/project/wallaby-plugin-couchdb/, wallaby-plugin-couchdb, 0.1.13, This package integrates the couchdb backend into wallaby., 2013-01-31T15:46:34+0000
/project/txpinky/, txpinky, 0.1.0, Pinky is a multi node distributed replicated in memory cache application., 2015-11-29T19:35:44+0000
/project/purity/, purity, 0.2.4, Purity dynamic patching library for Pure Data in Python., 2009-12-05T17:22:13+0000
/project/txsshadmin/, txsshadmin, 0.2.0, Administrative SSH interface for network services., 2019-11-12T18:20:44+0000
/project/driver2200087/, driver2200087, 0.6.1, Python Package to interface with Radio Shack's 2200087 Multimeter, 2015-08-19T23:11:28+0000
/project/helga-reviews/, helga-reviews, 0.0.6, A helga command to query reviewboard pending reviews targeted at a user, groupor channel (using a channel-to-group mapping)., 2014-10-22T13:49:26+0000
/project/helga-zen/, helga-zen, 0.1.0, The Zen of Python as a helga plugin, 2014-04-06T19:07:02+0000
/project/sphinxcontrib-trio/, sphinxcontrib-trio, 1.1.2, Make Sphinx better at documenting Python functions and methods, 2020-05-04T16:44:35+0000
/project/vcssshd/, vcssshd, 0.2.3, Library for easy and fast creation of an ssh demon for popular VCSs (Mercurial and Git), 2013-06-24T07:20:47+0000
/project/mantissa/, Mantissa, 0.9.0, A multiprotocol application deployment platform, 2017-09-05T09:06:47+0000
/project/treq-kerberos/, treq-kerberos, 1.2.0, Kerberos auth for Twisted's treq, 2018-07-17T21:39:50+0000
/project/lupulo/, lupulo, 0.3, Framework to build realtime web pages dedicated to monitor                    robots or IoT devices., 2016-01-20T11:39:29+0000
/project/thimble/, thimble, 0.2.0, A Twisted thread-pool based wrapper for blocking APIs., 2016-03-07T22:35:20+0000
/project/zed/, zed, 1.0.4, Thin wrapper for integrating ZeroMQ sockets into the Twisted reactore, 2021-03-31T18:45:23+0000
/project/eyefi/, eyefi, 0.2, EyeFi Server Framework, 2012-03-03T22:35:06+0000
/project/smpp-twisted/, smpp.twisted, 0.4, SMPP 3.4 client built on Twisted, 2013-07-26T18:41:19+0000
/project/piped-contrib-zmq/, piped.contrib.zmq, 0.7.0, ZeroMQ processors and providers for Piped., 2015-08-07T19:42:14+0000
/project/yatxmilter/, yatxmilter, 0.1.1, Twisted protocol to handle Milter Connections in libmilter style, 2014-08-04T13:28:39+0000
/project/txssmi/, txssmi, 0.3.0, Twisted library for Truteq's SSMI protocol, 2014-08-20T12:28:08+0000
/project/autobahntestsuite/, autobahntestsuite, 0.8.2, AutobahnTestSuite - WebSocket/WAMP protocol implementation test suite., 2021-03-16T23:52:15+0000
/project/txaioetcd/, txaioetcd, 18.10.2, Asynchronous client library for etcd3, 2018-10-11T18:04:02+0000
/project/qbuf/, qbuf, 0.9.4, Simple string buffering for python written in C., 2010-08-14T21:29:05+0000
/project/errormator-client/, errormator-client, 0.5.15, Client for Errormator reporting -  supporting WSGI and django  (http://errormator.com), 2013-11-16T12:52:59+0000
/project/pyamf/, PyAMF, 0.8.0, AMF support for Python, 2015-12-17T07:09:26+0000
/project/pyviewx-pygame/, pyviewx.pygame, 0.5.1, A pygame calibration scene for use with PyViewX, 2013-10-09T15:03:51+0000
/project/rollbar/, rollbar, 0.15.2, Easy and powerful exception tracking with Rollbar. Send messages and exceptions with arbitrary context, get back aggregates, and debug production issues quickly., 2021-01-25T20:56:03+0000
/project/txsyncml/, txsyncml, 0.0.1, Twisted based SyncML 1.1 server., 2014-03-10T04:26:57+0000
/project/mockssh/, MockSSH, 1.4.5, MockSSH: Mock an SSH server and all commands it supports., 2017-01-15T21:55:26+0000
/project/jasmin/, jasmin, 0.10.9, Jasmin is a very complete open source SMS Gateway with many enterprise-class features., 2021-02-25T12:15:35+0000
/project/twisted-mqtt/, twisted-mqtt, 0.3.9, MQTT client protocol package for Twisted, 2018-12-12T09:56:55+0000
/project/jsonrpc/, jsonrpc, 3.0.1, A JSON-RPC 2.0 client-server library, 2021-04-06T10:05:18+0000
/project/pycri/, pycri, 0.3, IRC-bot, 2011-03-14T13:30:49+0000
/project/wallaby-backend-elasticsearch/, wallaby-backend-elasticsearch, 0.1.31, Asynchronous elasticsearch backend - part of Wallaby. The couchDB application framework., 2013-01-25T00:34:14+0000
/project/helga-giphy/, helga-giphy, 0.1.1, A command plugin to search giphy for an anmiated gif., 2015-03-04T23:54:46+0000
/project/tc2100/, tc2100, 0.1.2, Receive data from a compatible USB digital thermometer, 2020-06-13T17:19:27+0000
/project/mitm6/, mitm6, 0.2.2, Pwning IPv4 via IPv6, 2019-03-31T21:16:30+0000
/project/npyscreenreactor/, npyscreenreactor, 1.3, Twisted reactor for npyscreen, 2016-01-30T02:38:00+0000
/project/cagou/, cagou, 0.7.0, Desktop/Android frontend for Salut à Toi XMPP client, 2019-07-24T19:13:22+0000
/project/txboxdotnet/, txboxdotnet, 15.5.0, Twisted-based async interface for Box (box.net) API v2.0, 2015-05-02T10:11:34+0000
/project/oonibackend/, oonibackend, 1.3.7, Open Observatory of Network Interference Backend, 2019-12-06T08:33:16+0000
/project/pygl2d/, PyGL2D, 0.3.7, A 2D Graphics Library for PyGame and PyOpenGL., 2012-10-19T15:06:11+0000
/project/helga-wiki-whois/, helga-wiki-whois, 0.1.0, A helga command to generate confluence-type URLs for users, 2015-03-04T13:17:05+0000
/project/spotware-connect/, spotware-connect, 0.1.2, A python client wraper for Spotware Open API 2.0, 2020-02-27T02:51:34+0000
/project/brutal/, brutal, 0.3.3, a multi-network asynchronous chat bot framework using twisted., 2013-05-14T00:30:05+0000
/project/mailsink/, mailsink, 0.0.2, a mock SMTP server, 2010-11-28T07:13:09+0000
/project/imagebot/, imagebot, 1.2.1, A web bot to crawl websites and scrape images., 2015-07-13T13:02:54+0000
/project/txcurrentcost/, txcurrentcost, 0.0.3, txcurrentcost is a Python Twisted package that lets you monitor your CurrentCost device., 2013-01-04T04:50:27+0000
/project/pingspice/, pingspice, 0.4.2, Object-oriented netlist construction and multiprocess SPICE simulation., 2020-03-20T18:48:26+0000
/project/helga-reviewboard/, helga-reviewboard, 0.2.0, A helga plugin for expanding shortcodes for code reviews on ReviewBoard, 2015-04-06T13:13:15+0000
/project/service-registry/, service-registry, 0.2.0, Python client for Rackspace Service Registry., 2013-03-20T18:57:29+0000
/project/txinvoke/, txinvoke, 0.1.0, Run inline callbacks from Twisted as Invoke tasks, 2015-04-07T06:07:51+0000
/project/helga/, helga, 1.7.13, A full-featured chat bot for Python 2.7 with plugin support, 2019-03-21T18:12:58+0000
/project/txwebutils/, txwebutils, 0.0.1, Utilities for twisted web, 2020-04-30T17:30:53+0000
/project/wallaby-plugin-pdfgenerator/, wallaby-plugin-pdfgenerator, 0.1.18, This package provides a PDF generator for wallaby., 2013-01-25T00:36:10+0000
/project/pylacewing/, pylacewing, 1.0.1, Python Lacewing Library, 2011-12-22T05:40:22+0000
/project/helga-flip/, helga-flip, 0.1.0, Helga plugin to flip words, 2014-08-15T20:41:50+0000
/project/txretry/, txretry, 1.0.1, A Twisted class for retrying failing calls with a customizable back-off schedule., 2016-06-17T18:54:29+0000
/project/projection/, projection, 0.0.0, Project Configuration, 2020-09-27T14:13:35+0000
/project/autobahn-rce/, autobahn_rce, 0.6.0.5, AutobahnPython - Optimised and modified for the RoboEarth Cloud Engine., 2013-07-06T15:21:04+0000
/project/helga-oneliner/, helga-oneliner, 0.1.0, A helga match plugin with a large amount of canned responses for a variety of regular expressions., 2015-03-04T16:46:25+0000
/project/stanczyk/, stanczyk, 0.1.0, Client software for the exercises in Crypto 101, the introductory book on cryptography., 2014-01-18T23:30:24+0000
/project/piped-contrib-database/, piped.contrib.database, 0.7.0, Database provider for Piped., 2015-08-07T19:41:48+0000
/project/tryfer/, tryfer, 0.2.2, Twisted Zipkin Tracing Library, 2012-09-24T17:37:20+0000
/project/sparked/, Sparked, 0.15, Application development framework for interactive installations, 2011-07-04T09:59:51+0000
/project/gdns/, gDNS, 0.1.4, Google DNS-over-HTTPS, 2017-09-18T22:28:54+0000
/project/packetmq/, packetmq, 0.1.5, Packet based networking, 2016-03-06T02:44:07+0000
/project/txlibravatar/, txLibravatar, 1.1, Twisted module for Libravatar, 2011-11-28T23:20:40+0000
/project/nevow/, Nevow, 0.14.5, Web Application Construction Kit, 2019-12-15T11:57:20+0000
/project/dovedns/, dovedns, 1.0.1, DoveDNS is a library for interfacing with Linode DNSManager, using Twisted., 2013-06-05T13:52:12+0000
/project/entropy-store/, entropy-store, 16.1.0, A simple content-addressed immutable object store, with flexible backend support., 2016-02-01T10:27:42+0000
/project/txrdq/, txRDQ, 0.2.14, A Twisted class for queueing and dispatching jobs in a controlled manner., 2014-01-25T23:12:12+0000
/project/sat/, sat, 0.7.0, Salut à Toi multipurpose and multi frontend XMPP client, 2019-07-24T18:13:28+0000
/project/piqueserver/, piqueserver, 1.0.0, Open-Source server implementation for Ace of Spades, 2019-12-02T01:45:10+0000
/project/er-calvin/, er-calvin, 1.1.1, Calvin is a distributed runtime and development framework for an actor based dataflowprogramming methodology, 2018-08-10T13:43:17+0000
/project/helga-versionone/, helga-versionone, 0.1.10, VersionOne interface for helga chat bot, 2017-01-30T15:13:58+0000
/project/sqlauth/, sqlauth, 0.2.12, Authentication and Authorization via SQL for Autobahn, 2014-12-23T17:32:56+0000
/project/slugathon/, slugathon, 0.1-20120727040741-5027075, Fantasy battle board game, 2012-07-27T04:07:47+0000
/project/nuageux/, nuageux, 0.1, lightweight distributed computing library, 2011-04-29T14:01:20+0000
/project/pyfibot/, pyfibot, 0.9.5, Python IRC bot based on twisted.words.irc, 2015-12-28T17:04:51+0000
/project/clarent/, clarent, 0.1.1, Shared API definitions for an online exercise system, 2014-02-27T16:58:41+0000
/project/helga-pull-requests/, helga-pull-requests, 0.0.5, A helga plugin to quickly link to github pull requests., 2015-04-20T21:11:59+0000
/project/hollowpoint/, hollowpoint, 0.1, Hollowpoint, 2013-06-16T20:54:50+0000
/project/launchdcheckin/, launchdcheckin, 0.13.0.1, launchd checkin for python and twisted, 2013-11-12T07:29:46+0000
/project/otfbot/, otfbot, 1.0.0, a modular IRC-Bot, 2011-04-22T10:56:32+0000
/project/qt4reactor/, qt4reactor, 1.6, Twisted Qt Integration, 2014-09-22T07:13:53+0000
/project/helga-meant-to-say/, helga-meant-to-say, 0.1.0, A helga plugin that lets users correct what they said, like using s/foo/bar, 2015-03-04T20:43:55+0000
/project/trigger/, trigger, 1.6.0, Trigger is a framework and suite of tools for configuring network devices, 2017-03-08T18:32:52+0000
/project/tridentstream/, tridentstream, 1.0.8, Media Streaming Server, 2020-05-14T14:49:42+0000
/project/moear-spider-zhihudaily/, moear-spider-zhihudaily, 1.1.1, MoEar爬虫功能扩展插件 - 知乎日报, 2018-06-17T04:17:56+0000
/project/txtwitter/, txTwitter, 0.1.6, A Twisted-based client library for Twitter's API., 2017-01-26T14:49:18+0000
/project/bitdust-p2p/, bitdust-p2p, 0.0.3, BitDust is new software framework to build distributed and secure peer-to-peer applications., 2020-09-15T19:26:40+0000
/project/txbugzilla/, txbugzilla, 2.0.0, Twisted API for Bugzilla, 2019-01-22T17:20:47+0000
/project/collective-transcode-daemon/, collective.transcode.daemon, 0.12, Video transcoding daemon, 2012-12-03T16:54:21+0000
/project/piped-contrib-statsd/, piped.contrib.statsd, 0.7.0, StatsD-utilities for Piped., 2015-08-07T19:41:58+0000
/project/qt5reactor/, qt5reactor, 0.6.3, Twisted Qt Integration, 2020-09-10T17:48:37+0000
/project/logalyzer/, logalyzer, 0.4, Web server HTTP access log parsing, filtering, and SQL database storage., 2018-06-12T23:27:14+0000
/project/airi/, airi, 0.1.1, AIRi software package, 2011-04-14T22:47:53+0000
/project/leap-mx/, leap.mx, 0.9.1, An asynchronous, transparently-encrypting remailer for the LEAP platform, 2017-02-16T15:40:15+0000
/project/crossbar/, crossbar, 21.3.1, Crossbar.io multi-protocol (WAMP/WebSocket, REST/HTTP, MQTT) application router for microservices., 2021-03-02T16:01:41+0000
/project/helga-reminders/, helga-reminders, 0.1.1, A helga command for scheduling one time or recurring reminders, 2015-03-04T20:32:07+0000
/project/txstathat/, txStatHat, 0.2.0, Twisted wrapper for StatHat.com, 2012-04-05T11:30:18+0000
/project/txproductpages/, txproductpages, 1.2.0, Twisted API for Red Hat Product Pages, 2019-11-27T19:52:43+0000
/project/txgsm/, txgsm, 0.2.0, Utilities for talking to a GSM modem over USB via AT commands., 2015-11-09T07:06:56+0000
/project/qt5reactor-fork/, qt5reactor-fork, 0.2, Twisted Qt Integration, 2015-06-12T14:35:27+0000
/project/pycnb/, pycnb, 0.0.5, Library, CLI and Twisted protocol for `Czech National Bank daily rates, 2017-06-03T05:40:20+0000
/project/pytgram/, pytgram, 0.0.7, Library to create Telegram Bot based on Twisted, 2018-02-01T20:07:14+0000
/project/txthoonk/, txthoonk, 0.1, Python/Twisted client for Thoonk, 2012-07-04T13:27:59+0000
/project/datahaven/, datahaven, rev8784, Distributed encrypted backup utility, 2014-06-05T06:28:50+0000
/project/wallaby-plugin-elasticsearch/, wallaby-plugin-elasticsearch, 0.1.10, This package integrates the elasticsearch backend into wallaby., 2013-01-25T00:35:05+0000
/project/iwant/, iwant, 1.0.14, CLI based decentralized peer to peer file sharing, 2017-06-27T18:23:27+0000
/project/mysearch/, mysearch, 1.5, MySearch engine, 2014-09-14T14:12:34+0000
/project/txgraylog/, txGraylog, 0.3, A twisted log service that interacts with Graylog2., 2015-03-31T17:33:03+0000
/project/axiombench/, axiombench, 0, Silly benchmarks for Axiom, 2012-09-12T16:59:52+0000
/project/twittytwister/, twittytwister, 0.1.0, Twitter client for Twisted Python, 2010-07-13T01:25:33+0000
/project/maxims/, maxims, 0.0.2, A set of tools and reusbale items for Axiom, 2013-03-02T13:44:10+0000
/project/txscrypt/, txscrypt, 3.0.0, Twisted wrapper for scrypt, 2013-12-04T11:32:23+0000
/project/ldaptor/, ldaptor, 21.2.0, A Pure-Python Twisted library for LDAP, 2021-02-28T23:59:55+0000
/project/patron-it-opencanary/, patron-it-opencanary, 0.7.1, OpenCanary daemon, 2018-12-15T01:19:17+0000
/project/txu1/, txu1, 13.06.0, Twisted-based async interface for Ubuntu One Files Cloud REST API v1, 2013-06-13T21:46:40+0000
/project/afpproxy/, afpproxy, 0.1.2, proxy for the AFP (AppleShare) protocol, 2016-02-05T18:31:02+0000
/project/canari/, canari, 3.3.10, Canari Framework - Maltego rapid transform development and execution framework., 2019-02-25T21:38:57+0000
/project/phen/, phen, 0.2.1, Decentralized platform for social applications, 2015-12-31T21:25:15+0000
/project/txaio/, txaio, 21.2.1, Compatibility API between asyncio/Twisted/Trollius, 2021-02-20T14:35:11+0000
/project/source-over-ssh/, source-over-ssh, 0.3, source repository management server over ssh, 2011-06-26T19:48:34+0000
/project/marathon-acme/, marathon-acme, 0.6.1, Automated management of Let's Encrypt certificates for apps running on Mesosphere Marathon, 2018-06-27T11:31:48+0000
/project/hostmaster/, hostmaster, 0.0.1, A simple way to master hosts, 2018-04-10T06:51:39+0000
/project/alot/, alot, 0.7.0, Terminal MUA using notmuch mail, 2018-02-27T19:09:35+0000
/project/mark2/, mark2, 0.1.4.3, Minecraft server wrapper, 2013-08-17T02:18:50+0000
/project/tx-logging/, tx-logging, 1.0.0, Extends Twisted log facilities., 2014-03-19T09:31:51+0000
/project/twisted-internet-processes/, twisted.internet.processes, 1.0b1, An implementation of deferToProcess using the multiprocessing package., 2009-08-24T19:26:26+0000
/project/piped/, piped, 0.7.0, A framework and application server with pipelines., 2015-08-07T19:39:46+0000
/project/tx-tlsrelay/, tx_tlsrelay, 2.1.1, A simple relay. See readme.md, 2014-12-06T02:19:47+0000
/project/ooniprobe/, ooniprobe, 2.3.0, Network measurement tool foridentifying traffic manipulation and blocking., 2018-02-14T09:14:22+0000
/project/opencanary/, opencanary, 0.6.1, OpenCanary daemon, 2021-03-30T13:07:18+0000
/project/twunnel/, twunnel, 0.14.0, A HTTPS/SOCKS4/SOCKS5 tunnel for Twisted., 2014-07-01T07:18:19+0000
/project/helga-isup/, helga-isup, 0.2.4, Helga plugin to check down for everyone or just me, 2017-01-05T21:35:58+0000
/project/txrestserver/, txrestserver, 0.4.2, A simple REST server for twisted-python with access authentication support, 2020-10-06T21:47:37+0000
/project/txrequest/, txrequest, 0.1.0, HTTP Request object API for Twisted, 2017-09-20T19:35:49+0000
/project/trosnoth/, trosnoth, 1.15.1, Trosnoth network platform game, 2021-02-01T10:16:37+0000
/project/twistedexiftool/, TwistedExiftool, 0.1.4, Discontinued, use txExiftool (https://pypi.python.org/pypi/txExiftool), 2016-01-16T23:09:29+0000
/project/asyncsteem/, asyncsteem, 0.6.3, Asynchonous library for usage of the STEEM JSON-RPC API, 2018-10-17T22:23:57+0000
/project/txi2p-tahoe/, txi2p-tahoe, 0.3.5, I2P bindings for Twisted, 2021-03-10T19:28:18+0000
/project/txpostgres/, txpostgres, 1.7.0, Twisted wrapper for asynchronous PostgreSQL connections, 2019-11-19T09:29:09+0000
/project/libervia/, libervia, 0.7.0, Web frontend for Salut à Toi, 2019-07-24T19:00:40+0000
/project/txgoogle/, txgoogle, 0.0.1, Google Data APIs for twisted, 2017-03-06T18:03:54+0000
/project/wallaby-backend-http/, wallaby-backend-http, 0.1.2, Wallaby backend for http(s)., 2013-01-25T00:40:03+0000
/project/taschenmesser/, taschenmesser, 18.3.2, Taschenmesser, a toolbelt with plugins for SCons, 2018-03-20T15:50:30+0000
/project/libtele/, libtele, 0.3, Library for interfacing http://tele.at/., 2011-01-15T11:49:17+0000
/project/piped-contrib-cyclone/, piped.contrib.cyclone, 0.7.0, Cyclone provider for Piped., 2015-08-07T19:41:43+0000
/project/documint/, Documint, 16.4.0, , 2016-04-07T19:32:03+0000
/project/piped-contrib-manhole/, piped.contrib.manhole, 0.7.0, Twisted Manhole support for Piped., 2015-08-07T19:41:53+0000
/project/carnifex/, carnifex, 0.2.5, Execute commands and run processes locally and remote, 2017-03-30T18:40:48+0000
/project/axiom/, axiom, 0.9.0, An in-process object-relational database, 2020-08-26T12:31:53+0000
/project/phen-mail/, phen.mail, 0.1.2, Mail Services Plugin for Phen, 2016-01-03T12:58:26+0000
/project/stompest-async/, stompest.async, 2.3.0, Twisted STOMP client based upon the stompest API., 2017-03-19T19:20:20+0000
/project/ooniprobe/, ooniprobe, 2.3.0, Network measurement tool foridentifying traffic manipulation and blocking., 2018-02-14T09:14:22+0000
/project/opencanary/, opencanary, 0.6.1, OpenCanary daemon, 2021-03-30T13:07:18+0000
/project/twunnel/, twunnel, 0.14.0, A HTTPS/SOCKS4/SOCKS5 tunnel for Twisted., 2014-07-01T07:18:19+0000
/project/helga-isup/, helga-isup, 0.2.4, Helga plugin to check down for everyone or just me, 2017-01-05T21:35:58+0000
/project/txrestserver/, txrestserver, 0.4.2, A simple REST server for twisted-python with access authentication support, 2020-10-06T21:47:37+0000
/project/txrequest/, txrequest, 0.1.0, HTTP Request object API for Twisted, 2017-09-20T19:35:49+0000
/project/trosnoth/, trosnoth, 1.15.1, Trosnoth network platform game, 2021-02-01T10:16:37+0000
/project/twistedexiftool/, TwistedExiftool, 0.1.4, Discontinued, use txExiftool (https://pypi.python.org/pypi/txExiftool), 2016-01-16T23:09:29+0000
/project/asyncsteem/, asyncsteem, 0.6.3, Asynchonous library for usage of the STEEM JSON-RPC API, 2018-10-17T22:23:57+0000
/project/txi2p-tahoe/, txi2p-tahoe, 0.3.5, I2P bindings for Twisted, 2021-03-10T19:28:18+0000
/project/txpostgres/, txpostgres, 1.7.0, Twisted wrapper for asynchronous PostgreSQL connections, 2019-11-19T09:29:09+0000
/project/libervia/, libervia, 0.7.0, Web frontend for Salut à Toi, 2019-07-24T19:00:40+0000
/project/txgoogle/, txgoogle, 0.0.1, Google Data APIs for twisted, 2017-03-06T18:03:54+0000
/project/wallaby-backend-http/, wallaby-backend-http, 0.1.2, Wallaby backend for http(s)., 2013-01-25T00:40:03+0000
/project/taschenmesser/, taschenmesser, 18.3.2, Taschenmesser, a toolbelt with plugins for SCons, 2018-03-20T15:50:30+0000
/project/deluge/, deluge, 2.0.3, BitTorrent Client, 2019-06-12T17:51:47+0000
/project/vtwt/, vtwt, 0.1.2, Ver's Twitter CLI, 2010-07-17T00:48:23+0000
/project/exifproxy/, exifproxy, 1.0.1, Metadata extraction reverse proxy based on twisted and exiftool, 2020-11-22T12:05:26+0000
/project/iwant/, iwant, 1.0.14, CLI based decentralized peer to peer file sharing, 2017-06-27T18:23:27+0000
/project/mysearch/, mysearch, 1.5, MySearch engine, 2014-09-14T14:12:34+0000
/project/afpproxy/, afpproxy, 0.1.2, proxy for the AFP (AppleShare) protocol, 2016-02-05T18:31:02+0000
/project/canari/, canari, 3.3.10, Canari Framework - Maltego rapid transform development and execution framework., 2019-02-25T21:38:57+0000
/project/phen/, phen, 0.2.1, Decentralized platform for social applications, 2015-12-31T21:25:15+0000
/project/txaio/, txaio, 21.2.1, Compatibility API between asyncio/Twisted/Trollius, 2021-02-20T14:35:11+0000
/project/source-over-ssh/, source-over-ssh, 0.3, source repository management server over ssh, 2011-06-26T19:48:34+0000
/project/tx-tlsrelay/, tx_tlsrelay, 2.1.1, A simple relay. See readme.md, 2014-12-06T02:19:47+0000
/project/txsh/, txsh, 0.2.1, Twisted Process interface, 2015-05-20T10:41:02+0000
/project/txi2p/, txi2p, 0.3.2, I2P bindings for Twisted, 2017-04-03T06:32:57+0000
/project/txanalytics/, txanalytics, 0.1.4, A Twisted based client for Google Analytics Measurement Protocol, 2017-06-14T16:01:50+0000
/project/txbom/, txbom, 0.0.2, txbom is a Python Twisted package that lets you retrieve forecasts and observations from the Australian Bureau of Meteorology (BOM)., 2013-01-04T05:37:14+0000
/project/twisted-scheduling/, twisted.scheduling, 1.0, A scheduling plugin for twisted, 2010-06-02T19:37:16+0000
/project/wallaby/, wallaby, 0.1.2, Wallaby is a powerful yet simple framework for building Qt-based, cross-platform applications in PyQt/PySide with a CouchDB/CouchBase and Elasticsearch backend., 2013-01-25T00:32:03+0000
/project/conchoctopus/, conchoctopus, 0.1a1, An environment and API that simplifies workingwith multiple SSH servers in an asynchronous way., 2010-06-15T14:35:23+0000
/project/smartanthill/, smartanthill, 0.0.0, An open IoT system, 2015-02-26T22:27:53+0000
/project/pymodbus3/, pymodbus3, 1.0.0, A fully featured modbus protocol stack in python, 2014-07-18T07:20:27+0000
/project/txscheduling/, TxScheduling, 1.1, A scheduling plugin for Twisted, 2011-08-25T20:50:58+0000
/project/wallaby-app-inspector/, wallaby-app-inspector, 0.1.23, IDE for wallaby., 2013-01-25T00:37:39+0000
/project/moear-spider-zhihudaily/, moear-spider-zhihudaily, 1.1.1, MoEar爬虫功能扩展插件 - 知乎日报, 2018-06-17T04:17:56+0000
/project/helga-jira/, helga-jira, 0.1.4, A helga plugin that can be used to store responses that can be returned from a question, 2017-08-31T19:12:54+0000
/project/sprained/, sprained, 0.008, An integration of the spread toolkit, (http://spread.org), with twisted., 2010-03-02T21:24:15+0000
/project/txrudp/, txrudp, 0.5.2, A Twisted extension implementing RUDP, 2017-07-26T14:14:01+0000
/project/txsockjs/, txsockjs, 1.2.2, Twisted SockJS wrapper, 2014-11-29T21:03:31+0000
/project/moear-package-mobi/, moear-package-mobi, 1.1.2.post0, MoEar打包功能扩展插件 - Mobi, 2018-06-17T02:06:14+0000
/project/ptsmpp/, ptsmpp, 0.1.0, PTSMPP - Python Twisted SMPP 3.4 client library, 2015-10-21T13:14:27+0000
/project/spamfighter/, spamfighter, 0.2.0, Web-service fighting spam and other unsolicited messages, 2009-02-27T09:02:18+0000
/project/twistedschedule/, twistedschedule, 1.0b1, A scheduling plugin for twisted, 2008-12-10T03:03:15+0000
/project/launchkey-twisted/, launchkey-twisted, 1.0.0, LaunchKey Asynchronous SDK for Twisted, 2015-08-25T18:24:05+0000
/project/amqpipe/, amqpipe, 1.2, Twisted based pipeline framework for AMQP, 2017-11-07T08:05:56+0000
/project/txkoji/, txkoji, 0.10.0, Twisted API for Koji, 2018-12-10T23:14:48+0000
/project/omnipresence/, omnipresence, 3.0alpha2, An IRC utility bot, 2015-08-18T21:11:19+0000
/project/fmspy/, fmspy, 0.1.0, Flash Media Server in Python using Twisted Framework, 2009-05-30T15:16:35+0000
/project/expel-lib/, expel.lib, 0.2, Generate and respond to xPL messages., 2011-12-07T21:37:47+0000
/project/helga-loljava/, helga-loljava, 0.1.0, A helga plugin that will respond with a silly generated Java class name when someone mentions the word 'java'., 2015-03-04T16:30:39+0000
/project/wallaby-backend-couchdb/, wallaby-backend-couchdb, 0.1.39, Asynchronous CouchDB backend - part of Wallaby. The couchDB application framework., 2013-01-26T15:19:34+0000
