/project/cadspy/, cadspy, 0.0.0, Stub package, 2021-02-12T16:50:34+0000
/project/zai/, zai, 0.0.2, zai placeholder package, 2018-11-07T09:12:55+0000
/project/sicp-js-zh/, sicp-js-zh, 2020.9.21.0, NUS CS1101s SICP JavaScript 描述, 2020-09-21T04:41:59+0000
/project/apachecn-sec-zh/, apachecn-sec-zh, 2021.2.14.0, ApacheCN 网络安全译文集, 2021-02-14T14:32:38+0000
/project/pullbot/, pullbot, 0.1.2, GitHub PR automation, 2018-01-22T09:03:20+0000
/project/hi-hello/, hi-hello, 1.0.4, Just saying hello., 2021-04-02T12:57:23+0000
/project/chachacha/, chachacha, 0.2.1, Chachacha changes changelogs, 2020-12-14T07:32:10+0000
/project/neuronpy/, neuronpy, 0.1.6, Python interfaces and utilities for interacting with the NEURON simulator and analyzing neural data., 2012-07-08T16:13:14+0000
/project/iolite/, iolite, 0.3.1, , 2021-02-22T10:22:06+0000
/project/sqlakeyset/, sqlakeyset, 1.0.1616300210, offset-free paging for sqlalchemy, 2021-03-21T04:16:51+0000
/project/egenix-mx-base/, egenix-mx-base, 3.2.9, eGenix mx Base Distribution for Python - mxDateTime, mxTextTools, mxProxy, mxTools, mxBeeBase, mxStack, mxQueue, mxURL, mxUID, 2015-08-27T12:31:12+0000
/project/ftrack-s3-accessor/, ftrack-s3-accessor, 0.1.7.post1, A ftrack s3 accessor updated to work with ftrack-python-api and boto3., 2020-10-08T19:15:52+0000
/project/certain/, certain, 0.1.0, , 2020-12-12T13:23:59+0000
/project/azureml-train/, azureml-train, 1.27.0, , 2021-04-19T15:48:59+0000
/project/release-info/, release-info, 0.1.3, automatically updated python release information, 2020-09-06T07:32:50+0000
/project/abilian-core/, abilian-core, 0.11.18, A framework for enterprise applications (CRM, ERP, collaboration...), based on Flask and SQLAlchemy, 2021-03-16T11:39:21+0000
/project/purplship-fedex/, purplship.fedex, 2021.3, Purplship - Boxknight Shipping Extension, 2021-04-18T05:01:34+0000
/project/magen-id-client/, magen-id-client, 2.1a0, Magen ID Client Package, 2017-11-03T08:39:53+0000
/project/migra-idempotent/, migra-idempotent, 1.7, Like `diff` but for PostgreSQL schemas, 2020-11-29T17:41:55+0000
/project/python-patch/, python-patch, 0.0.1, Make your python smart, 2021-01-19T05:08:12+0000
/project/light-rest-client/, light-rest-client, 1.0.3, A very lightweight REST client for Python., 2018-11-30T20:11:09+0000
/project/mkl/, mkl, 2021.2.0, Intel® oneAPI Math Kernel Library, 2021-03-26T20:21:26+0000
/project/pytket-braket/, pytket-braket, 0.5.0, Extension for pytket, providing access to Amazon Braket backends, 2021-04-01T11:04:40+0000
/project/librelingo-types/, librelingo-types, 0.1.2, Data types to be used in Python packages for LibreLingo, 2021-03-02T16:38:00+0000
/project/pinboard-to-sqlite/, pinboard-to-sqlite, 1.2.0, Save data from Pinboard to a SQLite database, 2019-11-07T20:34:40+0000
/project/impi/, impi, 2019.4.243, Intel(R) MPI Runtime, 2019-11-13T12:03:35+0000
/project/ipp-crypto-include/, ipp-crypto-include, 2021.2.0, Intel® Integrated Performance Primitives Cryptography, 2021-03-26T20:17:18+0000
/project/gym-cartpole-swingup/, gym-cartpole-swingup, 0.1.3, A simple, continuous-control environment for OpenAI Gym, 2021-04-14T23:12:35+0000
/project/authorizenet/, authorizenet, 1.1.4, Authorize.Net Python SDK, 2021-03-31T18:28:48+0000
/project/allmydata-tahoe/, allmydata-tahoe, 1.10.2, secure, decentralized, fault-tolerant filesystem, 2015-07-31T02:49:28+0000
/project/pypkgs-jg/, pypkgs-jg, 0.1.0, Packaging dummy assignment, 2021-02-26T21:50:46+0000
/project/aioshadowsocks/, aioshadowsocks, 0.1.6, shadowsocks build with asyncio , also support many user in one port, 2021-03-19T00:10:40+0000
/project/mozaik/, mozaik, 0.1.0, Python package mozaik is an integrated workflow framework for large scale neural simulations., 2013-10-17T15:57:39+0000
/project/apachecn-python-zh/, apachecn-python-zh, 2021.1.7.0, ApacheCN Python 译文集, 2021-01-07T15:22:22+0000
/project/reduck/, reduck, 0.5.14, Data Redaction Application, 2021-04-13T14:00:06+0000
/project/water-masses/, water-masses, 2021.1.0a3, On the origin of water masses in the northern European shelf seas from a Lagrangian perspective, 2021-03-17T19:19:36+0000
/project/uavsim/, uavsim, 0.0.4, UAV Simulator, 2018-10-05T21:40:35+0000
/project/unfolded-data-sdk/, unfolded.data-sdk, 0.2.0, Module for working with Unfolded Studio's Data SDK, 2021-02-23T19:25:55+0000
/project/purplship/, purplship, 2021.3, Multi-carrier shipping API integration with python, 2021-04-18T05:01:36+0000
/project/fluidasserts/, fluidasserts, 21.2.32684, Assertion Library for Security Assumptions, 2021-02-23T16:44:13+0000
/project/snmp-fetch/, snmp-fetch, 0.1.7.1, An opinionated python SNMPv2 library built for rapid database ingestion., 2019-11-04T21:31:10+0000
/project/streamsets-testenvironments/, streamsets-testenvironments, 0.0.4, Spin environments for StreamSets products, 2018-08-08T17:09:38+0000
/project/stockbot/, stockbot, 0.2.0, Stock market analysis library written in Python., 2016-11-22T19:53:09+0000
/project/tusker/, tusker, 0.3.3, A PostgreSQL specific migration tool, 2021-04-09T12:08:18+0000
/project/acclaim-badges/, acclaim-badges, 0.1.0, Acclaim Badges for EDX, 2017-06-06T04:01:15+0000
/project/mkl-static/, mkl-static, 2021.2.0, Intel® oneAPI Math Kernel Library, 2021-03-26T20:29:50+0000
/project/django-swagger-tester/, django-swagger-tester, 2.2.1, Django test utility for validating Swagger documentation, 2021-01-24T00:11:25+0000
/project/pydvdcss/, pydvdcss, 1.3.2, Python wrapper for VideoLAN's libdvdcss., 2021-04-18T22:36:09+0000
/project/quickbase-client/, quickbase-client, 0.2.0, A QuickBase Python API Client Generator, 2021-04-15T01:38:01+0000
/project/zoom-narrator/, zoom-narrator, 1.0.1, Play audio while streaming its closed captions to Zoom, 2021-01-06T04:40:22+0000
/project/nanohttp/, nanohttp, 1.11.10, A very micro http framework., 2019-11-30T13:25:19+0000
/project/openhsi/, openhsi, 0.0.8, Library to calibrate, trigger and capture data cubes for the open source hyperspectral camera., 2021-04-20T13:21:50+0000
/project/apachecn-ailearning/, apachecn-ailearning, 2020.12.29.0, 访问 http://localhost:{port} 查看文档, 2020-12-29T12:51:59+0000
/project/basilisp/, basilisp, 0.1.dev15, A Clojure-like lisp written for Python, 2021-04-22T12:48:45+0000
/project/pi-heaan/, pi-heaan, 0.4.2, pi-heaan is a simulator to HEaaN API, the library of CKKS scheme, 2021-04-23T07:02:35+0000
/project/expi-skel/, expi-skel, 0.5.5, A package template for use with the Extender Package Index., 2020-01-01T22:06:36+0000
/project/howtodoinjava-zh/, howtodoinjava-zh, 2020.9.21.0, HowToDoInJava 中文系列教程, 2020-09-21T04:06:15+0000
/project/doc-note-untangler/, doc-note-untangler, 1.0.1, Untangle special markdown blocks from docstrings and assemble them into a static webpage., 2021-03-26T13:54:06+0000
/project/fe4ml-zh/, fe4ml-zh, 2020.9.21.0, 面向机器学习的特征工程, 2020-09-21T03:53:02+0000
/project/django-auth-adfs/, django-auth-adfs, 1.6.1, A Django authentication backend for Microsoft ADFS and AzureAD, 2021-03-25T11:37:01+0000
/project/magen-gmail-client/, magen-gmail-client, 0.0.1, Magen Gmail Client Package, 2018-01-13T10:25:29+0000
/project/mqtt-publish/, mqtt-publish, 1.0, A command line utility for quickly publishing a single MQTT message., 2020-01-12T04:50:26+0000
/project/narrowband/, NarrowBand, 0.2.1, NarrowBand library, 2019-02-13T09:57:07+0000
/project/paper/, paper, 0.2.0, Keep generated fields in cache for your Django models., 2015-09-13T09:35:37+0000
/project/pynn/, PyNN, 0.9.6, A Python package for simulator-independent specification of neuronal network models, 2020-12-22T15:07:43+0000
/project/etherpump/, etherpump, 0.0.20, Pumping text from etherpads into publications, 2021-03-18T10:16:44+0000
/project/seaborn-file/, seaborn-file, 1.1.1, Seaborn-File enables the manipulation of thedirectories of a computer within a program., 2018-03-31T22:02:20+0000
/project/django-codenerix-cms/, django-codenerix-cms, 1.0.16, Codenerix CMS is a module that enables CODENERIX to set products on serveral platforms in a general manner., 2018-06-23T16:14:11+0000
/project/python-conio/, Python-Conio, 1.1.0, Python Conio 1.1.0 is wrapper for Turbo C conio., 2010-11-12T18:09:51+0000
/project/wolfssl/, wolfssl, 4.1.0.post0, Python module that encapsulates wolfSSL's C SSL/TLS library., 2019-09-26T17:59:49+0000
/project/gaiaengine/, gaiaengine, 0.3.4, Lightweight and easy-to-use graphics engine. The project is still in development and not ready for release, 2021-02-06T14:22:10+0000
/project/nlp-py-2e-zh/, nlp-py-2e-zh, 2020.12.29.0, Python 自然语言处理 第二版, 2020-12-29T10:46:01+0000
/project/uat-python-cicd/, uat-python-cicd, 3.0.1, Test ci/cd, 2021-02-09T11:32:44+0000
/project/pycaroon/, pycaroon, 0.0.1, Secret, 2021-03-14T10:14:58+0000
/project/icc-rt/, icc-rt, 2020.0.133, Intel(R) Compiler Runtime, 2019-11-13T12:01:50+0000
/project/purplship-ups-package/, purplship.ups-package, 2021.2, Purplship - UPS Package Shipping Extension, 2021-02-17T16:10:29+0000
/project/mappr/, mappr, 0.3.1, , 2021-02-03T01:06:29+0000
/project/supercsv/, supercsv, 0.1, csv unicode, 2011-01-25T11:08:17+0000
/project/python-canvas/, python-canvas, 0.1.9, Данная библиотека содержить SqlAlchemy ORM для системы Canvas, 2021-02-05T11:28:51+0000
/project/superior-cache-analyzer/, Superior-Cache-ANalyzer, 3.3.7.post3, An analysis tool for Apache Traffic Server caches., 2019-09-19T15:56:35+0000
/project/dqc-us-rules/, dqc_us_rules, 3.5.0, Added 2017 taxonomy to rule 0041, 2017-06-06T19:56:36+0000
/project/nowyou-grafits-script-python/, nowyou-grafits-script-python, 1.1.3, Now you project grafis scripts, 2019-08-24T07:59:25+0000
/project/cfnresponse/, cfnresponse, 1.1.1, Send a response object to a custom resource by way of an Amazon S3 presigned URL, 2020-11-15T00:11:06+0000
/project/mosyn/, mosyn, 1.1.0, A morphological dictionary tool., 2018-08-04T07:21:35+0000
/project/purplship-purolator-courier/, purplship.purolator-courier, 2021.3.1, Purplship - Purolator Courier Shipping Extension, 2021-04-24T00:45:19+0000
/project/linuxbackup/, linuxbackup, 0.0.1, Backup and restore for linux, 2019-11-17T06:35:20+0000
/project/dmsa/, dmsa, 0.5.8, SQLAlchemy models and DDL and ERD generation from chop-dbhi/data-models style JSON endpoints., 2016-02-12T17:51:35+0000
/project/python-sanity-html/, python-sanity-html, 0.0.4, HTML renderer for Sanity's Portable Text format, 2021-04-19T10:33:23+0000
/project/strictdoc/, strictdoc, 0.0.10,  Software for writing technical requirements and specifications., 2021-04-18T12:44:56+0000
/project/reshaper/, reshaper, 1.1.0, # Reshaper, 2017-08-28T16:21:15+0000
/project/ldict/, ldict, 0.210330.2, Uniquely identified lazy dict, 2021-03-30T16:45:02+0000
/project/nonebot-plugin-trpglogger/, nonebot-plugin-trpglogger, 0.2.0, a logger for TRPG, 2021-03-20T10:27:06+0000
/project/pytor/, pytor, 0.1.6, Manage Tor hidden services keys, 2020-11-22T11:54:12+0000
/project/hota/, hota, 0.1.0, HTML Over The Air. Transporting HTML through WebSocket. Inspired by Hotwire., 2021-01-16T20:00:46+0000
/project/couchdb-schematics/, couchdb-schematics, 1.1.1, UNKNOWN, 2014-03-21T22:54:21+0000
/project/adaptdl-sched/, adaptdl-sched, 0.2.6, Dynamic-resource trainer and scheduler for deep learning, 2020-11-04T20:15:13+0000
/project/seeq/, seeq, 52.0.0.178.15, The Seeq SDK for Python, 2021-04-05T23:12:28+0000
/project/apkid/, apkid, 2.1.2, Android Package Identifier, 2021-01-28T22:33:45+0000
/project/maser4py/, maser4py, 0.9.0, maser4py offers tools to handle low frequency radioastronomy data, 2021-03-19T18:17:46+0000
/project/musamusa-errors/, musamusa-errors, 0.3, Convenient way to store and display error messages., 2021-03-20T10:51:54+0000
/project/pc-ble-driver-py/, pc-ble-driver-py, 0.15.0, Python bindings for the Nordic pc-ble-driver SoftDevice serialization library, 2020-10-09T09:23:55+0000
/project/biobeaker/, biobeaker, 0.0.2, Coming soon, 2021-02-15T23:17:03+0000
/project/haiku-lang/, haiku-lang, 0.0.7, An embedable LISP implemented on top of the Python interpreter., 2012-06-05T05:53:09+0000
/project/maryjane/, maryjane, 4.4.7, Python file watcher and task manager, 2017-06-05T22:50:40+0000
/project/unearthed-cli/, unearthed-cli, 0.1.5, Unearthed CLI Tool, 2021-04-08T00:06:02+0000
/project/yars/, YARS, 1.0, Yet Another RSS downloader, 2010-08-14T17:30:37+0000
/project/programiz-zh/, programiz-zh, 2020.9.21.0, Programiz 中文系列教程, 2020-09-21T04:36:47+0000
/project/encryptit/, encryptit, 0.1.0, OpenPGP API and CLI focusing on testing & clarity., 2015-04-11T18:16:49+0000
/project/logtail/, logtail, 1.0.1, Package for tailing logs and viewing in editor, 2018-10-04T17:54:35+0000
/project/jpl-plone2ldap/, jpl.plone2ldap, 0.0.0, Export Plone usernames and passwords and import them into an LDAP server, 2017-05-26T18:53:12+0000
/project/aws-kpl-deagg/, aws_kpl_deagg, 1.0.10, Python module to simplify processing of Amazon Kinesis Records which have been created with the Kinesis Producer Library., 2016-02-18T18:15:13+0000
/project/populater/, populater, 0.1.5, Cross platform string syntax for reliably extracting object data, 2018-04-06T13:58:18+0000
/project/azureml-designer-serving/, azureml-designer-serving, 0.0.10, , 2020-09-08T07:03:46+0000
/project/ksp-login/, ksp-login, 0.6.2, KSP Login is an app for easy authentication management with support for, 2021-01-24T18:45:24+0000
/project/rox/, rox, 5.0.2, Rollout.io ROX Python SDK, 2021-03-29T15:28:50+0000
/project/pytket/, pytket, 0.9.0, Python module for interfacing with the CQC tket library of quantum software, 2021-03-31T16:43:38+0000
/project/nonebot-plugin-rauthman/, nonebot-plugin-rauthman, 2.0.0a13, Rule-based authorization manager worked with nonebot2, 2021-04-18T18:22:49+0000
/project/django-codenerix-corporate/, django-codenerix-corporate, 2.0.3, Codenerix Corporate is a module that enables CODENERIX to manage corporate/enterprise details on serveral platforms in a general manner., 2018-06-23T16:17:19+0000
/project/nonebot-plugin-simdraw/, nonebot-plugin-simdraw, 0.1.4, A phonegame draw simulator plugin for nonebot2, 2021-01-29T05:48:09+0000
/project/v20/, v20, 3.0.25.0, OANDA v20 bindings for Python, 2018-09-28T13:39:36+0000
/project/stats-thinking-21-zh/, stats-thinking-21-zh, 2020.9.21.0, 斯坦福 Stats60 21 世纪的统计思维, 2020-09-21T04:44:52+0000
/project/podmena/, podmena, 0.4.2, Enhance your commit messages with emoji, 2019-05-20T13:00:00+0000
/project/blythooon/, blythooon, 0.80, (Net-) Installer for semi-automatically creating a Python runtime environment comprising all libraries necessary to run scientific applications with (Qt 4.8 based) GUIs., 2021-02-21T00:02:03+0000
/project/cryptol/, cryptol, 2.11.0, Cryptol client for the Cryptol 2.11 RPC server, 2021-03-25T23:46:57+0000
/project/apachecn-java-zh/, apachecn-java-zh, 2021.1.8.0, ApacheCN Java 译文集, 2021-01-08T12:08:23+0000
/project/dse-driver/, dse-driver, 2.11.1, DataStax Enterprise Python Driver, 2020-01-21T15:49:20+0000
/project/bomber/, bomber, 0.0.5, Get data from the BoM in Python, 2015-11-18T01:47:25+0000
/project/cafeteria/, cafeteria, 0.20.0, Cafeteria: A convenience package providing various building blocks enabling pythonic patterns., 2020-09-12T21:26:14+0000
/project/azureml-designer-datatransform-modules/, azureml-designer-datatransform-modules, 0.0.74, , 2021-04-13T08:21:17+0000
/project/manim-rubikscube/, manim-rubikscube, 0.0.8, A Manim implementation of a Rubik's Cube, 2021-01-23T23:12:53+0000
/project/schemahq-schemainspect/, schemahq-schemainspect, 1.0.12, Schema inspection for PostgreSQL (and possibly others), 2020-05-22T13:19:26+0000
/project/seaborn-flask-server/, seaborn-flask-server, 0.0.4, Seaborn helper wrapper around Flask, 2018-03-15T05:10:28+0000
/project/sourcesense-vessel/, sourcesense-vessel, 1.3.8, Vessel Cli Tool, 2021-03-25T14:22:16+0000
/project/marvelapi/, marvelapi, 0.0.1, Marvel api client and possible cli, 2018-10-23T17:10:09+0000
/project/jservicepy/, jservicepy, 1.0, API wrapper for jService (comes with a commmand-line game implementation!), 2020-08-15T01:44:46+0000
/project/strictdom/, strictdom, 0.3, strictly typed wrapper around Knio's Dominate, 2019-06-04T17:15:09+0000
/project/django-codenerix-payments/, django-codenerix-payments, 2.0.3, Codenerix Payments is a module that enables CODENERIX to manage payments and let clients to pay online., 2018-05-26T13:32:15+0000
/project/graiax-sayamod-nbnhhsh/, graiax-sayamod-nbnhhsh, 0.1.6, [Saya模块]能不能好好说话——缩写查询, 2021-02-26T14:19:29+0000
/project/biip/, biip, 1.0.0, Biip interprets the data in barcodes., 2021-04-18T00:55:12+0000
/project/magen-policy-service/, magen-policy-service, 1.0a1, Policy Microservice Package, 2017-09-01T08:35:01+0000
/project/indep-free/, indep-free, 0.3.2, Send newspaper "El Independiente" to mail. While we can download the newspaper and sed via email., 2021-02-22T16:10:54+0000
/project/rcon-shell/, rcon-shell, 0.0.1, Minecraft rcon shell in Python, 2021-03-20T20:00:18+0000
/project/adafruit-nrfutil/, adafruit-nrfutil, 0.5.3.post13, Python 3 version of Nordic Semiconductor nrfutil utility and Python library (modified by Adafruit), 2020-11-01T06:31:12+0000
/project/rohdeschwarz/, rohdeschwarz, 1.7.1.dev1, Rohde & Schwarz general purpose instrument control toolbox, 2020-12-14T21:50:57+0000
/project/eye2you/, eye2you, 0.1.dev1, fundus image analysis, 2019-07-09T10:26:59+0000
/project/csvy/, csvy, 0.1.5, Convenience wrappers for the standard library csv module., 2020-04-09T04:38:58+0000
/project/sec-wiki/, sec-wiki, 2020.10.30.0, ApacheCN 安全知识库, 2020-10-30T11:53:27+0000
/project/simspeclib/, simspeclib, 2.3.0.3, SimSpec library. SIMplified SPECtrum reduction package for astronomy., 2018-06-24T11:02:27+0000
/project/frf/, frf, 0.10.0, FastAPI RESt Framework, 2021-02-18T14:59:51+0000
/project/simpylc/, SimPyLC, 3.9.4, SimPyLC PLC simulator, after its C++ big brother that has controlled industrial installations for more than 25 years now. ARDUINO CODE GENERATION ADDED!, 2021-02-11T19:35:53+0000
/project/mqlight/, mqlight, 1.0.2015020201b1, IBM MQ Light Client Python Module, 2015-02-03T15:57:05+0000
/project/gruetils/, gruetils, 0.0.2, Small utilities used in many of my projects, 2018-11-28T18:58:57+0000
/project/statice/, statice, 1.0.0, A fake package to warn the user they are not installing the correct package., 2021-02-16T13:54:17+0000
/project/mchat/, mchat, 0.1.0, A console chat client for most Minecraft server versions, 2020-12-08T00:37:04+0000
/project/shell-utils/, shell-utils, 2.3.1, Shell automation tools, like Make on steroids., 2018-09-08T00:56:37+0000
/project/apachecn-home/, apachecn-home, 2021.4.15.0, 访问 http://localhost:{port} 查看文档, 2021-04-15T06:58:16+0000
/project/cloudhouse-guardian/, cloudhouse-guardian, 0.0.18, Guardian SDK for Python, 2021-02-24T04:16:52+0000
/project/mlfinlab/, mlfinlab, 1.1.0, MlFinlab helps portfolio managers and traders who want to leverage the power of machine learning by providing reproducible, interpretable, and easy to use tools., 2021-04-15T15:58:10+0000
/project/org-asm/, ORG.asm, 1.0.3, A de novo assembler dedicated to organelle genome assembling, 2019-04-03T15:16:42+0000
/project/dorado-sensitivity/, dorado-sensitivity, 0.3.0, Dorado sensitivity and exposure time calculator, 2021-03-19T03:29:17+0000
/project/pip-example-pkg-revuel/, pip-example-pkg-revuel, 0.10.3, Tutorial to distribute a pip package, 2020-11-16T13:32:50+0000
/project/rundeckpy/, rundeckpy, 0.2.7, Rundeck python plugins, helper functions and cli tool, 2021-04-25T09:12:07+0000
/project/scpi/, scpi, 2.4.0, Basic idea here is to make transport-independent command sender/parser and a device baseclass that implements the common SCPI commands, 2021-04-25T11:02:28+0000
/project/sarar/, sarar, 0.1.0, SARAR is a command-line-interface tool for GNU/Linux, its goal is to optimize the process of remembering things., 2021-04-25T13:46:35+0000
/project/gr-cli/, gr-cli, 0.2.0, Gerrit's command line tool, 2021-04-25T14:38:12+0000
/project/bb-cli/, bb-cli, 0.4.0, Bitbucket's command line tool, 2021-04-25T16:13:37+0000
/project/flowty/, flowty, 1.2.9, Flowty Network Optimization Solver, 2021-04-25T18:20:37+0000
/project/pywhat/, pywhat, 0.1.17, What is that thing?, 2021-04-25T18:45:02+0000
/project/crypto-history/, crypto-history, 1.2b12, crypto_history is a python package for extracting history of crypto-currencies from various exchanges and presenting them in a tabular data-format, 2021-04-25T21:51:20+0000
/project/dsmigrator/, dsmigrator, 0.4.5, A cli tool to migrate Trend Micro Deep Security to the cloud., 2021-04-25T23:25:59+0000
/project/django-cast/, django-cast, 0.1.35, Just another blogging / podcasting package, 2020-10-26T05:35:17+0000
/project/sunflower/, Sunflower, 1.1.0, model transcription factor binding to DNA, 2010-06-08T00:21:08+0000
/project/p5core/, p5core, 0.7.0, Programmer en Python comme un Pro Par la Pratique, 2020-12-11T11:42:32+0000
/project/dosie/, Dosie, 0.0.3, A search engine that makes knowledge a resource, and creates liberation with information sharing, 2019-03-11T13:22:59+0000
/project/mit-18-06-linalg-notes/, mit-18.06-linalg-notes, 2020.9.21.0, MIT 18.06 线性代数笔记, 2020-09-21T04:15:56+0000
/project/iscc-samples/, iscc-samples, 0.4.0, A collection of media files as sample data for ISCC testing., 2021-03-14T15:50:37+0000
/project/pubkeeper-protocol-v1/, pubkeeper.protocol.v1, 1.1.1, Brew, Fill, Consume, 2018-06-12T21:23:30+0000
/project/data-france/, data-france, 0.11.3, Paquet agrégeant des données administratives publiques pour en rendre l'utilisation facile., 2021-03-24T17:49:15+0000
/project/pypkgs-elina/, pypkgs-elina, 0.1.0, "Python package that eases the pain of concatenating Pandas categoricals!", 2021-02-27T06:27:24+0000
/project/python-monetdb/, python-monetdb, 11.19.3.2, Native MonetDB client Python API, 2015-01-07T15:27:09+0000
/project/myt/, myt, 0.5.4, Time, zones, 2021-04-15T12:41:25+0000
/project/hexdoor/, hexdoor, 0.1.0, A colorful terminal hex viewer, 2019-02-14T07:13:03+0000
/project/hybrid-vocal-classifier/, hybrid-vocal-classifier, 0.3.0, a Python machine learning library for animal vocalizations and bioacoustics, 2021-04-10T19:34:50+0000
/project/bgcore/, bgcore, 0.5.0, Biomedical Genomics Python core libraries, 2014-07-29T08:36:06+0000
/project/ringmaster-show/, ringmaster.show, 0.4.2, The world is a circus and you are the ringmaster!, 2021-04-08T09:56:52+0000
/project/simspec/, simspec, 1.11.0, User interface for SimSpec. SIMplified SPECtrum reduction package for astronomy., 2019-04-04T15:50:53+0000
/project/helmholtz/, Helmholtz, 0.2.0, A framework for creating neuroscience databases, 2012-02-03T13:36:34+0000
/project/uniquid/, uniquid, 0.5.6, UniquID command line administration tool., 2020-02-21T13:17:45+0000
/project/ddv-logging/, ddv-logging, 0.2.1, Python logging formatters, filters, and convenience methods, 2020-10-18T17:02:11+0000
/project/rssd/, rssd, 2021.2.22, Rohde & Schwarz SCPI Driver, 2021-02-22T18:36:27+0000
/project/prql/, prql, 0.1.12, An interpreted relational query language that compiles to SQL, 2020-11-17T16:14:01+0000
/project/narration/, narration, 0.2.2, Narration, 2021-02-07T14:31:14+0000
/project/vital/, vital, 0.2.16, , 2021-04-02T22:18:08+0000
/project/idp-engine/, idp-engine, 0.8.0, IDP-Z3 is a collection of software components implementing the Knowledge Base paradigm using the FO(.) language and a Z3 SMT solver., 2021-03-25T17:12:42+0000
/project/robot-spline/, robot-spline, 1.0.0, Robot spline path library, 2016-05-21T16:23:25+0000
/project/lcthw-zh/, lcthw-zh, 2020.9.21.0, 笨办法学C 中文版, 2020-09-21T04:14:26+0000
/project/ubase/, ubase, 0.2.1, μBase is oversimpistic key-value database wrapper on top of aiosqlite, 2021-04-23T18:04:24+0000
/project/apap/, apap, 0.0.0b3, Declarative and handy RESTful client factory, 2019-08-17T12:25:30+0000
/project/qctrl-commons/, qctrl-commons, 7.0.1, Q-CTRL Python Commons, 2021-04-22T06:58:55+0000
/project/bosdyn-choreography-client/, bosdyn-choreography-client, 2.3.4, Boston Dynamics API client code and interfaces for choreography, 2021-04-14T12:02:51+0000
/project/onednn-cpu-dpcpp-gpu-dpcpp/, onednn-cpu-dpcpp-gpu-dpcpp, 2021.2.0, Intel® oneAPI Deep Neural Network Library, 2021-03-26T20:16:57+0000
/project/webnms/, WebNMS, 1b1, A package providing provisions for connecting with a WebNMS IoT platform, 2018-12-13T14:41:30+0000
/project/jpl-mcl-site-knowledge/, jpl.mcl.site.knowledge, 0.0.8, Knowledge representation for the MCL site, 2018-09-05T19:06:38+0000
/project/portfolioscience/, portfolioscience, 1.0.11, PortfolioScience RiskAPI Enterprise Client, 2020-11-18T17:47:43+0000
/project/pyton/, pyTON, 0.1.4, Python API for libtonlibjson (Telegram Open Network Light Client), 2020-01-21T10:03:13+0000
/project/magen-statistics-service/, magen-statistics-service, 1.1a1, Statistics MicroService Package, 2017-10-20T07:05:18+0000
/project/xarray-ms/, xarray-ms, 0.1.9, xarray Datasets from CASA Tables., 2019-06-21T13:06:13+0000
/project/azureml-designer-core/, azureml-designer-core, 0.0.61, , 2021-04-13T08:29:39+0000
/project/azureml-automl-runtime/, azureml-automl-runtime, 1.27.0.post1, AutoML client runtime library, 2021-04-21T15:26:10+0000
/project/ruamel-music/, ruamel.music, 0.4.0, handling of music files: conversion, playing, 2020-09-17T13:06:46+0000
/project/wailord/, wailord, 0.0.2, Wailord is a python library to interact with ORCA, 2020-12-27T16:43:49+0000
/project/medaimodels/, medaimodels, 0.1.0, A libarary for creating med-ai models, 2020-08-10T14:00:30+0000
/project/pytorch-doc-zh/, pytorch-doc-zh, 2020.9.28.0, <center>PyTorch 中文教程</center>, 2020-09-28T06:10:33+0000
