/project/hypatia-engine/, hypatia_engine, 0.3.6, 2D action adventure game engine, 2015-12-06T02:55:12+0000
/project/cryptography/, cryptography, 3.4.7, cryptography is a package which provides cryptographic recipes and primitives to Python developers., 2021-03-25T17:31:04+0000
/project/termtosvg/, termtosvg, 1.1.0, Record terminal sessions as SVG animations, 2020-01-18T20:09:17+0000
/project/wikimedia-spicerack/, wikimedia-spicerack, 0.0.49, Automation framework for the WMF production infrastructure, 2021-03-04T13:45:19+0000
/project/yapydata/, yapydata, 0.1.40, The 'yapydata provides miscellaneous low-level *Python* data access APIs., 2019-12-13T09:48:02+0000
/project/meinheld/, meinheld, 1.0.2, High performance asynchronous Python WSGI Web Server, 2020-05-17T13:09:14+0000
/project/suext/, suext, 0.0.3, Utility for showing any file extension and MIME type info. Support show files information in a directory as list or table., 2020-04-01T07:41:01+0000
/project/qgitc/, qgitc, 3.3.2, A file conflict viewer for git, 2021-04-18T01:15:55+0000
/project/taskforce/, taskforce, 0.6.0, Taskforce starts and restarts daemon processes.  It will detect executable and/or module changes and automatically restart the affected processes., 2020-08-13T19:13:49+0000
/project/termtosvg/, termtosvg, 1.1.0, Record terminal sessions as SVG animations, 2020-01-18T20:09:17+0000
/project/wikimedia-spicerack/, wikimedia-spicerack, 0.0.49, Automation framework for the WMF production infrastructure, 2021-03-04T13:45:19+0000
/project/argopt/, argopt, 0.7.0, doc to argparse driven by docopt, 2021-03-01T16:51:30+0000
/project/ooniprobe/, ooniprobe, 2.3.0, Network measurement tool foridentifying traffic manipulation and blocking., 2018-02-14T09:14:22+0000
/project/pyramidueditor/, pyramidueditor, 1.0.1, A Pyramid application for Baidu Ueditor., 2015-06-05T09:52:25+0000
/project/dropstar/, dropstar, 2010.10.14.0, dropSTAR: Drop Scripts, Templates and RPC.  A stand-alone HTTP server for mixing dynamic and static content with RPC calls.  Focused on system administration and automation tasks., 2010-10-14T18:22:11+0000
/project/theonionbox/, theonionbox, 20.2, The Onion Box: Dashboard to monitor Tor node operations., 2020-01-19T16:46:06+0000
/project/opencanary/, opencanary, 0.6.1, OpenCanary daemon, 2021-03-30T13:07:18+0000
/project/df-config/, df-config, 0.9.38, Smart default settings for Django websites, 2021-04-19T06:09:18+0000
/project/ecs-pipeline-deploy/, ecs-pipeline-deploy, 0.5.1, An opinionated deployment application for ECS services, 2020-09-10T23:08:27+0000
/project/python-openzwave/, python-openzwave, 0.4.19, python_openzwave is a python wrapper for the openzwave c++ library., 2019-03-20T10:06:12+0000
/project/autotorrent/, autotorrent, 1.7.1, AutoTorrent allows easy cross-seeding, 2019-12-30T20:59:14+0000
/project/pymmbfuse/, pymmbfuse, 0.7.4, Fuse driver for BBC Microcomputer DFS disk images and MMB disk bundles, 2020-05-11T17:10:58+0000
/project/za-id-number/, za-id-number, 0.0.3, Library South African ID number validation and easy data extraction., 2021-01-20T17:25:10+0000
/project/py-rbac/, py-rbac, 20.12.3, Python implementation of the NIST model for role based access control (RBAC)., 2020-12-21T02:31:07+0000
/project/darfortie/, darfortie, 1.0.2, A utility that extends and simplifies using dar (Disk ARchive) for doing routine incremental backups., 2020-02-01T05:11:55+0000
/project/fbsd-gpio/, fbsd_gpio, 0.5.0, cffi-based Python bindings for FreeBSD GPIO, 2016-04-02T22:34:36+0000
/project/qutebrowser/, qutebrowser, 2.2.0, A keyboard-driven, vim-like browser based on PyQt5., 2021-04-13T10:07:16+0000
/project/joes-ntpdate/, joes-ntpdate, 1.9.78, Joe's own ntpdate: set the date and time via NTP, 2015-05-22T00:53:48+0000
/project/exposan/, exposan, 0.0.10, Exposition of sanitation and resource recovery systems, 2021-04-24T20:53:47+0000
/project/scp-marvin/, scp-marvin, 1.0.1, SCP Wiki entry retrieval script, 2015-11-10T18:39:57+0000
/project/ruia/, ruia, 0.8.3, Async Python 3.6+ web scraping micro-framework based on asyncio., 2021-04-09T05:00:26+0000
/project/fmspy/, fmspy, 0.1.0, Flash Media Server in Python using Twisted Framework, 2009-05-30T15:16:35+0000
/project/httoop/, httoop, 0.0, object oriented HTTP protocol library, 2020-11-03T13:42:33+0000
/project/chicken-turtle-util/, chicken_turtle_util, 4.1.2, Python 3 utility library, 2017-06-12T14:15:19+0000
/project/xml-json-yaml-convert/, xml-json-yaml-convert, 1.0.1, Base level XML, JSON, YAML conversion tool, 2021-02-05T22:42:47+0000
/project/clustershell/, ClusterShell, 1.8.3, ClusterShell library and tools, 2019-12-17T19:16:00+0000
/project/borgweb/, borgweb, 0.3.0, Browser-based user interface for BorgBackup, 2018-06-25T21:35:12+0000
/project/dephp/, dephp, 0.4.0, Unofficial CLI application that decodes files through unphp.net web service, 2016-01-11T14:32:46+0000
/project/cryptidy/, cryptidy, 1.0.5, Python high level library for symmetric & asymmetric encryption, 2021-03-16T11:14:16+0000
/project/mathopt/, mathopt, 0.1.1, Library for mathematical optimization for sympy, 2020-10-11T20:49:10+0000
/project/test-faust-streaming/, test-faust-streaming, 1.11.0a2, Python Stream processing., 2020-10-27T10:44:25+0000
/project/mikroe-uhb/, mikroe-uhb, 0.2, USB HID Bootloader programmer for MikroElektronika devices, 2014-02-18T12:06:12+0000
/project/aitoai/, aitoai, 0.4.1, Aito.ai Python SDK, 2020-12-18T14:51:43+0000
/project/scrapy-nimbus/, scrapy-nimbus, 0.5.3, scrapy extend, 2017-04-09T01:49:17+0000
/project/powpow/, powpow, 0.0.3, Unix-style utilities for Python shell, 2021-04-07T01:51:26+0000
/project/kivy-jetson/, Kivy-jetson, 2.1.0.dev0, A software library for rapid development of hardware-accelerated multitouch applications., 2021-02-17T16:47:10+0000
/project/sap-xssec/, sap-xssec, 3.0.0, SAP Python Security Library, 2021-04-07T15:12:22+0000
/project/autoplanner/, autoplanner, 0.9.7, No description yet., 2018-01-03T18:17:43+0000
/project/prepnet/, prepnet, 0.2.0, Reconstructable preprocessor library, 2020-08-31T11:13:16+0000
/project/metron-tagger/, metron-tagger, 1.0.15, A program to write metadata from metron.cloud to a comic archive, 2021-03-20T20:37:24+0000
/project/ofunctions-json-sanitize/, ofunctions.json-sanitize, 0.1.1, Simple tool that filters unwanted characters including non printable from JSON objects, 2021-02-11T01:10:15+0000
/project/persistentdatatools/, persistentdatatools, 2.2.10, This is a library used to manipulate, and save data quickly., 2020-04-30T18:36:51+0000
/project/remclient/, remclient, 1.1.2, client library for REM server, 2021-01-29T14:14:04+0000
/project/pycx4/, pycx4, 1.3, CXv4 control system framework Python bindings, 2021-04-16T12:08:42+0000
/project/teleme/, teleme, 0.1.0, An async, super simple Telegram Bot framework., 2020-05-22T13:16:07+0000
/project/aiosmtpd/, aiosmtpd, 1.4.2, aiosmtpd - asyncio based SMTP server, 2021-03-08T04:32:36+0000
/project/ofunctions-network/, ofunctions.network, 0.5.0, Network diagnostics, MTU probing, Public IP discovery, HTTP/HTTPS internet connectivty tests, ping, 2021-02-11T01:10:20+0000
/project/pwned/, pwned, 0.1.2, Check if you've been pwned via haveibeenpwned.com, 2016-05-15T09:29:02+0000
/project/redvty/, redvty, 0.0.1, VTY automation via SSH., 2019-11-15T15:17:17+0000
/project/nuitka/, Nuitka, 0.6.14.4, Python compiler with full language support and CPython compatibility, 2021-04-18T14:21:23+0000
/project/avalonms/, avalonms, 0.6.0, Avalon Music Server, 2015-11-09T02:26:15+0000
/project/drewtilities/, drewtilities, 1.3.2, Simple utilities for dev work., 2019-05-30T22:03:01+0000
/project/namedtupledefs/, namedtupledefs, 0.1.21, Extended 'namedtuple' by default values., 2019-12-13T12:30:09+0000
/project/pyramidueditor/, pyramidueditor, 1.0.1, A Pyramid application for Baidu Ueditor., 2015-06-05T09:52:25+0000
/project/dropstar/, dropstar, 2010.10.14.0, dropSTAR: Drop Scripts, Templates and RPC.  A stand-alone HTTP server for mixing dynamic and static content with RPC calls.  Focused on system administration and automation tasks., 2010-10-14T18:22:11+0000
/project/theonionbox/, theonionbox, 20.2, The Onion Box: Dashboard to monitor Tor node operations., 2020-01-19T16:46:06+0000
/project/opencanary/, opencanary, 0.6.1, OpenCanary daemon, 2021-03-30T13:07:18+0000
/project/aitoai/, aitoai, 0.4.1, Aito.ai Python SDK, 2020-12-18T14:51:43+0000
/project/scrapy-nimbus/, scrapy-nimbus, 0.5.3, scrapy extend, 2017-04-09T01:49:17+0000
/project/powpow/, powpow, 0.0.3, Unix-style utilities for Python shell, 2021-04-07T01:51:26+0000
/project/kivy-jetson/, Kivy-jetson, 2.1.0.dev0, A software library for rapid development of hardware-accelerated multitouch applications., 2021-02-17T16:47:10+0000
/project/sap-xssec/, sap-xssec, 3.0.0, SAP Python Security Library, 2021-04-07T15:12:22+0000
/project/autoplanner/, autoplanner, 0.9.7, No description yet., 2018-01-03T18:17:43+0000
/project/prepnet/, prepnet, 0.2.0, Reconstructable preprocessor library, 2020-08-31T11:13:16+0000
/project/metron-tagger/, metron-tagger, 1.0.15, A program to write metadata from metron.cloud to a comic archive, 2021-03-20T20:37:24+0000
/project/ofunctions-json-sanitize/, ofunctions.json-sanitize, 0.1.1, Simple tool that filters unwanted characters including non printable from JSON objects, 2021-02-11T01:10:15+0000
/project/persistentdatatools/, persistentdatatools, 2.2.10, This is a library used to manipulate, and save data quickly., 2020-04-30T18:36:51+0000
/project/remclient/, remclient, 1.1.2, client library for REM server, 2021-01-29T14:14:04+0000
/project/pycx4/, pycx4, 1.3, CXv4 control system framework Python bindings, 2021-04-16T12:08:42+0000
/project/teleme/, teleme, 0.1.0, An async, super simple Telegram Bot framework., 2020-05-22T13:16:07+0000
/project/aiosmtpd/, aiosmtpd, 1.4.2, aiosmtpd - asyncio based SMTP server, 2021-03-08T04:32:36+0000
/project/trio-typing/, trio-typing, 0.5.0, Static type checking support for Trio and related projects, 2020-06-29T03:54:45+0000
/project/mizoo/, mizoo, 0.5, Use deep learning to rename your images with the related caption., 2016-11-19T09:30:21+0000
/project/uptime/, uptime, 3.0.1, Cross-platform uptime library, 2013-10-07T14:19:57+0000
/project/fsquota/, FsQuota, 0.1.0, Interface to file system quotas on UNIX platforms, 2020-04-20T18:23:36+0000
/project/diamond-patterns/, diamond-patterns, 0.5.3, Diamond-Patterns are scaffolds for knowledge work.  Use patterns to go faster., 2019-07-27T13:10:38+0000
/project/sourceinfo/, sourceinfo, 0.1.40, Utilities for simplified gain of runtime information on source code and binary locations., 2019-12-13T09:11:10+0000
/project/ofunctions-network/, ofunctions.network, 0.5.0, Network diagnostics, MTU probing, Public IP discovery, HTTP/HTTPS internet connectivty tests, ping, 2021-02-11T01:10:20+0000
/project/pwned/, pwned, 0.1.2, Check if you've been pwned via haveibeenpwned.com, 2016-05-15T09:29:02+0000
/project/redvty/, redvty, 0.0.1, VTY automation via SSH., 2019-11-15T15:17:17+0000
/project/nuitka/, Nuitka, 0.6.14.4, Python compiler with full language support and CPython compatibility, 2021-04-18T14:21:23+0000
/project/avalonms/, avalonms, 0.6.0, Avalon Music Server, 2015-11-09T02:26:15+0000
/project/drewtilities/, drewtilities, 1.3.2, Simple utilities for dev work., 2019-05-30T22:03:01+0000
/project/namedtupledefs/, namedtupledefs, 0.1.21, Extended 'namedtuple' by default values., 2019-12-13T12:30:09+0000
/project/unix-cred/, unix-cred, 0.2.1, A library that simplifies reading peer credentials from Unix domain sockets, 2021-01-08T19:10:52+0000
/project/coho/, coho, 0.4, SMILES parser, 2019-01-19T03:34:02+0000
/project/bsddb185/, bsddb185, 1.1, bsddb185 module from Python 2.6, 2008-05-10T14:44:44+0000
/project/ssh2-python3/, ssh2-python3, 0.22.6, Super fast SSH library - bindings for libssh2 and Python 3, 2020-12-28T10:35:32+0000
/project/dmoj/, dmoj, 3.0.1, The judge component of the DMOJ: Modern Online Judge platform, 2021-02-28T01:28:00+0000
/project/pcp/, pcp, 1.2, Performance Co-Pilot collector, monitor and instrumentation APIs, 2017-05-31T06:54:19+0000
/project/xmppcat/, xmppcat, 0.1.1, CLI application that works like cat but sends its output through xmpp, 2012-11-15T14:09:15+0000
/project/checkopenbgpd/, checkopenbgpd, 0.10, Check OpenBGPD sessions Nagios|Icinga|shinken|etc plugin, 2018-01-20T15:41:06+0000
/project/attic/, Attic, 0.16, Deduplicated backups, 2015-05-16T19:39:43+0000
/project/jitterentropy/, jitterentropy, 0.1, Use libjitterentropy to get random bytes, 2019-10-22T01:51:09+0000
/project/darkseid/, darkseid, 1.0.6, A library to interact with comic archives, 2020-10-30T20:24:52+0000
/project/ofunctions-process/, ofunctions.process, 0.1.1, Shorthand for killing an entire process tree, 2021-02-11T01:10:23+0000
/project/configo/, Configo, 1.4, Easy way to use existing JSON, XML or YAML config files from bash shell/scripts, 2016-07-05T12:22:33+0000
/project/calmjs-dev/, calmjs.dev, 2.3.0, Package for aiding the development of JavaScript code to be provided as part of Python packages through integration with Node.js development tools into a Python environment via the Calmjs framework., 2019-05-28T06:03:36+0000
/project/menusys/, menusys, 1.1.7, Menu system to easily create a menu in CLI, 2021-01-29T19:30:21+0000
/project/slick-reporting/, slick-reporting, 0.1.3, A one-stop report adn analytics generation and computation with batteries included, 2020-04-25T07:19:30+0000
/project/django-easy-app/, django-easy-app, 0.0.27, Extend django-admin to create apps that are easier to set, 2015-05-01T17:25:28+0000
/project/faust/, faust, 1.10.4, Python Stream processing., 2020-02-25T22:57:18+0000
/project/musct/, musct, 1.0.1, Multiple user setting configuration tool, 2018-06-17T11:38:49+0000
/project/pymaestro/, pymaestro, 0.1, Pololu Maestro USB SDK in pure Python, 2017-06-11T15:57:07+0000
/project/pg-chameleon/, pg-chameleon, 2.0.16, MySQL to PostgreSQL replica and migration, 2020-09-23T16:21:24+0000
/project/calmjs-rjs/, calmjs.rjs, 2.0.1, Package for the integration of RequireJS into a Python environment via the Calmjs framework, to provide a reproducible workflow for the generation of deployable artifacts from JavaScript source code provided by Python packages in conjunction with standard JavaScript or Node.js packages sourced from npm or other similar package repositories., 2018-05-03T03:06:49+0000
/project/parallel-ssh/, parallel-ssh, 2.5.4, Asynchronous parallel SSH library, 2021-01-28T18:04:50+0000
/project/djt-csp/, djt-csp, 0.9.9, Panel for Django-debug-toolbar that checks some security headers, 2021-03-08T05:49:09+0000
/project/pycsdl2/, pycsdl2, 2.0.0.0.dev5, Simple DirectMedia Layer, 2015-10-25T16:03:05+0000
/project/minecraft-launcher-cmd/, minecraft-launcher-cmd, 1.0, Start Minecraft from commandline, 2019-12-02T17:37:14+0000
/project/ezjailremote/, ezjailremote, 0.2.2, a remote control and convenience wrapper for ezjail, 2013-05-03T12:56:47+0000
/project/epyunit/, epyunit, 0.2.12, The 'epyunit' package provides a wrapper for unit tests of commandline interfaces, and the automation of debugging with PyDev for external processes. The package could be used either from the comandline, or integrated into Eclipse with PyDev., 2017-03-27T04:21:41+0000
/project/pymodbus3/, pymodbus3, 1.0.0, A fully featured modbus protocol stack in python, 2014-07-18T07:20:27+0000
/project/eccsnacks/, eccsnacks, 1.0.2, Reference implementation of Curve25519 and Curve448 (goldilocks) as specified in RFC7748, 2020-04-22T03:50:21+0000
/project/kivymd-extensions-filemanager/, kivymd-extensions.filemanager, 0.1.5, File manager for desktop, 2020-11-09T16:48:39+0000
/project/aliyun/, Aliyun, 0.1.1, UNKNOWN, 2011-11-11T09:32:11+0000
/project/extra-boolean/, extra-boolean, 1.0.6, Boolean data type has two possible truth values to represent logic., 2021-04-01T12:33:37+0000
/project/patroni/, patroni, 2.0.2, PostgreSQL High-Available orchestrator and CLI, 2021-02-22T13:49:40+0000
/project/plow/, plow, 0.4.4, Python client for the Plow render farm, 2013-05-27T11:08:14+0000
/project/monotonic-time/, monotonic-time, 2.1.0, monotonic time for Python 2 and 3, on Linux, FreeBSD, Mac OS X, and Windows., 2017-05-29T02:43:03+0000
/project/ofunctions-service-control/, ofunctions.service-control, 0.1.3, Windows & Linux service control functions, 2021-03-30T14:03:42+0000
/project/spamfighter/, spamfighter, 0.2.0, Web-service fighting spam and other unsolicited messages, 2009-02-27T09:02:18+0000
/project/kthbuild/, kthbuild, 0.0.90, Knuth node build tools, 2021-04-13T15:09:35+0000
/project/joes-ntpdate/, joes-ntpdate, 1.9.78, Joe's own ntpdate: set the date and time via NTP, 2015-05-22T00:53:48+0000
/project/exposan/, exposan, 0.0.10, Exposition of sanitation and resource recovery systems, 2021-04-24T20:53:47+0000
/project/scp-marvin/, scp-marvin, 1.0.1, SCP Wiki entry retrieval script, 2015-11-10T18:39:57+0000
/project/ruia/, ruia, 0.8.3, Async Python 3.6+ web scraping micro-framework based on asyncio., 2021-04-09T05:00:26+0000
/project/fmspy/, fmspy, 0.1.0, Flash Media Server in Python using Twisted Framework, 2009-05-30T15:16:35+0000
/project/httoop/, httoop, 0.0, object oriented HTTP protocol library, 2020-11-03T13:42:33+0000
/project/chicken-turtle-util/, chicken_turtle_util, 4.1.2, Python 3 utility library, 2017-06-12T14:15:19+0000
/project/xml-json-yaml-convert/, xml-json-yaml-convert, 1.0.1, Base level XML, JSON, YAML conversion tool, 2021-02-05T22:42:47+0000
/project/clustershell/, ClusterShell, 1.8.3, ClusterShell library and tools, 2019-12-17T19:16:00+0000
/project/borgweb/, borgweb, 0.3.0, Browser-based user interface for BorgBackup, 2018-06-25T21:35:12+0000
/project/chemicals/, chemicals, 1.0.5, Chemical properties component of Chemical Engineering Design Library (ChEDL), 2021-04-25T17:42:59+0000
/project/hoopa/, hoopa, 0.0.7, Asynchronous crawler micro-framework based on python., 2021-04-26T01:35:55+0000
/project/df-websockets/, df-websockets, 0.10.9, Websocket integration for Django, 2021-04-16T08:51:00+0000
/project/fsnix/, fsnix, 0.2, Expose more advanced posix/file system APIs to Python, 2012-11-12T20:42:35+0000
/project/twine/, twine, 3.4.1, Collection of utilities for publishing packages on PyPI, 2021-03-17T00:42:30+0000
/project/fogbugz-bis/, fogbugz-bis, 1.1, Python library for interacting with the FogBugz API, 2019-04-17T13:59:37+0000
/project/kd-samba/, kd-samba, 0.1.dev0, Web interface for managing samba users, 2020-12-04T11:25:33+0000
/project/cpuid/, cpuid, 0.0.10, cpuid Pythonic API, 2021-01-26T00:42:36+0000
/project/pythemis/, pythemis, 0.13.0, , 2020-07-08T15:24:07+0000
/project/ofunctions-threading/, ofunctions.threading, 0.1.0, Threading decorator to run functions as threads, 2021-03-30T14:04:27+0000
/project/kaidoku/, kaidoku, 0.5.6, Player, solver and creater of sudoku puzzles, 2018-08-22T06:36:01+0000
/project/actorio/, actorio, 0.1.4, A simple actor framework for asyncio, 2018-12-06T17:40:54+0000
/project/ofunctions/, ofunctions, 2.0.3, Toolset with various file logging / network / checksumming / process functions, 2021-03-30T13:58:36+0000
/project/thomas/, thomas, 2.2.3, Thomas allows segmented downloads and is an alternative to Axel, 2019-02-17T14:07:06+0000
/project/hipachectl/, hipachectl, 0.3.0, Command Line Tool to Manage hipache, 2015-12-26T05:41:01+0000
/project/adoc/, adoc, 0.1.5, Python code documentation generator, 2018-08-29T18:31:43+0000
/project/cv/, cv, 1.0.0, Check version of a Python module, 2019-09-19T16:32:26+0000
/project/kivymd/, kivymd, 0.104.1, Set of widgets for Kivy inspired by Google's Material Design, 2020-04-27T20:04:26+0000
/project/setuplibcore/, setuplibcore, 0.1.15, Support library functions for extensions and entry points of setuptools / distutils., 2019-12-13T11:13:52+0000
/project/readme-renderer/, readme-renderer, 29.0, readme_renderer is a library for rendering "readme" descriptions for Warehouse, 2021-02-23T05:45:15+0000
/project/oneid-cli/, oneID-cli, 1.0.35, A command line interface for the Neustar Trusted Identity (TDI) Core, 2017-12-14T21:34:32+0000
/project/mu-sdk/, mu-sdk, 0.0.3, ss-panel mu api sdk for python, 2016-12-15T15:41:42+0000
/project/openlp/, OpenLP, 2.9.2, Open source Church presentation and lyrics projection application., 2020-12-21T18:27:11+0000
/project/borgbackup/, borgbackup, 1.1.16, Deduplicated, encrypted, authenticated and compressed backups, 2021-03-22T21:44:05+0000
/project/yakt/, yakt, 0.1.dev0, Yet another keysigning tool, 2018-02-05T05:55:50+0000
/project/ffmpy3/, ffmpy3, 0.2.3, A simple asynchronous Python wrapper for ffmpeg, 2017-01-01T03:24:32+0000
/project/x84/, x84, 2.0.17, Framework for Telnet and SSH BBS or MUD server development with example default bbs board, 2020-06-17T12:51:31+0000
/project/kivymd-extensions-akivymd/, kivymd-extensions.akivymd, 1.2.6, A set of fancy widgets for KivyMD, 2021-04-25T19:08:46+0000
/project/fpscanner/, fpscanner, 0.1.1, , 2021-04-23T02:41:35+0000
/project/maybe/, maybe, 0.4.0, See what a program does before deciding whether you really want it to happen., 2016-03-27T17:57:21+0000
/project/yaurtww/, yaurtww, 0.0.1, Yet Another Urban Terror Wget Wrapper., 2014-08-04T04:30:25+0000
/project/setupjavax/, setupjavax, 0.1.38, Support Java extensions for setuptools / distutils., 2019-12-13T13:46:37+0000
/project/cuts/, cuts, 0.37.7, Remove and/or rearrange sections from each line of a file(s)., 2015-07-26T21:23:19+0000
/project/fintech/, fintech, 6.6.2, The Python FinTech package (SEPA, EBICS & more), 2021-03-16T00:48:02+0000
/project/multicoder/, multicoder, 0.1.2, Test classical encodings., 2020-01-14T12:58:58+0000
/project/awacs/, awacs, 1.0.4, AWS Access Policy Language creation library, 2021-03-20T15:31:48+0000
/project/atividades-algoritmos/, atividades-algoritmos, 0.1, Pacote com a resolução das atividades do segundo estágio, 2019-04-12T23:56:45+0000
/project/hoopa/, hoopa, 0.0.7, Asynchronous crawler micro-framework based on python., 2021-04-26T01:35:55+0000
/project/gnupg/, gnupg, 2.3.1, A Python wrapper for GnuPG, 2017-09-06T23:42:36+0000
/project/cyhdfs/, cyhdfs, 0.1.3, Cython wrapper around libhdfs, 2012-09-19T19:24:20+0000
/project/kivymd-extensions-example-extension/, kivymd-extensions.example-extension, 0.1.1, Example extension that adds beautiful button, 2020-11-01T10:35:50+0000
/project/trollo/, trollo, 0.2.1, , 2021-02-23T21:21:38+0000
/project/ffpyplayer/, ffpyplayer, 4.3.2, A cython implementation of an ffmpeg based player., 2020-10-14T23:56:01+0000
/project/game-of-thrones/, game-of-thrones, 0.1.7, Command line tool to generate words that sound like characters from Game of Thrones. Good for project names., 2014-06-24T16:54:25+0000
/project/caffeine-ng/, caffeine-ng, 3.5.1, Tray bar app to temporarily inhibit screensaver and sleep mode., 2021-01-19T08:32:29+0000
/project/bobtemplates-pypbr/, bobtemplates.pypbr, 0.3, bobtemplates to create python packages with pbr, 2015-03-31T13:05:09+0000
/project/flac2all/, flac2all, 5.1, Multi process, clustered, FLAC to multi codec audio converter with tagging support, 2020-01-23T11:48:41+0000
/project/freebsd-ports/, FreeBSD-ports, 0.0.9, Parse FreeBSD Ports INDEX, provide search API, 2019-07-11T21:25:43+0000
/project/redssh/, redssh, 2.3.2, An SSH automation library., 2021-03-06T12:10:54+0000
/project/auxlib/, auxlib, 0.0.43, auxiliary library to the python standard library, 2019-03-13T19:10:44+0000
/project/subprocess32/, subprocess32, 3.5.4, A backport of the subprocess module from Python 3 for use on 2.x., 2019-05-20T22:14:16+0000
/project/viz-alchemy/, viz-alchemy, 0.0.1, Visualize database relationship for SQLAlchemy, 2020-12-07T16:02:39+0000
/project/pollinator/, pollinator, 0.0.3, Pollinator is a Python poll and generator based package for writing simple
non-blocking network services, 2016-01-17T19:48:30+0000
/project/wheelz/, wheelz, 0.1, wheelz -- complexity via Burrows-Wheeler transform., 2019-11-14T19:48:28+0000
/project/egenix-mxodbc-zopeda/, egenix-mxodbc-zopeda, 2.2.3, eGenix mxODBC Zope/Plone Database Adapter for Plone and Zope, 2015-09-11T18:36:59+0000
/project/timemory/, timemory, 3.1.0, Lightweight cross-language instrumentation API for C, C++, Python, Fortran, and CUDA which allows arbitrarily bundling tools together into a single performance analysis handle, 2020-07-11T01:12:43+0000
/project/ofunctions-string-handling/, ofunctions.string-handling, 0.1.2, Simple string sanitization functions, 2021-03-30T14:04:04+0000
/project/env2/, env2, 0.0.0, os.environ on steroids, 2017-11-10T20:41:58+0000
/project/pg-chameleon-web/, pg-chameleon-web, 0.1.dev0, Web interface for pg_chameleon, 2020-05-01T12:50:00+0000
/project/fnvstring/, fnvstring, 0.9.7, Python fnv hash string implementation, 2021-04-04T10:43:25+0000
/project/qiime-tools/, qiime-tools, 1.1.2, Useful additions to the QIIME analysis pipeline including tools for data visualization and cluster-computing., 2014-09-19T15:00:56+0000
/project/cix/, cix, 0.1, cheminformatics utilities, 2020-11-15T18:47:48+0000
/project/python-slick-reporting/, python-slick-reporting, 0.1.4, A one-stop report adn analytics generation and computation with batteries included, 2020-04-25T18:38:47+0000
/project/get-geckodriver/, get-geckodriver, 0.2.1, Automatically install geckodriver, compile if required., 2020-09-13T23:20:35+0000
/project/archey4/, archey4, 4.11.0, Archey is a simple system information tool written in Python, 2021-03-21T08:21:44+0000
/project/ruruki/, ruruki, 1.4.2, Ruruki is a lightweight in-memory graph database which is ideal if you need a temporary graph database, or just doing a proof of concept and need a fast and reliable graph database., 2017-05-20T04:38:22+0000
/project/cloudi/, cloudi, 2.0.1, Python CloudI API, 2020-11-27T06:18:14+0000
/project/chicken-turtle-project/, chicken_turtle_project, 2.3.0, Python 3 project development tools, 2016-10-08T00:20:58+0000
