/project/django-civil/, django-civil, 0.0.2, A toolkit for social Django projects, 2016-10-06T17:38:37+0000
/project/management/, management, 0.0.1, dropbox, 2021-04-19T22:22:03+0000
/project/pygame-frame/, pygame-frame, 0.0.6, A lib to simplify the use of pygame, 2020-11-03T21:11:34+0000
/project/ktext/, ktext, 0.40, Pre-processing text in parallel for Keras in python., 2019-05-15T04:54:29+0000
/project/hos/, hos, 0.0.0, , 2020-08-18T20:56:13+0000
/project/ashar/, ashar, 0.5.5, This project is for data encryption with password protection., 2021-04-18T16:48:40+0000
/project/roleplay/, roleplay, 0.11, Python does Roles, 2008-01-14T13:27:58+0000
/project/htttea/, htttea, 0.1.0, Web server for testing., 2017-10-05T14:26:02+0000
/project/cyan/, cyan, 0.0.1, Project Template, 2020-02-03T14:47:21+0000
/project/ae-deep/, ae-deep, 0.1.0, ae_deep portion of python application environment namespace package, 2020-09-26T13:05:27+0000
/project/django-registry-maploom/, django-registry-maploom, 1.5.1, Use MapLoom in your django projects., 2016-08-06T13:16:36+0000
/project/flake8-cached/, flake8-cached, 0.0.1, A wrapper around flake8's cli that uses cache at file level, 2021-04-13T22:19:12+0000
/project/figaro/, figaro, 0.1, Production cloud deployments of fig infrastructure with docker, 2014-02-01T19:45:55+0000
/project/fictive-cache/, fictive-cache, 0.0.1, , 2021-02-10T18:24:52+0000
/project/learn-opt/, learn-opt, 0.0.1, , 2020-09-06T05:45:29+0000
/project/kelly/, kelly, 1.0, A Python module for working with the Kelly Criterion, 2020-04-11T18:00:14+0000
/project/abap/, abap, 0.1.0, Audiobooks as podcasts, 2017-08-03T22:07:38+0000
/project/mads-secrets/, mads-secrets, 0.0.1, PyPi package created by Schibsted's Product & Application Security team., 2021-02-16T08:36:15+0000
/project/wraps/, wraps, 0.0.1, dropbox, 2021-04-19T22:27:14+0000
/project/repository/, repository, 0.0.0.0a0.dev20201217, repository, 2020-12-17T08:57:22+0000
/project/moment/, moment, 0.12.1, Dealing with dates and times should be easy, 2020-11-27T22:37:39+0000
/project/monkey-ioc/, monkey.ioc, 0.0.1.dev4, Simple IOC framework agile as a monkey., 2019-09-16T20:09:40+0000
/project/quickplug/, quickplug, 0.0.1, A general purpose plugin framework for rapid application development and extensibility., 2019-01-30T05:20:07+0000
/project/kpruss/, kpruss, 0.0.3, The Sphinx theme for my website, 2021-04-17T06:21:00+0000
/project/micropie/, micropie, 0.0.0, Async micro-framework to build microservices, 2020-09-30T17:01:56+0000
/project/uvvispy/, uvvispy, 0.1.0.dev6, Package for handling optical absorption data., 2019-09-26T05:22:44+0000
/project/passes/, passes, 0.0.1, apple, 2021-04-19T22:10:11+0000
/project/vmbox/, vmbox, 0.1.1, Manage Virtual Machines with Cloud Images, 2019-02-17T15:08:48+0000
/project/tornado-encookie/, tornado-encookie, 0.0.1, Encrypted cookie support for the Tornado Web Framework, 2013-05-07T21:18:37+0000
/project/cxc-django/, cxc-django, 0.0.4, A django wrapper made by Xiaochen Cui, 2018-01-26T07:16:22+0000
/project/classarg/, classarg, 0.0.2, A library for easily creating CLI applications., 2018-06-17T13:56:32+0000
/project/geojson-elevation/, geojson_elevation, 0.1, GeoJSON compatible elevation proxy, 2015-06-06T22:30:20+0000
/project/pyrm/, PyRM, 0.1.0.0812, PyRM is an open-source "Rechnungs-Manager" using django., 2011-08-12T09:36:41+0000
/project/tf-cpu/, tf-cpu, 0.0.0, , 2019-05-17T23:11:23+0000
/project/pavis/, pavis, 0.0.3, Parallel corpora version control engine, 2020-01-10T07:03:43+0000
/project/urivalue/, urivalue, 0.0.1, apple, 2021-04-19T22:11:52+0000
/project/ghostfn/, ghostfn, 0.0.1, ghostfn is very pog, 2021-04-09T16:35:14+0000
/project/pyrses/, pyrses, 0.0.2, ncurses based TUI framwork, 2017-11-13T22:34:22+0000
/project/popularity/, popularity, 0.0.1, apple, 2021-04-19T22:10:21+0000
/project/tg-ext-repoze-who/, tg.ext.repoze.who, 0.1-r26, tg.ext.repoze.who are repoze.who plugins for TurboGears 2, 2008-06-04T15:12:02+0000
/project/cacao-accounting/, cacao-accounting, 0.0.1.dev20210403, Software contable para micro, pequeñas y medianas empresas., 2021-04-03T19:02:10+0000
/project/dbt-log-parser/, dbt-log-parser, 0.2.1, Parse structured metadata from dbt logs, 2020-12-09T17:51:31+0000
/project/pyvm/, PyVM, 0.0.2, Python for operation between vector and matrix, 2021-04-11T15:01:09+0000
/project/solarwindpy/, solarwindpy, 0.0.1.dev0, , 2019-02-03T02:34:30+0000
/project/netty-finder/, netty-finder, 1.0.0, This is a python verison of the original netty-finder that was written in JavaScript,, 2018-11-12T06:46:49+0000
/project/pytest-cassandra/, pytest-cassandra, 0.1.0, Cassandra CCM Test Fixtures for pytest, 2017-11-04T01:07:53+0000
/project/billojwtsession/, billojwtsession, 0.0.0, internal use, 2021-02-10T19:18:11+0000
/project/fictive-marshmallow/, fictive-marshmallow, 0.0.1, , 2021-02-10T18:25:03+0000
/project/syzygy-docs-themes/, syzygy-docs-themes, 0.1.0.dev1, Sphinx themes for the documentation of Kogia, Caperea and Stenella., 2020-07-19T10:46:44+0000
/project/flyquery/, FlyQuery, 0.1.1, API for accessing FlyBase through url request and parsing out data, 2018-01-19T16:00:56+0000
/project/aggregates/, aggregates, 0.0.1, dropbox, 2021-04-19T22:18:52+0000
/project/bytbil-vehicle-data-api-client/, bytbil-vehicle-data-api-client, 0.0.1, PyPi package created by Schibsted's Product & Application Security team., 2021-02-16T08:34:16+0000
/project/pymove-osmnx/, pymove-osmnx, 0.3.0, A lib python to integrate PyMove and OSMnx, 2021-02-03T17:25:54+0000
/project/pybel-tools/, pybel-tools, 0.9.1, A cool pool of tools for BEL, 2021-01-31T23:36:55+0000
/project/nlpobservability/, nlpobservability, 0.0.1, PyPi package created by Schibsted's Product & Application Security team., 2021-02-16T08:36:48+0000
/project/gordon-dns-gcp/, gordon-dns-gcp, 0.0.1.dev38, GCP Plugins for Gordon and Gordon Janitor, 2021-04-13T20:32:04+0000
/project/eidein/, eidein, 0.0.0, Interactive tool for dimensionality reduction of data and their visualisation., 2020-11-16T09:24:50+0000
/project/billodata/, billodata, 0.0.0, internal use, 2021-02-15T09:34:05+0000
/project/sch-portal/, sch-portal, 0.0.1, PyPi package created by Schibsted's Product & Application Security team., 2021-02-16T08:37:42+0000
/project/failed/, failed, 0.0.1, dropbox, 2021-04-19T22:20:29+0000
/project/laminarflow/, laminarflow, 0.0.7, Streamline your TensorFlow workflow., 2018-06-27T05:04:31+0000
/project/flapjacks/, flapjacks, 0.1.0, A Python project for transcoding videos on AWS and deploying them to Youtube., 2018-02-03T16:43:11+0000
/project/invenio-ext/, invenio-ext, 0.3.2, Invenio module that provides integration with Flask extensions., 2015-10-07T09:44:46+0000
/project/ae-kivy-glsl/, ae-kivy-glsl, 0.1.7, ae_kivy_glsl portion of python application environment namespace package, 2021-02-25T00:47:12+0000
/project/mlos/, mlos, 0.0.30, mlOS test Package, 2021-03-27T05:05:53+0000
/project/cturtle/, cturtle, 0.0.6, A ctypes interface to the TURTLE library, 2018-11-14T21:16:20+0000
/project/incenp-binseqs/, incenp.binseqs, 0.2.1, Support for binary sequence formats in Biopython, 2019-08-21T20:24:33+0000
/project/4711/, 4711, 0.0.2, A collection of CLI tools for working with data structures, parsing and formatting, 2020-06-30T04:25:17+0000
/project/dsml/, dsml, 0.1.2, , 2020-06-01T22:31:16+0000
/project/hexfarm/, hexfarm, 0.0.7, Rutgers HEX Computing Utility Library, 2019-02-10T07:38:51+0000
/project/foxtrader/, foxtrader, 0.0.2, foxtrader, 2019-11-21T11:53:44+0000
/project/babel-compiler/, babel-compiler, 0.0.0.dev0, The compiler for next generation Python., 2019-11-20T06:27:18+0000
/project/qtft-qopt/, qtft-qopt, 0.0.1.dev1, Quantum-inspired optimization algorithms, 2019-07-26T08:22:40+0000
/project/acc/, acc, 0.1.1, Adaptive Cruise Control, 2017-02-03T17:40:25+0000
/project/ae-kivy-file-chooser/, ae-kivy-file-chooser, 0.1.8, ae_kivy_file_chooser portion of python application environment namespace package, 2021-04-03T18:16:54+0000
/project/greatfet/, GreatFET, 2021.2.1, Python library for hardware hacking with the GreatFET, 2021-02-23T15:58:16+0000
/project/hiertest/, hiertest, 0.0.1, microsoft, 2021-04-19T22:00:51+0000
/project/fraction-literal/, fraction-literal, 0.0.1, Experimental syntax for fraction literals, 2020-10-24T12:00:13+0000
/project/pics2word/, pics2word, 0.9.7, A command line program to copy a large number of pictures into a word document., 2018-04-06T13:14:01+0000
/project/airflow-commons/, airflow-commons, 0.0.13, Common functions for airflow, 2021-04-19T08:22:11+0000
/project/firepyer/, firepyer, 0.0.4, Interacting with Cisco FTD devices via the FDM REST API in Python, 2021-03-13T20:37:57+0000
/project/ais-py/, AIS.py, 0.2.2, Python interface for the Swisscom All-in Signing Service, 2018-10-22T14:49:47+0000
/project/aiopulsar/, aiopulsar, 0.0, Async Python client for Apache Pulsar, 2020-05-18T13:44:04+0000
/project/telstra-mobile/, telstra.mobile, 0.1, API for interacting with Telstra's mobile services via cellular modem, 2015-06-05T09:21:41+0000
/project/gomatic-manager/, gomatic-manager, 0.0.1, PyPi package created by Schibsted's Product & Application Security team., 2021-02-16T08:35:16+0000
/project/ecies/, ecies, 0.0.1, google, 2021-04-19T21:11:41+0000
/project/spydal/, spydal, 0.0.1, PyPi package created by Schibsted's Product & Application Security team., 2021-02-16T08:38:46+0000
/project/django-tvdb/, django-tvdb, 0.0.1, TVDB support for Django projects, 2016-09-19T08:31:35+0000
/project/jsonschemaplus/, jsonschemaplus, 0.0.1.dev1, JSON Schema validation for Python, 2016-10-31T04:06:11+0000
/project/unbroadcast/, unbroadcast, 0.0.1, google, 2021-04-19T21:16:03+0000
/project/shortest/, shortest, 0.0.1, apple, 2021-04-19T22:10:38+0000
/project/nucosmq/, nucosMQ, 0.0.9, nucosMQ - a pure python message module, 2017-01-05T17:42:19+0000
/project/tilechips/, tilechips, 0.0.2, A python package to create raster tiles for deep learning training image chips, 2021-03-02T09:05:51+0000
/project/readable/, readable, 0.0.post30, testing and assertion library, 2013-09-24T23:03:26+0000
/project/nrl/, nrl, 0.0.1, Network representation learning in Python, 2019-01-25T12:51:43+0000
/project/logcollection/, logcollection, 0-1-0, logging handler collection, 2015-01-14T16:24:19+0000
/project/tornado-emails/, tornado-emails, 0.0.1, Send email asynchronously in Tornado applications, 2019-02-11T07:50:54+0000
/project/torecsys/, torecsys, 0.0.5, Pure PyTorch Recommender System Module, 2019-09-05T08:53:45+0000
/project/globaltrie-server/, globaltrie-server, 1.0.7, CLI to host Trie Server, 2021-04-25T15:12:59+0000
/project/gsn-provider-scanner/, gsn-provider-scanner, 0.0.1, PyPi package created by Schibsted's Product & Application Security team., 2021-02-16T08:35:38+0000
/project/cfdtools/, cfdtools, 0.0.1, Tools for mesh and solution management in CFD, 2021-03-12T21:25:29+0000
/project/entity-extract/, entity_extract, 0.0.1, Used for the entity extraction of a text and a corpora and to comapre and reduce entity lists, 2017-10-31T09:56:09+0000
/project/interact-ai/, interact-ai, 0.0.1, Interact AI, 2021-01-28T01:16:37+0000
/project/maseya-z3pr/, maseya-z3pr, 1.0.0rc1, Randomize palette data for Legend of Zelda: A Link to the Past., 2020-09-11T05:25:48+0000
/project/flake8-name-migrations/, flake8-name-migrations, 0.1.0, Flake8 hook for reminding you to give your Django migrations human readable names, 2021-03-28T13:06:23+0000
/project/taz/, taz, 0.1.0, Taz Framework, 2015-03-05T21:15:01+0000
/project/img2url/, img2url, 0.2.0, upload image to github and return corresponding url., 2016-08-20T13:08:12+0000
/project/telebot-utils/, telebot-utils, 0.0.8, Utils for pyTelegramBotAPI module, 2020-12-05T14:36:52+0000
/project/swaggerpython/, swaggerpython, 0.2.3, Library for accessing Swagger-enabled API's, 2018-02-01T11:25:18+0000
/project/invenio-trends-ui/, invenio-trends-ui, 1.0.0a1, UI for Invenio-Search., 2016-08-26T15:15:32+0000
/project/datadog-monitors-linter/, datadog-monitors-linter, 0.0.1, PyPi package created by Schibsted's Product & Application Security team., 2021-02-16T08:34:48+0000
/project/pingme/, pingme, 0.0.1, Cli for Pingme Android application., 2015-01-02T05:30:06+0000
/project/tg-bot/, tg-bot, 0.1.0, Framework for bot creation in Telegram.
, 2017-07-16T23:43:08+0000
/project/keywordtree/, keywordtree, 0.1.6, , 2019-06-02T22:19:39+0000
/project/lightcurve-pipeline/, lightcurve-pipeline, 1.0, Create lightcurves from HST/COS and HST/STIS data, 2016-03-18T20:34:07+0000
/project/ate-ds-dal/, ate-ds-dal, 0.0.1, PyPi package created by Schibsted's Product & Application Security team., 2021-02-16T08:32:53+0000
/project/uiplug/, uiplug, 0.0.1, Nothing, 2019-09-11T20:51:09+0000
/project/odltools/, odltools, 0.1.34, Tools for troubleshooting OpenDaylight, 2019-07-30T06:50:56+0000
/project/accuracy/, accuracy, 0.0.1, cisco, 2021-04-19T22:33:35+0000
/project/ionyweb/, ionyweb, 0.3, A javascript UI based on REST API CMS based on Django., 2012-11-25T09:14:44+0000
/project/formkit/, formkit, 0.5.0a1, A kit for rapid development of powerful input forms., 2015-09-22T19:29:47+0000
/project/flask-mm/, flask-mm, 0.0.13.dev0, Media Manager for flask, 2020-02-28T16:14:53+0000
/project/yaq/, yaq, 0.0.0, Yet another acquisition., 2017-09-21T03:15:00+0000
/project/caldavxml/, caldavxml, 0.0.1, apple, 2021-04-19T22:08:01+0000
/project/durationvalue/, durationvalue, 0.0.1, apple, 2021-04-19T22:08:29+0000
/project/sk/, sk, 0.0.1, Utilities for scikit-learn to quickly build and experiment with machine learning models., 2019-10-16T21:51:41+0000
/project/django-graphql-countries/, django-graphql-countries, 0.0.5, GraphQL implementation for countries, 2018-01-30T15:19:22+0000
/project/gelu/, gelu, 0.0.1, google, 2021-04-19T21:12:07+0000
/project/mimid/, mimid, 0.0.8, Modern mocking library for Python., 2020-12-02T23:16:32+0000
/project/datadog-cli/, datadog-cli, 0.0.1, PyPi package created by Schibsted's Product & Application Security team., 2021-02-16T08:34:44+0000
/project/nn/, nn, 0.1.1, A neural network library built on top of TensorFlow for quickly building deep learning models., 2020-01-27T12:01:45+0000
/project/oracle-river/, oracle_river, 1.0.2, Charger des donnees oracle vers Elasticsearch / Load data from oracle to Elasticsearch, 2016-04-05T11:11:07+0000
/project/transmuter/, transmuter, 0.0.0, Docstring parser and transmuter, 2021-03-21T11:23:35+0000
/project/dotsite/, dotsite, 0.3.9, Python modules often used in dotjab, and elsewhere, 2017-05-07T17:14:23+0000
/project/sesame-package-tools/, sesame-package-tools, 0.4.2, Sesame Packaging Tools for building Conan recipes, 2020-07-08T03:21:15+0000
/project/inspire-crawler/, inspire-crawler, 3.0.4, Crawler integration with INSPIRE-HEP., 2019-08-14T10:19:56+0000
/project/cpc-stats/, cpc.stats, 1.3.5, Set of utilities to perform statistical calculations, 2019-03-14T14:54:23+0000
/project/hikari-tanjun/, hikari-tanjun, 1.0.1a3, A flexible command client designed to extend Hikari, 2021-01-17T20:39:43+0000
/project/topic999/, topic999, 1.0.1.dev1, Topic Model User Evaluation, 2017-06-22T09:23:57+0000
/project/djangorave/, djangorave, 0.1.2, Django integration for Flutterwave Rave Card payments and subscriptions, 2020-12-16T11:50:32+0000
/project/mp-locustio/, mp-locustio, 0.0.1, PyPi package created by Schibsted's Product & Application Security team., 2021-02-16T08:36:38+0000
/project/dirname/, dirname, 0.0.1, twitter, 2021-04-19T21:22:28+0000
/project/tensorspacejs/, tensorspacejs, 0.2.0, TensorSpace.js Python tool package, 2019-04-19T21:20:44+0000
/project/django-miniblog/, django-miniblog, 0.1.0, Django application for managing a simple blog., 2020-09-01T08:53:32+0000
/project/aidkitmlevaluate/, aidkitmlevaluate, 0.1.0, A test Python package for an interface to evaluate ML models, 2020-11-16T08:18:30+0000
/project/geovalue/, geovalue, 0.0.1, apple, 2021-04-19T22:08:43+0000
/project/strawboss/, strawboss, 0.2.0, Procfile runner, 2016-01-07T21:35:47+0000
/project/bigmouth/, bigmouth, 0.1.3, Django interface to the Pelican static blog generator., 2012-02-06T06:54:19+0000
/project/mete0r-zipedit/, mete0r.zipedit, 0.0.1, ZipFile editing, 2017-04-02T14:32:00+0000
/project/simono-especificaciones/, simono-especificaciones, 0.1.8, Especificaciones de Sensores para Sistema de Monitoreo de Nodos, 2020-08-20T20:12:02+0000
/project/visibudget/, visibudget, 0.1.0, Visual budget management, 2019-01-05T02:12:17+0000
/project/wok-compiler/, wok-compiler, 0.1.0, Advanced yet human-readable markup language, 2019-11-12T12:55:53+0000
/project/apps/, apps, 0.0.0.0.dev20200918, , 2020-09-18T06:21:52+0000
/project/econopy/, econopy, 0.0.3, Simple economic utilities, 2018-04-13T17:00:13+0000
/project/sptvis/, sptvis, 0.0.1, PyPi package created by Schibsted's Product & Application Security team., 2021-02-16T08:38:45+0000
/project/utils-flask-sqlalchemy/, utils-flask-sqlalchemy, 0.1.4, Python lib of tools for Flask and SQLAlchemy, 2021-02-03T15:21:36+0000
/project/eazy/, eazy, 0.3.0, Pythonic photo-zs modeled after EAZY, 2020-08-13T14:44:26+0000
/project/innovative/, innovative, 0.0.0.0.0.0a0.dev20201230, innovative, 2020-12-29T17:18:31+0000
/project/rdfa2rdf/, rdfa2rdf, 0.1, WSGI proxy for transforming RDFa to RDF via RDFa2RDFXML.xsl., 2007-09-26T00:08:25+0000
/project/pantherapy/, pantherapy, 0.0.3.dev0, 1D hydraulics, 2020-02-27T21:56:23+0000
/project/pylumi/, pylumi, 1.2.2, Python API for interacting with Pulumi resource plugins., 2020-11-28T03:38:21+0000
/project/reactive/, reactive, 0.1, Python ReactiveStreams library, 2017-01-31T17:13:24+0000
/project/aiostorage/, aiostorage, 0.1.16, Asynchronous object storage, 2019-02-10T13:38:37+0000
/project/conduct/, conduct, 0.0.0, Lightning nodes conductor, with a code., 2020-05-02T20:56:32+0000
/project/waytwo/, waytwo, 0.0.1, Automated REST API for way2sms, 2018-01-20T14:40:22+0000
/project/flask-resources/, flask-resources, 0.7.2, Flask Resources module to create REST APIs., 2021-04-16T06:57:48+0000
/project/beholder/, beholder, 0.0.0, A lightweight and easy to use folder watcher, 2017-10-27T02:01:09+0000
/project/bajson/, bajson, 0.0.6, library for converting to/from json, 2020-12-29T11:32:43+0000
/project/rest-easy/, rest-easy, 0.0.1.dev0, Makes ReST Easy - Work in Progress, 2018-02-16T00:56:49+0000
/project/kidibox-py/, kidibox-py, 0.1.3, A Python library to interact with kidibox-api, 2016-02-15T23:46:35+0000
/project/trigdistrs/, trigdistrs, 0.0a1, Trigonometric Probability Distributions (see Souza 2016: NEW TRIGONOMETRIC CLASSES OF PROBABILISTIC DISTRIBUTIONS, PhD Thesisavailable at http://goo.gl/Z6nbJz).
Uses symbolic computing with sympy.stats., 2016-09-06T20:54:59+0000
/project/pyomics/, PyOmics, 0.0.1.dev6, A library for dealing with omic-data in the life sciences, 2017-04-17T18:58:42+0000
/project/xchacha/, xchacha, 0.0.1, google, 2021-04-19T21:16:53+0000
/project/invenio-workflows-ui/, invenio-workflows-ui, 2.0.19, Invenio module which acts as a UI layer for invenio-workflows., 2020-01-24T08:52:14+0000
/project/qcaus/, qcaus, 0.0.0, A Python library for quantum causality., 2020-10-03T15:03:44+0000
/project/viktor-cli/, viktor-cli, 0.0.0, viktor cli, 2020-10-26T09:24:54+0000
/project/rollingrank/, rollingrank, 0.3.1, fast rolling rank for numpy, 2020-05-30T21:55:52+0000
/project/shelvelogin/, shelveLogin, 0.0.4, A simple user management system, 2021-04-03T05:14:11+0000
/project/tlfp/, tlfp, 0.0.3, Data generator for the-law-factory project lafabriquedelaloi.fr, 2019-10-26T23:04:55+0000
/project/prisjakt-feed-validation-utils/, prisjakt-feed-validation-utils, 0.0.1, PyPi package created by Schibsted's Product & Application Security team., 2021-04-15T10:52:31+0000
/project/moonroof/, moonroof, 0.0.5, Client library for moonroof, 2020-06-03T21:50:15+0000
/project/blurr/, blurr, 0.4.1, Data aggregation pipeline for running real-time predictive models, 2018-06-20T00:07:31+0000
/project/csv-dispatcher/, csv-dispatcher, 0.0.1, Description., 2021-03-30T07:00:04+0000
/project/conan-recipe-generator/, conan-recipe-generator, 0.0.1, Generate conan recipe from a source release, 2020-08-07T20:43:21+0000
/project/pd3-plot/, pd3-plot, 1.0.1, pd3_plot is a utility for visulizing simulations from pd3., 2020-08-10T18:38:58+0000
/project/realpython/, realPython, 0.1.1, This is a python package containing handy things like advanced and basic math calculations and translations., 2021-02-21T17:34:17+0000
/project/mauscope/, mauscope, 1.0.1, Microscopy stage., 2018-07-13T17:39:24+0000
/project/pyulog-selab/, pyulog-Selab, 1.0.6, Python log parser for ULog., 2021-03-19T11:02:21+0000
/project/barracuda/, Barracuda, 0.0.2, Framework for controlling ground equipment, 2020-05-05T18:37:55+0000
/project/mail-service/, mail-service, 1.0.5, Sending email using various services., 2020-10-26T13:15:24+0000
/project/quackdns/, quackdns, 0.3.1, Keeps your DuckDNS IP information updated., 2019-01-28T09:56:35+0000
/project/neural-transfer/, neural-transfer, 0.0.5, A small example package, 2020-09-07T15:23:53+0000
/project/skydance/, skydance, 0.1.2, A library for communication with Skydance Wi-Fi relays., 2021-01-17T20:49:55+0000
/project/pygrate/, pygrate, 0.0.3, Migration tools for python, 2019-12-12T05:38:00+0000
/project/tornado-api/, tornado-api, 0.0.1, Async APIs with Tornado, 2019-02-11T07:51:02+0000
/project/nekbot-protocols-irc/, nekbot.protocols.irc, 0.1.0.16, IRC Protocol for Nekbot, a modular multiprotocol bot., 2015-05-23T16:26:17+0000
/project/libicu/, libicu, 0.0.1, apple, 2021-04-19T22:09:24+0000
/project/appstore/, appstore, 0.0.4, App Store -- user-oriented front-end for pip., 2019-07-06T05:01:13+0000
/project/s3-dumps/, s3-dumps, 0.2.1, A package for backup DB and store in s3, 2019-05-09T18:19:31+0000
/project/mork/, mork, 0.1.4, A project for installing packages across the virtualenv boundary., 2018-09-29T19:07:10+0000
/project/napari-tracking/, napari-tracking, 0.0.0, napari tracking plugin., 2020-02-02T21:11:09+0000
/project/httplens/, httplens, 0.0.1, A Collection of http debugging and testing tools, 2021-04-04T19:26:13+0000
/project/purelazy/, purelazy, 0.0.0, , 2021-04-16T12:24:38+0000
/project/sibus-lib/, sibus-lib, 0.2.2, Library for SiBus elements, 2018-03-30T21:31:33+0000
/project/stonk/, stonk, 0.0.1, A set of tools to pull and analyze stock data., 2020-04-27T23:21:36+0000
/project/pybel-git/, pybel-git, 0.1.0, PyBEL Git utilities, 2019-11-20T00:21:12+0000
/project/microscan/, microscan, 0.0.2, Python driver from Microscan barcode readers, 2018-05-07T07:30:35+0000
/project/midia/, MIDIA, 0.0.2, Description., 2019-11-21T15:11:20+0000
/project/pynebl/, pynebl, 0.0.1, , 2018-04-18T17:03:22+0000
/project/lldbsuite/, lldbsuite, 0.0.1, apple, 2021-04-19T22:09:36+0000
/project/arger/, arger, 1.3.8, Create argparser automatically from functions, 2021-04-11T08:22:46+0000
/project/edison/, edison, 0.0.2, Absurdity as a Service, 2014-02-04T06:19:01+0000
/project/shared-metrics/, shared-metrics, 0.0.1, PyPi package created by Schibsted's Product & Application Security team., 2021-02-16T08:38:34+0000
/project/cxc-toolkit/, cxc-toolkit, 0.6.2, Toolbox contains a lot of utility functions, 2019-01-22T02:38:56+0000
/project/tornado-forms/, tornado-forms, 0.0.1, Build HTML forms from any data source in Tornado applications, 2019-02-11T07:50:50+0000
/project/messaging-model-io/, messaging-model-io, 0.0.1, PyPi package created by Schibsted's Product & Application Security team., 2021-02-16T08:36:24+0000
/project/mimus/, mimus, 0.0.0, create mock service with ease, 2020-01-02T02:48:50+0000
/project/sxrobot/, sxrobot, 1.0.0.dev1, A wechat robot, 2017-05-19T08:00:21+0000
/project/async-stripe/, async-stripe, 0.1.2, An asynchronous wrapper for the Stripe payment API., 2019-06-11T14:52:57+0000
/project/pyradiosky/, pyradiosky, 0.1.1, Python objects and interfaces for representing diffuse, extended and compact astrophysical radio sources, 2021-02-17T20:16:50+0000
/project/vivid-store/, vivid-store, 0.0.1, Catalog Server and Algorithm Repository, 2019-09-23T13:15:21+0000
/project/metalab/, MetaLab, 0.0.0.0a0.dev20201217, MetaLab, 2020-12-17T09:06:37+0000
/project/invenio-circulation/, invenio-circulation, 1.0.0a30, Invenio module for the circulation of bibliographic items., 2021-01-27T15:24:40+0000
/project/precognit/, precognit, 0.0.0, , 2019-01-10T09:03:17+0000
/project/djnext/, djnext, 0.0.2, Django-NextJS Isomorphic UI dev with Decorator pattern, 2018-05-12T12:03:13+0000
/project/django-filemanager-lte/, django-filemanager-lte, 0.0.7, Template for reusable django applications mod django-suit, 2016-12-23T18:55:36+0000
/project/passwords/, passwords, 0.2.0, Passwords for everyone., 2013-05-25T09:00:19+0000
/project/aqlbasic/, aqlbasic, 0.0.2, A simple package to connect to mysql easily, 2021-02-25T17:49:36+0000
/project/missioncontrol-client/, missioncontrol-client, 0.0.3, python client for the missioncontrol api, 2019-03-11T23:52:51+0000
/project/pyleo/, pyleo, 0.0.13, Unofficial Lingualeo API python library, 2019-04-06T04:28:56+0000
/project/furious-fastas/, furious-fastas, 0.1.5, Module to update the fastas., 2019-07-30T16:22:35+0000
/project/hsaquery/, hsaquery, 0.2.0, Python tools for querying the ESA Hubble Science Archive, 2018-08-31T13:04:47+0000
/project/django-zendesk/, django-zendesk, 0.0.1, Django application for handling HTTP target callbacks from Zendesk., 2013-07-09T18:43:33+0000
/project/mymodel/, mymodel, 0.0.1, Valve, 2021-04-19T22:46:53+0000
/project/nlpcorepy/, nlpcorepy, 0.0.1, PyPi package created by Schibsted's Product & Application Security team., 2021-02-16T08:36:47+0000
/project/advapi/, advapi, 0.0.1, microsoft, 2021-04-19T21:59:05+0000
/project/hffe/, hffe, 0.0.13, Implements high-frequency financial econometrics tools., 2019-03-04T18:50:38+0000
/project/vaurien/, vaurien, 1.9, TCP Chaos Proxy, 2014-06-21T10:13:45+0000
