/project/gdirsync/, Gdirsync, 0.1.0, Simple multi-platform file syncing tool, 2020-01-15T21:08:57+0000
/project/padua/, padua, 0.1.16, A Python interface for Proteomic Data Analysis, working with MaxQuant & Perseus outputs, 2019-03-11T13:40:51+0000
/project/gmailwatcher/, gmailwatcher, 11.10.19, A desktop gmail notifier for Ubuntu OS, 2011-10-30T18:16:41+0000
/project/gooeydev/, GooeyDev, 1.0.3.5, Gooey (made by Chris Kiehl) turns (almost) any command line program into a full GUI application with one line. This a custom release of the development branch (1.0.3) of gooey., 2019-10-30T13:18:46+0000
/project/ecsu-mid-project/, ECSU_Mid_Project, 1.1, Extracts HTML data with python regex and convert the data to a csv file, 2018-10-09T18:05:36+0000
/project/awd/, awd, 1.3.4, a window director;, 2019-01-16T00:32:43+0000
/project/file-converter/, File_Converter, 0.1, Make me them backups, 2018-10-04T15:28:11+0000
/project/pystiler/, pystiler, 0.4.1, Python simple tiler for non-tiling window managers, 2018-01-01T21:09:56+0000
/project/wpcraft/, wpcraft, 1.2.3, A CLI for fetching wallpapers from WallpapersCraft, 2018-12-01T16:19:04+0000
/project/bitdust/, bitdust, 0.0.2, BitDust is a decentralized on-line storage network for safe, independent and private communications., 2019-05-11T17:54:37+0000
/project/ye-tui/, ye-tui, 0.1.6, yet is a console (kind of rss) application to download youtube videos., 2021-01-30T17:21:55+0000
/project/reloci/, reloci, 2, Organize photos based on exif, 2021-04-11T20:11:35+0000
/project/openlp/, OpenLP, 2.9.2, Open source Church presentation and lyrics projection application., 2020-12-21T18:27:11+0000
/project/ansi-interactive-search/, ansi-interactive-search, 0.0.2, Ansi based interactive search UI, 2018-07-02T06:02:04+0000
/project/webappify/, WebAppify, 0.3, Create desktop apps of your favourite websites, 2017-08-11T17:43:24+0000
/project/bellite/, bellite, 1.4.22, Create desktop applications for Mac OSX (10.7 & 10.8) and Windows XP, 7 & 8 using modern web technology and Python (Node.js or Ruby or PHP or Java)., 2013-04-19T15:10:02+0000
/project/rapidpro-pull/, rapidpro-pull, 1.0.3, An open-source tool to pull and cache data from RapidPro servers., 2017-02-02T17:46:27+0000
/project/vocball/, vocball, 1.1.0, Play vocabulary football in class, 2019-12-27T12:25:01+0000
/project/dirsync/, dirsync, 2.2.5, Advanced directory tree synchronisation tool, 2020-07-31T23:21:46+0000
/project/mirage-linemode/, mirage-linemode, 0.1.1, Customizable linemode plugin for ranger., 2020-08-01T14:35:37+0000
/project/win2xcur/, win2xcur, 0.0.3, win2xcur is a tool to convert Windows .cur and .ani cursors to Xcursor format., 2020-10-03T05:57:03+0000
/project/delivery/, delivery, 0.0.2, Simple, multiplatform interface for desktop notifications, 2019-06-21T17:03:47+0000
/project/pytest-qt/, pytest-qt, 3.3.0, pytest support for PyQt and PySide applications, 2019-12-07T13:38:10+0000
/project/text-based-switcher/, text-based-switcher, 0.0.2.dev0, Text-based window switcher for Unity, 2015-07-23T15:51:42+0000
/project/sotlogger/, sotlogger, 1.0, SOT Library, Maintain event logs in casandra database using python connection script., 2014-10-15T08:17:06+0000
/project/envswitch/, envswitch, 1.4.1, A very simple GUI and CLI to manage environment variables., 2017-10-23T11:43:21+0000
/project/jamd-viewer/, jamd-viewer, 0.8, A multiplatform desktop markdown viewer powered by flask-desktop-ui., 2020-11-16T05:39:28+0000
/project/pywincmdtheme/, pywincmdtheme, 0.1.10, pywincmdtheme v. 0.1.7

Tool that can change color theme for windows cmd andpowershell. Uses ~/.Xresources file that defines 16 standard colors,background color and foreground color., 2013-01-13T13:19:28+0000
/project/photo-namer-nautilus/, photo-namer-nautilus, 0.0.6, Photo namer nautilus file manager script for files imported with CatGrab phpto import app., 2016-08-15T17:56:35+0000
/project/lnk/, lnk, 0.1.4, A command-line URL-shortening client., 2015-09-19T19:37:22+0000
/project/cterm/, cterm, 0.0.9, Fork your input to multiple Terminal windows, 2020-01-20T12:02:50+0000
/project/desktopography/, desktopography, 1.2, A simple desktopography.net wallpaper retriever, 2020-06-17T16:13:27+0000
/project/demomgr/, Demomgr, 1.7.6, TF2 demo file management tool written in Python and Tcl, using tkinter., 2021-04-23T15:49:13+0000
/project/sync/, sync, 1.0.0, Python cile copy utility, 2014-12-14T05:42:24+0000
/project/rat/, Rat, 0.1, Rat is a library for simplifying common tasks of PyGtk and gnome-python, 2006-01-31T01:56:45+0000
/project/xinput-gui/, xinput-gui, 0.3.1, A simple GUI for Xorg's Xinput tool., 2019-07-20T05:03:14+0000
/project/ranger-fm/, ranger-fm, 1.9.3, Vim-like file manager, 2020-01-01T19:51:42+0000
/project/rnr/, rnr, 1.0.4, The RNR File Manager (RNR's Not Ranger), 2021-03-28T14:46:56+0000
/project/wasanbon/, wasanbon, 1.1.0.post5, Development Framework for Robotics Technology Middleware (RTM), 2018-07-17T05:59:55+0000
/project/xontrib-apipenv/, xontrib-apipenv, 0.4.0, Auto activate a Pipenv virtual environment, 2019-05-29T10:51:35+0000
/project/wx-icons-tango/, wx-icons-tango, 0.1.1, description goes here, 2020-04-16T19:20:17+0000
/project/movielist/, MovieList, 1.5.1, A utility to catalogue and play media., 2016-12-11T15:44:07+0000
/project/dbussy/, DBussy, 1.3, language bindings for libdbus, for Python 3.5 or later, 2020-05-23T23:33:55+0000
/project/orderpy/, orderPy, 1.0, A python script for windows that will order a disordered set of files by their date of creation or last modification., 2017-11-05T18:17:54+0000
/project/your-notes/, your-notes, 0.1, a), 2019-07-06T18:23:09+0000
/project/wx-icons-humanity/, wx-icons-humanity, 0.1.3, Humanity and Humanity Dark icon themes for wxPython 🐍, 2020-08-03T11:18:42+0000
/project/event-simulate/, event-simulate, 1.0.4, 模拟键盘,鼠标事件的Python包。A Python package simulating keyboard and mouse eventsAuthor: 七分诚意, 2021-03-27T06:07:11+0000
/project/os-sys-linux/, os-sys-linux, 0.0.0.dev0, a big lib with many usefull tools and it are not only os and sys tools..., 2020-01-04T10:12:51+0000
/project/musicbutler/, musicbutler, 0.1.7, A robot that receives voice commands to play albums from your MP3 collection, 2008-08-18T20:22:20+0000
/project/osd-neo2/, OSD-neo2, 0.15, On screen display for learning the keyboard layout Neo2, 2020-06-05T14:32:38+0000
/project/gnome-shell-install-extension/, gnome-shell-install-extension, 1.1.0, Install Gnome Shell extension from zip files., 2018-11-27T09:37:35+0000
/project/linker/, linker, 0.1.0, link files based on name, 2014-04-04T20:54:24+0000
/project/wx-icons-suru/, wx-icons-suru, 0.1.2, Suru icon theme for wxPython 🐍, 2020-08-03T16:50:01+0000
/project/count-files/, count-files, 1.5.0, A command-line interface (CLI) utility that helps you count all the files or search for files with a certain file extension (or without it) in the specified directory., 2019-08-09T19:13:51+0000
/project/python-package-sync-tool/, python-package-sync-tool, 0.5.3, Small tool to sync package from different machines, 2020-12-17T15:44:10+0000
/project/vsucs4900c/, vsucs4900c, 0.1, Demo for building a Python project, 2020-04-10T08:24:48+0000
/project/buildboticon/, buildboticon, 0.3.2, A buildbot monitoring utility, 2011-01-22T11:21:24+0000
/project/qtwidgets/, qtwidgets, 0.18, Custom widget library for PyQt5 and PySide2 (Qt for Python). Free to use in your own applications., 2021-01-06T12:46:52+0000
/project/gsnodegraph/, gsnodegraph, 0.1.4, Powerful nodegraph widget for wxpython GUIs, 2021-04-18T23:10:33+0000
/project/kvuilder/, kvuilder, 1.0.1, Kivy Project Template Builder, 2020-08-14T11:33:00+0000
/project/pybingwallpaper/, PyBingWallpaper, 1.5.6, A simple Bing.com wallpaper downloader, 2019-05-01T04:49:32+0000
/project/xsession-manager/, xsession-manager, 1.0.1, A command line to save and restore sessions for X11 desktops like Gnome, with many other features, 2020-11-21T04:17:31+0000
/project/python-fsutil/, python-fsutil, 0.4.0, file-system utilities for lazy devs., 2020-12-23T13:25:25+0000
/project/ws-grid-pager/, ws-grid-pager, 0.2, A workspace grid pager for EMWH-compliant window-managers, 2016-01-22T15:41:30+0000
/project/spyke/, spyke, 0.1, A skype connection manager., 2009-08-07T13:36:02+0000
/project/gi-docgen/, gi-docgen, 2021.5, Documentation tool for GObject-based libraries, 2021-04-15T15:11:51+0000
/project/m79atomic/, m79atomic, 2.0.1, minus79's atomic libs, 2015-11-18T16:21:45+0000
/project/ezdialog/, EzDialog, 1.5.2, A simple dialog window library for early Python programmers, 2015-10-06T18:05:49+0000
/project/i3menu/, i3menu, 3.0, a set of menus based on Rofi or dmenu to interact with i3wm, 2016-03-04T19:03:17+0000
/project/slprint11-pkg/, slprint11-pkg, 1.1, Simple module to display a text with a time interval between each characters., 2020-05-02T00:11:08+0000
/project/image-rename/, image-rename, 0.2.0, Rename the picture by looking through the human eye and typing. (you don't need to open the file by yourself), 2020-10-11T16:50:34+0000
/project/ecsuconvert-1/, ECSUConvert_1, 0.5, Demo for building a Python project, 2018-10-02T16:19:47+0000
/project/pygmount/, pygmount, 0.9.3, Software for graphical mount network shares., 2014-04-03T12:26:59+0000
/project/pygpsclient/, PyGPSClient, 1.0.5, PyGPSClient GNSS/GPS Graphical Client, 2021-04-24T07:57:15+0000
/project/sqlitely/, SQLitely, 1.2, SQLite database tool, 2020-09-22T18:37:13+0000
/project/xontrib-ssh-agent/, xontrib-ssh-agent, 1.0.12, SSH agent integration for xonsh, 2020-04-05T19:17:04+0000
/project/civ5-wallpapers/, civ5-wallpapers, 1.0.0, Use Civilization V wallpapers on your Linux desktop, 2016-10-09T15:40:13+0000
/project/pynotifyd/, pynotifyd, 0.0.2, Simple notification server, 2018-07-10T19:46:18+0000
/project/pyprof2calltree/, pyprof2calltree, 1.4.5, Help visualize profiling data from cProfile with kcachegrind and qcachegrind, 2020-04-19T10:39:09+0000
/project/ezno-convert/, ezno-convert, 0.0.5b4, Convert office files quickly and easily through CLI, GUI, or windows explorer context menu, 2021-02-10T05:35:47+0000
/project/nwqt4/, nwqt4, 0.2, A new-wallpaper.org client, 2011-11-27T10:49:40+0000
/project/lazydog/, lazydog, 0.1.1, User-level filesystem event observer, 2018-05-03T15:31:21+0000
/project/xontrib-fzf-widgets/, xontrib-fzf-widgets, 0.0.4, fzf widgets for xonsh, 2020-10-16T10:43:06+0000
/project/pyerge/, pyerge, 0.3.7, Various tools to emerge and to show status for conky, 2020-11-17T14:13:18+0000
/project/moderngl-beta/, ModernGL-beta, 5.0.2, ModernGL: PyOpenGL alternative, 2017-11-21T05:42:23+0000
/project/xontrib-pyenv/, xontrib-pyenv, 1.0.4, Pyenv integration for xonsh, 2020-06-10T05:51:54+0000
/project/holyview/, HolyView, 0.1, Ncurse tool to help you choose what you want to do, 2011-02-24T09:48:13+0000
/project/pyqubes/, pyqubes, 0.0.3, QubesOS dom0 automation in Python, 2017-05-01T01:45:24+0000
/project/audman/, audman, 0.3.1, Control the audacious media player., 2015-09-29T21:03:09+0000
/project/copyusb/, copyusb, 1.1.0, Copy connected USB media device to current script directory., 2017-02-23T11:44:28+0000
/project/codethemes/, codethemes, 0.1.4, Import visual studio themes as linux terminal theme profiles, 2019-06-01T13:25:03+0000
/project/swaytools/, swaytools, 0.1.0, Quality of life tools for sway, 2020-02-07T06:24:39+0000
/project/wx-icons-adwaita/, wx-icons-adwaita, 0.1.2, Adwaita icon theme for wxPython 🐍, 2020-08-03T08:14:29+0000
/project/xprofile/, xprofile, 1.2.0, A tool to manage and automatically apply xrandr configurations., 2015-05-17T17:51:12+0000
/project/sun/, sun, 1.3.1, Tray notification applet for informing about package updates in Slackware, 2021-01-03T15:50:39+0000
/project/xontrib-powerline-binding/, xontrib-powerline-binding, 0.3.1, Powerline binding for xonsh, 2020-10-03T10:47:58+0000
/project/cinnamon-udev-locker/, cinnamon-udev-locker, 0.1.0, Lock Cinnamon desktop session on device removal (i.e YubiKey), 2017-04-04T11:13:21+0000
/project/ffsuspend/, ffsuspend, 0.1, Suspend processes when X window not visible (i3-wm only), 2020-06-04T14:00:51+0000
/project/ecsuproject-2/, ECSUProject_2, 0.1, Demo for building a Python project, 2018-10-03T05:36:14+0000
/project/ewmh-ext/, ewmh-ext, 1.0.1, ewmh ext;, 2018-12-03T18:06:29+0000
/project/count-money/, count-money, 0.7.1, A tkinter based GUI application that helps you count money., 2019-08-12T01:20:28+0000
/project/yawttk/, yawTtk, 1.0.5, yawTtk is a Python wrapper for Tile. It provides classes which allow the display, positioning and control of native look'n feel widgets., 2017-07-23T21:56:35+0000
/project/pytest-dbus-notification/, pytest-dbus-notification, 1.0.1, D-BUS notifications for pytest results., 2014-03-05T16:17:47+0000
/project/galacteek/, galacteek, 0.5.0, Browser for the distributed web, 2021-03-16T17:55:02+0000
/project/sftpman-gtk/, sftpman-gtk, 1.0.3, A GTK frontend for SftpMan, which helps you mount SFTP file systems., 2019-04-12T07:32:30+0000
/project/pyremote/, pyremote, 0.1, Provides a Python-compatible interface for the Apple Remote, 2010-08-16T18:25:31+0000
/project/arknightspaintingextract/, ArknightsPaintingExtract, 1.2.1, an tool to work with arknights Texture2D, 2019-06-22T14:26:56+0000
/project/tkinter-help/, tkinter.help, 2.0, Small Preview of Tkinter Widgets, 2011-02-07T15:56:44+0000
/project/qtile-plasma/, qtile-plasma, 1.5.6, A flexible, tree-based layout for Qtile, 2021-02-21T06:28:25+0000
/project/music-scraper/, music_scraper, 1.1.0, Gets Songs from the web and allows users to download the same, 2016-07-29T16:10:44+0000
/project/save-thread-result/, save-thread-result, 0.0.6, Simple subclass wrapper around `threading.Thread` to get the return value from a thread in python (from `threading` built-in module in Python Standard library). Exact same interface for creating an instance of this threading sublcass as `threading.Thread`!, 2021-02-08T00:27:52+0000
/project/desktop3/, desktop3, 0.5.3, Simple desktop integration for Python., 2019-08-19T14:12:17+0000
/project/pymaxquant/, pyMaxQuant, 0.1.0, A Python interface for working with MaxQuant & Perseus outputs, 2015-10-28T15:37:28+0000
/project/py7file/, py7file, 0.7.4, Convenient File Handling Library, 2011-11-19T23:25:20+0000
/project/py3status-ups-battery-status/, py3status-ups-battery-status, 0.1.2, py3status module to show the status of a UPS battery, 2021-03-07T05:07:22+0000
/project/freshwall/, freshwall, 1.1.2, GNOME 2 wallpaper changer, 2009-04-06T17:19:35+0000
/project/htmltocsv/, HTMLtoCSV, 0.1, Program for taking table in html and outputting in csv file., 2018-10-04T15:50:27+0000
/project/hyperparameter-hunter/, hyperparameter-hunter, 3.0.0, Easy hyperparameter optimization and automatic result saving across machine learning algorithms and libraries, 2019-08-06T08:52:20+0000
/project/pi3-switch/, pi3-switch, 0.5.2, More advanced workspace switcher for i3., 2018-09-10T17:41:58+0000
/project/asyncluster/, AsynCluster, 0.3, Asynchronous cluster management based on the Twisted framework, with evolutionary computing tools for asynchronous node processing., 2008-03-23T05:10:55+0000
/project/cricket-score-indicator/, cricket-score-indicator, 5.0, An indicator to show live cricket(domestic/international) scores, 2018-03-03T10:13:40+0000
/project/jade-application-kit/, Jade-Application-Kit, 3.5.6, Create native web wrappers or write hybrid Desktop applications on Linux, with Python, JavaScript, HTML, and Blink, 2020-11-20T01:24:14+0000
/project/blackpanther-pydialog/, blackPanther-pydialog, 0.9.8, PyDialog [PyQt5] is a new dialog instead kdialog or zenity, 2018-12-03T22:21:19+0000
/project/wallpoppy/, WallPoppy, 0.1.0, Simple wallpaper daemon using feh, 2018-12-25T01:12:33+0000
/project/xontrib-thefuck/, xontrib-thefuck, 0.3.6, Xonsh extension for thefuck, 2019-03-07T11:19:01+0000
/project/asyncdbus/, asyncdbus, 0.4.1, A zero-dependency async DBus library, 2021-02-22T14:43:48+0000
/project/xontrib-repa-prompt/, xontrib-repa-prompt, 0.0.5, Custom prompt for xonsh, 2020-06-09T17:53:55+0000
/project/ds-store/, ds-store, 1.3.0, Manipulate Finder .DS_Store files from Python, 2020-10-15T08:28:01+0000
/project/jeepney/, jeepney, 0.6.0, Low-level, pure Python DBus protocol wrapper., 2020-11-19T12:21:03+0000
/project/i3pystatus/, i3pystatus, 3.35, A complete replacement for i3status, 2016-08-31T16:19:58+0000
/project/ecsuproject-1/, ECSUProject_1, 0.1, Demo for building a Python project, 2018-10-02T13:05:14+0000
/project/midterm-2018/, Midterm_2018, 0.2, Webscraper to develope unitest skills, 2018-10-09T15:26:58+0000
/project/bkp/, bkp, 0.1.8, Creates backups of your files and directories., 2018-12-07T22:51:34+0000
/project/xontrib-histcpy/, xontrib-histcpy, 0.1, Useful aliases and shortcuts for extracting links and text from command output history in xonsh, 2019-05-23T09:43:48+0000
/project/mygnuhealth/, MyGNUHealth, 0.9b1, The GNU Health Personal Health Record, 2021-04-18T21:58:54+0000
/project/freetile/, freetile, 0.1.3, freely tiling script for X, 2019-10-17T04:59:00+0000
/project/caspyr/, caspyr, 1.1.1, Cinchingly awesome scripts of Pythonic rapture, 2019-08-01T23:19:27+0000
/project/xontrib-avox/, xontrib-avox, 0.8, Automatic voxes for projects, 2020-01-22T19:11:12+0000
/project/chooser/, chooser, 0.3.5.2, Choose browser when opening a URI, 2017-11-20T00:38:58+0000
/project/kabaret/, kabaret, 2.1.12, VFX/Animation Studio Framework, 2020-02-28T15:45:33+0000
/project/pvnhxgmgiq/, pvnhxgmgiq, 0.1.7, , 2018-02-27T05:46:59+0000
/project/konfsave/, konfsave, 0.4.2, Easy saving and switching between multiple KDE configurations., 2021-03-18T20:56:36+0000
/project/unbuffered-input/, unbuffered-input, 0.0.1, Unbuffered input from terminal with callbacks, 2018-07-01T23:32:49+0000
/project/desktop-drive/, desktop-drive, 0.3a1, Bash-like file operations on Google Drives "mounted" on the local filesystem., 2017-01-15T16:53:51+0000
/project/xontrib-z/, xontrib-z, 0.4, Tracks your most used directories, based on 'frecency'., 2018-10-16T23:47:21+0000
/project/flask-desktop-ui/, flask-desktop-ui, 0.3, Desktop web user interface using Flask APP as backend, 2020-11-16T05:39:51+0000
/project/id3encodingconverter/, id3encodingconverter, 0.1alpha.svn20080501, ID3 tag viewer for conversion of different character sets, 2008-05-01T18:04:19+0000
/project/sittagger/, sittagger, 0.5.0, Image viewer with user-labels tag database, 2020-04-02T19:03:28+0000
/project/blurwal/, BlurWal, 1.1.1, Smoothly blurs the wallpaper when windows are opened., 2019-03-30T22:02:22+0000
/project/shtab/, shtab, 1.3.5, Automatically generate shell tab completion scripts for python CLI apps, 2021-02-22T15:41:09+0000
/project/sharescanner/, Sharescanner, 0.1.0, A GTK tool for scanning network shares and downloading files from them, 2012-01-02T22:06:50+0000
/project/sticky-notes/, sticky-notes, 2.3, Stick your notes to your desktop (inspired from stickies for Mac), 2016-10-07T16:17:40+0000
/project/pwclip/, pwclip, 1.7.16, password-manager - temporarily saves passwords to the clipboard, 2021-01-14T15:40:48+0000
/project/beamer/, beamer, 0.2.0, Simplistic CLI for toggling and positioning a secondary monitor or projector, 2019-11-08T09:12:25+0000
/project/ethmenu/, ethmenu, 2.0.4, Simple menu, 2020-10-23T15:19:11+0000
/project/i3pystatus-anybar/, i3pystatus_anybar, 1.0, AnyBar widget for i3pystatus, 2015-03-17T14:06:55+0000
/project/printingpress/, printingpress, 0.3, Shameless name-grab for a possible future project, 2021-04-08T20:02:11+0000
/project/textoter/, textoter, 0.51, Send SMS from your mobile phone. Phone is connected via Bluetooth, 2021-03-27T07:18:33+0000
/project/boot/, boot, 0.30, VHDL simulator and synthesis tool, 2012-08-26T13:18:02+0000
/project/runpon/, RunPON, 0.5, runs scripts, keeping track of the elapsed time., 2009-09-19T12:54:21+0000
/project/xkbgroup/, xkbgroup, 0.2.0, Query and change XKB layout state, 2017-10-06T01:42:25+0000
/project/pysyncdroid/, pysyncdroid, 1.1.0, A simple way to synchronize an Android device connected to a Linux PC via MTP over USB, 2018-12-08T14:46:34+0000
/project/disaiah-project-1/, Disaiah_Project_1, 0.1, Demo for building a Python project, 2018-10-02T16:37:03+0000
/project/ration/, ration, 0.1.3, Civilized window management, 2010-07-24T01:41:18+0000
/project/udiskie/, udiskie, 2.3.3, Removable disk automounter for udisks, 2021-03-05T14:13:46+0000
/project/gkeyring/, gkeyring, 0.4, Tool for shell access to GNOME keyring, 2016-01-14T18:09:17+0000
/project/install-freedesktop/, install-freedesktop, 0.1.2, Setuptools extension to install freedesktop.org app icons, 2015-02-02T04:45:16+0000
/project/uistylelang/, uistylelang, 0.8.5, Simple CSS-like language which allows for drawing and styling wxPython elements., 2020-09-09T17:07:35+0000
/project/pywlroots/, pywlroots, 0.2.6, Python binding to the wlroots library using cffi, 2021-04-24T15:12:59+0000
/project/dots-linux/, dots-linux, 0.0.1, Linux System Manager., 2016-07-23T03:09:47+0000
/project/minidlnaindicator/, minidlnaindicator, 0.5.5, MiniDLNA Indicator, 2017-09-08T16:05:54+0000
/project/windownow/, windownow, 0.9.6, Switch desktop's windows by typing their titles, name, etc., 2013-01-14T12:04:23+0000
/project/classicmenu-indicator/, classicmenu-indicator, 0.11, An Unity indicator applet that provides the classic GNOME application menu, 2017-10-25T16:42:17+0000
/project/start-jupyter-cm/, start-jupyter-cm, 2.3.0, Add entries to start Jupyter from context menu., 2021-04-11T16:07:57+0000
/project/gallery-uploader/, Gallery-Uploader, 2.3, Upload pictures and videos to Gallery installations, 2010-11-17T09:04:24+0000
/project/virtscreen/, virtscreen, 0.3.1, Make your iPad/tablet/computer as a secondary monitor on Linux., 2018-11-09T09:46:57+0000
/project/hubd/, hubd, 0.1, Real-time JSON MVC Framework, 2012-02-17T07:05:45+0000
/project/plover/, plover, 3.1.1, Open Source Stenography Software, 2017-03-07T20:35:01+0000
/project/irssinotifier/, IrssiNotifier, 0.1.1, Irssi Real Time Remote Visual Notification., 2007-05-23T22:36:44+0000
/project/gdm2setup/, gdm2setup, 0.3.7, GDM2 Setup utility and libraries, 2010-03-02T02:34:31+0000
/project/pyride/, PYRIDE, 0.0.1.dev19, PYRIDE: A Cross-Platform RegEx IDE, 2020-09-27T21:42:02+0000
/project/navgator/, navgator, 0.5.2, A multi-paned multi-tabbed file manager, 2019-06-28T20:23:23+0000
/project/py-make/, py-make, 0.1.1, Makefile execution powered by pure Python, 2019-01-21T00:18:55+0000
/project/unsettings/, unsettings, 0.11, A configuration frontend for the Unity desktop environment, 2015-11-08T20:48:33+0000
/project/desktop/, desktop, 0.4.2, Simple desktop integration for Python, 2014-01-04T23:31:10+0000
/project/ibooks/, ibooks, 0.3, iBooks Author cover and metadata extraction, 2013-07-29T21:46:55+0000
/project/final-project/, Final_Project, 1.0, Extracting home information from zillow.com, 2018-12-02T23:51:18+0000
/project/tqdm/, tqdm, 4.60.0, Fast, Extensible Progress Meter, 2021-04-06T01:23:21+0000
/project/py3status-amdfan/, py3status-amdfan, 0.1.0, py3status monitor show amdgpu fan speeds and temp, 2021-04-11T00:31:19+0000
/project/pywingo/, pywingo, 0.0.12, Provide access to wingo via sockets, 2016-07-09T12:36:35+0000
/project/pasteboard/, pasteboard, 0.3.3, Pasteboard - Python interface for reading from NSPasteboard (macOS clipboard), 2021-01-29T08:10:39+0000
/project/py3status-cpu-governor/, py3status-cpu-governor, 0.1.2, py3status monitor to show the state of your cpu governor, 2021-03-07T05:07:06+0000
/project/tuna-wrap/, tuna-wrap, 0.1.1, Wraps Nautilus scripts for use in Thunar file manager, 2016-08-15T15:19:18+0000
/project/pymmbgui/, pymmbgui, 0.1.3, GUI tool to manage BBC Microcomputer DFS disk images and MMB disk bundles, 2020-05-11T17:10:57+0000
/project/football-score-indicator/, football_score_indicator, 4.5.9.5, An indicator to show live football scores in panel, 2016-04-19T20:20:36+0000
/project/vsucs4900/, vsucs4900, 0.1, Demo for building a Python project, 2020-04-10T07:54:55+0000
/project/python-fileinspector/, python-fileinspector, 1.0.2, A module to determine file mimetypes, 2016-10-10T20:06:01+0000
/project/i3-quickterm/, i3-quickterm, 1.0, A small drop-down terminal for i3 and sway, 2020-04-06T18:10:50+0000
/project/venuspy/, venuspy, 1.0.3, A cross platform tool for setting a random wallpaper image from unsplash.com, 2020-02-03T06:31:28+0000
/project/pytyle1x/, pytyle1x, 1.0.1, A tiling manager for EWMH compliant window managers, 2021-04-07T15:18:10+0000
/project/os-sys/, os-sys, 2.1.4, a big lib with many usefull tools and it are not only os and sys tools..., 2019-12-10T20:06:28+0000
/project/explorerfromwsl/, ExplorerFromWSL, 1.0.0, call explorer.exe from wsl shell by unix-style path, 2019-07-13T01:43:52+0000
/project/pypath-magic/, pypath_magic, 0.3.1, IPython magic and CLI to manipulate the Python path, 2015-01-21T06:45:55+0000
/project/git-fame/, git-fame, 1.14.1, Pretty-print `git` repository collaborators sorted by contributions, 2021-03-01T22:16:22+0000
/project/astrality/, astrality, 1.1.1, A dynamic configuration file manager., 2018-11-27T17:37:28+0000
/project/redditwallpaperchooser/, RedditWallpaperChooser, 0.2.3, Automatically download trending wallpapers from subreddits of your choice., 2016-09-01T08:39:00+0000
/project/tomaatti/, tomaatti, 0.5.0, Pomodoro timer with i3 integration, 2018-10-10T10:34:41+0000
/project/gridsync/, gridsync, 0.4.3, Synchronize local directories with Tahoe-LAFS storage grids., 2020-07-25T00:41:46+0000
/project/clip/, clip, 0.2.0, A CLI clipboard manager, 2013-01-20T00:55:33+0000
/project/you/, you, 0.5.0.dev1, My next dumb thing., 2017-12-22T21:37:05+0000
/project/pavlovadm/, pavlovadm, 2.0, utility to issue commands to pavlov's rcon like admin interface, 2020-06-21T15:38:21+0000
/project/titulky/, titulky, 1.0.1, Tiny SubRip subtitles editor, 2021-04-18T17:02:22+0000
