/project/pycapnp-async/, pycapnp-async, 0.7.0, A cython wrapping of the C++ Cap'n Proto library with support for asyncio, 2019-10-21T07:13:53+0000
/project/scriptgen/, scriptgen, 0.0.5, A collection of script generation helpers and templates., 2021-01-13T11:29:23+0000
/project/classofvector2d/, classofvector2d, 1.0.4, Prepared to help graphics coding for Python, 2021-01-24T19:18:16+0000
/project/yawinpty-extra/, yawinpty-extra, 0.1.0.dev1, yet another winpty binding for python (extra package), 2017-07-16T07:50:27+0000
/project/liblearn/, liblearn, 0.0.1, Simple addition algorithm, 2021-03-16T12:46:49+0000
/project/iautolibrary/, iautolibrary, 0.0.1, , 2020-11-06T15:23:25+0000
/project/dracopy/, DracoPy, 0.0.19, Python wrapper for Google's Draco Mesh Compression Library, 2021-03-23T21:14:21+0000
/project/abkp009-simple-calc/, abkp009-simple-calc, 0.0.1, A very basic calculator, 2021-01-16T07:24:05+0000
/project/joshbasiccalculator/, joshbasiccalculator, 0.0.1, A very basic calculator, 2020-04-19T15:23:14+0000
/project/pycoalescence/, pycoalescence, 1.2.9.post2, A spatially explicit neutral ecology simulator using coalescence methods, 2021-03-26T11:20:27+0000
/project/tradingtechnicals/, TradingTechnicals, 0.0.1, Technical Analysis, 2021-02-15T20:35:56+0000
/project/ps-histogram/, ps-histogram, 0.0.3, Histogram Equalization, 2019-03-12T02:29:12+0000
/project/rectanglecollision/, RectangleCollision, 0.0.0.7, A basic collision module, 2020-07-14T13:48:35+0000
/project/easydataframe-lipsum/, easydataframe-lipsum, 0.0.3, A library that handles small xlsx files as a DataFrame., 2021-01-02T01:52:34+0000
/project/topsis-mahir-101803603/, topsis-mahir-101803603, 0.0.1, A very basic calculator, 2020-11-13T18:40:15+0000
/project/kaidoku/, kaidoku, 0.5.6, Player, solver and creater of sudoku puzzles, 2018-08-22T06:36:01+0000
/project/test-01/, Test-01, 1.0, Speed up your model making process. This will help you in selecting best features, best Models (SVM,SVR Random Fotest e.t.c and also in Data Preprocessing, 2020-12-13T08:33:03+0000
/project/a2y-builda2y/, a2y-builda2y, 1.0.0, , 2020-11-28T14:32:59+0000
/project/pythonlibtest/, pythonlibtest, 0.0.3, A very basic getreq, 2021-02-11T08:06:13+0000
/project/passtorage/, passtorage, 0.0.4, txt password generator and manager with tkinter., 2019-03-22T17:12:51+0000
/project/fuzzy-math/, Fuzzy-Math, 0.0.1, Performs Fuzzy Math Functions, 2021-02-07T19:34:57+0000
/project/akkiprint/, akkiprint, 0.0.1, A extension simple extension that allows you to print text., 2021-01-05T10:24:33+0000
/project/xinet/, xinet, 0.0.7, Use Python to create and explor world., 2021-02-27T09:33:38+0000
/project/crun-py/, crun-py, 0.0.5, C Programming Simplified, 2020-08-20T14:45:07+0000
/project/pyspam/, pySpam, 0.0.1, Text spam with PySpam, 2021-03-11T10:58:09+0000
/project/oceas/, oceas, 0.0.2, A very basic, 2021-03-29T20:48:38+0000
/project/ezdiscordpy/, ezdiscordpy, 0.0.1, made to facilitate you discord.py, 2021-03-08T22:59:07+0000
/project/maheshbasiccalculator/, maheshbasiccalculator, 0.0.1, A basic calculator, 2020-05-28T15:44:50+0000
/project/chipp/, chipp, 0.2, A AI STORE, 2020-10-01T10:35:54+0000
/project/calcprueba/, calcprueba, 0.1.1, Operaciones de 2 digitos, 2020-11-17T23:43:39+0000
/project/djpython/, djpython, 0.0.1, Audio Processing package, 2020-08-04T12:15:11+0000
/project/terminal-minesweeper/, terminal-minesweeper, 0.1.1, A pure Python implementation of minesweeper using curses., 2020-12-25T03:36:40+0000
/project/laundry/, laundry, 2020.2.2, Folding spreadsheets into neat shapes., 2020-02-26T01:29:25+0000
/project/cobra-component-models/, cobra-component-models, 0.5.0, SQLAlchemy ORM and pydantic data models for SQL storage and JSON serialization of COBRA components such as reactions, compounds, and compartments., 2020-04-25T08:54:51+0000
/project/akanekopy/, akanekopy, 1.0.9, Akaneko for Python 3 and above, 2021-01-11T04:17:15+0000
/project/collageradiomics-types/, collageradiomics-types, 0.2.1.dev21, CoLliage Implementation, 2020-09-09T20:01:19+0000
/project/topsis-101816021/, TOPSIS-101816021, 0.0.1, A Python package to find TOPSIS for multi-criteria decision analysis method, 2020-11-13T15:59:17+0000
/project/rh-1099/, rh-1099, 1.0.1, Parses Robinhood 1099 tax document from PDF into CSV format, 2021-04-08T20:58:13+0000
/project/modelpostgres/, modelpostgres, 0.0.0, Model for CRUD operations with PostgreSQL DB, 2020-12-09T17:35:00+0000
/project/hdbcli/, hdbcli, 2.8.16, SAP HANA Python Client, 2021-04-20T15:08:27+0000
/project/pyipcmi/, pyIPCMI, 1.1.5, An IP Core Management Infrastructure written in Python - pyIPCMI., 2019-10-13T23:30:09+0000
/project/pyxa/, pyxa, 0.0.2, pyXA is an open-source, flexible, high-performance function serving framework for Charlotte AI., 2019-12-05T12:44:00+0000
/project/neuralnet-pytorch/, neuralnet-pytorch, 1.0.0, A high-level library on top of Pytorch., 2019-06-24T04:07:18+0000
/project/distancecontrol/, distancecontrol, 0.0.2.5, A library used to control programs(mainly games) without focusing them., 2020-07-26T19:18:56+0000
/project/terracotta/, terracotta, 0.7.0, A modern XYZ tile server written in Python, 2020-07-01T09:56:26+0000
/project/principledinvestigator/, principledinvestigator, 0, not yet, 2021-01-12T23:30:02+0000
/project/getscatterplots/, getscatterplots, 0.0.1, data visualisation, 2020-08-25T09:21:16+0000
/project/ansi-escape-room/, ansi-escape-room, 1.4.2, Simple library for color and formatting to terminal, 2020-03-29T00:29:57+0000
/project/gspread10/, gspread10, 0.0.2, Package which helps us to read the data from google sheets, 2020-10-11T08:04:18+0000
/project/managecache/, managecache, 0.1.2, Manage cache by using method to add data in cache, to remove data from cache, to get all keys from cache, to check memcached stats, 2020-12-06T16:29:16+0000
/project/topsis-yopro/, topsis-yopro, 0.1, A tool to calculate TOPSIS Score and Rank for given Dataset., 2020-11-13T17:46:47+0000
/project/autoanno/, autoanno, 0.0.1.dev1, Investigation into using AutoML and Topological Data Analysis for Automated Annotation, 2021-03-22T19:26:25+0000
/project/py-makefile/, py-makefile, 1.0.0, implement makefile, 2019-11-07T16:57:29+0000
/project/pysmart-ai/, pysmart-ai, 0.0.5, A smarter way of automating machine learning and deep learning 🔥, 2021-04-20T15:31:30+0000
/project/yapowf/, yapowf, 0.0.7, A new Python Power Factory API, 2021-03-29T16:04:02+0000
/project/pyasge/, pyasge, 1.0.0b1, Python bindings for ASGE, 2021-04-20T00:28:31+0000
/project/mohammedyasser/, mohammedyasser, 0.0.1, very simple calculator, 2021-01-12T13:34:31+0000
/project/reybasiccalculator/, ReyBasicCalculator, 0.0.1, A command line calculator, 2021-04-12T08:15:39+0000
/project/reg-sieves/, reg-sieves, 0.0.1, The regression approach with sieves., 2020-09-22T00:10:28+0000
/project/sesam-jacktop/, Sesam-JackTop, 0.0.1, Sesam Software Jacket and Topside Helper Tools, 2020-07-24T11:36:44+0000
/project/piimp/, piimp, 0.0.0, This is a Python package for post-processing ice irradiation data., 2020-11-20T06:18:36+0000
/project/generator-name/, Generator-Name, 0.0.4, Generacion de Id en base a nombre, 2020-12-01T20:06:43+0000
/project/binmysql/, BinMySQL, 0.0.9, Quick and intuitive MySQL Connector, 2021-04-04T15:33:32+0000
/project/vamsikrishnapapana/, vamsikrishnapapana, 0.0.1, A simple library that contains my details, 2021-03-11T14:40:12+0000
/project/morepitool/, MorEpiTool, 2.0.8, RL based Epidemic control simulation environment, 2021-03-04T15:25:55+0000
/project/tsr/, tsr, 0.0.3, TSR on command-line, 2018-07-11T08:54:29+0000
/project/lifx-control-panel/, lifx-control-panel, 1.8.0, An open source application for controlling your LIFX brand lights, 2020-08-08T21:29:41+0000
/project/simpleeconomy/, SimpleEconomy, 1.2.1, Very easy to use discord.py economy creator, 2021-04-13T13:09:47+0000
/project/vivek2dropoffnan/, vivek2dropoffnan, 0.0.1, A simple package to perform basic data cleaning in EDA, 2021-03-23T00:10:23+0000
/project/crisps/, crisps, 0.0.3.1, Eat and get fat., 2021-02-07T10:39:27+0000
/project/heaty/, Heaty, 2020.10b2, A building heat load calculator, 2020-10-23T13:04:19+0000
/project/ddns-client/, ddns-client, 0.8, ddns_client, used with coredns/etcd, 2019-06-27T03:01:22+0000
/project/brainio/, brainio, 0.0.20, Loading and saving of brain imaging data., 2020-06-18T15:11:40+0000
/project/randpercent/, randpercent, 0.0.3, A library to generate booleans with a given percentage., 2021-04-02T21:51:36+0000
/project/upperdek/, upperdek, 0.0.1, A very basic program, 2020-09-09T21:02:49+0000
/project/spotlight-api/, spotlight-api, 0.0.2, Allow you to monetize your Discord Bots while adding ads to them, 2020-12-06T14:56:06+0000
/project/owopy/, owopy, 0.0.1, This module OwOifies your sentences (turns your sentences into japanese "furry" baby babblespeak :>), 2021-04-07T07:08:39+0000
/project/django-rss-xml-parser/, django-rss-xml-parser, 0.4, This parser is intended for RSS/XML that does not communicate the standard rfc5005, 2017-09-25T00:30:47+0000
/project/s-fhimiancaculator/, s.fhimiancaculator, 0.0.1, A very basic calculator, 2021-03-17T15:14:44+0000
/project/pylgorithm/, pylgorithm, 0.0.1, A Package That Contains Lots Of Commonly Used Algorithms To Make The Developer's Life Easier, 2021-02-16T17:19:10+0000
/project/tlscanary/, tlscanary, 4.0.0, TLS/SSL Test Suite for Mozilla Firefox, 2020-02-18T20:56:15+0000
/project/lc-py/, lc-py, 2.0.1, Lowercase values for Python!, 2019-12-03T02:38:30+0000
/project/line-formater/, line-formater, 1.1.0, A collection of line text formaters, 2018-09-07T09:07:17+0000
/project/sdasbasiccalculator/, SDasBasicCalculator, 1.0.1, A very basic calculator, 2021-01-19T19:13:14+0000
/project/larkinlab/, larkinlab, 0.0.16, A collection of code I have either made or found that helps streamline things. For Data Analysis., 2020-11-03T03:32:25+0000
/project/examplepkgwindf98/, examplepkgwindf98, 0.1.2, A small example package, 2020-12-28T05:42:34+0000
/project/recalc/, ReCalc, 0.1.12, , 2018-03-25T00:19:28+0000
/project/liamhealytest/, liamhealytest, 0.0.1, Test library, 2021-02-13T14:52:37+0000
/project/sqlalchemy-paradox/, sqlalchemy-paradox, 0.2.0, A SQLAlchemy dialect for Borland / Corel Paradox flat-file databases., 2021-03-10T18:57:36+0000
/project/cp2trans/, cp2trans, 1.1.0, Clipboard to translate., 2020-01-02T07:04:06+0000
/project/sub-finder/, sub-finder, 0.0.1, Module to get all subsidiaries of the given company, 2021-03-30T09:20:26+0000
/project/behzodcalculator/, behzodcalculator, 0.0.1, Juda oddiy kalkulyator, 2021-04-23T19:10:49+0000
/project/hi-pypi-practice/, hi-pypi-practice, 0.0.2, A practice package for me., 2021-02-22T03:27:11+0000
/project/quotespy/, quotespy, 1.3, Python library to create quotes/lyrics and tweet graphics with PIL., 2020-08-30T22:12:16+0000
/project/example-pkg-test03/, example-pkg-test03, 0.1.1, A small example package, 2020-02-27T13:23:21+0000
/project/cxsystem2/, cxsystem2, 0.1.2.6, A cerebral cortex simulation framework, 2020-01-30T14:39:11+0000
/project/sap-example-pkg/, sap-example-pkg, 0.0.6, A small example package, 2019-07-03T13:06:17+0000
/project/zas-rep-tools-data/, zas-rep-tools-data, 0.3, This is the data-set for "zas-rep-tools" package., 2018-10-15T17:04:45+0000
/project/daquiri/, daquiri, 0.0.2, DAQuiri = DAQ + UI Generation + Reactivity + Instruments: A simple scientific DAQ framework., 2019-09-10T19:30:46+0000
/project/xint/, xint, 0.0.4, Use Python to create and explor world., 2021-04-12T08:31:15+0000
/project/secure-password-py/, secure-password-py, 0.0.0, A very easy password generator, 2021-03-14T18:30:58+0000
/project/hyralix/, Hyralix, 0.1.0, Hyralix is a basic text formatter for Python., 2020-12-26T17:59:59+0000
/project/signalpy/, SignalPy, 1.0.6, Realtime communication for Python web applications, 2020-10-20T02:15:54+0000
/project/c3-toolset-nightly/, c3-toolset-nightly, 20210424, Toolset for control, calibration and characterization of physical systems, 2021-04-24T09:57:24+0000
/project/potosnail/, Potosnail, 0.2.4, improves ML workflow, 2021-03-12T13:31:11+0000
/project/topsis-ritik-101803600/, TOPSIS-Ritik-101803600, 0.0.1, TOPSIS package, 2020-11-13T18:54:52+0000
/project/mediaplanning/, mediaplanning, 0.0.5, Python package for media planning, 2020-08-30T15:10:47+0000
/project/plotmygsheet/, plotmygsheet, 0.0.1, This package will plot a graph between the two columns of your choice from google sheet., 2020-10-10T12:44:56+0000
/project/starsymbolfinder/, starsymbolfinder, 0.0.6, A package that finds a star symbol for a specified date., 2021-04-05T11:31:56+0000
/project/vsutillib/, vsutillib, 1.6.4, Library module with miscellaneous convenience functions and classes, 2020-09-03T20:29:37+0000
/project/offline-115/, Offline-115, 0.1.5, 115网盘添加离线下载任务命令行工具, 2020-10-03T10:47:39+0000
/project/algo-ml/, algo-ml, 0.0.1, Machine learning Package, 2020-09-20T19:06:14+0000
/project/gym-guesswho/, gym-guesswho, 0.0.5, An OpenAI Gym framework for machine learning with the game "Guess Who?", 2018-08-07T01:03:58+0000
/project/genix/, genix, 0.1.2, GUI library for Pygame, 2020-08-27T04:20:49+0000
/project/calculations/, Calculations, 1.10, To calculate equations and draw diagrams, 2020-08-02T17:47:30+0000
/project/asyncrequester/, asyncrequester, 0.1.2, Basic async requester, 2020-09-29T18:42:38+0000
/project/rsrtools/, rsrtools, 1.0.0, Tools for creating Rocksmith 2014 songlists and managing Rocksmith save files, 2020-05-16T03:44:49+0000
/project/pydiscordbot/, PyDiscordBot, 0.0.0, A very basic discord bot for begginer, 2021-04-15T07:42:54+0000
/project/filehandling/, filehandling, 0.21.0, Cross-platform file handling utilities., 2021-01-23T22:16:16+0000
/project/crystal-0-0-1/, crystal-0.0.1, 0.0.1, Calculation of mismatch of FCC crystal systems, 2021-01-13T02:22:35+0000
/project/paygo-utils/, paygo-utils, 0.0.18, This is a utilities library that contains the base files needed by every microservice, 2021-02-19T09:16:06+0000
/project/noblesse2/, noblesse2, 0.0.1, Optimiser, 2021-04-07T20:49:55+0000
/project/intersection-py/, intersection.py, 1.2.0, A simple API Wrapper for IC, 2021-04-11T19:03:50+0000
/project/makeprimetanakiin/, makeprimetanakiin, 0.0.1, A simple prime number identifier, 2021-03-13T16:49:35+0000
/project/py-nsbcli/, py-nsbcli, 0.5.20, interacting with Tendermint-NSB from python, 2019-06-28T15:13:35+0000
/project/sclacsll/, sclacsll, 0.0.1, A basic calculator which add, subtracts, multiplies and divides, 2020-08-21T13:43:58+0000
/project/secure-password/, secure-password, 2.1, A very easy password generator, 2021-03-17T14:00:15+0000
/project/bet365/, bet365, 0.0.3, ninja25538@tutanota.de, 2020-05-24T17:19:20+0000
/project/tkinterx/, tkinterx, 0.0.9, Use tkinter to create a handy GUI tool., 2020-05-30T01:34:40+0000
/project/dpye/, dpye, 0.0.2, discord.py-easy, 2020-09-06T04:00:45+0000
/project/arpes/, arpes, 2.6.0, Modular data analysis code for angle resolved photoemission spectroscopy (ARPES), 2020-01-21T01:47:27+0000
/project/ataner/, ataner, 0.0.1, Say hello!, 2021-01-15T17:23:14+0000
/project/simple-package/, Simple-Package, 0.0.1, A very basic calculator, 2020-10-26T21:11:35+0000
/project/manuvision/, manuvision, 0.0.1a0, A small example package, 2020-08-19T10:11:17+0000
/project/bg-atlasapi/, bg-atlasapi, 1.0.0, A lightweight python module to interact with atlases for systems neuroscience, 2020-10-04T15:30:09+0000
/project/igpu/, igpu, 0.1.2, A cross-platform module for retrieving information and stats on installed gpus., 2020-04-25T16:45:06+0000
/project/onhandcal/, onhandcal, 0.0.1, basic calculator, 2020-11-27T12:55:52+0000
/project/oeispy/, oeispy, 0.0.5, Simple Python Library for OEIS, 2020-06-06T07:32:12+0000
/project/yucli/, YUCLI, 1.3.0.0, A customizable command line environment for Python projects, 2021-04-15T22:30:02+0000
/project/bert-embeddings/, bert-embeddings, 0.0.9, Create positional embeddings based on TinyBERT or similar bert models, 2021-04-17T15:39:22+0000
/project/satyam/, Satyam, 0.0.1, This pacakage conatins a basic functionality of a calculator , containing functions such as addition , subraction , multiplication and division. It  will return the value calculated by the respective function., 2021-02-09T10:20:08+0000
/project/koapy/, koapy, 0.3.4, Kiwoom Open Api Python, 2021-03-28T23:47:28+0000
/project/fmoarpg/, FMOARPG, 0.0.7, Biblioteca para integrar Forge e Power BI, 2020-06-29T17:54:23+0000
/project/simplelinearregression/, simplelinearregression, 0.0.1, A very linear regression package, 2020-12-19T15:41:37+0000
/project/arsibasiccalculator/, arsibasiccalculator, 0.0.1, A very basic calculator, 2021-03-14T09:49:47+0000
/project/engimaencryptionconcept/, EngimaEncryptionConcept, 0.0.5, Enigma Machine Encryption, 2020-10-24T16:30:40+0000
/project/tweetdatalib6/, tweetdatalib6, 0.0.1, A very basic twitter data extractor library, 2020-09-05T21:20:11+0000
/project/naitancalculator/, naitancalculator, 0.1, A very basic calculator, 2020-12-12T12:19:32+0000
/project/flecsimo/, flecsimo, 0.1.3, A research/educational simulation model of a IIoT cellular production site., 2020-08-28T17:16:02+0000
/project/fpldata/, fpldata, 0.0.4, Getting data out of FPL API made easier, 2020-10-08T20:40:35+0000
/project/hello-wor/, hello-wor, 0.0.1, A very simple library, 2021-04-18T09:03:05+0000
/project/onedrive/, onedrive, 0.0.14, Download shared folders with Selenium in bulk., 2020-07-01T10:52:04+0000
/project/csvwrangle/, csvwrangle, 0.0.1, Wrangle CSV data with pandas from the command-line, 2020-12-24T16:04:12+0000
/project/functions-for-mash-objects/, functions-for-mash-objects, 0.0.1, Functions for parsing of maya ascii files that returns name, position and uid of all mesh objects, 2021-01-19T20:35:58+0000
/project/cappy-python/, CapPy-Python, 0.0.6, Python package for easy window capturing, 2020-09-05T21:27:01+0000
/project/apprest-interface/, apprest_interface, 1.0.7.dev0, A simple Python package to facilitate interactions with APP's API, 2017-12-15T22:15:42+0000
/project/pillepy/, pillepy, 0.0.1, Useful functions for data manipulation., 2020-12-21T09:54:48+0000
/project/manhattandistance/, manhattandistance, 1.1.1, Calculates the Manhattan Distance of two places, 2020-12-15T16:08:03+0000
/project/pyautomaker/, PyAutoMaker, 0.1.4, 자동화를 위한 패키지, 2021-03-01T13:50:42+0000
/project/pymemory/, PyMemory, 0.0.7, Happy using PyMemory to read and write to computer memory., 2019-10-25T13:28:42+0000
/project/liqueur/, liqueur, 0.0.5, A lightweight python framework for Capital API, 2020-07-05T10:14:56+0000
/project/autocp2k/, autocp2k, 0.0.1, This is a python module for automating CP2K calculations., 2020-05-25T22:03:26+0000
/project/dotsandboxes/, DotsAndBoxes, 1.1.0, 点格棋对弈软件, 2018-07-25T02:16:10+0000
/project/pdot/, pdot, 0.0.1, This is a bookmark!, 2021-02-20T00:03:11+0000
/project/gloria-housing/, gloria-housing, 0.0.1, Predicts Median housing value, 2020-11-13T13:02:37+0000
/project/timemory/, timemory, 3.1.0, Lightweight cross-language instrumentation API for C, C++, Python, Fortran, and CUDA which allows arbitrarily bundling tools together into a single performance analysis handle, 2020-07-11T01:12:43+0000
/project/wmc-datalake-functions/, wmc-datalake-functions, 1.0, Functions from WMC Datalake, 2020-11-18T12:20:30+0000
/project/cwl-airflow-parser/, cwl-airflow-parser, 1.0.20181213213631, Package extends Airflow functionality with CWL v1.0 support, 2018-12-13T21:46:28+0000
/project/pisarnwatebasiccalculator/, pisarnwatebasiccalculator, 0.0.1, A very very basic calculator, 2020-10-15T15:05:14+0000
/project/dominisia/, dominisia, 0.0.1, Say hello!, 2021-01-13T20:10:26+0000
/project/lts/, lts, 0.0.2, A basic list to string converter, 2020-08-26T21:27:34+0000
/project/pycapnp/, pycapnp, 1.0.0, A cython wrapping of the C++ Cap'n Proto library, 2020-11-20T21:00:38+0000
/project/fliptrack/, fliptrack, 1.0.0, A Library for getting Flipkart Products info, 2020-10-15T15:22:33+0000
/project/mosquito-remover/, mosquito-remover, 1.0.0, This is only for entertainment purposes (I made this for fun!), 2021-02-17T08:44:16+0000
/project/a2y/, a2y, 0.8.0, A handy package for installing a2y series modules., 2020-06-30T03:03:54+0000
/project/veerbasiccalculator/, veerbasiccalculator, 0.0.1, A very basic calculator, 2020-10-20T08:16:41+0000
/project/uptt/, uPTT, 0.0.1.beta, uPTT, 2019-08-19T07:02:38+0000
/project/cryptoanalysis/, cryptoanalysis, 0.0.1, Basic analysis and visualization of cryptocurrency digital assets, 2021-04-10T15:57:37+0000
/project/pymathrix/, pymathrix, 0.0.7, Pymathrix is a python library for matrix objects creation and basic operations., 2020-10-01T15:35:25+0000
/project/formatting/, formatting, 0.0.1, A formatting function, 2021-02-06T14:20:02+0000
/project/topsis-sukriti-401803026/, TOPSIS-SUKRITI-401803026, 0.0.4, TOPSIS evaluator for given data. Enter all arguments as strings, 2020-11-13T20:42:11+0000
/project/pathtub/, pathtub, 1.1.2, Reading and editing Windows PATH., 2020-04-12T16:31:03+0000
/project/discordbmd/, discordBMD, 0.0.1, A simple bot discord creator, 2021-03-24T11:26:36+0000
/project/datapreprep/, datapreprep, 0.0.7, A Data Pre Processing Package, 2020-12-09T15:58:35+0000
/project/bhasklibrary/, bhasklibrary, 0.0.1, A very basic calculator, 2021-02-11T16:50:48+0000
/project/postgrestools/, PostgresTools, 0.0.7, Tools to copy database, 2020-12-16T17:05:44+0000
/project/n2pc-library/, N2PC-Library, 0.0.1, Calculates N2PC component of attention, 2020-12-07T22:34:20+0000
/project/skyiris/, skyiris, 0.1.5, machine leanring with iris_dataset, 2021-03-22T15:33:27+0000
/project/usd-core/, usd-core, 21.5, Pixar's Universal Scene Description library, 2021-04-12T22:37:07+0000
/project/collageradiomics-core/, collageradiomics-core, 0.1.2.1, CoLliage Implementation, 2020-07-26T21:40:48+0000
/project/pys5p/, pys5p, 1.1.1, Software package to access S5p Tropomi data products, 2020-11-06T14:48:56+0000
/project/creatingpylibrary/, creatingPyLibrary, 0.0.1, A very basic calculator, 2020-12-19T20:37:22+0000
/project/thepeeps191calc/, thepeeps191calc, 0.0.1, A very basic calculator, 2020-11-26T04:38:29+0000
/project/own-app/, own-app, 0.0.1, , 2021-01-30T14:01:59+0000
/project/potofox/, Potofox, 0.0.1, a Deep Learning library, 2021-03-10T15:54:43+0000
/project/ffmaxflow/, ffmaxflow, 0.0.6, Implementation of the  Fork Fulkerson method to find the max posible flow of a network, 2021-04-25T03:44:44+0000
/project/pybingwallpaper/, PyBingWallpaper, 1.5.6, A simple Bing.com wallpaper downloader, 2019-05-01T04:49:32+0000
/project/calc-by-xlabd/, calc-by-xlabd, 0.0.2, A simple calculator, 2020-09-25T05:26:52+0000
/project/kinopoiskdata/, kinopoiskdata, 1.0, Kinopoisk films data, 2020-12-24T11:59:53+0000
/project/tonetransposer/, tonetransposer, 0.0.5, Transposes a series of tones into all 12 keys and classifies them by their shape on a piano keyboard, 2020-06-24T17:40:36+0000
/project/irori/, irori, 1.0.0, general purpose built tool, 2019-02-02T08:36:51+0000
/project/dcspy/, dcspy, 1.2.2, Software for integrating Digital Combat Simulation planes with Logitech G13/G15/G510, 2021-04-24T14:24:36+0000
/project/dprofiles/, dprofiles, 0.0.2, Discord Oauth2 Client for Quart and a easy to use API Wrapper for dprofiles.xyz, 2021-03-28T09:05:46+0000
/project/bitbotxl/, bitbotxl, 0.0.2, A Python module for the 4tronix Bit:bot XL., 2020-06-03T14:51:01+0000
/project/skidings/, skidings, 0.1.2, Simple module for new comers to networking and requests and mysql, 2021-02-03T01:06:15+0000
/project/justapracticemodule69420blazeit/, justapracticemodule69420blazeit, 1.0.0, This is a calculator, 2020-11-09T19:31:04+0000
/project/maid/, maid, 0.1.12, A package manager written in Python 3.7, 2019-01-09T10:57:22+0000
/project/topology-radiomics/, topology-radiomics, 0.0.0.dev1, Topology Radiomics by INVENT and BRIC lab, 2020-09-25T07:57:39+0000
/project/slprint11-pkg/, slprint11-pkg, 1.1, Simple module to display a text with a time interval between each characters., 2020-05-02T00:11:08+0000
/project/pyfpa/, pyfpa, 0.0.9, Leverage the power of Python for corporate finance and accounting functions., 2020-12-08T01:56:51+0000
/project/andrew-confidence-intervals/, andrew-confidence-intervals, 0.0.6, Package for calculation of confidence intervals., 2020-09-05T14:33:44+0000
/project/enan/, enan, 1.0.2, a package for ENrichment ANalyses, 2020-11-09T09:41:29+0000
/project/trovefm/, trovefm, 0.0.2, A Python API for TroveFM, 2018-12-15T22:19:57+0000
/project/noita-save-manager/, noita-save-manager, 0.1.2, Noita Save Manager, allows for backup and restoring of save files, 2021-03-14T01:18:44+0000
/project/eelforkexcludefiles/, EelForkExcludeFiles, 0.14.8, For little HTML GUI applications, with easy Python/JS interop, 2021-04-12T20:47:18+0000
/project/dharadrop2/, dharadrop2, 0.0.1, Basic cleaning, 2021-04-11T04:42:09+0000
/project/frogpam/, FrogPAM, 0.0.1, Biblioteca para integrar Forge e Power BI, 2020-06-29T16:13:18+0000
/project/gitupload/, gitupload, 1.0.2, A Python package to upload a local repository to Github from your Local Machine without git commands, 2020-04-16T03:55:09+0000
/project/applicationcreatortoolkit/, applicationcreatortoolkit, 0.0.1, A GUI library built on top of tkinter, 2021-03-19T18:01:31+0000
/project/prospector2/, prospector2, 0.1, Prospector: python static analysis tool, 2018-07-31T12:59:38+0000
/project/y1z1ncalculator/, Y1z1nCalculator, 0.0.3, Simple calc, 2020-10-20T10:36:38+0000
/project/bleak/, bleak, 0.11.0, Bluetooth Low Energy platform Agnostic Klient, 2021-03-18T09:03:23+0000
/project/plotg/, plotg, 0.0.1, A very basic gsheets ploting library, 2020-10-08T19:14:33+0000
/project/oddtools/, OddTools, 1.0.0, An odd package that does odd things for odd people, 2021-04-19T10:21:48+0000
/project/mf3cf/, mf3cf, 2.1.1, Model-free 3-component full polarimetric decomposition, 2021-01-06T14:49:49+0000
