/project/django-inbound-rules/, django-inbound-rules, 1.1.0, Django Inbound Rules is an app to allow or restrict group of users on specified url(s) based on CIDR blocks(now IPv4 only) excluding user with superuser permissions., 2020-09-12T12:34:13+0000
/project/mia-accounting/, mia-accounting, 0.0.2, A Django accounting application, 2020-09-08T23:03:39+0000
/project/django-sslcommerz/, django-sslcommerz, 1.0.0a0, , 2020-07-25T07:52:18+0000
/project/gdaps-frontend-vue/, gdaps-frontend-vue, 0.0.5, "Generic Django Apps Plugin System - Vue.js frontend plugin", 2021-01-10T01:26:34+0000
/project/django-ninja/, django-ninja, 0.12.2, Django Ninja - Fast Django REST framework, 2021-04-06T06:32:32+0000
/project/django-knocker/, django-knocker, 0.4.0, Channels-based desktop notification system, 2020-05-22T21:13:49+0000
/project/drf-reset-password/, drf-reset-password, 1.2.8, Description, 2020-10-06T09:03:45+0000
/project/django-easy-formset/, django-easy-formset, 0.2.4, Django Formsets with ECMAScript 6., 2020-10-20T17:38:05+0000
/project/workoutizer/, workoutizer, 0.17.1, 🏋️ Browser based Sport and Workout Organizer 🏃‍♀️, 2021-04-20T19:59:37+0000
/project/lucterios/, lucterios, 2.5.8.21032515, Lucterios framework., 2021-03-30T09:26:51+0000
/project/djcorecap/, djcorecap, 1.0.1, Useful functions, tags, and Bootstrap-friendly templates for Django., 2020-04-10T19:34:24+0000
/project/drf-keypair-permissions/, drf-keypair-permissions, 1.0.5, Crypto Keypair Authorization for Django Rest Framework, 2021-01-21T13:37:21+0000
/project/incuna-mail/, incuna-mail, 4.1.1, Pythonic utility for sending template based emails with Django., 2020-06-30T12:32:23+0000
/project/edc-consent/, edc-consent, 0.3.6, Base models, forms and admin for participant ICF for clinicedc/edc projects., 2021-04-23T11:32:08+0000
/project/django-fahrenheit/, django-fahrenheit, 0.1.4, A tool for easily restrict access to some project URLs or even objects for legal reasons., 2020-02-03T07:26:04+0000
/project/django-multi-email-field/, django-multi-email-field, 0.6.2, Provides a model field and a form field to manage list of e-mails, 2020-07-23T14:00:44+0000
/project/django-backend-auth-api/, django-backend-auth-api, 0.2.1, A Django app that provide all urls authentication for your backend api., 2021-03-24T11:03:21+0000
/project/drf-dynamic-serializers/, drf-dynamic-serializers, 1.0, Dynamic serializers for the Django REST Framework, 2020-08-19T12:31:17+0000
/project/pinax-blog/, pinax-blog, 8.0.1, Blogging app for the Django web framework, 2020-07-27T19:00:31+0000
/project/django-cleanup/, django-cleanup, 5.2.0, Deletes old files., 2021-04-18T17:08:10+0000
/project/django-syzygy/, django-syzygy, 0.1.0a7, , 2021-04-02T16:35:53+0000
/project/django-oauth-api/, django-oauth-api, 0.7.0, OAuth API for Django using Django Rest Framework, 2020-01-31T07:01:44+0000
/project/django-menu-generator/, django-menu-generator, 1.1.0, A straightforward menu generator for Django, 2020-11-16T03:12:08+0000
/project/django-sms-cn/, django-sms-cn, 0.1.1, A Django app to use sms, 2019-12-25T08:24:14+0000
/project/django-classy-tags/, django-classy-tags, 2.0.0, Class based template tags for Django, 2020-08-26T09:29:08+0000
/project/ajax-views/, ajax-views, 0.4.1, A simple Django application to easily use AJAX views with JavaScript., 2021-02-08T09:34:59+0000
/project/webtemplate-dbca/, webtemplate-dbca, 1.3.0, Base HTML templates for DBCA Django projects, 2020-10-30T02:10:59+0000
/project/django-sequences/, django-sequences, 2.6, Generate gapless sequences of integer values., 2021-02-06T17:58:24+0000
/project/django-xicon/, django-xicon, 0.16.0, Django reusable application to handle modern bunch of site icons, 2021-04-16T02:35:59+0000
/project/django-clearcache/, django-clearcache, 1.2.1, Allows you to clear Django cache via admin UI or manage.py command, 2021-04-15T11:55:55+0000
/project/django-quickbooks/, django-quickbooks, 0.6.4.2, A Django app to integrate with quickbooks., 2020-03-09T11:38:01+0000
/project/django-hydra/, django-hydra, 0.9.9, Gives superpowers to Django Framework, 2020-11-25T22:50:05+0000
/project/pinax-testimonials/, pinax-testimonials, 3.0.0, a testimonials app, 2020-07-17T23:45:53+0000
/project/huscy-subjects/, huscy.subjects, 1.0.2, Managing subjects in a human research context., 2021-02-15T07:34:04+0000
/project/django-queryable-properties/, django-queryable-properties, 1.6.1, Write Django model properties that can be used in database queries., 2021-04-19T17:13:57+0000
/project/django-import/, django-import, 0.0.4, Import to django models, 2020-05-28T07:58:34+0000
/project/django-auth-adfs/, django-auth-adfs, 1.6.1, A Django authentication backend for Microsoft ADFS and AzureAD, 2021-03-25T11:37:01+0000
/project/django-query-params/, django-query-params, 0.5.0, A Django app providing template tags for query string management, 2021-01-21T22:04:20+0000
/project/geonode-avatar/, geonode-avatar, 5.0.7, A fork of django-avatar, for GeoNode, 2020-08-04T15:50:17+0000
/project/django-infopush/, django-infopush, 1.8, Django reusable app, what allows to send web push., 2020-12-24T15:09:43+0000
/project/django-athm/, django-athm, 0.4.2, Django + ATH Móvil, 2020-11-01T16:33:13+0000
/project/django-anymail/, django-anymail, 8.2, Django email integration for Amazon SES, Mailgun, Mailjet, Postmark, SendGrid, SendinBlue, SparkPost and other transactional ESPs, 2021-01-27T22:46:58+0000
/project/drf-imgproxy/, drf-imgproxy, 1.1.0, Serialize Django's ImageField into imgproxy URLs for your Django REST Framework APIs to generate thumbnails., 2021-04-23T12:27:59+0000
/project/django-tinymce4-widget/, django-tinymce4-widget, 6.1.2, A Django application that provides a TinyMCE 4 editor widget without any static files, 2021-04-06T18:17:53+0000
/project/django-schema-graph/, django-schema-graph, 1.2.0, An interactive graph of your Django model structure., 2020-03-01T09:33:43+0000
/project/django-username-email/, django-username-email, 2.4.2, Custom Django User model that makes email the USERNAME_FIELD., 2021-04-10T02:51:19+0000
/project/django-version-checks/, django-version-checks, 1.1.0, System checks for your project's environment., 2021-01-25T14:51:53+0000
/project/drf-yasg-edge/, drf-yasg-edge, 2.1, Automated generation of real Swagger/OpenAPI 2.0 schemas from Django Rest Framework code., 2020-02-22T04:21:25+0000
/project/django-envelope/, django-envelope, 1.4, A contact form app for Django, 2020-04-18T13:58:32+0000
/project/django-registration/, django-registration, 3.1.2, An extensible user-registration application for Django, 2021-04-01T05:04:30+0000
/project/django-viewflow/, django-viewflow, 1.8.1, Reusable workflow library for django, 2021-01-15T06:46:28+0000
/project/netbox-gitlab/, netbox-gitlab, 0.6.1, GitLab export to Ansible Inventory for NetBox, 2021-03-03T13:29:57+0000
/project/wagtail-localize/, wagtail-localize, 0.9.5, Translation plugin for Wagtail CMS, 2021-03-05T09:43:25+0000
/project/django-test-migrations/, django-test-migrations, 1.1.0, Test django schema and data migrations, including ordering, 2020-12-23T17:26:03+0000
/project/django-editor-ymaps/, django-editor-ymaps, 2.1.21, Creating and editing Yandex maps., 2020-10-17T10:06:52+0000
/project/django-blastplus/, django-blastplus, 3.0.0, A simple Django app to conduct web-based blast+ local alignment search., 2020-02-11T12:35:36+0000
/project/django-docrootcms/, django-docrootcms, 2.0, The missing app for developers creating and maintaining websites, 2020-11-06T23:40:54+0000
/project/django-dynamicsettings/, django-dynamicsettings, 0.0.1, use dynamic (database) settings in your settings.py, 2020-08-09T00:20:11+0000
/project/pixelforest-drf/, pixelforest-drf, 0.2.3, A compilation of the applications we often use in addition to Django Rest Framework, 2020-02-25T13:53:46+0000
/project/notifications-plugin/, notifications-plugin, 0.1.2, A django app to create simple notifications, 2020-04-21T06:29:41+0000
/project/wagtail-resume/, wagtail-resume, 1.1.0, A Wagtail project made to simplify creation of resumes for developers., 2021-01-28T12:16:26+0000
/project/django-html-components/, django-HTML-components, 0.3, Adds several commonly used components for Django, such as a styled header and footer., 2020-01-25T08:36:18+0000
/project/django-commonstuff/, django-commonstuff, 0.9, Reusable app, what collects django-related code, used in most of my projects., 2020-12-24T14:55:52+0000
/project/viapy/, viapy, 0.2.0, Python module for interacting with VIAF data & APIs, 2020-03-26T16:04:07+0000
/project/django-cronman/, django-cronman, 3.0.0, Cron management app for Django, 2021-01-20T20:23:21+0000
/project/djangorestframework-dataclasses/, djangorestframework-dataclasses, 0.9, A dataclasses serializer for Django REST Framework, 2021-04-18T18:21:35+0000
/project/jnt-django-toolbox/, jnt-django-toolbox, 0.1.52, , 2021-02-24T12:48:03+0000
/project/django-migrate-sql-deux/, django-migrate-sql-deux, 0.5.0, Migration support for raw SQL in Django, 2020-03-31T18:48:52+0000
/project/huscy-appointments/, huscy.appointments, 1.1.1, , 2020-05-06T07:56:04+0000
/project/pnp-graphql/, pnp-graphql, 0.1.5, A simple model based GraphQL API configurator written in Python and based of Django, 2020-07-28T04:20:53+0000
/project/html-json-forms/, html-json-forms, 1.1.1, Implementation of the HTML JSON Forms spec for use with the Django REST Framework., 2020-01-15T00:57:48+0000
/project/django-allauth-2fa/, django-allauth-2fa, 0.8, Adds two factor authentication to django-allauth, 2020-02-03T13:35:07+0000
/project/django-patternfly/, django-patternfly, 0.0.1, Patternfly support for Django projects, 2021-01-18T22:44:05+0000
/project/django-fixtures-command/, django-fixtures-command, 0.1.0, Simple Django command that helps to organize your fixtures, 2020-12-09T02:24:58+0000
/project/django-library-project/, django-library-project, 0.1, A deployable Django app created by the cookiecutter-django-library template., 2020-09-12T09:30:35+0000
/project/graphene-django-optimizer/, graphene-django-optimizer, 0.8.0, Optimize database access inside graphene queries., 2021-01-02T17:19:58+0000
/project/unicef-locations/, unicef-locations, 1.9, Locations for eTools, 2019-12-16T17:13:21+0000
/project/drf-dynamics/, drf-dynamics, 0.0.4, Dynamic mixins for Django REST Framework, 2019-12-24T15:13:48+0000
/project/django-capture-on-commit-callbacks/, django-capture-on-commit-callbacks, 1.4.0, Capture and make assertions on transaction.on_commit() callbacks., 2021-01-25T14:47:58+0000
/project/django-sniplates/, django-sniplates, 0.7.0, Efficient template macro sets for Django, 2020-01-22T21:01:34+0000
/project/django-generic-api-permissions/, django-generic-api-permissions, 0.1.0, Generic API permissions and visibilities for Django, 2020-12-18T12:48:09+0000
/project/django-multitype-file-field/, django-multitype-file-field, 0.0.5, , 2020-01-06T14:06:57+0000
/project/django-windowsauth/, django-windowsauth, 1.4.0, Easy integration and deployment of Django projects into Windows Environments., 2021-02-20T04:12:29+0000
/project/django-fsa/, django-fsa, 2.8.0, Django friendly finite state machine support, forked from django-fsm, 2019-12-08T17:18:14+0000
/project/blender-id-oauth-client/, blender-id-oauth-client, 0.9.3, Django app for using Blender ID as OAuth2 authentication service., 2020-10-21T21:52:41+0000
/project/django-midtrans/, django-midtrans, 0.0.1a0, django_midtrans is a package for integrate midtrans to django framework, 2021-02-15T03:17:15+0000
/project/herbie/, herbie, 1.0b2, Herbie is a central data store for business data in a distributed service architecture., 2020-09-21T10:26:38+0000
/project/django-kaio/, django-kaio, 0.14.3, Class based settings for Django projects that can be read from multiple sources, 2020-11-05T08:03:14+0000
/project/django-simple-metatags/, django-simple-metatags, 2.0.2, The django application allows to add title, keywords and description meta tags to site's pages., 2021-04-21T12:04:51+0000
/project/django-chartjs/, django-chartjs, 2.2.1, Django Chart.js and Hightchart ajax views, 2020-07-15T13:53:19+0000
/project/sharepoint-rest-api/, sharepoint-rest-api, 0.7.4, Provide REST API (DRF style) for SharePoint, 2020-12-19T04:01:49+0000
/project/django-fakemoneyd/, django-fakemoneyd, 0.1.1, A Django app to provide currencies and amount of the currencies., 2020-11-02T07:57:25+0000
/project/django-token-tools/, django-token-tools, 0.1.2, Suite of Django tools around token authentication., 2019-12-17T14:14:48+0000
/project/pinax-teams/, pinax-teams, 2.0.0, An app for Django sites that supports open, by invitation, and by application teams, 2020-07-19T18:17:51+0000
/project/django-celery-tracker/, django-celery-tracker, 1.2.0, Celery tracker for Django., 2020-12-07T13:16:29+0000
/project/django-xworkflows/, django-xworkflows, 1.0.0, A django app enabling Django models to use xworkflows., 2020-03-09T18:48:02+0000
/project/django-avishan/, django-avishan, 0.5.32, Avishan is just an set of tools, 2021-03-29T18:21:17+0000
/project/django-terra-geocrud/, django-terra-geocrud, 1.0.14, Geographic CRUD for django-geostore, 2021-04-16T13:02:06+0000
/project/django-material/, django-material, 1.7.6, Material design for django forms and admin, 2021-03-26T00:45:18+0000
/project/django-fluent-blogs/, django-fluent-blogs, 2.0.6, A blog engine with flexible block contents (based on django-fluent-contents)., 2020-06-11T09:39:11+0000
/project/django-statusboard/, django-statusboard, 0.10.0, Django app to show system status, 2020-12-04T09:13:36+0000
/project/django-states3/, django-states3, 3.0.1, State machine for django models, 2019-12-05T08:18:13+0000
/project/django-terra-settings/, django-terra-settings, 1.0.3, Common settings and utils for terra apps., 2021-04-13T09:46:13+0000
/project/django-mssql-azure-backend/, django-mssql-azure-backend, 1.0.2, Django backend for Microsoft SQL Server, 2020-11-20T06:33:23+0000
/project/dj-currencies3/, dj-currencies3, 1.0.2, A reusable django app that provides locally updated exchange rates to your app, 2020-12-28T06:02:48+0000
/project/pinax-news/, pinax-news, 3.0.0, a simple app for publishing links to news articles on your site, 2020-07-17T23:39:00+0000
/project/mssql-django/, mssql-django, 1.0b1, Django backend for Microsoft SQL Server, 2021-03-19T17:22:27+0000
/project/django-permissions-auditor/, django-permissions-auditor, 1.0.3, django-permissions-auditor is a tool to audit access control on your django app., 2021-02-15T20:04:10+0000
/project/ssi-views/, ssi-views, 0.1.1, A simple Django application to process SSI includes, 2021-02-08T09:46:03+0000
/project/huscy-attributes/, huscy.attributes, 0.3.0a5, , 2020-09-02T18:12:54+0000
/project/django-keys/, django-keys, 1.0.4, Python package and CLI tool for generating and handling secret keys used by Django applications., 2021-04-14T10:47:07+0000
/project/unicms-template-unical/, unicms-template-unical, 0.4.11, uniCMS Unical Template based on Bootstrap Italia, 2021-04-22T11:05:20+0000
/project/django-cool/, django-cool, 1.1.1, Cool to use for the Django Framework., 2021-04-25T09:00:59+0000
/project/django-yamldoc/, django-yamldoc, 1.0.0, Quoins for static sites, 2021-04-25T19:24:06+0000
/project/django-lgi/, django-lgi, 0.1.2, Django Lambda Gateway Interface, 2020-07-07T20:16:32+0000
/project/django-cricket-statistics/, django-cricket-statistics, 0.0.1, A Django app for cricket statistics, 2020-09-17T15:07:59+0000
/project/django-uwsgi-taskmanager/, django-uwsgi-taskmanager, 2.2.11, Django application to manage async tasks via admin interface, using uWSGI spooler., 2021-04-10T10:12:55+0000
/project/df-websockets/, df-websockets, 0.10.9, Websocket integration for Django, 2021-04-16T08:51:00+0000
/project/django-pg-zero-downtime-migrations/, django-pg-zero-downtime-migrations, 0.10, Django postgresql backend that apply migrations with respect to database locks, 2020-09-30T22:47:34+0000
/project/django-redis/, django-redis, 4.12.1, Full featured redis cache backend for Django., 2020-05-27T11:38:54+0000
/project/django-frontend-forms/, django-frontend-forms, 0.2.10, A Django helper app to add editing capabilities to the frontend using modal forms, 2021-04-09T08:00:48+0000
/project/wagtailstreamforms/, wagtailstreamforms, 3.14, Wagtail forms in a streamfield, 2021-03-26T09:09:42+0000
/project/django-polymodels/, django-polymodels, 1.7.0, Polymorphic models implementation for django, 2021-03-20T06:21:14+0000
/project/dp-packaging-index-server/, dp-packaging-index-server, 0.0.2, A table for storing app settings, 2020-03-23T21:08:11+0000
/project/django-address/, django-address, 0.2.5, A django application for describing addresses., 2020-08-30T19:15:15+0000
/project/django-celery-growthmonitor/, django-celery-growthmonitor, 1.0.1, A Django helper to monitor jobs running Celery tasks, 2020-07-29T12:39:03+0000
/project/django-bread/, django-bread, 1.0.2, Helper for building BREAD interfaces, 2020-12-16T20:18:10+0000
/project/django-countries-plus/, django-countries-plus, 1.3.1, A django model & fixture containing all data from the countries table of Geonames.org, 2020-01-21T13:39:24+0000
/project/django-thaad/, django-thaad, 1.0.5, Provide utils to intercept and save/redirect requests, 2020-05-25T01:50:01+0000
/project/minigest/, minigest, 0.3.0, Un mini gestionale pensato per aiutare a mantenere i conti di un'azienda, 2020-07-17T12:13:30+0000
/project/django-localized-recurrence/, django-localized-recurrence, 4.0.0, Store events that recur in users' local times., 2020-12-29T07:54:06+0000
/project/django-markdown-view/, django-markdown-view, 0.0.4, Serve .md pages as Django views., 2020-07-09T18:03:44+0000
/project/django-push-notifications/, django-push-notifications, 2.0.0, Send push notifications to mobile devices through GCM, APNS or WNS and to WebPush (Chrome, Firefox and Opera) in Django, 2020-03-11T14:08:19+0000
/project/django-icomoon/, django-icomoon, 1.4.0, A Django app to deploy wefonts from Icomoon and display them, 2020-08-18T00:06:02+0000
/project/django-oscar-stores/, django-oscar-stores, 3.0, An extension for Oscar to include stores, 2020-11-20T11:31:32+0000
/project/django-mssql-backend-aad/, django-mssql-backend-aad, 0.2.1, Django backend for Microsoft SQL Server with AAD and Azure MSI suport, 2021-02-26T17:48:23+0000
/project/django-flag-app/, django-flag-app, 1.1.0, A pluggable django application that adds the ability for users to flag(or report) your models, 2021-04-18T15:40:40+0000
/project/django-sitemap-generate/, django-sitemap-generate, 0.4.0, Background sitemap generation for Django, 2021-04-09T10:13:00+0000
/project/huscy-data-request/, huscy.data-request, 0.1.0a0, , 2020-07-24T16:00:55+0000
/project/nuclear-postaladdress/, nuclear-postaladdress, 1.0.0, A django application for describing addresses., 2020-12-09T01:38:55+0000
/project/uniauth-saml2-idp/, uniauth-saml2-idp, 2.0.0b0, uniAuth is a Django SAML2 Identity Provider, 2021-04-08T13:51:38+0000
/project/django-imap-backend/, django-imap-backend, 0.2.3, IMAP backend for Django mail package, 2020-07-19T16:39:45+0000
/project/django-ajaxview/, django-ajaxview, 1.0.1, Django Ajax base view, 2020-12-26T21:51:35+0000
/project/scrapycw/, scrapycw, 0.3.0, 一个web监控scrapy的工具, 2020-02-09T13:25:38+0000
/project/myks-gallery/, myks-gallery, 0.8, Photo gallery with granular access control, 2021-01-17T08:01:20+0000
/project/django-admin-search-builder/, django-admin-search-builder, 0.2.2, Django Admin Search Builder, 2020-05-29T08:24:34+0000
/project/drf-guard/, drf-guard, 0.3.0, Flexible permissions for Django REST Framework, 2020-08-01T21:45:18+0000
/project/django-cancan/, django-cancan, 0.4.2, Authorization library for Django, 2021-03-03T07:47:16+0000
/project/django-google-maps/, django-google-maps, 0.12.4, Plugs google maps V3 api into Django admin., 2021-04-06T13:26:33+0000
/project/django-comments-dab/, django-comments-dab, 2.6.1, Django Comment app. It can be associated with any given model., 2021-04-17T11:38:07+0000
/project/django-form-builder/, django-form-builder, 0.16.3, Django Form builder, 2020-12-17T15:27:12+0000
/project/django-app-helper/, django-app-helper, 3.0.1, Helper for django applications development, 2020-12-09T14:13:17+0000
/project/authens/, authens, 0.1b3, CAS Authentication at the ENS, 2021-04-06T22:11:42+0000
/project/django-tgb-basics/, django-tgb-basics, 0.2.14, Basic fundamentals features for Django projects., 2020-07-30T18:41:57+0000
/project/django-exoral/, django-exoral, 0.1.1, Django-App für die Katalogisierung mündlicher Prüfungen, 2020-11-17T20:21:57+0000
/project/django-convenient-formsets/, django-convenient-formsets, 0.9.2, Django formsets made convenient for users and developers alike., 2021-04-21T12:25:08+0000
/project/cool-django-auth-ldap/, cool-django-auth-ldap, 1.1.3, https://github.com/django-auth-ldap/django-auth-ldap/blob/2.0.0/docs/index.rst with little extra. Based on version 2.0.0, 2021-01-02T10:13:15+0000
/project/django-upload-form/, django-upload-form, 0.5.0, A minimal (yet careful about UX) solution to upload multiple files in a Django project, using a Django-like Form Class, 2021-02-23T19:05:07+0000
/project/django-postges-lookups-any/, django-postges-lookups-any, 0.1.2, Provides =ANY(ARRAY(xxx)) instead of IN (xxx), 2021-02-08T21:57:15+0000
/project/django-side-effects/, django-side-effects, 1.6.2, Django app for managing external side effects., 2020-08-19T20:50:59+0000
/project/drf-writable-nested/, drf-writable-nested, 0.6.2, Writable nested helpers for django-rest-framework's serializers, 2020-10-29T16:29:11+0000
/project/rest-framework-apicontrol/, rest-framework-apicontrol, 0.8.4, Control Clients Apps access over REST APIs with ApiKeys, 2020-12-27T00:19:40+0000
/project/common-framework/, common-framework, 2021.4.21, All-in-one framework for Django and Django REST Framework, 2021-04-23T00:24:39+0000
/project/django-hybrid-attributes/, django-hybrid-attributes, 0.1.0, A Django plugin for mimicking the power of SQLAlchemy hybrid_property and hybrid_method, 2020-06-05T17:26:18+0000
/project/aiia-django-rest-swagger/, aiia-django-rest-swagger, 1.0.0, Swagger UI for Django REST Framework 3.5+, 2020-10-23T01:24:35+0000
/project/django-flexible-subscriptions/, django-flexible-subscriptions, 0.15.1, A subscription and recurrent billing application for Django., 2020-08-11T01:23:42+0000
/project/django-tidyfields/, django-tidyfields, 1.2.0, Easily accept html input with Django models, templates and DRF serializers, 2020-03-29T21:05:24+0000
/project/django-rql/, django-rql, 3.9.0, Django RQL Filtering, 2021-04-14T09:22:06+0000
/project/dbsettings/, dbsettings, 0.9.6, A Django app to store key-value pairs in the database, 2021-02-12T13:31:55+0000
/project/django-pwa/, django-pwa, 1.0.10, A Django app to include a manifest.json and Service Worker instance to enable progressive web app behavior, 2020-07-01T22:27:48+0000
/project/django-client-side-image-cropping/, django-client-side-image-cropping, 0.1.8, Widget for the Django ImageField that provides an interface for cropping the image client-side to a specific size., 2021-03-31T19:51:16+0000
/project/django-simple-account/, django-simple-account, 0.0.18, Django simple account, 2020-05-22T19:32:31+0000
/project/django-guardian/, django-guardian, 2.3.0, Implementation of per object permissions for Django., 2020-06-07T23:52:17+0000
/project/django-log-viewer/, django-log-viewer, 1.1.2, Django log viewer, 2020-10-30T10:57:39+0000
/project/django-sortedm2m/, django-sortedm2m, 3.0.2, Drop-in replacement for django's many to many field with sorted relations., 2020-07-23T17:00:35+0000
/project/django-elastipymemcache/, django-elastipymemcache, 2.0.4, Django cache backend for Amazon ElastiCache (memcached), 2020-08-10T16:51:27+0000
/project/django-netbox-confluence/, django-netbox-confluence, 0.1.4, A Django app to connect NetBox and Confluence Wiki., 2019-12-20T14:57:55+0000
/project/django-enumfields/, django-enumfields, 2.1.1, Real Python Enums for Django., 2021-02-23T06:41:05+0000
/project/django-cognito-redux/, django-cognito-redux, 1.4.4, Library for allowing the use of AWS Cognito security in Django projects, 2020-12-07T19:34:10+0000
/project/cloudinary/, cloudinary, 1.25.0, Python and Django SDK for Cloudinary, 2021-03-26T14:20:21+0000
/project/aa-standingssync/, aa-standingssync, 1.1.4, Standing sync for non-alliance characters - app for for Alliance Auth, 2020-10-09T15:02:05+0000
/project/django-tagulous/, django-tagulous, 1.1.0, Fabulous Tagging for Django, 2020-12-06T14:26:53+0000
/project/request-id-django-log/, request-id-django-log, 0.2.0, A simple way to implement request_id in Django, 2020-07-28T17:48:19+0000
/project/django-concurrency/, django-concurrency, 2.3, Optimistic lock implementation for Django. Prevents users from doing concurrent editing., 2021-03-07T18:30:45+0000
/project/djiffy/, djiffy, 0.6.0, Django app for IIIF Presentation book content, 2020-03-26T18:21:26+0000
/project/django-taxtea/, django-taxtea, 1.0.2, TaxTea - Django App that calculates tax rates for SaaS products, 2020-08-17T18:03:16+0000
/project/dfsaas-blog/, dfsaas-blog, 0.1.4, A Django app to run blogs., 2020-11-09T19:26:12+0000
/project/django-coverage-plugin/, django-coverage-plugin, 1.8.0, Django template coverage.py plugin, 2020-01-24T01:29:13+0000
/project/whitenoise/, whitenoise, 5.2.0, Radically simplified static file serving for WSGI applications, 2020-08-04T09:33:38+0000
/project/version-control/, version-control, 0.0.5, Django Version Control, 2021-04-14T17:30:58+0000
/project/fundor-utilities/, fundor-utilities, 1.3.8, , 2020-08-03T12:50:39+0000
/project/django-instagram-profile/, django-instagram-profile, 1.0.0, Django package to sync and display personal Instagram media, 2021-01-04T15:36:01+0000
/project/django-query-profiler/, django-query-profiler, 0.6, Django query profiler, 2021-01-16T00:13:27+0000
