/project/lttbc/, lttbc, 0.2.0, Largest triangle three buckets module for Python written in C, 2020-10-25T16:13:50+0000
/project/odin-ai/, odin-ai, 1.2.5, Deep learning for research and production, 2020-06-07T21:36:53+0000
/project/agate/, agate, 1.6.2, A data analysis library that is optimized for humans instead of machines., 2021-03-10T22:04:35+0000
/project/eoxserver/, EOxServer, 0.4.0, EOxServer is a server for Earth Observation (EO) data, 2016-04-21T10:16:44+0000
/project/summa-visualization/, summa-visualization, 0.1.0b0, A visualization for the graphs generated by summa., 2018-01-18T06:03:47+0000
/project/biasedurn/, biasedurn, 0.0.2, BiasedUrn provides discrete distributions in Python, 2019-02-08T09:50:05+0000
/project/hcpre/, hcpre, 0.5.5, Generalized launcher for human connectome project BOLD preprocessing, 2014-06-11T20:24:10+0000
/project/skimmr-bm/, skimmr_bm, 0.1-a2, SKIMMR library and scipts for machine-aided skim-reading (the specific package version for biomedical texts), 2013-02-15T17:24:03+0000
/project/scrapy-loader-upkeep/, scrapy-loader-upkeep, 0.1.1, An alternative to the built-in ItemLoader of Scrapy which focuses on maintainability of fallback parsers., 2020-01-04T05:20:08+0000
/project/znet/, Znet, 0.0.1, Devision tree, 2019-04-22T22:28:52+0000
/project/pidsim-models/, pidsim-models, 0.2.1, A set of reference models for PIDSIM, 2010-11-03T01:29:42+0000
/project/ibm-wos-utils/, ibm-wos-utils, 2.1.1, IBM Watson OpenScale API client utility module, 2021-03-15T05:08:30+0000
/project/torchmetrics/, torchmetrics, 0.3.1, PyTorch native Metrics, 2021-04-21T22:50:25+0000
/project/vectorbt/, vectorbt, 0.17.7, Python library for backtesting and analyzing trading strategies at scale, 2021-03-31T22:14:56+0000
/project/bw2agg/, bw2agg, 0.1.2, Extension to brightway2 package to create and work with aggregated data, 2019-09-06T19:47:48+0000
/project/sframe/, SFrame, 2.1, SFrame is an scalable, out-of-core dataframe, which allows you to work with datasets that are larger than the amount of RAM on your system., 2016-07-22T16:50:57+0000
/project/oamap/, oamap, 0.12.4, Perform high-speed calculations on columnar data without creating intermediate objects., 2018-06-12T07:05:27+0000
/project/psicons-core/, psicons.core, 0.1, A tool for documentable and reproducible analysis and research, 2011-08-01T17:06:32+0000
/project/pythoms/, pythoms, 2.2.6, A Python library to aid in the processing and interpretation of mass spectrometric data., 2021-03-23T23:11:44+0000
/project/awkward-cpp/, awkward-cpp, 0.13.0, Connect awkward-arrays to C++ using pybind11., 2020-07-20T15:30:05+0000
/project/lmoments/, lmoments, 0.2.2, L-Moment Algorithms in Python 2.7, 2014-01-23T05:48:08+0000
/project/pysafetybear/, PySafetyBear, 0.10.0, 'PySafetyBear' bear for coala (http://coala.rtfd.org/), 2017-03-16T13:05:29+0000
/project/openfisca-parsers/, OpenFisca-Parsers, 1.0.2, Lexers, parsers, compilers, etc for OpenFisca source code, 2017-03-14T10:38:44+0000
/project/rgmining-dataset-io/, rgmining-dataset-io, 0.9.2, Dataset I/O for Review graph mining project, 2017-06-22T16:01:56+0000
/project/huhuseg/, HuhuSeg, 0.6.1, Simple Chinese segmentator, keywords extractor and other examples, 2018-06-01T16:02:57+0000
/project/dedupe-hcluster/, dedupe-hcluster, 0.3.8, Hierarchical Clustering Algorithms (Information Theory), 2020-01-11T19:50:24+0000
/project/hcluster/, hcluster, 0.2.0, A hierarchical clustering package for Scipy., 2008-12-14T10:22:11+0000
/project/portfolio-analytics/, portfolio-analytics, 0.0.1, Keep calm and optimize., 2014-08-03T10:53:04+0000
/project/jgtextrank/, jgtextrank, 0.1.6, Yet another Python implementation of TextRank: package for the creation, manipulation, and study of TextRank algorithm based keywords extraction and summarisation, 2019-11-27T11:51:43+0000
/project/simpleitk-simpleelastix/, SimpleITK-SimpleElastix, 2.0.0rc2.dev909, SimpleITK is a simplified interface to the Insight Toolkit (ITK) for image registration and segmentation, 2021-03-05T13:16:34+0000
/project/guide-seq/, guide-seq, 1.0.2, An easy to use bioinformatic pipeline for the GUIDE-seq assay., 2020-12-21T15:17:21+0000
/project/scaleogram/, scaleogram, 0.9.5, User friendly scaleogram plot for Continuous Wavelet Transform, 2019-04-15T14:40:12+0000
/project/openfisca-uk/, OpenFisca-UK, 0.2.1, OpenFisca tax and benefit system for UK, 2020-11-30T12:27:04+0000
/project/django-public-project/, django-public-project, 0.7.5, Custom CMS for making public projects, political processes or enquiry commission work more transparent, 2017-03-16T18:45:40+0000
/project/ethnicolr/, ethnicolr, 0.5.0, Predict Race/Ethnicity Based on Sequence of Characters in the Name, 2021-02-05T14:55:06+0000
/project/simplemma/, simplemma, 0.3.0, A simple multilingual lemmatizer for Python., 2021-04-08T19:36:36+0000
/project/aict-tools/, aict-tools, 0.27.0, Artificial Intelligence for Imaging Atmospheric Cherenkov Telescopes, 2021-04-06T14:38:29+0000
/project/wmd/, wmd, 1.3.2, Accelerated functions to calculate Word Mover's Distance, 2019-10-21T12:39:52+0000
/project/itk-numerics/, itk-numerics, 5.2.0, ITK is an open-source toolkit for multidimensional image analysis, 2021-04-04T14:13:35+0000
/project/kupp/, kupp, 0.0.2, A package for preprocessing a knowledge graph, 2019-05-07T09:24:56+0000
/project/teleforma/, TeleForma, 0.8, open web multimedia e-learning platform, 2012-09-19T21:54:24+0000
/project/trendet/, trendet, 0.7, Trend detection on stock time series data, 2020-06-28T17:30:29+0000
/project/autogluon-core/, autogluon.core, 0.1.0, AutoML for Text, Image, and Tabular Data, 2021-03-01T22:06:41+0000
/project/audiomodels/, audiomodels, 0.1.dev3, audio models package with semantic features identification, 2019-08-27T19:26:30+0000
/project/target-datadotworld/, target-datadotworld, 1.0.1, Singer target for data.world, 2018-06-08T20:59:13+0000
/project/doan/, doan, 0.2.3, Simple library for analytics, 2017-09-24T08:10:26+0000
/project/ayx-plugin-cli/, ayx-plugin-cli, 0.1b2, The Alteryx command line interface for using Alteryx SDKs., 2021-02-26T23:52:44+0000
/project/usaddress/, usaddress, 0.5.10, Parse US addresses using conditional random fields, 2017-02-09T14:18:22+0000
/project/cn-zipline-live/, cn-zipline-live, 1.3, A backtester and live trader for financial algorithms in China., 2018-01-16T13:45:30+0000
/project/orange3-textable/, Orange3-Textable, 3.1.9, Textable add-on for Orange 3 data mining software package., 2021-04-15T05:49:10+0000
/project/goreturnsbear/, GoReturnsBear, 0.10.0, 'GoReturnsBear' bear for coala (http://coala.rtfd.org/), 2017-03-16T13:00:44+0000
/project/copyxnat/, copyxnat, 0.7.6, CopyXnat is a python utility for copying XNAT projects from one XNAT server to another, 2021-03-30T07:49:15+0000
/project/taguette/, taguette, 0.10.1, Document tagger for qualitative analysis, 2021-02-24T22:02:43+0000
/project/recorder-base-test/, recOrder-base-test, 0.0.1, Framework to enable acquisition, analysis, visualization of computational microscopy workflows, 2020-01-07T19:02:01+0000
/project/champ/, champ, 2.1.1, Modularity based networks partition selection tool, 2020-10-09T14:44:11+0000
/project/scikit-tda/, scikit-tda, 0.1.0, Topological Data Analysis for humans, 2021-01-09T19:51:04+0000
/project/torchhandle/, torchhandle, 0.9.2104.1, TorchHandle makes your PyTorch development more efficient and make you use PyTorch more comfortable, 2021-03-25T04:40:10+0000
/project/luftdatenpumpe/, luftdatenpumpe, 0.20.2, Process live and historical data from luftdaten.info. Filter by station-id, sensor-id and sensor-type, apply reverse geocoding, store into TSDB and RDBMS databases, publish to MQTT or just output as JSON., 2020-01-27T23:14:00+0000
/project/sequana-coverage/, sequana-coverage, 0.9.1, Parallelise version of sequana_coverage standalone application., 2020-07-19T13:13:48+0000
/project/permutationimportance/, PermutationImportance, 1.2.1.8, Important variables determined through data-based variable importance methods, 2020-10-07T11:54:43+0000
/project/masterfile/, masterfile, 0.5.1, Tools to organize, document, and validate the variables of interest in scientific studies, 2020-09-24T15:57:41+0000
/project/dfauditor/, dfauditor, 0.0.4, A dataframe auditor that extracts descriptive statistics from dataframe columns, 2020-11-17T19:26:42+0000
/project/caar/, caar, 5.0.0b6, Accelerating analysis of time stamped sensor observations and cycling device operations., 2016-12-30T18:46:04+0000
/project/curious/, curious, 1.2.0, Graph-based data exploration tool, 2018-04-06T15:40:17+0000
/project/pyscagnostics/, pyscagnostics, 0.1.0a4, Graph theoretic scatterplot diagnostics, 2020-07-04T16:59:58+0000
/project/road-agent/, road-agent, 1.0.1, Object-oriented framework for modeling of mobile agents., 2019-04-12T19:27:47+0000
/project/ncloud/, ncloud, 2.8.1, ncloud is a command line client to help you use and manage Nervana's deep learning cloud., 2017-12-01T18:49:03+0000
/project/upsetjs-jupyter-widget/, upsetjs-jupyter-widget, 1.9.0, UpSet.js is a re-implementation of UpSetR to create interactive set visualizations for more than three sets, 2021-02-17T18:26:00+0000
/project/astar/, astar, 0.93, A-* algorithm implementation, 2021-01-25T18:46:31+0000
/project/rockset/, rockset, 0.7.68, Rockset Python Client and `rock` CLI, 2021-02-11T19:08:34+0000
/project/mcerp3/, mcerp3, 1.0.3, Real-time latin-hypercube-sampling-based Monte Carlo Error Propagation, 2018-08-30T22:06:03+0000
/project/push/, push, 0.2, Twitter as a push notification service, 2013-02-09T21:40:15+0000
/project/hdltex/, HDLTex, 1.0.5, HDLTex: Hierarchical Deep Learning for Text Classification, 2018-04-20T17:23:32+0000
/project/textmining3/, textmining3, 1.1.0, Text Mining Utilities for Python 3, 2018-10-13T10:26:28+0000
/project/save-thread-result/, save-thread-result, 0.0.6, Simple subclass wrapper around `threading.Thread` to get the return value from a thread in python (from `threading` built-in module in Python Standard library). Exact same interface for creating an instance of this threading sublcass as `threading.Thread`!, 2021-02-08T00:27:52+0000
/project/phplintbear/, PHPLintBear, 0.10.0, 'PHPLintBear' bear for coala (http://coala.rtfd.org/), 2017-03-16T13:03:42+0000
/project/famafrench/, famafrench, 0.1.4, Python package designed to construct and replicate datasets from Ken French's online library (https://mba.tuck.dartmouth.edu/pages/faculty/ken.french/data_library.html) via remote access to wrds-cloud., 2020-05-12T06:43:59+0000
/project/rowordnet/, rowordnet, 1.1.0, Python API for the Romanian WordNet, 2020-08-06T10:47:09+0000
/project/cukuramoto/, cukuramoto, 1.0.0, , 2019-09-07T03:29:27+0000
/project/w2m/, w2m, 0.2, www spider producing an adjacency matrix, 2012-01-02T09:51:39+0000
/project/dockerfilelintbear/, DockerfileLintBear, 0.10.0, 'DockerfileLintBear' bear for coala (http://coala.rtfd.org/), 2017-03-16T12:57:05+0000
/project/pygraphviz/, pygraphviz, 1.7, Python interface to Graphviz, 2021-02-01T21:54:55+0000
/project/trunklucator/, trunklucator, 1.1.6, Easy plugable UI for your experiments with data and machine learning, 2020-10-22T15:47:31+0000
/project/nervananeon/, nervananeon, 2.6.0, Intel's deep learning framework, 2018-01-05T23:25:04+0000
/project/comparedecimal/, comparedecimal, 1.0.0, Compare decimal representations of floating-point numbers., 2019-12-02T15:54:25+0000
/project/imagemounter/, imagemounter, 3.1.0, Command line utility and Python package to ease the (un)mounting of forensic disk images., 2017-08-06T09:44:33+0000
/project/mozilla-taar3/, mozilla-taar3, 1.0.7, Telemetry-Aware Addon Recommender, 2021-02-05T02:16:47+0000
/project/pyltp/, pyltp, 0.2.1, pyltp: the python extension for LTP, 2017-12-22T05:26:02+0000
/project/pysbd/, pysbd, 0.3.4, pysbd (Python Sentence Boundary Disambiguation) is a rule-based sentence boundary detection that works out-of-the-box across many languages., 2021-02-11T16:36:33+0000
/project/canonicalize/, canonicalize, 1.3, canonicalize a cluster of records, 2015-02-12T22:38:51+0000
/project/trompace-client/, trompace-client, 0.3, A python library to read from and write to the Trompa CE, 2021-04-23T17:57:04+0000
/project/cms-estate/, cms-estate, 1.0.6, Best CMS for website of Real Estate agency. FREE! Reservation calendar, Mobile version, SEO, Admin panel , Classified ads. Django + ReactJS., 2018-05-22T17:35:22+0000
/project/ripser/, ripser, 0.6.0, A Lean Persistent Homology Library for Python, 2020-11-02T18:07:16+0000
/project/vecshare/, vecshare, 1.3.9, Python library for sharing word embeddings, 2018-01-25T19:09:12+0000
/project/meta-optimize/, meta-optimize, 0.0.1, Meta Optimization for Hyperactive, 2020-02-15T19:19:17+0000
/project/coala-json/, coala-json, 0.1.3, A collection of coala json utilities, 2019-09-04T15:57:37+0000
/project/arxiv-cli/, arxiv-cli, 0.1.6, A Python wrapper for the arXiv API., 2018-08-22T23:44:25+0000
/project/kotka/, kotka, 0.1.1, Korean Obfuscation ToolKit Advanced, 2020-07-26T09:59:01+0000
/project/tinkle/, tinkle, 0.0.1, Data Simplified, 2018-05-04T06:25:56+0000
/project/choicemodels/, choicemodels, 0.2.2, Tools for discrete choice estimation, 2020-04-17T19:59:43+0000
/project/ystafdb/, ystafdb, 0.5.2, CLI tool to parse YSTAFDB and produce ttl/nt/xml., 2020-07-08T14:18:28+0000
/project/mementoembed/, mementoembed, 0.2021.2.22.22825, , 2021-02-22T02:35:58+0000
/project/oonibackend/, oonibackend, 1.3.7, Open Observatory of Network Interference Backend, 2019-12-06T08:33:16+0000
/project/daymetpy/, daymetpy, 1.0.0, A library for accessing Daymet surface weather data, 2018-05-12T13:14:58+0000
/project/parserator/, parserator, 0.6.8, Create parsers, 2018-03-29T02:09:22+0000
/project/pgreaper/, pgreaper, 1.0.0a2, A simple, flexible, and robust wrapper around the Postgres COPY command. Supports loading CSV/JSON files and Python objects with automatic schema inference., 2017-10-18T23:19:15+0000
/project/mllint/, mllint, 0.5.1, Linter for Machine Learning projects, 2021-04-15T19:14:41+0000
/project/shelby/, shelby, 0.3, Framework for tabular data ML competitions, 2018-11-26T14:07:05+0000
/project/topic999/, topic999, 1.0.1.dev1, Topic Model User Evaluation, 2017-06-22T09:23:57+0000
/project/spkit/, spkit, 0.0.9.2, SpKit: Signal Processing toolkit | Nikesh Bajaj |, 2021-04-22T16:33:02+0000
/project/sql-test/, sql-test, 0.1.5, Conduct quality assurance testing on database tables, 2019-08-31T15:49:12+0000
/project/investpyx/, investpyx, 0.1.5, This is a fork of investpy library, and is intended for testing purpose only. All descriptions are hence of original investpy library. Please support the original Author for the contribution he made by developing the investpy library., 2021-02-24T22:02:14+0000
/project/gdal-utils/, gdal-utils, 3.3.0.6, gdal-utils: An extension library for GDAL - Geospatial Data Abstraction Library, 2021-03-27T14:57:17+0000
/project/selenium-update/, selenium-update, 0.0.0, Automate Selenium webdriver dependency set up, 2020-08-09T10:21:26+0000
/project/meteostat/, meteostat, 1.2.2, Access and analyze historical weather and climate data with Python., 2021-04-12T15:19:18+0000
/project/cdochain/, cdochain, 0.2b3, Easy chaining of cdo methods., 2016-06-28T13:18:58+0000
/project/pydelphin/, PyDelphin, 1.5.1, Libraries and scripts for DELPH-IN data, 2021-01-05T01:22:10+0000
/project/perlcriticbear/, PerlCriticBear, 0.10.0, 'PerlCriticBear' bear for coala (http://coala.rtfd.org/), 2017-03-16T13:03:30+0000
/project/bioread/, bioread, 2.1.2, Utilities to read BIOPAC AcqKnowledge files, 2020-12-04T03:10:24+0000
/project/dynamic-stock-model/, dynamic_stock_model, 1.0, Python class for efficient handling of dynamic stock models, 2015-05-24T19:58:36+0000
/project/sequana-rnaseq/, sequana-rnaseq, 0.13.0, A RNAseq pipeline from raw reads to feature counts, 2021-04-09T20:28:18+0000
/project/puq/, puq, 2.6.1, PUQ Uncertainty Quantification Tool, 2018-07-17T20:31:55+0000
/project/labpy/, labpy, 0.0.4, labpy - a python laboratory (automation) environment, 2018-11-04T19:38:37+0000
/project/datapunt-processing/, datapunt-processing, 0.0.1a12, Datapunt generic ETL command line scripts and functions for shell scripting in Docker., 2018-06-15T15:50:19+0000
/project/segtok/, segtok, 1.5.10, sentence segmentation and word tokenization tools, 2020-05-12T20:26:24+0000
/project/comma/, comma, 0.5.3, Python CSV, and delimiter-spaced files, for humans!, 2020-08-08T02:29:48+0000
/project/hexer-hx/, hexer-hx, 0.0.1, a tool to help in the arcane arts of decoding and reverse engineering binary data, 2020-08-16T11:58:19+0000
/project/emobpy/, emobpy, 0.5.3, Time series for battery electric vehicles modeling, 2021-03-16T19:44:37+0000
/project/fuzzycategory/, fuzzycategory, 0.0.4, A context comparison, 2015-12-01T16:08:59+0000
/project/top2vec/, top2vec, 1.0.24, Top2Vec learns jointly embedded topic, document and word vectors., 2021-04-01T13:21:41+0000
/project/spss-converter/, spss-converter, 0.1.1, Simple format converter utility for SPSS data files, 2021-03-31T04:03:57+0000
/project/hspf-utils/, hspf-utils, 5.1.1, Utilities to work with Hydrological Simulation Program - FORTRAN (HSPF) models., 2020-04-30T22:51:43+0000
/project/ncbi-taxonomist/, ncbi-taxonomist, 1.2.1, Toolbox to manage NCBI taxonomical data, 2020-11-14T20:16:55+0000
/project/pyridy/, pyridy, 0.1.0, Support library for measurements made with the Ridy Android App, 2021-04-23T19:43:40+0000
/project/flyingcircus-numeric/, flyingcircus-numeric, 0.1.1.2, FlyingCircus with NumPy/SciPy., 2020-05-19T21:28:59+0000
/project/svgdatashapes/, SVGdatashapes, 0.3.62, Simple procedural library to create many types of plots and data displays in SVG for dynamic web pages. General purpose: biomedical, scientific, business., 2020-03-11T19:38:20+0000
/project/dataduct-flywire/, dataduct-flywire, 0.4.1, DataPipeline for Humans, 2018-07-11T14:09:27+0000
/project/sci-analysis/, sci-analysis, 2.2.1, An easy to use and powerful python-based data exploration and analysis tool, 2019-04-12T03:39:09+0000
/project/sqlintbear/, SQLintBear, 0.10.0, 'SQLintBear' bear for coala (http://coala.rtfd.org/), 2017-03-16T13:06:35+0000
/project/participation/, participation, 0.1.dev1, Participation is a python package for social participation ontologies, rdf data (linked data) triplification and analysis, 2015-03-27T16:37:22+0000
/project/evalne/, evalne, 0.3.3, Open Source Network Embedding Evaluation toolkit, 2020-12-14T12:01:14+0000
/project/bw2preagg/, bw2preagg, 0.2.3, Used to preemptively generate correlated samples in Brightway2 for whole LCI databases., 2020-04-13T11:57:45+0000
/project/modepy/, modepy, 2021.1, Modes and nodes for high-order methods, 2021-04-12T16:22:37+0000
/project/snappysonic/, snappysonic, 0.0.6, snappysonic provides an application to simulate an ultrasound probe moving over a body torso, it is intended for public engagement events", 2021-03-16T11:27:56+0000
/project/resnet-tensorflow/, resnet-tensorflow, 0.0.1, Deep Residual Neural Network, 2017-10-28T05:03:42+0000
/project/simpleitk/, SimpleITK, 2.0.2, SimpleITK is a simplified interface to the Insight Toolkit (ITK) for image registration and segmentation, 2020-12-02T15:04:47+0000
/project/arus/, arus, 1.1.22, Activity Recognition with Ubiquitous Sensing, 2021-02-04T00:09:46+0000
/project/refo/, REfO, 0.13, Regular expressions for objects, 2014-10-08T20:16:52+0000
/project/rvect/, rvect, 0.1.0.0, Implements a vector data type similar to that in the R statistical language., 2011-09-04T16:40:04+0000
/project/napari-tracking/, napari-tracking, 0.0.0, napari tracking plugin., 2020-02-02T21:11:09+0000
/project/mtwaffle/, mtwaffle, 0.7, Magnetotelluric data analysis, 2018-10-07T04:40:15+0000
/project/optimisation/, Optimisation, 1.2, Cellular Optimisation Functions, 2017-08-28T09:19:12+0000
/project/tglex/, tglex, 0.2.1, Lexical analysis base for telegram bots, 2020-03-29T01:44:53+0000
/project/zipunicode/, ZipUnicode, 1.0.0, Fix unreadable file names when extracting zip file, 2020-05-30T04:08:50+0000
/project/lex2/, lex2, 0.9.3, Flexible, ruleset-based tokenizer using regex., 2021-04-19T20:19:21+0000
/project/pyppeteer-spider/, pyppeteer-spider, 1.1.1, A stealthy asynchronous (optionally distributed) spider running Chrome, Headless Chrome, Chromium, or Headless Chromium, 2020-07-11T12:14:30+0000
/project/biomedicus/, biomedicus, 3.0b10, A biomedical and clinical NLP engine., 2021-03-11T00:50:31+0000
/project/kxy/, kxy, 1.0.3, A Powerful Serverless Pre-Learning and Post-Learning Analysis Toolkit, 2021-03-23T03:30:39+0000
/project/vadersentiment-swedish/, vaderSentiment-swedish, 1.0.3, VADER Sentiment Analysis. VADER (Valence Aware Dictionary and sEntiment Reasoner) is a lexicon and rule-based sentiment analysis tool that is specifically attuned to sentiments expressed in social media, and works well on texts from other domains., 2019-10-27T14:03:38+0000
/project/anonlink/, anonlink, 0.14.2, Anonymous linkage using cryptographic hashes and bloom filters, 2021-02-10T01:41:07+0000
/project/emate/, emate, 1.1.3, eMaTe can run in both CPU and GPU and can estimate the spectral density and related trace functions, such as entropy and Estrada index, even in matrices (directed or undirected graphs) with million of nodes., 2020-07-13T12:56:50+0000
/project/ampule/, ampule, 0.9, Ampule (Automated MatPlotLib) is a minimalistic tool designed for repeatednon-interactive processing and plotting of tabular data, 2021-01-05T16:42:15+0000
/project/mordl/, mordl, 1.0.35, Morphological parser (POS, lemmata, NER etc.), 2021-04-05T13:34:39+0000
/project/spatialedge-analytics-mesh/, spatialedge-analytics-mesh, 0.0.2, Facades and common functions necessary for data science and data engineering workflows, 2020-12-03T14:55:11+0000
/project/sinkhorn-knopp/, sinkhorn_knopp, 0.2, Sinkhorn-Knopp Algorithm, 2018-03-31T14:19:50+0000
/project/amphipathic/, amphipathic, 1.0.0, This is a library to evaluate an aminoacid sequence and determine an amphipathic index for each alpha helix or beta sheet., 2020-11-12T13:22:31+0000
/project/life-line-chart/, life-line-chart, 1.7.5, Generate ancestor (genealogy) chart, 2020-09-05T16:22:16+0000
/project/scikit-surgeryimage/, scikit-surgeryimage, 0.8.6, scikit-surgeryimage implements image processing tools and alogrithms for Image Guided Surgery., 2021-03-30T09:26:25+0000
/project/hillmaker/, hillmaker, 0.2.3, Occupancy analysis tool for systems having time of day and day of week effects, 2020-03-18T19:10:27+0000
/project/pergola/, pergola, 0.2.0, A library to analyze and visualize behavioral data by unlocking genomic tools, 2019-12-23T10:38:26+0000
/project/gse/, gse, 0.1.9, extract metadata and dataset from GEO Series Matrix format data, 2014-02-10T22:43:29+0000
/project/pairedcompcalc/, PairedCompCalc, 1.0.1, Statistical Analysis of Paired-Comparison Data, 2020-05-15T05:56:03+0000
/project/levenshtein-search/, Levenshtein-search, 1.4.5, Search through documents for approximately matching strings, 2019-12-31T00:43:32+0000
/project/appstore-profile-scraper/, appstore-profile-scraper, 0.0.10, App Store Profile Information Scraper, 2021-03-30T09:12:06+0000
/project/fretfinder/, fretfinder, 1.0.0, Adaptive guitar fret finder algorithm implementation, 2020-12-13T06:48:04+0000
/project/hdsubnetfinder/, hdsubnetfinder, 0.2.2, Heat Diffusion Sub-network Finder, 2015-08-18T20:35:41+0000
/project/kunteksto/, kunteksto, 2.1.0, The tool to translate your CSV data files into RDF, XML and JSON with full semantics and syntactic validation., 2018-12-28T05:50:41+0000
/project/openfisca-nsw-base/, openfisca-nsw-base, 0.8.0, OpenFisca tax and benefit system for nsw - base package, 2020-01-15T06:09:27+0000
/project/netflowvizu/, NetFlowVizu, 0.6, Network flow visualizer., 2011-06-07T09:14:22+0000
/project/co2dice/, co2dice, 3.0.0, Polyvers's lib to derive subproject versions from tags on Git monorepos., 2019-01-30T11:27:32+0000
/project/pyusid/, pyUSID, 0.0.10, Framework for storing, visualizing, and processing Universal Spectroscopic and Imaging Data (USID), 2021-03-06T14:35:30+0000
/project/louvain-github/, louvain-github, 0.6.1.post1, Forked from louvain-igraph (https://github.com/vtraag/louvain-igraph). Publish because its PyPI version is out-of-date, whereas our scCloud package depends on this github repo version. Will remove if a new release is published., 2019-07-29T20:54:12+0000
/project/kshape/, kshape, 1.0.1, Python implementation of k-Shape, 2017-09-26T12:47:35+0000
/project/ghcmodbear/, GhcModBear, 0.10.0, 'GhcModBear' bear for coala (http://coala.rtfd.org/), 2017-03-16T13:01:08+0000
/project/cifrum/, cifrum, 0.2.6, Flexible and easy-to-use Python library for analysis & manipulation with financial & economic data, 2019-10-07T19:21:12+0000
/project/dbnomics/, DBnomics, 1.2.1, DBnomics Python Client, 2021-04-01T15:37:27+0000
/project/wizardhat/, WizardHat, 0.2.1, Real-time processing and plotting of data streamed over LSL, with a focus on student-led BCI projects., 2018-11-19T22:13:22+0000
/project/defdap/, DefDAP, 0.93.2, A python library for correlating EBSD and HRDIC data., 2021-04-16T14:14:20+0000
/project/pymorphy2-dicts/, pymorphy2-dicts, 2.4.393442.3710985, OpenCorpora.org dictionaries pre-compiled for pymorphy2, 2015-01-17T16:40:38+0000
/project/address-templeter/, address-templeter, 1.41, search for addresses in the text, 2020-06-15T10:00:43+0000
/project/mep/, mep, 0.0.1, Minimal energy path tools for atomistic systems, 2019-08-09T20:14:43+0000
/project/datrie-2019/, datrie-2019, 0.7.1, Super-fast, efficiently stored Trie for Python., 2019-04-29T11:55:05+0000
/project/fast-lapjv/, fast-lapjv, 1.0.0, Linear sum assignment problem solver using Jonker-Volgenant algorithm., 2020-05-21T03:37:23+0000
/project/sdm-collector/, sdm-collector, 1.0.3, Eastron SDM120 Modbus collector, 2017-10-07T15:56:27+0000
/project/oafabrik/, oafabrik, 0.8.0, A Python SDK for Fabrik, 2021-04-20T12:38:13+0000
