/project/secs/, secs, 0.2.0, Simple encrypted containers, 2017-05-03T04:09:27+0000
/project/bingmaps/, bingmaps, 0.3.7, bingmaps, 2016-03-25T05:15:33+0000
/project/izon/, izon, 2018.5.24, A dependency handling tool for files, 2018-05-25T08:32:04+0000
/project/watchdog/, watchdog, 2.0.3, Filesystem events monitoring, 2021-04-22T17:57:30+0000
/project/aiofiles/, aiofiles, 0.6.0, File support for asyncio., 2020-10-27T17:36:43+0000
/project/witchfinder/, witchfinder, 0.1.1, an experiment in modern file carving, 2020-08-25T00:09:49+0000
/project/safemount/, safemount, 0.6, A FUSE mount that only permits safe characters in the file names, 2019-11-27T13:51:38+0000
/project/yatfs/, yatfs, 0.4.0, FUSE-based torrent-backed filesystem, 2018-02-01T09:39:13+0000
/project/txdir/, txdir, 2.0.0, Creating file tree from text tree and vice versa, 2019-11-20T21:35:20+0000
/project/heketi/, heketi, 3.0.0, Python client library for Heketi, 2016-10-25T11:46:57+0000
/project/simple-file-poller/, simple-file-poller, 0.0.10, Simple Python 3 library for file polling., 2021-03-17T20:27:37+0000
/project/reusables/, reusables, 0.9.6, Commonly Consumed Code Commodities, 2020-09-26T15:46:56+0000
/project/fspath/, fspath, 20190323, semantic path names and more, 2019-03-23T17:18:16+0000
/project/pathway/, Pathway, 1.3.1, A library for interacting with the filesystem, 2010-01-18T02:26:02+0000
/project/bedup/, bedup, 0.10.1, Deduplication for Btrfs filesystems, 2016-05-18T07:30:55+0000
/project/fuselpk/, fuselpk, 0.1, LDAP Public Key filesystem for openssh, 2010-09-02T14:42:49+0000
/project/opendir/, opendir, 0.0.1, Implements POSIX opendir, 2008-06-28T16:41:36+0000
/project/renameat2/, renameat2, 0.4.0, A wrapper around Linux's renameat2 system call, 2021-04-19T19:28:51+0000
/project/linereader/, linereader, 1.0.0, Gives Python the ability to randomly access any chunk of a file quickly, without loading any content into memory, and implements two new dynamic types of file handles., 2014-05-26T19:10:37+0000
/project/lvmify/, lvmify, 0.0.1, Convert partitions to LVM, 2013-03-01T19:05:44+0000
/project/pyhdfs/, PyHDFS, 0.3.1, Pure Python HDFS client, 2020-01-05T03:14:53+0000
/project/filesafe/, filesafe, 0.2, An interface to safely perform file operations., 2009-04-18T00:54:22+0000
/project/slushbox/, Slushbox, 0.2.1, Reloads web pages when files in local directories change., 2011-12-29T04:15:19+0000
/project/loggedfs/, loggedfs, 0.0.6, Filesystem monitoring with Fuse and Python, 2020-07-11T08:36:05+0000
/project/gfapi/, gfapi, 1.2, Python bindings for GlusterFS libgfapi, 2018-09-20T14:18:22+0000
/project/explosive-fuse/, explosive.fuse, 0.5, Mount archives as a filesystem., 2018-07-13T15:54:56+0000
/project/jinja2-fsloader/, jinja2-fsloader, 0.3.0, A Jinja2 template loader using PyFilesystem2, 2020-01-29T14:01:46+0000
/project/pyinotify-smarkets/, pyinotify-smarkets, 1.0.0, Linux filesystem events monitoring, 2016-06-11T12:11:58+0000
/project/fswalk/, fswalk, 1.3.3, An efficient multiprocessing directory walk and search tool, 2021-04-02T11:59:19+0000
/project/suext/, suext, 0.0.3, Utility for showing any file extension and MIME type info. Support show files information in a directory as list or table., 2020-04-01T07:41:01+0000
/project/bitdust-p2p/, bitdust-p2p, 0.0.3, BitDust is new software framework to build distributed and secure peer-to-peer applications., 2020-09-15T19:26:40+0000
/project/dohq-artifactory/, dohq-artifactory, 0.7.534, A Python interface to Artifactory, 2021-03-10T05:58:23+0000
/project/python-benedict/, python-benedict, 0.23.2, python-benedict is a dict subclass with keylist/keypath support, I/O shortcuts (base64, csv, json, pickle, plist, query-string, toml, xml, yaml) and many utilities... for humans, obviously., 2021-01-19T11:08:10+0000
/project/watchers-py/, watchers.py, 1.0.1-rc.1, A simple script that monitors changes in the file system using polling., 2014-11-12T15:21:47+0000
/project/ytfs/, ytfs, 0.99a5, YouTube File System, 2017-04-08T21:22:46+0000
/project/lascheck/, lascheck, 0.1.3, checking conformity of Log ASCII Standard (LAS) files to LAS 2.0 standard, 2020-07-26T09:55:44+0000
/project/ipfsapi/, ipfsapi, 0.4.4, Python IPFS API client library, 2019-05-13T17:33:16+0000
/project/log-everywhere/, log-everywhere, 0.0.1, Logging package to enable writing all program information with corresponding datetime to multiple, DIFFERENT files safely when running multiple threads (multi-threading)., 2021-01-14T08:20:05+0000
/project/koboldfs/, koboldfs, 0.3.2, application-level distributed file system written in Python, 2011-03-19T18:33:08+0000
/project/foremon/, foremon, 1.3.0, Automatically restart applications when file changes are detected., 2021-02-22T02:43:40+0000
/project/btrfs-simple-snapshots/, btrfs-simple-snapshots, 0.1.4, Snapshot you btrfs subvolumes and apply a retention policy, 2018-06-05T19:40:50+0000
/project/teuthology/, teuthology, 1.1.0, Ceph test framework, 2021-02-25T16:03:04+0000
/project/ezntfs/, ezntfs, 0.1.4, An easy-to-use wrapper for NTFS-3G on macOS, 2020-09-30T13:10:39+0000
/project/fs-ossfs/, fs-ossfs, 1.1.1, AliCloud OSS filesystem for PyFilesystem2, 2019-06-17T16:42:44+0000
/project/ubidump/, ubidump, 1.0.0, Commandline tool for viewing or extracting UBIFS images., 2020-11-09T09:01:09+0000
/project/pyfstab/, pyfstab, 0.1.1, Fstab parsing and formatting library, 2020-04-11T09:00:35+0000
/project/zfslib/, zfslib, 0.9, ZFS Python Library, 2021-01-02T05:04:21+0000
/project/ipfshttpclient4ipwb/, ipfshttpclient4ipwb, 0.6.0, Python IPFS HTTP CLIENT library, 2020-06-24T13:53:32+0000
/project/filesequence/, filesequence, 0.1.12, Write to an indexed sequence of files using the standard Python file API, 2013-09-14T22:16:12+0000
/project/pbar/, Pbar, 1.0, Progress bar to watch file size, 2013-07-25T04:10:37+0000
/project/spasco/, spasco, 1.0.1, Renaming Tool, 2021-04-25T16:26:49+0000
/project/zfs-replicate/, zfs-replicate, 1.4.0, ZFS Snapshot Replicator, 2021-03-25T19:13:17+0000
/project/dynamo-fuse/, dynamo-fuse, 0.1.4, Linux FUSE file system implementation with AWS DynamoDB as the storage, 2013-08-03T02:44:05+0000
/project/lasio/, lasio, 0.29, Read/write well data from Log ASCII Standard (LAS) files, 2021-04-14T04:03:57+0000
/project/btrfsmaint/, btrfsmaint, 0.5.2, BTRFS Filesystem Maintenace Scripts., 2017-07-22T14:50:52+0000
/project/imap-storage/, imap-storage, 0.2.1, Use your Email-account as Storage for data structures and files, 2019-10-09T15:11:55+0000
/project/glustercli/, glustercli, 0.8.0, Python bindings for GlusterFS CLI and Metrics collection, 2020-08-10T10:50:30+0000
/project/smart-image-renamer/, smart-image-renamer, 0.3, A script to intelligently bulk rename images using EXIF data contained within., 2014-05-29T02:37:58+0000
/project/treecat/, treecat, 0.2.0, Displays a tree view of files and their contents, 2020-10-28T05:57:37+0000
/project/aiofiles38/, aiofiles38, 0.5.0.dev0, this will be removed after the origin aiofiles38 supports new versions of Python, 2019-12-12T11:23:44+0000
/project/win32-setctime/, win32-setctime, 1.0.3, A small Python utility to set file creation time on Windows, 2020-10-04T22:05:04+0000
/project/fatfs/, fatfs, 0.0.4, A wrapper around ChaN's FatFS library for FAT filesystem manipulation., 2020-07-31T08:33:46+0000
/project/hdu/, hdu, 0.2.3.12, Human-friendly summary of disk usage., 2020-04-11T15:54:13+0000
/project/simple-tagger/, simple-tagger, 0.6, Simple console tool for manage tags on files and directories, 2016-04-24T10:47:53+0000
/project/tornado-http-firewall/, tornado-http-firewall, 0.0.3, Validation and Hosting daemon for scatter.online., 2019-01-21T05:11:31+0000
/project/pfio/, pfio, 1.4.0, PFN IO library, 2021-04-21T10:33:19+0000
/project/allmydata-tahoe/, allmydata-tahoe, 1.10.2, secure, decentralized, fault-tolerant filesystem, 2015-07-31T02:49:28+0000
/project/synoacl/, synoacl, 0.0.2, A simple wrapper around Synology's synoacltool., 2015-09-02T20:27:23+0000
/project/paradise/, paradise, 0.3.0, A file sharing and media streaming utility for local network, 2020-11-25T21:05:12+0000
/project/watchdog-lite/, watchdog-lite, 0.0.1, Filesystem events monitoring, 2017-02-10T18:50:17+0000
/project/flinck/, flinck, 0.3.2, Sort your movies on filesystem using symlinks., 2016-06-02T21:45:57+0000
/project/pythonwebhdfs/, PythonWebHDFS, 0.2.3, Customized Python Web HDFS client, 2019-02-12T07:22:28+0000
/project/pyxattr/, pyxattr, 0.7.2, Filesystem extended attributes for python, 2020-11-29T19:44:00+0000
/project/txu1/, txu1, 13.06.0, Twisted-based async interface for Ubuntu One Files Cloud REST API v1, 2013-06-13T21:46:40+0000
/project/linux-aio-bind/, linux-aio-bind, 1.0.0, Python binding for Linux AIO, 2019-01-22T16:05:40+0000
/project/pylibacl/, pylibacl, 0.6.0, POSIX.1e ACLs for python, 2020-11-29T01:49:44+0000
/project/projy/, Projy, 0.4.1, Projy is a template-based skeleton generator., 2013-10-21T13:32:54+0000
/project/phen/, phen, 0.2.1, Decentralized platform for social applications, 2015-12-31T21:25:15+0000
/project/ovos-skill-installer/, ovos-skill-installer, 0.0.5, Mycroft skill installer from .zip or .tar.gz urls, 2021-03-09T18:55:15+0000
/project/noticeme/, noticeme, 2019.11, Provides a framework for building file watchers. Includes a file watcher utility program that allows you to create file watchers declaratively., 2019-11-09T20:48:11+0000
/project/kdfilefinder/, kdFileFinder, 1.0.2, , 2020-05-31T09:01:17+0000
/project/encviewfuse/, encviewfuse, 0.3.0.post1, A fuse implementation of an encrypted view on a given directory., 2015-12-13T19:56:16+0000
/project/prn/, prn, 0.84, A powerful script to rename files. Better, stronger, faster., 2020-12-02T02:58:54+0000
/project/kddesktopassistant/, kdDesktopAssistant, 1.0.3, , 2019-04-04T10:10:27+0000
/project/addext/, addext, 2.0.1, Adds file extensions based on PRONOM ID, 2019-11-11T19:47:51+0000
/project/python-onedrive/, python-onedrive, 15.10.5, Obsolete python/cli module for MS SkyDrive/OneDrive old API, do not use for new projects, 2015-10-15T11:16:25+0000
/project/atree/, atree, 1.0.0a1, An augmented version of the `tree` command, 2021-01-03T10:27:02+0000
/project/flist/, flist, 0.602, File List Expansion, 2015-10-26T15:14:06+0000
/project/mafs/, mafs, 0.2.1, Quickly conjure up virtual fileysystems, 2019-06-02T10:34:37+0000
/project/petact/, petact, 0.1.2, A package extraction tool, 2018-06-25T21:39:08+0000
/project/pysmbclient/, PySmbClient, 0.1.5, A convenient smbclient wrapper, 2017-03-03T00:37:56+0000
/project/sqlfs/, sqlfs, 0.1.0, SQLite FUSE filesystem, 2019-08-11T22:02:59+0000
/project/fs-dlk/, fs-dlk, 0.1.3, Azure Datalake filesystem for PyFilesystem2, 2020-03-29T22:02:26+0000
/project/steel/, steel, 0.2, A Python framework for describing binary file formats, 2013-10-19T21:14:42+0000
/project/fs-webdavfs/, fs.webdavfs, 0.4.2, WebDAV support for pyfilesystem2, 2021-03-10T18:20:09+0000
/project/pymmbfuse/, pymmbfuse, 0.7.4, Fuse driver for BBC Microcomputer DFS disk images and MMB disk bundles, 2020-05-11T17:10:58+0000
/project/save/, save, 0.1, A very simple module to safely save data to files in python, 2016-10-25T12:09:07+0000
/project/srfp/, srfp, 0.1.0, Client for the Simple Read-only File Protocol, 2014-11-15T03:34:15+0000
/project/fileshuffle/, fileshuffle, 0.5, Shuffle files, 2017-06-08T12:08:55+0000
/project/fs-gcsfs/, fs-gcsfs, 1.4.5, A PyFilesystem interface to Google Cloud Storage, 2021-03-25T10:38:04+0000
/project/pyftpdlib-ustcblog/, pyftpdlib-ustcblog, 1.4.1, USTC Blog fork of Very fast asynchronous FTP server library, 2015-02-16T10:23:50+0000
/project/llfuse/, llfuse, 1.4.1, Python bindings for the low-level FUSE API, 2021-01-31T20:50:00+0000
/project/filehandlers/, filehandlers, 3.1.0, Package containing code to help in working with files., 2020-05-21T03:02:27+0000
/project/abl-vpath/, abl.vpath, 0.9, A OO-abstraction of file-systems, 2018-09-18T09:16:53+0000
/project/gpt/, gpt, 0.2, GPT utils, 2019-03-04T10:55:34+0000
/project/dejumblefs/, dejumblefs, 0.9, dejumble: presents an organized view of the contents of a directory., 2016-11-30T11:46:19+0000
/project/carson-tool-create-template/, carson-tool.create_template, 0.2.0, File templates are specifications of the default contents to be generated when creating a new file., 2019-10-29T10:46:27+0000
/project/lf-backup/, lf-backup, 0.4.5, lf-backup is a tool for backing up large files to object storage
, e.g. swift., 2017-01-19T07:01:35+0000
/project/md2notion/, md2notion, 2.4.1, Utilities for importing Markdown files to Notion.so, 2021-03-30T10:14:13+0000
/project/libcgroup-bind/, libcgroup-bind, 1.0.7, Python binding for libcgroup, 2019-03-29T17:13:32+0000
/project/easyfuse/, easyfuse, 0.0.1, Python library to create a simple FUSE file system, 2016-02-10T18:09:50+0000
/project/farmfs/, farmfs, 0.8.2, tool which de-duplicates files in a filesystem by checksum., 2020-12-31T09:10:44+0000
/project/fs-onedatafs/, fs.onedatafs, 18.2.2.0, Onedata filesystem for PyFilesystem2, 2019-07-13T12:15:54+0000
/project/qdupe/, qdupe, 0.1, A command-line utility to quickly find duplicate files, 2010-11-10T15:09:47+0000
/project/pyvert/, pyvert, 0.4, pyvert is a tool to convert a filesystem directory structure to and from YAML, 2015-12-08T04:33:12+0000
/project/appdata/, appdata, 1.2.0, Utils to manage application data folder., 2020-04-14T23:39:16+0000
/project/pathtools3/, pathtools3, 0.2.1, File system general utilities, 2018-08-22T15:30:07+0000
/project/doorpi/, DoorPi, 2.5.1, provide intercomstation to the doorstation by VoIP, 2016-08-01T15:58:19+0000
/project/jupyter-pyfilesystem/, jupyter-pyfilesystem, 0.0.5, Jupyter Notebook PyFilesystem Contents Manager, 2020-01-11T15:55:46+0000
/project/guider/, guider, 3.9.81, A system-wide analyzer of performance, 2021-03-27T07:40:38+0000
/project/cs-vt/, cs.vt, 20190309, A content hash based data store with a filesystem layer, using variable sized blocks, arbitrarily sized data and utilising some domain knowledge to aid efficient block boundary selection., 2019-03-09T05:24:46+0000
/project/hashdb2/, hashdb2, 1.0, HashDb2 provides a simple method for executing commands based on matched files, 2017-05-07T13:31:30+0000
/project/renv/, renv, 0.3.1, The renv package is a CLI tool for creating environments for the R statistical programming language.  It takes advantage of the python venv module and its modular EnvBuilder class., 2019-04-13T16:00:48+0000
/project/ublame/, ublame, 0.1.0, Add some depth to `git blame`, 2020-11-11T10:17:35+0000
/project/python-hdfs/, python-hdfs, 0.4, Python wrapper for libhdfs, 2015-06-09T10:07:29+0000
/project/free-disk/, free-disk, 0.2.2, delete file with oldest modification date until a minimum of --free-bytes are available on disk, 2021-04-09T08:33:24+0000
/project/mdfmonitor/, mdfmonitor, 0.1.2b, The mdfmonitor  can monitoring the file modification., 2014-03-25T15:16:06+0000
/project/targetd-client/, targetd-client, 0.5.0, A client library for targetd, 2021-02-13T22:40:12+0000
/project/bitrot/, bitrot, 1.0.0, Detects bit rotten files on the hard drive to save your precious photo and music collection from slow decay., 2020-05-17T22:14:22+0000
/project/md2notion/, md2notion, 2.4.1, Utilities for importing Markdown files to Notion.so, 2021-03-30T10:14:13+0000
/project/libcgroup-bind/, libcgroup-bind, 1.0.7, Python binding for libcgroup, 2019-03-29T17:13:32+0000
/project/easyfuse/, easyfuse, 0.0.1, Python library to create a simple FUSE file system, 2016-02-10T18:09:50+0000
/project/farmfs/, farmfs, 0.8.2, tool which de-duplicates files in a filesystem by checksum., 2020-12-31T09:10:44+0000
/project/fs-onedatafs/, fs.onedatafs, 18.2.2.0, Onedata filesystem for PyFilesystem2, 2019-07-13T12:15:54+0000
/project/qdupe/, qdupe, 0.1, A command-line utility to quickly find duplicate files, 2010-11-10T15:09:47+0000
/project/pyvert/, pyvert, 0.4, pyvert is a tool to convert a filesystem directory structure to and from YAML, 2015-12-08T04:33:12+0000
/project/guider/, guider, 3.9.81, A system-wide analyzer of performance, 2021-03-27T07:40:38+0000
/project/cs-vt/, cs.vt, 20190309, A content hash based data store with a filesystem layer, using variable sized blocks, arbitrarily sized data and utilising some domain knowledge to aid efficient block boundary selection., 2019-03-09T05:24:46+0000
/project/hashdb2/, hashdb2, 1.0, HashDb2 provides a simple method for executing commands based on matched files, 2017-05-07T13:31:30+0000
/project/renv/, renv, 0.3.1, The renv package is a CLI tool for creating environments for the R statistical programming language.  It takes advantage of the python venv module and its modular EnvBuilder class., 2019-04-13T16:00:48+0000
/project/ublame/, ublame, 0.1.0, Add some depth to `git blame`, 2020-11-11T10:17:35+0000
/project/python-hdfs/, python-hdfs, 0.4, Python wrapper for libhdfs, 2015-06-09T10:07:29+0000
/project/free-disk/, free-disk, 0.2.2, delete file with oldest modification date until a minimum of --free-bytes are available on disk, 2021-04-09T08:33:24+0000
/project/mdfmonitor/, mdfmonitor, 0.1.2b, The mdfmonitor  can monitoring the file modification., 2014-03-25T15:16:06+0000
/project/targetd-client/, targetd-client, 0.5.0, A client library for targetd, 2021-02-13T22:40:12+0000
/project/lasio/, lasio, 0.29, Read/write well data from Log ASCII Standard (LAS) files, 2021-04-14T04:03:57+0000
/project/btrfsmaint/, btrfsmaint, 0.5.2, BTRFS Filesystem Maintenace Scripts., 2017-07-22T14:50:52+0000
/project/imap-storage/, imap-storage, 0.2.1, Use your Email-account as Storage for data structures and files, 2019-10-09T15:11:55+0000
/project/glustercli/, glustercli, 0.8.0, Python bindings for GlusterFS CLI and Metrics collection, 2020-08-10T10:50:30+0000
/project/fsquota/, FsQuota, 0.1.0, Interface to file system quotas on UNIX platforms, 2020-04-20T18:23:36+0000
/project/swift-commander/, swift-commander, 1.5.0, swift commander (swc) is a wrapper for curl and python-swift to access openstack swift cloud storage systems., 2020-11-09T08:30:50+0000
/project/cirrus-client/, cirrus-client, 0.2.1.1, Global Maksimum Cirrus Client API., 2021-01-10T21:37:53+0000
/project/osso-docktool/, osso-docktool, 1.2, HDD administration and maintenance, 2021-04-16T12:49:45+0000
/project/searchthesky/, SearchTheSky, 0.0.31, A Powerful code re-factoring tool for multiple programming languages. Includes Regular Expression tools., 2014-06-11T03:23:05+0000
/project/muchspace/, muchspace, 0.3.2, A CLI utility in python3 to calulate total disk space required for media links, 2018-06-12T04:51:38+0000
/project/arbory/, arbory, 0.0.5, Nice directory trees., 2019-11-14T22:48:25+0000
/project/pysyncml/, pysyncml, 0.2.0, A pure-python implementation of the SyncML adapter framework and protocol., 2013-12-15T16:00:46+0000
/project/sh-utils/, sh-utils, 0.9, some commands to simplify various things, 2016-02-02T05:46:57+0000
/project/fs-s3fs/, fs-s3fs, 1.1.1, Amazon S3 filesystem for PyFilesystem2, 2019-08-14T10:59:30+0000
/project/tahoe-lafs/, tahoe-lafs, 1.15.1, secure, decentralized, fault-tolerant file store, 2021-03-23T21:00:37+0000
/project/f3utils/, f3utils, 0.11, Utilities from the F3 ERP suite, 2019-05-14T06:28:28+0000
/project/scandir/, scandir, 1.10.0, scandir, a better directory iterator and faster os.walk(), 2019-03-09T17:58:19+0000
/project/fs/, fs, 2.4.13, Python's filesystem abstraction layer, 2021-03-27T17:20:59+0000
/project/pyxdu/, pyxdu, 0.3.0, Display the output of "du" in a window., 2021-03-28T13:23:40+0000
/project/jinja2-fsloader/, jinja2-fsloader, 0.3.0, A Jinja2 template loader using PyFilesystem2, 2020-01-29T14:01:46+0000
/project/loggedfs/, loggedfs, 0.0.6, Filesystem monitoring with Fuse and Python, 2020-07-11T08:36:05+0000
/project/gfapi/, gfapi, 1.2, Python bindings for GlusterFS libgfapi, 2018-09-20T14:18:22+0000
/project/explosive-fuse/, explosive.fuse, 0.5, Mount archives as a filesystem., 2018-07-13T15:54:56+0000
/project/pyinotify-smarkets/, pyinotify-smarkets, 1.0.0, Linux filesystem events monitoring, 2016-06-11T12:11:58+0000
/project/fswalk/, fswalk, 1.3.3, An efficient multiprocessing directory walk and search tool, 2021-04-02T11:59:19+0000
/project/pyflogd/, pyflogd, 0.1.1, File system access monitoring daemon, 2013-10-14T22:19:22+0000
/project/safeoutput/, safeoutput, 2.0, Tempfile wrapper to ensure output files are either complete, or empty. Also handles stdout, which gives no truncation guarantees., 2019-12-23T06:57:43+0000
/project/megacl/, megacl, 0.4.6, mega.co.nz command line client., 2013-05-12T05:30:00+0000
/project/kdautoteamviewer/, kdAutoTeamviewer, 1.0.1, , 2019-04-05T23:33:05+0000
/project/zfs-check/, zfs-check, 0.6.0, Check on the health of your ZFS pools, 2019-06-10T02:39:39+0000
/project/uriutils/, uriutils, 0.1.16, Easily read and write to different storage platforms in Python., 2018-11-02T09:11:26+0000
/project/pyil-converter/, pyil-converter, 0.6.6.9, Convert files to the format you want!, 2016-11-08T23:37:25+0000
/project/pyinotify/, pyinotify, 0.9.6, Linux filesystem events monitoring, 2015-06-04T15:50:22+0000
/project/column-text-format/, column-text-format, 0.0.2, Unfilled description, 2021-03-13T15:21:41+0000
/project/ntfsjournal/, ntfsjournal, 1.0, Module to read NTFS USN journal., 2011-05-05T10:03:16+0000
/project/openmeta/, openmeta, 0.1.1dev, Trivial wrapper providing tidy python access to the openmeta command-line client to set OS X openmeta tags on files, 2011-03-16T02:42:10+0000
/project/split-file-reader/, split-file-reader, 0.0.4, A package to read parted files on disk., 2020-12-01T02:53:47+0000
/project/preadwrite/, preadwrite, 0.0.1, pread, pwrite interface for pypy 6.0, 2020-08-26T04:44:08+0000
/project/pathlib2-unicode/, pathlib2-unicode, 3.0.0, Object-oriented filesystem paths handles unicode., 2021-03-03T10:18:44+0000
/project/symlink-gardener/, symlink-gardener, 0.2.3, A symlink farm manager akin to GNU Stow, 2019-03-08T23:40:54+0000
/project/gsutil/, gsutil, 4.61, A command line tool for interacting with cloud storage services., 2021-04-06T17:40:39+0000
/project/watchgod/, watchgod, 0.7, Simple, modern file watching and code reload in python., 2021-01-30T16:34:39+0000
/project/fcache/, fcache, 0.4.7, a dictionary-like, file-based cache module for Python, 2017-03-12T02:04:57+0000
