/project/pycweather/, pycweather, 0.3.0, Weather display manager for conky, 2011-12-26T07:20:48+0000
/project/dbus-next/, dbus-next, 0.2.2, A zero-dependency DBus library for Python with asyncio support, 2020-12-07T16:17:42+0000
/project/rustybits/, rustybits, 0.0.2, , 2020-01-19T21:35:16+0000
/project/url-to-image/, url-to-image, 1.0.1, Get image object from given url., 2021-01-05T11:28:08+0000
/project/penelope/, penelope, 3.1.3.0, Penelope is a multi-tool for creating, editing and converting dictionaries, especially for eReader devices, 2016-09-23T09:27:17+0000
/project/foonitidigital/, foonitidigital, 1, Testing the app, 2014-10-13T08:12:58+0000
/project/map/, map, 1.3.0, map applies a command to files/folders at a certain path., 2020-11-19T16:45:57+0000
/project/amethyst/, amethyst, 0.1.3, A general-purpose keyboard-based launcher., 2020-07-23T18:05:26+0000
/project/nielsen/, Nielsen, 2.3.0, Rename and organize TV show files., 2020-10-31T21:59:32+0000
/project/tkbak/, tkbak, 1.0.7, Simple Backup Application, 2015-03-23T19:43:45+0000
/project/countdownapp/, CountDownApp, 0.0.1, Count Down Timer Application, 2016-12-03T17:14:47+0000
/project/golumn/, golumn, 0.21.3, Graphical CSV viewer. `column` with a "g", 2018-08-03T18:23:11+0000
/project/xontrib-prompt-ret-code/, xontrib-prompt-ret-code, 1.0.1, Adds return code info to xonsh prompt., 2016-07-22T20:45:39+0000
/project/directfolderbrowser/, DirectFolderBrowser, 21.2, A simple file and folder browser for Panda3D, 2021-02-22T11:52:32+0000
/project/pytkgen/, pytkgen, 1.7, Create Tkinter GUIs from JSON definition files., 2020-06-22T08:18:49+0000
/project/pywebrun/, PyWebRun, 0.0.3, Python Web Runner - Running Python scripts over HTTP, 2008-02-26T21:02:55+0000
/project/xontrib-gitinfo/, xontrib-gitinfo, 0.1.0, Displays information on entering a git repository., 2019-12-22T16:08:47+0000
/project/scrobbify/, scrobbify, 0.1, Real-time 'now playing notifications' for Spotify, 2010-09-02T10:29:51+0000
/project/vsucsprime2/, vsucsprime2, 0.2, Demo for building a Python project, 2020-04-10T07:53:28+0000
/project/vsucs4900b/, vsucs4900b, 0.1, Demo for building a Python project, 2020-04-10T07:58:02+0000
/project/qtile/, qtile, 0.17.0, A pure-Python tiling window manager., 2021-02-13T18:46:35+0000
/project/clipster-desktop/, clipster-desktop, 0.4.5, Multi Platform Cloud Clipboard - Desktop Client, 2021-01-03T18:57:34+0000
/project/shortcutter/, shortcutter, 0.1.21, Easy cross-platform creation of shortcuts supporting virtual and Anaconda environments (fork of Shortcut), 2020-09-29T02:48:43+0000
/project/pyqtcolordialog/, pyqtcolordialog, 0.3, An improved color dialog for PyQt5, 2019-12-23T09:13:00+0000
/project/pauseonlock/, pauseonlock, 0.1.0, Pause/Resume your media players on screen locking/unlocking, 2021-03-20T21:39:54+0000
/project/dwim/, dwim, 0.3.1, Location aware application launcher, 2017-05-29T21:19:22+0000
/project/remofile/, remofile, 1.0.0.dev6, Quick and easy-to-use alternative to FTP, 2018-12-02T00:42:24+0000
/project/inary/, inary, 1.4.2-1, Inary (Special Package Manager), 2020-11-01T17:55:55+0000
/project/txdir/, txdir, 2.0.0, Creating file tree from text tree and vice versa, 2019-11-20T21:35:20+0000
/project/eafsotlogger/, eafsotlogger, 1.1, SOT Library, Maintain log in casandra database using python script., 2014-10-14T10:20:14+0000
/project/pywayland/, pywayland, 0.4.1, Python bindings for the libwayland library written in pure Python, 2021-04-21T23:57:27+0000
/project/finder-colors/, finder_colors, 0.9.5, Get/Set the Colors set on files by OSX Finder, 2015-11-06T13:41:52+0000
/project/i3-workscreen/, i3-workscreen, 1.0.0, i3wm - assign workspaces to correct display outputs based on multi-scenario multi-monitor configuration, 2020-04-08T18:21:26+0000
/project/project-explorer/, project_explorer, 0.0.0a7, A simple file browser that uses project based concepts., 2018-01-13T17:25:02+0000
/project/notify2/, notify2, 0.3.1, Python interface to DBus notifications, 2017-04-28T14:03:42+0000
/project/bluedo/, bluedo, 0.54, Bluetooth proximity automation, 2020-10-12T15:34:06+0000
/project/elzzur/, elzzur, 0.0.1.0, elzzur solves a Ruzzle board, listing all the valid words with their scores., 2016-05-11T11:54:55+0000
/project/libdesktop/, libdesktop, 3.0, A cross-platform library for miscellaneous OS functions and conveniences., 2016-07-11T16:08:06+0000
/project/enaml-extensions/, enaml-extensions, 0.1.0, Enaml extra widgets and extensions, 2015-06-30T21:15:07+0000
/project/cinefiles/, cinefiles, 1.1.1, Organize your movie folder and files, 2017-06-13T16:47:30+0000
/project/dittohunt/, dittohunt, 1.1, A duplicate file finder, previewer, and deleter., 2017-07-16T19:53:17+0000
/project/iwx/, iwx, 0.1.0.dev1, wxPython utilities and enhanced controls, 2016-04-24T05:19:09+0000
/project/directsync/, directsync, 2.0.0, Compare(*diff*)/synchronize/backup/mirror folders quickly., 2020-11-14T10:43:01+0000
/project/windy/, windy, 0.9.9, windy is Windows GUI application for managing user/system environment variables., 2016-07-09T21:45:13+0000
/project/mow/, mow, 0.0.8, Organise your movie folders, fetch metadata and movie-posters, 2016-01-27T14:07:41+0000
/project/bitdust-p2p/, bitdust-p2p, 0.0.3, BitDust is new software framework to build distributed and secure peer-to-peer applications., 2020-09-15T19:26:40+0000
/project/py3status-github-notifications/, py3status-github-notifications, 0.1.0, py3status module to show your Github notifications, 2021-03-10T04:40:05+0000
/project/altf2/, altf2, 1.1.0, Simple program runner (Alt-F2 handler). Requires PyQt5, 2019-10-22T08:48:24+0000
/project/speech/, speech, 0.5.2, A clean interface to Windows speech recognition and text-to-speech capabilities., 2009-02-27T14:32:06+0000
/project/pydirduplicatefinder/, PyDirDuplicateFinder, 0.3.0, Analyse all files in one or more directories and manage duplicate files (the same file present with different names), 2009-08-15T15:30:25+0000
/project/alex-ber-utils/, alex-ber-utils, 0.6.5, AlexBerUtils is collection of the small utilities, 2021-04-12T11:26:52+0000
/project/mac-alias/, mac-alias, 2.2.0, Generate/parse Mac OS Alias records from Python, 2020-12-08T22:24:45+0000
/project/josephine/, josephine, 0.0.1a2, Maya Animation Studio Pipeline, 2018-11-22T16:40:34+0000
/project/midterm/, Midterm, 0.1, Programming Languages Mid-Term, 2018-10-09T21:51:40+0000
/project/pypie/, pypie, 0.1, devilspie clone based on wnck and pygtk, 2010-03-11T18:34:20+0000
/project/cwmctrl/, cwmctrl, 0.0.1, Bindings for wmctrl, 2018-04-26T14:25:25+0000
/project/gkraken/, gkraken, 0.12.2, GUI to control cooling and lighting of NZXT Kraken X (X42, X52, X62 or X72) pumps, 2019-09-26T15:46:36+0000
/project/rofi-tmuxp/, rofi-tmuxp, 0.1.0, Rofi script to launch tmuxp sessions, 2019-09-25T20:28:03+0000
/project/gnome-workcycle-applet/, gnome-workcycle-applet, 0.1, A simple time-management utiliy., 2010-11-11T19:27:32+0000
/project/skyperious/, Skyperious, 4.7, Skype chat history tool, 2021-03-15T21:10:41+0000
/project/kernelcheck/, kernelcheck, 1.1.4, Build the latest kernel, 2008-06-30T14:35:03+0000
/project/rotate-screen/, rotate-screen, 0.1.0, A small Python package for rotating the screen., 2020-07-05T12:12:55+0000
/project/filenametranslation/, fileNameTranslation, 0.1, This package will allow you to translate your file names to you desire language, 2017-10-30T18:28:20+0000
/project/cyther/, Cyther, 0.7.0, The Cross-Platform Cython/Python Compiler, 2016-04-17T19:52:41+0000
/project/kitti3/, kitti3, 0.2.6, Kitti3 - Kitty drop down terminal service for i3wm, 2020-04-05T01:14:26+0000
/project/pipl/, pipl, 0.2.0.dev4, Package Index PipeLine, 2019-05-15T17:20:16+0000
/project/treecat/, treecat, 0.2.0, Displays a tree view of files and their contents, 2020-10-28T05:57:37+0000
/project/inputscope/, InputScope, 1.4, Mouse and keyboard input heatmap visualizer and statistics, 2021-02-11T13:46:11+0000
/project/nordnm/, nordnm, 0.8.1, A CLI tool for automating the importing, securing and usage of NordVPN OpenVPN servers through NetworkManager., 2020-03-18T11:12:20+0000
/project/xonsh-autoxsh/, xonsh-autoxsh, 0.3, Auto launcher of `.autoxsh` scripts for Xonsh shell's `cd` function, 2018-03-09T05:50:01+0000
/project/kwallet-dump/, kwallet-dump, 1.0.2, Access KWallet files without KDE desktop, 2013-09-18T17:27:43+0000
/project/python-qnotifications/, python-qnotifications, 2.0.6, Pretty in-app notifications for PyQt, 2020-09-14T09:01:02+0000
/project/vignette/, vignette, 4.5.2, Library to create FreeDesktop-compatible thumbnails, 2019-08-17T17:51:36+0000
/project/sys-backlight/, sys-backlight, 0.1, Control linux screen brightness from commandline, 2017-03-16T16:43:59+0000
/project/rotate-screen/, rotate-screen, 0.1.0, A small Python package for rotating the screen., 2020-07-05T12:12:55+0000
/project/filenametranslation/, fileNameTranslation, 0.1, This package will allow you to translate your file names to you desire language, 2017-10-30T18:28:20+0000
/project/cyther/, Cyther, 0.7.0, The Cross-Platform Cython/Python Compiler, 2016-04-17T19:52:41+0000
/project/kitti3/, kitti3, 0.2.6, Kitti3 - Kitty drop down terminal service for i3wm, 2020-04-05T01:14:26+0000
/project/pipl/, pipl, 0.2.0.dev4, Package Index PipeLine, 2019-05-15T17:20:16+0000
/project/treecat/, treecat, 0.2.0, Displays a tree view of files and their contents, 2020-10-28T05:57:37+0000
/project/inputscope/, InputScope, 1.4, Mouse and keyboard input heatmap visualizer and statistics, 2021-02-11T13:46:11+0000
/project/gnome-source-thumbnailer/, gnome-source-thumbnailer, 0.3.1, Thumbnails for your code, 2021-03-14T21:57:16+0000
/project/dzenstatus/, DzenStatus, 0.1.4, A flexible (pkg_resources) plugin-based script for creating dzen2 status bars., 2010-10-12T13:25:27+0000
/project/send2trash/, Send2Trash, 1.5.0, Send file to trash natively under Mac OS X, Windows and Linux., 2018-02-16T15:00:13+0000
/project/computersittimer/, computerSitTimer, 0.1.2, A simple timer in tray to prevent sitting too long., 2021-01-17T14:15:35+0000
/project/guibot/, guibot, 0.41.1, GUI automation tool, 2020-10-30T14:37:52+0000
/project/exiffind/, exiffind, 0.0.5, Find images by their exif tags, 2017-04-11T00:22:30+0000
/project/selenium-support/, selenium-support, 0.0.1, Usefull function for Selenium umbrella project, 2021-04-18T07:40:50+0000
/project/revelation-indicator/, revelation-indicator, 0.1.5, Indicator for the revelation password manager on Unity desktop., 2012-06-11T14:20:23+0000
/project/pygameui/, pygameui, 0.2.0, GUI framework for Pygame, 2012-04-04T17:46:04+0000
/project/lackey/, Lackey, 0.7.3, A Sikuli script implementation in Python, 2018-11-13T16:15:28+0000
/project/kitsiso/, kitsiso, 0.2.0, Library for sending desktop notifications., 2019-06-03T04:39:45+0000
/project/os-sys-php/, os-sys-php, 2019.10.13, a big lib with many usefull tools and it are not only os and sys tools..., 2019-10-14T04:22:05+0000
/project/rotate-keyboard-layout/, rotate-keyboard-layout, 1.0.1, Simple script to rotate among X keyboard layouts, 2016-10-26T02:39:07+0000
/project/argopt/, argopt, 0.7.0, doc to argparse driven by docopt, 2021-03-01T16:51:30+0000
/project/auto-adjust-display-brightness/, auto-adjust-display-brightness, 1.3.1, Automatically adjust Linux display brightness, 2017-04-17T11:07:03+0000
/project/easy-tk/, easy-tk, 1.0.7.3, Make Tkinter apps in an easy way using JSON., 2021-04-23T20:01:39+0000
/project/lockatme/, lockatme, 0.0.3, Modulable screen locker, 2018-10-20T22:35:17+0000
/project/magicgui/, magicgui, 0.2.9, build GUIs from functions, using magic, 2021-04-05T20:44:36+0000
/project/lastplayer/, lastplayer, 0.0.1, Simple program that keeps the order of the last used players, 2018-07-12T12:03:23+0000
/project/dmgbuild/, dmgbuild, 1.4.2, macOS command line utility to build disk images, 2020-10-16T19:32:13+0000
/project/darkman/, darkman, 0.2.0, A framework for dark-mode and light-mode transitions on Linux desktop., 2021-02-17T19:08:52+0000
/project/meme-manager/, meme-manager, 0.3.1, A meme manager with web UI, 2020-03-28T08:05:02+0000
/project/lf-backup/, lf-backup, 0.4.5, lf-backup is a tool for backing up large files to object storage
, e.g. swift., 2017-01-19T07:01:35+0000
/project/github-macros/, github-macros, 2.0.0, , 2019-02-26T19:56:34+0000
/project/zenityshell/, ZenityShell, 0.0.1-r001a-ekcebo-ivaritt, Zenity Module with more option embedded for fast integration, 2012-09-18T04:57:36+0000
/project/easytkinter/, EasyTkinter, 1.1.0, A module to greatly simplify tkinter applications., 2016-03-28T14:17:37+0000
/project/enia-translator/, enia-translator, 1.3, Search for Interligua translations on-line, 2018-05-17T18:03:17+0000
/project/image-lister/, image_lister, 0.1.9, List images, with some basic statistics, 2015-12-12T12:03:00+0000
/project/shotman/, shotman, 0.1.3, Simple, light, modern tool for screenshooting., 2020-12-13T23:36:26+0000
/project/fscleaner/, fscleaner, 2.0, file system folder cleaner and file remover, 2020-02-22T18:28:04+0000
/project/xdmenu/, xdmenu, 1.0.0, Extensible wrapper for dmenu., 2017-06-01T19:48:55+0000
/project/dam-sync/, dam-sync, 0.0.3, Synchronisation CLI tool for your digital assets, 2020-08-12T16:52:48+0000
/project/billabong/, Billabong, 0.2.5, Personal Encrypted file storage, backup and sharing, 2015-08-24T20:31:58+0000
/project/gsteditor/, GstEditor, 0.1.0, GStreamer Graphical Pipeline Editor, 2009-05-01T18:37:57+0000
/project/disk-treemap/, disk-treemap, 1.0.4, Just another disk usage analyzer with treemap GUI., 2021-03-07T19:27:30+0000
/project/piccol/, piccol, 1.1, Color picker and translator, 2019-06-15T21:36:15+0000
/project/pyful/, pyful, 0.2.2, Python file management utility, 2011-02-06T04:47:14+0000
/project/hpass/, hpass, 0.2.1, A simple password management tool, 2020-06-29T14:03:41+0000
/project/doubleplusungood/, doubleplusungood, 0.1, Shameless name-grab for a possible future project, 2020-01-13T15:24:32+0000
/project/openssl-gtk/, openssl-gtk, 1.1.1, Perform your Openssl operations without using a terminal., 2019-11-12T22:33:18+0000
/project/ctlimit/, ctlimit, 0.0.5, Computer Time Limit for Children, 2016-06-10T17:37:34+0000
/project/createcloudmap/, CreateCloudMap, 0.9.13, Create a cloud map for xplanet using satellite images from the Dundee Satellite Receiving Station, 2019-02-08T21:44:11+0000
/project/python-specbar/, python-specbar, 0.3, Simple module to build a statusbar for spectrwm., 2012-11-02T08:00:03+0000
/project/pyxdu/, pyxdu, 0.3.0, Display the output of "du" in a window., 2021-03-28T13:23:40+0000
/project/pyxel-lander/, pyxel-lander, 1.3.1, Lunar Lander game tribute written in Python with Pyxel retro game engine, 2021-02-24T21:05:34+0000
/project/rotate-keyboard-layout/, rotate-keyboard-layout, 1.0.1, Simple script to rotate among X keyboard layouts, 2016-10-26T02:39:07+0000
/project/easy-tk/, easy-tk, 1.0.7.3, Make Tkinter apps in an easy way using JSON., 2021-04-23T20:01:39+0000
/project/lockatme/, lockatme, 0.0.3, Modulable screen locker, 2018-10-20T22:35:17+0000
/project/brocoli/, brocoli, 0.6.1, Browse Collections for iRODS, 2020-06-09T09:42:28+0000
/project/tmuxomatic/, tmuxomatic, 2.18, Intelligent tmux session management ... #tmux, 2015-07-03T20:24:01+0000
/project/xatk/, xatk, 0.2.2, keyboard-driven window switcher for X11, 2017-03-17T19:41:07+0000
/project/tqdm-conan/, tqdm-conan, 4.27.0, Temporary fork of tqdmFast, Extensible Progress Meter, 2018-10-18T13:49:59+0000
/project/ecsu-midterm-proj/, ECSU_Midterm_Proj, 0.2, Extracts HTML data with python regex and convert the data to a csv file, 2018-10-09T19:29:25+0000
/project/py3tree/, py3tree, 0.0.3, Display the i3 tree for the current or all workspaces, 2018-08-06T00:31:10+0000
/project/folderpreview/, folderpreview, 0.4.3, Generates folder preview thumb, 2021-04-24T17:18:02+0000
/project/pdb4qt/, pdb4qt, 0.2, A set_trace() that works with PyQt4, 2012-03-26T15:44:46+0000
/project/wx-icons-hicolor/, wx-icons-hicolor, 0.2.0, Hicolor icon theme for wxPython., 2020-11-27T21:34:59+0000
/project/dconfjson/, dconfjson, 0.2.3, Convert gnome settings between binary conf files and json, 2019-06-01T13:25:52+0000
/project/screencastwriter/, screencastwriter, 0.1, Screencast Writer is screencast helper tool, 2006-04-23T10:51:53+0000
/project/revelation-indicator/, revelation-indicator, 0.1.5, Indicator for the revelation password manager on Unity desktop., 2012-06-11T14:20:23+0000
/project/pygameui/, pygameui, 0.2.0, GUI framework for Pygame, 2012-04-04T17:46:04+0000
/project/lackey/, Lackey, 0.7.3, A Sikuli script implementation in Python, 2018-11-13T16:15:28+0000
/project/libdesktop/, libdesktop, 3.0, A cross-platform library for miscellaneous OS functions and conveniences., 2016-07-11T16:08:06+0000
/project/enaml-extensions/, enaml-extensions, 0.1.0, Enaml extra widgets and extensions, 2015-06-30T21:15:07+0000
/project/cinefiles/, cinefiles, 1.1.1, Organize your movie folder and files, 2017-06-13T16:47:30+0000
/project/dittohunt/, dittohunt, 1.1, A duplicate file finder, previewer, and deleter., 2017-07-16T19:53:17+0000
/project/iwx/, iwx, 0.1.0.dev1, wxPython utilities and enhanced controls, 2016-04-24T05:19:09+0000
/project/directsync/, directsync, 2.0.0, Compare(*diff*)/synchronize/backup/mirror folders quickly., 2020-11-14T10:43:01+0000
/project/windy/, windy, 0.9.9, windy is Windows GUI application for managing user/system environment variables., 2016-07-09T21:45:13+0000
/project/bitdust-p2p/, bitdust-p2p, 0.0.3, BitDust is new software framework to build distributed and secure peer-to-peer applications., 2020-09-15T19:26:40+0000
/project/altf2/, altf2, 1.1.0, Simple program runner (Alt-F2 handler). Requires PyQt5, 2019-10-22T08:48:24+0000
/project/speech/, speech, 0.5.2, A clean interface to Windows speech recognition and text-to-speech capabilities., 2009-02-27T14:32:06+0000
/project/pydirduplicatefinder/, PyDirDuplicateFinder, 0.3.0, Analyse all files in one or more directories and manage duplicate files (the same file present with different names), 2009-08-15T15:30:25+0000
/project/alex-ber-utils/, alex-ber-utils, 0.6.5, AlexBerUtils is collection of the small utilities, 2021-04-12T11:26:52+0000
/project/midterm/, Midterm, 0.1, Programming Languages Mid-Term, 2018-10-09T21:51:40+0000
/project/pypie/, pypie, 0.1, devilspie clone based on wnck and pygtk, 2010-03-11T18:34:20+0000
/project/mac-alias/, mac-alias, 2.2.0, Generate/parse Mac OS Alias records from Python, 2020-12-08T22:24:45+0000
/project/josephine/, josephine, 0.0.1a2, Maya Animation Studio Pipeline, 2018-11-22T16:40:34+0000
/project/cwmctrl/, cwmctrl, 0.0.1, Bindings for wmctrl, 2018-04-26T14:25:25+0000
/project/gkraken/, gkraken, 0.12.2, GUI to control cooling and lighting of NZXT Kraken X (X42, X52, X62 or X72) pumps, 2019-09-26T15:46:36+0000
/project/rofi-tmuxp/, rofi-tmuxp, 0.1.0, Rofi script to launch tmuxp sessions, 2019-09-25T20:28:03+0000
/project/gnome-workcycle-applet/, gnome-workcycle-applet, 0.1, A simple time-management utiliy., 2010-11-11T19:27:32+0000
/project/skyperious/, Skyperious, 4.7, Skype chat history tool, 2021-03-15T21:10:41+0000
/project/kernelcheck/, kernelcheck, 1.1.4, Build the latest kernel, 2008-06-30T14:35:03+0000
/project/gdirsync/, Gdirsync, 0.1.0, Simple multi-platform file syncing tool, 2020-01-15T21:08:57+0000
/project/padua/, padua, 0.1.16, A Python interface for Proteomic Data Analysis, working with MaxQuant & Perseus outputs, 2019-03-11T13:40:51+0000
/project/gmailwatcher/, gmailwatcher, 11.10.19, A desktop gmail notifier for Ubuntu OS, 2011-10-30T18:16:41+0000
/project/gooeydev/, GooeyDev, 1.0.3.5, Gooey (made by Chris Kiehl) turns (almost) any command line program into a full GUI application with one line. This a custom release of the development branch (1.0.3) of gooey., 2019-10-30T13:18:46+0000
/project/ecsu-mid-project/, ECSU_Mid_Project, 1.1, Extracts HTML data with python regex and convert the data to a csv file, 2018-10-09T18:05:36+0000
/project/awd/, awd, 1.3.4, a window director;, 2019-01-16T00:32:43+0000
/project/os-sys-linux/, os-sys-linux, 0.0.0.dev0, a big lib with many usefull tools and it are not only os and sys tools..., 2020-01-04T10:12:51+0000
/project/file-converter/, File_Converter, 0.1, Make me them backups, 2018-10-04T15:28:11+0000
/project/pystiler/, pystiler, 0.4.1, Python simple tiler for non-tiling window managers, 2018-01-01T21:09:56+0000
/project/wpcraft/, wpcraft, 1.2.3, A CLI for fetching wallpapers from WallpapersCraft, 2018-12-01T16:19:04+0000
/project/bitdust/, bitdust, 0.0.2, BitDust is a decentralized on-line storage network for safe, independent and private communications., 2019-05-11T17:54:37+0000
/project/ye-tui/, ye-tui, 0.1.6, yet is a console (kind of rss) application to download youtube videos., 2021-01-30T17:21:55+0000
/project/reloci/, reloci, 2, Organize photos based on exif, 2021-04-11T20:11:35+0000
/project/openlp/, OpenLP, 2.9.2, Open source Church presentation and lyrics projection application., 2020-12-21T18:27:11+0000
/project/ansi-interactive-search/, ansi-interactive-search, 0.0.2, Ansi based interactive search UI, 2018-07-02T06:02:04+0000
/project/webappify/, WebAppify, 0.3, Create desktop apps of your favourite websites, 2017-08-11T17:43:24+0000
/project/bellite/, bellite, 1.4.22, Create desktop applications for Mac OSX (10.7 & 10.8) and Windows XP, 7 & 8 using modern web technology and Python (Node.js or Ruby or PHP or Java)., 2013-04-19T15:10:02+0000
/project/rapidpro-pull/, rapidpro-pull, 1.0.3, An open-source tool to pull and cache data from RapidPro servers., 2017-02-02T17:46:27+0000
/project/vocball/, vocball, 1.1.0, Play vocabulary football in class, 2019-12-27T12:25:01+0000
/project/dirsync/, dirsync, 2.2.5, Advanced directory tree synchronisation tool, 2020-07-31T23:21:46+0000
/project/mirage-linemode/, mirage-linemode, 0.1.1, Customizable linemode plugin for ranger., 2020-08-01T14:35:37+0000
/project/win2xcur/, win2xcur, 0.0.3, win2xcur is a tool to convert Windows .cur and .ani cursors to Xcursor format., 2020-10-03T05:57:03+0000
/project/delivery/, delivery, 0.0.2, Simple, multiplatform interface for desktop notifications, 2019-06-21T17:03:47+0000
/project/pytest-qt/, pytest-qt, 3.3.0, pytest support for PyQt and PySide applications, 2019-12-07T13:38:10+0000
/project/text-based-switcher/, text-based-switcher, 0.0.2.dev0, Text-based window switcher for Unity, 2015-07-23T15:51:42+0000
/project/sotlogger/, sotlogger, 1.0, SOT Library, Maintain event logs in casandra database using python connection script., 2014-10-15T08:17:06+0000
/project/envswitch/, envswitch, 1.4.1, A very simple GUI and CLI to manage environment variables., 2017-10-23T11:43:21+0000
/project/jamd-viewer/, jamd-viewer, 0.8, A multiplatform desktop markdown viewer powered by flask-desktop-ui., 2020-11-16T05:39:28+0000
/project/musicbutler/, musicbutler, 0.1.7, A robot that receives voice commands to play albums from your MP3 collection, 2008-08-18T20:22:20+0000
/project/osd-neo2/, OSD-neo2, 0.15, On screen display for learning the keyboard layout Neo2, 2020-06-05T14:32:38+0000
/project/movielist/, MovieList, 1.5.1, A utility to catalogue and play media., 2016-12-11T15:44:07+0000
/project/dbussy/, DBussy, 1.3, language bindings for libdbus, for Python 3.5 or later, 2020-05-23T23:33:55+0000
/project/orderpy/, orderPy, 1.0, A python script for windows that will order a disordered set of files by their date of creation or last modification., 2017-11-05T18:17:54+0000
/project/i3menu/, i3menu, 3.0, a set of menus based on Rofi or dmenu to interact with i3wm, 2016-03-04T19:03:17+0000
/project/slprint11-pkg/, slprint11-pkg, 1.1, Simple module to display a text with a time interval between each characters., 2020-05-02T00:11:08+0000
/project/qtrangeslider/, QtRangeSlider, 0.1.0, Multi-handle range slider widget for PyQt/PySide, 2021-04-25T21:30:52+0000
/project/image-rename/, image-rename, 0.2.0, Rename the picture by looking through the human eye and typing. (you don't need to open the file by yourself), 2020-10-11T16:50:34+0000
/project/gnome-shell-install-extension/, gnome-shell-install-extension, 1.1.0, Install Gnome Shell extension from zip files., 2018-11-27T09:37:35+0000
/project/linker/, linker, 0.1.0, link files based on name, 2014-04-04T20:54:24+0000
/project/wx-icons-suru/, wx-icons-suru, 0.1.2, Suru icon theme for wxPython 🐍, 2020-08-03T16:50:01+0000
/project/count-files/, count-files, 1.5.0, A command-line interface (CLI) utility that helps you count all the files or search for files with a certain file extension (or without it) in the specified directory., 2019-08-09T19:13:51+0000
/project/python-package-sync-tool/, python-package-sync-tool, 0.5.3, Small tool to sync package from different machines, 2020-12-17T15:44:10+0000
/project/pywincmdtheme/, pywincmdtheme, 0.1.10, pywincmdtheme v. 0.1.7

Tool that can change color theme for windows cmd andpowershell. Uses ~/.Xresources file that defines 16 standard colors,background color and foreground color., 2013-01-13T13:19:28+0000
/project/vsucs4900c/, vsucs4900c, 0.1, Demo for building a Python project, 2020-04-10T08:24:48+0000
/project/buildboticon/, buildboticon, 0.3.2, A buildbot monitoring utility, 2011-01-22T11:21:24+0000
/project/qtwidgets/, qtwidgets, 0.18, Custom widget library for PyQt5 and PySide2 (Qt for Python). Free to use in your own applications., 2021-01-06T12:46:52+0000
/project/gsnodegraph/, gsnodegraph, 0.1.4, Powerful nodegraph widget for wxpython GUIs, 2021-04-18T23:10:33+0000
/project/kvuilder/, kvuilder, 1.0.1, Kivy Project Template Builder, 2020-08-14T11:33:00+0000
/project/pybingwallpaper/, PyBingWallpaper, 1.5.6, A simple Bing.com wallpaper downloader, 2019-05-01T04:49:32+0000
/project/photo-namer-nautilus/, photo-namer-nautilus, 0.0.6, Photo namer nautilus file manager script for files imported with CatGrab phpto import app., 2016-08-15T17:56:35+0000
