/project/monthly-returns-heatmap/, monthly-returns-heatmap, 0.0.11, Utility to create a monthly returns heatmap from Pandas series, 2018-08-16T07:20:36+0000
/project/yfinance-ez/, yfinance-ez, 0.3.0, Yahoo! Finance market data downloader, 2021-03-11T07:59:01+0000
/project/tagreader/, tagreader, 2.7.0, Library for reading from Aspen InfoPlus.21 and OSIsoft PI IMS servers, 2021-02-01T15:02:25+0000
/project/pydatalogger/, pydatalogger, 0.1.0, PyDatalogger - Data logging made easy, 2019-03-02T14:10:04+0000
/project/widediaper/, widediaper, 0.0.8, Simple, stable, easily debuggable R/Python piping, 2015-09-29T08:56:41+0000
/project/neuraxle/, neuraxle, 0.5.7, Neuraxle is a Machine Learning (ML) library for building neat pipelines, providing the right abstractions to both ease research, development, and deployment of your ML applications., 2021-02-25T16:00:44+0000
/project/hexrec/, hexrec, 0.2.2, Library to handle hexadecimal record files, 2020-11-08T00:41:22+0000
/project/yuuki-core/, yuuki-core, 6.5.2, The LINE Protocol for Star Yuuki BOT, 2020-06-14T09:47:16+0000
/project/dwdweather2/, dwdweather2, 0.14.0, Python client to access weather data from Deutscher Wetterdienst (DWD), the federal meteorological service in Germany., 2020-07-03T12:51:14+0000
/project/pythonmatlab/, PythonMatlab, 1.0a.dev0, Python Matlab interface, 2015-07-08T18:02:44+0000
/project/mung/, mung, 1.1, Tools for the Music Notation Graph representation of music notation, used primarily for optical music recognition., 2019-08-12T15:11:30+0000
/project/sila2comlib/, sila2comlib, 0.2.0, sila2comlib - a SiLA 2 python3 communication library, 2019-11-10T15:41:33+0000
/project/fhub/, fhub, 0.0.13, Python client for Finnhub API, 2020-05-26T10:26:31+0000
/project/pyqtvisa/, PyQtVisa, 1.1.dev6, Qt framework for building PyVISA applications for GPIB, RS232, TCPIP and USB instruments, 2020-02-27T11:11:18+0000
/project/sourceinfo/, sourceinfo, 0.1.40, Utilities for simplified gain of runtime information on source code and binary locations., 2019-12-13T09:11:10+0000
/project/mishmash-io-client/, mishmash-io-client, 0.0.7, mishmash io client library, 2020-11-03T17:18:27+0000
/project/semi-ate-stdf/, Semi-ATE-STDF, 0.1.14, Library to read/write STDF/ATDF files, 2021-03-11T00:38:32+0000
/project/threatbus-zeek/, threatbus-zeek, 2021.3.25, A plugin to enable threatbus communication with Zeek network monitor., 2021-03-25T09:17:00+0000
/project/muscima/, muscima, 0.10.0, Tools for the MUSCIMA++ dataset of music notation., 2018-07-05T10:17:59+0000
/project/sbp/, sbp, 3.4.6, Python bindings for Swift Binary Protocol, 2021-04-02T02:59:13+0000
/project/hollowpoint/, hollowpoint, 0.1, Hollowpoint, 2013-06-16T20:54:50+0000
/project/asyncffmpeg/, asyncffmpeg, 1.0.1, Supports async / await pattern for FFmpeg operations., 2021-03-18T17:17:59+0000
/project/pydcpf/, pydcpf, 1.4, Python device communications protocol framework, 2014-02-14T14:56:41+0000
/project/yfinance/, yfinance, 0.1.59, Yahoo! Finance market data downloader, 2021-03-25T00:43:03+0000
/project/trigger/, trigger, 1.6.0, Trigger is a framework and suite of tools for configuring network devices, 2017-03-08T18:32:52+0000
/project/vasuki/, vasuki, 0.3.2, Vasuki generates different kinds of random unique identifiers, tokens and words, 2019-07-04T08:52:36+0000
/project/pycomm3/, pycomm3, 1.1.1, A Python Ethernet/IP library for communicating with Allen-Bradley PLCs., 2021-04-16T12:55:12+0000
/project/udsoncan/, udsoncan, 1.13.1, Implementation of the Unified Diagnostic Service (UDS) protocol (ISO-14229) used in the automotive industry., 2020-07-19T16:24:59+0000
/project/simpletap/, simpletap, 2.0.0, Unittest runner producing Test Anything Protocol (TAP) output, 2021-04-14T21:39:33+0000
