/project/skyperious/, Skyperious, 4.7, Skype chat history tool, 2021-03-15T21:10:41+0000
/project/kernelcheck/, kernelcheck, 1.1.4, Build the latest kernel, 2008-06-30T14:35:03+0000
/project/rotate-screen/, rotate-screen, 0.1.0, A small Python package for rotating the screen., 2020-07-05T12:12:55+0000
/project/filenametranslation/, fileNameTranslation, 0.1, This package will allow you to translate your file names to you desire language, 2017-10-30T18:28:20+0000
/project/cyther/, Cyther, 0.7.0, The Cross-Platform Cython/Python Compiler, 2016-04-17T19:52:41+0000
/project/kitti3/, kitti3, 0.2.6, Kitti3 - Kitty drop down terminal service for i3wm, 2020-04-05T01:14:26+0000
/project/pipl/, pipl, 0.2.0.dev4, Package Index PipeLine, 2019-05-15T17:20:16+0000
/project/treecat/, treecat, 0.2.0, Displays a tree view of files and their contents, 2020-10-28T05:57:37+0000
/project/inputscope/, InputScope, 1.4, Mouse and keyboard input heatmap visualizer and statistics, 2021-02-11T13:46:11+0000
/project/gnome-source-thumbnailer/, gnome-source-thumbnailer, 0.3.1, Thumbnails for your code, 2021-03-14T21:57:16+0000
/project/dzenstatus/, DzenStatus, 0.1.4, A flexible (pkg_resources) plugin-based script for creating dzen2 status bars., 2010-10-12T13:25:27+0000
/project/send2trash/, Send2Trash, 1.5.0, Send file to trash natively under Mac OS X, Windows and Linux., 2018-02-16T15:00:13+0000
/project/computersittimer/, computerSitTimer, 0.1.2, A simple timer in tray to prevent sitting too long., 2021-01-17T14:15:35+0000
/project/brocoli/, brocoli, 0.6.1, Browse Collections for iRODS, 2020-06-09T09:42:28+0000
/project/tmuxomatic/, tmuxomatic, 2.18, Intelligent tmux session management ... #tmux, 2015-07-03T20:24:01+0000
/project/xatk/, xatk, 0.2.2, keyboard-driven window switcher for X11, 2017-03-17T19:41:07+0000
/project/exiffind/, exiffind, 0.0.5, Find images by their exif tags, 2017-04-11T00:22:30+0000
/project/guibot/, guibot, 0.41.1, GUI automation tool, 2020-10-30T14:37:52+0000
/project/tqdm-conan/, tqdm-conan, 4.27.0, Temporary fork of tqdmFast, Extensible Progress Meter, 2018-10-18T13:49:59+0000
/project/ecsu-midterm-proj/, ECSU_Midterm_Proj, 0.2, Extracts HTML data with python regex and convert the data to a csv file, 2018-10-09T19:29:25+0000
/project/selenium-support/, selenium-support, 0.0.1, Usefull function for Selenium umbrella project, 2021-04-18T07:40:50+0000
/project/cefpython3/, cefpython3, 66.1, GUI toolkit for embedding a Chromium widget in desktop applications, 2021-02-16T20:11:57+0000
/project/wallpyper/, wallpyper, 0.0.6, Tiny Python module handling Linux wallpaper changes, 2013-10-11T18:04:37+0000
/project/py3tree/, py3tree, 0.0.3, Display the i3 tree for the current or all workspaces, 2018-08-06T00:31:10+0000
/project/folderpreview/, folderpreview, 0.4.3, Generates folder preview thumb, 2021-04-24T17:18:02+0000
/project/pdb4qt/, pdb4qt, 0.2, A set_trace() that works with PyQt4, 2012-03-26T15:44:46+0000
/project/wx-icons-hicolor/, wx-icons-hicolor, 0.2.0, Hicolor icon theme for wxPython., 2020-11-27T21:34:59+0000
/project/dconfjson/, dconfjson, 0.2.3, Convert gnome settings between binary conf files and json, 2019-06-01T13:25:52+0000
/project/screencastwriter/, screencastwriter, 0.1, Screencast Writer is screencast helper tool, 2006-04-23T10:51:53+0000
/project/revelation-indicator/, revelation-indicator, 0.1.5, Indicator for the revelation password manager on Unity desktop., 2012-06-11T14:20:23+0000
/project/pygameui/, pygameui, 0.2.0, GUI framework for Pygame, 2012-04-04T17:46:04+0000
/project/lackey/, Lackey, 0.7.3, A Sikuli script implementation in Python, 2018-11-13T16:15:28+0000
/project/kitsiso/, kitsiso, 0.2.0, Library for sending desktop notifications., 2019-06-03T04:39:45+0000
/project/os-sys-php/, os-sys-php, 2019.10.13, a big lib with many usefull tools and it are not only os and sys tools..., 2019-10-14T04:22:05+0000
/project/pyxel-lander/, pyxel-lander, 1.3.1, Lunar Lander game tribute written in Python with Pyxel retro game engine, 2021-02-24T21:05:34+0000
/project/rotate-keyboard-layout/, rotate-keyboard-layout, 1.0.1, Simple script to rotate among X keyboard layouts, 2016-10-26T02:39:07+0000
/project/argopt/, argopt, 0.7.0, doc to argparse driven by docopt, 2021-03-01T16:51:30+0000
/project/auto-adjust-display-brightness/, auto-adjust-display-brightness, 1.3.1, Automatically adjust Linux display brightness, 2017-04-17T11:07:03+0000
/project/easy-tk/, easy-tk, 1.0.7.3, Make Tkinter apps in an easy way using JSON., 2021-04-23T20:01:39+0000
/project/lockatme/, lockatme, 0.0.3, Modulable screen locker, 2018-10-20T22:35:17+0000
/project/magicgui/, magicgui, 0.2.9, build GUIs from functions, using magic, 2021-04-05T20:44:36+0000
/project/lastplayer/, lastplayer, 0.0.1, Simple program that keeps the order of the last used players, 2018-07-12T12:03:23+0000
/project/dmgbuild/, dmgbuild, 1.4.2, macOS command line utility to build disk images, 2020-10-16T19:32:13+0000
/project/darkman/, darkman, 0.2.0, A framework for dark-mode and light-mode transitions on Linux desktop., 2021-02-17T19:08:52+0000
/project/meme-manager/, meme-manager, 0.3.1, A meme manager with web UI, 2020-03-28T08:05:02+0000
/project/lf-backup/, lf-backup, 0.4.5, lf-backup is a tool for backing up large files to object storage
, e.g. swift., 2017-01-19T07:01:35+0000
/project/github-macros/, github-macros, 2.0.0, , 2019-02-26T19:56:34+0000
/project/zenityshell/, ZenityShell, 0.0.1-r001a-ekcebo-ivaritt, Zenity Module with more option embedded for fast integration, 2012-09-18T04:57:36+0000
/project/alignak-app/, alignak_app, 1.4.4, Desktop application, with system tray, for Alignak monitoring solution, 2018-05-15T09:20:54+0000
/project/hpass/, hpass, 0.2.1, A simple password management tool, 2020-06-29T14:03:41+0000
/project/generalfile/, generalfile, 2.4, Easily manage files cross platform., 2021-04-17T10:25:34+0000
/project/pi3-smart-workspace/, pi3-smart-workspace, 0.1.21, Simple program that looks through the i3 config and finds the bound workspaces for each output, and then opening that workspace on the output, that the mouse is currently on., 2020-11-22T17:56:05+0000
/project/doubleplusungood/, doubleplusungood, 0.1, Shameless name-grab for a possible future project, 2020-01-13T15:24:32+0000
/project/openssl-gtk/, openssl-gtk, 1.1.1, Perform your Openssl operations without using a terminal., 2019-11-12T22:33:18+0000
/project/ctlimit/, ctlimit, 0.0.5, Computer Time Limit for Children, 2016-06-10T17:37:34+0000
/project/createcloudmap/, CreateCloudMap, 0.9.13, Create a cloud map for xplanet using satellite images from the Dundee Satellite Receiving Station, 2019-02-08T21:44:11+0000
/project/python-specbar/, python-specbar, 0.3, Simple module to build a statusbar for spectrwm., 2012-11-02T08:00:03+0000
/project/pyxdu/, pyxdu, 0.3.0, Display the output of "du" in a window., 2021-03-28T13:23:40+0000
/project/pyxel-lander/, pyxel-lander, 1.3.1, Lunar Lander game tribute written in Python with Pyxel retro game engine, 2021-02-24T21:05:34+0000
/project/rotate-keyboard-layout/, rotate-keyboard-layout, 1.0.1, Simple script to rotate among X keyboard layouts, 2016-10-26T02:39:07+0000
/project/argopt/, argopt, 0.7.0, doc to argparse driven by docopt, 2021-03-01T16:51:30+0000
/project/auto-adjust-display-brightness/, auto-adjust-display-brightness, 1.3.1, Automatically adjust Linux display brightness, 2017-04-17T11:07:03+0000
/project/easy-tk/, easy-tk, 1.0.7.3, Make Tkinter apps in an easy way using JSON., 2021-04-23T20:01:39+0000
/project/lockatme/, lockatme, 0.0.3, Modulable screen locker, 2018-10-20T22:35:17+0000
/project/magicgui/, magicgui, 0.2.9, build GUIs from functions, using magic, 2021-04-05T20:44:36+0000
/project/dmgbuild/, dmgbuild, 1.4.2, macOS command line utility to build disk images, 2020-10-16T19:32:13+0000
/project/darkman/, darkman, 0.2.0, A framework for dark-mode and light-mode transitions on Linux desktop., 2021-02-17T19:08:52+0000
/project/meme-manager/, meme-manager, 0.3.1, A meme manager with web UI, 2020-03-28T08:05:02+0000
/project/pyful/, pyful, 0.2.2, Python file management utility, 2011-02-06T04:47:14+0000
/project/crossfiledialog/, crossfiledialog, 0.1.0, A Python wrapper for opening files and folders with the native file dialog., 2020-06-21T13:01:21+0000
/project/popupdict/, popupdict, 0.3.3, Linux 下的划词翻译工具，支持有道智云等多种翻译服务, 2019-03-01T06:48:10+0000
/project/swift-commander/, swift-commander, 1.5.0, swift commander (swc) is a wrapper for curl and python-swift to access openstack swift cloud storage systems., 2020-11-09T08:30:50+0000
/project/alignak-app/, alignak_app, 1.4.4, Desktop application, with system tray, for Alignak monitoring solution, 2018-05-15T09:20:54+0000
/project/hpass/, hpass, 0.2.1, A simple password management tool, 2020-06-29T14:03:41+0000
/project/generalfile/, generalfile, 2.4, Easily manage files cross platform., 2021-04-17T10:25:34+0000
/project/pi3-smart-workspace/, pi3-smart-workspace, 0.1.21, Simple program that looks through the i3 config and finds the bound workspaces for each output, and then opening that workspace on the output, that the mouse is currently on., 2020-11-22T17:56:05+0000
/project/doubleplusungood/, doubleplusungood, 0.1, Shameless name-grab for a possible future project, 2020-01-13T15:24:32+0000
/project/openssl-gtk/, openssl-gtk, 1.1.1, Perform your Openssl operations without using a terminal., 2019-11-12T22:33:18+0000
/project/ctlimit/, ctlimit, 0.0.5, Computer Time Limit for Children, 2016-06-10T17:37:34+0000
/project/createcloudmap/, CreateCloudMap, 0.9.13, Create a cloud map for xplanet using satellite images from the Dundee Satellite Receiving Station, 2019-02-08T21:44:11+0000
/project/python-specbar/, python-specbar, 0.3, Simple module to build a statusbar for spectrwm., 2012-11-02T08:00:03+0000
/project/pyxdu/, pyxdu, 0.3.0, Display the output of "du" in a window., 2021-03-28T13:23:40+0000
/project/ahk/, ahk, 0.12.0, A Python wrapper for AHK, 2021-01-07T16:32:56+0000
/project/cmdui/, CMDUI, 0.2.0, A GUI toolkit for CMD., 2020-11-12T13:58:29+0000
/project/memoria-romaaeterna/, memoria-romaaeterna, 1.0.0, Play Memory (Matching) for up to four players, 2019-12-27T10:41:24+0000
/project/pydfm/, pydfm, 3.0.dev3, Find duplicated files and directories, 2016-02-08T10:24:26+0000
/project/pymandel/, PyMandel, 1.0.2, PyMandel Fractal Generator Application, 2021-04-17T20:00:59+0000
/project/statis/, Statis, 1.1.0, Modular system monitoring and status display via desktop notifications., 2020-12-11T16:49:01+0000
/project/windy/, windy, 0.9.9, windy is Windows GUI application for managing user/system environment variables., 2016-07-09T21:45:13+0000
/project/mow/, mow, 0.0.8, Organise your movie folders, fetch metadata and movie-posters, 2016-01-27T14:07:41+0000
/project/bitdust-p2p/, bitdust-p2p, 0.0.3, BitDust is new software framework to build distributed and secure peer-to-peer applications., 2020-09-15T19:26:40+0000
/project/py3status-github-notifications/, py3status-github-notifications, 0.1.0, py3status module to show your Github notifications, 2021-03-10T04:40:05+0000
/project/altf2/, altf2, 1.1.0, Simple program runner (Alt-F2 handler). Requires PyQt5, 2019-10-22T08:48:24+0000
/project/speech/, speech, 0.5.2, A clean interface to Windows speech recognition and text-to-speech capabilities., 2009-02-27T14:32:06+0000
/project/pydirduplicatefinder/, PyDirDuplicateFinder, 0.3.0, Analyse all files in one or more directories and manage duplicate files (the same file present with different names), 2009-08-15T15:30:25+0000
/project/alex-ber-utils/, alex-ber-utils, 0.6.5, AlexBerUtils is collection of the small utilities, 2021-04-12T11:26:52+0000
/project/mac-alias/, mac-alias, 2.2.0, Generate/parse Mac OS Alias records from Python, 2020-12-08T22:24:45+0000
/project/josephine/, josephine, 0.0.1a2, Maya Animation Studio Pipeline, 2018-11-22T16:40:34+0000
/project/midterm/, Midterm, 0.1, Programming Languages Mid-Term, 2018-10-09T21:51:40+0000
/project/pypie/, pypie, 0.1, devilspie clone based on wnck and pygtk, 2010-03-11T18:34:20+0000
/project/cwmctrl/, cwmctrl, 0.0.1, Bindings for wmctrl, 2018-04-26T14:25:25+0000
/project/gkraken/, gkraken, 0.12.2, GUI to control cooling and lighting of NZXT Kraken X (X42, X52, X62 or X72) pumps, 2019-09-26T15:46:36+0000
/project/rofi-tmuxp/, rofi-tmuxp, 0.1.0, Rofi script to launch tmuxp sessions, 2019-09-25T20:28:03+0000
/project/gnome-workcycle-applet/, gnome-workcycle-applet, 0.1, A simple time-management utiliy., 2010-11-11T19:27:32+0000
/project/skyperious/, Skyperious, 4.7, Skype chat history tool, 2021-03-15T21:10:41+0000
/project/kernelcheck/, kernelcheck, 1.1.4, Build the latest kernel, 2008-06-30T14:35:03+0000
