/project/mtwaffle/, mtwaffle, 0.7, Magnetotelluric data analysis, 2018-10-07T04:40:15+0000
/project/python-ntfs/, python-ntfs, 0.1, Open source Python library for NTFS analysis, 2014-08-31T22:01:54+0000
/project/macfsevents/, MacFSEvents, 0.8.1, Thread-based interface to file system observation primitives., 2018-02-21T11:40:45+0000
/project/watchlion/, watchlion, 0.3, Filesystem events monitoring, 2013-03-04T05:27:08+0000
/project/dirs/, dirs, 0.1.0, A small library for obtaining platform dependent directory paths for application and user directories, 2019-12-19T17:51:23+0000
/project/pathsjson/, pathsjson, 0.0.3, , 2017-11-13T14:26:05+0000
/project/gridsync/, gridsync, 0.4.3, Synchronize local directories with Tahoe-LAFS storage grids., 2020-07-25T00:41:46+0000
/project/pytest-cid/, pytest_cid, 1.1.1, Compare data structures containing matching CIDs of different versions and encoding, 2020-12-18T00:16:12+0000
/project/libmount/, libmount, 0.9, A wrapper around libmount, for reading and manipulating filesystem tables., 2012-02-05T17:54:01+0000
/project/pywatchman/, pywatchman, 1.4.1, Watchman client for python, 2017-09-01T14:20:22+0000
/project/pyarrfs/, pyarrfs, 0.8.1, a RAR reading file system, 2013-01-30T21:05:55+0000
/project/rustybits/, rustybits, 0.0.2, , 2020-01-19T21:35:16+0000
/project/aiofiles-ext/, aiofiles-ext, 0.4.0, File support for asyncio., 2017-07-13T18:45:47+0000
/project/pymmb/, pymmb, 1.0.0, Python library for accessing BBC Microcomputer DFS disk images and MMB disk bundles, 2020-05-13T08:05:30+0000
/project/rpaths/, rpaths, 0.13, Path manipulation library, 2017-04-17T17:35:37+0000
/project/zsm/, zsm, 0.2.1, ZFS Snapshot Manager, 2021-01-24T23:21:06+0000
/project/secs/, secs, 0.2.0, Simple encrypted containers, 2017-05-03T04:09:27+0000
/project/bingmaps/, bingmaps, 0.3.7, bingmaps, 2016-03-25T05:15:33+0000
/project/reusables/, reusables, 0.9.6, Commonly Consumed Code Commodities, 2020-09-26T15:46:56+0000
/project/izon/, izon, 2018.5.24, A dependency handling tool for files, 2018-05-25T08:32:04+0000
/project/aiofiles/, aiofiles, 0.6.0, File support for asyncio., 2020-10-27T17:36:43+0000
/project/witchfinder/, witchfinder, 0.1.1, an experiment in modern file carving, 2020-08-25T00:09:49+0000
/project/safemount/, safemount, 0.6, A FUSE mount that only permits safe characters in the file names, 2019-11-27T13:51:38+0000
/project/yatfs/, yatfs, 0.4.0, FUSE-based torrent-backed filesystem, 2018-02-01T09:39:13+0000
/project/machfs/, machfs, 1.3, Library for reading and writing Macintosh HFS volumes, 2021-04-12T00:09:15+0000
/project/fusepy/, fusepy, 3.0.1, Simple ctypes bindings for FUSE, 2018-09-17T00:14:52+0000
/project/ftpfs/, ftpfs, 0.2, , 2018-03-06T08:32:22+0000
/project/remofile/, remofile, 1.0.0.dev6, Quick and easy-to-use alternative to FTP, 2018-12-02T00:42:24+0000
/project/watchdog/, watchdog, 2.0.3, Filesystem events monitoring, 2021-04-22T17:57:30+0000
/project/txdir/, txdir, 2.0.0, Creating file tree from text tree and vice versa, 2019-11-20T21:35:20+0000
/project/heketi/, heketi, 3.0.0, Python client library for Heketi, 2016-10-25T11:46:57+0000
/project/simple-file-poller/, simple-file-poller, 0.0.10, Simple Python 3 library for file polling., 2021-03-17T20:27:37+0000
/project/fspath/, fspath, 20190323, semantic path names and more, 2019-03-23T17:18:16+0000
/project/pathway/, Pathway, 1.3.1, A library for interacting with the filesystem, 2010-01-18T02:26:02+0000
/project/bedup/, bedup, 0.10.1, Deduplication for Btrfs filesystems, 2016-05-18T07:30:55+0000
/project/fuselpk/, fuselpk, 0.1, LDAP Public Key filesystem for openssh, 2010-09-02T14:42:49+0000
/project/opendir/, opendir, 0.0.1, Implements POSIX opendir, 2008-06-28T16:41:36+0000
/project/renameat2/, renameat2, 0.4.0, A wrapper around Linux's renameat2 system call, 2021-04-19T19:28:51+0000
/project/linereader/, linereader, 1.0.0, Gives Python the ability to randomly access any chunk of a file quickly, without loading any content into memory, and implements two new dynamic types of file handles., 2014-05-26T19:10:37+0000
/project/lvmify/, lvmify, 0.0.1, Convert partitions to LVM, 2013-03-01T19:05:44+0000
/project/pyhdfs/, PyHDFS, 0.3.1, Pure Python HDFS client, 2020-01-05T03:14:53+0000
/project/filesafe/, filesafe, 0.2, An interface to safely perform file operations., 2009-04-18T00:54:22+0000
/project/slushbox/, Slushbox, 0.2.1, Reloads web pages when files in local directories change., 2011-12-29T04:15:19+0000
/project/gynx/, gynx, 0.0.8, Google Drive sync client for Linux, 2020-04-05T13:25:23+0000
/project/crypt4ghfs/, crypt4ghfs, 1.1, Crypt4GH FUSE file system, 2020-11-02T00:51:53+0000
/project/dittohunt/, dittohunt, 1.1, A duplicate file finder, previewer, and deleter., 2017-07-16T19:53:17+0000
/project/pathlib2/, pathlib2, 2.3.5, Object-oriented filesystem paths, 2019-09-27T07:33:53+0000
/project/treeage/, treeage, 0.2.0, Lists contents of directories in a tree-like format with age metric indicated for each file, 2020-12-31T00:32:29+0000
/project/pydica-watchdog/, pydica-watchdog, 0.6.2, Native and Virtual Filesystem Events Monitoring, 2013-07-25T12:52:41+0000
/project/suext/, suext, 0.0.3, Utility for showing any file extension and MIME type info. Support show files information in a directory as list or table., 2020-04-01T07:41:01+0000
/project/bitdust-p2p/, bitdust-p2p, 0.0.3, BitDust is new software framework to build distributed and secure peer-to-peer applications., 2020-09-15T19:26:40+0000
/project/dohq-artifactory/, dohq-artifactory, 0.7.534, A Python interface to Artifactory, 2021-03-10T05:58:23+0000
/project/python-benedict/, python-benedict, 0.23.2, python-benedict is a dict subclass with keylist/keypath support, I/O shortcuts (base64, csv, json, pickle, plist, query-string, toml, xml, yaml) and many utilities... for humans, obviously., 2021-01-19T11:08:10+0000
/project/watchers-py/, watchers.py, 1.0.1-rc.1, A simple script that monitors changes in the file system using polling., 2014-11-12T15:21:47+0000
/project/ytfs/, ytfs, 0.99a5, YouTube File System, 2017-04-08T21:22:46+0000
/project/lascheck/, lascheck, 0.1.3, checking conformity of Log ASCII Standard (LAS) files to LAS 2.0 standard, 2020-07-26T09:55:44+0000
/project/ipfsapi/, ipfsapi, 0.4.4, Python IPFS API client library, 2019-05-13T17:33:16+0000
/project/log-everywhere/, log-everywhere, 0.0.1, Logging package to enable writing all program information with corresponding datetime to multiple, DIFFERENT files safely when running multiple threads (multi-threading)., 2021-01-14T08:20:05+0000
/project/koboldfs/, koboldfs, 0.3.2, application-level distributed file system written in Python, 2011-03-19T18:33:08+0000
/project/foremon/, foremon, 1.3.0, Automatically restart applications when file changes are detected., 2021-02-22T02:43:40+0000
/project/btrfs-simple-snapshots/, btrfs-simple-snapshots, 0.1.4, Snapshot you btrfs subvolumes and apply a retention policy, 2018-06-05T19:40:50+0000
/project/teuthology/, teuthology, 1.1.0, Ceph test framework, 2021-02-25T16:03:04+0000
/project/ezntfs/, ezntfs, 0.1.4, An easy-to-use wrapper for NTFS-3G on macOS, 2020-09-30T13:10:39+0000
/project/ubidump/, ubidump, 1.0.0, Commandline tool for viewing or extracting UBIFS images., 2020-11-09T09:01:09+0000
/project/fs-ossfs/, fs-ossfs, 1.1.1, AliCloud OSS filesystem for PyFilesystem2, 2019-06-17T16:42:44+0000
/project/pyfstab/, pyfstab, 0.1.1, Fstab parsing and formatting library, 2020-04-11T09:00:35+0000
/project/zfslib/, zfslib, 0.9, ZFS Python Library, 2021-01-02T05:04:21+0000
/project/ipfshttpclient4ipwb/, ipfshttpclient4ipwb, 0.6.0, Python IPFS HTTP CLIENT library, 2020-06-24T13:53:32+0000
/project/filesequence/, filesequence, 0.1.12, Write to an indexed sequence of files using the standard Python file API, 2013-09-14T22:16:12+0000
/project/pyftpdlib-ustcblog/, pyftpdlib-ustcblog, 1.4.1, USTC Blog fork of Very fast asynchronous FTP server library, 2015-02-16T10:23:50+0000
/project/llfuse/, llfuse, 1.4.1, Python bindings for the low-level FUSE API, 2021-01-31T20:50:00+0000
/project/filehandlers/, filehandlers, 3.1.0, Package containing code to help in working with files., 2020-05-21T03:02:27+0000
/project/abl-vpath/, abl.vpath, 0.9, A OO-abstraction of file-systems, 2018-09-18T09:16:53+0000
/project/gpt/, gpt, 0.2, GPT utils, 2019-03-04T10:55:34+0000
/project/dejumblefs/, dejumblefs, 0.9, dejumble: presents an organized view of the contents of a directory., 2016-11-30T11:46:19+0000
/project/carson-tool-create-template/, carson-tool.create_template, 0.2.0, File templates are specifications of the default contents to be generated when creating a new file., 2019-10-29T10:46:27+0000
/project/lf-backup/, lf-backup, 0.4.5, lf-backup is a tool for backing up large files to object storage
, e.g. swift., 2017-01-19T07:01:35+0000
/project/md2notion/, md2notion, 2.4.1, Utilities for importing Markdown files to Notion.so, 2021-03-30T10:14:13+0000
/project/libcgroup-bind/, libcgroup-bind, 1.0.7, Python binding for libcgroup, 2019-03-29T17:13:32+0000
/project/easyfuse/, easyfuse, 0.0.1, Python library to create a simple FUSE file system, 2016-02-10T18:09:50+0000
/project/farmfs/, farmfs, 0.8.2, tool which de-duplicates files in a filesystem by checksum., 2020-12-31T09:10:44+0000
/project/fs-onedatafs/, fs.onedatafs, 18.2.2.0, Onedata filesystem for PyFilesystem2, 2019-07-13T12:15:54+0000
/project/qdupe/, qdupe, 0.1, A command-line utility to quickly find duplicate files, 2010-11-10T15:09:47+0000
/project/pyvert/, pyvert, 0.4, pyvert is a tool to convert a filesystem directory structure to and from YAML, 2015-12-08T04:33:12+0000
/project/appdata/, appdata, 1.2.0, Utils to manage application data folder., 2020-04-14T23:39:16+0000
/project/pathtools3/, pathtools3, 0.2.1, File system general utilities, 2018-08-22T15:30:07+0000
/project/doorpi/, DoorPi, 2.5.1, provide intercomstation to the doorstation by VoIP, 2016-08-01T15:58:19+0000
/project/jupyter-pyfilesystem/, jupyter-pyfilesystem, 0.0.5, Jupyter Notebook PyFilesystem Contents Manager, 2020-01-11T15:55:46+0000
/project/guider/, guider, 3.9.81, A system-wide analyzer of performance, 2021-03-27T07:40:38+0000
/project/flinck/, flinck, 0.3.2, Sort your movies on filesystem using symlinks., 2016-06-02T21:45:57+0000
/project/pyxattr/, pyxattr, 0.7.2, Filesystem extended attributes for python, 2020-11-29T19:44:00+0000
/project/txu1/, txu1, 13.06.0, Twisted-based async interface for Ubuntu One Files Cloud REST API v1, 2013-06-13T21:46:40+0000
/project/linux-aio-bind/, linux-aio-bind, 1.0.0, Python binding for Linux AIO, 2019-01-22T16:05:40+0000
/project/pylibacl/, pylibacl, 0.6.0, POSIX.1e ACLs for python, 2020-11-29T01:49:44+0000
/project/projy/, Projy, 0.4.1, Projy is a template-based skeleton generator., 2013-10-21T13:32:54+0000
/project/phen/, phen, 0.2.1, Decentralized platform for social applications, 2015-12-31T21:25:15+0000
/project/ovos-skill-installer/, ovos-skill-installer, 0.0.5, Mycroft skill installer from .zip or .tar.gz urls, 2021-03-09T18:55:15+0000
/project/noticeme/, noticeme, 2019.11, Provides a framework for building file watchers. Includes a file watcher utility program that allows you to create file watchers declaratively., 2019-11-09T20:48:11+0000
/project/kdfilefinder/, kdFileFinder, 1.0.2, , 2020-05-31T09:01:17+0000
/project/encviewfuse/, encviewfuse, 0.3.0.post1, A fuse implementation of an encrypted view on a given directory., 2015-12-13T19:56:16+0000
/project/prn/, prn, 0.84, A powerful script to rename files. Better, stronger, faster., 2020-12-02T02:58:54+0000
/project/kddesktopassistant/, kdDesktopAssistant, 1.0.3, , 2019-04-04T10:10:27+0000
/project/addext/, addext, 2.0.1, Adds file extensions based on PRONOM ID, 2019-11-11T19:47:51+0000
/project/python-onedrive/, python-onedrive, 15.10.5, Obsolete python/cli module for MS SkyDrive/OneDrive old API, do not use for new projects, 2015-10-15T11:16:25+0000
/project/atree/, atree, 1.0.0a1, An augmented version of the `tree` command, 2021-01-03T10:27:02+0000
/project/flist/, flist, 0.602, File List Expansion, 2015-10-26T15:14:06+0000
/project/mafs/, mafs, 0.2.1, Quickly conjure up virtual fileysystems, 2019-06-02T10:34:37+0000
/project/petact/, petact, 0.1.2, A package extraction tool, 2018-06-25T21:39:08+0000
/project/fs-dlk/, fs-dlk, 0.1.3, Azure Datalake filesystem for PyFilesystem2, 2020-03-29T22:02:26+0000
/project/steel/, steel, 0.2, A Python framework for describing binary file formats, 2013-10-19T21:14:42+0000
/project/fs-webdavfs/, fs.webdavfs, 0.4.2, WebDAV support for pyfilesystem2, 2021-03-10T18:20:09+0000
/project/pymmbfuse/, pymmbfuse, 0.7.4, Fuse driver for BBC Microcomputer DFS disk images and MMB disk bundles, 2020-05-11T17:10:58+0000
/project/save/, save, 0.1, A very simple module to safely save data to files in python, 2016-10-25T12:09:07+0000
/project/srfp/, srfp, 0.1.0, Client for the Simple Read-only File Protocol, 2014-11-15T03:34:15+0000
/project/fileshuffle/, fileshuffle, 0.5, Shuffle files, 2017-06-08T12:08:55+0000
/project/fs-gcsfs/, fs-gcsfs, 1.4.5, A PyFilesystem interface to Google Cloud Storage, 2021-03-25T10:38:04+0000
/project/pyftpdlib-ustcblog/, pyftpdlib-ustcblog, 1.4.1, USTC Blog fork of Very fast asynchronous FTP server library, 2015-02-16T10:23:50+0000
/project/llfuse/, llfuse, 1.4.1, Python bindings for the low-level FUSE API, 2021-01-31T20:50:00+0000
/project/filehandlers/, filehandlers, 3.1.0, Package containing code to help in working with files., 2020-05-21T03:02:27+0000
/project/abl-vpath/, abl.vpath, 0.9, A OO-abstraction of file-systems, 2018-09-18T09:16:53+0000
/project/gpt/, gpt, 0.2, GPT utils, 2019-03-04T10:55:34+0000
/project/dejumblefs/, dejumblefs, 0.9, dejumble: presents an organized view of the contents of a directory., 2016-11-30T11:46:19+0000
/project/carson-tool-create-template/, carson-tool.create_template, 0.2.0, File templates are specifications of the default contents to be generated when creating a new file., 2019-10-29T10:46:27+0000
/project/lf-backup/, lf-backup, 0.4.5, lf-backup is a tool for backing up large files to object storage
, e.g. swift., 2017-01-19T07:01:35+0000
/project/md2notion/, md2notion, 2.4.1, Utilities for importing Markdown files to Notion.so, 2021-03-30T10:14:13+0000
/project/libcgroup-bind/, libcgroup-bind, 1.0.7, Python binding for libcgroup, 2019-03-29T17:13:32+0000
/project/easyfuse/, easyfuse, 0.0.1, Python library to create a simple FUSE file system, 2016-02-10T18:09:50+0000
/project/farmfs/, farmfs, 0.8.2, tool which de-duplicates files in a filesystem by checksum., 2020-12-31T09:10:44+0000
/project/fs-onedatafs/, fs.onedatafs, 18.2.2.0, Onedata filesystem for PyFilesystem2, 2019-07-13T12:15:54+0000
/project/pyinotify/, pyinotify, 0.9.6, Linux filesystem events monitoring, 2015-06-04T15:50:22+0000
/project/column-text-format/, column-text-format, 0.0.2, Unfilled description, 2021-03-13T15:21:41+0000
/project/ntfsjournal/, ntfsjournal, 1.0, Module to read NTFS USN journal., 2011-05-05T10:03:16+0000
/project/openmeta/, openmeta, 0.1.1dev, Trivial wrapper providing tidy python access to the openmeta command-line client to set OS X openmeta tags on files, 2011-03-16T02:42:10+0000
/project/split-file-reader/, split-file-reader, 0.0.4, A package to read parted files on disk., 2020-12-01T02:53:47+0000
/project/gsutil/, gsutil, 4.61, A command line tool for interacting with cloud storage services., 2021-04-06T17:40:39+0000
/project/watchgod/, watchgod, 0.7, Simple, modern file watching and code reload in python., 2021-01-30T16:34:39+0000
/project/fcache/, fcache, 0.4.7, a dictionary-like, file-based cache module for Python, 2017-03-12T02:04:57+0000
/project/bitrot/, bitrot, 1.0.0, Detects bit rotten files on the hard drive to save your precious photo and music collection from slow decay., 2020-05-17T22:14:22+0000
/project/pybofh/, pybofh, 0.2.1, A Linux system administration automation toolset, 2018-03-15T10:04:06+0000
/project/cronicle/, cronicle, 0.4.0, Use cron to rotate backup files!, 2020-12-23T22:06:50+0000
/project/hachoir3-superdesk/, hachoir3-superdesk, 3.0a1.post2, Package of Hachoir parsers used to open binary files, 2015-08-03T08:20:12+0000
/project/billabong/, Billabong, 0.2.5, Personal Encrypted file storage, backup and sharing, 2015-08-24T20:31:58+0000
/project/epoch-analyzer/, epoch_analyzer, 0.4, Utility detect probable date/time formats given a numeric input., 2016-04-18T20:02:16+0000
/project/disk-treemap/, disk-treemap, 1.0.4, Just another disk usage analyzer with treemap GUI., 2021-03-07T19:27:30+0000
/project/justfile/, justfile, 0.0.1a0, Just Read, Just Write, Just Right, 2020-06-30T01:19:45+0000
/project/fs-dropboxfs/, fs.dropboxfs, 0.2.2.post2, Dropbox support for pyfilesystem2, 2020-01-31T19:43:40+0000
/project/linux-aio/, linux-aio, 0.4.1, Linux aio ABI wrapper, 2019-01-29T12:07:01+0000
/project/bookkeeper/, Bookkeeper, 0.0.2, GNU Stow with steroids, 2015-04-28T22:08:27+0000
/project/oscfs/, oscfs, 0.7.1, A FUSE based file system to access Open Build Service (OBS) instances, 2020-02-21T13:05:55+0000
/project/py-workdocs-prep/, py-workdocs-prep, 0.5.1, AWS Workdocs Preparation Utility, 2019-11-10T13:42:09+0000
/project/porter/, porter, 0.1.5, Porter: Simple File Operations in Python, 2013-07-03T17:43:51+0000
/project/osso-docktool/, osso-docktool, 1.2, HDD administration and maintenance, 2021-04-16T12:49:45+0000
/project/searchthesky/, SearchTheSky, 0.0.31, A Powerful code re-factoring tool for multiple programming languages. Includes Regular Expression tools., 2014-06-11T03:23:05+0000
/project/muchspace/, muchspace, 0.3.2, A CLI utility in python3 to calulate total disk space required for media links, 2018-06-12T04:51:38+0000
/project/tahoe-lafs/, tahoe-lafs, 1.15.1, secure, decentralized, fault-tolerant file store, 2021-03-23T21:00:37+0000
/project/f3utils/, f3utils, 0.11, Utilities from the F3 ERP suite, 2019-05-14T06:28:28+0000
/project/scandir/, scandir, 1.10.0, scandir, a better directory iterator and faster os.walk(), 2019-03-09T17:58:19+0000
/project/pyxdu/, pyxdu, 0.3.0, Display the output of "du" in a window., 2021-03-28T13:23:40+0000
/project/pysmbclient/, PySmbClient, 0.1.5, A convenient smbclient wrapper, 2017-03-03T00:37:56+0000
/project/sqlfs/, sqlfs, 0.1.0, SQLite FUSE filesystem, 2019-08-11T22:02:59+0000
/project/fs-dlk/, fs-dlk, 0.1.3, Azure Datalake filesystem for PyFilesystem2, 2020-03-29T22:02:26+0000
/project/steel/, steel, 0.2, A Python framework for describing binary file formats, 2013-10-19T21:14:42+0000
/project/fs-webdavfs/, fs.webdavfs, 0.4.2, WebDAV support for pyfilesystem2, 2021-03-10T18:20:09+0000
/project/pymmbfuse/, pymmbfuse, 0.7.4, Fuse driver for BBC Microcomputer DFS disk images and MMB disk bundles, 2020-05-11T17:10:58+0000
/project/hdu/, hdu, 0.2.3.12, Human-friendly summary of disk usage., 2020-04-11T15:54:13+0000
/project/simple-tagger/, simple-tagger, 0.6, Simple console tool for manage tags on files and directories, 2016-04-24T10:47:53+0000
/project/tornado-http-firewall/, tornado-http-firewall, 0.0.3, Validation and Hosting daemon for scatter.online., 2019-01-21T05:11:31+0000
/project/pfio/, pfio, 1.4.0, PFN IO library, 2021-04-21T10:33:19+0000
/project/allmydata-tahoe/, allmydata-tahoe, 1.10.2, secure, decentralized, fault-tolerant filesystem, 2015-07-31T02:49:28+0000
/project/synoacl/, synoacl, 0.0.2, A simple wrapper around Synology's synoacltool., 2015-09-02T20:27:23+0000
/project/pythonwebhdfs/, PythonWebHDFS, 0.2.3, Customized Python Web HDFS client, 2019-02-12T07:22:28+0000
/project/pylibacl/, pylibacl, 0.6.0, POSIX.1e ACLs for python, 2020-11-29T01:49:44+0000
/project/projy/, Projy, 0.4.1, Projy is a template-based skeleton generator., 2013-10-21T13:32:54+0000
/project/phen/, phen, 0.2.1, Decentralized platform for social applications, 2015-12-31T21:25:15+0000
/project/ovos-skill-installer/, ovos-skill-installer, 0.0.5, Mycroft skill installer from .zip or .tar.gz urls, 2021-03-09T18:55:15+0000
/project/noticeme/, noticeme, 2019.11, Provides a framework for building file watchers. Includes a file watcher utility program that allows you to create file watchers declaratively., 2019-11-09T20:48:11+0000
/project/kdfilefinder/, kdFileFinder, 1.0.2, , 2020-05-31T09:01:17+0000
/project/encviewfuse/, encviewfuse, 0.3.0.post1, A fuse implementation of an encrypted view on a given directory., 2015-12-13T19:56:16+0000
/project/prn/, prn, 0.84, A powerful script to rename files. Better, stronger, faster., 2020-12-02T02:58:54+0000
/project/kddesktopassistant/, kdDesktopAssistant, 1.0.3, , 2019-04-04T10:10:27+0000
/project/addext/, addext, 2.0.1, Adds file extensions based on PRONOM ID, 2019-11-11T19:47:51+0000
/project/crypt4ghfs/, crypt4ghfs, 1.1, Crypt4GH FUSE file system, 2020-11-02T00:51:53+0000
/project/dittohunt/, dittohunt, 1.1, A duplicate file finder, previewer, and deleter., 2017-07-16T19:53:17+0000
/project/pathlib2/, pathlib2, 2.3.5, Object-oriented filesystem paths, 2019-09-27T07:33:53+0000
/project/treeage/, treeage, 0.2.0, Lists contents of directories in a tree-like format with age metric indicated for each file, 2020-12-31T00:32:29+0000
/project/pydica-watchdog/, pydica-watchdog, 0.6.2, Native and Virtual Filesystem Events Monitoring, 2013-07-25T12:52:41+0000
/project/bitdust-p2p/, bitdust-p2p, 0.0.3, BitDust is new software framework to build distributed and secure peer-to-peer applications., 2020-09-15T19:26:40+0000
/project/dohq-artifactory/, dohq-artifactory, 0.7.534, A Python interface to Artifactory, 2021-03-10T05:58:23+0000
/project/python-benedict/, python-benedict, 0.23.2, python-benedict is a dict subclass with keylist/keypath support, I/O shortcuts (base64, csv, json, pickle, plist, query-string, toml, xml, yaml) and many utilities... for humans, obviously., 2021-01-19T11:08:10+0000
/project/safeoutput/, safeoutput, 2.0, Tempfile wrapper to ensure output files are either complete, or empty. Also handles stdout, which gives no truncation guarantees., 2019-12-23T06:57:43+0000
/project/megacl/, megacl, 0.4.6, mega.co.nz command line client., 2013-05-12T05:30:00+0000
/project/kdautoteamviewer/, kdAutoTeamviewer, 1.0.1, , 2019-04-05T23:33:05+0000
/project/zfs-check/, zfs-check, 0.6.0, Check on the health of your ZFS pools, 2019-06-10T02:39:39+0000
/project/uriutils/, uriutils, 0.1.16, Easily read and write to different storage platforms in Python., 2018-11-02T09:11:26+0000
/project/pyil-converter/, pyil-converter, 0.6.6.9, Convert files to the format you want!, 2016-11-08T23:37:25+0000
/project/pyinotify/, pyinotify, 0.9.6, Linux filesystem events monitoring, 2015-06-04T15:50:22+0000
/project/column-text-format/, column-text-format, 0.0.2, Unfilled description, 2021-03-13T15:21:41+0000
/project/ntfsjournal/, ntfsjournal, 1.0, Module to read NTFS USN journal., 2011-05-05T10:03:16+0000
/project/openmeta/, openmeta, 0.1.1dev, Trivial wrapper providing tidy python access to the openmeta command-line client to set OS X openmeta tags on files, 2011-03-16T02:42:10+0000
/project/split-file-reader/, split-file-reader, 0.0.4, A package to read parted files on disk., 2020-12-01T02:53:47+0000
/project/preadwrite/, preadwrite, 0.0.1, pread, pwrite interface for pypy 6.0, 2020-08-26T04:44:08+0000
/project/pathlib2-unicode/, pathlib2-unicode, 3.0.0, Object-oriented filesystem paths handles unicode., 2021-03-03T10:18:44+0000
/project/symlink-gardener/, symlink-gardener, 0.2.3, A symlink farm manager akin to GNU Stow, 2019-03-08T23:40:54+0000
/project/gsutil/, gsutil, 4.61, A command line tool for interacting with cloud storage services., 2021-04-06T17:40:39+0000
/project/watchgod/, watchgod, 0.7, Simple, modern file watching and code reload in python., 2021-01-30T16:34:39+0000
/project/fcache/, fcache, 0.4.7, a dictionary-like, file-based cache module for Python, 2017-03-12T02:04:57+0000
/project/spasco/, spasco, 1.0.1, Renaming Tool, 2021-04-25T16:26:49+0000
/project/fsnix/, fsnix, 0.2, Expose more advanced posix/file system APIs to Python, 2012-11-12T20:42:35+0000
/project/fixturefilehandler/, fixturefilehandler, 1.4.0, This project helps you to vacate specific file path or deploy resource file into specific file path when unit testing., 2020-08-17T06:19:26+0000
/project/hachoir/, hachoir, 3.1.2, Package of Hachoir parsers used to open binary files, 2021-02-15T11:03:12+0000
/project/in-place/, in-place, 0.5.0, In-place file processing, 2021-02-20T20:46:33+0000
/project/speedcopy/, speedcopy, 2.1.0, Replacement or alternative for python copyfile()utilizing server side copy on network shares for fastercopying., 2020-06-09T15:12:02+0000
/project/aioflock/, aioflock, 0.0.1, File lock support for asyncio., 2015-08-28T16:06:17+0000
/project/pyznap/, pyznap, 1.6.0, ZFS snapshot tool written in Python, 2020-09-22T18:06:26+0000
/project/py-splice/, py-splice, 1.0.2, A Python interface to splice(2), 2018-11-30T18:39:41+0000
/project/rc-cli/, rc-cli, 0.4.1, RoseCloud CLI, 2019-03-28T19:29:00+0000
/project/remcmp/, remcmp, 2.1.0.post2, Extensible program to compare local and remote directories., 2019-10-02T20:54:09+0000
/project/kubefuse/, kubefuse, 0.7.3, A FUSE file system for Kubernetes, 2016-08-24T09:43:37+0000
/project/pydirstat/, pydirstat, 0.9.15, Show statistics informations for a directory in HTML, SVG, or Flash., 2006-11-02T22:45:52+0000
/project/perplex/, perplex, 0.0.1, Perpetual Plex in the Cloud, 2018-12-23T05:33:08+0000
/project/dewi-commands/, dewi-commands, 2.1.1, A toolchain and framework for everyday tasks, 2020-07-03T21:26:57+0000
/project/pymmbtool/, pymmbtool, 1.0.0, Command line tools to manage BBC Microcomputer DFS disk images and MMB disk bundles, 2020-05-13T08:05:00+0000
/project/bitdust/, bitdust, 0.0.2, BitDust is a decentralized on-line storage network for safe, independent and private communications., 2019-05-11T17:54:37+0000
/project/jaffle/, jaffle, 0.2.4, Python app and process orchestration tool for development environment, 2018-06-17T06:02:59+0000
