/project/copy-windows-10-lock-screen-wallpaper/, copy-windows-10-lock-screen-wallpaper, 1.1.4, Copy Windows 10 Lock Screen Wallpaper, 2020-10-04T02:55:48+0000
/project/sunidhi/, sunidhi, 0.0.5, Make graph from google sheets, 2020-10-13T15:40:11+0000
/project/gbprocess/, gbprocess, 0.0.1, A basic binary converter, 2020-09-25T19:29:00+0000
/project/tasslab/, tasslab, 0.0.6, phase reset package, 2020-04-13T10:25:36+0000
/project/biowardrobe-airflow-plugins/, biowardrobe-airflow-plugins, 1.1.3, Add plugin workflows to BioWardrobe, 2019-01-23T20:30:17+0000
/project/wxpython/, wxPython, 4.1.1, Cross platform GUI toolkit for Python, "Phoenix" version, 2020-11-25T21:48:11+0000
/project/khrplot/, khrplot, 0.0.3, import google sheets and plot any columns you choose, 2020-10-11T10:08:15+0000
/project/gunjancalc/, gunjancalc, 0.0.1, A very basic calculator, 2020-10-31T19:09:57+0000
/project/remotescreen/, remotescreen, 0.0.2, View remote screen via HTTP/HTTPS., 2020-07-03T14:34:09+0000
/project/gemlibrary-windows/, GEMLibrary-windows, 0.3.2, GEM Derivatives Library, 2020-06-02T19:50:34+0000
/project/topsis101803603/, topsis101803603, 0.0.1, A very basic calculator, 2020-11-13T18:37:41+0000
/project/mattapi/, mattapi, 0.99.3, Test API Iris, 2019-08-29T23:53:49+0000
/project/ryantest/, RyanTest, 0.1.0, A test programmes, 2019-03-03T14:29:34+0000
/project/economycord/, EconomyCord, 0.0.6, A simple-compact economy package for discord.py with documentation, 2021-02-23T18:20:04+0000
/project/parfis/, parfis, 0.0.4, Particles and field simulator, 2020-10-15T11:27:40+0000
/project/mitsuplccom/, mitsuplccom, 0.0.1, Library to communicate with FX5U PLC using socket communication, 2021-04-23T10:57:42+0000
/project/vikas/, Vikas, 0.0.1, Our package will give u a basic calculator function such as add, sub, multiply and divide., 2021-02-09T10:30:59+0000
/project/execution-pipeline/, execution-pipeline, 0.5.0, This library allows users to easily wrap functions with a series of decorators., 2020-12-27T08:09:54+0000
/project/npclc/, npclc, 0.0.1, A very basic calculator, 2020-10-20T13:54:07+0000
/project/dnsbl/, dnsbl, 0.0.6, Module that checks the given ips blacklisting status, 2021-03-22T09:36:32+0000
/project/topsis-jatin-101866020/, topsis-jatin-101866020, 0.0.1, topsis score and rank calculator, 2020-11-13T15:29:21+0000
/project/electrumsv-sdk/, electrumsv-sdk, 0.0.33, ElectrumSV SDK, 2021-02-09T04:53:03+0000
/project/wendata/, wendata, 1.0, package for research, 2021-04-09T05:47:22+0000
/project/dymmaths/, DymMaths, 0.0.3, A simple calculator, 2021-03-25T09:38:14+0000
/project/simple-calculator/, Simple-Calculator, 0.0.1, A basic calculator which add, subtracts, multiplies and divides, 2020-08-20T17:46:57+0000
/project/shawarma/, shawarma, 0.0.1, A simple package to perform basic data cleaning in EDA, 2021-03-22T22:16:27+0000
/project/calculadoraclases/, CalculadoraClases, 0.0.4, Operaciones de 2 digitos con Interfaz, 2020-11-25T23:29:53+0000
/project/talkpy/, talkpy, 0.0.1, It is a very semple libary, 2021-01-02T04:41:54+0000
/project/fastdb/, fastdb, 0.0.8, database for server-client jobs or local storage, 2021-02-20T13:12:52+0000
/project/azimsimple/, azimsimple, 0.0.2, A very simple library, 2021-04-18T09:13:43+0000
/project/taguchimethod/, taguchimethod, 0.0.1.0, Taguchi Method, 2020-08-21T09:13:58+0000
/project/mescapi/, mescapi, 0.1.13, Python API for MESc, 2020-08-06T14:04:51+0000
/project/patelier/, patelier, 0.0.2.dev1, A Japanese text-line analyzing package, 2020-11-25T08:17:00+0000
/project/dsdce/, dsdce, 0.0.2, A simple library to get the code for all Data Structure tutorials for dce department PSG Polytechnic College. Developed by Mohamed Fazil, DCE Student, PSG Polytechnic College., 2020-09-22T15:15:13+0000
/project/ftpackage/, FtPackage, 0.0.4, built-in python functions, 2020-12-16T14:32:37+0000
/project/gsheetvis/, gsheetvis, 0.0.3, A Visualizing program which can visualize you data from google sheets, 2020-10-12T05:24:37+0000
/project/bcalculator/, BCalculator, 0.0.1, A very basic calculator, 2020-10-01T17:06:07+0000
/project/graphy2/, graphy2, 0.4.2, graphy2: cross platform compatible Custom_Graphs and tables, 2020-08-11T23:49:34+0000
/project/animerim/, animerim, 0.1, A simle package to scrap anime infos, 2021-03-29T20:14:41+0000
/project/simses/, simses, 1.1.1, Simulation for Stationary Storage Systems (SimSES), 2021-04-23T12:54:16+0000
/project/calculadoraclasesss/, CalculadoraClasesss, 0.5.4, Operaciones de 2 digitos con Interfaz, 2020-11-26T20:55:23+0000
/project/echo-api/, echo_api, 1.0.7.dev0, Python API for Echo credentialing software, 2018-06-28T21:47:03+0000
/project/bpy-build/, bpy-build, 2.1.0, Find Blender sources in version control, create build scripts, 2020-11-18T02:01:27+0000
/project/simcal/, Simcal, 0.0.1, Our package will give u a basic calculator function such as add, sub, multiply and divide., 2021-02-09T11:46:33+0000
/project/acapy/, acapy, 0.0.12, AVALDATA AcapLib2 Python wrapper., 2021-04-12T05:44:13+0000
/project/mybasiccalculator/, mybasicCalculator, 0.0.1, A very basic calculator, 2020-07-16T18:32:43+0000
/project/image-quality/, image-quality, 1.2.7, Image quality is an open source software library for Automatic Image Quality Assessment (IQA)., 2021-02-15T01:21:30+0000
/project/sesh/, sesh, 0.2.7, A tool for managing music classes from the command line., 2019-12-11T20:32:48+0000
/project/input-simple/, input-simple, 1.0.2, A Library for facilitating input operations, 2020-09-09T11:34:47+0000
/project/windowsapps/, windowsapps, 0.0.8, Windows Apps for python, 2021-03-06T16:50:27+0000
/project/a2y-wxtools/, a2y-wxtools, 0.8.5, A module that supplies some wx widgets., 2020-11-30T09:01:33+0000
/project/zmzget/, zmzget, 0.1.0, CLI Tool for fetching the updating zimuzu tv serials., 2018-03-25T08:00:01+0000
/project/mark-libray/, mark-libray, 0.0.1, format table, 2020-11-12T05:09:31+0000
/project/example-pkg-windf98/, example-pkg-windf98, 0.0.2, A small example package, 2020-12-16T06:32:36+0000
/project/pylibcklb/, pylibcklb, 1.10.0, The pylibcklb is a library of functions and classes created from me and were used in different other projects of me., 2018-08-24T11:45:07+0000
/project/hanhanai/, HanhanAI, 2.0.2, Universal game AI system for game developer, 2019-09-10T08:16:44+0000
/project/dl-auto-cnn/, DL-auto-cnn, 0.0.1, creates a cnn architecture using user inputs, 2020-10-19T14:09:15+0000
/project/cloud-volume/, cloud-volume, 3.11.0, A serverless client for reading and writing Neuroglancer Precomputed volumes both locally and on cloud services., 2021-04-23T23:57:06+0000
/project/psutil/, psutil, 5.8.0, Cross-platform lib for process and system monitoring in Python., 2020-12-19T01:19:27+0000
/project/wmc-dl-functions/, wmc-dl-functions, 1.2, Functions from WMC Datalake, 2020-11-18T16:47:14+0000
/project/mylittlehelpers/, mylittlehelpers, 1.1.0.dev0, Just some helper functions that I expect to use across projects, 2018-06-08T02:18:32+0000
/project/dts-256-hasher/, DTS-256-Hasher, 0.0.1, A hashing tool, safe to use to store password, 2021-03-13T15:52:09+0000
/project/save-thread-result/, save-thread-result, 0.0.6, Simple subclass wrapper around `threading.Thread` to get the return value from a thread in python (from `threading` built-in module in Python Standard library). Exact same interface for creating an instance of this threading sublcass as `threading.Thread`!, 2021-02-08T00:27:52+0000
/project/glvi/, glvi, 0.1.7, Local variable importance from a global model, 2020-09-08T02:24:19+0000
/project/collageradiomics/, collageradiomics, 0.3.3, CoLliage Implementation, 2020-12-11T01:53:42+0000
/project/modelcrudpostgres/, modelcrudpostgres, 0.0.0, Model for CRUD operations with PostgreSQL DB, 2020-12-09T17:40:22+0000
/project/ipboards/, ipboards, 9999.0.2, POC testing, 2021-02-27T04:57:02+0000
/project/mathnew/, Mathnew, 0.0.1, A very basic calculator, 2020-10-12T10:57:29+0000
/project/customtkwidgets/, CustomTkWidgets, 0.0.1, Custom widgets to make tkinter look better, 2020-11-04T15:55:55+0000
/project/cmdperfect/, cmdperfect, 0.3, Hy, this is cool librari for making cmd programs more beautifull and easy, 2020-12-27T09:34:37+0000
/project/cloudmesh-abstract/, cloudmesh-abstract, 4.3.5, A command called abstract and foo for the cloudmesh shell, 2021-02-06T01:16:54+0000
/project/speedtimedistance/, speedtimedistance, 0.0.0.1, calculate speed, time and distance, 2020-08-19T11:56:12+0000
/project/joulescope/, joulescope, 0.9.6, Joulescope™ host driver and utilities, 2021-04-14T16:52:33+0000
/project/jrccalculator/, jrccalculator, 0.0.1, A very basic calculator, 2021-01-02T12:45:20+0000
/project/orchid-python-api/, orchid-python-api, 2021.1.399.post1, Defines and implements the Python API for Orchid*. (*Orchid is a mark of Reveal Energy Services, Inc.), 2021-04-09T19:04:28+0000
/project/a2y-mew/, a2y-mew, 0.9.3, A module that implements improved Mewtocol., 2021-01-23T07:47:56+0000
/project/tangier-api/, tangier_api, 1.2.3.dev0, A simple Python package to facilitate interactions with Tangier's API, 2019-03-12T23:36:21+0000
/project/calcy/, calcy, 0.0.6, A basic calculator, 2020-07-11T15:57:17+0000
/project/pyflct/, pyflct, 0.2.2, A Python wrapper for Fourier Local Correlation Tracking., 2021-04-01T12:46:30+0000
/project/basicenssembleargumentation/, Basicenssembleargumentation, 0.0.1, A basic argumentation process where the outcomes from different models can argue for generating a final output., 2020-05-24T17:52:16+0000
/project/devil-s-calculator/, Devil-s-Calculator, 0.0.1, Hail Hydra, 2021-02-09T11:51:23+0000
/project/glowriya-calculator/, glowriya-calculator, 0.0.1, A very basic calculator, 2020-11-12T21:22:30+0000
/project/eprinttools/, eprinttools, 0.1.7, Command line tools, Golang package and Python module for working with the EPrints 3.x REST API, 2020-09-02T21:00:36+0000
/project/bsbclaci/, BsbClaci, 0.0.1, The Calculator of all time., 2020-08-26T07:26:25+0000
/project/andyontop/, andyontop, 1.4, AndyOnTop, 2021-03-23T02:34:04+0000
/project/pyautoscraper/, pyautoscraper, 0.0.2, A lightweight python module which automates webscraping and parsing through HTML, 2020-10-06T20:24:38+0000
/project/dineshbasiccalculator/, dineshbasiccalculator, 0.0.2, A very basic calculator, 2020-05-29T17:14:59+0000
/project/fordfulkerson-prueba/, fordfulkerson-prueba, 0.0.5, Implementación del método Fork Fulkerson, 2021-03-17T19:45:41+0000
/project/collageradiomicscli/, collageradiomicscli, 1.0.0, Get Collage features from an image and a binary mask, 2020-09-20T22:58:41+0000
/project/fpgatools/, fpgatools, 1.2.0, University project to support FPGA development., 2020-10-17T19:15:34+0000
/project/calculadoraclasion/, CalculadoraClasion, 0.5.4, Operaciones de 2 digitos con Interfaz, 2020-11-26T20:55:25+0000
/project/selenium-update/, selenium-update, 0.0.0, Automate Selenium webdriver dependency set up, 2020-08-09T10:21:26+0000
/project/inkster/, inkster, 1.1.4, Inkster is possible for many things., 2020-07-11T15:00:38+0000
/project/refrapt/, Refrapt, 0.1.8, A tool to mirror Debian repositories for use as a local mirror., 2021-04-23T18:47:36+0000
/project/topsis-arsh-101803614/, TOPSIS-Arsh-101803614, 0.0.1, This Python Package is used to implement the TOPSIS Algorithm, 2020-11-14T05:52:31+0000
/project/calcchidy/, calcchidy, 0.1.1, Operaciones de 2 digitos, 2020-11-17T23:31:20+0000
/project/plaidml/, plaidml, 0.7.0, PlaidML machine learning accelerator, 2020-01-16T02:53:55+0000
/project/madseksempel/, madseksempel, 0.1.1, A statistical calculator for the course 'Probability Theory and Statistics at the University of Copenhagen, 2020-12-02T17:07:26+0000
/project/ormucoq3lrucache/, ormucoq3lrucache, 1.0, A basic lru cache, 2020-09-03T00:43:45+0000
/project/tokenbox/, tokenbox, 1.1.1.dev0, RESTful API token management utility, 2017-09-08T14:16:54+0000
/project/freq-frame/, freq-frame, 1.0.0, , 2021-04-25T18:02:14+0000
/project/mail-service/, mail-service, 1.0.5, Sending email using various services., 2020-10-26T13:15:24+0000
/project/fastdbf/, fastdbf, 0.1.6, Read DBF Files with C and Python, fast., 2020-12-09T16:32:33+0000
/project/slootexhelps/, slootexhelps, 0.0.2, A very basic calculator, 2021-04-20T14:27:56+0000
/project/orbithunter/, orbithunter, 0.6.1, Framework for Nonlinear Dynamics and Chaos, 2021-03-26T15:11:20+0000
/project/wtools/, wtools, 1.0.10, WAF build tools, 2021-02-08T17:20:10+0000
/project/pymsfilereader/, pymsfilereader, 1.0.1, Thermo MSFileReader Python bindings to interact with .raw files generated by Thermo tandem mass spectrometers., 2019-07-23T14:20:41+0000
/project/gabri432physicslibrary/, gabri432physicslibrary, 0.0.4, A short set of Physics formulas and constants, 2021-02-26T19:28:40+0000
/project/aalmond/, Aalmond, 0.1, Functions for Dataframe Vital Stats, Outliers Detection, Sectional Data View from Mid, Mid Q1, Mid Q3 of a Dataframe, 2020-07-24T07:38:29+0000
/project/serial-mock/, serial_mock, 0.1, mocks serial ports for use with com0com(windows) or socat(*nix), 2017-04-22T06:32:54+0000
/project/venuspy/, venuspy, 1.0.3, A cross platform tool for setting a random wallpaper image from unsplash.com, 2020-02-03T06:31:28+0000
/project/mattiarigicalculator/, mattiarigicalculator, 0.0.1, A very basic calculator, 2020-12-16T22:04:58+0000
/project/pmini/, pmini, 0.1.0, A test programmes, 2019-03-03T14:41:56+0000
/project/gitrepo/, gitrepo, 2.8.0.post1, Repo helps manage many Git repositories, does the uploads to revision control systems, and automates parts of the development workflow., 2021-03-19T10:22:51+0000
/project/cloudmesh-sys/, cloudmesh-sys, 4.3.3, A command called sys for the cloudmesh shell, 2020-10-27T17:21:03+0000
/project/uweaimevan-basic-calculator/, uweaimevan-basic-calculator, 0.0.1, A very basic calculator, 2020-11-14T22:03:47+0000
/project/enginetk/, enginetk, 0.0.2, a small game engine for tkinter, 2021-03-31T17:00:33+0000
/project/topsis-karanaggarwal-101983065/, TOPSIS-KaranAggarwal-101983065, 1.0.1, Topsis_Assignment, 2020-11-13T15:49:47+0000
/project/jprimee/, jprimee, 0.0.1, Checks whether number is prime or not, 2020-06-23T16:35:17+0000
/project/icusim/, ICUSIM, 0.2.0, Intensive Care Unit (ICU) Simulation, 2020-04-13T13:27:43+0000
/project/gkbasiccalculator/, GKBasicCalculator, 0.0.1, A very basic calculator, 2020-07-12T07:42:23+0000
/project/rectangle-packer/, rectangle-packer, 2.0.0, Pack a set of rectangles into a bounding box with minimum area, 2020-12-29T18:26:57+0000
/project/mediabyte/, mediabyte, 0.9.1.5, Mediabyte - a succinct syntax for handling online media, 2020-01-19T16:48:21+0000
/project/srinivascalculator/, srinivascalculator, 0.1.3, A very basic calculator, 2020-06-09T11:50:58+0000
/project/explorerfromwsl/, ExplorerFromWSL, 1.0.0, call explorer.exe from wsl shell by unix-style path, 2019-07-13T01:43:52+0000
/project/sqlalchemy-dataflex/, sqlalchemy-dataflex, 0.1.5, A SQLAlchemy dialect for DataFlex flat-file databases., 2021-02-10T21:03:52+0000
/project/datagoose/, datagoose, 0.0.1, Basic database for python, 2021-04-04T11:08:46+0000
/project/pymails/, PyMails, 0.0.5, Simple tools for sending mail, 2021-04-04T15:39:05+0000
/project/sh0rt/, Sh0rt, 0.0.1, Shortner a url via this libary we offer many services, 2020-12-22T09:15:48+0000
/project/coep-package/, coep-package, 0.0.4, to create csv file and create latex code, 2021-04-03T08:30:11+0000
/project/a2y-hengchangsheng/, a2y-hengchangsheng, 0.8.1, A module that interfaces HengChangSheng things., 2020-09-26T13:25:48+0000
/project/line-protocol-parser/, line-protocol-parser, 1.1.0, Parse InfluxDB line protocol string into Python dictionary, 2020-09-05T13:28:58+0000
/project/amap/, amap, 0.1.26, Automated mouse atlas propagation, 2020-06-12T07:43:29+0000
/project/myterial/, myterial, 1.1, Easy acces to material colors hex codes, 2021-03-17T08:51:41+0000
/project/getboxplots/, getboxplots, 0.0.1, data visualisation, 2020-08-25T09:18:23+0000
/project/qip2/, qip2, 1.6.0.0, Integrate kdb+ into python, 2020-05-07T17:57:42+0000
/project/dwriteshapepy/, dwriteshapepy, 1.0.2, Python extension for Windows DirectWrite shaping, modeled after uharfbuzz, 2021-04-08T00:51:41+0000
/project/pw-gen/, pw-gen, 0.0.9, A library for generating secure passwords, 2021-04-03T15:59:20+0000
/project/basicensembleargumentation/, Basicensembleargumentation, 0.0.1, A basic argumentation process where the outcomes from different models can argue for generating a final output., 2020-05-30T18:23:10+0000
/project/biowardrobe-cwl-workflows/, biowardrobe-cwl-workflows, 1.0.20181213214400, Wrapped BioWardrobe's CWL files, 2018-12-13T21:44:31+0000
/project/femtoapi/, femtoapi, 1.0.0, Python API for MESc, 2020-10-30T07:28:27+0000
/project/anurag-simplecalculator/, anurag-simplecalculator, 0.0.3, A very basic calculator, 2020-12-16T17:12:44+0000
/project/ethos-u-vela/, ethos-u-vela, 2.1.1, Neural network model compiler for Arm Ethos-U NPUs, 2021-03-01T15:28:15+0000
/project/getcreds/, getcreds, 0.0.2, obfuscate credentials for code, 2020-09-15T16:41:57+0000
/project/basic-calculator-finite/, basic-calculator-finite, 0.0.1, Calculator, 2021-02-10T07:11:58+0000
/project/abecalculator/, abecalculator, 0.2, A very basic calculator, 2021-02-16T06:30:44+0000
/project/ninadcalc/, ninadcalc, 0.0.1, Our package will give u a basic calculator function such as add, sub, multiply and divide., 2021-02-09T11:45:54+0000
/project/basic-calculator-nls/, basic-calculator-nls, 0.0.1, A very basic four function calculator, 2021-03-06T00:06:41+0000
/project/tbvectors/, tbVectors, 0.0.4, An easy way to use vectors, 2021-04-21T18:06:07+0000
/project/pvnhxgmgiq/, pvnhxgmgiq, 0.1.7, , 2018-02-27T05:46:59+0000
/project/fastcalculator/, fastcalculator, 1.0.0, A very basic calculator, 2020-12-28T15:52:33+0000
/project/hebrew-fix/, hebrew-fix, 0.0.2, With this module you can fix your hebrew broken encode, 2020-10-02T09:11:54+0000
/project/easy-ds/, easy-ds, 0.0.1, Implementation of data structures, 2021-02-15T03:37:39+0000
/project/bpqcrypto/, bpqcrypto, 1.3.3, a crypto library for BPQ, 2018-12-04T13:53:04+0000
/project/sc388/, sc388, 0.0.1, A very basic number addition, 2021-02-08T22:37:32+0000
/project/getpiecharts/, getpiecharts, 0.0.1, data visualisation, 2020-08-20T13:11:15+0000
/project/simplebmi/, simplebmi, 1.0.1, A very basic BMI calculator, 2020-12-31T10:53:30+0000
/project/contact-points/, contact-points, 0.0.7, Find contact points in a 3D Volume., 2021-04-02T00:34:59+0000
/project/freshserviceapi/, FreshServiceApi, 0.0.6, Modules for the FreshService API, 2021-02-05T02:16:54+0000
/project/bookpam/, bookpam, 0.0.1, BookPam is a typesetting system; it includes features designed for the production of technical documentation and book., 2021-03-17T19:46:29+0000
/project/baem200/, baem200, 0.0.11, Bachmann electronic Python Util Library, 2019-08-14T12:38:48+0000
/project/topsis-ayush-101803401/, TOPSIS-Ayush-101803401, 0.0.1, A very basic file of topsis, 2020-11-12T19:06:46+0000
/project/openvr/, openvr, 1.16.801, Unofficial python bindings for Valve OpenVR SDK, 2021-02-26T00:32:36+0000
/project/pyimapi/, pyIMAPI, 0.4.0b2, Create CD, DVD, DVD Dual Layer, and BluRay ISO images under Windows directly from Python, 2018-06-25T06:47:36+0000
/project/a2y-modbus/, a2y-modbus, 0.8.2, A module that implements partial function of Modbus protocol., 2021-01-04T06:16:44+0000
/project/validateconection/, ValidateConection, 0.0.1, Pruebas de conexion para Dongle, 2020-12-11T00:10:13+0000
/project/asamba/, asamba, 1.0.8, Python interface to peform asteroseismic modelling with the asamba grid, 2017-06-21T10:55:59+0000
/project/wickes-tools/, wickes-tools, 0.0.4, code collection, 2021-01-09T20:18:13+0000
/project/thebasiccalculator/, TheBasicCalculator, 0.0.1, A very basic calculator, 2020-10-01T17:08:42+0000
/project/hellothere/, HelloThere, 0.0.1, A Package That Has One Function., 2020-11-27T18:29:03+0000
/project/gridsync/, gridsync, 0.4.3, Synchronize local directories with Tahoe-LAFS storage grids., 2020-07-25T00:41:46+0000
/project/pyaviation/, pyaviation, 0.0.2, This package provides functionnalities for aviation, 2021-01-17T17:52:12+0000
/project/avsub/, avsub, 1.0.2, A simplified command-line interface for FFmpeg, 2021-04-12T00:18:47+0000
/project/tomotopy/, tomotopy, 0.11.1, Tomoto, Topic Modeling Tool for Python, 2021-03-27T15:57:35+0000
/project/whitecanzelib/, whitecanzelib, 0.2, This is my basic python library., 2020-07-19T12:49:57+0000
/project/coursework/, coursework, 0.0.1, Model for CRUD operations with PostgreSQL DB, 2020-12-09T17:59:49+0000
/project/weather-dc/, weather-dc, 0.0.1, Prints weather of Washington DC also creates a excel file of the forecast., 2021-02-12T19:27:15+0000
/project/pttlibrary/, PTTLibrary, 0.9.1, PTT library, 2020-02-09T14:34:54+0000
/project/ocrmypdf/, ocrmypdf, 12.0.0, OCRmyPDF adds an OCR text layer to scanned PDF files, allowing them to be searched, 2021-04-23T07:40:28+0000
/project/fdet/, fdet, 0.2.1, An easy to use face detection module based on MTCNN and RetinaFace algorithms., 2020-05-14T21:42:20+0000
/project/epew/, epew, 3.4.7, epew (ExternalProgramExecutionWrapper) is a tool to wrap program-calls with some useful functions like getting stdout, stderr, exitcode and the ability to set a timeout., 2020-10-27T19:03:46+0000
/project/pnguin/, pnguin, 0.0.1, A simple, dual-axis DataFrame library with remote support, 2020-12-16T14:03:14+0000
/project/sagarcalculator/, SagarCalculator, 0.0.1, Our package will give u a basic calculator function such as add, sub, multiply and divide., 2021-02-11T18:36:51+0000
/project/terminatetensorflow/, Terminatetensorflow, 0.0.8, A very basic NN framework, 2021-01-24T22:12:01+0000
/project/eric-ide/, eric-ide, 21.4, eric-ide is an integrated development environment for the Python language., 2021-04-02T10:04:11+0000
/project/fibooks/, fibooks, 1.0.4, Python library for financial statement analysis. The full documentation can be found at: https://github.com/TimoKats/fibooks, 2021-04-24T16:04:40+0000
/project/colored/, colored, 1.4.2, Simple library for color and formatting to terminal, 2019-12-09T09:45:53+0000
/project/pycellsewew/, pycellsewew, 1.2.8, A simple and flexible Python3 library for Cell, 2020-11-07T16:10:41+0000
/project/top-sis-cal/, TOP-SIS-CAL, 0.0.1, Calculation of TOPSIS, 2020-11-13T20:25:53+0000
/project/prerak-calculator/, Prerak-Calculator, 0.0.1, Our package will give you a basic calculator function like addition, subtraction, multiplication and division., 2021-02-09T12:24:12+0000
/project/psychxr/, psychxr, 0.2.2, Python extension library for interacting with eXtended Reality displays (HMDs), intended for research in neuroscience and psychology., 2019-10-16T20:36:38+0000
/project/manufaitest/, ManufaiTest, 0.1.1, Union de proyectos anteriores, 2020-12-30T01:08:54+0000
/project/uzbekstemmer/, UzbekStemmer, 0.0.1, Uzbek Stemmer, 2021-04-19T13:33:49+0000
/project/shadowcut/, shadowCut, 1.0.6, Deep Learning Library to speed up the coding process, 2021-04-17T05:52:30+0000
/project/metric-py/, metric-py, 0.0.6, Metric python3 module, 2020-05-13T02:09:40+0000
/project/golumn/, golumn, 0.21.3, Graphical CSV viewer. `column` with a "g", 2018-08-03T18:23:11+0000
/project/magicprintbykeshari/, MagicPrintByKeshari, 0.0.1, , 2020-07-23T19:45:15+0000
/project/sdp18/, SDP18, 0.1.0, This package schedules surgeries using metaheurisitcs. It is a project done for in NUS for Systems Design Project (SDP):Metaheuristic Surgery Scheduling for Operating Theatre Scheduling, 2021-02-01T06:19:22+0000
/project/wsl-tray/, wsl-tray, 0.2, wsl-tray is a lightweight Windows tray application for easily managing WSL 2 VMs., 2020-07-22T14:57:18+0000
/project/dakshbasicpackage/, dakshbasicpackage, 0.0.1, Basic Print statement, 2020-11-18T11:22:05+0000
/project/django-caching/, django_caching, 1.1.0, A easy using django cache manager., 2017-06-27T04:36:05+0000
/project/mkvbatchmultiplex/, mkvbatchmultiplex, 2.0.1, A mkv media batch multiplex., 2020-09-03T21:03:32+0000
/project/kelpsong/, kelpsong, 0.1.0, An algorithm library for robotics and AI, 2020-10-22T22:13:53+0000
/project/topsis-shreya-101803595/, TOPSIS-Shreya-101803595, 0.0.1, This Python Package is used to implement the TOPSIS Algorithm, 2020-11-14T06:15:35+0000
/project/solsticepy/, solsticepy, 0.3.10, Scripts and wrappers for Solstice ray-tracing software, 2020-10-13T07:32:44+0000
/project/nntoybox/, nntoybox, 1.0.5, DeepLearning Model Builder, 2021-04-21T17:21:30+0000
/project/cabocha-python/, cabocha-python, 0.69.1, Python wrapper for CaboCha: Japanese Dependency Structure Analyzer, 2019-09-20T18:56:47+0000
/project/secretlisting/, secretListing, 0.0.1, Makes operations on lists easy., 2021-03-08T17:12:33+0000
/project/a2y-atsui/, a2y-atsui, 0.9.0, A module that implements the UI part of ats module., 2020-11-22T03:30:27+0000
/project/shaderpy/, shaderpy, 0.0.4, A simple shader package for Pyglet., 2021-02-27T17:42:37+0000
/project/simplepackage4/, SimplePackage4, 0.0.2, A very basic calculator, 2020-10-26T22:06:41+0000
/project/csvgen/, csvgen, 1.0.0, A command line CSV data output generator for testing, 2018-03-31T20:13:39+0000
/project/wav-win-sound/, wav-win-sound, 1.0.7, Play WAV Sounds (Windows ONLY!), 2021-02-14T13:25:37+0000
/project/fazil/, fazil, 0.0.1, A simple library developed by Fazil., 2020-09-22T13:55:25+0000
/project/olsapy/, olsapy, 2.0.1, a package for orthogonal linear separation analysis (OLSA), 2020-12-05T13:48:22+0000
/project/iexplorer-api/, iexplorer-api, 0.0.1, Internet Explorer API written on C++ Builder 6, 2021-01-09T05:16:08+0000
/project/brainreg/, brainreg, 0.2.4, Automated 3D brain registration, 2021-03-11T12:21:10+0000
/project/emiz/, emiz, 2018.9.16.4, Set of tools for the DCS mission builder, 2018-09-16T19:45:46+0000
