/project/phen-dns/, phen.dns, 0.1.1, Domain Name Server for Phen, 2016-01-01T21:20:30+0000
/project/txsockjs-client/, txsockjs_client, 0.1.0, SockJS client for Twisted-Python, 2015-04-30T11:38:50+0000
/project/txeasymail/, txeasymail, 20121112, Twisted client for easy email sending, 2012-11-12T19:47:51+0000
/project/gameserverbackend/, gameServerBackend, 0.0.4, A framework that interfaces games with websockets, 2020-10-16T03:42:51+0000
/project/helga-hipchat-nicks/, helga-hipchat-nicks, 0.1.1, A helga preprocessor to ensure that user nicks are set as @ mentions, 2015-03-07T16:32:30+0000
/project/txexiftool/, txExiftool, 0.1.3, Exiftool protocol and stream endpoint plugin to be used with Twisted, 2016-01-16T22:47:58+0000
/project/jersey/, jersey, 0.1.5, Jersey Core Libraries, 2010-11-11T21:31:24+0000
/project/twisted-ipython/, twisted-ipython, 2.0.0, An IPython extension for running twisted code, 2019-06-20T21:11:28+0000
/project/txgeonames/, txgeonames, 20121106, Twisted client for the GeoNames API, 2012-11-06T13:41:49+0000
/project/bitdust/, bitdust, 0.0.2, BitDust is a decentralized on-line storage network for safe, independent and private communications., 2019-05-11T17:54:37+0000
/project/pyviewx-client/, pyviewx.client, 0.5.1, A package for communicating with eye trackers via the iViewX server software from SensoMotoric Instruments., 2013-07-01T19:12:41+0000
/project/authkerb/, authkerb, 0.1, Kerberos authentication for Twisted, 2014-08-17T07:16:46+0000
/project/spreadsheetui/, spreadsheetui, 1.1.0, Multiclient bittorrent webui, 2020-06-07T12:54:55+0000
/project/txhl7/, txHL7, 0.5.0,  Async Twisted server implementation of Health Level 7's (HL7) Minimal Lower-Layer Protocol (MLLP)., 2020-09-08T23:24:52+0000
/project/helga-facts/, helga-facts, 0.2.2, A helga plugin that can be used to store responses that can be returned from a question, 2015-07-23T19:11:30+0000
/project/txoauth2/, txoauth2, 1.1.1, A module that allows implementing OAuth2 with twisted, 2018-10-26T12:20:07+0000
/project/txamqp3/, txAMQP3, 0.9.1, Python3 library for communicating with AMQP peers and brokers using Twisted, 2020-10-20T22:17:26+0000
/project/ade/, ade, 1.3.3, Asynchronous Differential Evolution, with efficient multiprocessing., 2020-03-20T17:47:55+0000
/project/redis-proxy/, redis_proxy, 0.0.2, a redis proxy that will seperate read and write, 2013-09-11T14:29:39+0000
/project/txxbee/, txXBee, 0.0.4, XBee Protocol for Twisted, 2012-02-23T22:32:58+0000
/project/scrivener/, scrivener, 0.2, Twisted Scribe Client/Server, 2012-09-07T17:05:14+0000
/project/pymodbus/, pymodbus, 2.5.1, A fully featured modbus protocol stack in python, 2021-04-01T06:19:31+0000
/project/authenticity/, authenticity, 0.1.1, OpenID Server running on mod_python and using a LDAP directory, 2011-03-19T04:21:08+0000
/project/twistedwebsocket/, TwistedWebsocket, 0.0.7, Websocket server implementation based on Twisted with SSL support., 2014-03-07T03:00:40+0000
/project/txhttp/, txHTTP, 0.1.2, Twisted + klein based HTTP app server framework, 2018-04-10T09:26:23+0000
/project/carml/, carml, 20.0.0, A command-line tool to query and control a running Tor. Based on txtorcon + Twisted., 2020-04-15T17:06:09+0000
/project/octothorpe/, octothorpe, 0.5, Asterisk Manager Interface library for the Twisted engine, 2014-07-20T03:02:06+0000
/project/merlyn/, merlyn, 0.0.9, A server backend for interactive online exercises., 2014-01-19T19:36:21+0000
/project/pychat/, PyChat, 1.5.0, Asynchronous Chat Client, 2015-01-07T15:49:54+0000
/project/vmw-vco/, vmw.vco, 0.3.1, Python bindings for the VMware Orchestrator, 2010-10-25T10:47:09+0000
/project/txasgiresource/, txasgiresource, 2.2.1, ASGI implemented as a Twisted resource, 2020-05-07T15:56:57+0000
/project/helga-poems/, helga-poems, 0.2.0, A helga command to generate either haiku or tanka poems, 2016-10-26T20:46:35+0000
/project/autobahn/, autobahn, 21.3.1, WebSocket client & server library, WAMP real-time framework, 2021-03-02T15:12:15+0000
/project/xslproxy/, xslproxy, 1.0.1, Xsl transforming reverse proxy based on twisted, 2020-11-23T14:07:54+0000
/project/sasync/, sAsync, 0.9.3, SQLAlchemy done Asynchronously: Twisted-friendly access to an SQL database., 2018-04-21T00:57:03+0000
/project/eagleeye/, eagleeye, 0.2.0, EagleEye is a library for metrics reporting, using Twisted., 2013-05-28T10:54:16+0000
/project/txcosm/, txcosm, 0.1.0, txcosm is a Python Twisted package to communicate with the Cosm API., 2013-01-27T06:20:33+0000
/project/fmn/, fmn, 2.1.1, Library for fedmsg Notifications, 2018-04-05T15:43:57+0000
/project/vault-redirector/, vault-redirector, 0.2.0, Python/Twisted application to redirect Hashicorp Vault client requests to the active node in a HA cluster, 2016-06-15T15:04:42+0000
/project/sat-pubsub/, sat-pubsub, 0.3.0, XMPP Publish-Subscribe Service Component, build for the need of the « Salut à Toi » project, 2019-08-16T10:43:55+0000
/project/asynqueue/, AsynQueue, 0.9.8, Asynchronous task queueing with Twisted: threaded, multicore, and remote., 2019-03-05T02:44:56+0000
/project/helga-spongebob/, helga-spongebob, 0.1, HeLgA PlUgIn tO Do mOcKiNg sPoNgEbOb tExT, 2018-12-19T06:19:50+0000
/project/treq/, treq, 21.1.0, High-level Twisted HTTP Client API, 2021-01-15T07:44:41+0000
/project/txpx/, TxPx, 0.1, Robust process management and communication for Twisted, 2015-03-29T20:20:53+0000
/project/ilmwetter/, ilmwetter, 0.2, Scrapy spider for the weather in Ilmenau, 2015-05-01T09:27:35+0000
/project/wallaby-base/, wallaby-base, 0.1.45, Core package for wallaby., 2013-02-01T12:12:31+0000
/project/wallaby-app-crm/, wallaby-app-crm, 0.1.36, CRM based on wallaby., 2013-01-25T00:38:41+0000
/project/txdbus/, txdbus, 1.1.2, A native Python implementation of the DBus protocol for Twisted applications., 2020-10-14T16:50:03+0000
/project/minidns/, minidns, 0.3, Simple DNS Server with REST API, for localhost only, 2013-09-11T17:40:51+0000
/project/mamba-framework/, mamba-framework, 0.3.5, Mamba is a high-level RAD Web Applications framework based on Twisted Web that uses Storm ORM as database access layer, 2013-05-06T22:01:05+0000
/project/txdiscourse/, txDiscourse, 0.1.2, Discourse API wrapper for Twisted, 2015-01-29T15:42:32+0000
/project/partysig/, partysig, 0.0.1, Create and verify distributed multi-party signatures, 2016-12-25T05:00:25+0000
/project/ccatterina-pymodbus/, ccatterina.pymodbus, 1.5.2.1, A fully featured modbus protocol stack in python, 2018-06-21T08:39:00+0000
/project/sqlbridge/, sqlbridge, 0.1.68, sql bridge for Autobahn|Python., 2014-12-18T17:05:07+0000
/project/txkazoo/, txkazoo, 0.0.5, Twisted binding for Kazoo, 2014-06-10T07:27:51+0000
/project/piped-contrib-zookeeper/, piped.contrib.zookeeper, 0.7.1, Apache ZooKeeper support for Piped., 2017-07-13T20:44:43+0000
/project/piped-contrib-amqp/, piped.contrib.amqp, 0.7.0, AMQP support for Piped., 2015-08-07T19:41:37+0000
/project/sockjs-cyclone/, sockjs-cyclone, 1.0.2, SockJS python server for the Cyclone Web Server, 2013-11-24T11:37:10+0000
/project/shadowsocks-gtk/, shadowsocks-gtk, 0.1.1, ShadowSocks Gtk Client, 2014-10-05T15:41:39+0000
/project/ncolony/, ncolony, 18.6.0, A process starter/monitor, 2018-06-24T00:34:33+0000
/project/twoost/, twoost, 0.3.3.1, Twoost is a collection of tools and helpers for the Twisted framework., 2016-01-26T22:12:34+0000
/project/lupulo/, lupulo, 0.3, Framework to build realtime web pages dedicated to monitor                    robots or IoT devices., 2016-01-20T11:39:29+0000
/project/thimble/, thimble, 0.2.0, A Twisted thread-pool based wrapper for blocking APIs., 2016-03-07T22:35:20+0000
/project/zed/, zed, 1.0.4, Thin wrapper for integrating ZeroMQ sockets into the Twisted reactore, 2021-03-31T18:45:23+0000
/project/lalita/, lalita, 0.1.3, Yet another IRC bot., 2015-09-26T00:44:08+0000
/project/txmsgpackrpc/, txmsgpackrpc, 1.2, txmsgpackrpc is a Twisted library to support msgpack-rpc, 2016-12-18T13:39:10+0000
/project/treeoflife/, treeoflife, 0.0.4, A Tree of your Life (end-user application), 2014-03-22T06:04:56+0000
/project/silverberg/, silverberg, 0.1.12, Twisted CQL Cassandra Client, 2015-07-15T23:51:32+0000
/project/dfutils/, dfutils, 0.0.2, Utilities to work with Twisted Deferreds., 2013-08-29T17:57:19+0000
/project/vncdotool/, vncdotool, 1.0.0, Command line VNC client, 2020-04-10T23:44:33+0000
/project/pyamf/, PyAMF, 0.8.0, AMF support for Python, 2015-12-17T07:09:26+0000
/project/pyviewx-pygame/, pyviewx.pygame, 0.5.1, A pygame calibration scene for use with PyViewX, 2013-10-09T15:03:51+0000
/project/rollbar/, rollbar, 0.15.2, Easy and powerful exception tracking with Rollbar. Send messages and exceptions with arbitrary context, get back aggregates, and debug production issues quickly., 2021-01-25T20:56:03+0000
/project/txsyncml/, txsyncml, 0.0.1, Twisted based SyncML 1.1 server., 2014-03-10T04:26:57+0000
/project/mockssh/, MockSSH, 1.4.5, MockSSH: Mock an SSH server and all commands it supports., 2017-01-15T21:55:26+0000
/project/jasmin/, jasmin, 0.10.9, Jasmin is a very complete open source SMS Gateway with many enterprise-class features., 2021-02-25T12:15:35+0000
/project/helga-icanhazascii/, helga-icanhazascii, 0.1.0, A helga match plugin that will show ASCII art for certain keywords., 2015-03-04T14:01:54+0000
/project/twisted-mqtt/, twisted-mqtt, 0.3.9, MQTT client protocol package for Twisted, 2018-12-12T09:56:55+0000
/project/txconnpool/, txconnpool, 0.1.1, A generalized connection pooling library for Twisted, 2010-02-22T20:33:10+0000
/project/jsonrpc/, jsonrpc, 3.0.1, A JSON-RPC 2.0 client-server library, 2021-04-06T10:05:18+0000
/project/pycri/, pycri, 0.3, IRC-bot, 2011-03-14T13:30:49+0000
/project/wallaby-backend-elasticsearch/, wallaby-backend-elasticsearch, 0.1.31, Asynchronous elasticsearch backend - part of Wallaby. The couchDB application framework., 2013-01-25T00:34:14+0000
/project/helga-giphy/, helga-giphy, 0.1.1, A command plugin to search giphy for an anmiated gif., 2015-03-04T23:54:46+0000
/project/tc2100/, tc2100, 0.1.2, Receive data from a compatible USB digital thermometer, 2020-06-13T17:19:27+0000
/project/cagou/, cagou, 0.7.0, Desktop/Android frontend for Salut à Toi XMPP client, 2019-07-24T19:13:22+0000
/project/txboxdotnet/, txboxdotnet, 15.5.0, Twisted-based async interface for Box (box.net) API v2.0, 2015-05-02T10:11:34+0000
/project/redirbot/, redirbot, 0.0.5, IRCBot, telling people they should contact you on different nickname, 2013-07-23T09:34:07+0000
/project/pendrell/, pendrell, 0.3.7, HTTP 1.1 user agent for the programmable web, 2010-12-26T07:32:29+0000
/project/wallaby-frontend-qt/, wallaby-frontend-qt, 0.2.45, Integration of Qt into wallaby., 2013-02-01T12:11:51+0000
/project/twisted-hl7/, twisted-hl7, 0.2.2, Async Twisted server implementation of Health Level 7 MLLP, 2014-11-06T13:56:04+0000
/project/lala/, lala, 0.4, IRC bot based on the twisted framework, 2014-09-27T17:20:49+0000
/project/txriak/, txriak, 0.3.2, txriak is a Twisted module that communicates with the
                     HTTP interface of Basho Technologies Riak data store., 2011-03-23T13:49:10+0000
/project/txgithub/, txgithub, 15.0.0, GitHub API client implemented using Twisted., 2015-01-13T00:35:42+0000
/project/txampext/, txampext, 0.0.11, Extensions to Twisted's AMP implementation, 2013-12-20T15:38:16+0000
/project/spotware-connect/, spotware-connect, 0.1.2, A python client wraper for Spotware Open API 2.0, 2020-02-27T02:51:34+0000
/project/brutal/, brutal, 0.3.3, a multi-network asynchronous chat bot framework using twisted., 2013-05-14T00:30:05+0000
/project/mailsink/, mailsink, 0.0.2, a mock SMTP server, 2010-11-28T07:13:09+0000
/project/imagebot/, imagebot, 1.2.1, A web bot to crawl websites and scrape images., 2015-07-13T13:02:54+0000
/project/txcurrentcost/, txcurrentcost, 0.0.3, txcurrentcost is a Python Twisted package that lets you monitor your CurrentCost device., 2013-01-04T04:50:27+0000
/project/pingspice/, pingspice, 0.4.2, Object-oriented netlist construction and multiprocess SPICE simulation., 2020-03-20T18:48:26+0000
/project/txretry/, txretry, 1.0.1, A Twisted class for retrying failing calls with a customizable back-off schedule., 2016-06-17T18:54:29+0000
/project/projection/, projection, 0.0.0, Project Configuration, 2020-09-27T14:13:35+0000
/project/stanczyk/, stanczyk, 0.1.0, Client software for the exercises in Crypto 101, the introductory book on cryptography., 2014-01-18T23:30:24+0000
/project/piped-contrib-database/, piped.contrib.database, 0.7.0, Database provider for Piped., 2015-08-07T19:41:48+0000
/project/tryfer/, tryfer, 0.2.2, Twisted Zipkin Tracing Library, 2012-09-24T17:37:20+0000
/project/helga-ignore/, helga-ignore, 0.1.0, A helga plugin to ignore messages from specific user nicks, 2015-07-08T20:23:27+0000
/project/txpool/, txpool, 0.9, A persistent process pool for Twisted, 2015-01-28T01:21:49+0000
/project/wallaby-plugin-couchdb/, wallaby-plugin-couchdb, 0.1.13, This package integrates the couchdb backend into wallaby., 2013-01-31T15:46:34+0000
/project/mantissa/, Mantissa, 0.9.0, A multiprotocol application deployment platform, 2017-09-05T09:06:47+0000
/project/treq-kerberos/, treq-kerberos, 1.2.0, Kerberos auth for Twisted's treq, 2018-07-17T21:39:50+0000
/project/eyefi/, eyefi, 0.2, EyeFi Server Framework, 2012-03-03T22:35:06+0000
/project/smpp-twisted/, smpp.twisted, 0.4, SMPP 3.4 client built on Twisted, 2013-07-26T18:41:19+0000
/project/piped-contrib-zmq/, piped.contrib.zmq, 0.7.0, ZeroMQ processors and providers for Piped., 2015-08-07T19:42:14+0000
/project/yatxmilter/, yatxmilter, 0.1.1, Twisted protocol to handle Milter Connections in libmilter style, 2014-08-04T13:28:39+0000
/project/txssmi/, txssmi, 0.3.0, Twisted library for Truteq's SSMI protocol, 2014-08-20T12:28:08+0000
/project/autobahntestsuite/, autobahntestsuite, 0.8.2, AutobahnTestSuite - WebSocket/WAMP protocol implementation test suite., 2021-03-16T23:52:15+0000
/project/txaioetcd/, txaioetcd, 18.10.2, Asynchronous client library for etcd3, 2018-10-11T18:04:02+0000
/project/qbuf/, qbuf, 0.9.4, Simple string buffering for python written in C., 2010-08-14T21:29:05+0000
/project/errormator-client/, errormator-client, 0.5.15, Client for Errormator reporting -  supporting WSGI and django  (http://errormator.com), 2013-11-16T12:52:59+0000
/project/anydex/, anydex, 0.1.0, The Universal Decentralized Exchange, 2019-06-17T14:37:11+0000
/project/swftp/, swftp, 1.0.7, SwFTP is an FTP and SFTP interface for Openstack Object
Storage (swift), 2013-07-03T15:23:38+0000
/project/actr6-jni/, actr6_jni, 1.4.1, A high level library wrapper for the ACT-R JNI using Twisted., 2014-03-31T20:41:55+0000
/project/decmoc/, decmoc, 20130206, Declarative mocking, 2013-02-06T15:30:48+0000
/project/qt-reactor/, qt-reactor, 0.6, Twisted Qt Integration for Qt4 and Qt5 using qtpy, 2018-10-29T21:41:02+0000
/project/txdpce/, txdpce, 0.1.2, A Twisted class for parallel execution of functions performing the same task, returning the result from the one that finishes first., 2011-07-12T12:27:31+0000
/project/vertex/, Vertex, 0.3.1, Divmod Vertex is the first implementation of the Q2Q protocol, which is a peer-to-peer communication protocol for establishing stream-based communication between named endpoints., 2015-03-05T04:30:47+0000
/project/txkeystone/, txKeystone, 0.1.3, A Twisted Agent implementation which authenticates to Keystone and uses the Keystone auth credentials to authenticate against requested urls., 2013-10-31T00:55:41+0000
/project/txonedrive/, txOneDrive, 15.10.0, Obsolete twisted-based python async interface for old MS OneDrive API, 2015-10-25T05:48:37+0000
/project/helga-hipster/, helga-hipster, 0.1.2, Helga plugin to get hipster music recommendations, 2014-10-09T16:23:13+0000
/project/yell/, yell, 0.3.2, User notification library with pluggable backends. Compatible with popular frameworks such as Django, Flask, Celery., 2013-02-26T15:21:28+0000
/project/helga-xkcd/, helga-xkcd, 0.1.2, A helga plugin to fetch xkcd comics, 2017-05-01T02:00:38+0000
/project/txserviceregistry/, txServiceRegistry, 0.2.0, A Twisted Python client for Rackspace Service Registry., 2013-03-28T21:03:11+0000
/project/kotori/, kotori, 0.26.6, Kotori is a data acquisition, processing and graphing toolkit for humans, 2021-02-17T14:53:25+0000
/project/orchstr8/, orchstr8, 0.0.5, Services orchestration and testing library for torba and electrumx based projects., 2018-10-09T04:23:32+0000
/project/txsocksx/, txsocksx, 1.15.0.2, Twisted client endpoints for SOCKS{4,4a,5}, 2015-08-03T17:20:51+0000
/project/helga-stfu/, helga-stfu, 0.1.0, A helga plugin that can be used to store responses that can be returned from a question, 2015-03-04T18:59:07+0000
/project/epsilon/, epsilon, 0.8.0, A set of utility modules used by Divmod projects, 2020-08-05T12:10:38+0000
/project/txredis/, txredis, 2.4, Python/Twisted client for Redis key-value store, 2016-02-05T00:32:28+0000
/project/txdlo/, txdlo, 0.1.8, A Twisted class for observing a set of deferreds., 2013-12-31T02:43:14+0000
/project/vcsserver/, vcsserver, 0.3.1, Library for easy and fast creation of an ssh demon for popular VCSs (Mercurial and Git), 2014-02-11T10:54:23+0000
/project/twisted-theseus/, twisted-theseus, 0.14.1.3, a Deferred-aware profiler for Twisted, 2015-10-29T19:50:47+0000
/project/wsjsonrpc/, wsjsonrpc, 0.0.2, JSON-RPC 2.0 over websockets, 2021-03-25T02:18:25+0000
/project/fmn-sse/, fmn-sse, 0.2.1, Real time feed for fedmsg, 2017-01-12T18:47:43+0000
/project/smpp-twisted3/, smpp.twisted3, 0.6, SMPP 3.4 client built on Twisted / Python3, 2020-10-21T09:16:59+0000
/project/mitm6/, mitm6, 0.2.2, Pwning IPv4 via IPv6, 2019-03-31T21:16:30+0000
/project/npyscreenreactor/, npyscreenreactor, 1.3, Twisted reactor for npyscreen, 2016-01-30T02:38:00+0000
/project/tendril-framework/, tendril-framework, 0.1.0, An open-ended framework for handling information, to aid development, management, and production cycles, 2017-03-19T20:05:22+0000
/project/pycri-spotify/, pycri-spotify, 0.1, Spotify plugin for pycri, 2011-03-25T11:24:45+0000
/project/bfabio-pymodbus/, bfabio.pymodbus, 1.3.1, A fully featured modbus protocol stack in python, 2017-11-20T15:19:12+0000
/project/pyamf2/, PyAMF2, 0.6.1.5, AMF support for Python, 2014-09-13T21:20:28+0000
/project/sine/, Sine, 0.3.0, Divmod Sine is a standards-based voice-over-IP application server,        built as an offering for the Mantissa application server platform., 2009-11-29T19:14:08+0000
/project/txmx/, txmx, 0.0.1, MailExchange in Twisted, 2018-07-29T19:20:26+0000
/project/stenographer/, stenographer, 0.1.3, An HTTP interaction recorder for Twisted Web, 2015-08-20T20:01:29+0000
/project/oonibackend/, oonibackend, 1.3.7, Open Observatory of Network Interference Backend, 2019-12-06T08:33:16+0000
/project/pygl2d/, PyGL2D, 0.3.7, A 2D Graphics Library for PyGame and PyOpenGL., 2012-10-19T15:06:11+0000
/project/helga-wiki-whois/, helga-wiki-whois, 0.1.0, A helga command to generate confluence-type URLs for users, 2015-03-04T13:17:05+0000
/project/helga-reviewboard/, helga-reviewboard, 0.2.0, A helga plugin for expanding shortcodes for code reviews on ReviewBoard, 2015-04-06T13:13:15+0000
/project/service-registry/, service-registry, 0.2.0, Python client for Rackspace Service Registry., 2013-03-20T18:57:29+0000
/project/txinvoke/, txinvoke, 0.1.0, Run inline callbacks from Twisted as Invoke tasks, 2015-04-07T06:07:51+0000
/project/helga/, helga, 1.7.13, A full-featured chat bot for Python 2.7 with plugin support, 2019-03-21T18:12:58+0000
/project/txwebutils/, txwebutils, 0.0.1, Utilities for twisted web, 2020-04-30T17:30:53+0000
/project/wallaby-plugin-pdfgenerator/, wallaby-plugin-pdfgenerator, 0.1.18, This package provides a PDF generator for wallaby., 2013-01-25T00:36:10+0000
/project/pylacewing/, pylacewing, 1.0.1, Python Lacewing Library, 2011-12-22T05:40:22+0000
/project/helga-flip/, helga-flip, 0.1.0, Helga plugin to flip words, 2014-08-15T20:41:50+0000
/project/autobahn-rce/, autobahn_rce, 0.6.0.5, AutobahnPython - Optimised and modified for the RoboEarth Cloud Engine., 2013-07-06T15:21:04+0000
/project/helga-oneliner/, helga-oneliner, 0.1.0, A helga match plugin with a large amount of canned responses for a variety of regular expressions., 2015-03-04T16:46:25+0000
/project/txpinky/, txpinky, 0.1.0, Pinky is a multi node distributed replicated in memory cache application., 2015-11-29T19:35:44+0000
/project/purity/, purity, 0.2.4, Purity dynamic patching library for Pure Data in Python., 2009-12-05T17:22:13+0000
/project/txsshadmin/, txsshadmin, 0.2.0, Administrative SSH interface for network services., 2019-11-12T18:20:44+0000
/project/vcssshd/, vcssshd, 0.2.3, Library for easy and fast creation of an ssh demon for popular VCSs (Mercurial and Git), 2013-06-24T07:20:47+0000
/project/sparked/, Sparked, 0.15, Application development framework for interactive installations, 2011-07-04T09:59:51+0000
/project/gdns/, gDNS, 0.1.4, Google DNS-over-HTTPS, 2017-09-18T22:28:54+0000
/project/packetmq/, packetmq, 0.1.5, Packet based networking, 2016-03-06T02:44:07+0000
/project/txlibravatar/, txLibravatar, 1.1, Twisted module for Libravatar, 2011-11-28T23:20:40+0000
/project/nevow/, Nevow, 0.14.5, Web Application Construction Kit, 2019-12-15T11:57:20+0000
/project/dovedns/, dovedns, 1.0.1, DoveDNS is a library for interfacing with Linode DNSManager, using Twisted., 2013-06-05T13:52:12+0000
/project/entropy-store/, entropy-store, 16.1.0, A simple content-addressed immutable object store, with flexible backend support., 2016-02-01T10:27:42+0000
/project/driver2200087/, driver2200087, 0.6.1, Python Package to interface with Radio Shack's 2200087 Multimeter, 2015-08-19T23:11:28+0000
/project/helga-reviews/, helga-reviews, 0.0.6, A helga command to query reviewboard pending reviews targeted at a user, groupor channel (using a channel-to-group mapping)., 2014-10-22T13:49:26+0000
/project/helga-zen/, helga-zen, 0.1.0, The Zen of Python as a helga plugin, 2014-04-06T19:07:02+0000
/project/sphinxcontrib-trio/, sphinxcontrib-trio, 1.1.2, Make Sphinx better at documenting Python functions and methods, 2020-05-04T16:44:35+0000
/project/txrdq/, txRDQ, 0.2.14, A Twisted class for queueing and dispatching jobs in a controlled manner., 2014-01-25T23:12:12+0000
/project/sat/, sat, 0.7.0, Salut à Toi multipurpose and multi frontend XMPP client, 2019-07-24T18:13:28+0000
/project/piqueserver/, piqueserver, 1.0.0, Open-Source server implementation for Ace of Spades, 2019-12-02T01:45:10+0000
/project/er-calvin/, er-calvin, 1.1.1, Calvin is a distributed runtime and development framework for an actor based dataflowprogramming methodology, 2018-08-10T13:43:17+0000
/project/helga-versionone/, helga-versionone, 0.1.10, VersionOne interface for helga chat bot, 2017-01-30T15:13:58+0000
/project/sqlauth/, sqlauth, 0.2.12, Authentication and Authorization via SQL for Autobahn, 2014-12-23T17:32:56+0000
/project/slugathon/, slugathon, 0.1-20120727040741-5027075, Fantasy battle board game, 2012-07-27T04:07:47+0000
/project/nuageux/, nuageux, 0.1, lightweight distributed computing library, 2011-04-29T14:01:20+0000
/project/pyfibot/, pyfibot, 0.9.5, Python IRC bot based on twisted.words.irc, 2015-12-28T17:04:51+0000
/project/clarent/, clarent, 0.1.1, Shared API definitions for an online exercise system, 2014-02-27T16:58:41+0000
/project/helga-pull-requests/, helga-pull-requests, 0.0.5, A helga plugin to quickly link to github pull requests., 2015-04-20T21:11:59+0000
/project/hollowpoint/, hollowpoint, 0.1, Hollowpoint, 2013-06-16T20:54:50+0000
/project/launchdcheckin/, launchdcheckin, 0.13.0.1, launchd checkin for python and twisted, 2013-11-12T07:29:46+0000
/project/otfbot/, otfbot, 1.0.0, a modular IRC-Bot, 2011-04-22T10:56:32+0000
/project/txtorcon/, txtorcon, 20.0.0, Twisted-based Tor controller client, with state-tracking and     configuration abstractions.     https://txtorcon.readthedocs.org     https://github.com/meejah/txtorcon, 2020-04-01T03:41:21+0000
/project/spamfighter/, spamfighter, 0.2.0, Web-service fighting spam and other unsolicited messages, 2009-02-27T09:02:18+0000
/project/vumi-go/, vumi-go, 0.5.0, Vumi Go, 2014-08-19T14:06:31+0000
/project/minitrue/, minitrue, 20130126, Proxy designed to lie., 2013-01-26T14:37:18+0000
/project/hammer/, hammer, 0.1, Hammer is a framework for managing load-balancer configuration, 2012-06-07T17:43:09+0000
/project/txtwitter/, txTwitter, 0.1.6, A Twisted-based client library for Twitter's API., 2017-01-26T14:49:18+0000
/project/bitdust-p2p/, bitdust-p2p, 0.0.3, BitDust is new software framework to build distributed and secure peer-to-peer applications., 2020-09-15T19:26:40+0000
/project/txbugzilla/, txbugzilla, 2.0.0, Twisted API for Bugzilla, 2019-01-22T17:20:47+0000
/project/collective-transcode-daemon/, collective.transcode.daemon, 0.12, Video transcoding daemon, 2012-12-03T16:54:21+0000
/project/piped-contrib-statsd/, piped.contrib.statsd, 0.7.0, StatsD-utilities for Piped., 2015-08-07T19:41:58+0000
/project/qt5reactor/, qt5reactor, 0.6.3, Twisted Qt Integration, 2020-09-10T17:48:37+0000
/project/logalyzer/, logalyzer, 0.4, Web server HTTP access log parsing, filtering, and SQL database storage., 2018-06-12T23:27:14+0000
/project/airi/, airi, 0.1.1, AIRi software package, 2011-04-14T22:47:53+0000
/project/leap-mx/, leap.mx, 0.9.1, An asynchronous, transparently-encrypting remailer for the LEAP platform, 2017-02-16T15:40:15+0000
/project/crossbar/, crossbar, 21.3.1, Crossbar.io multi-protocol (WAMP/WebSocket, REST/HTTP, MQTT) application router for microservices., 2021-03-02T16:01:41+0000
/project/helga-reminders/, helga-reminders, 0.1.1, A helga command for scheduling one time or recurring reminders, 2015-03-04T20:32:07+0000
/project/txstathat/, txStatHat, 0.2.0, Twisted wrapper for StatHat.com, 2012-04-05T11:30:18+0000
/project/txproductpages/, txproductpages, 1.2.0, Twisted API for Red Hat Product Pages, 2019-11-27T19:52:43+0000
