/project/django-janitor/, django-janitor, 0.5.1, django-janitor allows you to use bleach to clean HTML stored in a Model's field., 2017-10-30T23:40:03+0000
/project/lighty-template/, lighty-template, 0.3.4, Simple template engine for python, 2012-06-15T07:10:34+0000
/project/pyratemp/, pyratemp, 0.3.2, Small, simple and powerful template-engine for Python., 2013-09-18T08:00:35+0000
/project/tutormagic/, tutormagic, 0.3.1, Magic to display pythontutor.com from a code cell in the IPython notebook., 2021-03-04T23:13:45+0000
/project/apachecn-cv-zh/, apachecn-cv-zh, 2021.2.18.0, ApacheCN 计算机视觉译文集, 2021-02-18T14:48:45+0000
/project/storm-doc-zh/, storm-doc-zh, 2020.9.21.0, Storm 1.1.0 中文文档, 2020-09-21T04:45:44+0000
/project/omero-figure/, omero-figure, 4.4.0, OMERO figure creation app, 2021-02-25T14:18:45+0000
/project/ipy-table/, ipy_table, 1.15.1, Creates richly formatted tables in a Jypyter Notebook, 2017-08-25T23:41:39+0000
/project/quik/, quik, 0.2.2, A fast and lightweight Python template engine, 2013-09-06T13:57:44+0000
/project/cardify/, cardify, 0.1.0, Cardify - A set of GPLv3+ libraries to deal with carding information., 2016-03-19T17:11:39+0000
/project/llthw-zh/, llthw-zh, 2020.9.21.0, 笨办法学 Linux 中文版, 2020-09-21T04:15:06+0000
/project/django-markdownx/, django-markdownx, 3.0.1, A comprehensive Markdown editor built for Django., 2019-12-28T09:03:17+0000
/project/omero-webtagging-autotag/, omero-webtagging-autotag, 3.1.0, OMERO webtagging autotag app, 2020-01-18T08:44:38+0000
/project/cssutils/, cssutils, 2.2.0, A CSS Cascading Style Sheets library for Python, 2021-03-11T01:12:04+0000
/project/html/, html, 1.16, simple, elegant HTML, XHTML and XML generation, 2011-06-29T09:29:32+0000
/project/markdown-figure-caption/, markdown-figure-caption, 0.0.1, Add <figcaption> elements to your images, 2019-01-27T16:45:52+0000
/project/chemdataextractor-ide/, ChemDataExtractor-IDE, 1.3.2, A toolkit for extracting chemical information from the scientific literature., 2019-11-28T14:09:56+0000
/project/omero-gallery/, omero-gallery, 3.4.0, A Python plugin for OMERO.web, 2021-03-26T10:24:28+0000
/project/penelope/, penelope, 3.1.3.0, Penelope is a multi-tool for creating, editing and converting dictionaries, especially for eReader devices, 2016-09-23T09:27:17+0000
/project/selectq/, selectq, 0.0.6, Non cryptic XML/HTML parsing, 2020-12-15T02:56:21+0000
/project/tns/, tns, 1.0.0, Top News Selectors (tns): Top news parsing from select websites, 2018-02-04T02:03:41+0000
/project/characterentities/, characterentities, 0.1.2, HTML Entities for Python, 2018-09-29T17:20:10+0000
/project/pdfkit-async/, pdfkit-async, 0.7.2, Wkhtmltopdf python wrapper to convert html to pdf using the webkit rendering engine and qt, 2020-05-09T21:02:10+0000
/project/xmlwitch/, xmlwitch, 0.3, xmlwitch offers Pythonic XML generation through context generators, 2016-08-25T20:29:21+0000
/project/async-markdown/, async-markdown, 3.3.4, Asynchronous version of the Markdown package., 2021-04-09T21:29:07+0000
/project/handroll/, handroll, 3.1, A website generator for software artisans, 2016-12-26T15:41:00+0000
/project/markdown-djangostaticimage/, markdown-djangostaticimage, 0.1, Markdown extension: Add static tag to image source, 2017-10-24T07:32:11+0000
/project/pinyin-markdown/, pinyin_markdown, 0.8.2, Type Chinese pinyin with tone numbers in Markdown. Get accented pinyin., 2017-02-09T23:30:19+0000
/project/druid/, Druid, 0.2.1, Doing Magic things with Tumulus, 2014-08-11T13:11:21+0000
/project/mdx-outline/, mdx_outline, 1.3.0, Python-Markdown extension to wrap the document logical sections (as implied by h1-h6 headings), 2017-05-31T23:37:22+0000
/project/fasttext-doc-zh/, fasttext-doc-zh, 2020.9.21.0, FastText 中文文档, 2020-09-21T03:52:29+0000
/project/bamanro-django-markdownx/, bamanro-django-markdownx, 2.0.29, A comprehensive Markdown editor built for Django., 2019-06-25T13:44:37+0000
/project/beautifulsoup4/, beautifulsoup4, 4.9.3, Screen-scraping library, 2020-10-03T15:37:19+0000
/project/django-html-sanitizer/, django-html_sanitizer, 0.1.5, Provides a set of HTML cleaning utilities for django models, forms and templates., 2016-01-13T01:28:30+0000
/project/topicaxis-opengraph/, topicaxis-opengraph, 0.5, A module to parse the Open Graph Protocol, 2019-08-10T18:49:34+0000
/project/djingles/, djingles, 0.1.13, Set of django utilities, 2020-09-15T13:28:41+0000
/project/markdown-swiss/, markdown-swiss, 0.0.1, This is an extension to Python-Markdown which provides a variety of functions for running python code, 2018-02-21T10:26:11+0000
/project/ipython-tempmagic/, ipython-tempmagic, 0.0.1, Temporary file magic IPython, 2018-02-08T19:52:34+0000
/project/tlang-tdoc/, tlang-tdoc, 0.0.1, Tree Document Format, 2020-03-03T03:03:40+0000
/project/lachesis/, lachesis, 0.0.3.0, lachesis automates the segmentation of a transcript into closed captions, 2017-01-26T21:14:42+0000
/project/ibooker-plain-dealer/, ibooker-plain-dealer, 2020.11.3.0, iBooker 布客老实人报, 2020-11-03T02:59:18+0000
/project/hoedown/, hoedown, 0.3.0, The Python binding for Hoedown, a markdown parsing library., 2018-10-11T12:43:01+0000
/project/options-scraper/, options-scraper, 0.9.91, NASDAQ Options chain scraper for https://old.nasdaq.com, 2020-06-20T07:02:27+0000
/project/rst2html5/, rst2html5, 2.0, Generates (X)HTML5 documents from standalone reStructuredText sources, 2021-04-24T02:51:49+0000
/project/fude/, fude, 1.0.1, Library for rendering HTML in Python, 2012-12-16T14:15:44+0000
/project/mdtree/, mdtree, 0.7, Convert markdown to html with TOC(table of contents), 2019-01-07T04:07:57+0000
/project/htmldom/, htmldom, 2.0, HTML parser which can be used for web-scraping applications, 2012-06-28T13:04:45+0000
/project/matplotlib-doc-zh/, matplotlib-doc-zh, 2020.9.21.0, Matplotlib 用户指南, 2020-09-21T04:15:38+0000
/project/tagcap/, tagcap, 0.1.8, A simple and efficient HTML/XML parsing library written in pure Python, 2020-07-08T22:47:33+0000
/project/iloveruby-zh/, iloveruby-zh, 2020.9.21.0, 我爱 Ruby, 2020-09-21T04:09:18+0000
/project/ogp/, ogp, 0.9.1, A module to parse the Open Graph Protocol, 2012-08-01T15:29:36+0000
/project/excerpt-html/, excerpt-html, 0.1, Extract summary from HTML text, 2021-02-06T00:19:09+0000
/project/prat-misaka/, prat-misaka, 1.1.5, Prat fork of Frank Smit's Python binding for Sundown, a markdown parsing library., 2014-01-14T20:23:56+0000
/project/quoter/, quoter, 1.6.8, Powerful way to construct text, HTML, and XML, plus a kick-ass join, 2017-05-15T23:56:30+0000
/project/lxml/, lxml, 4.6.3, Powerful and Pythonic XML processing library combining libxml2/libxslt with the ElementTree API., 2021-03-21T18:09:35+0000
/project/lightgallery/, lightgallery, 0.5, Markdown extension to wrap images in lightbox/lightgallery, 2021-02-15T09:47:34+0000
/project/citelementtree/, citelementtree, 1.2.7, ElementTree - a light-weight XML object model for Python., 2015-03-04T03:28:02+0000
/project/curlwrapper/, curlwrapper, 0.1.110, curlwrapper (browser interface for curl), 2011-11-08T03:48:09+0000
/project/datastruct/, datastruct, 0.3, A small but useful package to load, validate and use typed data structures, including configuration files., 2020-05-16T03:58:23+0000
/project/dirty/, dirty, 1.0.2, A dirty and simple HTML/XML template engine for Python 3., 2009-05-19T02:44:48+0000
/project/numba-doc-zh/, numba-doc-zh, 2020.9.21.0, Numba 0.44 中文文档, 2020-09-21T04:32:29+0000
/project/osrframework/, osrframework, 0.20.4, OSRFramework - A set of AGPLv3+ OSINT tools developed by i3visio analysts for online research., 2021-02-11T13:29:33+0000
/project/woob/, woob, 3.0, Woob, Web Outside Of Browsers, 2021-04-11T12:52:02+0000
/project/cocktail/, cocktail, 1.8.3, A tasty mix of python web development utilities., 2016-03-17T11:55:11+0000
/project/impatient-js-zh/, impatient-js-zh, 2020.9.21.0, 写给不耐烦程序员的 JavaScript, 2020-09-21T04:09:34+0000
/project/plumage/, plumage, 2.4.0, Clean and tidy theme for Pelican., 2020-12-06T17:42:32+0000
/project/livehtml/, livehtml, 0.0.1, Simple development server for writing an html pages, 2012-06-27T20:35:09+0000
/project/bdt-sitemap/, bdt_sitemap, 0.9, Sitemap.xml generator for a local copy of a website, 2014-08-13T21:36:28+0000
/project/frogstarb/, FrogstarB, 0.1.0, Simple tool to post to Blogger.com from the command line., 2011-01-06T14:12:27+0000
/project/pyorg/, pyorg, 0.1.8, The org-mode parser fro python, 2017-01-22T14:35:45+0000
/project/osrframework-server/, osrframework-server, 0.18.0a4, OSRFramework Server - A HTTP server writen in Python to interact with OSRFramework., 2017-12-03T18:32:46+0000
/project/pypi-simple/, pypi-simple, 0.8.0, PyPI Simple Repository API client library, 2020-12-13T19:47:19+0000
/project/elementtreefactory/, ElementTreeFactory, 1.0, A Genshi-inspired framework for easy use of ElementTree, 2011-11-27T19:51:42+0000
/project/pdfgen/, pdfgen, 1.0.5, Pyppeteer-based async python wrapper to convert html to pdf, 2020-08-12T18:11:24+0000
/project/omero-mapr/, omero-mapr, 0.4.1, MAPR is a Python plugin for OMERO.web, 2020-10-02T12:53:22+0000
/project/markupsafe-slow/, MarkupSafe-slow, 1.0, Implements a XML/HTML/XHTML Markup safe string for Python, 2017-05-03T09:40:08+0000
/project/django-wysiwyg/, django-wysiwyg, 0.8.0, django-wysiwyg, 2016-08-17T16:17:05+0000
/project/mf2py/, mf2py, 1.1.2, Python Microformats2 parser, 2018-08-08T23:41:52+0000
/project/html-diff/, html-diff, 0.3.0, HTML-formatted diff'ing of HTML snippets, 2020-07-12T10:06:46+0000
/project/photoweb/, photoweb, 0.4.1, Templated HTML galleries based on in-photo metadata, 2013-05-13T06:14:08+0000
/project/inlinestyler/, inlinestyler, 0.2.5, Inlines external CSS into HTML elements., 2018-03-19T20:23:00+0000
/project/django-quilljs/, django-quilljs, 0.0.2, Easily use Quill.js in your django admin., 2019-02-09T20:43:56+0000
/project/djungle-html5shiv/, djungle-html5shiv, 0.0.0, html5shiv as Django app., 2012-07-14T13:12:00+0000
/project/misaka/, misaka, 2.1.1, A CFFI binding for Hoedown, a markdown parsing library., 2018-12-02T20:29:26+0000
/project/xmltool/, xmltool, 1.0.0, Tool to manipulate XML files, 2020-07-21T15:25:39+0000
/project/nlp-pytorch-zh/, nlp-pytorch-zh, 2021.1.4.0, PyTorch 自然语言处理, 2021-01-04T09:37:07+0000
/project/collective-soupstrainer/, collective.soupstrainer, 2.2, Clean up HTML using BeautifulSoup and filter rules., 2021-03-25T08:50:57+0000
/project/noat/, noat, 1.0.2, Non-overlapping annotation HTML tag insertion., 2014-06-26T20:44:47+0000
/project/basic-web-scraper/, basic-web-scraper, 0.13.7, Basic Web Scraper made with selenium and bs4, 2020-11-16T00:05:49+0000
/project/markdown-bugzilla-extension/, Markdown-Bugzilla-Extension, 0.1, Bugzilla extension for Markdown., 2015-11-26T20:06:05+0000
/project/betterimageextension/, BetterImageExtension, 0.0.1, Python-Markdown extension to add additional image syntax eg print and web sizes from a single image, 2015-03-10T18:16:17+0000
/project/markdown-extra/, markdown-extra, 1.0.1, Set of extensions for markdown, 2019-03-14T14:57:00+0000
/project/markdownsuperscript/, MarkdownSuperscript, 2.1.1, Python-Markdown extension to allow for superscript text., 2018-10-09T23:32:20+0000
/project/sphinx-dehead/, sphinx-dehead, 0.2.1, A script to extract the main div section element from HTML, 2014-07-13T01:37:23+0000
/project/namethatcolor/, NameThatColor, 1.0.3, Find human-readable color names for hex values, 2010-09-25T18:37:55+0000
/project/profile-readme/, profile-readme, 0.1.2, A CLI tool for generating a GitHub profile README using the Jinja2 template engine., 2020-12-10T21:58:32+0000
/project/markmin/, markmin, 20210313.2, A better markup language, 2021-03-13T16:14:21+0000
/project/kbdextension/, kbdextension, 1.0.1, Extension for python-markdown that adds markdown syntax for the KBD HTML tag., 2020-06-09T03:07:18+0000
/project/highscalability-examples-zh/, highscalability-examples-zh, 2020.9.21.0, HighScalability 中文示例, 2020-09-21T04:04:08+0000
/project/omero-iviewer/, omero-iviewer, 0.10.2, A Python plugin for OMERO.web, 2021-02-17T13:06:00+0000
/project/wu/, wu, 0.0.0, Writeup is a markup language that transforms to HTML., 2019-05-24T14:49:17+0000
/project/beginnersbook-zh/, beginnersbook-zh, 2020.9.21.0, BeginnersBook 中文系列教程, 2020-09-21T03:45:23+0000
/project/htmlpretty/, htmlpretty, 0.1.0, , 2011-12-19T21:50:33+0000
/project/flask-reveal/, flask-reveal, 0.4.4, Make reveal.js presentations with Flask, 2018-03-28T13:48:43+0000
/project/assetmingle/, assetmingle, 0.1.2, Convert image and file references in HTML and CSS files to data URLs, 2013-03-20T13:19:28+0000
/project/slack-backup/, slack-backup, 0.8, Make copy of slack converstaions, 2019-01-05T16:45:44+0000
/project/bud-nospam/, bud.nospam, 1.0.1, ROT 13 encrypt text to prevent spam, 2009-02-24T20:53:23+0000
/project/zeppelin-doc-zh/, zeppelin-doc-zh, 2020.9.21.0, Zeppelin 0.7.2 中文文档, 2020-09-21T04:54:00+0000
/project/render-engine/, render-engine, 2021.3.0, Static Page Generation with Flask-like simplicity and flair ✨, 2021-03-18T00:10:52+0000
/project/pyctpp2/, pyctpp2, 0.12.2, Python interface to CTPP2 library., 2012-01-24T14:36:41+0000
/project/latex2markdown/, latex2markdown, 0.2.1, An AMS-LaTeX compatible converter that maps a subset of LaTeX to Markdown/MathJaX., 2012-04-03T03:15:02+0000
/project/webtranslate/, webtranslate, 0.1, Translate html (lxml based) using google translate api, 2012-06-25T04:16:14+0000
/project/inscriptis/, inscriptis, 1.1.2, inscriptis - HTML to text converter., 2021-01-04T12:52:28+0000
/project/lektor-responsive-image/, lektor-responsive-image, 0.1a1, Lektor plugin to help with multi-resolution responsive images, 2021-02-13T23:56:43+0000
/project/renoir/, renoir, 1.3.2, A templating engine designed with simplicity in mind, 2021-03-08T20:57:42+0000
/project/dom-query/, dom-query, 0.0.4, CSS selector syntax for python minidom and compatible DOM implementations, 2020-02-19T18:46:08+0000
/project/journalist/, journalist, 0.0.3, App to write journal digitally, 2018-01-03T15:16:05+0000
/project/omero-webtagging-tagsearch/, omero-webtagging-tagsearch, 3.1.0, OMERO webtagging tagsearch app, 2020-01-18T08:46:42+0000
/project/153957-theme/, 153957-theme, 1.0.0, Theme for sigal generated photo albums, 2017-09-06T19:52:13+0000
/project/ds-ipynb-zh/, ds-ipynb-zh, 2020.11.4.0, 数据科学 IPython 笔记本, 2020-11-04T02:42:21+0000
/project/log-everywhere/, log-everywhere, 0.0.1, Logging package to enable writing all program information with corresponding datetime to multiple, DIFFERENT files safely when running multiple threads (multi-threading)., 2021-01-14T08:20:05+0000
/project/django-ember-index/, django-ember-index, 0.7.0, A Django app to serve Ember index files., 2015-06-04T21:54:39+0000
/project/flamingo/, flamingo, 1.6, Flamingo is a python3-based, pelican-inspired static site generator, 2021-04-09T15:00:02+0000
/project/ansi2html/, ansi2html, 1.6.0, , 2020-11-17T14:24:40+0000
/project/html-json-forms/, html-json-forms, 1.1.1, Implementation of the HTML JSON Forms spec for use with the Django REST Framework., 2020-01-15T00:57:48+0000
/project/jinja2compact/, jinja2compact, 1.1, Reduce whitespace in jinja2 templates at compile time, 2015-11-05T22:14:07+0000
/project/ipython-beautifulsoup/, ipython-beautifulsoup, 0.3, Custom rendering of beautifulsoup objects       in IPython notebook and qtconsole, 2014-08-26T03:57:18+0000
/project/zptkit/, ZPTKit, 0.4.1, Tool to use Zope Page Templates with Webware or Paste, 2006-06-20T22:20:35+0000
/project/lxmlmeld/, lxmlmeld, 0.5, Meld3-like templating using lxml, 2018-06-09T16:15:33+0000
/project/static-hy/, static.hy, 0.0.8, A static website generator written in Hy., 2017-08-09T18:19:44+0000
/project/umarkdown/, umarkdown, 1.2.0, Python wrapper of Markdown using CMark., 2021-03-27T14:33:45+0000
/project/airflowdoczh/, AirflowDocZh, 2020.9.20.0, Airflow 中文文档, 2020-09-20T13:13:52+0000
/project/emeraldtree/, emeraldtree, 0.10.0, EmeraldTree - a light-weight XML object model for Python., 2015-06-09T23:20:22+0000
/project/djungle-sizzle/, djungle-sizzle, 0.0.0, Sizzle as Django app., 2012-07-14T15:26:30+0000
/project/pleaseshare/, pleaseshare, 0.5, A file-sharing web application, 2015-02-06T11:49:32+0000
/project/j2tools/, j2tools, 2019.3, Useful tools for jinja2 template processor., 2019-03-11T20:41:00+0000
/project/djmako/, djmako, 0.4, mako template support for Django >=1.2, 2012-04-04T01:20:28+0000
/project/py3-aeneas/, py3-aeneas, 1.1.0, py3-aeneas is a fork of aeneas, 2020-05-03T17:25:40+0000
/project/advancedhtmlparser/, AdvancedHTMLParser, 9.0.1, A Powerful HTML Parser/Scraper/Validator/Formatter that constructs a modifiable, searchable DOM tree, and includes many standard JS DOM functions (getElementsBy*, appendChild, etc) and additional methods, 2020-02-12T22:10:03+0000
/project/pythonspot-zh/, pythonspot-zh, 2020.9.21.0, PythonSpot 中文系列教程, 2020-09-21T04:40:36+0000
/project/apachecn-algo-zh/, apachecn-algo-zh, 2021.1.7.0, ApacheCN 数据结构与算法译文集, 2021-01-07T15:59:10+0000
/project/apachecn-ml-zh/, apachecn-ml-zh, 2021.3.7.0, ApacheCN 机器学习译文集, 2021-03-07T11:19:25+0000
/project/data8-textbook-zh/, data8-textbook-zh, 2020.9.21.0, UCB Data8 计算与推断思维, 2020-09-21T02:54:33+0000
/project/tinyhtml/, tinyhtml, 1.1.0, A tiny library to safely render compact HTML5 from Python expressions., 2020-11-20T16:00:39+0000
/project/deansi/, deansi, 1.2, ANSI codes to HTML converter, 2016-01-08T13:29:15+0000
/project/documint/, Documint, 16.4.0, , 2016-04-07T19:32:03+0000
/project/mdx-figcaption-ng/, mdx_figcaption_ng, 0.1, Extension for Python-Markdown to parse images with captions inside a figure element., 2018-03-12T13:47:25+0000
/project/scripttranscluder/, ScriptTranscluder, 0.2, Transclude content via <script> tags, 2009-02-10T21:45:51+0000
/project/webstring/, webstring, 0.5, Template engine that uses Python as the template language, 2007-01-04T21:25:29+0000
/project/html5tidy/, html5tidy, 1.0, Simple wrapper around html5lib & lxml.etree to "tidy" html in the wild to well-formed xml/html, 2012-04-27T12:56:55+0000
/project/debmans/, debmans, 1.0.0, Extract and render manuals from Debian packages, 2016-11-22T04:44:19+0000
/project/overload/, overload, 1.1, Simple overloading of methods and functions through an @overload decorator, 2011-05-05T08:51:04+0000
/project/scrapy-doc-zh/, scrapy-doc-zh, 2020.9.21.0, Scrapy 1.6 中文文档, 2020-09-21T04:41:05+0000
/project/gitlab-doc-zh/, gitlab-doc-zh, 2020.9.21.0, Gitlab 中文文档, 2020-09-21T03:56:27+0000
/project/pyhaml/, PyHAML, 1.2.1, Pythonic implementation of HAML, cross compiling to Mako template syntax., 2019-07-29T01:20:55+0000
/project/django-htmlmin-ajax/, django-htmlmin-ajax, 0.11.0, HTML minifier for Python frameworks (not only Django, despite the name)., 2020-12-20T18:23:47+0000
/project/interstat/, interstat, 0.2.2, An HTML formatter for IRC log files, 2015-07-16T22:17:44+0000
/project/html-processor/, html-processor, 0.0.5, Package that provides a set of classes around BeautifulSoup for easy HTML modification., 2020-04-11T04:30:51+0000
/project/take/, take, 0.2.0, A DSL for extracting data from a web page., 2015-04-15T08:19:23+0000
/project/htmlminifier/, HTMLMinifier, 0.1.1, A simple HTML5 minifier written in Python., 2014-02-28T09:54:04+0000
/project/soupmatchers/, soupmatchers, 0.4, Matchers for checking parts of a HTML parse tree, 2018-05-18T19:08:59+0000
/project/kibana-doc-zh/, kibana-doc-zh, 2020.9.21.0, Kibana 5.2 中文文档, 2020-09-21T04:13:48+0000
/project/soy/, soy, 2012-12-21-p2, Client- and server-side templating system for JavaScript, Java and Python., 2014-04-05T07:28:16+0000
/project/django-mailcss/, django-mailcss, 0.1.0, A Django app useful for inlining CSS (primarily for e-mails), 2017-05-22T10:05:47+0000
/project/elstir/, elstir, 0.0.1, Project documentation with Markdown., 2020-12-23T00:20:50+0000
/project/drf-timestamp-pagination/, drf-timestamp-pagination, 0.1, DRF Pagination to work with Timestamp Paginator., 2015-03-12T14:25:53+0000
/project/markdownsubscript/, MarkdownSubscript, 2.1.1, Python-Markdown extension to allow for subscript text., 2018-10-10T00:08:23+0000
/project/gtw/, GTW, 3.7, A werkzeug-based framework for RESTful web applications, 2020-04-28T11:01:49+0000
/project/numpy-display/, numpy_display, 1.2.0, Formats numpy matrices in an IPython Notebook, 2014-06-11T16:45:11+0000
/project/pymdown-extensions/, pymdown-extensions, 8.1.1, Extension pack for Python Markdown., 2021-01-26T01:43:08+0000
/project/seaborn-doc-zh/, seaborn-doc-zh, 2020.9.21.0, seaborn 0.9 中文文档, 2020-09-21T04:41:30+0000
/project/cloud-fancyindex/, cloud-fancyindex, 0.0.1, Generates indexes for cloud buckets from NGINX Fancyindex themes, 2020-03-02T03:57:53+0000
/project/mdx-unimoji/, mdx_unimoji, 1.0, Python-Markdown extension that replaces common smileys with their Unicode emoji emoticons. ;), 2014-12-31T22:12:35+0000
/project/djungle-backbone/, djungle-backbone, 0.0.0, Backbone.js as Django app., 2012-07-14T12:33:15+0000
/project/djungle-d3/, djungle-d3, 0.0.1, D3.js as Django app., 2012-07-14T12:22:18+0000
/project/mkdocs-traefiklabs-test/, mkdocs-traefiklabs-test, 100.0.5, A Traefik Labs branded Material Design theme for MkDocs, 2021-01-08T10:46:20+0000
/project/twiddler/, twiddler, 0.9.1, A simple but flexible templating system for dynamically generating textual output., 2008-07-24T23:23:14+0000
/project/it-ebooks-blog/, it-ebooks-blog, 2021.4.15.0, 计算机开放电子书归档, 2021-04-15T02:28:17+0000
/project/pymdown-include/, pymdown-include, 0.0.1, Include..., 2020-03-15T23:35:22+0000
/project/richtypo/, richtypo, 0.2.3, The only web typograph that don't make a mess out of your text. Russian and English supported., 2017-02-27T17:15:11+0000
/project/omero-webtest/, omero-webtest, 0.4.0, A Python plugin for OMERO.web, 2020-01-13T13:58:34+0000
/project/clearsilver/, clearsilver, 0.10.1, High performance HTML Template System, 2005-10-20T20:04:39+0000
/project/markdown-del-ins/, markdown-del-ins, 1.0.0, Markdown extension to support the <del> and <ins> tags, 2020-01-09T10:19:31+0000
/project/five-pt/, five.pt, 3.0, DEPRECATED: Five bridges and patches to use Chameleon with Zope., 2017-11-30T07:58:45+0000
/project/hap/, hap, 1.3.2, A simple HTML scraping tool, 2018-11-11T21:03:27+0000
/project/beautifulsoup/, BeautifulSoup, 3.2.2, Screen-scraping library, 2019-10-05T11:28:41+0000
/project/hailstorm/, hailstorm, 1.0.0, A Python templating library in the style of Jinja2 and Django templates featuring the full power of Python in the expressions that can be embedded in the template files. Hailstorm was extracted from the templating code that is part of Tornado Web Server framework published by Facebook., 2013-02-24T14:47:49+0000
/project/latex2mathml/, latex2mathml, 2.16.5, Pure Python library for LaTeX to MathML conversion, 2021-03-20T13:07:18+0000
/project/omero-weberror/, omero-weberror, 0.4.0, A Python plugin for OMERO.web, 2020-01-13T13:33:10+0000
/project/gumbo/, gumbo, 0.10.0, Python bindings for Gumbo HTML parser, 2015-05-01T02:52:48+0000
/project/ll-xist/, ll-xist, 5.65, Extensible HTML/XML generator, cross-platform templating language, Oracle utilities and various other tools, 2021-01-13T11:06:10+0000
/project/ghmarkdown/, ghmarkdown, 2.0.2, ghmarkdown is the complete command-line             tool for GitHub-flavored markdown, 2017-11-23T21:28:33+0000
/project/ntu-hsuantienlin-ml/, ntu-hsuantienlin-ml, 2020.9.21.0, 台湾大学林轩田机器学习笔记, 2020-09-21T04:29:29+0000
/project/piculet/, piculet, 1.0.1, XML/HTML scraper using XPath queries., 2019-02-07T12:07:34+0000
/project/collective-tinymceplugins-embedly/, collective.tinymceplugins.embedly, 1.0.2, Integration of the Embedly TinyMCE plugin with Plone, 2016-11-05T18:31:51+0000
/project/os-sys-php/, os-sys-php, 2019.10.13, a big lib with many usefull tools and it are not only os and sys tools..., 2019-10-14T04:22:05+0000
/project/mkpatcher/, mkpatcher, 1.0.2, Python-Markdown extension allowing arbitrary scripts to modify MkDocs input files, 2020-04-26T19:21:04+0000
/project/hc/, hc, 0.1.1, Holiday converter tool, 2017-06-04T14:28:19+0000
/project/sprout/, Sprout, 1.1.1, Common Python library which contains reusable components, developed at Infrae., 2013-05-23T09:45:42+0000
/project/publicstatic/, publicstatic, 0.7.8.4, Yet another static website builder. A good one., 2014-04-07T13:03:44+0000
/project/chcss/, chcss, 0.0.1, CSS naming hierarchy enforcer, 2021-01-31T06:14:00+0000
/project/djungle-underscore/, djungle-underscore, 0.0.1, Underscore.js as Django app., 2012-07-14T15:35:39+0000
/project/yatl/, yatl, 20210326.1, Yet Another Template Language, 2021-03-27T15:32:36+0000
/project/fiduswriter/, fiduswriter, 3.9.21, A semantic wordprocessor for academic purposes, 2021-04-18T02:23:50+0000
/project/utf8-escape/, utf8-escape, 1.4, , 2017-11-27T18:34:21+0000
/project/html5tidy/, html5tidy, 1.0, Simple wrapper around html5lib & lxml.etree to "tidy" html in the wild to well-formed xml/html, 2012-04-27T12:56:55+0000
/project/debmans/, debmans, 1.0.0, Extract and render manuals from Debian packages, 2016-11-22T04:44:19+0000
/project/overload/, overload, 1.1, Simple overloading of methods and functions through an @overload decorator, 2011-05-05T08:51:04+0000
/project/pytidylib6/, pytidylib6, 0.2.2, Python wrapper for HTML Tidy (tidylib), compatible with Python 2 and 3, 2013-12-09T19:45:53+0000
/project/sneact/, sneact, 0.1.1, Sneact is a python library for building user interfaces, 2020-12-02T00:16:15+0000
/project/wq/, wq, 1.2.1, A modular framework for citizen science field data collection via offline-capable mobile web apps., 2020-09-02T08:14:40+0000
/project/sicp-js-zh/, sicp-js-zh, 2020.9.21.0, NUS CS1101s SICP JavaScript 描述, 2020-09-21T04:41:59+0000
