/project/django-haml/, django_haml, 1.0, A HAML pre-processor for Django 1.3 and Django 1.4, 2012-07-25T05:21:14+0000
/project/tlscanary/, tlscanary, 4.0.0, TLS/SSL Test Suite for Mozilla Firefox, 2020-02-18T20:56:15+0000
/project/lc-py/, lc-py, 2.0.1, Lowercase values for Python!, 2019-12-03T02:38:30+0000
/project/line-formater/, line-formater, 1.1.0, A collection of line text formaters, 2018-09-07T09:07:17+0000
/project/underscorex/, UnderscoreX, 0.0.1r001a-yusut-bozlon, DecoratorClass used to parse **Kargs and handle Warning and exception thru Missing Attribute by adding static Decorator., 2012-09-18T05:00:50+0000
/project/sqlalchemy-paradox/, sqlalchemy-paradox, 0.2.0, A SQLAlchemy dialect for Borland / Corel Paradox flat-file databases., 2021-03-10T18:57:36+0000
/project/chronophore/, chronophore, 0.6.0, Desktop app for tracking sign-ins and sign-outs in a tutoring center., 2016-11-21T20:22:54+0000
/project/daquiri/, daquiri, 0.0.2, DAQuiri = DAQ + UI Generation + Reactivity + Instruments: A simple scientific DAQ framework., 2019-09-10T19:30:46+0000
/project/xint/, xint, 0.0.4, Use Python to create and explor world., 2021-04-12T08:31:15+0000
/project/pyzos/, PyZOS, 0.0.60, Python interface for Zemax OpticStudio COM API (ZOS-API), 2016-02-26T19:49:10+0000
/project/nation-rss-parser/, nation-rss-parser, 0.2.1, , 2019-02-28T14:11:23+0000
/project/signalpy/, SignalPy, 1.0.6, Realtime communication for Python web applications, 2020-10-20T02:15:54+0000
/project/doormouse/, doormouse, 1.1.0, PKI without the PITA., 2016-06-04T15:10:43+0000
/project/win7ools/, win7ools, 0.3.0, Python project that provides programmatic access to the Windows OS, 2014-12-31T14:58:01+0000
/project/calculations/, Calculations, 1.10, To calculate equations and draw diagrams, 2020-08-02T17:47:30+0000
/project/waftools/, waftools, 0.4.13, Handy tools for the WAF meta build environment, 2016-10-19T07:31:27+0000
/project/tkinterx/, tkinterx, 0.0.9, Use tkinter to create a handy GUI tool., 2020-05-30T01:34:40+0000
/project/arpes/, arpes, 2.6.0, Modular data analysis code for angle resolved photoemission spectroscopy (ARPES), 2020-01-21T01:47:27+0000
/project/igpu/, igpu, 0.1.2, A cross-platform module for retrieving information and stats on installed gpus., 2020-04-25T16:45:06+0000
/project/aleat3/, aleat3, 0.2.4.post1, An aleatory syntaxes package. Third generation., 2021-04-13T16:19:46+0000
/project/cappy-python/, CapPy-Python, 0.0.6, Python package for easy window capturing, 2020-09-05T21:27:01+0000
/project/comiccrawler/, comiccrawler, 2020.10.29, An image crawler, including multiple modules and GUI., 2020-10-29T05:05:49+0000
/project/vimeo-dl/, vimeo_dl, 1.0, Retrieve Vimeo content and metadata, 2016-08-10T13:14:36+0000
/project/pybingwallpaper/, PyBingWallpaper, 1.5.6, A simple Bing.com wallpaper downloader, 2019-05-01T04:49:32+0000
/project/irori/, irori, 1.0.0, general purpose built tool, 2019-02-02T08:36:51+0000
/project/pybrood/, pybrood, 0.9.2, Broodwar API binding, 2017-06-16T20:28:59+0000
/project/maid/, maid, 0.1.12, A package manager written in Python 3.7, 2019-01-09T10:57:22+0000
/project/pydf2json/, pydf2json, 2.3.4.post6, PDF analysis. Convert contents of PDF to a JSON-style python dictionary., 2019-12-16T20:07:49+0000
/project/srim-srout/, srim_srout, 0.1.2, Tools for SRIM SR output, 2016-02-22T12:11:29+0000
/project/pycomm/, pycomm, 1.0.8, A PLC communication library for Python, 2015-11-01T16:20:56+0000
/project/node-vm2/, node-vm2, 0.3.7, A binding to Node.js + vm2, helps you execute JavaScript safely., 2020-03-23T14:39:27+0000
/project/pwbs/, pwbs, 0.5.0.dev2, PWBS is Build System for easy automation process., 2019-06-19T21:49:47+0000
/project/pyusb/, pyusb, 1.1.1, Python USB access module, 2021-01-20T06:22:11+0000
/project/eccw/, eccw, 1.1.0.post1, Exact Critical Coulomb Wedge : tools to compute and display the exact solution of any parameter of Critical Coulomb Wedge, 2019-10-08T15:11:57+0000
/project/pyjquery/, PyjQuery, 3.5.1.1, The Write Less, Do More, JavaScript Library for DicksonUI, 2020-10-19T02:05:33+0000
/project/sapy-script/, sapy-script, 1.0.1, Library to manipulate SAP by script, 2018-07-31T11:21:27+0000
/project/pyspectator-tornado/, pyspectator_tornado, 1.1.2, pyspectator_tornado is a web-monitoring tool ported onTornado with pyspectator as a main monitoring module., 2017-04-14T21:52:28+0000
/project/projectsetup/, ProjectSetup, 0.1.1, describe your project, 2018-01-18T21:57:14+0000
/project/edlm/, edlm, 0.1.9, , 2018-02-23T17:35:18+0000
/project/seg2py/, SEG2Py, 0.0.4, SEG2Py - a Python 3 module that works around the ObsPy framework offering a flexible and easy way to visualize SEG2 seismic sections., 2015-10-04T23:51:24+0000
/project/save-thread-result/, save-thread-result, 0.0.6, Simple subclass wrapper around `threading.Thread` to get the return value from a thread in python (from `threading` built-in module in Python Standard library). Exact same interface for creating an instance of this threading sublcass as `threading.Thread`!, 2021-02-08T00:27:52+0000
/project/pywinpath/, pywinpath, 2016.5.3b3, A command-line utility for MS Windows to keep the Windows PATH variable tidy and short., 2016-05-03T21:08:03+0000
/project/epipylib/, epipylib, 0.1.0-2, Epidemic model library for fitting epidemic models., 2016-09-25T12:11:20+0000
/project/epip/, Epip, 1.0.4, Pipe style programming in Python, 2018-07-14T05:51:51+0000
/project/rstwatch/, rstwatch, 1.0.3, Watch directories for changes to RST files and generate HTML, 2019-08-22T03:35:45+0000
/project/hydrotrace/, HydroTrace, 0.2.post1, Hydrogen Trace Analysis Suite, 2020-04-28T19:40:46+0000
/project/etm-qt/, etm_qt, 2.3.27, event and task manager, 2014-04-13T18:16:01+0000
/project/winproxy/, winproxy, 0.3.0a1, A Proxy Selection Tool for Windows, 2016-01-18T19:25:10+0000
/project/risc/, risc, 0.2.1, Python client and CLI for RISC, 2020-03-27T16:52:32+0000
/project/thermostate/, thermostate, 1.2.1, A package to manage thermodynamic states, 2020-07-21T15:20:39+0000
/project/colortuple/, colortuple, 1.0.2, A namedtuple for storing RGBA color values, along with a few simple methods
for generating and modifying colors., 2014-09-05T21:41:22+0000
/project/cyclic-sequences/, cyclic-sequences, 1.1.2, A collection of cyclic sequence objects., 2018-09-15T10:44:58+0000
/project/qtlab/, qtlab, 0.0.27, , 2019-12-01T03:20:07+0000
/project/pvnhxgmgiq/, pvnhxgmgiq, 0.1.7, , 2018-02-27T05:46:59+0000
/project/openvr/, openvr, 1.16.801, Unofficial python bindings for Valve OpenVR SDK, 2021-02-26T00:32:36+0000
/project/pyimapi/, pyIMAPI, 0.4.0b2, Create CD, DVD, DVD Dual Layer, and BluRay ISO images under Windows directly from Python, 2018-06-25T06:47:36+0000
/project/bragly/, bragly, 0.1.4, A small tool to remind yourself of your day-to-day accomplishments, 2016-03-22T06:26:46+0000
/project/tomotopy/, tomotopy, 0.11.1, Tomoto, Topic Modeling Tool for Python, 2021-03-27T15:57:35+0000
/project/deadcheck/, deadcheck, 0.0.3.3.1, Deadlink Check Utility using Python Modules, 2015-03-10T07:11:56+0000
/project/fdet/, fdet, 0.2.1, An easy to use face detection module based on MTCNN and RetinaFace algorithms., 2020-05-14T21:42:20+0000
/project/cynpy/, cynpy, 0.209, Ray's DVT utilities, 2018-09-11T09:14:15+0000
/project/imagepipe/, ImagePipe, 0.2.0rc1, Biological image analysis pipelines compiler, 2017-10-16T15:04:55+0000
/project/etmtk/, etmtk, 3.2.39, event and task manager, 2019-10-03T22:03:40+0000
/project/pyimd/, pyIMD, 0.0.8, Inertial mass determination, 2019-06-21T15:30:21+0000
/project/pwm-lib/, pwm-lib, 0.0.1.dev1, PWM is just a DRY library., 2018-07-10T23:24:37+0000
/project/pykinect/, pykinect, 2.1, PyKinect Module for interacting with the Kinect SDK, 2014-08-11T16:14:24+0000
/project/waveplot-scanner/, waveplot-scanner, 0.0.1, Tool to scan audio files, and generate and upload WavePlots., 2014-09-05T17:24:19+0000
/project/readerlib/, readerlib, 1.0, A binding for open().read() that provides the ability to read a few letters or more., 2012-08-07T15:43:35+0000
/project/wxpython/, wxPython, 4.1.1, Cross platform GUI toolkit for Python, "Phoenix" version, 2020-11-25T21:48:11+0000
/project/mattapi/, mattapi, 0.99.3, Test API Iris, 2019-08-29T23:53:49+0000
/project/py3-bp/, py3-bp, 0.0.4, Ultimate template for new Python 3 projects, 2019-09-20T05:05:48+0000
/project/ea-psu-controller/, ea-psu-controller, 1.1.0, Controller for Elektro-Automatik power supplies, 2018-10-16T14:31:03+0000
/project/tgt-grease/, tgt-grease, 2.6.1, Modern distributed automation engine built with love by Target, 2019-05-07T13:20:26+0000
/project/ca-py/, CA.py, 1.8.1, CA.pl Python Fork, 2019-02-18T05:15:00+0000
/project/python-libtiepie/, python-libtiepie, 0.9.7, Python bindings for LibTiePie, 2021-04-08T12:38:19+0000
/project/yawinpty/, yawinpty, 0.4.3, yet another winpty binding for python, 2017-08-22T04:10:32+0000
/project/tulip-python/, tulip-python, 5.5.1, Large graphs analysis and drawing, 2021-01-21T14:42:58+0000
/project/dhiraj/, Dhiraj, 0.0.1, package will give you a basic calculator function such as addition, substraction, multiplication and division., 2021-02-09T10:28:51+0000
/project/labpype/, LabPype, 0.7.8, A Framework for Creating Pipeline Software, 2018-07-15T21:35:12+0000
/project/pypylon/, pypylon, 1.7.2, The python wrapper for the Basler pylon Camera Software Suite., 2021-03-03T12:57:18+0000
/project/semantic-url/, semantic_url, 1.0.11, Semantic URL - A Parsing & Manipulation library for creating & using Semantic URLs, 2015-08-11T20:53:38+0000
/project/sytad/, SYTAD, 0.1.3, Provides a simple terminal/scripting interface for downloading audio from YouTube via pafy. Works on Android through QPython., 2014-10-28T12:31:08+0000
/project/psutil/, psutil, 5.8.0, Cross-platform lib for process and system monitoring in Python., 2020-12-19T01:19:27+0000
/project/stoichiograph/, Stoichiograph, 0.1.2, Spell words with elemental symbols from the periodic table ("He", "Cu", etc)., 2017-05-16T10:23:30+0000
/project/prwlock/, prwlock, 0.4.1, Native process-shared rwlock support for Python, 2020-05-28T13:37:06+0000
/project/wtools/, wtools, 1.0.10, WAF build tools, 2021-02-08T17:20:10+0000
/project/pymsfilereader/, pymsfilereader, 1.0.1, Thermo MSFileReader Python bindings to interact with .raw files generated by Thermo tandem mass spectrometers., 2019-07-23T14:20:41+0000
/project/serial-mock/, serial_mock, 0.1, mocks serial ports for use with com0com(windows) or socat(*nix), 2017-04-22T06:32:54+0000
/project/spherepy/, spherepy, 0.0.9, Numerical routines for working with spherical harmonic coefficients, 2015-06-29T18:47:11+0000
/project/safeprint/, safeprint, 0.2.0, A printer suppressing UnicodeEncodeError, 2017-03-01T01:13:43+0000
/project/sqlalchemy-dataflex/, sqlalchemy-dataflex, 0.1.5, A SQLAlchemy dialect for DataFlex flat-file databases., 2021-02-10T21:03:52+0000
/project/newftp/, NewFTP, 0.0.2, A GUI program to login the FTP system and a background program to manage FTP file downloading, 2019-01-30T08:26:36+0000
/project/asamba/, asamba, 1.0.8, Python interface to peform asteroseismic modelling with the asamba grid, 2017-06-21T10:55:59+0000
/project/gridsync/, gridsync, 0.4.3, Synchronize local directories with Tahoe-LAFS storage grids., 2020-07-25T00:41:46+0000
/project/avsub/, avsub, 1.0.2, A simplified command-line interface for FFmpeg, 2021-04-12T00:18:47+0000
/project/area4/, area4, 3.11.0, Dividers in Python, the easy way!, 2020-12-28T04:45:38+0000
/project/elib/, elib, 2018.11.22.1, , 2018-11-22T10:34:31+0000
/project/ramlient/, ramlient, 0.1.4, Access to a RAML API done right, in Python., 2017-06-29T17:36:28+0000
/project/earthpic/, earthpic, 0.3, Earth photos downloader, 2016-02-09T02:04:28+0000
/project/psychxr/, psychxr, 0.2.2, Python extension library for interacting with eXtended Reality displays (HMDs), intended for research in neuroscience and psychology., 2019-10-16T20:36:38+0000
/project/tkbak/, tkbak, 1.0.7, Simple Backup Application, 2015-03-23T19:43:45+0000
/project/golumn/, golumn, 0.21.3, Graphical CSV viewer. `column` with a "g", 2018-08-03T18:23:11+0000
/project/django-caching/, django_caching, 1.1.0, A easy using django cache manager., 2017-06-27T04:36:05+0000
/project/mkvbatchmultiplex/, mkvbatchmultiplex, 2.0.1, A mkv media batch multiplex., 2020-09-03T21:03:32+0000
/project/emiz/, emiz, 2018.9.16.4, Set of tools for the DCS mission builder, 2018-09-16T19:45:46+0000
/project/sasspython/, SassPython, 0.2.1, binding for libsass, 2012-08-08T08:02:26+0000
/project/pyms-nist-search/, pyms-nist-search, 0.4.14, PyMassSpec extension for searching mass spectra using NIST's Mass Spectrum Search Engine, 2020-04-29T06:48:36+0000
/project/moziris/, moziris, 0.8.5, Automation tool for visual testing, 2020-01-09T18:02:00+0000
/project/akerun-sum/, akerun-sum, 1.2.2, Enter and leave data totalization program for Akerun, 2020-09-28T03:10:25+0000
/project/watchdog/, watchdog, 2.0.3, Filesystem events monitoring, 2021-04-22T17:57:30+0000
/project/freeseer/, freeseer, 3.0.1, Video recording and streaming software, 2014-01-03T01:49:45+0000
/project/ripsaw/, ripsaw, 0.0.7, cut logs into bits, 2018-06-06T02:06:07+0000
/project/fr/, fr, 3.0, A program to print resources in delicious flavors., 2020-07-06T03:09:13+0000
/project/physical2fa/, Physical2FA, 1.1.0, Encryption using 2 Factor Authentication through an external drive., 2020-05-23T18:54:36+0000
/project/yoctopuce/, yoctopuce, 1.10.44175, Yoctopuce python API, 2021-03-12T10:21:54+0000
/project/vnpy/, vnpy, 1.9.2, A framework for developing Quantitative Trading programmes, 2018-12-29T02:21:27+0000
/project/pyzdde/, PyZDDE, 2.0.3, Zemax / OpticStudio standalone extension using Python, 2016-10-03T02:35:24+0000
/project/ahkunwrapped/, ahkunwrapped, 2.0.2, Lightweight execution and bidirectional communication for native AutoHotkey code and scripts; full language support., 2021-03-20T09:29:16+0000
/project/elib-wx/, elib-wx, 2018.12.15.2, Weather management lib for DCS, 2018-12-15T11:47:06+0000
/project/a2d-diary/, a2d_diary, 0.1.5, A2D-Diary web app. Create and encode paper diaries automatically, 2017-11-11T17:37:39+0000
/project/elib-miz/, elib-miz, 2018.10.21.1, MIZ file lib, 2018-10-21T17:45:00+0000
/project/elib-logging/, elib-logging, 2018.6.17.1, , 2018-06-17T14:36:49+0000
/project/eccw-gui/, eccw-gui, 1.1.1, Exact Critical Coulomb Wedge - Graphical User Interface: tools to compute and display the exact solution of any parameter of Critical Coulomb Wedge, 2019-10-13T13:58:22+0000
/project/suext/, suext, 0.0.3, Utility for showing any file extension and MIME type info. Support show files information in a directory as list or table., 2020-04-01T07:41:01+0000
/project/winsystem/, winsystem, 1.0.8, Control Windows volume,use Windows TTS,make link on Windows，调用tts，创建快捷方式，控制音量, 2020-08-27T04:04:10+0000
/project/flex-motion/, flex-motion, 0.0.1, Python bindings around National Instruments's Flex Motion, 2020-02-10T00:18:23+0000
/project/guacamole/, guacamole, 0.9.2, Guacamole is an command line tool library for Python, 2015-08-06T17:31:18+0000
/project/rapy/, rapy, 0.101, Ray's private DVT utilities, 2018-08-22T09:04:57+0000
/project/reversi/, Reversi, 1.2.1, A version of the Reversi board game intended for casual play., 2015-05-29T18:27:32+0000
/project/ptt-article-parser/, ptt-article-parser, 0.5.0, A renaming tool for PTT articles, 2018-06-11T18:42:45+0000
/project/foremon/, foremon, 1.3.0, Automatically restart applications when file changes are detected., 2021-02-22T02:43:40+0000
/project/vpip/, vpip, 0.4.3, A CLI which aims to provide an npm-like experience when working with Python packages., 2020-01-31T12:27:06+0000
/project/esst/, esst, 2018.12.21.1, , 2018-12-21T21:17:42+0000
/project/dicksonui/, DicksonUI, 2.4.5, Lightweight And Full Featured Browser Based UI / GUI (Graphical User Interface Library), 2020-10-16T13:10:48+0000
/project/epab/, EPAB, 2018.12.18.1, Etcher's Python Application Builder, 2018-12-18T02:31:31+0000
/project/elib-run/, elib-run, 2018.12.6.1, Simple wrapper around the Sarge library to run sub-processes, 2018-12-06T14:11:21+0000
/project/pyniscope/, pyniscope, 0.4.0, Python wrapper for NI Oscilloscopes, 2017-06-22T00:59:39+0000
/project/hypatia-engine/, hypatia_engine, 0.3.6, 2D action adventure game engine, 2015-12-06T02:55:12+0000
/project/elib-wx/, elib-wx, 2018.12.15.2, Weather management lib for DCS, 2018-12-15T11:47:06+0000
/project/elib-logging/, elib-logging, 2018.6.17.1, , 2018-06-17T14:36:49+0000
/project/eccw-gui/, eccw-gui, 1.1.1, Exact Critical Coulomb Wedge - Graphical User Interface: tools to compute and display the exact solution of any parameter of Critical Coulomb Wedge, 2019-10-13T13:58:22+0000
/project/suext/, suext, 0.0.3, Utility for showing any file extension and MIME type info. Support show files information in a directory as list or table., 2020-04-01T07:41:01+0000
/project/winsystem/, winsystem, 1.0.8, Control Windows volume,use Windows TTS,make link on Windows，调用tts，创建快捷方式，控制音量, 2020-08-27T04:04:10+0000
/project/flex-motion/, flex-motion, 0.0.1, Python bindings around National Instruments's Flex Motion, 2020-02-10T00:18:23+0000
/project/guacamole/, guacamole, 0.9.2, Guacamole is an command line tool library for Python, 2015-08-06T17:31:18+0000
/project/generalgui/, generalgui, 1.3.0, Extends and simplifies tkinter functionality with built-in QoL improvements., 2020-07-24T11:26:27+0000
/project/win-app-packager/, win-app-packager, 1.4.2, Python Win App Packager, 2021-01-30T19:21:33+0000
/project/killer/, killer, 0.7.1, Shuts the system down upon disallowed changes, 2019-08-12T09:47:19+0000
/project/mps/, mps, 0.20.16, Search, Stream and Download MP3, 2014-07-16T17:38:06+0000
/project/pydivert/, pydivert, 2.1.0, Python binding to windivert driver, 2017-10-20T21:36:56+0000
/project/dynaui/, DynaUI, 1.1.5, A framework to increase the scalability and flexibility of wxPython, 2021-03-26T07:22:06+0000
/project/epyunit/, epyunit, 0.2.12, The 'epyunit' package provides a wrapper for unit tests of commandline interfaces, and the automation of debugging with PyDev for external processes. The package could be used either from the comandline, or integrated into Eclipse with PyDev., 2017-03-27T04:21:41+0000
/project/debekcalc/, debekCalc, 0.0.1, Czesc, 2021-02-21T13:24:49+0000
/project/pyfmodex/, pyfmodex, 0.7.0, Python bindings to the Fmod Ex library., 2021-03-26T23:32:40+0000
/project/openrs/, OpenRS, 0.0, Open Residual Stress analysis suite, 2021-01-25T18:45:23+0000
/project/bimap/, bimap, 0.1.1, Container similar to boost bimap, 2018-07-13T11:29:44+0000
/project/numtogreek/, numtogreek, 1.0.3, Converts Numbers (Integers and Floats) to Greek Words., 2019-10-27T18:52:09+0000
/project/reddit-comment-scraper/, reddit_comment_scraper, 2.0.5, A simple Reddit-scraping script, 2014-12-29T02:24:52+0000
/project/musical-hash/, musical-hash, 0.1.3, like random-art, but with music, 2020-03-08T06:48:33+0000
/project/paperstream/, paperstream, 1.1.0, PaperStream web app. Create and encode paper diaries or surveys automatically, 2018-06-02T20:04:35+0000
/project/esst/, esst, 2018.12.21.1, , 2018-12-21T21:17:42+0000
/project/dicksonui/, DicksonUI, 2.4.5, Lightweight And Full Featured Browser Based UI / GUI (Graphical User Interface Library), 2020-10-16T13:10:48+0000
/project/epab/, EPAB, 2018.12.18.1, Etcher's Python Application Builder, 2018-12-18T02:31:31+0000
/project/pynim/, pynim, 1.0.5, pynim - a tool for build instaler for Python scripts., 2021-04-03T14:54:31+0000
/project/device-cloud/, device-cloud, 18.6.19, Python library for Wind River's Helix Device Cloud, 2018-06-20T17:16:18+0000
/project/pafy/, pafy, 0.5.5, Retrieve YouTube content and metadata, 2019-11-22T07:14:11+0000
/project/nearside/, nearside, 0.0.1, A package for processing antenna near-field measurements., 2015-06-29T19:14:58+0000
/project/musichaos/, musichaos, 0.1.0, tool to tidy up your music chaos, 2016-02-03T03:42:40+0000
/project/casement/, casement, 0.0.1, Useful functionality for managing Microsoft Windows., 2019-07-11T21:56:50+0000
/project/mps-youtube/, mps-youtube, 0.2.8, Terminal based YouTube player and downloader, 2018-02-18T04:59:29+0000
/project/enginecrawler/, engineCrawler, 1.3, Scraping images from the web., 2020-11-29T10:58:24+0000
/project/lamonpy/, lamonpy, 0.2.0, Lamonpy, Latin POS Tagger & Lemmatizer for Python, 2020-10-15T17:17:49+0000
/project/winstats/, winstats, 0.80, A simple Windows status retrieval module with no additional dependencies., 2020-07-06T00:46:26+0000
/project/supermarkdown/, SuperMarkdown, 0.2.4, export a complex Markdown file into a standalone HTML file., 2017-09-19T08:45:09+0000
/project/xnt/, Xnt, 0.6.3, High-Level build script for doing more complex build tasks, 2013-10-21T23:37:42+0000
/project/generalgui/, generalgui, 1.3.0, Extends and simplifies tkinter functionality with built-in QoL improvements., 2020-07-24T11:26:27+0000
/project/win-app-packager/, win-app-packager, 1.4.2, Python Win App Packager, 2021-01-30T19:21:33+0000
/project/killer/, killer, 0.7.1, Shuts the system down upon disallowed changes, 2019-08-12T09:47:19+0000
/project/mps/, mps, 0.20.16, Search, Stream and Download MP3, 2014-07-16T17:38:06+0000
/project/pydivert/, pydivert, 2.1.0, Python binding to windivert driver, 2017-10-20T21:36:56+0000
/project/dynaui/, DynaUI, 1.1.5, A framework to increase the scalability and flexibility of wxPython, 2021-03-26T07:22:06+0000
/project/epyunit/, epyunit, 0.2.12, The 'epyunit' package provides a wrapper for unit tests of commandline interfaces, and the automation of debugging with PyDev for external processes. The package could be used either from the comandline, or integrated into Eclipse with PyDev., 2017-03-27T04:21:41+0000
/project/pymodbus3/, pymodbus3, 1.0.0, A fully featured modbus protocol stack in python, 2014-07-18T07:20:27+0000
/project/winping/, winping, 0.2.4, Ping implementation which utilizes Windows ICMP API, 2020-08-09T23:42:23+0000
/project/pysciter/, PySciter, 0.4.32, Python bindings for the Sciter - Embeddable HTML/CSS/script engine (cross-platform desktop GUI toolkit)., 2021-03-25T14:52:46+0000
/project/pco/, pco, 0.1.3, This class provides methods for using pco cameras., 2020-12-07T09:35:00+0000
/project/radish-bdd/, radish-bdd, 0.13.4, Behaviour-Driven-Development tool for python, 2021-03-29T06:28:05+0000
/project/cloudendure/, cloudendure, 0.3.5, Python wrapper and CLI for CloudEndure, 2020-06-05T16:59:21+0000
/project/py-win-keyboard-layout/, py_win_keyboard_layout, 0.2, Interaction with keyboard layout on windows, 2017-01-25T01:08:19+0000
/project/chronogram/, chronogram, 0.1.7, Chrono-gram, the diachronic word embedding model based on Word2vec Skip-gram with Chebyshev approximation, 2019-09-23T14:56:31+0000
/project/mattapi-targets/, mattapi-targets, 0.77, Targets for Mozilla Iris, 2019-08-29T20:14:53+0000
/project/securityheaders/, securityheaders, 0.0.1, Fetch Security Headers for a specific URL using securityheaders.io, 2016-02-24T03:03:02+0000
/project/py-thorlabs-tsp/, py-thorlabs-tsp, 0.0.8, Controls for Thorlabs TSP01 temperature and humidity sensor, 2021-03-17T15:09:28+0000
/project/chicken-turtle-util/, chicken_turtle_util, 4.1.2, Python 3 utility library, 2017-06-12T14:15:19+0000
/project/rtapylysis/, rtapylysis, 0.3, Synchrotorn Rapid Thermal Annealing (RTA) X-ray Diffraction (XRD) Data Analysis Project, 2017-01-24T18:08:39+0000
/project/churchrepl/, churchrepl, 1.0.2, A simple REPL for lambda calculus, 2016-06-28T14:39:00+0000
/project/mountwizzard4/, mountwizzard4, 1.1.1, Tool for managing 10micron mounts, 2021-04-02T21:51:46+0000
/project/toga-winforms/, toga-winforms, 0.2.15, A Microsoft .Net backend for the Toga widget toolkit using the WinForms API., 2017-08-14T18:31:04+0000
