/project/databrickslabs-jupyterlab/, databrickslabs-jupyterlab, 2.2.0, Remote JupyterLab kernel for Databricks, 2021-04-21T11:36:50+0000
/project/pycouchdb/, pycouchdb, 1.14.1, Modern pure python CouchDB Client., 2020-02-20T08:50:17+0000
/project/purplship-usps/, purplship.usps, 2021.3, Purplship - USPS Shipping Extension, 2021-04-18T05:01:25+0000
/project/dnac/, dnac, 1.3.1.7, A wrapper for using Cisco DNA Center's REST API, 2020-04-16T19:34:59+0000
/project/pyinstrument-patch/, pyinstrument-patch, 0.0.2, Patch for fix pyinstrument root_frame exception, 2020-07-04T03:37:52+0000
/project/opentimelineio/, OpenTimelineIO, 0.13.0, Editorial interchange format and API, 2020-08-24T18:21:56+0000
/project/django-wools/, django-wools, 0.1.4, Django tools from WITH, 2020-06-04T11:59:28+0000
/project/mkl-dpcpp/, mkl-dpcpp, 2021.2.0, Intel® oneAPI Math Kernel Library, 2021-03-26T20:33:06+0000
/project/mpymodcore-watering/, mpymodcore-watering, 0.0.9, mpymodcore, 2020-12-12T05:32:22+0000
/project/dpcpp-cpp-rt/, dpcpp-cpp-rt, 2021.2.0, Intel® C++ Compiler Classic, 2021-03-26T20:17:02+0000
/project/filemarx/, filemarx, 0.1.0, Validate a directory structure using JSON schemas, 2015-03-01T15:28:17+0000
/project/deft-hep/, deft-hep, 0.1.0, dEFT is a tool for performing fits of EFT coefficients to HEP data in seconds, 2021-04-23T09:14:53+0000
/project/scriber/, scriber, 0.1.3, Python client API for scriber.io, 2015-03-27T19:28:09+0000
/project/azureml-designer-pytorch-modules/, azureml-designer-pytorch-modules, 0.0.37, , 2021-04-16T06:59:48+0000
/project/yt-scraper/, yt-scraper, 0.8.4, Command line utility querying the YouTube API v3., 2020-05-31T20:05:33+0000
/project/pygroupexc/, pygroupexc, 0.1.0, Library for giving similar exceptions the same identifier, 2020-11-27T22:14:22+0000
/project/arus/, arus, 1.1.22, Activity Recognition with Ubiquitous Sensing, 2021-02-04T00:09:46+0000
/project/njinn-worker/, njinn-worker, 0.12.4, Njinn Worker, 2021-04-21T11:42:48+0000
/project/flask-s3-gzip/, Flask-S3-gzip, 0.1.8, Seamlessly serve the static files of your Flask app from Amazon S3 (forked from original flask-s3), 2014-11-16T07:45:11+0000
/project/idp-solver/, idp-solver, 0.7.3, IDP-Z3 is a collection of software components implementing the Knowledge Base paradigm using the IDP language and a Z3 SMT solver., 2021-03-04T09:53:40+0000
/project/impi-rt/, impi-rt, 2021.2.0, Intel® MPI Library, 2021-03-26T20:17:14+0000
/project/bergen/, bergen, 0.3.103, A python client for the Arnheim Framework, 2021-04-23T14:16:11+0000
/project/opencl-rt/, opencl-rt, 2021.2.0, Intel® oneAPI OpenCL* Runtime, 2021-03-26T20:25:26+0000
/project/philsol/, philsol, 0.25, A fully vectorial finite difference waveguide mode solver. Based on the algorithm of Zhu and Brown, 2021-04-16T18:18:32+0000
/project/schematics-patched/, schematics-patched, 1.1.2, A aptched version of schematics 1.1.1 that can pickle with multiprocessing, 2018-04-04T17:43:18+0000
/project/seaborn-calling-function/, seaborn-calling-function, 0.0.2, SeabornCallingFunction reads metadata regarding functions applied to its member functions.", 2017-12-27T16:37:29+0000
/project/dbd-py/, dbd-py, 0.2.8, Cool Discord Bot Designer module for python by Edited Cocktail, 2021-03-20T10:19:38+0000
/project/onednn-devel-cpu-dpcpp-gpu-dpcpp/, onednn-devel-cpu-dpcpp-gpu-dpcpp, 2021.2.0, Intel® oneAPI Deep Neural Network Library, 2021-03-26T20:20:57+0000
/project/abnex/, abnex, 1.0.0, Abnormal expressions (abnex) is an alternative to regular expressions (regex)., 2021-03-06T12:29:52+0000
/project/luh3417/, luh3417, 0.1.6, A WordPress backup/restore/workflow tool, 2020-12-02T15:42:43+0000
/project/qmenta-lint/, qmenta-lint, 0.9.8, Run qlint to perform linting (flake8) on QMENTA components., 2020-05-19T13:44:01+0000
/project/pytket-cirq/, pytket-cirq, 0.9.0, Extension for pytket, providing translation to and from the Cirq framework, 2021-04-01T11:04:41+0000
/project/commvault-client/, commvault-client, 2.3.0, Python wrapper for Commvault api, 2020-10-08T18:55:24+0000
/project/mythic-payloadtype-container/, mythic-payloadtype-container, 0.0.38, Functionality for Mythic Payload Type Containers, 2021-03-17T01:06:41+0000
/project/stanford-cs183-notes/, stanford-cs183-notes, 2020.9.21.0, 斯坦福 CS183 & YC 创业课系列中文笔记, 2020-09-21T04:44:04+0000
/project/purplship-canpar/, purplship.canpar, 2021.3, Purplship - Canpar Shipping Extension, 2021-04-18T05:01:28+0000
/project/ri-python/, ri-python, 0.9.9, Resolved Instruments Python library, 2021-04-24T21:48:30+0000
/project/opensmile/, opensmile, 2.0.0, Python wrapper for common openSMILE feature sets, 2021-02-12T11:05:11+0000
/project/django-codenerix-transports/, django-codenerix-transports, 1.0.4, Codenerix Transports is a module that enables CODENERIX to manage transports and let clients to request transport of packages with kwnown companies., 2018-05-08T09:46:58+0000
/project/ee-extra/, ee-extra, 0.0.1, Miscellaneous functions for working with the Earth Engine Python API., 2021-04-02T15:17:46+0000
/project/homekeeper-game/, homekeeper-game, 1.0.2, short house-keeping tetrizoid for 2019 global game jam, 2019-01-28T03:23:51+0000
/project/osmpy/, osmpy, 0.2.0, Powerfull wrapper around OSM Overpass Turbo to query regions of any size and shape, 2020-11-24T16:51:02+0000
/project/seniverse-py/, seniverse-py, 0.1.1, 心知天气第三方SDK / seniverse third party sdk for python3, 2021-04-12T04:46:58+0000
/project/flask-azure-oauth/, flask-azure-oauth, 0.5.0, Python Flask extension for using Azure Active Directory with OAuth to protect applications, 2020-09-14T14:37:49+0000
/project/magen-datastore/, magen-datastore, 1.0a1, Ingestion MicroService Package, 2017-08-31T03:36:25+0000
/project/brainfoodr/, brainfoodr, 0.1.3, structure for r projects, 2019-06-05T21:18:50+0000
/project/qat-variational/, qat-variational, 1.2.3, Module qat-variational [9f5dd6b] - Compiled by Atos, 2021-04-23T20:56:48+0000
/project/python-sdk-auth/, python-sdk-auth, 0.3.0, Library for Hologram Authentication methods, 2019-10-25T18:17:21+0000
/project/moana/, moana, 0.1.1, Moana: A robust and scalable cell type classification framework for single-cell RNA-Seq data., 2018-10-31T00:06:27+0000
/project/lqcuq-zh/, lqcuq-zh, 2020.10.26.0, <center>使用 Qiskit 学习量子计算 - 翻译版</center>, 2020-10-26T11:14:13+0000
/project/dbdpy/, dbdpy, 1.2.9, Discord Bot Designer For Discord module for python writen by Edited cocktail, official server: https://discord.gg/t9wHKGtD7p, 2021-02-10T10:33:39+0000
/project/mkl-include/, mkl-include, 2021.2.0, Intel® oneAPI Math Kernel Library, 2021-03-26T20:23:39+0000
/project/pyentrypoint/, pyentrypoint, 0.7.4, pyentrypoint manages entrypoints in Docker containers., 2020-06-14T17:50:59+0000
/project/allensdk/, allensdk, 2.10.3, core libraries for the allensdk., 2021-04-24T00:13:06+0000
/project/metascript/, metascript, 0.1.1, Metascript retrieval and processing, 2007-08-06T18:58:28+0000
/project/izza/, izza, 0.4.0, my machine learning toolkit, 2021-04-05T17:04:52+0000
/project/adas/, adas, 1.0.5, Python package for AdaS: Adaptive Scheduling of Stochastic Gradients, 2021-04-24T17:35:08+0000
/project/seaborn-logger/, seaborn-logger, 0.0.4, SeabornLogger enables the streaming of the data relevant ot a program's to a logging file, 2018-03-15T05:10:48+0000
/project/pillow-scripts/, pillow-scripts, 5.0.0, Python Imaging Library (Fork) Scripts, 2018-01-01T21:24:39+0000
/project/dpy-utils/, dpy-utils, 0.1.0, A discord.py utility library., 2021-01-05T19:43:37+0000
/project/bosdyn-client/, bosdyn-client, 2.3.4, Boston Dynamics API client code and interfaces, 2021-04-14T12:02:26+0000
/project/ripozo-cassandra/, ripozo-cassandra, 0.2.1, Integrates cassandra/cqlengine with ripozo to easily create cassandra backed Hypermedia/HATEOAS/REST apis, 2015-06-30T17:43:49+0000
/project/ur-cb2/, ur_cb2, 0.2, A package to interface with a UR CB2 Robot over TCP/IP, 2016-03-22T03:38:11+0000
/project/oneccl-devel/, oneccl-devel, 2021.2.0, Intel® oneAPI Collective Communications Library, 2021-03-26T20:18:53+0000
/project/jvm/, jvm, 0.5.0b3, Python bridge for the Java Virtual Machine., 2020-12-13T20:54:47+0000
/project/pimodelmanager/, pimodelmanager, 0.4.0, A package used to manage our ML models., 2021-04-15T14:56:25+0000
/project/comet-ml/, comet-ml, 3.9.0, Supercharging Machine Learning, 2021-04-15T14:42:27+0000
/project/azureml-designer-internal/, azureml-designer-internal, 0.0.49, , 2021-04-13T08:30:22+0000
/project/sdvi-rally/, sdvi-rally, 0.1.0, The Rally SDK, 2021-03-17T00:25:41+0000
/project/flake8-pytest-importorskip/, flake8-pytest-importorskip, 1.1.0, Make pycodestyle treat pytest.importorskip as an import statement (avoid E402), 2021-03-01T22:10:04+0000
/project/hotair/, hotair, 0.1.0, HTML Over The Air. Transporting HTML through WebSocket. Inspired by Hotwire., 2021-01-16T20:17:51+0000
/project/stories-pytest/, stories-pytest, 0.1.0, Pytest reporter for stories executed during the test., 2020-12-04T18:56:34+0000
/project/intel-scipy/, intel-scipy, 1.1.0, SciPy optimized with Intel(R) MKL library, 2018-09-25T15:29:45+0000
/project/magen-hwa-service/, magen-hwa-service, 1.1a1, Magen Hello-World WebApp MicroService Package, 2017-11-08T19:16:50+0000
/project/baem200/, baem200, 0.0.11, Bachmann electronic Python Util Library, 2019-08-14T12:38:48+0000
/project/python-programming-net-zh/, python-programming-net-zh, 2020.9.21.0, PythonProgramming.net 系列教程, 2020-09-21T04:39:23+0000
/project/allya-nestedconfigparser/, allya.nestedconfigparser, 0.1.0, A simple extension to configparser that allows nested fallback configurations, 2016-08-17T22:46:31+0000
/project/ak-apkid/, ak-apkid, 2.1.0.post1, Android Package Identifier, 2020-04-28T21:39:12+0000
/project/pinkopy/, pinkopy, 2.1.2, Python wrapper for Commvault api, 2016-09-28T22:20:47+0000
/project/sphinx-diagrams/, sphinx-diagrams, 0.2.2, Rendering Diagrams in Sphinx, 2020-12-12T05:48:06+0000
/project/pypssl/, pypssl, 2.2, Python API for PSSL., 2021-04-15T22:35:20+0000
/project/motoman/, motoman, 0.1.3, A command line tool to control a set of stepper motors, 2021-03-15T09:20:26+0000
/project/django-on-chain/, django-on-chain, 1.2.8, Django On Chain, 2020-12-03T14:10:49+0000
/project/freeflyer-runtime-api/, freeflyer-runtime-api, 3.0.0, Python interface to the FreeFlyer® Runtime API, 2019-10-17T06:33:02+0000
/project/indico-fonts/, indico-fonts, 1.1, Indico - Binary fonts, 2017-03-10T13:03:50+0000
/project/simdak/, simdak, 1.1.0, Importer-exporter data Simdak Kemdikbud, 2020-12-26T02:51:40+0000
/project/rapidpro-python/, rapidpro-python, 2.8.2, Python client library for the RapidPro API, 2021-04-09T19:20:24+0000
/project/beward/, beward, 1.0.14, Constants., 2021-03-23T04:05:04+0000
/project/lighton/, LightOn, 0.0.18, LightOn - A lightweight Python course taking beginners seriously, 2015-12-11T16:48:27+0000
/project/utaufile/, utaufile, 0.1.0, Read and write UTAU ust file and NiaoNIAO nn file, 2020-08-31T02:28:38+0000
/project/threatstack-agent-python/, threatstack-agent-python, 0.1.1, Application Security Monitoring by Threat Stack, 2020-08-17T19:43:34+0000
/project/polygon2/, Polygon2, 2.0.8, Polygon2 is a Python-2 package that handles polygonal shapes in 2D, 2015-11-05T09:49:40+0000
/project/speedport/, speedport, 1.0.1, , 2021-03-03T22:41:02+0000
/project/opentimelineio-py/, OpenTimelineIO-Py, 0.11.0.dev2, Editorial interchange format and API, 2021-01-05T13:43:45+0000
/project/onednn-devel-cpu-tbb/, onednn-devel-cpu-tbb, 2021.2.0, Intel® oneAPI Deep Neural Network Library, 2021-03-26T20:21:12+0000
/project/tfimgtools/, tfimgtools, 0.0.6, A tool for sorting images given a tensorflow model., 2017-05-18T15:07:48+0000
/project/azureml-designer-vowpal-wabbit-modules/, azureml-designer-vowpal-wabbit-modules, 0.0.26, , 2021-04-13T08:44:05+0000
/project/asa-core/, asa-core, 0.1.0, , 2020-10-23T05:37:06+0000
/project/napplib/, napplib, 0.3.58, Small lib with custom functions to handle with azure, napp hub and custom workflows, 2021-04-16T20:13:30+0000
/project/rpio/, RPIO, 0.10.0, Advanced GPIO for the Raspberry Pi. Extends RPi.GPIO with PWM, GPIO interrups, TCP socket interrupts, command line tools and more, 2013-03-14T15:00:48+0000
/project/independentsoft-msg/, independentsoft.msg, 1.6, Outlook .msg file format module, 2019-11-14T21:17:33+0000
/project/filegardener/, filegardener, 1.6.9, filegardener file utilities dedup, only file copy detection, empty dir detection, 2017-04-02T00:12:35+0000
/project/seaborn-timestamp/, seaborn-timestamp, 1.1.0, Seaborn Timestamp has timing functions and a timing profile which collects and reports on timing data of code execution, 2018-04-01T03:35:55+0000
/project/cthulhu-cult-database/, cthulhu-cult.database, 0.1, SQL Alchemy entities for Cthulhu Cult project, 2020-01-06T01:59:09+0000
/project/bilidriveex/, BiliDriveEx, 2020.3.9.3, ☁️ 哔哩哔哩云 Ex，支持任意文件的全速上传与下载, 2020-03-10T10:03:16+0000
/project/mvinstall/, mvinstall, 0.3.0, mvinstall - install data and packages from S3., 2019-05-25T20:43:46+0000
/project/tentakel/, tentakel, 3.1.1, distributed command execution, 2021-02-26T16:07:02+0000
/project/csdbe/, csdbe, 2.3.0, This is a CSDBE(Coctail script discord bot editor) writen by Winter_coctail, 2021-01-20T07:25:23+0000
/project/scrud-django/, scrud-django, 0.5.0, A Django REST Framework app for Semantic CRUD., 2021-04-01T14:05:08+0000
/project/fasttext-doc-zh/, fasttext-doc-zh, 2020.9.21.0, FastText 中文文档, 2020-09-21T03:52:29+0000
/project/rodder/, rodder, 0.1.9.1, A distro-independant package manager for Linux, 2021-04-23T11:36:58+0000
/project/typefit/, typefit, 0.3.0, Fits JSON values into Python type-anotated objects, 2020-04-30T13:15:35+0000
/project/flake8-flask/, flake8-flask, 0.9.3, Static analysis checks for Flask, by r2c. Available in our free program analysis tool, Bento. (ht, 2020-04-15T19:14:35+0000
/project/mnemoize/, mnemoize, 0.1.1, Use mnemonic code instead of bytes or passwords., 2020-08-04T22:53:50+0000
/project/anycore-dbg-supplement/, anycore-dbg-supplement, 0.3.1, A bundle of auxiliary scripts for the Anycore project, 2020-12-20T15:15:12+0000
/project/azureml-pipeline/, azureml-pipeline, 1.27.0, , 2021-04-19T15:48:49+0000
/project/logx/, logx, 0.1.1579232358, best practice python logging with zero config, 2020-01-17T03:39:18+0000
/project/magic-comic-reader/, magic-comic-reader, 1.8, Scrapes webcomics to make them easier to read., 2018-06-04T04:26:16+0000
/project/markdown-iconfonts/, markdown-iconfonts, 3.0.0, Easily display icon fonts in markdown., 2018-12-15T15:17:32+0000
/project/pyadaaah/, pyadaaah, 0.90, Python extension adding automatic, dynamic, runtime type and range checking support, 2021-02-18T23:56:51+0000
/project/pyk8sver/, pyk8sver, 1.0, Get k8s version from github, 2019-01-14T18:11:45+0000
/project/magen-logger/, magen-logger, 1.0a1, Magen Logging Package, 2017-08-31T02:47:29+0000
/project/qat-comm/, qat-comm, 1.2.1, Module qat-comm [3edbcc6] - Compiled by Atos, 2021-04-23T20:54:59+0000
/project/panoramik-analytic-models/, panoramik-analytic-models, 0.3.6, Panoramik ClickHouse analytic models, 2019-09-23T13:35:35+0000
/project/montblanc/, montblanc, 0.6.4, GPU-accelerated RIME implementations., 2021-02-03T08:20:02+0000
/project/pydebuggerupgrade/, pydebuggerupgrade, 3.4.6.46, CLI and library utility for upgrading firmware on Microchip PKOB nano (nEDBG) debugger, 2020-10-30T15:38:53+0000
/project/ibooker-plain-dealer/, ibooker-plain-dealer, 2020.11.3.0, iBooker 布客老实人报, 2020-11-03T02:59:18+0000
/project/etch-a-tv/, etch-a-tv, 0.1.1, Draw images over the radio, 2021-01-18T06:33:54+0000
/project/scpi/, scpi, 2.4.0, Basic idea here is to make transport-independent command sender/parser and a device baseclass that implements the common SCPI commands, 2021-04-25T11:02:28+0000
/project/db-sheet/, db-sheet, 0.1.4, db_sheet: Using Google Spreadsheets as Database., 2019-01-03T23:00:36+0000
/project/aa-spark-run-utils/, aa-spark-run-utils, 1.4.0, , 2020-10-16T10:00:20+0000
/project/emencia-yuic/, emencia-yuic, 2.4.8, Nope, 2021-02-13T02:36:30+0000
/project/fastiqa/, fastiqa, 0.6.1, fastiqa makes deep learning for image quality assessment faster and easier, 2020-02-21T19:55:22+0000
/project/tvm-valuetypes/, tvm-valuetypes, 0.0.3, Collection of utils for handling Telegram Open Network Virtual Machine value types, 2019-12-27T19:20:14+0000
/project/ibm-quantum-widgets/, ibm-quantum-widgets, 1.0.3, IBM Quantum widgets for Jupyter, 2021-02-11T17:04:06+0000
/project/rss-parser/, rss-parser, 0.2.3, Typed pythonic RSS parser, 2021-04-15T15:30:34+0000
/project/contrib-colormaps/, contrib-colormaps, 0.0.1, Contributed colormaps, 2019-11-22T22:19:20+0000
/project/zeorawdata/, ZeoRawData, 2.0, Zeo Raw Data Library, 2014-09-20T08:03:24+0000
/project/modelicapy/, modelicapy, 0.3.2, A Python library containing a variety of scripts and functions for interaction with Modelica and TRANSFORM, 2018-12-19T18:10:56+0000
/project/azureml-dataprep/, azureml-dataprep, 2.15.0, Azure ML Data Preparation SDK, 2021-04-22T07:42:06+0000
/project/fa-common/, fa-common, 0.13.2, CSIRO Geoanalytics FastAPI Common Framework. Standardises Data access, authentication, task execution and provides a number of utilities and helper classes., 2021-01-20T08:32:47+0000
/project/matplotlib-doc-zh/, matplotlib-doc-zh, 2020.9.21.0, Matplotlib 用户指南, 2020-09-21T04:15:38+0000
/project/dev-shell/, dev-shell, 0.2.2, Devloper shell for easy startup..., 2021-04-13T06:35:54+0000
/project/azureml-contrib-services/, azureml-contrib-services, 1.27.0, , 2021-04-19T15:48:36+0000
/project/iloveruby-zh/, iloveruby-zh, 2020.9.21.0, 我爱 Ruby, 2020-09-21T04:09:18+0000
/project/sepp/, sepp, 0.0.0, Science Exploitation and Preservation Platform, 2019-06-03T22:07:44+0000
/project/py-agender/, py-agender, 0.0.9, Simple opencv & tensorflow based solution to estimate Faces, Age and Gender on pictures, 2019-08-26T13:59:23+0000
/project/musamusa-fal/, musamusa-fal, 0.0.3, Use this package to store a filename and a line number., 2021-03-04T16:01:01+0000
/project/idonethis/, idonethis, 1.0.0, A simple Python CLI for interacting with idonethis, 2015-06-05T04:40:54+0000
/project/piauthorizer/, piauthorizer, 0.5.0, A package to create a uniform authorization and autorest standard for FastAPI, 2021-04-15T08:36:36+0000
/project/py-hi/, py-hi, 0.1.2, hi is a tiny cli program that send benchmark request to almost everything based on asyncio, 2021-01-23T08:00:44+0000
/project/python-tldap/, python-tldap, 1.0.6, High level python LDAP Library, 2021-04-07T23:10:21+0000
/project/huntflow-py/, huntflow-py, 0.1.1, Huntflow API library for Python, 2020-05-02T22:57:48+0000
/project/douze/, douze, 0.1.4, A DigitalOcean API client to help with 12-factors apps, 2020-07-17T09:05:32+0000
/project/deepsparse/, deepsparse, 0.2.0, Neural network inference engine that delivers GPU-class performance for sparsified models on CPUs, 2021-03-31T22:24:49+0000
/project/norgatedata/, norgatedata, 1.0.58, Python interface to financial data provided by Norgate Data, 2021-04-21T04:14:24+0000
/project/distro-names/, distro-names, 0.0.8, Search for the names and versions of popular OS distributions, 2021-03-25T00:33:24+0000
/project/canopy-toolkit/, canopy-toolkit, 1.0.14, Nifty utilities to access Canopy resources via python., 2020-01-03T12:59:56+0000
/project/numba-doc-zh/, numba-doc-zh, 2020.9.21.0, Numba 0.44 中文文档, 2020-09-21T04:32:29+0000
/project/devsnets/, devsnets, 1.9.6, Devsnets, 2021-03-24T12:22:10+0000
/project/icecore/, icecore, 0.2.0.0, icecore C++ library python bindings, 2018-03-02T01:29:39+0000
/project/neuron-morphology/, neuron-morphology, 1.0.0, Tools for working with single-neuron morphological reconstructions, 2020-07-02T21:49:06+0000
/project/inqbus-rainflow/, inqbus.rainflow, 1.5, Cython optimized rainflow algorithm, 2017-08-21T13:51:42+0000
/project/pyogmaneo/, pyogmaneo, 1.0.3, Python bindings for the OgmaNeo2 library, 2020-06-16T23:50:24+0000
/project/ipp-include/, ipp-include, 2021.2.0, Intel® Integrated Performance Primitives, 2021-03-26T20:21:17+0000
/project/pacu/, pacu, 0.1.15, , 2021-04-21T22:17:39+0000
/project/gstly/, gstly, 0.1.6, Internal GStreamer libraries for BrainFrame, 2021-03-02T18:48:48+0000
/project/echostream-managed-app/, echostream-managed-app, 0.0.1, Application that implements the managed app functionality, 2021-01-18T18:12:44+0000
/project/webheroes-utils/, webheroes-utils, 0.0.4, Set of python utils made specifically for Web Heroes Inc., 2015-06-22T23:45:55+0000
/project/bento-cli/, bento-cli, 0.12.0, Free program analysis focused on bugs that matter to you., 2020-05-08T22:15:32+0000
/project/egenix-pyopenssl/, egenix-pyopenssl, 0.13.16, eGenix pyOpenSSL Distribution for Python, 2016-11-11T10:00:02+0000
/project/django-mail-panel/, django-mail-panel, 3.2.3, A panel for django-debug-toolbar that allows for viewing of recently sent email., 2021-04-05T17:00:27+0000
/project/theconcierge/, theconcierge, 0.0.2, The Concierge allows you to create a simple project for the development of a ready-to-use Telegram Bot., 2021-03-26T15:17:00+0000
/project/cpthook/, cpthook, 1.0.2, Centrally manage hooks for git repositories, 2014-05-01T05:40:50+0000
/project/instrument-server/, instrument-server, 1.3.4, TCP server for controlling multiple instruments with a simplified SCPI interface, 2019-11-26T20:39:13+0000
/project/pyvera/, pyvera, 0.3.13, Python API for talking to Veracontrollers, 2021-02-06T18:54:43+0000
/project/grid2viz/, grid2viz, 1.1.0, Grid2Op Visualization companion app., 2021-03-22T08:41:25+0000
/project/inqbus-ocf-generic/, inqbus.ocf.generic, 0.1, Generic OCF resource agents, 2011-11-29T21:42:22+0000
/project/test-pypi-poetry/, test-pypi-poetry, 0.2.9, The Description, 2020-12-15T02:41:41+0000
/project/toolchain-pants-plugin/, toolchain.pants.plugin, 0.8.1, Toolchain Pants plugin., 2021-04-08T19:17:18+0000
/project/egenix-mxodbc-connect-client/, egenix-mxodbc-connect-client, 2.1.5, eGenix mxODBC Connect Client for Python, 2015-10-23T08:41:04+0000
/project/sevenbridges-cwl/, sevenbridges-cwl, 1.1.3, SBG Python library to create CWL tools and workflows, 2018-11-23T14:42:39+0000
/project/ripsaw/, ripsaw, 0.0.7, cut logs into bits, 2018-06-06T02:06:07+0000
/project/customer-mlscrcom/, customer.mlscrcom, 0.4, mls-cr.com Theme & Policy Product., 2015-06-25T13:10:07+0000
/project/octoapi/, octoapi, 0.1.0, Python interface to Octopus Energy API, 2020-11-02T16:58:22+0000
/project/splunk-appinspect/, splunk-appinspect, 2.4.0, Automatic validation checks for Splunk Apps, 2021-04-01T23:47:09+0000
/project/chaosrouter-core/, chaosrouter_core, 0.1.2, Core suite of basic useful directives, 2018-04-06T14:18:22+0000
/project/pistack/, pistack, 0.0.1, , 2018-06-11T14:41:51+0000
/project/intellisense-python/, intellisense-python, 1.0.0, Intellisense API for Python., 2014-07-11T18:52:10+0000
/project/avacoin/, avacoin, 0.0.0.dev0, avacoin, 2018-10-16T21:53:42+0000
/project/sphinxcontrib-nvd3/, sphinxcontrib.nvd3, 0.2.1, Sphinx chart extension using NVD3.js., 2021-02-16T04:21:10+0000
/project/pylsocr/, pyLSOCR, 0.1.4, A python wrapper, 2015-01-29T06:09:10+0000
/project/fasttask/, fasttask, 0.1.4, ### FastTask is simple to fast run task, 2021-03-05T10:17:00+0000
/project/trend-app-protect/, trend-app-protect, 4.4.3, Trend Micro Cloud One Application Security, 2020-07-04T03:38:20+0000
/project/syneto-api/, syneto-api, 0.2.10, Syneto Client API library, 2021-04-18T09:09:04+0000
/project/genicam2/, genicam2, 0.0.0.dev5472, The official Python Binding for the GenICam GenApi & the GenTL Producers, 2018-10-25T02:49:41+0000
/project/defbench/, defbench, 0.1.1, benchmark (time + memory) individual python functions, 2021-02-13T18:37:07+0000
/project/nlp-pytorch-zh/, nlp-pytorch-zh, 2021.1.4.0, PyTorch 自然语言处理, 2021-01-04T09:37:07+0000
/project/nalaf/, nalaf, 0.6.0, Natural Language Framework, for NER and RE, 2021-01-15T15:05:40+0000
/project/mxnet-octave-conv/, mxnet-octave-conv, 0.1.0, Octave convolution, 2019-04-19T11:36:16+0000
/project/nvdsc/, nvdsc, 0.0.325, Nvidia Data Science Client Beta, 2021-04-14T19:43:41+0000
/project/qencode3/, qencode3, 0.9.30, Qencode client library to easily setup a working solution using Python v3.x., 2020-07-14T11:29:29+0000
/project/ngsequtils/, ngSeqUtils, 1.2.1, Some utility scripts for handling Next Generation Sequencing data and for working with wig/bigwig and gff files in python, 2014-01-08T14:19:54+0000
/project/django-codenerix-products/, django-codenerix-products, 2.0.3, Codenerix Products is a module that enables CODENERIX to set products on serveral platforms in a general manner., 2018-05-08T09:46:08+0000
/project/sqreen/, sqreen, 1.27.0, Sqreen agent to protect Python applications., 2021-04-07T11:38:49+0000
/project/dynmap-api/, dynmap-api, 0.1.3, A unified Python API wrapper for Dynmap, 2020-11-28T20:36:38+0000
/project/purplship-canadapost/, purplship.canadapost, 2021.3, Purplship - Canada Post Shipping Extension, 2021-04-18T05:01:21+0000
/project/drop2beets/, drop2beets, 1.0.0, Import singles to Beets as soon as they are dropped in a folder, 2020-11-30T20:59:12+0000
/project/sanic-oauthlib/, sanic-oauthlib, 0.2.3, OAuthLib for Sanic, ported from Flask-OAuthLib, 2020-10-30T04:49:04+0000
/project/esmvaltool-sample-data/, ESMValTool-sample-data, 0.0.3, ESMValTool sample data, 2021-02-10T10:58:07+0000
/project/shiboken2/, shiboken2, 5.15.2, Python / C++ bindings helper module, 2020-11-20T08:16:59+0000
/project/common-cmplr-lib-rt/, common-cmplr-lib-rt, 2021.2.0, Intel® oneAPI Runtime COMMON LIBRARIES, 2021-03-26T20:16:20+0000
/project/conflagration/, conflagration, 0.0.10, , 2018-04-12T21:47:03+0000
/project/ruamel-yaml-base/, ruamel.yaml.base, 0.1.4, YAMLBase class with saving loading and version support, 2017-07-03T11:35:27+0000
