/project/txexiftool/, txExiftool, 0.1.3, Exiftool protocol and stream endpoint plugin to be used with Twisted, 2016-01-16T22:47:58+0000
/project/simplecv/, SimpleCV, 1.3, Make Computers See with SimpleCV, the Python Framework for Machine Vision, 2012-08-10T20:42:41+0000
/project/picamip/, picamip, 1.1.1b0, Simple Raspberry Pi camera http server interface, 2020-10-02T18:05:00+0000
/project/smth/, smth, 0.8.0, Scan books and handwriting in batch mode from console, 2020-08-17T15:01:51+0000
/project/pxc200/, pxc200, 1.0, Adds support for the Imagenation PXC-200 frame grabber
to the Python Imaging Library, 2003-03-18T19:45:40+0000
/project/wificamera/, wificamera, 0.1.1, WifiCamera is a Python module for controlling the network camera CS-W07G-CY., 2012-03-04T08:51:11+0000
/project/hypershot/, hypershot, 0.3.1, Create screen shots of a video file, and upload them to an image host., 2017-06-18T16:47:49+0000
/project/shutter/, shutter, 0.0.7, ctypes interface for libgphoto2, 2014-08-16T04:05:52+0000
/project/pibooth/, pibooth, 2.0.1, A photo booth application in pure Python for the Raspberry Pi., 2020-09-23T21:14:46+0000
/project/pyflycap2/, pyflycap2, 0.3.0, Cython bindings for Point Gray Fly Capture 2., 2019-11-15T01:54:50+0000
/project/picamraw/, picamraw, 1.2.64, Library for extracting raw bayer data from a Raspberry Pi JPEG+RAW file, 2018-12-20T00:33:28+0000
/project/pibooth-picture-template/, pibooth-picture-template, 1.0.0, Pibooth plugin to customize the final picture layout using Flowchart Maker., 2020-11-14T15:54:10+0000
/project/mss/, mss, 6.1.0, An ultra fast cross-platform multiple screenshots module in pure python using ctypes., 2020-10-31T17:19:10+0000
/project/pywebcamwebservermonitor/, pyWebCamWebServerMonitor, 0.0.14, Webcam WebControl panel build with flask & vue to record / see live and other things designed for linux., 2021-02-16T14:17:05+0000
/project/hough/, hough, 0.2.6, Skew detection and correction in scanned images, 2020-11-12T21:54:06+0000
/project/bullseye/, bullseye, 0.1.1, laser beam profiler, 2012-03-05T00:15:40+0000
/project/imantics/, imantics, 0.1.12, Python package for managing image annotations, 2020-01-22T17:54:17+0000
/project/scan-merge/, scan-merge, 1.0.1, Tool to merge scanned PDFs from single sided document feeders, 2019-06-24T10:21:24+0000
/project/ptpy/, ptpy, 0.3.2, A pure Python implementation of Picture Transfer Protocol., 2017-12-19T10:21:34+0000
/project/spreads/, spreads, 0.4.1, Book digitization workflow assistant, 2013-12-25T22:39:05+0000
/project/twain/, twain, 1.0.5, TWAIN API for accessing scanners, cameras, etc on Windows, 2010-06-10T13:51:06+0000
/project/stereovision/, StereoVision, 1.0.4, Library and utilities for 3d reconstruction from stereo cameras., 2017-04-15T13:15:44+0000
/project/pytwain/, pytwain, 2.0, TWAIN API for accessing scanners, cameras, etc on Windows, 2013-05-18T04:09:40+0000
/project/surveillance-bot/, surveillance-bot, 1.0, Basic video surveillance system controlled through a telegram bot., 2020-06-16T18:06:28+0000
/project/d3dshot/, d3dshot, 0.1.5, Extremely Fast and Robust Screen Capture on Windows with the Desktop Duplication API, 2020-06-12T00:15:54+0000
/project/pixelinkwrapper/, pixelinkWrapper, 1.1.0, A Pixelink API Python wrapper for Pixelink cameras, 2021-01-07T21:13:44+0000
/project/pypcd/, pypcd, 0.1.1, Read and write PCL .pcd files in python., 2018-03-16T03:52:07+0000
/project/pydicamsdk/, pydicamsdk, 0.1.0, A wrapper for the pco sensicam/dicam SDK, 2015-09-02T15:10:59+0000
/project/pubgis/, PUBGIS, 0.2.12, PUBG Location Tracker, 2017-10-23T06:58:09+0000
/project/argus-gui/, argus-gui, 2.1.dev3, Tools for 3D camera calibration and reconstruction with graphical user interfaces, 2019-02-19T14:36:08+0000
/project/covidcharter/, covidcharter, 0.1, A package for charting covid in Virginia counties, 2020-05-02T20:12:26+0000
/project/strawpy/, strawpy, 1.1, Strawpy is a python wrapper for the strawpoll API., 2016-12-08T03:44:15+0000
/project/depthprojector/, DepthProjector, 1.0.4, DepthMap generator using Perspective Projection., 2016-03-07T03:28:22+0000
/project/pysentech/, pysentech, 0.2, pysentech is a python wrapper for the Sentech USB Camera SDK, 2017-02-28T06:54:10+0000
/project/save-thread-result/, save-thread-result, 0.0.6, Simple subclass wrapper around `threading.Thread` to get the return value from a thread in python (from `threading` built-in module in Python Standard library). Exact same interface for creating an instance of this threading sublcass as `threading.Thread`!, 2021-02-08T00:27:52+0000
/project/tiffany/, tiffany, 0.6.7, Tiffany -- read/write/arrange any multi-page Tiff, any compression, 2015-01-28T20:19:12+0000
/project/canvasvg/, canvasvg, 1.0.5, Save Tkinter Canvas in SVG file, 2017-02-16T10:01:38+0000
/project/pillow-scripts/, pillow-scripts, 5.0.0, Python Imaging Library (Fork) Scripts, 2018-01-01T21:24:39+0000
/project/pibooth-sound-effects/, pibooth-sound-effects, 0.0.3, , 2020-09-20T15:57:00+0000
/project/scansort/, scansort, 0.1, Scansort helps to collate and rename book scan images, 2016-12-07T19:46:57+0000
/project/argus/, argus, 0.0.11, Helper routines for using multiple, inexpensive calibrated and synchronized cameras for 3D scientific use., 2019-03-01T20:22:20+0000
/project/pykinect/, pykinect, 2.1, PyKinect Module for interacting with the Kinect SDK, 2014-08-11T16:14:24+0000
/project/eyefi/, eyefi, 0.2, EyeFi Server Framework, 2012-03-03T22:35:06+0000
/project/lolologist/, lolologist, 0.5.5, A utility that automatically generates an image macro from your webcam whenever you commit to a git repository., 2016-06-16T01:15:30+0000
/project/normcap/, normcap, 0.1.11, OCR-powered screen-capture tool to capture information instead of images, 2021-04-04T09:07:09+0000
/project/qscreencast/, QScreenCast, 0.1.32, A no-nonsense screen-caster behind a QToolButton., 2021-04-09T07:53:21+0000
/project/pymt/, PyMT, 0.5.1, A framework for making accelerated multitouch UI, 2010-09-06T21:04:31+0000
/project/insight/, insight, 0.140514, Make streaming of your Blender cameras, 2014-05-15T06:43:10+0000
/project/canon-remote/, canon-remote, 0.0.1, Use old Canon cameras with Python., 2012-01-31T02:14:16+0000
/project/paperwork/, paperwork, 2.0.2, Using scanner and OCR to grep dead trees the easy way, 2021-01-01T15:25:12+0000
/project/exifnaming/, EXIFnaming, 0.0.19, Tools for organizing and tagging photos, 2020-05-20T14:32:02+0000
/project/open3d/, open3d, 0.12.0, ['Open3D is an open-source library that supports rapid development of software that deals with 3D data.'], 2020-12-25T00:12:28+0000
/project/bcnc/, bCNC, 0.9.14.317, Swiss army knife for all your CNC/g-code needs, 2021-03-05T12:40:36+0000
/project/pypylon/, pypylon, 1.7.2, The python wrapper for the Basler pylon Camera Software Suite., 2021-03-03T12:57:18+0000
/project/picamera/, picamera, 1.13, A pure Python interface for the Raspberry Pi camera module., 2017-02-25T20:15:36+0000
/project/twitscreen/, twitscreen, 0.1, A simple screenshot utility that can crop images and upload them to Twitpic, 2009-07-01T07:05:33+0000
/project/locate-me/, locate-me, 0.0.7a, Python CLI tool that returns hidden GPS coordinates from photos and locates it on a google map, 2016-08-11T13:18:34+0000
/project/pillow/, Pillow, 8.2.0, Python Imaging Library (Fork), 2021-04-01T20:53:21+0000
/project/wscreenshot/, wscreenshot, 0.0.3, This package which helps you to take screenshot of specific running window, 2020-09-22T03:52:08+0000
/project/grab-screen/, grab-screen, 0.0.13, Take screenshots and upload anywhere, 2017-09-05T23:52:37+0000
/project/ambibulb/, ambibulb, 0.0.51, Python utility controls the color of RC lights based on the dominant color of an image on your screen., 2021-02-19T11:52:28+0000
/project/webkit2png/, webkit2png, 0.8.2, Takes snapshot of webpages using Webkit and Qt4, 2010-05-12T20:47:53+0000
/project/open3d-python/, open3d-python, 0.7.0.0, ['Open3D is an open-source library that supports rapid development of software that deals with 3D data.'], 2019-06-06T21:45:31+0000
/project/asciisciit/, asciisciit, 0.3.0, asciisciit is a Python toolbox for displaying and converting images, movies, and camera feeds into ascii., 2018-10-25T06:42:50+0000
/project/pyttygif/, pyttygif, 0.2.4, ttyrec to GIF converter, 2019-09-02T17:37:06+0000
/project/pyocr/, pyocr, 0.8, A Python wrapper for OCR engines (Tesseract, Cuneiform, etc), 2021-01-01T16:01:07+0000
/project/pyforms-web/, PyForms-Web, 4.2.0, Pyforms Web is Python 3 framework to create single-page web applications., 2020-01-03T10:30:19+0000
/project/pyinsane/, pyinsane, 1.4.0, Pure Python implementation of the Sane API (using ctypes) and abstration layer, 2016-07-27T12:14:40+0000
/project/pibooth-lcd-i2c/, pibooth-lcd-i2c, 1.0.0, Plugin to handle small LCD display., 2020-11-06T14:40:30+0000
/project/grabber/, grabber, 0.1.0, grabber: periodically grabs a picture of your screen, 2015-04-22T06:57:54+0000
/project/log-everywhere/, log-everywhere, 0.0.1, Logging package to enable writing all program information with corresponding datetime to multiple, DIFFERENT files safely when running multiple threads (multi-threading)., 2021-01-14T08:20:05+0000
/project/pymba/, pymba, 0.3.7, Pymba is a Python wrapper for Allied Vision's Vimba C API., 2020-06-16T06:00:19+0000
/project/cloudviewer/, cloudViewer, 0.3.7, ['cloudViewer is an open-source library that supports rapid development of software that deals with 3D data.'], 2020-12-16T05:46:07+0000
/project/tesserocr/, tesserocr, 2.5.1, A simple, Pillow-friendly, Python wrapper around tesseract-ocr API using Cython, 2020-03-17T17:45:44+0000
/project/pyinsane2/, pyinsane2, 2.0.13, Python library to access and use image scanners (Linux/Windows/etc), 2018-07-25T20:28:26+0000
/project/paperwork-shell/, paperwork-shell, 2.0.2, Paperwork's shell interface, 2021-01-01T15:24:45+0000
/project/django-manuscript/, django-manuscript, 0.3.1, Django application for managing rare book scanning/OCR projects, 2011-11-22T19:38:04+0000
/project/gphoto2/, gphoto2, 2.2.4, Python interface to libgphoto2, 2020-11-09T18:56:18+0000
/project/picamerab/, picamerab, 1.13b1, A pure Python interface for the Raspberry Pi camera module., 2020-07-28T18:40:02+0000
/project/picamerax/, picamerax, 20.9.1, A pure Python interface for the Raspberry Pi camera module, with extra features and fixes., 2020-09-07T15:12:57+0000
/project/blink2png/, blink2png, 0.9.3, To take snapshot of web pages using Blink Engine and Qt5, 2020-04-03T11:37:41+0000
/project/compoundpi/, compoundpi, 0.4, A project for controlling multiple Pi camera modules simultaneously, 2015-08-23T23:49:57+0000
/project/uncrumpled-kivy/, uncrumpled_kivy, 1.9.2.dev0, A software library for rapid development of hardware-accelerated multitouch applications., 2017-04-15T08:41:16+0000
/project/pylivestream/, pylivestream, 1.11.3, Livestream using FFmpeg to YouTube Live, Periscope, Facebook Live, Twitch, and many more, 2020-11-15T13:54:01+0000
/project/tesseract-ocr/, tesseract-ocr, 0.0.1, A Python wrapper for Tesseract, 2015-10-06T12:15:42+0000
/project/shot-detector/, shot-detector, 0.0.5.dev3, Python shot detector based on PyAV, 2016-08-30T19:04:19+0000
/project/omelette/, Omelette, 1.1.6, Python Imaging Library, 2010-10-18T20:14:21+0000
/project/picamera-mqtt/, picamera-mqtt, 0.0.5, MQTT-based control and image capture with local and remote networked Raspberry Pi cameras., 2018-12-16T14:42:58+0000
/project/pd9530/, pd9530, 1.0.3, Library to interact with a PD9530 handheld scanner, 2016-02-14T12:28:04+0000
/project/sba/, sba, 1.6.8, wrapper for Lourakis' sparse bundle adjustment C library, 2017-08-08T22:22:43+0000
/project/spyder-screencast/, spyder-screencast, 0.0.12, screencaster for spyder 5., 2021-04-17T09:12:26+0000
/project/kazam/, kazam, 1.5.5, A screencasting program created with design in mind., 2019-08-27T07:04:29+0000
/project/paperwork-backend/, paperwork-backend, 2.0.2, Paperwork's backend, 2021-01-01T15:24:35+0000
/project/twistedexiftool/, TwistedExiftool, 0.1.4, Discontinued, use txExiftool (https://pypi.python.org/pypi/txExiftool), 2016-01-16T23:09:29+0000
/project/castro/, castro, 1.0.6, Screencasting library, 2011-04-12T21:06:32+0000
/project/pibooth-extra-lights/, pibooth-extra-lights, 1.0.1, Pibooth plugin for extra lights management., 2020-10-11T17:36:45+0000
/project/pibooth-google-photo/, pibooth-google-photo, 1.0.2, Pibooth plugin for Google Photos upload., 2020-05-25T09:12:23+0000
/project/desktopmagic/, Desktopmagic, 14.3.11, Robust multi-monitor screenshot grabber (Windows-only right now), 2014-03-11T02:10:18+0000
/project/libsonyapi/, libsonyapi, 1.0, Python binding for Sony Camera API, 2020-08-22T19:26:36+0000
/project/exifproxy/, exifproxy, 1.0.1, Metadata extraction reverse proxy based on twisted and exiftool, 2020-11-22T12:05:26+0000
/project/flirextractor/, flirextractor, 1.0.2, An efficient GPLv3-licensed Python package for extracting temperature data from FLIR IRT images., 2020-08-09T23:13:57+0000
/project/kivy-jetson/, Kivy-jetson, 2.1.0.dev0, A software library for rapid development of hardware-accelerated multitouch applications., 2021-02-17T16:47:10+0000
/project/pillow-simd/, Pillow-SIMD, 7.0.0.post3, Python Imaging Library (Fork), 2020-01-26T14:30:27+0000
/project/python-sane/, python-sane, 2.9.1, This is the python-sane package, 2021-01-05T13:12:03+0000
/project/needle/, needle, 0.5.0, Automated testing for your CSS., 2017-04-02T23:28:24+0000
/project/m3-pil/, m3-PIL, 1.1.7, Python Imaging Library, 2014-09-23T16:40:43+0000
/project/iotccsdk/, iotccsdk, 0.1.4, SDK in Python for interacting with the Vision AI DevKit. See https://aka.ms/visionaidevkit, 2019-06-20T00:33:07+0000
/project/blink2png-bridge/, blink2png-bridge, 0.1.4, To via blink2png by Python directly., 2020-04-04T08:46:14+0000
/project/wrpclient/, wrpclient, 0.1, Workswell Remote Protocol Client, 2020-01-31T20:32:35+0000
/project/multical/, multical, 0.1.5, Flexible multi-camera multi-board camera calibration library and application., 2021-04-14T07:20:13+0000
/project/adf2pdf/, adf2pdf, 0.8.2, Automate the workflow around ADF scanning, OCR and PDF creation, 2020-12-06T17:40:36+0000
/project/asyncffmpeg/, asyncffmpeg, 1.0.1, Supports async / await pattern for FFmpeg operations., 2021-03-18T17:17:59+0000
/project/libzbar-ctypes/, libzbar-ctypes, 0.1.2, Python ctypes libzbar wrapper, 2017-05-19T11:38:48+0000
/project/ocrd-fork-tesserocr/, ocrd-fork-tesserocr, 3.0.0rc2, A simple, Pillow-friendly, Python wrapper around tesseract-ocr API using Cython, 2019-07-18T08:57:09+0000
/project/pibooth-qrcode/, pibooth-qrcode, 0.0.3, Pibooth plugin to display a QR Code on the screen during idle time., 2021-04-25T15:14:08+0000
/project/txexiftool/, txExiftool, 0.1.3, Exiftool protocol and stream endpoint plugin to be used with Twisted, 2016-01-16T22:47:58+0000
/project/simplecv/, SimpleCV, 1.3, Make Computers See with SimpleCV, the Python Framework for Machine Vision, 2012-08-10T20:42:41+0000
/project/picamip/, picamip, 1.1.1b0, Simple Raspberry Pi camera http server interface, 2020-10-02T18:05:00+0000
/project/smth/, smth, 0.8.0, Scan books and handwriting in batch mode from console, 2020-08-17T15:01:51+0000
/project/pxc200/, pxc200, 1.0, Adds support for the Imagenation PXC-200 frame grabber
to the Python Imaging Library, 2003-03-18T19:45:40+0000
/project/pyflycap2/, pyflycap2, 0.3.0, Cython bindings for Point Gray Fly Capture 2., 2019-11-15T01:54:50+0000
/project/pibooth-qrcode/, pibooth-qrcode, 0.0.3, Pibooth plugin to display a QR Code on the screen during idle time., 2021-04-25T15:14:08+0000
/project/ptpy/, ptpy, 0.3.2, A pure Python implementation of Picture Transfer Protocol., 2017-12-19T10:21:34+0000
/project/pibooth-picture-template/, pibooth-picture-template, 1.0.0, Pibooth plugin to customize the final picture layout using Flowchart Maker., 2020-11-14T15:54:10+0000
/project/mss/, mss, 6.1.0, An ultra fast cross-platform multiple screenshots module in pure python using ctypes., 2020-10-31T17:19:10+0000
/project/pywebcamwebservermonitor/, pyWebCamWebServerMonitor, 0.0.14, Webcam WebControl panel build with flask & vue to record / see live and other things designed for linux., 2021-02-16T14:17:05+0000
/project/hough/, hough, 0.2.6, Skew detection and correction in scanned images, 2020-11-12T21:54:06+0000
/project/bullseye/, bullseye, 0.1.1, laser beam profiler, 2012-03-05T00:15:40+0000
/project/imantics/, imantics, 0.1.12, Python package for managing image annotations, 2020-01-22T17:54:17+0000
/project/scan-merge/, scan-merge, 1.0.1, Tool to merge scanned PDFs from single sided document feeders, 2019-06-24T10:21:24+0000
/project/wificamera/, wificamera, 0.1.1, WifiCamera is a Python module for controlling the network camera CS-W07G-CY., 2012-03-04T08:51:11+0000
/project/hypershot/, hypershot, 0.3.1, Create screen shots of a video file, and upload them to an image host., 2017-06-18T16:47:49+0000
/project/shutter/, shutter, 0.0.7, ctypes interface for libgphoto2, 2014-08-16T04:05:52+0000
/project/pibooth/, pibooth, 2.0.1, A photo booth application in pure Python for the Raspberry Pi., 2020-09-23T21:14:46+0000
/project/picamraw/, picamraw, 1.2.64, Library for extracting raw bayer data from a Raspberry Pi JPEG+RAW file, 2018-12-20T00:33:28+0000
/project/spreads/, spreads, 0.4.1, Book digitization workflow assistant, 2013-12-25T22:39:05+0000
/project/stereovision/, StereoVision, 1.0.4, Library and utilities for 3d reconstruction from stereo cameras., 2017-04-15T13:15:44+0000
/project/normcap/, normcap, 0.1.11, OCR-powered screen-capture tool to capture information instead of images, 2021-04-04T09:07:09+0000
/project/qscreencast/, QScreenCast, 0.1.34, A no-nonsense screen-caster behind a QToolButton., 2021-04-25T08:52:26+0000
/project/pymt/, PyMT, 0.5.1, A framework for making accelerated multitouch UI, 2010-09-06T21:04:31+0000
/project/insight/, insight, 0.140514, Make streaming of your Blender cameras, 2014-05-15T06:43:10+0000
/project/canon-remote/, canon-remote, 0.0.1, Use old Canon cameras with Python., 2012-01-31T02:14:16+0000
/project/surveillance-bot/, surveillance-bot, 1.0, Basic video surveillance system controlled through a telegram bot., 2020-06-16T18:06:28+0000
/project/d3dshot/, d3dshot, 0.1.5, Extremely Fast and Robust Screen Capture on Windows with the Desktop Duplication API, 2020-06-12T00:15:54+0000
/project/pixelinkwrapper/, pixelinkWrapper, 1.1.0, A Pixelink API Python wrapper for Pixelink cameras, 2021-01-07T21:13:44+0000
/project/paperwork/, paperwork, 2.0.2, Using scanner and OCR to grep dead trees the easy way, 2021-01-01T15:25:12+0000
/project/pypcd/, pypcd, 0.1.1, Read and write PCL .pcd files in python., 2018-03-16T03:52:07+0000
/project/pydicamsdk/, pydicamsdk, 0.1.0, A wrapper for the pco sensicam/dicam SDK, 2015-09-02T15:10:59+0000
/project/pubgis/, PUBGIS, 0.2.12, PUBG Location Tracker, 2017-10-23T06:58:09+0000
/project/exifnaming/, EXIFnaming, 0.0.19, Tools for organizing and tagging photos, 2020-05-20T14:32:02+0000
/project/open3d/, open3d, 0.12.0, ['Open3D is an open-source library that supports rapid development of software that deals with 3D data.'], 2020-12-25T00:12:28+0000
/project/bcnc/, bCNC, 0.9.14.317, Swiss army knife for all your CNC/g-code needs, 2021-03-05T12:40:36+0000
/project/pypylon/, pypylon, 1.7.2, The python wrapper for the Basler pylon Camera Software Suite., 2021-03-03T12:57:18+0000
/project/depthprojector/, DepthProjector, 1.0.4, DepthMap generator using Perspective Projection., 2016-03-07T03:28:22+0000
/project/tiffany/, tiffany, 0.6.7, Tiffany -- read/write/arrange any multi-page Tiff, any compression, 2015-01-28T20:19:12+0000
/project/canvasvg/, canvasvg, 1.0.5, Save Tkinter Canvas in SVG file, 2017-02-16T10:01:38+0000
/project/picamera/, picamera, 1.13, A pure Python interface for the Raspberry Pi camera module., 2017-02-25T20:15:36+0000
/project/twitscreen/, twitscreen, 0.1, A simple screenshot utility that can crop images and upload them to Twitpic, 2009-07-01T07:05:33+0000
/project/locate-me/, locate-me, 0.0.7a, Python CLI tool that returns hidden GPS coordinates from photos and locates it on a google map, 2016-08-11T13:18:34+0000
/project/pillow/, Pillow, 8.2.0, Python Imaging Library (Fork), 2021-04-01T20:53:21+0000
/project/pyttygif/, pyttygif, 0.2.4, ttyrec to GIF converter, 2019-09-02T17:37:06+0000
/project/twain/, twain, 1.0.5, TWAIN API for accessing scanners, cameras, etc on Windows, 2010-06-10T13:51:06+0000
/project/pykinect/, pykinect, 2.1, PyKinect Module for interacting with the Kinect SDK, 2014-08-11T16:14:24+0000
/project/eyefi/, eyefi, 0.2, EyeFi Server Framework, 2012-03-03T22:35:06+0000
/project/lolologist/, lolologist, 0.5.5, A utility that automatically generates an image macro from your webcam whenever you commit to a git repository., 2016-06-16T01:15:30+0000
/project/pytwain/, pytwain, 2.0, TWAIN API for accessing scanners, cameras, etc on Windows, 2013-05-18T04:09:40+0000
/project/argus-gui/, argus-gui, 2.1.dev3, Tools for 3D camera calibration and reconstruction with graphical user interfaces, 2019-02-19T14:36:08+0000
/project/covidcharter/, covidcharter, 0.1, A package for charting covid in Virginia counties, 2020-05-02T20:12:26+0000
/project/strawpy/, strawpy, 1.1, Strawpy is a python wrapper for the strawpoll API., 2016-12-08T03:44:15+0000
/project/pysentech/, pysentech, 0.2, pysentech is a python wrapper for the Sentech USB Camera SDK, 2017-02-28T06:54:10+0000
/project/save-thread-result/, save-thread-result, 0.0.6, Simple subclass wrapper around `threading.Thread` to get the return value from a thread in python (from `threading` built-in module in Python Standard library). Exact same interface for creating an instance of this threading sublcass as `threading.Thread`!, 2021-02-08T00:27:52+0000
/project/wscreenshot/, wscreenshot, 0.0.3, This package which helps you to take screenshot of specific running window, 2020-09-22T03:52:08+0000
/project/grab-screen/, grab-screen, 0.0.13, Take screenshots and upload anywhere, 2017-09-05T23:52:37+0000
/project/ambibulb/, ambibulb, 0.0.51, Python utility controls the color of RC lights based on the dominant color of an image on your screen., 2021-02-19T11:52:28+0000
/project/pillow-scripts/, pillow-scripts, 5.0.0, Python Imaging Library (Fork) Scripts, 2018-01-01T21:24:39+0000
/project/pibooth-sound-effects/, pibooth-sound-effects, 0.0.3, , 2020-09-20T15:57:00+0000
/project/webkit2png/, webkit2png, 0.8.2, Takes snapshot of webpages using Webkit and Qt4, 2010-05-12T20:47:53+0000
/project/scansort/, scansort, 0.1, Scansort helps to collate and rename book scan images, 2016-12-07T19:46:57+0000
/project/argus/, argus, 0.0.11, Helper routines for using multiple, inexpensive calibrated and synchronized cameras for 3D scientific use., 2019-03-01T20:22:20+0000
/project/open3d-python/, open3d-python, 0.7.0.0, ['Open3D is an open-source library that supports rapid development of software that deals with 3D data.'], 2019-06-06T21:45:31+0000
/project/asciisciit/, asciisciit, 0.3.0, asciisciit is a Python toolbox for displaying and converting images, movies, and camera feeds into ascii., 2018-10-25T06:42:50+0000
/project/pyocr/, pyocr, 0.8, A Python wrapper for OCR engines (Tesseract, Cuneiform, etc), 2021-01-01T16:01:07+0000
/project/pyforms-web/, PyForms-Web, 4.2.0, Pyforms Web is Python 3 framework to create single-page web applications., 2020-01-03T10:30:19+0000
/project/multical/, multical, 0.1.5, Flexible multi-camera multi-board camera calibration library and application., 2021-04-14T07:20:13+0000
/project/adf2pdf/, adf2pdf, 0.8.2, Automate the workflow around ADF scanning, OCR and PDF creation, 2020-12-06T17:40:36+0000
/project/asyncffmpeg/, asyncffmpeg, 1.0.1, Supports async / await pattern for FFmpeg operations., 2021-03-18T17:17:59+0000
/project/pillow-simd/, Pillow-SIMD, 7.0.0.post3, Python Imaging Library (Fork), 2020-01-26T14:30:27+0000
/project/kazam/, kazam, 1.5.5, A screencasting program created with design in mind., 2019-08-27T07:04:29+0000
/project/picamerax/, picamerax, 20.9.1, A pure Python interface for the Raspberry Pi camera module, with extra features and fixes., 2020-09-07T15:12:57+0000
/project/blink2png/, blink2png, 0.9.3, To take snapshot of web pages using Blink Engine and Qt5, 2020-04-03T11:37:41+0000
/project/compoundpi/, compoundpi, 0.4, A project for controlling multiple Pi camera modules simultaneously, 2015-08-23T23:49:57+0000
/project/uncrumpled-kivy/, uncrumpled_kivy, 1.9.2.dev0, A software library for rapid development of hardware-accelerated multitouch applications., 2017-04-15T08:41:16+0000
/project/pylivestream/, pylivestream, 1.11.3, Livestream using FFmpeg to YouTube Live, Periscope, Facebook Live, Twitch, and many more, 2020-11-15T13:54:01+0000
/project/tesseract-ocr/, tesseract-ocr, 0.0.1, A Python wrapper for Tesseract, 2015-10-06T12:15:42+0000
/project/picamera-mqtt/, picamera-mqtt, 0.0.5, MQTT-based control and image capture with local and remote networked Raspberry Pi cameras., 2018-12-16T14:42:58+0000
/project/picamerax/, picamerax, 20.9.1, A pure Python interface for the Raspberry Pi camera module, with extra features and fixes., 2020-09-07T15:12:57+0000
/project/blink2png/, blink2png, 0.9.3, To take snapshot of web pages using Blink Engine and Qt5, 2020-04-03T11:37:41+0000
/project/compoundpi/, compoundpi, 0.4, A project for controlling multiple Pi camera modules simultaneously, 2015-08-23T23:49:57+0000
/project/uncrumpled-kivy/, uncrumpled_kivy, 1.9.2.dev0, A software library for rapid development of hardware-accelerated multitouch applications., 2017-04-15T08:41:16+0000
/project/pylivestream/, pylivestream, 1.11.3, Livestream using FFmpeg to YouTube Live, Periscope, Facebook Live, Twitch, and many more, 2020-11-15T13:54:01+0000
/project/tesseract-ocr/, tesseract-ocr, 0.0.1, A Python wrapper for Tesseract, 2015-10-06T12:15:42+0000
