/project/myremotedump/, myremotedump, 0.1.0, Dumps a firewalled MySQL database via a ssh tunnel to the remote system, 2013-12-13T14:58:53+0000
/project/pkgdiff/, pkgdiff, 0.1, Compare FreeBSD pkg files by metadata., 2020-12-01T15:19:49+0000
/project/sap-py-jwt/, sap-py-jwt, 1.5.0, SAP CP Security Client Library for JWT offline validation, 2019-07-09T21:40:18+0000
/project/djt-og/, djt-og, 0.9.6, Panel for Django-debug-toolbar that displays OpenGraph metadata found in your HTML page., 2020-11-24T15:33:03+0000
/project/freezer/, freezer, 10.0.0, The OpenStack Backup Restore and Disaster Recovery as a Service Platform, 2021-04-14T11:03:37+0000
/project/oneid-connect/, oneID-connect, 0.21.1, Neustar TDI is an identity & authentication framework for the Internet of Things (IoT) devices, servers, and end-users., 2017-10-17T20:28:53+0000
/project/confset/, confset, 0.1.0, A simple script to change or update package configurations, 2020-05-08T21:30:10+0000
/project/raisin/, raisin, 0.0.23, Simple parallel, distributed and cluster computing, 2021-04-24T10:58:04+0000
/project/hark-builder/, hark-builder, 1.0.0.dev6, tool to build hark images, 2016-07-24T06:52:11+0000
/project/fpi/, fpi, 0.1.1, Fluid-particle Interaction component of Chemical Engineering Design Library (ChEDL), 2016-04-04T02:56:58+0000
/project/inventicode/, Inventicode, 1.0.2, Create labels with QR and barcodes., 2017-02-26T22:33:24+0000
/project/pyqtenumconverter/, PyQtEnumConverter, 1.0, Converts enums from PyQt5 to PyQt6, 2021-03-15T13:55:26+0000
/project/wenv/, wenv, 0.2.1, Running Python on Wine, 2020-07-10T17:59:06+0000
/project/ocrmypdf/, ocrmypdf, 12.0.0, OCRmyPDF adds an OCR text layer to scanned PDF files, allowing them to be searched, 2021-04-23T07:40:28+0000
/project/openbsd/, openbsd, 0.1.0, OpenBSD Library, 2019-05-02T23:40:14+0000
/project/simplewebdavclient/, simplewebdavclient, 1.0.2, This is a library used to make WebDav Client Connections simple., 2020-04-30T19:43:56+0000
/project/biosteam/, biosteam, 2.27.7, The Biorefinery Simulation and Techno-Economic Analysis Modules, 2021-04-15T05:25:54+0000
/project/setupdocx/, setupdocx, 0.1.22, Support of documentation commands and extensions for setuptools / distutils., 2019-12-11T08:43:33+0000
/project/filegardener/, filegardener, 1.6.9, filegardener file utilities dedup, only file copy detection, empty dir detection, 2017-04-02T00:12:35+0000
/project/bw2qsd/, bw2qsd, 0.0.10, Bridging Brightway2 and QSD packages for LCA, 2021-04-20T17:31:01+0000
/project/passweb/, passweb, 0.0.1, Secure Password (Web) Manager, 2013-09-01T12:12:54+0000
/project/python-dbusmock/, python-dbusmock, 0.23.0, Mock D-Bus objects, 2021-03-24T18:39:18+0000
/project/jdtextedit/, jdTextEdit, 8.3, A powerful texteditor with a lot of features, 2021-02-28T19:37:01+0000
/project/trio-asyncio/, trio-asyncio, 0.12.0, A re-implementation of the asyncio mainloop on top of Trio, 2021-01-08T00:57:52+0000
/project/ffmpy/, ffmpy, 0.3.0, A simple Python wrapper for ffmpeg, 2021-01-13T11:55:47+0000
/project/setproctitle/, setproctitle, 1.2.2, A Python module to customize the process title, 2021-01-23T03:52:02+0000
/project/zsm/, zsm, 0.2.1, ZFS Snapshot Manager, 2021-01-24T23:21:06+0000
/project/fluids/, fluids, 1.0.5, Fluid dynamics component of Chemical Engineering Design Library (ChEDL), 2021-04-22T02:13:17+0000
/project/pythonids/, pythonids, 0.1.40, The 'pythonids' package provides the identification and enumeration of Python syntax and implementation., 2019-12-19T05:50:36+0000
/project/command-runner/, command-runner, 0.6.3, Platform agnostic command and shell execution tool, also allows UAC/sudo privilege elevation, 2021-03-15T15:28:07+0000
/project/cpuid-py/, cpuid-py, 0.0.1, cpuid Pythonic API, 2017-10-18T13:46:39+0000
/project/repomirror/, repomirror, 1.0.4, Clone/mirror multiple Linux distro/BSD flavor/etc. repositories to a local server, 2020-07-07T17:33:39+0000
/project/ofunctions-mailer/, ofunctions.mailer, 0.3.5, Mail sending function that handles encryption, authentication, bulk and split mail sending, 2021-02-11T01:10:18+0000
/project/scriptharness/, scriptharness, 0.2.0, A generic logging, configuration, and workflow framework for scripts., 2015-06-21T07:20:09+0000
/project/moin/, moin, 1.9.11, MoinMoin 1.9.11 is an easy to use, full-featured and extensible wiki software package, 2020-11-08T17:42:48+0000
/project/dyndnsc-growl/, dyndnsc-growl, 0.1, plugin for dyndnsc providing growl desktop notifications, 2018-01-14T19:42:18+0000
/project/python-powerdns/, python-powerdns, 0.2.1, PowerDNS web api python client and interface, 2018-06-19T13:22:37+0000
/project/sasspython/, SassPython, 0.2.1, binding for libsass, 2012-08-08T08:02:26+0000
/project/watchdog/, watchdog, 2.0.3, Filesystem events monitoring, 2021-04-22T17:57:30+0000
/project/ofunctions-checksums/, ofunctions.checksums, 0.2.1, SHA256 Checksumming functions, checksum manifest file creation and verification, 2021-02-11T01:10:12+0000
/project/ssh2-python/, ssh2-python, 0.26.0, Super fast SSH library - bindings for libssh2, 2021-01-02T21:30:02+0000
/project/troposphere/, troposphere, 2.7.1, AWS CloudFormation creation library, 2021-04-16T18:26:32+0000
/project/botskeleton/, botskeleton, 3.3.6, A skeleton for content bots., 2019-07-03T04:55:42+0000
/project/chemicals/, chemicals, 1.0.5, Chemical properties component of Chemical Engineering Design Library (ChEDL), 2021-04-25T17:42:59+0000
/project/yatfs/, yatfs, 0.4.0, FUSE-based torrent-backed filesystem, 2018-02-01T09:39:13+0000
/project/pymailq/, pymailq, 0.9.0, Postfix queue control python tool, 2017-09-07T11:29:36+0000
/project/hb/, hb, 1.4.2, A simple command-line utility for calculating checksums., 2018-11-03T05:06:35+0000
/project/inary/, inary, 1.4.2-1, Inary (Special Package Manager), 2020-11-01T17:55:55+0000
/project/updoc/, updoc, 1.9.7, Upload HTML documentations and share bookmarks, 2018-02-04T14:11:41+0000
/project/inparallel/, inparallel, 1.0.3, A novel take on process-based parallelism in Python (CPython 2.7 or 3.4+), 2017-01-06T15:12:15+0000
/project/homer/, homer, 0.2.7, Configuration manager for network devices, 2021-04-20T13:32:41+0000
/project/namedtupledefs2/, namedtupledefs2, 0.1.21, Extended 'namedtuple' by default values., 2019-12-13T12:31:13+0000
/project/qtile/, qtile, 0.17.0, A pure-Python tiling window manager., 2021-02-13T18:46:35+0000
/project/ofunctions-bisection/, ofunctions.bisection, 0.2.1, Bisection function that allows callable to be tested with any list of arguments, 2021-02-11T01:10:11+0000
/project/readme/, readme, 0.7.1, readme is a library for rendering "readme" descriptions for Warehouse, 2016-01-05T09:24:35+0000
/project/aifashion-sdk/, aifashion-sdk, 1.2.0, AIFashion® Python SDK, 2019-07-18T07:39:51+0000
/project/bitprim/, bitprim, 1.1.94, Bitcoin development platform, 2018-08-08T13:17:36+0000
/project/autodock-logger/, autodock-logger, 0.0.2, autodock logger plugin, 2015-12-26T04:46:00+0000
/project/minecraft-launcher-lib/, minecraft-launcher-lib, 2.1, A library for creating a custom Minecraft launcher, 2020-07-13T20:23:32+0000
/project/ofunctions-misc/, ofunctions.misc, 1.0.0, Collection of various functions, 2021-02-11T01:10:19+0000
/project/wikilink/, wikilink, 0.3.0.post1, A multiprocessing web-scraping application to scrape wiki pages and find minimum number of links between two given wiki pages., 2019-03-30T14:24:35+0000
/project/kvpio-python/, kvpio-python, 0.2.0, Official kvp.io python bindings and client, 2016-06-06T14:56:33+0000
/project/dato-predictive-service-client/, dato-predictive-service-client, 1.0.0, Dato Predictive Service Client makes it easy to make REST API calls to Dato Predictive Services, 2015-05-19T00:12:17+0000
/project/libzt/, libzt, 1.3.4b1, ZeroTier, 2021-03-18T01:15:49+0000
/project/yapydata/, yapydata, 0.1.40, The 'yapydata provides miscellaneous low-level *Python* data access APIs., 2019-12-13T09:48:02+0000
/project/pyonedesk/, pyonedesk, 0.0.30, PyOneDesk, 2019-08-01T14:38:31+0000
/project/flutils/, flutils, 0.7, A collection of commonly used utility functions for Python projects., 2020-07-23T17:06:11+0000
/project/sequencetools/, sequencetools, 0.0.7, sequencetools -- A package for FASTX stats generation and manipulation, 2020-02-07T20:25:50+0000
/project/cdist/, cdist, 6.9.6, A Usable Configuration Management System, 2021-04-20T05:36:01+0000
/project/pysha3/, pysha3, 1.0.2, SHA-3 (Keccak) for Python 2.7 - 3.5, 2017-02-05T16:42:07+0000
/project/wiredtiger/, wiredtiger, 10.0.0, high performance, scalable, production quality, NoSQL, Open Source extensible platform for data management, 2021-04-12T04:11:41+0000
/project/rainbow-logging-handler/, rainbow_logging_handler, 2.2.2, Ultimate Python colorized logger with user-custom color, 2014-08-06T23:43:19+0000
/project/pydica-watchdog/, pydica-watchdog, 0.6.2, Native and Virtual Filesystem Events Monitoring, 2013-07-25T12:52:41+0000
/project/jdaptdirreinstall/, jdAptDirReinstall, 1.0, Reinstall all packages that have files in a directory, 2019-11-13T16:33:56+0000
/project/meinheld/, meinheld, 1.0.2, High performance asynchronous Python WSGI Web Server, 2020-05-17T13:09:14+0000
/project/suext/, suext, 0.0.3, Utility for showing any file extension and MIME type info. Support show files information in a directory as list or table., 2020-04-01T07:41:01+0000
/project/libspg/, libspg, 0.2, Python library for interacting with Brazil NPAC SPG, 2015-06-15T01:36:51+0000
/project/openvas-lib/, openvas-lib, 1.1.8, OpenVAS Manager for OpenVAS 6 to 8 and XML report parser, 2019-06-27T08:57:31+0000
/project/wpyscan/, wpyscan, 1.0.1, Wordpress pentest tool, 2018-12-02T15:56:28+0000
/project/pthat/, pthat, 1.0.1, A package containing the API for the PTHat by CNC Design Limited, 2020-12-01T01:35:06+0000
/project/autodock/, autodock, 0.0.2, Daemon for Docker Automation, 2015-12-26T04:28:17+0000
/project/twine-verify-upload/, twine-verify-upload, 0.0.3, Adds "verify-upload" command to twine., 2020-08-15T23:11:48+0000
/project/pfweb/, pfweb, 0.1.0.dev4, Simple web interface for the OpenBSD Packet Filter, 2016-12-10T23:22:02+0000
/project/smersh-cli/, smersh-cli, 0.1.dev1, A SMERSH command-line client, 2021-03-08T13:02:17+0000
/project/simple-monitor-alert/, simple-monitor-alert, 0.2.4, A simple monitor with alerts for Unix/Linux under the KISS philosophy. Keep It Simple, Stupid!, 2016-06-07T14:31:21+0000
/project/mod-wsgi-httpd/, mod-wsgi-httpd, 2.4.46.1, Installer for Apache httpd server., 2020-10-31T09:33:55+0000
/project/log-everywhere/, log-everywhere, 0.0.1, Logging package to enable writing all program information with corresponding datetime to multiple, DIFFERENT files safely when running multiple threads (multi-threading)., 2021-01-14T08:20:05+0000
/project/dongbei-lang/, dongbei-lang, 0.0.6, Programming language based on Dongbei dialect, 2020-02-29T23:00:39+0000
/project/serviceping/, serviceping, 20.3.174593, A command line utility that provides a ping like interface for checking tcp/ssl ports and services, 2020-03-13T15:24:26+0000
/project/calmjs-sassy/, calmjs.sassy, 1.0.2, Package for extending the Calmjs framework to support the usage of sass in a manner that crosses Python package boundaries by exposing an import system that mimics the package namespaces available within a given Python environment., 2020-04-23T10:14:52+0000
/project/name-of-thrones/, name-of-thrones, 0.2.7, Command line tool to generate words that sound like characters from Game of Thrones. Good for naming projects, servers and stray cats., 2016-03-04T21:28:55+0000
/project/proxmox-deploy/, proxmox-deploy, 0.4.0, proxmox-deploy is cli-based deployment tool for Proxmox, 2017-11-05T13:18:55+0000
/project/phylotoast/, phylotoast, 1.3.0, Tools for phylogenetic data analysis including visualization and cluster-computing support., 2016-02-25T22:01:33+0000
/project/foremon/, foremon, 1.3.0, Automatically restart applications when file changes are detected., 2021-02-22T02:43:40+0000
/project/accelerator/, accelerator, 2021.4.1.dev1, A tool for fast and reproducible processing of large amounts of data., 2021-04-01T18:54:36+0000
/project/redexpect/, redexpect, 2.0.3.post3, An SSH automation library using expect., 2019-11-23T16:57:58+0000
/project/npm-accel/, npm-accel, 2.0.1, Accelerator for npm, the Node.js package manager, 2020-09-17T12:35:34+0000
/project/fanery/, Fanery, 0.2.5, Application development framework, 2014-11-18T12:15:28+0000
/project/idem-bsd/, idem-bsd, 4.2, Vertical app merge components for Idem and grains support on BSD, 2020-09-14T17:17:28+0000
/project/tzolkin-calendar/, tzolkin-calendar, 1.0.0, Program to calculate and convert Tzolk’in/Maya calendar dates., 2021-03-25T17:27:52+0000
/project/graphlab-service-client/, GraphLab-Service-Client, 1.3.0, GraphLab Service Client makes it easy to make REST API calls to GraphLab Predictive Services, 2015-02-27T01:00:09+0000
/project/hark-imagestore/, hark-imagestore, 1.0.0.dev4, image store service for the hark tool, 2016-07-24T06:47:28+0000
/project/ofunctions-platform/, ofunctions.platform, 1.0.1, Very basic platform identification, 2021-03-30T14:02:36+0000
/project/zfslib/, zfslib, 0.9, ZFS Python Library, 2021-01-02T05:04:21+0000
/project/pysed/, pysed, 0.7.8, CLI utility that parses and transforms text, 2015-07-03T20:03:34+0000
/project/daemonocle/, daemonocle, 1.2.3, A Python library for creating super fancy Unix daemons, 2021-04-23T03:46:00+0000
/project/faust-streaming/, faust-streaming, 0.6.3, Python Stream processing., 2021-04-06T15:07:05+0000
/project/pytgram/, pytgram, 0.0.7, Library to create Telegram Bot based on Twisted, 2018-02-01T20:07:14+0000
/project/gphoto2/, gphoto2, 2.2.4, Python interface to libgphoto2, 2020-11-09T18:56:18+0000
/project/yapyutils/, yapyutils, 0.1.38, The 'yapyutils' package provides miscellaneous low-level Python utilities., 2019-12-18T12:43:17+0000
/project/fogbugz/, fogbugz, 1.0.6, Python library for interacting with the FogBugz API, 2016-11-01T14:47:06+0000
/project/passme/, passme, 1.2.0, Password management with command line, 2020-09-16T16:38:45+0000
/project/gpxconverter/, gpxconverter, 0.9.4, gpx to csv converter. it supports waypoint elements except extensions. Values in extensions will be ignored., 2018-01-19T06:34:42+0000
/project/scrap2rst/, scrap2rst, 0.3.0, Converting scrapbox syntax into reStructuredText, 2019-09-26T00:21:34+0000
/project/xntool/, xntool, 0.8.2, funny tools, 2017-02-15T02:06:09+0000
/project/sysv-ipc/, sysv-ipc, 1.1.0, System V IPC primitives (semaphores, shared memory and message queues) for Python, 2021-01-17T19:07:39+0000
/project/setuplib/, setuplib, 0.1.14, Support library functions for extensions and entry points of setuptools / distutils., 2019-12-13T09:54:07+0000
/project/pyngrok/, pyngrok, 5.0.5, A Python wrapper for ngrok., 2021-03-26T01:04:59+0000
/project/calmjs/, calmjs, 3.4.1, A Python framework for building toolchains and utilities for working with the Node.js ecosystem from within a Python environment., 2019-05-23T06:39:53+0000
/project/octadist/, octadist, 3.0.0, OctaDist: A tool for calculating distortion parameters in molecule., 2021-03-08T22:52:18+0000
/project/bbarchivist/, bbarchivist, 4.0.0, BlackBerry OS tools, in Pythons, 2019-09-02T14:02:06+0000
/project/pretty-bad-protocol/, pretty-bad-protocol, 3.1.1, A Python wrapper for GnuPG, 2018-08-01T21:07:12+0000
/project/select-backport/, select_backport, 0.2, Backport of the new select module with epoll and kqueue interface, 2010-11-28T00:39:53+0000
/project/anyks-lm/, anyks-lm, 3.4.9, Smart language model, 2020-09-20T11:29:41+0000
/project/moneta/, moneta, 1.8.11, Emulator for different kinds (Debian/Yum/Pypi/Maven/…) of package repositories on the same server., 2018-02-04T14:09:51+0000
/project/setuptestx/, setuptestx, 0.1.46, Support test automation for setuptools / distutils., 2019-12-13T13:34:05+0000
/project/tmuxomatic/, tmuxomatic, 2.18, Intelligent tmux session management ... #tmux, 2015-07-03T20:24:01+0000
/project/python-pylls/, python-pylls, 0.9.4, Python library to interface Cachet API (cachethq.io), 2017-07-26T15:57:43+0000
/project/cam/, cam, 0.3.1, Collection of utilities for C/C++ archive (lib and app) build, 2018-05-18T06:25:49+0000
/project/pyastyle/, pyastyle, 1.1.5, Python wrapper extension for Artistic Style, 2015-02-23T10:56:15+0000
/project/projector-installer/, projector-installer, 1.1.3, Install, configure and run JetBrains IDEs with Projector Server on Linux or in WSL, 2021-04-20T11:20:10+0000
/project/uncrumpled-kivy/, uncrumpled_kivy, 1.9.2.dev0, A software library for rapid development of hardware-accelerated multitouch applications., 2017-04-15T08:41:16+0000
/project/tqdm-conan/, tqdm-conan, 4.27.0, Temporary fork of tqdmFast, Extensible Progress Meter, 2018-10-18T13:49:59+0000
/project/ofunctions-delayed-keyboardinterrupt/, ofunctions.delayed-keyboardinterrupt, 0.1.0, Intercept CTRL+C signal in your Python code, 2021-02-11T01:10:13+0000
/project/vivarium/, vivarium, 0.10.1, vivarium is a microsimulation framework built on top of the standard scientific python stack., 2020-12-24T18:41:27+0000
/project/musdk/, musdk, 0.0.7, ss-panel mu api sdk for python, 2016-12-17T13:51:08+0000
/project/xattr/, xattr, 0.9.7, Python wrapper for extended filesystem attributes, 2019-12-02T22:37:23+0000
/project/package-index/, package-index, 1.0.0rc0, Dataclasses API for PyPI and other warehouses., 2019-09-19T16:28:12+0000
/project/watchdog-lite/, watchdog-lite, 0.0.1, Filesystem events monitoring, 2017-02-10T18:50:17+0000
/project/hypatia-engine/, hypatia_engine, 0.3.6, 2D action adventure game engine, 2015-12-06T02:55:12+0000
/project/cryptography/, cryptography, 3.4.7, cryptography is a package which provides cryptographic recipes and primitives to Python developers., 2021-03-25T17:31:04+0000
/project/pylibacl/, pylibacl, 0.6.0, POSIX.1e ACLs for python, 2020-11-29T01:49:44+0000
/project/pytil/, pytil, 7.0.0, Python 3 utility library, 2018-01-08T16:56:58+0000
/project/distro/, distro, 1.5.0, Distro - an OS platform information API, 2020-03-30T21:22:46+0000
/project/djangofloor/, djangofloor, 1.2.11, Simple configuration management and websockets with Django., 2020-08-29T17:46:03+0000
/project/ofunctions-random/, ofunctions.random, 0.1.1, Simple random string generator including password generator, 2021-02-11T01:10:24+0000
/project/pykmip/, PyKMIP, 0.10.0, KMIP library, 2020-02-25T16:28:52+0000
/project/sqlantaresia/, SQLAntaresia, 0.4.2, Cross platform MySQL management tools aimed at both developers and system administrators, 2012-04-03T09:10:19+0000
/project/encviewfuse/, encviewfuse, 0.3.0.post1, A fuse implementation of an encrypted view on a given directory., 2015-12-13T19:56:16+0000
/project/pyhexedit/, pyhexedit, 1.0.0, Hex Editor, 2021-03-06T14:38:13+0000
/project/meerk/, meerk, 0.3.1, , 2018-11-07T10:25:32+0000
/project/dlipower/, dlipower, 1.0.176, Control digital loggers web power switch, 2018-06-16T07:34:24+0000
/project/cepko/, cepko, 1.0.1, Communication with CloudSigma's VMs through a virtual serial port, 2014-03-17T10:44:22+0000
/project/qgitc/, qgitc, 3.3.2, A file conflict viewer for git, 2021-04-18T01:15:55+0000
/project/taskforce/, taskforce, 0.6.0, Taskforce starts and restarts daemon processes.  It will detect executable and/or module changes and automatically restart the affected processes., 2020-08-13T19:13:49+0000
/project/termtosvg/, termtosvg, 1.1.0, Record terminal sessions as SVG animations, 2020-01-18T20:09:17+0000
/project/wikimedia-spicerack/, wikimedia-spicerack, 0.0.49, Automation framework for the WMF production infrastructure, 2021-03-04T13:45:19+0000
/project/argopt/, argopt, 0.7.0, doc to argparse driven by docopt, 2021-03-01T16:51:30+0000
/project/ooniprobe/, ooniprobe, 2.3.0, Network measurement tool foridentifying traffic manipulation and blocking., 2018-02-14T09:14:22+0000
/project/pyramidueditor/, pyramidueditor, 1.0.1, A Pyramid application for Baidu Ueditor., 2015-06-05T09:52:25+0000
/project/dropstar/, dropstar, 2010.10.14.0, dropSTAR: Drop Scripts, Templates and RPC.  A stand-alone HTTP server for mixing dynamic and static content with RPC calls.  Focused on system administration and automation tasks., 2010-10-14T18:22:11+0000
/project/theonionbox/, theonionbox, 20.2, The Onion Box: Dashboard to monitor Tor node operations., 2020-01-19T16:46:06+0000
/project/opencanary/, opencanary, 0.6.1, OpenCanary daemon, 2021-03-30T13:07:18+0000
/project/df-config/, df-config, 0.9.38, Smart default settings for Django websites, 2021-04-19T06:09:18+0000
/project/ecs-pipeline-deploy/, ecs-pipeline-deploy, 0.5.1, An opinionated deployment application for ECS services, 2020-09-10T23:08:27+0000
/project/python-openzwave/, python-openzwave, 0.4.19, python_openzwave is a python wrapper for the openzwave c++ library., 2019-03-20T10:06:12+0000
/project/autotorrent/, autotorrent, 1.7.1, AutoTorrent allows easy cross-seeding, 2019-12-30T20:59:14+0000
/project/pymmbfuse/, pymmbfuse, 0.7.4, Fuse driver for BBC Microcomputer DFS disk images and MMB disk bundles, 2020-05-11T17:10:58+0000
/project/za-id-number/, za-id-number, 0.0.3, Library South African ID number validation and easy data extraction., 2021-01-20T17:25:10+0000
/project/py-rbac/, py-rbac, 20.12.3, Python implementation of the NIST model for role based access control (RBAC)., 2020-12-21T02:31:07+0000
/project/darfortie/, darfortie, 1.0.2, A utility that extends and simplifies using dar (Disk ARchive) for doing routine incremental backups., 2020-02-01T05:11:55+0000
/project/fbsd-gpio/, fbsd_gpio, 0.5.0, cffi-based Python bindings for FreeBSD GPIO, 2016-04-02T22:34:36+0000
/project/qutebrowser/, qutebrowser, 2.2.0, A keyboard-driven, vim-like browser based on PyQt5., 2021-04-13T10:07:16+0000
/project/llfuse/, llfuse, 1.4.1, Python bindings for the low-level FUSE API, 2021-01-31T20:50:00+0000
/project/kivymd-extensions-sweetalert/, kivymd-extensions.sweetalert, 0.1.5, Beautiful, responsive, customizable and accessible popup replacement, 2020-11-23T08:34:34+0000
/project/conff/, conff, 0.5.0, Simple config parser with evaluator library., 2018-06-05T05:37:18+0000
/project/polyarchiv/, polyarchiv, 0.14.3, Multiple-source backup tool: backup files|MySQL|LDAP|PostgresSQL to git|rsync|tar archives, 2017-04-23T12:16:47+0000
/project/mkbak-iterfzf/, mkbak-iterfzf, 0.7.0.25.1, Pythonic interface to fzf, 2021-02-09T20:43:21+0000
/project/kivymd-extensions/, kivymd-extensions, 1.0.0, Additional packages for KivyMD library, 2020-11-01T08:53:17+0000
/project/bakercm/, bakercm, 0.4.4, Baker is a decentralized configuration management based on files, 2018-11-12T21:49:18+0000
/project/alom-exporter/, alom-exporter, 0.0.6, Prometheus exporter for Sun ALOM statistics, 2020-10-03T22:37:43+0000
/project/stack-watcher/, stack-watcher, 0.3.4, Be the first to answer questions on Stack Exchange web sites with this library
and command line tool to notify you as soon as relevant questions are posted., 2014-12-23T19:21:23+0000
/project/rvo/, rvo, 23.0.6, Managing text data from the commandline, 2017-02-25T09:13:15+0000
/project/papa/, papa, 1.0.6, Simple socket and process kernel, 2016-01-20T22:53:19+0000
/project/zvbi/, Zvbi, 0.1.1, Interface to the Zapping VBI decoder library, 2020-05-30T07:28:03+0000
/project/lightweight/, lightweight, 1.0.0.dev52, Code over configuration static site generator., 2020-06-29T15:06:45+0000
/project/clearsilver/, clearsilver, 0.10.1, High performance HTML Template System, 2005-10-20T20:04:39+0000
/project/txrecaptcha/, txrecaptcha, 0.0.6, Twisted reCAPTCHA client, 2015-03-25T10:19:10+0000
/project/passme/, passme, 1.2.0, Password management with command line, 2020-09-16T16:38:45+0000
/project/gpxconverter/, gpxconverter, 0.9.4, gpx to csv converter. it supports waypoint elements except extensions. Values in extensions will be ignored., 2018-01-19T06:34:42+0000
/project/scrap2rst/, scrap2rst, 0.3.0, Converting scrapbox syntax into reStructuredText, 2019-09-26T00:21:34+0000
/project/sourceinfo/, sourceinfo, 0.1.40, Utilities for simplified gain of runtime information on source code and binary locations., 2019-12-13T09:11:10+0000
/project/ofunctions-network/, ofunctions.network, 0.5.0, Network diagnostics, MTU probing, Public IP discovery, HTTP/HTTPS internet connectivty tests, ping, 2021-02-11T01:10:20+0000
/project/pwned/, pwned, 0.1.2, Check if you've been pwned via haveibeenpwned.com, 2016-05-15T09:29:02+0000
/project/redvty/, redvty, 0.0.1, VTY automation via SSH., 2019-11-15T15:17:17+0000
/project/nuitka/, Nuitka, 0.6.14.4, Python compiler with full language support and CPython compatibility, 2021-04-18T14:21:23+0000
/project/avalonms/, avalonms, 0.6.0, Avalon Music Server, 2015-11-09T02:26:15+0000
/project/drewtilities/, drewtilities, 1.3.2, Simple utilities for dev work., 2019-05-30T22:03:01+0000
/project/namedtupledefs/, namedtupledefs, 0.1.21, Extended 'namedtuple' by default values., 2019-12-13T12:30:09+0000
/project/unix-cred/, unix-cred, 0.2.1, A library that simplifies reading peer credentials from Unix domain sockets, 2021-01-08T19:10:52+0000
/project/coho/, coho, 0.4, SMILES parser, 2019-01-19T03:34:02+0000
/project/argopt/, argopt, 0.7.0, doc to argparse driven by docopt, 2021-03-01T16:51:30+0000
/project/ooniprobe/, ooniprobe, 2.3.0, Network measurement tool foridentifying traffic manipulation and blocking., 2018-02-14T09:14:22+0000
/project/pyramidueditor/, pyramidueditor, 1.0.1, A Pyramid application for Baidu Ueditor., 2015-06-05T09:52:25+0000
/project/dropstar/, dropstar, 2010.10.14.0, dropSTAR: Drop Scripts, Templates and RPC.  A stand-alone HTTP server for mixing dynamic and static content with RPC calls.  Focused on system administration and automation tasks., 2010-10-14T18:22:11+0000
/project/theonionbox/, theonionbox, 20.2, The Onion Box: Dashboard to monitor Tor node operations., 2020-01-19T16:46:06+0000
/project/opencanary/, opencanary, 0.6.1, OpenCanary daemon, 2021-03-30T13:07:18+0000
