/project/hadeploy/, HADeploy, 0.6.1, An Hadoop Application deployment tool, 2019-01-22T11:06:21+0000
/project/django-fagungis/, django-fagungis, 0.1.1, DJANGO + FAbric + GUnicorn + NGInx + Supervisor deployment, 2020-07-14T17:00:06+0000
/project/fiscal-printer-adapter/, fiscal-printer-adapter, 0.0.3, A standarized fiscal printer interface, 2018-12-28T00:41:14+0000
/project/pypi-simple/, pypi-simple, 0.8.0, PyPI Simple Repository API client library, 2020-12-13T19:47:19+0000
/project/whereami/, whereami, 0.4.85, Uses WiFi to tell you where you are, 2017-10-21T09:40:26+0000
/project/pkg-orphan/, pkg_orphan, 1.0, Find installed pkgsrc packages which are not dependencies of any other packages (orphans), 2013-03-03T04:34:46+0000
/project/mocka/, mocka, 0.0.8, Mocka mocks APIs, 2016-08-06T01:02:41+0000
/project/flask-transmute/, flask-transmute, 1.4.0, a flask plugin to generate routes from objects., 2018-02-16T04:20:15+0000
/project/chrispile/, chrispile, 1.2.4, Syntactic sugar for running ChRIS apps locally, 2021-03-18T18:47:58+0000
/project/botox/, botox, 0.1.1, High level Boto (AWS) wrapper. Gives boto a facelift!, 2012-06-12T17:27:05+0000
/project/rezup/, rezup, 1.1.0, Rez launching environment manager, 2021-04-26T05:02:47+0000
/project/gcg/, gcg, 0.2.0, Git Changelog Generator, 2019-07-09T19:48:36+0000
/project/makeapt/, makeapt, 1.0a2, Debian APT repositories generator, 2018-10-14T14:52:42+0000
/project/pexe38/, pexe38, 1.3, Python38 to Exe, 2019-12-17T00:49:39+0000
/project/mcloud/, mcloud, 1.0.4, A tool that helps you manage Docker based deployments, 2016-03-07T11:46:27+0000
/project/contender/, contender, 0.2.2, None, 2014-08-27T17:13:12+0000
/project/gn2pg-client/, gn2pg-client, 0.0.5.dev0, Import tool from GeoNature to a PostgreSQL database through Export module API (client side), 2021-01-07T22:01:22+0000
/project/doctor-wheel/, doctor-wheel, 1.2, A utility to strip and reduce the size of your wheels, 2020-12-10T17:52:00+0000
/project/vas/, vas, 1.0.0, vFabric Administration Server Python API, 2012-11-02T12:33:20+0000
/project/pyjig/, pyjig, 1.1.2, Quickly create python projects from templates., 2020-06-15T18:44:56+0000
/project/setuptools-scm-semver/, setuptools-scm-semver, 0.1.3, the blessed package to manage your versions by scm tags, 2019-06-27T07:44:28+0000
/project/yagmail-outlook/, yagmail-outlook, 0.9.178, A fork of yagmail to solve outlook compatiblity problem, 2017-07-03T01:39:09+0000
/project/tow/, tow, 1.0.0a13, Tow is tool for automatization docker configuration managment workflow, 2015-06-02T15:23:45+0000
/project/attributecode/, attributecode, 1.0.0, Generate attribution document with input of CSV/Excel/JSON., 2021-03-31T08:06:50+0000
/project/docker-odoo-env/, docker-odoo-env, 0.0a10, A small tool to manage Dockerized Odoo, 2018-12-31T18:49:40+0000
/project/patchwork/, patchwork, 1.0.1, Deployment/sysadmin operations, powered by Fabric, 2018-06-20T22:14:15+0000
/project/oktaauthpy3/, oktaauthpy3, 0.8, Authenticates from the CLI, 2020-11-09T14:53:25+0000
/project/fabric2/, fabric2, 2.6.0, High level SSH command execution, 2021-01-19T01:10:02+0000
/project/mipubsub/, miPubSub, 0.1.dev1, Publish/Subscribe pattern build with RabbitMQ and Protocol Buffers, 2018-01-26T00:02:45+0000
/project/ivydepparse/, ivydepparse, 1.0.1, Ivy Dependency Parser, 2015-09-30T14:13:51+0000
/project/terminator3/, terminator3, 0.0.1, It does cool things, 2018-12-11T04:28:03+0000
/project/setuptools-sky/, setuptools_sky, 0.1.7, the blessed package to manage your versions by scm tags, 2018-09-26T12:35:03+0000
/project/fabtools/, fabtools, 0.20.0, Tools for writing awesome Fabric files, 2016-10-12T10:37:57+0000
/project/graingert-drc/, graingert-drc, 0.5.0, Temporary fork of client for Docker Registry V1 and V2, 2017-01-11T13:56:36+0000
/project/iptest/, IPTest, 0.1.1, It does cool things with IPs against blacklists, 2017-05-20T18:55:03+0000
/project/udata-schema-gouvfr/, udata-schema-gouvfr, 1.2.0, Integration with schema.data.gouv.fr, 2020-10-16T15:20:18+0000
/project/bumpr/, bumpr, 0.3.7, Version bumper and Python package releaser, 2017-10-29T11:18:49+0000
/project/thrash-protect/, thrash-protect, 0.13.0, Simple-Stupid user-space program doing "kill -STOP" and "kill -CONT" to protect from thrashing, 2019-11-22T20:48:36+0000
/project/fabric-shuttle/, fabric-shuttle, 0.0.22, Declarative service-oriented approach with hooks for using Fabric to provision a machine or vagrant box., 2017-10-14T08:20:09+0000
/project/elasticpy/, elasticpy, 0.12, Python Wrapper for elasticsearch, 2013-04-16T19:56:34+0000
/project/pelican-frontmark/, pelican-frontmark, 1.2.1, CommonMark/Frontmatter reader for Pelican, 2019-12-09T18:17:17+0000
/project/version-query/, version-query, 1.1.0, Package version query toolkit for Python, 2020-02-05T08:54:29+0000
/project/fabrlce/, fabrlce, 1.0.0, High level SSH command execution, 2021-03-10T05:29:15+0000
/project/hemp/, Hemp, 0.1.9, Tools for Fabric, 2019-02-19T15:57:40+0000
/project/bdist-nsi/, bdist_nsi, 0.1.5, Create NSIS windows installers for Python modules., 2012-10-27T12:07:24+0000
/project/omego/, omego, 0.7.0, OME installation and administration tool, 2019-11-11T14:39:34+0000
/project/cliche/, cliche, 0.7.46, A minimalistic CLI wrapper out to be the best, 2021-04-15T22:05:29+0000
/project/django-js/, django.js, 0.8.1, Django JS Tools, 2013-10-19T11:50:45+0000
/project/oozappa/, oozappa, 0.9.1, Fabric task runner and helper. Executes and manages tasks via web browser., 2017-12-16T05:34:04+0000
/project/mcloud-plugin-browser-auto-open/, mcloud-plugin-browser-auto-open, 0.10.14, browser-auto-open mcloud plugin, 2015-07-31T06:46:32+0000
/project/probcount/, probcount, 0.1, A simple probabilistic counter., 2017-12-19T13:15:00+0000
/project/yadtbroadcast-client-wamp2/, yadtbroadcast-client-wamp2, 0.0.2, YADT - an Augmented Deployment Tool - The Broadcast Client Part, 2015-02-02T12:18:15+0000
/project/libcomps/, libcomps, 0.1.15.post1, Comps XML file manipulation library, 2020-07-08T18:20:15+0000
/project/rdeploy/, rdeploy, 0.0.37, CLI that makes it easy to build and deploy an application to k8s., 2021-04-09T15:10:44+0000
/project/sanic-restplus/, sanic-restplus, 0.5.5, Fully featured framework for fast, easy and documented API development with Sanic, 2021-01-02T09:54:34+0000
/project/fastlang/, fastlang, 0.0.4, Fast Detection of Language without Dependencies, 2017-03-11T19:14:50+0000
/project/pipcmd/, pipcmd, 0.1, Tool for installing and managing commands installed from PyPI, 2018-02-12T22:42:42+0000
/project/onyxproject/, onyxproject, 0.9.0, Intelligent Dashboard, 2017-05-10T14:37:40+0000
/project/feedview/, feedview, 0.0.1, View a feed url with `feedview <URL>`, 2017-05-25T17:59:35+0000
/project/swagger-schema/, swagger-schema, 0.5.1, a schematics-based schema for Swagger definitions., 2017-12-17T19:50:39+0000
/project/depl/, depl, 0.0.1, depl - deploy easy and fast., 2013-09-22T17:55:44+0000
/project/pypi2pkgbuild/, pypi2pkgbuild, 0.3, A PyPI to PKGBUILD converter., 2021-03-30T20:41:14+0000
/project/sshtoy/, sshtoy, 1.0.5, Connecting to remote host with one command., 2012-09-27T16:52:34+0000
/project/clusterp/, clusterp, 0.1.4, Clusterp : Cluster profiling made easy, 2018-04-09T14:12:53+0000
/project/zc-recipe-cmmi/, zc.recipe.cmmi, 3.0.0, ZC Buildout recipe for configure/make/make install, 2019-03-30T08:10:54+0000
/project/auto-extract/, auto_extract, 0.0.9, Automatically extract content., 2020-03-08T21:59:38+0000
/project/ipecac/, ipecac, 0.2, Generate Swagger/OAS 3.0 documentation from Python comments, 2018-12-17T02:23:48+0000
/project/vcs-repo-mgr/, vcs-repo-mgr, 4.2, Version control repository manager, 2018-04-26T09:31:06+0000
/project/pelican-drafts/, pelican-drafts, 0.1.1, Add a browsable drafts listing to your Pelican website, 2020-03-25T23:24:02+0000
/project/easypypi/, easypypi, 2.0.6, By FAR the easiest and quickest way to publish your Python creations on PyPI so other people can just `pip install your_script`., 2021-01-30T02:58:05+0000
/project/python-bol-api/, python-bol-api, 0.9.1, Wrapper for the bol.com API, 2020-05-14T13:52:34+0000
/project/bsm/, bsm, 0.3.0, Bundled software manager, 2018-01-17T08:01:06+0000
/project/amet/, amet, 0.4, A library to read complex configuration from environment variables., 2018-05-13T12:13:27+0000
/project/autoupgrade-prima/, autoupgrade-prima, 0.6.3, Automatic upgrade of PyPI packages, 2020-06-30T13:14:25+0000
/project/gisht/, gisht, 0.5, Gists in the shell, 2015-08-04T09:42:07+0000
/project/figaro/, figaro, 0.1, Production cloud deployments of fig infrastructure with docker, 2014-02-01T19:45:55+0000
/project/pyp2rpm/, pyp2rpm, 3.3.6, Convert Python packages to RPM SPECFILES, 2021-03-21T23:24:00+0000
/project/ore-recipe-svnlib/, ore.recipe.svnlib, 0.1.6, Buildout recipe for compiling python subversion bindings, 2008-11-18T14:06:04+0000
/project/githubrelease/, githubrelease, 1.5.8, githubrelease is a CLI to easily manage GitHub releases, assets and references, 2018-04-08T19:46:36+0000
/project/redshiftsql/, redshiftsql, 0.0.7, Executes SQL commands from STDIN in a single transaction, 2018-03-15T19:36:06+0000
/project/udata-data-fair/, udata-data-fair, 0.3.1, Use DataFair embeds to preview data, 2020-03-17T14:58:14+0000
/project/cozy-indexer/, cozy-indexer, 1.0.6, Little API that provides indexation and full-text search features to the Cozy Cloud Platform., 2015-06-23T15:06:07+0000
/project/remote-copy-and-execute/, remote_copy_and_execute, 1.1.1, Tool to use SSH protocol to copy and execute arbitrary scripts/commands on a list of machines in parallel, 2015-08-30T23:21:40+0000
/project/pynsist/, pynsist, 2.7, Build NSIS installers for Python applications., 2021-03-28T16:28:58+0000
/project/udata-piwik/, udata-piwik, 2.1.2, Piwik support for uData, 2020-07-03T14:41:56+0000
/project/read-version/, read-version, 0.3.1, Extract your project's __version__ variable, 2020-07-12T20:19:09+0000
/project/save-thread-result/, save-thread-result, 0.0.6, Simple subclass wrapper around `threading.Thread` to get the return value from a thread in python (from `threading` built-in module in Python Standard library). Exact same interface for creating an instance of this threading sublcass as `threading.Thread`!, 2021-02-08T00:27:52+0000
/project/python-cloudwatchlogs-logging/, python-cloudwatchlogs-logging, 0.0.3, Handler for easy logging to AWS CloudWatchLogs., 2015-03-16T14:52:50+0000
/project/treeshaker/, treeshaker, 0.0.3, A tree-shaking tool for Python., 2020-05-16T21:40:44+0000
/project/ezpy/, ezpy, 0.1.0.dev0, Make Python application installs easy as pie, for both users and developers, 2017-06-20T15:44:36+0000
/project/anguine/, anguine, 0.0.0, anguine, 2017-11-08T22:45:05+0000
/project/flask-mm/, flask-mm, 0.0.13.dev0, Media Manager for flask, 2020-02-28T16:14:53+0000
/project/yt-finance/, yt.finance, 0.2, A very basic finance library, 2013-03-17T20:51:09+0000
/project/redis-taxon/, redis-taxon, 0.3.0, Redis-backed tagged data store, 2012-09-24T04:11:47+0000
/project/berth/, berth, 1.3.5, Utility to generate package files using Docker containers, 2017-05-05T09:22:58+0000
/project/awsornot/, awsornot, 1.1.2, Classes for logging and key/value that work identically whether running on AWS or not, 2018-03-27T23:42:55+0000
/project/poni/, poni, 0.4.9, system configuration software, 2011-04-05T15:27:40+0000
/project/dh-splitpackage/, dh_splitpackage, 0.2.3, dh_split - split monolithic installation directory into sub-packages without pulling your hair out, 2011-06-14T17:41:52+0000
/project/enstaller/, enstaller, 4.8.13, Install and managing tool for egg-based packages, 2017-01-13T19:54:54+0000
/project/pipdatedd/, pipdatedd, 0.3.3, pip update helpers, 2019-08-03T16:59:05+0000
/project/katversion/, katversion, 1.1, Reliable git-based versioning for Python packages, 2020-07-27T09:01:41+0000
/project/ya-ma/, ya-ma, 0.3.8, YANDEX transport API client library, 2019-10-13T13:56:06+0000
/project/docker-map/, docker-map, 1.1.1, Managing Docker images, containers, and their dependencies in Python., 2020-04-09T20:41:18+0000
/project/mcloud-plugin-simple-publish/, mcloud-plugin-simple-publish, 0.10.10, Very simple mechanism to publish application using docker-proxy, 2015-05-28T00:38:34+0000
/project/toka/, toka, 0.2.3.21, A handy tool to generate common files in command line, 2015-09-08T04:51:31+0000
/project/seclusion/, seclusion, 1.1.0, A simple way to provide a secluded deployment location, 2016-02-07T18:23:18+0000
/project/os-sys/, os-sys, 2.1.4, a big lib with many usefull tools and it are not only os and sys tools..., 2019-12-10T20:06:28+0000
/project/instagrampictures/, instagramPictures, 1.3.1, Script for downloading pictures from instagram.com, 2017-05-10T21:12:11+0000
/project/setuptools-scm/, setuptools-scm, 6.0.1, the blessed package to manage your versions by scm tags, 2021-03-17T14:18:59+0000
/project/outsystems-pipeline/, outsystems-pipeline, 0.3.1, Python package to accelerate the integration of OutSystems with third-party CI/CD tools, 2020-03-25T15:11:47+0000
/project/distutils-ui/, distutils-ui, 0.1.3, A distutils build extension for PyQt{4,5} applications, 2020-10-02T16:06:09+0000
/project/udata-recommendations/, udata-recommendations, 2.2.0, uData content recommendations bridge, 2020-11-30T11:04:55+0000
/project/fabrik/, fabrik, 3.3.1, A simple to use deployment toolkit built on top of Fabric, 2018-04-16T06:56:31+0000
/project/ribosome-tool/, ribosome.tool, 0.6.6, Yet another project deploy and release tool, 2019-11-09T16:07:40+0000
/project/qypi/, qypi, 0.5.0, Query PyPI from the command line, 2019-05-18T17:04:10+0000
/project/huddle/, huddle, 0.1.5, A server-oriented auto-deployment utility for any type of program or script, 2017-05-30T23:49:21+0000
/project/metrics-migration/, metrics-migration, 0.1.2, a simple tool to help you migrate graphite metrics, 2017-01-13T23:21:13+0000
/project/pypackinit/, pypackinit, 1.0, Rapid python package skeleton generator, 2020-10-24T16:13:26+0000
/project/snakepit/, snakepit, 185, Package Python software as an RPM including all dependencies (even the interpreter)., 2016-03-17T13:18:20+0000
/project/spec-checker/, spec-checker, 0.0.2, Tool for checking textual requirement/design specifications, 2017-01-15T12:37:35+0000
/project/placer/, placer, 0.0.7, Let's draw on /r/place!, 2017-04-03T12:35:03+0000
/project/pyimapi/, pyIMAPI, 0.4.0b2, Create CD, DVD, DVD Dual Layer, and BluRay ISO images under Windows directly from Python, 2018-06-25T06:47:36+0000
/project/cyclonedx-bom/, cyclonedx-bom, 0.4.3, CycloneDX software bill-of-material (SBOM) generation utility, 2020-12-05T20:21:04+0000
/project/pulp-cli/, pulp-cli, 0.7.0, Command line interface to talk to pulpcore's REST API., 2021-03-15T18:18:21+0000
/project/distinfo/, distinfo, 0.2.0, Extract metadata from Python source distributions, 2018-07-20T22:34:05+0000
/project/fabtools3/, fabtools3, 0.19.0, [Python3 fork] Tools for writing awesome Fabric files, 2016-04-20T10:35:43+0000
/project/pexpect/, pexpect, 4.8.0, Pexpect allows easy control of interactive console applications., 2020-01-21T16:37:03+0000
/project/poorbox/, poorbox, 0.1, Downloads a dropbox directory via the dropbox REST API. Downloads only the changed files. Useful for limited environments., 2013-02-24T02:23:20+0000
/project/ravenpackapi/, ravenpackapi, 1.0.47, RavenPack API - Python client, 2021-04-12T07:56:30+0000
/project/nvchecker/, nvchecker, 2.3, New version checker for software, 2021-03-19T05:45:25+0000
/project/safeget/, safeget, 1.4.8, Safeget gets and verifies files. It does the security checks that almost everyone skips., 2021-03-08T20:08:31+0000
/project/django-absolute/, django-absolute, 0.3, Absolute URLs tools for django, 2013-03-03T01:39:32+0000
/project/pickley/, pickley, 2.4.6, Automate installation of standalone python CLIs, 2021-04-08T18:46:03+0000
/project/setupdocx/, setupdocx, 0.1.22, Support of documentation commands and extensions for setuptools / distutils., 2019-12-11T08:43:33+0000
/project/mt4pycon/, mt4pycon, 1.0.2, A python script using the mtapi EA on MT4 to get candle data, 2020-11-12T13:50:31+0000
/project/cozy-fuse/, cozy-fuse, 0.1.2, FUSE implementation for Cozy Files, 2014-07-21T11:11:54+0000
/project/cdent/, cdent, 0.5.7, C'Dent - A Portable Module Programming Language, 2010-06-15T03:27:16+0000
/project/jprm/, jprm, 0.4.0, Jellyfin Plugin Repository Manager, 2021-03-12T23:08:09+0000
/project/package-cache/, package-cache, 0.2, A caching proxy for package downloads, 2014-02-22T03:15:16+0000
/project/flowtool-python/, flowtool-python, 0.7.47, Shortcuts for python devs., 2016-05-11T12:14:29+0000
/project/yabs/, yabs, 0.4.0, Yet Another Build Script, 2020-12-28T18:57:58+0000
/project/pytempus/, pytempus, 1.2.2, Tempus Python API, 2018-02-09T10:26:38+0000
/project/pythonids/, pythonids, 0.1.40, The 'pythonids' package provides the identification and enumeration of Python syntax and implementation., 2019-12-19T05:50:36+0000
/project/pyk8sver/, pyk8sver, 1.0, Get k8s version from github, 2019-01-14T18:11:45+0000
/project/attrs-jsonschema/, attrs-jsonschema, 0.2, convert a attrs annotation to json a json schema., 2017-06-25T16:41:28+0000
/project/pelican-microdata/, pelican-microdata, 0.3.0, Microdata semantic markups support for Pelican Blog Generator, 2017-02-02T01:09:33+0000
/project/infotags/, infotags, 1.1.2, Meta info extraction for Python package setup scripts, 2017-09-08T21:01:48+0000
/project/repomirror/, repomirror, 1.0.4, Clone/mirror multiple Linux distro/BSD flavor/etc. repositories to a local server, 2020-07-07T17:33:39+0000
/project/ccfreeze/, ccfreeze, 1.1.5, create standalone executables from python scripts, 2016-05-22T09:21:10+0000
/project/btsbots-wallet/, btsbots-wallet, 0.2.3, web wallet for BitShares, 2016-10-02T07:40:10+0000
/project/pearlcli/, pearlcli, 2.1.1, Pearl is a lightweight package manager for automating reproducible environments between different systems (Linux and OSX).It can be used for dotfiles, plugins, programs and any form of code accessible via git., 2020-01-14T00:00:57+0000
/project/djangopypi/, djangopypi, 0.4.7, A Django application that emulates the Python Package Index., 2015-10-27T12:54:41+0000
/project/tinyshar/, tinyshar, 0.10.2, simple library and utility for creation of shell archives, 2020-06-17T13:17:50+0000
/project/sink/, sink, 0.1.0b2, Arch Linux AUR installer for the lazy, 2019-02-19T09:02:34+0000
/project/emby-updater/, emby-updater, 0.8.3, A little tool to keep your emby media server up to date., 2020-08-28T11:54:51+0000
/project/odoo-env/, odoo-env, 0.10.10, A Dockerized environment for Odoo, 2021-03-27T21:25:59+0000
/project/updater4pyi/, updater4pyi, 0.7, Lightweight library for software auto-update for applications frozen with pyinstaller, 2014-12-07T18:37:13+0000
/project/ivre/, ivre, 0.9.16, Network recon framework, 2020-12-08T14:53:50+0000
/project/paved/, Paved, 0.5.1, Common tasks for Paver-based projects., 2016-11-08T00:56:50+0000
/project/gocept-download/, gocept.download, 0.9.5, zc.buildout recipe for downloading and extracting an archive., 2010-07-26T08:50:55+0000
/project/cgtn-videos/, cgtn-videos, 0.0.4, Python package fetch the video URLs and metadata from CGTN website, 2019-12-04T03:53:43+0000
/project/repi-client/, repi-client, 0.4, RePi client, a Redis PubSub interface for PyPi., 2013-07-22T19:51:57+0000
/project/arundeckrun/, arundeckrun, 0.2.3, A Rundeck API Python client, 2016-04-13T13:27:55+0000
/project/pytest-lamp/, pytest-lamp, 0.1.0, , 2017-01-06T01:13:55+0000
/project/aptdaemon/, aptdaemon, 1.1.1, DBus driven daemon for APT, 2013-08-12T04:34:11+0000
/project/freeze-requirements/, freeze-requirements, 0.5.3, A script to help creating and maintaining frozen requirements for pip, 2017-07-27T11:05:19+0000
/project/deb-pkg-tools/, deb-pkg-tools, 8.4, Debian packaging tools, 2021-03-09T13:48:47+0000
/project/gouvlu/, gouvlu, 2.0.20, Official udata theme and extensions of the Open Data Portal of Luxembourg, 2021-04-20T12:25:31+0000
/project/pypiweb/, pypiweb, 0.1.1, pypiweb description, 2015-10-21T17:40:00+0000
/project/gstore/, gstore, 0.4.0, Synchronize GitHub repositories made easy, 2021-02-19T07:53:50+0000
/project/fiaas-publish/, fiaas-publish, 0.2.0, Publish python package to PyPI and Github, 2019-01-09T09:39:01+0000
/project/versionah/, versionah, 0.16.0, Simple version specification management, 2017-11-25T10:04:58+0000
/project/gptsum/, gptsum, 0.0.9, A tool to make disk images using GPT partitions self-verifiable, 2021-03-25T23:18:05+0000
/project/django-image-proxy/, django_image_proxy, 0.0.8, Simple Django Image Proxy especially for Horizon Openstack Dashboard., 2015-08-03T10:06:42+0000
/project/nostalgia/, nostalgia, 0.1.67, nostalgia enables to self-track and gain insights into your life, 2020-03-08T22:04:17+0000
/project/pipesnake/, pipesnake, 0.1, Feature extractor and data processing pipelines for Pandas inspired by Scikit-Learn., 2018-01-26T18:18:15+0000
/project/afterdown/, afterdown, 0.9.93, Automate the organization of your downloads., 2018-05-12T20:36:57+0000
/project/winapps/, winapps, 0.2.0, Python library for managing installed applications on Windows, 2021-04-02T16:26:07+0000
/project/yuki/, yuki, 1.0.6, CEPC software management toolkit, 2018-02-26T02:48:03+0000
/project/surgen/, surgen, 0.1.0, a utility library to help provide api route generation form function signature for web frameworks., 2019-07-05T22:50:15+0000
/project/spec2scl/, spec2scl, 1.2.2, Convert RPM specfiles to SCL-style., 2019-08-19T11:27:40+0000
/project/package-controller/, package-controller, 3.2.1, A CLI tool that acts as a wrapper for various other programs to make updating and publishing python and node packages easier, 2019-07-07T02:58:11+0000
/project/ownrepo/, ownrepo, 0.1b5, Simple, easy-to-setup private Python packages repository, 2015-03-10T20:10:02+0000
/project/flask-dotenv/, Flask-DotEnv, 0.1.2, The .env file support for Flask, 2019-04-30T18:38:51+0000
/project/possible/, possible, 0.0.0, Possible is configuration management tool, 2019-05-26T09:26:07+0000
/project/pip-save/, pip-save, 0.2.0, A wrapper around pip to add `npm --save` style functionality to pip, 2016-09-20T19:38:08+0000
/project/gentle/, Gentle, 0.1, Gentle is a help you quickly submit code to the test environment tools., 2013-12-04T15:12:20+0000
/project/appypi/, appypi, 0.2.0, appypi: sandboxing apps from Pypi packages, 2012-12-16T17:22:04+0000
/project/warthog/, warthog, 2.0.1, Simple client for A10 load balancers, 2017-07-20T21:19:28+0000
/project/rundeckrun/, rundeckrun, 0.2.1, Rundeck API Python client, 2015-10-12T20:51:39+0000
/project/moscow-yandex-transport/, moscow-yandex-transport, 0.2.0, YANDEX transport API client library, 2019-08-31T17:39:09+0000
/project/cizsle/, cizsle, 0.0a7, Cisco ZTP Server LE, 2019-05-09T02:14:31+0000
/project/rt-factory/, rt-factory, 0.2.4, Pythonic wrapper for the artifactory API, 2017-10-26T15:22:17+0000
/project/pglite/, pglite, 1.0.13, PostgreSQLite, 2020-09-01T08:16:49+0000
/project/rpmbrew-tools/, rpmbrew-tools, 0.1-7, Some utility tools that helps in building rpms, 2014-03-23T17:19:26+0000
/project/bundle/, bundle, 1.1.2, Create and manage bundle packages., 2012-01-13T13:54:26+0000
/project/xdb/, xdb, 0.0.0, One database API to use them all, 2016-01-04T19:07:03+0000
/project/cot/, cot, 2.2.1, Common OVF Tool, 2019-12-04T15:45:49+0000
/project/pip-accel/, pip-accel, 0.43, Accelerator for pip, the Python package manager, 2016-03-14T12:52:31+0000
/project/pip2pkgbuild/, pip2pkgbuild, 0.2.6, Generate PKGBUILD file for a Python module from PyPi, 2019-04-13T07:56:19+0000
/project/chishop/, chishop, 0.2.0, Simple PyPI server written in Django., 2009-03-22T00:45:57+0000
/project/udata-croquemort/, udata-croquemort, 2.0.1, Croquemort support for uData, 2020-06-17T12:49:05+0000
/project/drover/, drover, 0.7.1, a command-line utility to deploy Python packages to Lambda functions, 2020-04-07T07:44:43+0000
/project/textsearch/, textsearch, 0.0.21, Find strings/words in text; convenience and C speed, 2021-02-07T14:41:25+0000
/project/dcextensions/, dcextensions, 0.0.1, UNKNOWN, 2014-07-16T14:41:13+0000
/project/fabric-with-working-dependencies/, Fabric-with-working-dependencies, 1.0.1, Fabric is a simple, Pythonic tool for remote execution and deployment., 2011-04-19T12:54:59+0000
/project/bolt/, bolt, 0.9, Multi-server automation and deployment toolkit, 2011-05-16T20:03:45+0000
/project/signet/, signet, 3.0.2, Signet provides support for building and delivering tamper resistant python to your users and customers., 2020-06-19T16:25:33+0000
/project/jyboss/, jyboss, 0.2.8, Jython CLI for JBoss Application Server, 2019-11-01T01:54:36+0000
/project/autoupgrade/, autoupgrade, 0.2.0, Automatic upgrade of python modules and packages, 2015-01-05T15:35:31+0000
/project/repo-helper/, repo-helper, 2021.3.31, A tool to manage configuration files, build scripts etc. across multiple projects., 2021-03-31T11:20:53+0000
/project/pybuilder-aws-plugin/, pybuilder_aws_plugin, 183, PyBuilder plugin to handle AWS functionality, 2016-06-23T09:13:00+0000
/project/fabric-logging/, fabric-logging, 0.1.0, Adds option to redirect all stdout/stderr through standard Python logging. Very much a work in progress, 2012-09-19T00:28:18+0000
/project/setup-qt/, setup_qt, 1.0.0, Compile Qt resource files, UI files and translations in setup.py, 2017-03-23T17:03:48+0000
/project/signify/, signify, 0.3.0, Module to generate and verify PE signatures, 2020-08-16T10:32:38+0000
/project/pyalpm/, pyalpm, 0.9.2, libalpm bindings for Python 3, 2020-10-13T20:14:26+0000
/project/pup/, pup, 1.0.0a9, Pluggable Micro Packager, 2021-02-06T22:08:06+0000
/project/seed/, seed, 0.11.3, A utility for easily creating and releasing Python packages, 2017-02-22T16:22:12+0000
/project/yadtbroadcast-client/, yadtbroadcast-client, 1.2.1, YADT - an Augmented Deployment Tool - The Broadcast Client Part, 2014-02-11T15:22:18+0000
