/project/pergola/, pergola, 0.2.0, A library to analyze and visualize behavioral data by unlocking genomic tools, 2019-12-23T10:38:26+0000
/project/gse/, gse, 0.1.9, extract metadata and dataset from GEO Series Matrix format data, 2014-02-10T22:43:29+0000
/project/pairedcompcalc/, PairedCompCalc, 1.0.1, Statistical Analysis of Paired-Comparison Data, 2020-05-15T05:56:03+0000
/project/levenshtein-search/, Levenshtein-search, 1.4.5, Search through documents for approximately matching strings, 2019-12-31T00:43:32+0000
/project/appstore-profile-scraper/, appstore-profile-scraper, 0.0.10, App Store Profile Information Scraper, 2021-03-30T09:12:06+0000
/project/fretfinder/, fretfinder, 1.0.0, Adaptive guitar fret finder algorithm implementation, 2020-12-13T06:48:04+0000
/project/hdsubnetfinder/, hdsubnetfinder, 0.2.2, Heat Diffusion Sub-network Finder, 2015-08-18T20:35:41+0000
/project/kunteksto/, kunteksto, 2.1.0, The tool to translate your CSV data files into RDF, XML and JSON with full semantics and syntactic validation., 2018-12-28T05:50:41+0000
/project/openfisca-nsw-base/, openfisca-nsw-base, 0.8.0, OpenFisca tax and benefit system for nsw - base package, 2020-01-15T06:09:27+0000
/project/netflowvizu/, NetFlowVizu, 0.6, Network flow visualizer., 2011-06-07T09:14:22+0000
/project/co2dice/, co2dice, 3.0.0, Polyvers's lib to derive subproject versions from tags on Git monorepos., 2019-01-30T11:27:32+0000
/project/pyusid/, pyUSID, 0.0.10, Framework for storing, visualizing, and processing Universal Spectroscopic and Imaging Data (USID), 2021-03-06T14:35:30+0000
/project/louvain-github/, louvain-github, 0.6.1.post1, Forked from louvain-igraph (https://github.com/vtraag/louvain-igraph). Publish because its PyPI version is out-of-date, whereas our scCloud package depends on this github repo version. Will remove if a new release is published., 2019-07-29T20:54:12+0000
/project/kshape/, kshape, 1.0.1, Python implementation of k-Shape, 2017-09-26T12:47:35+0000
/project/ghcmodbear/, GhcModBear, 0.10.0, 'GhcModBear' bear for coala (http://coala.rtfd.org/), 2017-03-16T13:01:08+0000
/project/cifrum/, cifrum, 0.2.6, Flexible and easy-to-use Python library for analysis & manipulation with financial & economic data, 2019-10-07T19:21:12+0000
/project/dbnomics/, DBnomics, 1.2.1, DBnomics Python Client, 2021-04-01T15:37:27+0000
/project/wizardhat/, WizardHat, 0.2.1, Real-time processing and plotting of data streamed over LSL, with a focus on student-led BCI projects., 2018-11-19T22:13:22+0000
/project/defdap/, DefDAP, 0.93.2, A python library for correlating EBSD and HRDIC data., 2021-04-16T14:14:20+0000
/project/pymorphy2-dicts/, pymorphy2-dicts, 2.4.393442.3710985, OpenCorpora.org dictionaries pre-compiled for pymorphy2, 2015-01-17T16:40:38+0000
/project/address-templeter/, address-templeter, 1.41, search for addresses in the text, 2020-06-15T10:00:43+0000
/project/quantdsl/, quantdsl, 1.4.0, Domain specific language for quantitative analytics in finance., 2017-10-26T17:17:04+0000
/project/mep/, mep, 0.0.1, Minimal energy path tools for atomistic systems, 2019-08-09T20:14:43+0000
/project/proxmin/, proxmin, 0.6.11, Proximal methods for constrained optimization, 2020-11-23T18:18:19+0000
/project/hmc-loss/, hmc_loss, 1.0.0, , 2017-04-24T08:21:10+0000
/project/transitionmatrix/, transitionMatrix, 0.4.0, A Python powered library for statistical analysis and visualization of state transition phenomena, 2018-10-23T09:21:50+0000
/project/pewsql/, pewsql, 0.0.1, Analytics Tools for RDBMS, 2017-07-19T15:59:10+0000
/project/frds/, frds, 0.4.3, Financial Research Data Services, 2020-08-14T21:53:16+0000
/project/pathsjson/, pathsjson, 0.0.3, , 2017-11-13T14:26:05+0000
/project/treetaggerwrapper/, treetaggerwrapper, 2.3, Wrapper for the TreeTagger text annotation tool from H.Schmid., 2019-01-29T15:22:04+0000
/project/social/, social, 0.1.dev3, Social is a python package for social data analysis and exploitation, 2015-03-26T13:53:25+0000
/project/itk-ndreg/, itk-ndreg, 0.2.1, This is the Neurodata open-source Python package that performs affine and deformable (LDDMM) image registration., 2021-03-09T21:50:53+0000
/project/probablepeople/, probablepeople, 0.5.4, Parse romanized names & companies using advanced NLP methods, 2017-05-30T15:12:10+0000
/project/spatialedge-analytics-dfauditor/, spatialedge-analytics-dfauditor, 0.0.4, A dataframe auditor that extracts descriptive statistics from dataframe columns, 2021-02-25T06:15:14+0000
/project/nicecx-dev/, nicecx-dev, 0.0.1b7, Nice CX Python includes a client and a data model., 2017-10-18T22:29:33+0000
/project/luis/, luis, 2.0.2, A Python interface to Microsoft LUIS., 2017-07-20T20:38:22+0000
/project/tagme/, tagme, 0.1.3, Official TagMe API wrapper for Python, 2017-04-06T13:47:26+0000
/project/rgmining-review/, rgmining-review, 0.9.2, Review data structure for Review graph mining project, 2017-01-24T06:17:20+0000
/project/jgrepl/, jgrepl, 0.1.5, Extensible command-line REPL for interacting with JSON-graphs containing business objects, 2018-04-17T10:20:55+0000
/project/nestor-qt/, nestor-qt, 0.3.2, Legacy (Qt5) GUI for the Nestor annotation tool, 2020-09-30T21:03:58+0000
/project/itk-adaptivedenoising/, itk-adaptivedenoising, 0.2.0, Denoise an image using a spatially adaptive filter., 2021-01-20T16:22:53+0000
/project/wmf-user-metrics/, wmf_user_metrics, 0.1.1, Data Analysis for Wikipedia User data., 2013-02-05T17:29:14+0000
/project/napari-omero/, napari-omero, 0.1.0, napari/OMERO interoperability, 2020-06-24T21:29:41+0000
/project/cwl-airflow-tester/, cwl-airflow-tester, 1.0.20190620213659, Tester for cwl-airflow-parser, 2019-06-20T21:40:57+0000
/project/tstoolbox/, tstoolbox, 102.5.8, Command line script to manipulate time series files., 2021-03-07T02:25:35+0000
/project/ceilometer-riemann/, ceilometer-riemann, 0.2.6, Riemann publisher driver for OpenStack Ceilometer, 2013-11-13T11:49:17+0000
/project/rdf-fingerprinter/, rdf-fingerprinter, 0.2.10, Find out kind of data shapes your RDF dataset instantiates., 2021-01-22T13:41:55+0000
/project/sigmet/, sigmet, 0.9.0, A Python package to find and measure negative price shocks in financial time-series data, 2020-09-11T04:11:35+0000
/project/junctiontree/, junctiontree, 0.2.4, Junction tree and belief propagation algorithms, 2021-03-20T14:25:54+0000
/project/sdmx1/, sdmx1, 2.4.1, Statistical Data and Metadata eXchange (SDMX), 2021-04-12T13:35:14+0000
/project/cwltool/, cwltool, 3.0.20210319143721, Common workflow language reference implementation, 2021-03-19T14:51:00+0000
/project/pymorphy2-dicts-uk/, pymorphy2-dicts-uk, 2.4.1.1.1460299261, Ukrainian dictionaries for pymorphy2, 2016-04-10T15:41:52+0000
/project/waybackmachine/, waybackmachine, 0.2.0, Envelope for archive.org API., 2020-09-06T14:47:19+0000
/project/advas-advanced-search/, AdvaS-Advanced-Search, 0.2.3, Library for advanced search, 2005-01-29T23:25:04+0000
/project/babel-util/, babel_util, 1.0.1, Utilities to support the babel platform, 2015-08-14T22:49:13+0000
/project/iknowpy/, iknowpy, 1.0.11, iKnow Natural Language Processing engine, 2021-04-13T07:58:17+0000
/project/pynvt/, PyNVT, 0.0.1, Python Neuroimaging Visualization Tools, 2018-06-08T17:36:44+0000
/project/miresi/, miresi, 0.0.1, Miscellaneous Remote System Interface, 2019-03-02T14:34:00+0000
/project/cimtools/, CIMtools, 4.0.8, , 2020-09-15T10:09:20+0000
/project/pyphrasy/, pyphrasy, 0.2.0, Inflection russian collocations based on pymorphy2, 2021-03-24T19:52:47+0000
/project/sqaod/, sqaod, 1.0.2, A collection of solvers for simulated quantum annealing., 2018-11-11T14:20:32+0000
/project/guildai/, guildai, 0.7.3, Experiment tracking, ML developer tools, 2021-03-25T22:43:31+0000
/project/bandicoot/, bandicoot, 0.6.0, A toolbox to analyze mobile phone metadata., 2020-05-18T22:36:05+0000
/project/shellcheckbear/, ShellCheckBear, 0.10.0, 'ShellCheckBear' bear for coala (http://coala.rtfd.org/), 2017-03-16T13:06:29+0000
/project/cli-code/, cli-code, 28.1.0, long_description, 2020-03-26T03:59:31+0000
/project/veidt/, veidt, 0.0.2, Veidt is a deep learning library for materials science., 2017-09-18T20:20:51+0000
/project/mlglass/, mlglass, 0.0.1, MLglass: A Transparency with models, 2019-12-27T00:21:57+0000
/project/brightway-projects/, brightway-projects, 0.1.dev1, Management of projects in the Brightway Life Cycle Asssessment framework, 2019-10-18T20:15:06+0000
/project/canopen-monitor/, canopen-monitor, 3.3.0, An NCurses-based TUI application for tracking activity over the CAN bus and decoding messages with provided EDS/OD files., 2021-04-21T18:00:44+0000
/project/datameta-client/, datameta-client, 0.1.0, A high-level client for interacting with a DataMeta service, 2021-03-23T11:18:57+0000
/project/vintbear/, VintBear, 0.10.0, 'VintBear' bear for coala (http://coala.rtfd.org/), 2017-03-16T13:07:10+0000
/project/bioflow/, BioFlow, 0.2.3, Information Flow Analysis in biological networks, 2018-10-22T21:10:43+0000
/project/wordembeddingloader/, WordEmbeddingLoader, 0.2.1, Loaders and savers for different implentations of word embedding., 2017-11-05T01:55:48+0000
/project/nestcheck/, nestcheck, 0.2.1, Error analysis, diagnostic tests and plots for nested sampling calculations., 2019-08-17T09:59:34+0000
/project/sparse-som/, sparse-som, 0.6.1, Self-Organizing Maps for sparse inputs in python, 2020-11-27T13:09:59+0000
/project/ndd/, ndd, 1.10.6, Bayesian entropy estimation from discrete data, 2021-01-04T11:45:47+0000
/project/fiftyone-brain/, fiftyone-brain, 0.5.0, FiftyOne Brain, 2021-03-31T21:37:40+0000
/project/sequana-quality-control/, sequana-quality-control, 0.8.2, A quality control pipeline for illumina data set. This pipeline removes contaminants (e.g. Phix), performs fastqc, adapter cleaning and trimming and checks for contaminants, 2020-03-17T16:31:58+0000
/project/agate-sql/, agate-sql, 0.5.6, agate-sql adds SQL read/write support to agate., 2021-03-12T00:50:57+0000
/project/itk-gpufinitedifference/, itk-gpufinitedifference, 0.2.0, Base classes for ITK finite difference filters accelerated with OpenCL., 2019-12-12T11:14:20+0000
/project/pytreecat/, pytreecat, 0.1.9, A Bayesian latent tree model of multivariate multinomial data, 2017-08-15T03:08:37+0000
/project/pyaeso/, pyaeso, 0.7, Pythonic access to the Alberta (Canada) Electric System Operator (AESO) Energy Trading System (ETS)., 2011-12-28T08:23:56+0000
/project/flat-table/, flat-table, 1.1.1, A broader implementation of pandas json_normalize function., 2020-08-23T23:57:13+0000
/project/pyroclast/, pyroclast, 1.0.1, Basic Python-based data server for exposing flat table and object hierarchy files via REST-ful queries, 2015-12-04T21:26:30+0000
/project/kgcnn/, kgcnn, 0.1.1, General Base Layers for Graph Convolutions with tensorflow.keras, 2021-04-10T10:16:54+0000
/project/changeseq/, changeseq, 1.2.9.1, Bioinformatic pipeline for the CHANGE-seq assay., 2020-11-15T04:17:45+0000
/project/morphotester/, MorphoTester, 1.0.1, A scientific computing application for measuring topographic shape in 3D anatomical data., 2015-10-02T22:28:24+0000
/project/prettierplot/, prettierplot, 0.1.2, Quickly create prettier plots, 2020-04-17T19:03:05+0000
/project/javapmdbear/, JavaPMDBear, 0.10.0, 'JavaPMDBear' bear for coala (http://coala.rtfd.org/), 2017-03-16T13:01:43+0000
/project/africanwordnet/, africanwordnet, 0.0.1, A library for African WordNet., 2020-11-25T16:46:54+0000
/project/file-logger/, file-logger, 1.0.5, , 2021-04-19T20:54:30+0000
/project/rltk/, rltk, 2.0.0a15, Record Linkage ToolKit, 2020-04-13T21:55:18+0000
/project/govetbear/, GoVetBear, 0.10.0, 'GoVetBear' bear for coala (http://coala.rtfd.org/), 2017-03-16T13:00:55+0000
/project/lena/, lena, 0.3, Lena is an architectural framework for data analysis, 2021-02-23T09:32:05+0000
/project/bw-migrations/, bw-migrations, 0.1, Migration data and utilities for Brightway IO and LCA in general, 2019-10-29T20:01:16+0000
/project/datrie/, datrie, 0.8.2, Super-fast, efficiently stored Trie for Python., 2020-03-26T03:31:53+0000
/project/regex/, regex, 2021.4.4, Alternative regular expression module, to replace re., 2021-04-04T16:50:49+0000
/project/rlr/, rlr, 2.4.5, Case weighted L2 regularized logistic regression, 2018-05-18T21:30:13+0000
/project/coniii/, coniii, 2.4.1, Convenient Interface to Inverse Ising (ConIII), 2021-01-08T21:54:02+0000
/project/tai5-uan5-gian5-gi2-kang1-ku7/, tai5-uan5-gian5-gi2-kang1-ku7, 0.6.52, 臺灣語言資訊系統（Toolkit for Languages in Taiwan）, 2020-01-16T08:35:18+0000
/project/wafer-map/, wafer-map, 1.1.2, Semiconductor Wafer Mapping, 2019-10-14T16:22:19+0000
/project/scifireaders/, SciFiReaders, 0.0.1, Tools for extracting data and metadata from scientific data files, 2021-02-07T14:32:40+0000
/project/infertweet/, infertweet, 0.2, Infer information from Tweets. Useful for human-centered computing tasks, such as sentiment analysis, location prediction, authorship profiling and more!, 2013-05-09T05:41:24+0000
/project/segmentify/, segmentify, 0.1.1, Python image segmentation plugin., 2020-05-17T19:10:19+0000
/project/rgmining-tripadvisor-dataset/, rgmining-tripadvisor-dataset, 0.5.6, Trip Advisor dataset for Review Graph Mining Project, 2017-06-24T06:06:15+0000
/project/sequana-variant-calling/, sequana-variant-calling, 0.9.5, A variant calling pipeline to analyse sequencing Illumina data, 2020-11-24T10:54:50+0000
/project/baresql/, baresql, 0.7.4, playing SQL directly on Python datas, 2016-09-18T12:56:43+0000
/project/pybaselines/, pybaselines, 0.2.0, A collection of algorithms for fitting the baseline of experimental data., 2021-04-02T22:15:24+0000
/project/molstruct/, molstruct, 3.0.0, Convert chemical molecule data CSV files to structured data formats, 2021-04-21T20:52:57+0000
/project/graphite-api/, graphite-api, 1.1.3, Graphite-web, without the interface. Just the rendering HTTP API., 2016-05-23T08:16:45+0000
/project/itk-phasesymmetry/, itk-phasesymmetry, 1.0.4, ITK classes for computing phase symmetry using multi-scale steerable filters, 2020-11-25T19:23:00+0000
/project/pythondcs/, pythondcs, 0.1.1, Python Module for interfacing with the Coherent Research DCS v3+ remote metering server, 2019-07-15T13:19:33+0000
/project/scikit-surgerycore/, scikit-surgerycore, 0.6.9, scikit-surgerycore contains commonly used Image Guided Surgery algorithms and tools, 2021-04-08T07:37:25+0000
/project/dhtioc/, dhtioc, 1.1.1, Provide humidity and temperature using EPICS and Raspberry Pi., 2020-08-20T14:44:54+0000
/project/spc/, spc, 0.3, Statistical Process Control library for monitoring process behaviour, 2009-01-26T05:28:05+0000
/project/see-rnn/, see-rnn, 1.15.1, RNN and general weights, gradients, & activations visualization in Keras & TensorFlow, 2020-11-11T18:18:00+0000
/project/crowdtruth-fork/, crowdtruth-fork, 2.1.1, Disagreement based metrics for the processing and evaluation of crowdsourced annotations, 2021-04-14T05:55:31+0000
/project/hdpwordseg/, hdpwordseg, 1.1.9, HDP Word Segmentor, 2015-06-08T15:06:26+0000
/project/dlsur/, DLSuR, 0.0.17, Dynamic light scattering microrheology data analysis package, 2020-10-26T17:04:33+0000
/project/erichek/, erichek, 0.4.0, Validation packages for Eric's rooms, 2019-05-06T14:39:18+0000
/project/pyclustering/, pyclustering, 0.10.1.2, pyclustring is a python data mining library, 2020-11-25T22:41:20+0000
/project/openfisca-dummy-country/, OpenFisca-Dummy-Country, 0.1.6, Dummy tax and benefit system used for tests, 2017-05-03T17:06:15+0000
/project/watson-machine-learning-client-v4/, watson-machine-learning-client-V4, 1.0.134, Watson Machine Learning API Client, 2021-02-15T12:46:32+0000
/project/vaquero/, vaquero, 0.0.5, A library for iterative and interactive data wrangling, 2018-02-08T00:03:48+0000
/project/halp/, halp, 1.0.0, Hypergraph Algorithms Package, 2014-10-22T04:02:12+0000
/project/pythesint/, pythesint, 1.5.0, A Python interface to various metadata vocabularies, 2021-01-19T13:10:12+0000
/project/python-crfsuite-extension/, python-crfsuite-extension, 0.9.7, Python binding for CRFsuite, 2018-12-25T10:05:58+0000
/project/meta-learn/, meta-learn, 0.0.5, Collection and utilization of metadata from machine learning models and problems., 2019-11-04T18:34:29+0000
/project/estnltk-1-4-light/, estnltk-1.4-light, 1.0.1, Estnltk-1.4-light is a heavily stripped-down version of estnltk 1.4 which only includes core instruments for text tokenization and morphological analysis including lemmatization., 2019-12-14T23:45:09+0000
/project/amulog/, amulog, 0.1.12, A system log management tool with automatically generated log templates., 2021-04-04T21:06:10+0000
/project/garrus/, garrus, 0.2.0, Garrus. Python framework for better confidence estimate of deep neural networks., 2021-04-18T14:57:46+0000
/project/synthetic/, synthetic, 0.0.1, Symbolic generators for complex networks, 2018-12-25T00:28:01+0000
/project/pyvista/, pyvista, 0.29.1, Easier Pythonic interface to VTK, 2021-04-14T05:45:14+0000
/project/hat-trie/, hat-trie, 0.3, HAT-Trie for Python, 2016-02-08T04:44:25+0000
/project/wikidump/, wikidump, 0.1.3, Tools to manipulate and extract data from wikipedia dumps, 2013-04-10T00:50:29+0000
/project/telemeta/, Telemeta, 1.6.4, Open web audio application with semantics, 2017-09-17T22:11:05+0000
/project/htsengine/, htsengine, 0.2.4, An extension for whose want to use hts engine by Python 3, 2016-01-12T11:34:11+0000
/project/rgmining-script/, rgmining-script, 0.6.1, Analyzing scripts for Review Graph Mining Project., 2017-06-22T16:30:34+0000
/project/pysurfex-scheduler/, pysurfex-scheduler, 0.0.1a2, Python abstraction layer for a scheduling system, 2020-12-07T11:26:30+0000
/project/pansurg/, pansurg, 0.2, Basic pip module for accessing coronavirus resources, 2020-05-05T10:44:35+0000
/project/psychrochart/, psychrochart, 0.3.1, A python 3 library to make psychrometric charts and overlay information on them, 2019-11-12T23:07:46+0000
/project/nlp-architect/, nlp-architect, 0.5.4, Intel AI Lab NLP and NLU research model library, 2020-04-12T11:34:38+0000
/project/ndex-utils-dev/, ndex-utils-dev, 3.0.11.8, NDEx Python utilities.  Includes file conversion and importing functions, 2017-01-06T23:46:57+0000
/project/keras-adamw/, keras-adamw, 1.38, Keras implementation of AdamW, SGDW, NadamW, Warm Restarts, and Learning Rate multipliers, 2020-10-26T16:01:20+0000
/project/biokit/, biokit, 0.4.6, Access to Biological Web Services from Python, 2020-04-01T12:43:41+0000
/project/clangcomplexitybear/, ClangComplexityBear, 0.10.0, 'ClangComplexityBear' bear for coala (http://coala.rtfd.org/), 2017-03-16T12:56:45+0000
/project/estnltk-textclassifier/, estnltk-textclassifier, 1.2.2, Machine learning software for organizing data into categories, 2015-07-29T12:26:19+0000
/project/fastdameraulevenshtein/, fastDamerauLevenshtein, 1.0.7, Cython implementation of true Damerau-Levenshtein algorithm., 2020-10-31T21:24:51+0000
/project/itk-higherorderaccurategradient/, itk-higherorderaccurategradient, 1.1.0, ITK filters to estimate higher order accurate derivative and gradients, 2021-04-06T21:20:54+0000
/project/scikit-surgerybk/, scikit-surgerybk, 0.3.3, Python package for interfacing with BK Ultrasound machines, 2019-07-11T12:34:54+0000
/project/pyvad/, pyvad, 0.1.3, py-webrtcvad wrapper for trimming speech clips, 2021-01-17T00:05:58+0000
/project/dax/, dax, 2.1.0, Distributed Automation for XNAT, 2021-03-30T00:06:22+0000
/project/esiosdata/, esiosdata, 0.6.10, Web Scraper para datos de demanda, producción y coste de la energía eléctrica en España, y simulador de facturación eléctrica según el PVPC.., 2017-05-19T15:45:23+0000
/project/ogdf-python/, ogdf-python, 0.1.0.dev0, Automagic Python Bindings for the Open Graph Drawing Framework written in C++, 2020-09-07T15:20:50+0000
/project/pykomoran/, PyKomoran, 0.1.5, PyKomoran is Python wrapper for KOMORAN, KOrean MORphical ANalyzer., 2019-04-18T15:44:07+0000
/project/futura/, futura, 0.0.3, A tool for LCA, 2019-11-25T12:29:59+0000
/project/intuition/, intuition, 0.4.3, A trading system building blocks, 2014-05-31T12:33:02+0000
/project/ivre/, ivre, 0.9.16, Network recon framework, 2020-12-08T14:53:50+0000
/project/metonym/, metonym, 0.2, Getting better path similarity measures from wordnet by graphing the synsets, 2012-02-07T19:12:22+0000
/project/threatbus-zmq-app/, threatbus-zmq-app, 2021.3.25, A plugin to connect apps via ZeroMQ., 2021-03-25T09:16:56+0000
/project/csvkit/, csvkit, 1.0.5, A suite of command-line tools for working with CSV, the king of tabular file formats., 2020-03-03T03:00:28+0000
/project/ampel-core/, ampel-core, 0.7.1, Asynchronous and Modular Platform with Execution Layers, 2021-04-23T07:35:21+0000
/project/consensus/, consensus, 0.1.1, Make suggestions and find similar users using collaborative filtering, 2006-03-19T03:08:06+0000
/project/corider/, corider, 0.1.4, Tiny configuration library tailored for Deep Learning project and the Ride., 2021-03-12T07:39:36+0000
/project/mlbox/, mlbox, 0.8.5, A powerful Automated Machine Learning python library., 2020-08-25T09:32:37+0000
/project/modbp/, modbp, 1.0.3, This is a community detection package that used a belief propagation approach to optimize modularity on multilayer networks.  Algorithm is implemented in c++ with python interface for convenience., 2020-08-14T20:01:35+0000
/project/phyaat/, phyaat, 0.0.2, PhyAAt: Physiology of Auditory Attention, 2020-05-22T00:35:07+0000
/project/osrframework/, osrframework, 0.20.4, OSRFramework - A set of AGPLv3+ OSINT tools developed by i3visio analysts for online research., 2021-02-11T13:29:33+0000
/project/nlper/, nlper, 0.0.1, dpack, 2017-05-18T14:16:45+0000
/project/flyshare/, flyshare, 0.0.21, A utility for providing historical and Real-time Quotes data of China stocks, 2017-12-05T11:21:18+0000
/project/lemmagen3/, lemmagen3, 3.3.1, A Python2/3 wrapper for Lemmagen lemmatizer supporting 19 languages., 2020-04-27T13:13:28+0000
/project/imagesplit/, ImageSplit, 0.3.4, Utility for splitting large image files into slices or chunks, 2021-02-28T22:56:50+0000
/project/stylelintbear/, StyleLintBear, 0.10.0, 'StyleLintBear' bear for coala (http://coala.rtfd.org/), 2017-03-16T12:58:54+0000
/project/secpip/, secpip, 1.0.0rc1, Secure Pip Package Management Tool, 2020-12-24T20:55:24+0000
/project/prov/, prov, 2.0.0, A library for W3C Provenance Data Model supporting PROV-JSON, PROV-XML and PROV-O (RDF), 2020-11-01T18:30:05+0000
/project/evolven/, evolven, 1.0.0, Evolven API Python Client, 2020-01-29T09:09:12+0000
/project/ilcs-parser/, ilcs-parser, 0.1.0, Probabilistic parser for tagging data that references the Illinois Compiled Statutes (ILCS)., 2020-06-16T20:20:46+0000
/project/pathlims/, pathlims, 1.0.0, A package to study the length boundaries of complex networks., 2019-11-22T21:24:44+0000
/project/osrframework-server/, osrframework-server, 0.18.0a4, OSRFramework Server - A HTTP server writen in Python to interact with OSRFramework., 2017-12-03T18:32:46+0000
/project/nskipgrams/, nskipgrams, 0.3.0, A lightweight Python package to work with ngrams and skipgrams, 2021-03-29T03:51:09+0000
/project/open-korean-text-python/, open-korean-text-python, 1.0.0, Python interface to Open Korean Text Processor, 2017-12-06T16:09:46+0000
/project/json2xlsx/, json2xlsx, 1.3, Tool to generate xlsx (Excel spreadsheet) from JSON, 2016-05-25T08:43:33+0000
/project/morf-api/, morf-api, 0.5.1, The MOOC Replication Framework Python API, 2019-02-10T18:50:30+0000
/project/atnlp/, atnlp, 0.0.11, A tool for natural language processing in python based on scipy and sklearn, 2018-06-17T02:36:47+0000
/project/cerocoinclient/, CeroCoinClient, 2.0.1, A Python based educational platform for learning and teaching the basic concepts of crypto currencies, 2018-03-24T20:19:25+0000
/project/cerebralcortex-restclient/, cerebralcortex-restclient, 3.3.0, REST client for CerebralCortex-APIServer., 2020-08-07T20:46:13+0000
/project/tensortrade/, tensortrade, 1.0.1b0, TensorTrade: A reinforcement learning library for training, evaluating, and deploying robust trading agents., 2020-12-20T18:30:31+0000
/project/ibm-watson-machine-learning/, ibm-watson-machine-learning, 1.0.70, IBM Watson Machine Learning API Client, 2021-04-07T08:55:28+0000
/project/datagristle/, datagristle, 0.2.1, A toolbox and library of ETL, data quality, and data analysis tools, 2021-04-21T01:26:26+0000
/project/imagepypelines/, imagepypelines, 0.3.0a0, data pipeline and convienence library targeted at accelerating the development of imaging projects and research, 2020-04-28T13:27:28+0000
/project/cartes/, cartes, 0.2, A generic toolbox for building maps in Python, 2021-04-04T21:34:38+0000
/project/libsncompress/, libsncompress, 0.0.8, Compress JLA-like supernova data, 2019-03-06T14:03:36+0000
/project/cellnopt-data/, cellnopt.data, 1.0.3, data and model repository for http://www.cellnopt.org project, 2014-03-04T13:49:02+0000
/project/mishmash-io-rpc/, mishmash-io-rpc, 0.0.4, mishmash gRPC client service, 2020-10-01T13:48:23+0000
/project/pyomop/, pyomop, 3.0.0, OMOP CDM utils in Python, 2020-10-23T15:25:53+0000
/project/best-script-realestate/, best-script-realestate, 1.0.6, Fork of Best script Real estate agencies & Travel agencies. Django + ReactJS. Reservation calendar, Mobile version, SEO, Admin panel , Classified ads., 2018-05-22T15:19:12+0000
/project/itk-montage/, itk-montage, 0.7.3, Montaging for microscopy imaging files., 2021-04-06T22:14:13+0000
/project/pidata/, PIdata, 0.2.2, An easy-to-use connector for the OSI PI historian, 2020-06-11T07:12:44+0000
/project/tablereader/, tablereader, 1.1.0, Unified abstraction for handling xls, xlsx and CSV files in Python, 2018-02-10T22:40:50+0000
/project/flexds/, flexds, 1.1, Flex is a framework for building and executing computing pipelines, 2016-01-25T20:51:21+0000
/project/mchmm/, mchmm, 0.4.1, Markov chains and Hidden Markov models, 2020-12-09T15:52:14+0000
