/project/shot-detector/, shot-detector, 0.0.5.dev3, Python shot detector based on PyAV, 2016-08-30T19:04:19+0000
/project/omelette/, Omelette, 1.1.6, Python Imaging Library, 2010-10-18T20:14:21+0000
/project/picamera-mqtt/, picamera-mqtt, 0.0.5, MQTT-based control and image capture with local and remote networked Raspberry Pi cameras., 2018-12-16T14:42:58+0000
/project/pd9530/, pd9530, 1.0.3, Library to interact with a PD9530 handheld scanner, 2016-02-14T12:28:04+0000
/project/sba/, sba, 1.6.8, wrapper for Lourakis' sparse bundle adjustment C library, 2017-08-08T22:22:43+0000
/project/spyder-screencast/, spyder-screencast, 0.0.12, screencaster for spyder 5., 2021-04-17T09:12:26+0000
/project/kazam/, kazam, 1.5.5, A screencasting program created with design in mind., 2019-08-27T07:04:29+0000
/project/paperwork-backend/, paperwork-backend, 2.0.2, Paperwork's backend, 2021-01-01T15:24:35+0000
/project/twistedexiftool/, TwistedExiftool, 0.1.4, Discontinued, use txExiftool (https://pypi.python.org/pypi/txExiftool), 2016-01-16T23:09:29+0000
/project/castro/, castro, 1.0.6, Screencasting library, 2011-04-12T21:06:32+0000
/project/pibooth-extra-lights/, pibooth-extra-lights, 1.0.1, Pibooth plugin for extra lights management., 2020-10-11T17:36:45+0000
/project/pibooth-google-photo/, pibooth-google-photo, 1.0.2, Pibooth plugin for Google Photos upload., 2020-05-25T09:12:23+0000
/project/desktopmagic/, Desktopmagic, 14.3.11, Robust multi-monitor screenshot grabber (Windows-only right now), 2014-03-11T02:10:18+0000
/project/libsonyapi/, libsonyapi, 1.0, Python binding for Sony Camera API, 2020-08-22T19:26:36+0000
/project/exifproxy/, exifproxy, 1.0.1, Metadata extraction reverse proxy based on twisted and exiftool, 2020-11-22T12:05:26+0000
/project/flirextractor/, flirextractor, 1.0.2, An efficient GPLv3-licensed Python package for extracting temperature data from FLIR IRT images., 2020-08-09T23:13:57+0000
/project/kivy-jetson/, Kivy-jetson, 2.1.0.dev0, A software library for rapid development of hardware-accelerated multitouch applications., 2021-02-17T16:47:10+0000
/project/pillow-simd/, Pillow-SIMD, 7.0.0.post3, Python Imaging Library (Fork), 2020-01-26T14:30:27+0000
/project/python-sane/, python-sane, 2.9.1, This is the python-sane package, 2021-01-05T13:12:03+0000
/project/needle/, needle, 0.5.0, Automated testing for your CSS., 2017-04-02T23:28:24+0000
/project/m3-pil/, m3-PIL, 1.1.7, Python Imaging Library, 2014-09-23T16:40:43+0000
/project/iotccsdk/, iotccsdk, 0.1.4, SDK in Python for interacting with the Vision AI DevKit. See https://aka.ms/visionaidevkit, 2019-06-20T00:33:07+0000
/project/blink2png-bridge/, blink2png-bridge, 0.1.4, To via blink2png by Python directly., 2020-04-04T08:46:14+0000
/project/wrpclient/, wrpclient, 0.1, Workswell Remote Protocol Client, 2020-01-31T20:32:35+0000
/project/multical/, multical, 0.1.5, Flexible multi-camera multi-board camera calibration library and application., 2021-04-14T07:20:13+0000
/project/adf2pdf/, adf2pdf, 0.8.2, Automate the workflow around ADF scanning, OCR and PDF creation, 2020-12-06T17:40:36+0000
/project/asyncffmpeg/, asyncffmpeg, 1.0.1, Supports async / await pattern for FFmpeg operations., 2021-03-18T17:17:59+0000
/project/libzbar-ctypes/, libzbar-ctypes, 0.1.2, Python ctypes libzbar wrapper, 2017-05-19T11:38:48+0000
/project/ocrd-fork-tesserocr/, ocrd-fork-tesserocr, 3.0.0rc2, A simple, Pillow-friendly, Python wrapper around tesseract-ocr API using Cython, 2019-07-18T08:57:09+0000
