/project/parsel/, parsel, 1.6.0, Parsel is a library to extract data from HTML and XML using XPath and CSS selectors, 2020-05-07T20:46:55+0000
/project/fiole/, fiole, 0.4.1, The handy Python web framework., 2014-07-03T07:31:40+0000
/project/rdfutils/, rdfutils, 0.1, Thin wrapper functions to work with an RDF store based on the Redland C library & Python bindings (python-librdf), 2013-04-22T07:56:19+0000
/project/js-module-introduce-myself/, js-module-introduce-myself, 2020.9.21.0, JavaScript module introduce myself, 2020-09-21T04:12:57+0000
/project/wsgiview/, wsgiview, 0.2.1, Use TurboGears template plug-ins anywhere WSGI runs, 2007-01-02T00:03:47+0000
/project/jinja/, Jinja, 1.2, A small but fast and easy to use stand-alone template engine written in pure python., 2007-11-17T21:37:34+0000
/project/emmett-haml/, emmett-haml, 1.0.0, HAML syntax for Emmett templates, 2020-10-18T15:27:01+0000
/project/ocxsect/, ocxsect, 0.1.5, A python markdown extension that allows you to add semantic HTML5 sectioning elements into the generated html., 2019-08-15T15:01:13+0000
/project/tumulus/, Tumulus, 0.2.1, Python HTML Generator for Recyclable Web Elements, 2014-08-11T00:03:28+0000
/project/ds100-textbook-zh/, ds100-textbook-zh, 2020.9.21.0, UCB DS100 数据科学的原理与技巧, 2020-09-21T03:51:52+0000
/project/deepify/, deepify, 0.3.2, Deepify - A set of GPLv3+ libraries to deal with Deepweb connections., 2016-03-17T07:30:45+0000
/project/python-markdown-cloudinary/, python-markdown-cloudinary, 1.0.0, Markdown extension to display and manipulate images on Cloudinary., 2015-08-13T10:12:22+0000
/project/mackerel/, mackerel, 0.2, Minimal static site generator built with type annotations, 2017-07-11T22:23:54+0000
/project/markdown-notebook/, markdown-notebook, 1.0, Python markdown extension to render Jupyter output notation, 2019-02-08T10:27:59+0000
/project/calc4b-zh/, calc4b-zh, 2020.9.21.0, MIT 18.03 面向初学者的微积分, 2020-09-21T03:47:23+0000
/project/tosixinch/, tosixinch, 0.5.0, Browser to e-reader in a few minutes, 2020-08-23T15:10:11+0000
/project/django-inlinecss/, django-inlinecss, 0.3.0, A Django app useful for inlining CSS (primarily for e-mails), 2019-10-24T17:30:55+0000
/project/rst2html5slides/, rst2html5slides, 1.2.2, rst2html5slides generates a slideshow from a reStructuredText file., 2018-11-17T03:39:20+0000
/project/example-aless80/, example-aless80, 1.5.4, Markup language similar to Markdown targeting scientific reports, software documentation, books, blog posts, and slides. DocOnce can generate LaTeX, Sphinx, HTML, IPython notebooks, Markdown, MediaWiki, and other formats, 2021-03-02T08:39:48+0000
/project/statico/, statico, 0.2.1, Static site generator, 2015-09-06T18:05:54+0000
/project/pisa/, pisa, 3.0.33, PDF generator using HTML and CSS, 2010-06-16T14:09:56+0000
/project/chameleon-html/, chameleon.html, 0.9.3, Dynamic HTML template compiler with XSS language support., 2009-02-13T18:05:01+0000
/project/docupy/, docupy, 0.3.2, A markdown library., 2020-04-10T11:41:43+0000
/project/web-hacking-101-zh/, web-hacking-101-zh, 2020.9.21.0, Web Hacking 101 中文版, 2020-09-21T04:53:01+0000
/project/html5print/, html5print, 0.1.2, HTML5, CSS, Javascript Pretty Print, 2016-09-01T02:20:19+0000
/project/samdown/, samdown, 0.2.0, A markdown library, 2017-03-12T21:33:45+0000
/project/antimarkdown/, antimarkdown, 1.0.2, HTML to Markdown converter., 2018-06-01T19:59:18+0000
/project/rtfde/, RTFDE, 0.0.2, A library for extracting HTML content from RTF encapsulated HTML as commonly found in the exchange MSG email format., 2020-12-28T15:15:35+0000
/project/formalchemy/, FormAlchemy, 1.5.6, FormAlchemy greatly speeds development with SQLAlchemy mapped classes (models) in a HTML forms environment., 2020-11-12T10:56:58+0000
/project/mdx-bleach/, mdx_bleach, 0.1.4, Python-Markdown extension to sanitize the output of untrusted Markdown documents., 2018-05-21T02:59:09+0000
/project/online-resume/, online-resume, 2020.9.21.0, Online Resume, 2020-09-21T04:34:08+0000
/project/mdx-footnotes2/, mdx-footnotes2, 0.3.0, The official Python markdown "footnotes" extension, with additional options., 2021-04-09T07:55:12+0000
/project/sitekicker/, sitekicker, 1.0.6, Another static site generator, 2020-05-03T07:17:28+0000
/project/pymdown-toc-ext/, pymdown-toc-ext, 1.3.1, An extension for Python-Markdown which extends the built-in toc extension with additional capabilities to customize the generated table of contents., 2021-03-17T18:37:36+0000
/project/mdx-custom-span-class/, mdx-custom-span-class, 1.1.3, Markdown extension which allows inserting span elements with custom class, 2019-09-10T12:34:56+0000
/project/justext/, jusText, 2.2.0, Heuristic based boilerplate removal tool, 2016-03-06T18:01:09+0000
/project/markdown-jinja/, markdown-jinja, 0.1.0, Python Markdown extension which adds Jinja2 support, 2018-02-05T22:45:32+0000
/project/scrapely/, scrapely, 0.14.1, A pure-python HTML screen-scraping library, 2019-11-28T11:03:32+0000
/project/markdown-headdown/, markdown-headdown, 0.1.3, A Python-Markdown extension to downgrade headings, 2018-11-10T01:58:02+0000
/project/metadata-parser/, metadata-parser, 0.10.5, A module to parse metadata out of urls and html documents, 2021-03-26T16:08:00+0000
/project/xgboost-doc-zh/, xgboost-doc-zh, 2020.9.21.0, <center>XGBoost 中文文档</center>, 2020-09-21T04:53:36+0000
/project/logya/, logya, 4.7.2, Logya: easy to use and flexible static Web site generator., 2020-11-18T20:30:09+0000
/project/django-rest-framework-mongoengine/, django-rest-framework-mongoengine, 3.4.1, MongoEngine support for Django Rest Framework., 2020-01-02T13:56:12+0000
/project/dexy-filter-examples/, dexy_filter_examples, 0.0.4, Filter example templates., 2014-01-10T03:47:19+0000
/project/atropine/, atropine, 0.2, HTML Scraper Thing, 2005-11-29T01:29:21+0000
/project/htmllist/, HtmlList, 2.2.2, Extract information from HTML pages that have some kind of a repetitive pattern, 2010-10-16T11:07:38+0000
/project/geeksforgeeks-zh/, geeksforgeeks-zh, 2020.9.21.0, GeeksForGeeks 中文系列教程, 2020-09-21T03:54:31+0000
/project/chemdataextractor/, ChemDataExtractor, 1.3.0, A toolkit for extracting chemical information from the scientific literature., 2017-02-03T00:12:04+0000
/project/djungle-hyphenator/, djungle-hyphenator, 0.0.5, Hyphenator.js as Django app., 2013-03-30T16:03:13+0000
/project/wq-db/, wq.db, 1.2.1, Django design patterns and REST API for citizen science field data collection., 2020-09-02T05:10:10+0000
/project/farbox-misaka/, farbox-misaka, 0.0.2, A FarBox flavored Markdown parser (by Misaka Markdown parser)., 2021-02-01T01:49:47+0000
/project/spritify/, spritify, 0.4.2, The spritify is a tool for transform directory of images in the stylesheet and image file., 2015-03-31T03:39:12+0000
/project/elasticsearch-doc-zh/, elasticsearch-doc-zh, 2020.9.21.0, Elasticsearch 5.4 中文文档, 2020-09-21T03:26:44+0000
/project/textminer/, textminer, 1.3.1, Extracts content from html using rules., 2017-12-26T08:01:49+0000
/project/mdx-gh-links/, mdx_gh_links, 0.2, An extension to Python-Markdown which adds support for shorthand links to GitHub users, repositories, issues and commits., 2018-03-09T17:17:17+0000
/project/pymdown-typehint/, pymdown-typehint, 0.2.0, A Python-Markdown extension for styling variable types in-line, 2020-05-11T18:10:06+0000
/project/pytidyhtml5/, pytidyhtml5, 2021.1.11, HTML clean-up and repair: Statically linked Python interface for tidy-html5., 2021-01-11T23:12:40+0000
/project/ruby2shoes/, ruby2shoes, 1.09, low-resource writer's software for screenplays and fiction, 2007-10-14T18:02:16+0000
/project/pdfmate/, pdfmate, 0.4.9, Pyppeteer-based async python wrapper to convert html to pdf, 2020-12-06T12:56:36+0000
/project/pdfkit/, pdfkit, 0.6.1, Wkhtmltopdf python wrapper to convert html to pdf using the webkit rendering engine and qt, 2017-01-09T15:44:16+0000
/project/xml2data/, xml2data, 0.1.0, a library for converting xml into native data, 2013-03-02T15:57:22+0000
/project/pithytools/, pithytools, 0.0.1, Pithytools is a collection of command line utilities., 2020-05-06T16:10:08+0000
/project/markdown-bokeh/, markdown-bokeh, 0.1.1, This is an extension to Python-Markdown which provides the ability to include plots from bokeh., 2018-01-05T20:15:20+0000
/project/apachecn-ds-zh/, apachecn-ds-zh, 2020.10.30.0, ApacheCN 数据科学和机器学习译文集, 2020-10-30T05:19:34+0000
/project/mdx-semanticdata/, mdx_semanticdata, 1.1, Python-Markdown extension to add support for semantic data (RDFa)., 2012-11-05T00:35:39+0000
/project/uiuc-cs241-notes-zh/, uiuc-cs241-notes-zh, 2020.9.21.0, UIUC CS241 系统编程中文讲义, 2020-09-21T04:52:29+0000
/project/xmlbuilder/, xmlbuilder, 1.0, pythonic way to create xml/(x)html files. Updated version with fixes, unicode support and cleaned API., 2011-12-14T00:50:43+0000
/project/richxerox/, richxerox, 1.0.1, copy/paste for Mac OS X for rich text (HTML/RTF) rather than plain text, 2017-11-16T23:13:35+0000
/project/choubun/, choubun, 1.3.0, A library for generating HTML from Python using context managers, 2020-06-23T20:18:44+0000
/project/dragoncreole/, DragonCreole, 0.2.5.1, Optimized parser for creole-like markup language, 2017-05-26T21:17:48+0000
/project/textpipe-pattern/, textpipe-pattern, 3.6.1, Web mining module for Python., 2019-03-27T12:16:53+0000
/project/lmpythw-zh/, lmpythw-zh, 2020.9.21.0, 笨办法学 Python · 续 中文版, 2020-09-21T04:15:24+0000
/project/pluralize/, pluralize, 0.1.6, i18n + pluralization library with multi-plural form support and thread safe for web, 2020-09-11T06:23:58+0000
/project/stuphos/, stuphos, 1.0.15, Containerization middleware., 2020-11-05T13:18:05+0000
/project/htmlcssinclude/, HtmlCssInclude, 0.1.2, HtmlCssInclude convert css to inline style for mobile, 2011-03-30T07:53:07+0000
/project/sumy/, sumy, 0.8.1, Module for automatic summarization of text documents and HTML pages., 2019-05-19T14:38:29+0000
/project/khl-team/, khl_team, 1.0, Interface for obtaining data about KHL teams, 2017-02-12T01:10:26+0000
/project/pyqt4-doc-zh/, pyqt4-doc-zh, 2020.9.21.0, PyQt4 中文文档, 2020-09-21T04:38:48+0000
/project/markdown-changelog/, markdown-changelog, 0.0.4, Python-Markdown extension for easy changelog tagging, 2020-09-11T12:25:54+0000
/project/weppy-haml/, weppy-Haml, 0.4, Haml syntax for weppy templates, 2017-07-17T12:52:11+0000
/project/wq-app/, wq.app, 1.2.0, Offline-capable HTML5 web and hybrid apps for citizen science field data collection., 2020-01-22T07:12:47+0000
/project/surely/, surely, 0.1, Pythonic XML Shorthand, 2006-02-26T09:25:16+0000
/project/manga-py-providers/, manga-py.providers, 2.0a1, , 2019-11-24T11:59:46+0000
/project/lightnovel-crawler/, lightnovel-crawler, 2.25.1, An app to download novels from online sources and generate e-books., 2021-04-25T01:53:14+0000
/project/depdf/, depdf, 0.2.2, PDF table & paragraph extractor, 2020-06-12T12:12:38+0000
/project/pydantic-distiller/, pydantic-distiller, 0.1.0b8, HTML/JSON documents parser into Pydantic models, 2020-10-09T14:00:44+0000
/project/tibia-py/, tibia.py, 4.1.1, API that parses website content into python data., 2021-04-19T20:21:02+0000
/project/the-way-to-wealth-freedom-notes/, the-way-to-wealth-freedom-notes, 2020.9.21.0, 通往财富自由之路精细笔记, 2020-09-21T04:47:04+0000
/project/bookertrans/, BookerTrans, 2021.4.9.2, HTML Translator with Google Api for iBooker/ApacheCN, 2021-04-10T03:51:36+0000
/project/md-mermaid-ort/, md-mermaid-ort, 0.1.5, Fork of original md_mermaid by Olivier Ruelle, including some fixes with PR awaiting on the upstream, 2020-10-30T08:09:03+0000
/project/opengrapher/, opengrapher, 0.4, Utility for parsing the OpenGraph tags, 2020-11-13T11:59:45+0000
/project/parsedom/, parsedom, 1.0.0, A fast DOM parser, 2014-03-24T12:55:17+0000
/project/kiroku/, kiroku, 0.8.0, Static blog generator, 2014-01-02T09:23:16+0000
/project/djungle-pegjs/, djungle-pegjs, 0.0.2, PEG.js as Django app., 2012-07-13T20:54:03+0000
/project/pynfact/, pynfact, 1.3.2, Blog-oriented static website generator using Markdown or reStructuredText., 2020-08-05T10:32:27+0000
/project/markdown-mdantic/, markdown-mdantic, 1.3.1, Python-Markdown extension for rendering pydantic BaseModel as table, 2020-08-12T01:48:07+0000
/project/benker/, Benker, 0.5.2, Easily convert your CALS, HTML, Formex4, Office Open XML (docx) tables from one format to another., 2019-11-25T16:39:45+0000
/project/markdown/, Markdown, 3.3.4, Python implementation of Markdown., 2021-02-24T19:57:49+0000
/project/pwt-jinja2js/, pwt.jinja2js, 0.8.1, pwt.jinja2js is an extension to the Jinja2 template engine that compiles
valid Jinja2 templates containing macros to JavaScript. The JavaScript output
can be included via script tags or can be added to the applications JavaScript., 2013-02-28T14:50:07+0000
/project/django-richtexteditor/, django-richtexteditor, 0.0.1.dev3, Django Rich Text Editor with many flavors, 2020-07-22T16:25:32+0000
/project/beampy-slideshow/, beampy-slideshow, 0.5.5.post1, A python tool to create simple HTML5 presentation slideshow, 2019-07-08T07:16:09+0000
/project/djungle-less/, djungle-less, 0.0.3, LESS for Django, 2012-07-13T21:19:37+0000
/project/omero-forms/, omero-forms, 1.1.0, OMERO forms app for enhanced metadata input and provenance, 2020-05-07T06:46:59+0000
/project/htmlmin/, htmlmin, 0.1.12, An HTML Minifier, 2017-12-29T16:41:36+0000
/project/css-parser/, css-parser, 1.0.6, A CSS Cascading Style Sheets library for Python, 2020-10-28T03:31:19+0000
/project/mkdocs-swan/, mkdocs-swan, 0.1.0, SWAN theme for MkDocs, 2020-08-01T15:50:56+0000
/project/holly/, holly, 0.3.0, A blog-engine plugin for Ivy., 2020-12-30T21:08:16+0000
/project/dominate/, dominate, 2.6.0, Dominate is a Python library for creating and manipulating HTML documents using an elegant DOM API., 2020-10-21T07:01:43+0000
/project/html5witch/, html5witch, 0.2.1, html5witch offers Pythonic HTML5 generation based on xmlwitch, 2011-01-12T18:41:48+0000
/project/embeddify/, embeddify, 0.3.1, converts URLs to embed codes, 2017-08-28T10:55:49+0000
/project/citylink-utils/, citylink-utils, 0.8, Simple utility package to handle CityLink dispatches for commercial customers, 2014-07-11T20:49:13+0000
/project/mdx-smartypants/, mdx_smartypants, 1.5.1, Python-Markdown extension using smartypants to emit typographically nicer ("curly") quotes, proper ("em" and "en") dashes, etc., 2013-11-18T13:57:09+0000
/project/xlsconv/, xlsconv, 1.2.0, Tool to convert ODK-style XLSForms into Django models and HTML templates for use with wq (https://wq.io/), 2020-09-02T07:36:37+0000
/project/python-creole-atlassian/, python-creole-atlassian, 1.4.92, python-creole is an open-source (GPL) markup converter in pure Python for: creole2html, html2creole, html2ReSt, html2textile, 2020-11-20T15:03:15+0000
/project/mkdocs-material/, mkdocs-material, 7.1.3, A Material Design theme for MkDocs, 2021-04-24T11:10:28+0000
/project/pydhtmlparser/, pyDHTMLParser, 2.2.3, Python HTML/XML parser for easy web scraping., 2020-04-12T21:10:45+0000
/project/flink-doc-zh/, flink-doc-zh, 2021.4.11.0, Flink 中文文档, 2021-04-11T13:42:32+0000
/project/weasyprint/, weasyprint, 52.5, The Awesome Document Factory, 2021-04-17T15:22:49+0000
/project/genshi-forms/, genshi-forms, 1.0, Form generator and validator for Genshi, 2009-05-17T01:16:43+0000
/project/html-tree-diff/, html-tree-diff, 0.1.2, Structure-aware diff for html and xml documents, 2011-02-16T20:37:58+0000
/project/hamill/, hamill, 0.2.4, A lightweight markup language, 2021-03-15T15:06:14+0000
/project/django-rest-framework-mongoengine-hack/, django-rest-framework-mongoengine-hack, 1.0.0, Hack for django-rest-framework-mongoengine to support newer mongoengine and drf, 2015-11-13T10:02:42+0000
/project/dayone-export/, dayone_export, 1.0.0, Export Day One journal using Jinja2 templates, 2018-05-09T03:01:02+0000
/project/js-tinymce/, js.tinymce, 4.5.4, Fanstatic packaging of TinyMCE, 2017-03-07T08:42:57+0000
/project/markdown-include/, markdown-include, 0.6.0, This is an extension to Python-Markdown which provides an "include" function, similar to that found in LaTeX (and also the C pre-processor and Fortran). I originally wrote it for my FORD Fortran auto-documentation generator., 2020-08-20T23:10:25+0000
/project/renoir-haml/, renoir-haml, 1.0.0, HAML syntax for Renoir templates, 2020-03-15T22:31:38+0000
/project/apachecn-cs-zh/, apachecn-cs-zh, 2021.1.7.0, ApacheCN 计算机科学译文集, 2021-01-07T15:47:23+0000
/project/manga-py-utils/, manga-py.utils, 2.0, , 2020-05-02T23:00:37+0000
/project/htmlpyever/, htmlpyever, 0.1.0.post3, Python bindings to html5ever, 2017-03-04T01:17:39+0000
/project/xpath-py/, xpath-py, 0.1.2, Python library for generating XPath expressions, 2017-09-09T22:16:01+0000
/project/dotapatch/, dotapatch, 2.4.4, Parse Dota 2 text patches to html format., 2018-06-28T14:45:36+0000
/project/himl/, himl, 0.7.2, A hierarchical config using yaml, 2021-04-23T09:30:40+0000
/project/algo-zh/, algo-zh, 2020.9.27.0, 结构化算法刷题训练指南, 2020-09-27T13:49:00+0000
/project/leboncrevard/, leboncrevard, 0.1.1, Python scrapper / mailer for the french ad website leboncoin.fr, 2017-02-25T09:03:16+0000
/project/htmlnode/, HtmlNode, 0.1.8, A simple Python HTML generator, 2013-10-27T07:43:19+0000
/project/business-5min-notes/, business-5min-notes, 2020.9.21.0, 5 分钟商学院精细笔记, 2020-09-21T03:46:35+0000
/project/pypage/, pypage, 2.0.7, Light-weight Python Templating Engine, 2018-08-20T22:40:39+0000
/project/hypotonic/, hypotonic, 0.0.15, Fast asynchronous web scraper with minimalist API., 2020-09-27T16:41:50+0000
/project/mkdocs-swangallery/, mkdocs-swangallery, 0.0.3, Plugin for MkDocs to genereate a SWAN Gallery, 2020-10-01T11:07:43+0000
/project/geolucidate/, geolucidate, 0.4, Parse free-form geographic coordinates in text, and automatically generate links and metadata., 2011-07-08T19:18:51+0000
/project/domonic/, domonic, 0.2.13, Generate html with python 3. DOM API, Javascript API and more..., 2021-04-17T13:45:12+0000
/project/jinja2-maps/, jinja2_maps, 0.2.0, Maps filters for Jinja2, 2016-03-23T15:17:55+0000
/project/html3/, html3, 1.18, simple, elegant HTML, XHTML and XML generation for python3 (based on html), 2020-03-30T15:25:10+0000
/project/markdown-customblocks/, markdown-customblocks, 1.1.1, Python Markdown extension to add custom parametrizable and nestable blocks, 2020-08-09T07:43:29+0000
/project/ivy/, ivy, 5.1.0, A static website generator for people who enjoy the simpler things in life., 2021-01-20T14:32:04+0000
/project/apachedex/, APacheDEX, 1.8, Compute APDEX from Apache-style logs., 2021-01-21T05:51:01+0000
/project/komar/, KoMar, 0.5, KoMar is simple wiki-markup heavily based on Creole, 2011-05-30T21:20:45+0000
/project/djungle-favicons/, djungle-favicons, 0.0.0, Favicon auto-generation for Django, 2012-03-14T21:00:46+0000
/project/halweb/, HalWeb, 0.6.0, Halicea Web Framework(HalWeb) is an Appengine MVC web framework for real easy, understandable and rapid development, 2012-01-06T03:12:06+0000
/project/html-auto/, HTML-Auto, 0.0.4, Just another HTML tag generator (for Python), 2020-01-15T16:18:22+0000
/project/pytest-reporter-html1/, pytest-reporter-html1, 0.8.1, A basic HTML report template for Pytest, 2020-11-02T19:32:55+0000
/project/python-utilities-jsm/, python-utilities-jsm, 1.0.2, Myriad python utilities., 2021-04-14T03:11:04+0000
/project/mf2util/, mf2util, 0.5.1, Python Microformats2 utilities, a companion to mf2py, 2018-11-05T05:29:08+0000
/project/hq/, hq, 0.0.4, Command-line tool for querying, slicing & dicing HTML using the XPath/XQuery derivative HQuery., 2017-12-03T17:27:33+0000
/project/pynliner/, pynliner, 0.8.0, Python CSS-to-inline-styles conversion tool for HTML using BeautifulSoup and cssutils, 2017-01-10T19:36:56+0000
/project/dyplot/, dyplot, 0.8.8, matplotlib-like plot functions for dygraphs.js and c3.js., 2015-11-18T02:30:15+0000
/project/katagami/, katagami, 2.0.1, katagami: a simple xml/html template library, 2014-03-10T16:58:03+0000
/project/pyramid-chameleon/, pyramid_chameleon, 0.3, pyramid_chameleon, 2014-07-01T17:47:35+0000
/project/thcolor/, thcolor, 0.3.1, color management module, 2019-05-10T11:31:05+0000
/project/markdown-wavedrom/, markdown-wavedrom, 1.0.0, Support for WaveDrom in Python Markdown, 2021-03-06T10:29:49+0000
/project/page-scrapers/, page-scrapers, 2.3.0, Scrapers for specific websites, 2019-06-29T17:08:26+0000
/project/govuk-frontend-wtf/, govuk-frontend-wtf, 0.1.1, GOV.UK Frontend WTForms Widgets, 2021-03-05T12:32:45+0000
/project/pythonguru-zh/, pythonguru-zh, 2020.9.21.0, PythonGuru 中文系列教程, 2020-09-21T04:40:09+0000
/project/asha/, asha, 0.0.4, An unicode and ascii colour, emotes, art and loader library for terminals., 2020-01-15T11:02:49+0000
/project/pyminer-dev-guide/, pyminer-dev-guide, 2020.10.28.1, PyMiner 开发者指南, 2020-10-28T03:22:06+0000
/project/piratebaybua/, PirateBayBUA, 0.0.1r004-apha-chyctu, PirateBay Json, Python Query analysis, implemented with Better User Agent and Aparatus in << Software Pirating Analysis >> know in detection of malware, virus and Evil intention., 2013-09-04T20:58:08+0000
/project/mkdocs-material-extensions/, mkdocs-material-extensions, 1.0.1, Extension pack for Python Markdown., 2020-09-22T21:36:10+0000
/project/flask-mdform/, Flask-mdform, 0.1.1, Parse Markdown form and generate serializable FlaskForm, 2021-04-25T18:37:58+0000
/project/markyp-highlightjs/, markyp-highlightjs, 0.1910.0, Highlight.js-based syntax highlighting for web pages built with markyp-html, 2019-10-14T17:56:01+0000
/project/pywiktionary/, pywiktionary, 0.4a1.post1, Python library to retrieve wiktionary word definitions for different languages, 2021-01-28T20:11:22+0000
/project/principles-zh/, principles-zh, 2020.9.22.0, 原则 · 中文版, 2020-09-22T09:47:30+0000
/project/wanish/, wanish, 0.6.3, open source implementation of summly, 2016-12-11T12:10:55+0000
/project/eloquent-js-3e-zh/, eloquent-js-3e-zh, 2020.9.21.0, JavaScript 编程精解 中文第三版, 2020-09-21T03:52:11+0000
/project/cmarkdown/, cMarkdown, 0.1.1, Markdown for Python, accelerated by C., 2011-04-21T05:37:41+0000
/project/argot/, Argot, 0.6, argot text markup -- a markdown dialect, 2010-11-03T23:16:26+0000
/project/wq-start/, wq.start, 1.2.1, Project scaffolding tools for creating a new crowdsourcing or citizen science application with the wq framework., 2020-09-02T07:57:14+0000
/project/markdown-captions/, markdown-captions, 2, Turn markdown images into captioned images using <figure>, 2019-11-08T04:06:40+0000
/project/docraptor/, docraptor, 2.0.0, A wrapper for the DocRaptor HTML to PDF/XLS service., 2020-08-03T13:51:12+0000
/project/magictree/, magictree, 1.0.0, Easily create ElementTree with automatic Element factories, 2011-07-06T14:46:36+0000
/project/pandoc-gpp/, pandoc-gpp, 0.2.5, pandoc-gpp is wrapper around pandoc and gpp to provide mode functionalities to pandoc users, 2013-08-06T14:14:02+0000
/project/django-ginger/, django_ginger, 0.9.3, Set of django utilities, 2018-04-19T15:48:40+0000
/project/skunk-web/, skunk.web, 4.0.0a2dev-r227, SkunkWeb 4 web framework, 2008-10-04T02:48:27+0000
/project/md-environ/, md-environ, 0.1.0, This is an extension to Python-Markdown which allows environment variables to be used in the text., 2016-07-20T02:14:55+0000
/project/markdown-doi/, markdown-doi, 1.1.0, Convert doi:10.xxxxx/xxxx to nice bibliographic metadata, 2019-01-22T21:03:06+0000
/project/quant-learning/, quant-learning, 2020.10.26.1, QuantLearning, 2020-10-26T08:19:31+0000
/project/html5-parser/, html5-parser, 0.4.9, Fast C based HTML 5 parsing for python, 2019-11-03T03:14:33+0000
/project/python-comrak/, python-comrak, 0.5.0, Markdown HTML converters for Python made in Rust, 2020-10-30T20:56:30+0000
/project/mkdocs-rokubun/, mkdocs-rokubun, 5.5.12, A fork of Material Design theme for MkDocs for Rokubun, 2020-09-02T16:48:24+0000
/project/revelation/, revelation, 1.1.0, Make awesome reveal.js presentations with revelation, 2019-07-15T21:08:42+0000
/project/pythonbasics-zh/, pythonbasics-zh, 2020.9.21.0, PythonBasics 中文系列教程, 2020-09-21T04:39:51+0000
/project/gxsphinx/, GxSphinx, 1.0.0, Python documentation generator, 2020-08-04T03:07:53+0000
/project/django-statomatic/, django-statomatic, 0.8.12, Pure Django static site generator, 2011-10-28T23:09:24+0000
/project/opencv-doc-zh/, opencv-doc-zh, 2020.9.21.0, OpenCV 中文文档 4.0.0, 2020-09-21T04:35:32+0000
/project/syntags/, syntags, 0.2.0, A beautiful python syntax to generate HTML., 2020-03-11T06:00:31+0000
/project/dexy-guide-templates/, dexy-guide-templates, 0.0.6, Templates for the Dexy Guide, including Getting Started., 2020-03-31T21:37:15+0000
/project/htmlgen/, htmlgen, 2.0.0, HTML 5 Generator, 2020-07-22T21:02:42+0000
/project/buml/, buml, 0.1.6, buml markup language, 2012-05-25T12:42:51+0000
/project/html5/, html5, 0.0.9, HTML parser based on the WHATWG HTML specification, 2016-08-05T09:20:21+0000
/project/rstwatch/, rstwatch, 1.0.3, Watch directories for changes to RST files and generate HTML, 2019-08-22T03:35:45+0000
/project/secure-markdown/, secure-Markdown, 2.3.dev, Python implementation of Markdown., 2013-02-07T15:31:13+0000
/project/rst2json/, rst2json, 0.3.0, Split rendered reStructuredText into JSON, 2020-07-14T22:07:02+0000
/project/pqmarkup/, pqmarkup, 2021.3, A Python implementation of pq markup to HTML converter., 2021-03-07T22:32:56+0000
/project/pytagcloud/, pytagcloud, 0.3.5, Create beautiful tag clouds as images or HTML, 2012-02-14T09:55:44+0000
/project/linkable/, linkable, 0.2.2, Detect URL, Email, Hashtag and Mention from plain-text and convert into HTML hyperlink., 2019-07-02T09:09:27+0000
/project/zetcode-zh/, zetcode-zh, 2020.9.21.0, ZetCode 中文系列教程, 2020-09-21T04:54:58+0000
