/project/rebookmaker/, rebookmaker, 0.8.6, EPUB generator, 2021-04-17T19:19:21+0000
/project/configsetslib/, configsetslib, 0.0.1, PyPi package created by Schibsted's Product & Application Security team., 2021-02-16T08:34:30+0000
/project/scriptgen/, scriptgen, 0.0.5, A collection of script generation helpers and templates., 2021-01-13T11:29:23+0000
/project/zenfilter/, zenfilter, 0.6.3, Filter stdin to avoid excessive output, 2020-10-29T15:47:01+0000
/project/pyproject-analyzer/, pyproject-analyzer, 0.0.3, First module of PYCAudit (Python Code Audit) which aims to purpose an complet audit tool for Python Code, 2020-12-14T13:44:58+0000
/project/maintenancedb/, MaintenanceDB, 0.0.1a1, Manage providers maintenance notifications and fire alarms or invoke hooks, 2019-06-07T09:56:32+0000
/project/elecfence/, elecfence, 0.0.6, A electronic fence package, 2018-09-13T04:45:59+0000
/project/celery-amqp-events/, celery-amqp-events, 0.0.4, Distributed event handling on top of Celery, 2020-10-01T15:40:42+0000
/project/vivid-root/, vivid-root, 0.0.1, Algorithm Classification Catalog, 2019-10-19T16:15:12+0000
/project/relu/, relu, 0.0.1, google, 2021-04-19T21:14:03+0000
/project/nebliopy/, nebliopy, 0.0.1, , 2018-04-18T17:02:39+0000
/project/prosper/, prosper, 0.0.0.0.dev20200918, , 2020-09-18T06:18:41+0000
/project/sdllib/, sdllib, 0.0.0, WIP, 2021-04-20T08:11:23+0000
/project/teacher/, teacher, 0.0.2, attr: teacher.__doc__, 2020-05-22T12:59:06+0000
/project/billoprotobuf/, billoprotobuf, 0.0.0, internal use, 2021-02-10T19:18:13+0000
/project/pytorch-quant-tool/, pytorch-quant-tool, 1.3.1, An experimental neural network quantization environment in Pytorch., 2019-11-13T05:53:36+0000
/project/assertdb/, AssertDB, 0.0.1, A Database Precondition and Assertion Tool, 2016-12-01T17:14:52+0000
/project/django-rest-jwt-sso/, django-rest-jwt-sso, 0.0.5, Yet another SSO solution for Django REST Framework, 2019-05-16T09:03:49+0000
/project/pydisconf/, pydisconf, 0.1.6.dev1, Python client of disconf, 2017-09-11T03:49:40+0000
/project/nibetaseries/, nibetaseries, 0.6.0, BetaSeries Correlations implemented in Nipype, 2020-04-09T23:27:34+0000
/project/swaggerpy/, swaggerpy, 0.2.1, Library for accessing Swagger-enabled API's, 2014-08-12T02:57:28+0000
/project/django-widget-list/, django-widget_list, 0.10.0, An Advanced and flexible ajax data grid, 2013-05-22T15:11:02+0000
/project/oktaauth/, oktaauth, 0.2, Authenticates from the CLI, 2016-02-08T16:21:28+0000
/project/drinkwater/, drinkwater, 0.0.0, Drink water, 2019-06-11T03:37:07+0000
/project/tet-fanstatic/, tet.fanstatic, 0.1, Fanstatic integration for tet, 2015-09-06T13:33:32+0000
/project/asthook/, asthook, 0.0.5, Analyse apk source code and make a dynamic analysis, 2020-11-08T14:35:13+0000
/project/alita-graphql/, alita-graphql, 0.1.0, alita-graphql is graphql extension for Alita。, 2019-03-22T08:24:13+0000
/project/apitoolkit/, APIToolkit, 0.1.0, A Web API development toolkit for Python web frameworks., 2021-01-06T13:23:40+0000
/project/available/, available, 0.0.1, dropbox, 2021-04-19T22:19:03+0000
/project/mixpack/, mixpack, 0.0.1, , 2019-09-27T18:19:05+0000
/project/mcgrading/, mcgrading, 0.0.0, Build to serve at UniAndes., 2017-06-27T23:18:53+0000
/project/tr55/, tr55, 1.3.0, A Python implementation of TR-55., 2017-07-10T17:26:38+0000
/project/generator/, Generator, 0.1-alpha, Generator: generators for Django, 2012-04-17T17:13:30+0000
/project/pynsim/, PyNSim, 0.1.5, An generic simulator for water resources., 2019-10-15T16:11:36+0000
/project/deep-lincs/, deep-lincs, 0.0.3, A framework for deep learning with LINCS L1000 Data, 2019-08-10T10:38:36+0000
/project/bmww-api/, bmww-api, 0.0.6, A basic unofficial batmanwonderwoman.com (bmww) api, 2021-04-14T16:42:04+0000
/project/mete0r-recipe-nodejs/, mete0r.recipe.nodejs, 0.0.0, a buildout recipe to install node.js, 2016-11-18T01:42:07+0000
/project/scikits-vectorplot/, scikits.vectorplot, 0.1.1, Vector fields plotting algorithms., 2008-12-02T05:15:10+0000
/project/idessem/, idessem, 0.0.1, Interface para arquivos do DESSEM, 2021-01-14T17:13:44+0000
/project/elcano/, elcano, 0.1.0, Visual dataset explorer, 2020-05-24T18:14:53+0000
/project/atlassian-api-py/, atlassian-api-py, 0.2.5, Atlassian REST API Python Wrapper., 2021-04-20T05:41:28+0000
/project/iexcloud/, iexcloud, 0.0.1, iexcloud retrieves and archives iexcloud data in databases, 2020-07-16T03:33:40+0000
/project/test-release-tool/, test-release-tool, 0.2.0, Test for mar10/yabs, 2020-07-27T15:35:22+0000
/project/pacific/, Pacific, 0.0.3, Pacific, 2014-04-21T12:31:21+0000
/project/importance/, importance, 0.0.1, , 2017-11-28T23:18:50+0000
/project/mklists/, mklists, 0.1.1, Rebuild plain-text todo lists using rules, 2018-08-17T08:35:06+0000
/project/sharpen/, sharpen, 0.0.0.0.dev20200926, sharpen, 2020-09-26T15:40:37+0000
/project/aisy/, aisy, 0.0.0, , 2019-01-10T09:02:47+0000
/project/wwsclient/, wwsclient, 0.0.0.7, This script will be expose all workday webservice operations, 2021-03-19T12:57:24+0000
/project/wolfeutils/, wolfeutils, 0.0.2, Utilities for Wolfe Lab, 2017-09-07T18:18:08+0000
/project/hos-proto/, hos-proto, 0.0.0, , 2020-08-03T19:52:11+0000
/project/minerva-lib/, minerva-lib, 0.0.5, Minerva Python library, 2021-01-26T18:18:24+0000
/project/experience/, experience, 0.0.1, Experience, 2016-11-20T13:44:43+0000
/project/autogdc/, autoGDC, 0.0.1, Automatic Genomic Data Commons processing for bioinformaticians, 2020-11-16T05:50:28+0000
/project/fictive-flask/, fictive-flask, 0.0.1, , 2021-02-10T18:24:57+0000
/project/jksearch/, jksearch, 0.0.1, PyPi package created by Schibsted's Product & Application Security team., 2021-02-16T08:36:03+0000
/project/gyps/, gyps, 0.0.1, [WiP; Name Squatting] - Python transcoding tools for geodetic files, 2018-05-22T20:37:59+0000
/project/pydfu/, pydfu, 0.1, Disk and File system query, 2017-04-11T10:40:21+0000
/project/frelpt/, frelpt, 0.0.1, Loop pushdown translator, 2019-03-25T21:35:50+0000
/project/detections/, detections, 0.0.1, google, 2021-04-19T21:11:34+0000
/project/ratelang/, ratelang, 0.0.1.dev0, Experiment., 2020-05-28T05:56:39+0000
/project/snkit/, snkit, 1.6.0, a spatial networks toolkit, 2019-08-19T14:24:27+0000
/project/box-notifer/, box-notifer, 0.0.1, tells you if a new client is connected to your router, 2015-02-21T14:57:46+0000
/project/mlbazaar/, mlbazaar, 1.0.0, , 2020-06-16T21:26:16+0000
/project/blockpy/, blockpy, 0.0.0, Open-source blockchain utility for Python, 2018-03-10T01:25:36+0000
/project/primary/, primary, 0.0.1.dev1, Client for Primary's trading/market-data/etc. APIs (http://api.primary.com.ar/)., 2019-01-03T01:34:28+0000
/project/cania-utils/, cania-utils, 0.2.8, All utils for Cancer Image Analysis python package, 2021-04-14T08:55:54+0000
/project/github-api-v4/, github-api-v4, 0.0.0, , 2019-04-30T08:57:18+0000
/project/essm/, essm, 1.1, Environmental Science using Symbolic Math., 2020-12-20T23:04:18+0000
/project/bytbil-logger-lib/, bytbil-logger-lib, 0.0.1, PyPi package created by Schibsted's Product & Application Security team., 2021-02-16T08:34:06+0000
/project/idly/, idly, 0.0.3, interpretable deep learning. yay!, 2018-05-12T18:52:16+0000
/project/twentytab-colorful/, twentytab-colorful, 0.1, An extension to the Django web framework that provides database and form color fields, 2014-04-17T15:51:59+0000
/project/pynssm/, pynssm, 2.24.2a2, Python wrapper for NSSM - the Non-Sucking Service Manager (nssm.cc), 2018-06-07T20:11:48+0000
/project/d3cryp7-py/, d3cryp7.py, 0.5.1, A Python module for image analysis and recognition, 2017-05-19T02:35:26+0000
/project/openweather-api-client/, openweather-api-client, 0.0.1, OpenWeather API client, 2020-09-18T13:45:11+0000
/project/jupytertoolbox/, jupytertoolbox, 0.0.1a1.dev6, Version control, experiment tracking, script exporting, etc. for Jupyter notebooks, 2019-07-18T10:20:22+0000
/project/interfare/, interfare, 0.0.1, , 2019-10-21T12:55:28+0000
/project/netsim/, netsim, 0.0.0, Network simulation, 2019-04-01T23:11:47+0000
/project/zenodo-client/, zenodo-client, 0.1.0, A wrapper for the Zenodo API., 2021-03-25T15:51:50+0000
/project/uestcct/, uestcct, 0.0.1, export uestc course table to google calendar, 2017-09-05T09:29:46+0000
/project/django-graphql-persist/, django-graphql-persist, 0.1.1, Persisted queries for Django GraphQL, 2018-10-03T09:21:07+0000
/project/recover/, recover, 0.0.0, An effective Remote Co-Verification (ReCoVer) library of hardware and software co-designs, 2019-11-19T21:30:45+0000
/project/gsn-utils/, gsn-utils, 0.0.1, PyPi package created by Schibsted's Product & Application Security team., 2021-02-16T08:35:45+0000
/project/quetz/, quetz, 0.0.0, A Python library for compositional programming., 2020-06-09T11:36:01+0000
/project/djira/, djira, 0.2.1, Django Introspection REST API., 2018-08-28T12:11:19+0000
/project/automated-ml/, automated-ml, 0.0.0, , 2019-09-13T13:16:00+0000
/project/sch-locustio/, sch-locustio, 0.0.1, PyPi package created by Schibsted's Product & Application Security team., 2021-02-16T08:37:38+0000
/project/trickle/, trickle, 0.1, IOStream wrapper for use with Tornado coroutines., 2013-12-14T21:15:28+0000
/project/object-diff/, object-diff, 0.2.0, Library for diffing data structures of built-in types, 2020-10-19T20:52:40+0000
/project/magicstack/, magicstack, 0.5.0a1, MagicStack Application Development Framework, 2016-02-29T20:08:06+0000
/project/create-python-project/, Create-Python-Project, 0.1.0, Create-Python-Project is a CLI application to facilitate Python project management, 2018-01-16T15:10:32+0000
/project/termboxplot/, termboxplot, 0.0.6, Tufte inspired, one-liner, pipe-able, tidy data compatible, utf8, unicode boxplots, 2020-11-28T12:11:54+0000
/project/pywad/, pywad, 0.1.4, The Python Web Auto Drive framework using selenium.webdriver., 2015-03-16T09:38:54+0000
/project/django-video-embedding/, django-video-embedding, 2.0, Support for video upload in Django models, 2021-02-19T10:09:05+0000
/project/ate-cd-pipeline-scripts/, ate-cd-pipeline-scripts, 0.0.1, PyPi package created by Schibsted's Product & Application Security team., 2021-02-16T08:32:47+0000
/project/pushdown/, pushdown, 0.6.7, A fork form lark-parser, a modern parsing library, 2018-10-28T23:16:53+0000
/project/indicted/, indicted, 0.0.2, Indexed Dictionary Class, 2012-11-02T21:17:23+0000
/project/ocxserialtest/, ocxserialtest, 0.0.1, microsoft, 2021-04-19T22:01:43+0000
/project/rhhr/, RHHR, 0.0.0, , 2020-11-12T12:24:12+0000
/project/elu/, elu, 0.0.1, google, 2021-04-19T21:11:44+0000
/project/bype/, bype, 0.1a, Python Fluent DSL, 2015-05-28T08:23:03+0000
/project/refugee/, Refugee, dev, Migration made easy, 2011-06-09T00:10:26+0000
/project/fingo-django-graphiql-debug-toolbar/, fingo-django-graphiql-debug-toolbar, 0.1.5, Django Debug Toolbar for GraphiQL IDE, 2020-08-27T00:15:14+0000
/project/templatedemo/, TemplateDemo, 0.0.0, A sample project templated from jacebrowning/template-python., 2016-09-09T19:55:05+0000
/project/addnodes/, addnodes, 0.0.1, cisco, 2021-04-19T22:33:38+0000
/project/skserve/, skserve, 0.11, Flask-derived wrapper to serve sklearn models, 2020-09-16T23:59:16+0000
/project/reset/, reset, 0.0.1, dropbox, 2021-04-19T22:24:27+0000
/project/ansiformat/, ansiformat, 0.0.1.dev1, Library to pretty format CLI output, 2020-03-17T16:38:45+0000
/project/duco-ducobox/, duco.ducobox, 0.3.1, Read parameters from DucoBox., 2019-04-10T20:23:06+0000
/project/plenty-api/, plenty-api, 0.2.7, Interface for the PlentyMarkets API., 2020-12-22T12:11:42+0000
/project/angou-bitmex/, angou-bitmex, 2, Lightweight and suckless BitMEX REST API client library, 2018-05-24T18:13:11+0000
/project/listoliver/, listoliver, 1, description, 2014-11-18T00:13:10+0000
/project/changepassword/, changepassword, 0.0.1, dropbox, 2021-04-19T22:19:24+0000
/project/mlgb/, mlgb, 0.0.1, mlgb, 2020-11-06T12:51:08+0000
/project/qtemplate/, qtemplate, 0.0.1, Flexible and extensible templating CLI, 2020-12-26T19:16:17+0000
/project/blueberrymath/, blueberrymath, 0.1.1, Open Source Mathematical Package, 2020-08-31T14:09:30+0000
/project/qux/, qux, 0.0.1, google, 2021-04-19T21:13:47+0000
/project/mip-tool/, mip-tool, 0.0.3, `mip-tool` is a package for Python-MIP., 2021-01-14T11:18:11+0000
/project/generalprocess/, generalprocess, 0.0.1, , 2020-06-27T18:48:03+0000
/project/billo/, billo, 0.0.0, internal use, 2021-02-10T19:39:17+0000
/project/skibsted/, skibsted, 0.0.1, PyPi package created by Schibsted's Product & Application Security team., 2021-02-16T08:38:36+0000
/project/vidxs/, vidXs, 2.0, Streaming video data via networks, 2021-04-04T16:16:41+0000
/project/smartfolder/, smartfolder, 0.0.0, , 2019-04-27T11:42:23+0000
/project/cloudstarter/, cloudstarter, 0.0.1, PyPi package created by Schibsted's Product & Application Security team., 2021-02-16T08:34:26+0000
/project/paginate-wrapper/, paginate_wrapper, 0.1.5, minimal pagination, 2014-06-28T13:31:13+0000
/project/serenity-module-notes/, serenity-module-notes, 0.0.1, PyPi package created by Schibsted's Product & Application Security team., 2021-02-16T08:38:20+0000
/project/puppet-apis/, puppet-apis, 0.0.1, PyPi package created by Schibsted's Product & Application Security team., 2021-02-16T08:37:08+0000
/project/viktor/, viktor, 0.0.0, viktor python SDK, 2020-10-26T09:19:47+0000
/project/ae-kivy-relief-canvas/, ae-kivy-relief-canvas, 0.1.5, ae_kivy_relief_canvas portion of python application environment namespace package, 2021-04-09T19:11:07+0000
/project/bsettings/, bsettings, 0.0.1, facebook, 2021-04-19T21:52:49+0000
/project/date/, date, 0.0.1, dropbox, 2021-04-19T22:19:54+0000
/project/keepersecuritysm/, keepersecuritysm, 0.0.1a1, Keeper Commander Secrets Management for Python 3, 2021-04-21T15:22:43+0000
/project/senapy/, senapy, 0.3.2, Python client for senat.fr website, 2020-10-29T08:42:06+0000
/project/vidstream/, vidstream, 0.0.14, Streaming video data via networks, 2021-03-30T20:48:35+0000
/project/invenio-records-links/, invenio-records-links, 1.0.4, A generic links module for Invenio, 2019-11-07T21:31:29+0000
/project/accuasset/, accuasset, 0.0.0.10, SK Accuinsight Asset package, 2021-03-22T14:29:15+0000
/project/yamlmod/, yamlmod, 0.0.1, , 2014-09-20T15:20:16+0000
/project/0/, 0, 0.0.0, 0, 2017-08-06T03:43:27+0000
/project/endpointer/, endpointer, 0.0.4, A tool for transforming OpenAPI v3 specifications        into endpoint documentation, 2017-10-14T03:30:43+0000
/project/ask-test-util/, ask-test-util, 0.1.0, Test your Alexa skills locally, 2020-09-22T20:11:05+0000
/project/pytest-mercurial/, pytest-mercurial, 0.1.0, pytest plugin to write integration tests for projects using Mercurial Python internals, 2020-11-21T21:10:35+0000
/project/automationedge-aelistudio/, automationedge-aelistudio, 0.0.1, AutomationEdge Language Intelligence, 2020-09-24T05:07:28+0000
/project/solidarity/, solidarity, 0.0.0.0.dev20200926, solidarity, 2020-09-26T15:53:30+0000
/project/nhpoly/, nhpoly, 0.0.1, google, 2021-04-19T21:13:10+0000
/project/kiwi-platform/, kiwi-platform, 0.3.0, Company standards as code for Kiwi.com, 2019-12-16T11:23:56+0000
/project/ae-db-core/, ae-db-core, 0.1.12, ae_db_core portion of python application environment namespace package, 2020-08-27T17:03:33+0000
/project/moon-engine/, moon-engine, 0.8, , 2020-04-30T13:57:12+0000
/project/eodag-sentinelsat/, eodag-sentinelsat, 0.3.0, Sentinelsat plugin to EODAG (https://github.com/CS-SI/eodag), 2021-03-26T15:20:26+0000
/project/brewpi-remix/, BrewPi-Remix, 0.0.0.1, For the fans of the original Arduino temperature controller, 2020-08-02T14:17:56+0000
/project/restd/, restd, 0.0.5, Flexible and extensible REST, 2020-05-11T01:35:42+0000
/project/wcom/, wcom, 0.0.1, A simple library for solving WC questions, 2020-10-15T17:52:24+0000
/project/pymustang/, pymustang, 0.1, A lightweight, Sqlite ORM in Python., 2021-04-01T16:55:39+0000
/project/lightcurve/, lightcurve, 0.6.2, Create lightcurves from HST/COS and HST/STIS data, 2017-08-27T16:07:59+0000
/project/gsn-test/, gsn-test, 0.0.1, PyPi package created by Schibsted's Product & Application Security team., 2021-02-16T08:35:42+0000
/project/tefas-crawler/, tefas-crawler, 0.2.2, Crawl the public data from Tefas., 2020-11-28T08:52:14+0000
/project/adnipy/, adnipy, 0.1.0, Process ADNI study data with adnipy., 2019-10-25T13:18:06+0000
/project/invenio-pidrelations/, invenio-pidrelations, 0.1.0, Invenio module that adds PID relations to the Invenio-PIDStore module., 2020-12-15T08:05:43+0000
/project/leakdb/, LeakDB, 0.2, LeakDB is a very simple and fast key value store for Python, 2014-08-07T16:39:39+0000
/project/spark-tensorflow-distributor/, spark-tensorflow-distributor, 0.1.0, This package helps users do distributed training with TensorFlow on their Spark clusters., 2020-06-30T21:26:27+0000
/project/timberjack/, timberjack, 0.1.0, Logging toolbox for Python services at Mobify., 2016-09-21T18:37:09+0000
/project/gsn-api-client/, gsn-api-client, 0.0.1, PyPi package created by Schibsted's Product & Application Security team., 2021-02-16T08:35:24+0000
/project/abz/, abz, 0.0.0, , 2019-08-07T17:19:35+0000
/project/minnn/, minnn, 0.0.2, Basic toolkit for neural networks, 2021-02-27T12:18:25+0000
/project/billoredis/, billoredis, 0.0.0, internal use, 2021-02-10T19:18:15+0000
/project/avasdk/, avasdk, 1.0.3, , 2017-09-14T17:47:21+0000
/project/weno/, weno, 0.0.1, google, 2021-04-19T21:16:48+0000
/project/terraform-named-cloudflare/, terraform-named-cloudflare, 0.0.2, Module to easily convert Bind9 (named) zones into Terraform CloudFlare provider records definitions, 2020-02-03T01:15:31+0000
/project/zippy/, zippy, 0.2, A simple wrapper for the Ziptastic ZIPCode Search API., 2014-07-21T18:24:39+0000
/project/wrightsim/, WrightSim, 0.1.0, A simulation package for multidimensional spectroscopy., 2020-04-28T21:16:29+0000
/project/fpm/, fpm, 0.0.1, , 2019-10-04T23:00:19+0000
/project/readmemd/, readmemd, 0.0.0, , 2018-11-24T18:25:04+0000
/project/pyqode-json/, pyqode.json, 2.10.0, Adds JSon support to pyqode.core, 2016-06-28T12:25:25+0000
/project/ww/, ww, 0.2.1, Wrappers for Python builtins with higher-level APIs, 2016-11-09T23:40:57+0000
/project/plette/, plette, 0.2.3, Structured Pipfile and Pipfile.lock models., 2019-10-19T12:56:18+0000
/project/evileg-core/, evileg-core, 0.0.5, (ESNF-C) EVILEG Social Network Framework - Core Module., 2019-10-26T21:12:09+0000
/project/gsas-ii-wonder-win/, GSAS-II-WONDER-win, 1.0.1, GSAS-II plugin for WONDER, 2020-03-04T17:42:26+0000
/project/gcscontents/, gcscontents, 0.0.1, A ContentsManager for managing Google Cloud APIs., 2021-04-19T07:50:33+0000
/project/spinpy/, spinpy, 0.1.0.dev1, Package for simulating EPR data., 2019-09-26T05:14:59+0000
/project/toiboi/, toiboi, 0.0.0, TESS Object of Interest Binary Object Investigator, 2018-03-31T17:53:52+0000
/project/openapi-sanic/, openapi-sanic, 0.0.4, , 2021-03-15T14:52:33+0000
/project/bytbil-flask-utils-lib/, bytbil-flask-utils-lib, 0.0.1, PyPi package created by Schibsted's Product & Application Security team., 2021-02-16T08:34:02+0000
/project/mtd/, mtd, 0.1.dev0, Helper classes for Bayesian model-to-data comparison., 2014-10-22T13:13:17+0000
/project/become/, become, 0.0.1, dropbox, 2021-04-19T22:19:06+0000
/project/image-transformations/, image-transformations, 0.0.1, A basic image transformations using numpy and opencv, 2021-02-16T22:47:02+0000
/project/velvet/, velvet, 0.0.2, Beautiful signal processing and communications algorithms in Python, 2015-11-02T02:07:17+0000
/project/lino-patrols/, lino-patrols, 0.0.2, A Lino application for managing patrols, 2013-05-27T18:37:07+0000
/project/sopel-help/, sopel-help, 0.2.0, Help plugin for Sopel, 2021-03-28T14:34:47+0000
/project/fmeclient/, fmeclient, 0.0.1, FME Server Client, 2019-07-23T21:41:53+0000
/project/pgstructure/, PgStructure, 0.0.1, You can check the database structure of PostgreSQL, 2014-04-06T23:29:33+0000
/project/infrascloudy/, infrascloudy, 0.1.1, It does cloudy things, 2019-06-22T15:45:04+0000
/project/caph1993-pytools/, caph1993-pytools, 0.1.0, Python toolbox of Carlos Pinzón, 2021-03-10T11:12:31+0000
/project/cryptotax/, cryptotax, 1.0a1, Cryptocurrency tracker, 2018-02-24T15:07:27+0000
/project/pypix/, pypix, 0.1.6, Python library for generating pix codes with CRC16 validation, 2020-11-29T18:38:32+0000
/project/lux-widget/, lux-widget, 0.1.5, A Custom Jupyter Widget Library, 2021-04-19T01:30:32+0000
/project/timspy/, timspy, 0.9.3, TimsPy: access for raw timsTOF Pro data for data scientists, 2020-12-10T10:54:07+0000
/project/pyhandle/, pyhandle, 1.0.4, Library for management of handles , 2021-02-05T15:38:50+0000
/project/fiasco/, fiasco, 0.0.1.dev1, fiasco, 2020-04-17T23:08:07+0000
/project/jour-ouvre/, jour-ouvre, 0.1, Détecteur de jours ouvrés., 2021-04-02T09:36:08+0000
/project/aimmo-models/, aimmo-models, 0.0.7, Python Package and Tools for Deep Learning Model Deployment, 2020-08-13T08:08:04+0000
/project/jsonutils3/, jsonutils3, 1.0.0, A lib to use json easly., 2020-02-12T20:30:16+0000
/project/serenity-module-url-detection/, serenity-module-url-detection, 0.0.1, PyPi package created by Schibsted's Product & Application Security team., 2021-02-16T08:38:29+0000
/project/buspyrate/, buspyrate, 0.0.0, BusPirate binary mode library, 2021-02-20T22:11:25+0000
/project/weco-deploy/, weco-deploy, 5.6.32, A tool for deploying ECS services at the Wellcome Collection, 2021-04-21T09:41:11+0000
/project/tacks/, tacks, 0.0.0, Pin requirements for Python apps, 2020-06-18T00:55:31+0000
/project/footprintsapi/, footprintsapi, 1.0.5, API wrapper for the BMC (Numara) Footprints SOAP API, 2020-04-05T23:05:45+0000
/project/azoth/, azoth, 0.3.0, Sqlalchemy utilities, 2014-12-05T13:10:03+0000
/project/steer/, steer, 0.0.0, , 2021-04-24T19:49:12+0000
/project/vca-cli/, vca-cli, 18.0.1, VMware vCloud CLI, 2017-07-18T18:07:27+0000
/project/pygments-vice/, pygments-vice, 0.1.3, pygments-vice is a pygments style that is a port of the vim-vice colorscheme, 2020-03-02T18:34:58+0000
/project/jx/, jx, 0.0.1, , 2019-10-07T20:01:54+0000
/project/django-blakey-utils/, django-blakey-utils, 0.0.11-pre-alpha, Common utilities for Blakey project, 2012-10-18T11:28:32+0000
/project/bower/, bower, 0.0.0, , 2019-03-29T13:42:00+0000
/project/autoanno/, autoanno, 0.0.1.dev1, Investigation into using AutoML and Topological Data Analysis for Automated Annotation, 2021-03-22T19:26:25+0000
/project/growler-sass/, growler-sass, 0.1.0, An extension providing a SASS CSS renderer for Growler web applications, 2016-10-01T20:45:18+0000
/project/ucla-cs118/, ucla-cs118, 0.1.1, Network controller for the class project of UCLA CS118 class, 2017-04-09T21:20:17+0000
/project/robotflow/, robotflow, 0.0.1, RobotFlow is a development platform to create, simulate and deploy software for robots, 2020-09-06T11:22:03+0000
/project/kitch-numerical/, kitch.numerical, 0.0.2, A collection of common mathematical utilities., 2016-11-14T15:04:21+0000
/project/resaspy/, resaspy, 0.2.1, python for RESAS API., 2017-05-10T14:19:28+0000
/project/kmerdb/, kmerdb, 0.0.7, Yet another kmer library for Python, 2021-02-23T03:58:54+0000
/project/bayrell-aio/, bayrell-aio, 0.2, Async io library for Bayrell Web Application Server, 2016-06-08T12:51:04+0000
/project/yapowf/, yapowf, 0.0.7, A new Python Power Factory API, 2021-03-29T16:04:02+0000
/project/ppp-hal/, ppp_hal, 0.2.1, HAL backend module for the Projet Pensées Profondes, 2015-02-14T11:44:40+0000
/project/django-daiquiri/, django-daiquiri, 0.2, Daiquiri is a framework for the publication of scientific databases., 2018-04-25T08:07:15+0000
/project/autota/, autota, 0.0.3, Automatic generate QA from slides and grade marker/memo., 2020-07-06T06:09:32+0000
/project/blackjackpy/, blackjackpy, 0.0.2, , 2020-12-18T14:30:41+0000
/project/py-config-lib/, py-config-lib, 0.0.1, PyPi package created by Schibsted's Product & Application Security team., 2021-02-16T08:37:13+0000
/project/spott/, spott, 1, Face Recognizer, 2021-02-14T11:56:45+0000
/project/flask-mall/, Flask-MALL, 0.1.0, 基于flask的电商商城系统, 2020-03-15T04:51:06+0000
/project/bytbil-postgres-init-db/, bytbil-postgres-init-db, 0.0.1, PyPi package created by Schibsted's Product & Application Security team., 2021-02-16T08:34:09+0000
/project/workspacemanager/, workspacemanager, 0.3.2, This tool can manage a workspace by providing some useful functions (generation of the setup file and others, generate a virtual env according to the project name, install your own dependencies, generate dist of all dependencies...). See the readme for more informations., 2019-02-13T17:12:27+0000
/project/kaya/, kaya, 0.0.1.dev1, Testing framework inspired by jest, 2019-03-01T11:56:24+0000
/project/learn-ml/, learn-ml, 0.0.1, , 2020-09-06T05:46:43+0000
/project/d2c/, d2c, 0.0.0, Convert discrete dislocation data to continuous fields., 2019-08-02T10:14:47+0000
/project/cifar-extender/, cifar-extender, 1.0, extending the cifar datasets with imagenet images, 2018-02-21T20:06:09+0000
/project/packagebuilder/, packagebuilder, 0.1.0, A library for building python packages into binary or source distributions., 2018-09-21T04:58:40+0000
/project/gabi/, gabi, 0.2.0, Google Address Book Importer, 2010-09-26T12:07:02+0000
/project/blocksparsetensor/, blocksparsetensor, 0.0.1, google, 2021-04-19T21:10:53+0000
/project/ppp-natural-math/, ppp_natural_math, 0.3, Natural language processing for math questions for the Projet Pensées
Profondes., 2015-01-19T15:12:57+0000
/project/i6/, i6, 0.0.5, A standardized collection of python libs and tools, 2020-07-15T22:24:21+0000
/project/helga-alkafact/, helga-alkafact, 0.2.0, like chuck norris facts, but for alkapwn, 2018-12-05T16:29:49+0000
/project/pyddp/, pyddp, 0.4.0, Distributed Data Protocol (DDP), 2015-05-29T10:12:48+0000
/project/immureii/, immureii, 0.42.10, Immure Iniquitous Intent, 2021-03-22T23:10:15+0000
