/project/desfiddle/, DESfiddle, 1.0.0, A python package that offers high flexibility for implementing and experimenting with non-classical DES., 2021-04-23T15:37:59+0000
/project/teedoc/, teedoc, 1.12.5, doc site generator with multiple doc support, 2021-04-22T02:50:04+0000
/project/repo-helper-rtd/, repo-helper-rtd, 0.1.0, Manage ReadTheDocs documentation with repo-helper., 2020-12-11T09:23:39+0000
/project/sidekick-properties/, sidekick-properties, 0.1.0, Lazy properties and attributes for sidekick., 2021-04-03T19:53:15+0000
/project/rgb-to-hex/, rgb-to-hex, 0.0.5, BU KÜTÜPHANE 'TKİNTER' KÜTÜPHANESİNDE 'RGB' RENK KODLARINI KULLANABİLMEK İÇİN YAZILMIŞTIR, 2021-02-21T13:03:04+0000
/project/okaeri-sdk/, okaeri-sdk, 1.2.4, Okaeri Services SDK, 2021-03-20T07:43:43+0000
/project/opti/, opti, 1.0.17, A module for easy python, 2021-01-31T00:54:24+0000
/project/pingparsing/, pingparsing, 1.3.0, pingparsing is a CLI-tool/Python-library parser and transmitter for ping command., 2021-03-27T17:18:53+0000
/project/libmsf/, libmsf, 0.1.2, Python Metasploit Library, 2021-04-21T15:47:59+0000
/project/rodi/, rodi, 1.1.1, Implementation of dependency injection for Python 3, 2021-02-23T22:16:58+0000
/project/brunns-builder/, brunns-builder, 0.6.0, Test object builders., 2020-11-26T10:10:43+0000
/project/pauseonlock/, pauseonlock, 0.1.0, Pause/Resume your media players on screen locking/unlocking, 2021-03-20T21:39:54+0000
/project/mdmm/, mdmm, 0.1.3, The Modified Differential Multiplier Method (MDMM) for PyTorch., 2021-02-02T23:28:56+0000
/project/simplecep/, simplecep, 0.1.1, Fetch CEP addresses consistently using Correios API, third-party APIs as fallbacks and cache the results., 2021-03-29T04:37:30+0000
/project/smtpc/, smtpc, 0.9.2, , 2021-04-08T13:18:41+0000
/project/hpl-rv-gen/, hpl-rv-gen, 0.1.2, Runtime monitor generator based on HPL properties, 2021-03-11T10:12:22+0000
/project/watchdog/, watchdog, 2.0.3, Filesystem events monitoring, 2021-04-22T17:57:30+0000
/project/gstore/, gstore, 0.4.0, Synchronize GitHub repositories made easy, 2021-02-19T07:53:50+0000
/project/tutor-xqueue/, tutor-xqueue, 11.0.1, A Tutor plugin for Xqueue (external grading system), 2021-01-07T14:26:39+0000
/project/sopel-dns/, sopel-dns, 0.3.1, A DNS lookup plugin for Sopel IRC bots, 2021-03-05T07:33:40+0000
/project/nbt-utils/, nbt-utils, 1.1, Podrum's NBT library., 2021-04-01T21:04:39+0000
/project/match-ref/, match-ref, 1.0.1, Use top-level variable references in match cases, 2021-04-08T19:28:57+0000
/project/lesting-thrift/, lesting.thrift, 0.1.0, Lesting Apache Thrift, 2021-01-11T12:34:00+0000
/project/py-https/, py-https, 0.0.2.1, A simple python https server, 2021-03-14T23:10:26+0000
/project/minesweeper-toollib/, minesweeper-toollib, 1.0.4, , 2021-04-24T16:08:19+0000
/project/officeextractor/, officeextractor, 0.1.1, officeextractor extracts media files (images, videos, music) from Microsoft Office and LibreOffice files., 2020-12-01T10:01:19+0000
/project/hata/, hata, 1.1.69, A powerful asynchronous library for creating Discord bots in Python., 2021-04-24T01:18:33+0000
/project/gd-graph/, gd.graph, 0.1.1, Plotting Graphs in Geometry Dash., 2021-04-18T15:36:56+0000
/project/aiohttp-sqlalchemy/, aiohttp-sqlalchemy, 0.1b1, SQLAlchemy >= 1.4 support for aiohttp., 2021-04-20T12:26:13+0000
/project/olxbrasil/, olxbrasil, 0.2.4, Biblioteca para scrapping da Olx Brasil (olx.com.br), 2021-04-10T20:54:30+0000
/project/confidential-ml-utils/, confidential-ml-utils, 0.9.0, Utilities for confidential machine learning, 2021-04-09T18:59:09+0000
/project/pinhop/, pinhop, 0.1.2, Timehop for Pinboard, 2021-04-25T04:40:57+0000
/project/flake8-prettycount/, flake8-prettycount, 0.1.1, Wrapper around flake8 providing a formatted count at the end., 2020-11-26T11:19:24+0000
/project/pyinstaller-extractor/, pyinstaller-extractor, 1.0.1, Pyinstaller Extractor, 2020-12-18T03:03:48+0000
/project/hpl-specs/, hpl-specs, 0.2.1, HAROS Property Specification Language, 2021-02-08T17:44:47+0000
/project/bitarray-ph4/, bitarray-ph4, 1.9.1, efficient arrays of booleans -- C extension, 2021-04-01T11:53:14+0000
/project/log-everywhere/, log-everywhere, 0.0.1, Logging package to enable writing all program information with corresponding datetime to multiple, DIFFERENT files safely when running multiple threads (multi-threading)., 2021-01-14T08:20:05+0000
/project/math2/, math2, 0.0.2.dev4, A Python package for various math functions, 2021-03-29T03:11:36+0000
/project/fiscalyear/, fiscalyear, 0.3.1, Utilities for managing the fiscal calendar, 2021-02-07T16:44:24+0000
/project/formelsammlung/, formelsammlung, 5.0.0, Collection of different functions, 2021-02-06T21:57:16+0000
/project/friendly/, friendly, 0.3.43, Friendlier tracebacks in any language., 2021-04-11T11:03:23+0000
/project/charset-normalizer/, charset-normalizer, 1.3.6, The Real First Universal Charset Detector. No Cpp Bindings, Using Voodoo and Magical Artifacts., 2021-02-09T00:05:14+0000
/project/template-specialize/, template-specialize, 0.9.4, Recursive template file specializer., 2021-04-13T19:02:06+0000
/project/pydoodle/, pydoodle, 1.0.2, An API wrapper of Jdoodle.com, 2021-04-06T10:01:14+0000
/project/pywechatpay/, pywechatpay, 0.0.3, Python SDK for WechatPay V3, 2021-04-13T13:46:52+0000
/project/binary-utils/, binary-utils, 1.3, Podrum's Binary Utilities., 2021-04-10T18:15:02+0000
/project/mudpy/, mudpy, 0.3.0, The mudpy MUD server engine., 2020-10-08T23:56:48+0000
/project/hap-python/, HAP-python, 3.4.1, HomeKit Accessory Protocol implementation in python, 2021-03-28T19:34:58+0000
/project/datadings/, datadings, 3.1.0, datadings is a collection of tools to prepare datasets for machine learning. It's easy to use, space-efficient, and blazingly fast., 2021-03-15T14:38:32+0000
/project/typed-ast/, typed-ast, 1.4.3, a fork of Python 2 and 3 ast modules with type comment support, 2021-04-11T23:57:00+0000
/project/chisel/, chisel, 0.9.128, Light-weight WSGI application framework, schema-validated JSON APIs, and API documentation., 2021-04-13T18:53:43+0000
/project/ddsmt/, ddSMT, 0.0, A delta debugger for SMT-LIBv2 files, 2021-01-05T11:22:16+0000
/project/pyhaversion/, pyhaversion, 21.3.0, Get the latest Home Assistant version from various sources., 2021-03-29T08:50:23+0000
/project/minesweeper-toollib/, minesweeper-toollib, 1.0.4, , 2021-04-24T16:08:19+0000
/project/olxbrasil/, olxbrasil, 0.2.4, Biblioteca para scrapping da Olx Brasil (olx.com.br), 2021-04-10T20:54:30+0000
/project/flake8-prettycount/, flake8-prettycount, 0.1.1, Wrapper around flake8 providing a formatted count at the end., 2020-11-26T11:19:24+0000
/project/expliot/, expliot, 0.9.7, Expliot - IoT security testing and exploitation framework, 2021-03-26T21:29:48+0000
/project/vowing/, vowing, 0.3.5, 'Vowing' is an alternative to Python's built in async/await system that has been inspired by Javascript's Promise., 2021-03-30T13:10:12+0000
/project/logics/, logics, 1.0.1, Logics is a Python framework for mathematical logic, 2021-03-27T17:21:17+0000
/project/python-sanity-html/, python-sanity-html, 0.0.4, HTML renderer for Sanity's Portable Text format, 2021-04-19T10:33:23+0000
/project/rhymetagger/, rhymetagger, 0.2.9, A simple collocation-driven recognition of rhymes, 2021-03-02T18:46:34+0000
/project/heritrix3/, heritrix3, 0.4.1, A internetarchive/heritrix3 python REST API client., 2021-01-19T16:37:45+0000
/project/jutest/, jutest, 1.0.0, Library for easy testing CSV data using Jupyter notebook, 2021-04-16T13:01:23+0000
/project/flake8-annotations/, flake8-annotations, 2.6.2, Flake8 Type Annotation Checks, 2021-04-01T13:38:59+0000
/project/sqspy/, sqspy, 1.0.0, AWS SQS utility package for producing and consuming messages, 2021-03-27T17:47:18+0000
/project/pytest-unordered/, pytest-unordered, 0.4.1, Test equality of unordered collections in pytest, 2021-03-28T10:22:41+0000
/project/chisel/, chisel, 0.9.128, Light-weight WSGI application framework, schema-validated JSON APIs, and API documentation., 2021-04-13T18:53:43+0000
/project/ddsmt/, ddSMT, 0.0, A delta debugger for SMT-LIBv2 files, 2021-01-05T11:22:16+0000
/project/pyhaversion/, pyhaversion, 21.3.0, Get the latest Home Assistant version from various sources., 2021-03-29T08:50:23+0000
/project/thoryvos/, thoryvos, 1.0.4, The All-In One Cryptographic Toolkit, 2021-01-08T12:55:44+0000
/project/dj-smail/, dj-smail, 0.7.0, Simple S/MIME e-mails with Django, 2021-03-16T19:44:11+0000
/project/humanmark/, humanmark, 0.4.1, Human-friendly markdown., 2021-03-09T06:04:03+0000
/project/poetry-date-version-plugin/, poetry-date-version-plugin, 2021.6.4-3, , 2021-04-06T09:31:05+0000
/project/future-typing/, future-typing, 0.4.0, Backport for type hinting generics in standard collections and union types as X | Y, 2021-03-30T23:31:20+0000
/project/friendly/, friendly, 0.3.43, Friendlier tracebacks in any language., 2021-04-11T11:03:23+0000
/project/charset-normalizer/, charset-normalizer, 1.3.6, The Real First Universal Charset Detector. No Cpp Bindings, Using Voodoo and Magical Artifacts., 2021-02-09T00:05:14+0000
/project/template-specialize/, template-specialize, 0.9.4, Recursive template file specializer., 2021-04-13T19:02:06+0000
/project/pydoodle/, pydoodle, 1.0.2, An API wrapper of Jdoodle.com, 2021-04-06T10:01:14+0000
/project/pywechatpay/, pywechatpay, 0.0.3, Python SDK for WechatPay V3, 2021-04-13T13:46:52+0000
/project/binary-utils/, binary-utils, 1.3, Podrum's Binary Utilities., 2021-04-10T18:15:02+0000
/project/mudpy/, mudpy, 0.3.0, The mudpy MUD server engine., 2020-10-08T23:56:48+0000
/project/djangelo/, djangelo, 0.1.4, Tracking and rating Django Model activities with ELO system, 2020-12-22T17:56:14+0000
/project/krakenexapi/, krakenexapi, 0.0.1, A Kraken Exchange API adapter., 2020-12-27T02:24:32+0000
/project/braces-py/, braces.py, 0.3.0, Braces for Python Programming Language., 2021-04-18T14:21:31+0000
/project/auxiliary/, auxiliary, 0.0.2.dev20, A Python package for various helper and utility functions, 2021-04-03T23:30:32+0000
/project/mwot/, mwot, 0.0.0.dev0, An esolang, 2021-04-16T17:26:20+0000
/project/yourbase/, yourbase, 4.5.11, Skip tests based on tracing data, 2021-04-23T21:55:07+0000
/project/mqtt-randompub/, mqtt-randompub, 0.2.2, Tool for generating MQTT messages on various topics, 2021-02-03T11:57:26+0000
/project/fastapi-authz/, fastapi-authz, 0.0.5, An authorization middleware for FastAPI that supports ACL, RBAC, ABAC, based on PyCasbin, 2021-03-03T16:40:02+0000
/project/sickchill/, sickchill, 2021.4.10, Automatic Video Library Manager for TV Shows, 2021-04-10T08:37:15+0000
/project/consnet/, consnet, 1.0.5, A general toolkit for human-object interaction detection, 2021-04-19T17:00:38+0000
/project/drf-openapi-tester/, drf-openapi-tester, 1.3.5, Test utility for validating OpenAPI response documentation, 2021-02-28T12:16:03+0000
/project/sphinx-autodoc-defaultargs/, sphinx-autodoc-defaultargs, 0.1.1, Automatic generation of default arguments for the Sphinx autodoc extension., 2021-04-01T18:14:16+0000
/project/pyramid-decoy/, pyramid-decoy, 0.2.0, pyramid_decoy, a simple pyramid app, which solely purpose is to redirect traffic away to configured location, 2021-03-04T17:18:52+0000
/project/python-parallel-hierarchy/, python-parallel-hierarchy, 0.5.1, A utility for creating a parallel class hierarchy based on a primary set of classes., 2021-04-14T21:22:09+0000
/project/space-tracer/, space-tracer, 4.4.0, Trade time for space when debugging your code., 2021-04-13T02:02:00+0000
/project/zsh-history-to-fish/, zsh-history-to-fish, 0.3.0, Bring your ZSH history to Fish shell., 2021-01-25T05:40:09+0000
/project/cyclonedds/, cyclonedds, 0.1.0, Cyclone DDS Python binding, 2021-03-05T12:57:44+0000
/project/tutor-openedx/, tutor-openedx, 11.2.6, The docker-based Open edX distribution designed for peace of mind, 2021-04-09T08:53:20+0000
/project/bsdiff4/, bsdiff4, 1.2.1, binary diff and patch using the BSDIFF4-format, 2021-04-11T05:45:02+0000
/project/flake8-annotations/, flake8-annotations, 2.6.2, Flake8 Type Annotation Checks, 2021-04-01T13:38:59+0000
/project/sqspy/, sqspy, 1.0.0, AWS SQS utility package for producing and consuming messages, 2021-03-27T17:47:18+0000
/project/pytest-unordered/, pytest-unordered, 0.4.1, Test equality of unordered collections in pytest, 2021-03-28T10:22:41+0000
/project/officeextractor/, officeextractor, 0.1.1, officeextractor extracts media files (images, videos, music) from Microsoft Office and LibreOffice files., 2020-12-01T10:01:19+0000
/project/hata/, hata, 1.1.69, A powerful asynchronous library for creating Discord bots in Python., 2021-04-24T01:18:33+0000
/project/gd-graph/, gd.graph, 0.1.1, Plotting Graphs in Geometry Dash., 2021-04-18T15:36:56+0000
/project/aiohttp-sqlalchemy/, aiohttp-sqlalchemy, 0.1b1, SQLAlchemy >= 1.4 support for aiohttp., 2021-04-20T12:26:13+0000
/project/confidential-ml-utils/, confidential-ml-utils, 0.9.0, Utilities for confidential machine learning, 2021-04-09T18:59:09+0000
/project/pinhop/, pinhop, 0.1.2, Timehop for Pinboard, 2021-04-25T04:40:57+0000
/project/pyinstaller-extractor/, pyinstaller-extractor, 1.0.1, Pyinstaller Extractor, 2020-12-18T03:03:48+0000
/project/bitarray-ph4/, bitarray-ph4, 1.9.1, efficient arrays of booleans -- C extension, 2021-04-01T11:53:14+0000
/project/log-everywhere/, log-everywhere, 0.0.1, Logging package to enable writing all program information with corresponding datetime to multiple, DIFFERENT files safely when running multiple threads (multi-threading)., 2021-01-14T08:20:05+0000
/project/math2/, math2, 0.0.2.dev4, A Python package for various math functions, 2021-03-29T03:11:36+0000
/project/fiscalyear/, fiscalyear, 0.3.1, Utilities for managing the fiscal calendar, 2021-02-07T16:44:24+0000
/project/formelsammlung/, formelsammlung, 5.0.0, Collection of different functions, 2021-02-06T21:57:16+0000
/project/sigmage/, sigmage, 0.0.1a1, A Python package for signing images to mark the original creators, 2021-03-07T01:18:11+0000
/project/pytest-subprocess/, pytest-subprocess, 1.1.0, A plugin to fake subprocess for pytest, 2021-04-18T12:09:03+0000
/project/random-word/, Random-Word, 1.0.7, This is a simple python package to generate random english words, 2021-02-11T01:19:10+0000
/project/archfx-cloud/, archfx-cloud, 0.10.2, Python client for https://archfx.io, 2021-04-06T20:08:21+0000
/project/hpl-specs/, hpl-specs, 0.2.1, HAROS Property Specification Language, 2021-02-08T17:44:47+0000
/project/pyminesweeper/, pyminesweeper, 1.0.1, All algorithms of minesweeper, 2021-04-24T14:47:53+0000
/project/klogpy/, klogpy, 0.1.0, Python implementation of klog format for time tracking, 2021-04-01T13:42:43+0000
/project/spellwise/, spellwise, 0.8.1, 🚀 Extremely fast spelling checker and suggester in Python!, 2021-04-07T20:26:05+0000
/project/tensorbay/, tensorbay, 1.2.2, Graviti TensorBay Python SDK, 2021-04-25T06:40:43+0000
/project/curlylint/, curlylint, 0.13.0, {{ 🎀}} Experimental HTML templates linting for Jinja, Nunjucks, Django templates, Twig, Liquid, 2021-04-25T08:12:50+0000
/project/ffmpegio/, ffmpegio, 0.0.7, Read/write media files with FFmpeg, 2021-04-22T14:02:05+0000
/project/emcpy/, emcpy, 0.1.4, A python package to get information on the minecraft server EarthMC, 2021-04-25T14:38:55+0000
/project/spoof/, spoof, 1.5.1, HTTP server for testing environments, 2021-04-10T23:49:58+0000
/project/chemicals/, chemicals, 1.0.5, Chemical properties component of Chemical Engineering Design Library (ChEDL), 2021-04-25T17:42:59+0000
/project/pygitscrum/, pygitscrum, 0.4.3, pygitscrum, 2021-04-25T18:57:45+0000
/project/clippercard/, clippercard, 202104.25.2, Unofficial Python API for Clipper Card (transportation pass used in the SF Bay Area), 2021-04-25T20:08:36+0000
