/project/pymatgen-diffusion/, pymatgen-diffusion, 2020.10.8, Add-on to pymatgen for diffusion analysis., 2020-10-08T20:26:52+0000
/project/itk-skullstripping/, itk-skullstripping, 0.0.1, Automatic skull-stripping for neuroimage analysis, 2020-11-23T14:21:31+0000
/project/napari-aicsimageio/, napari-aicsimageio, 0.2.0, AICSImageIO bindings for napari, 2020-12-14T07:30:26+0000
/project/study/, study, 0.1.0, Framework for building data studies in a pipe-and-filter style that abstracts over issues such as multiprocessing., 2009-07-17T14:02:52+0000
/project/pyvistaqt/, pyvistaqt, 0.3.0, pyvista qt plotter, 2021-01-20T16:30:46+0000
/project/vivid-root/, vivid-root, 0.0.1, Algorithm Classification Catalog, 2019-10-19T16:15:12+0000
/project/upy2/, upy2, 2.0.1b6, A package for uncertainty propagation, 2020-09-11T06:32:55+0000
/project/richdem/, richdem, 0.3.4, High-Performance Terrain Analysis, 2018-07-13T20:03:49+0000
/project/queueing-tool/, queueing-tool, 1.2.4, Queueing network simulator, 2019-11-10T05:41:34+0000
/project/seqparser/, seqparser, 1.1.2, Cli tool to find specific regular expression like email, ip adress, phone number, bitcoin adress ... in a file, 2020-04-12T13:58:42+0000
/project/hachoir/, hachoir, 3.1.2, Package of Hachoir parsers used to open binary files, 2021-02-15T11:03:12+0000
/project/scsslintbear/, SCSSLintBear, 0.10.0, 'SCSSLintBear' bear for coala (http://coala.rtfd.org/), 2017-03-16T13:06:23+0000
/project/sasa/, sasa, 0.2.0, SAIL/AIL Sentiment Analyzer, 2019-04-09T21:20:38+0000
/project/ratconnectome/, RatConnectome, 0.0.2, Python API for neuroVIISAS Rat Connectome Project, 2019-09-13T15:02:07+0000
/project/csvbar/, csvbar, 1.4, Draw bar graphs from CSV files in the terminal., 2016-01-06T17:46:33+0000
/project/facebookinsights/, facebookinsights, 0.3.4, A wrapper and command-line interface for the Facebook Insights API., 2015-07-14T21:35:35+0000
/project/devicepilot/, devicepilot, 1.0.1, DevicePilot SDK for IoT Analytics, 2019-05-14T10:17:43+0000
/project/oscovida/, oscovida, 0.2.5, Coronavirus-2020, 2021-02-04T08:49:57+0000
/project/ndex/, ndex, 3.0.11.23, NDEx Python includes a client and a data model., 2017-03-13T01:31:47+0000
/project/automl-alex/, automl-alex, 1.3.10, State-of-the art Automated Machine Learning python library for Tabular Data, 2021-03-07T21:57:36+0000
/project/datamart/, datamart, 2021.3.17, Datamart API, 2021-03-17T21:07:07+0000
/project/libshorttext/, libshorttext, 1.1.0.0, LibShortText is an open source tool for short-text classification and analysis. It can handle the classification of, for example, titles, questions, sentences, and short messages, 2015-09-29T13:26:02+0000
/project/pyjstat/, pyjstat, 2.2.0, Library to handle JSON-stat data in python using pandas DataFrames., 2020-03-26T20:33:18+0000
/project/ejtraderth/, ejtraderTH, 1.0.3, This tiny little python module is useful for creating multiple threads of any function in seconds., 2021-03-04T16:20:21+0000
/project/trafilatura/, trafilatura, 0.8.2, Web scraping library and command-line tool for text discovery and retrieval. Downloads web pages, scrapes main text and comments while preserving some structure, and converts to TXT, CSV, JSON and XML, 2021-04-21T15:35:14+0000
/project/hublib/, hublib, 0.9.96, Python library for HUBzero Jupyter Notebooks, 2019-08-29T17:50:29+0000
/project/deeptrain/, deeptrain, 0.6.0, Full knowledge and control of the train state, 2020-09-15T14:14:21+0000
/project/pandas-alchemy/, pandas-alchemy, 0.0.2, SQL based, pandas compatible DataFrame & Series, 2021-04-12T18:10:40+0000
/project/grid-control/, grid-control, 1.9.86, The Swiss Army knife of job submission tools, 2017-08-03T13:55:17+0000
/project/retratodefases/, retratodefases, 0.1.3, Una librería sencilla para realizar retratos de fases de sistemas 2D y 3D., 2021-04-17T17:05:12+0000
/project/geoai-gdal/, geoai-GDAL, 3.1.2, GDAL: Geospatial Data Abstraction Library, 2021-04-22T12:49:38+0000
/project/galib/, galib, 1.1.2, A library for graph analysis in Python / NumPy., 2020-06-15T15:33:05+0000
/project/revrand/, revrand, 1.0.0, A library of scalable Bayesian generalized linear models with fancy features, 2017-01-29T03:22:37+0000
/project/jupyxplorer/, jupyXplorer, 0.0.4, jupyXplorer: notebooks generator from data, 2019-01-10T23:31:25+0000
/project/agreement-phi/, agreement-phi, 0.3.0, Inter-rater agreement Phi, as an alternative to Kripperndorfs alpha, as described in https://github.com/AlessandroChecco/agreement-phi, 2018-08-07T16:15:55+0000
/project/pytorch-lightning-spells/, pytorch-lightning-spells, 0.0.3, Some useful plugins for PyTorch Lightning., 2021-03-26T08:51:28+0000
/project/openfisca-web-api/, OpenFisca-Web-API, 8.2.0, Web API for OpenFisca, 2018-05-01T15:26:53+0000
/project/openfisca-survey-manager/, OpenFisca-Survey-Manager, 0.41.3, A tool for managing survey data, 2021-03-22T20:30:18+0000
/project/sparsesvd/, sparsesvd, 0.2.2, Python module that wraps SVDLIBC, a library for sparse Singular Value Decomposition., 2013-12-26T00:01:24+0000
/project/histbook/, histbook, 1.2.5, Versatile, high-performance histogram toolkit for Numpy., 2018-11-06T15:23:46+0000
/project/predikto/, predikto, 1.2.0, Predikto Python SDK, 2015-09-17T14:30:26+0000
/project/know-your-ip/, know_your_ip, 0.1.8, Get data on IP addresses, 2018-09-12T23:21:41+0000
/project/nixtla/, nixtla, 5.3.7, Formulae-based annotation for Sign Language corpora, 2014-11-28T16:04:16+0000
/project/dvg-ringbuffer/, dvg-ringbuffer, 1.0.1, Numpy ringbuffer at a fixed memory address to allow for significantly sped up numpy, sigpy, numba & pyFFTW calculations., 2020-07-21T22:06:39+0000
/project/regex4dummies/, regex4dummies, 1.4.6, A NLP library that simplifies pattern finding in strings, 2015-12-25T23:11:42+0000
/project/openturns/, openturns, 1.16, Uncertainty treatment library, 2020-11-18T11:21:08+0000
/project/fastnumbers/, fastnumbers, 3.1.0, Super-fast and clean conversions to numbers., 2020-11-21T23:08:05+0000
/project/clickhouse-sqlalchemy/, clickhouse-sqlalchemy, 0.1.6, Simple ClickHouse SQLAlchemy Dialect, 2021-03-15T09:58:58+0000
/project/hypermorph/, hypermorph, 0.1.2, HyperMorph - operational API for information management and data transformations-analytics, 2020-08-26T11:04:05+0000
/project/predictive-punter/, predictive-punter, 1.0.0a4, Applying predictive analytics to horse racing via Python, 2016-07-29T05:50:07+0000
/project/pycm/, pycm, 3.1, Multi-class confusion matrix library in Python, 2021-03-11T15:52:20+0000
/project/vader-sentiment/, vader-sentiment, 3.2.1.1, VADER Sentiment Analysis. VADER (Valence Aware Dictionary and sEntiment Reasoner) is a lexicon and rule-based sentiment analysis tool that is specifically attuned to sentiments expressed in social media, and works well on texts from other domains., 2019-01-08T10:00:51+0000
/project/writegoodlintbear/, WriteGoodLintBear, 0.10.0, 'WriteGoodLintBear' bear for coala (http://coala.rtfd.org/), 2017-03-16T13:03:24+0000
/project/sidpy/, sidpy, 0.0.5, Python utilities for storing, visualizing, and processing Spectroscopic and Imaging Data (SID), 2021-04-11T19:54:54+0000
/project/openfisca-country-template/, OpenFisca-Country-Template, 3.12.5, OpenFisca tax and benefit system for Country-Template, 2021-03-25T23:03:20+0000
/project/openfisca-france-dotations-locales/, OpenFisca-France-Dotations-Locales, 0.7.3, [EN] OpenFisca tax and benefit system for France State endowments to local authorities.         [FR] Modèle de microsimulation OpenFisca dédié aux dotations de l'État aux collectivités territoriales., 2021-04-22T11:20:12+0000
/project/dypolychord/, dyPolyChord, 0.1.1, Super fast dynamic nested sampling with PolyChord (python, C++ and Fortran likelihoods)., 2019-08-17T10:00:25+0000
/project/cwl-airflow/, cwl-airflow, 1.2.10, Python package to extend Airflow functionality with CWL v1.1 support, 2021-01-29T11:36:59+0000
/project/plda/, plda, 1.0.0, Latent Dirichlet Allocation in parallel, 2017-02-22T05:49:12+0000
/project/csvkitcat/, csvkitcat, 1.6.1a0, 'The unofficial extended family of csvkit: semi-awkward tools for command-line data parsing, 2020-09-25T16:38:26+0000
/project/pypika/, PyPika, 0.48.1, A SQL query builder API for Python, 2021-04-07T09:45:37+0000
/project/musiclegacy/, musicLegacy, 0.1.dev13, Yet another music package using the MASS (Music and Audio in Sample Sequences) framework, 2019-05-11T20:12:24+0000
/project/backprop/, backprop, 0.1.3, Backprop, 2021-04-20T14:16:41+0000
/project/nauth/, nauth, 1.0.12, Nervana platform authorization and authentication related, 2017-12-07T22:34:20+0000
/project/wurst/, wurst, 0.2.2, Wurst is a python package for linking and modifying industrial ecology models, 2020-12-02T22:02:26+0000
/project/nemoa/, nemoa, 0.5.582, Enterprise Machine-Learning and Predictive Analytics, 2019-07-09T18:13:56+0000
/project/seqgentools/, seqgentools, 0.0.16, Sequence Generation Tools inspired by Python itertools., 2019-03-20T16:44:15+0000
/project/influxgraph/, influxgraph, 1.5.0.post1, InfluxDB storage plugin for Graphite-API, 2018-11-03T22:21:22+0000
/project/rgmining-fraud-eagle/, rgmining-fraud-eagle, 0.9.7, An implementation of Fraud Eagle algorithm, 2017-09-27T06:45:13+0000
/project/itk-krcahsheetness/, itk-krcahsheetness, 0.1.0, ITK filters to generate a sheetness feature image useful for segmenting bone in CT images and similar applications., 2017-11-30T23:05:35+0000
/project/aistac-foundation/, aistac-foundation, 2.12.7, Augmented Intent Single Task Adaptive Components, 2021-04-02T12:44:01+0000
/project/luhn-algorithm-validator/, Luhn_Algorithm_Validator, 1.0.1, Luhn Account Number Validator, 2015-08-19T15:21:23+0000
/project/pipette/, pipette, 0.1.9, A library implementing a protocol to simplify programming pipeline-like chains of intercommunicating processes., 2015-04-07T17:09:27+0000
/project/snps/, snps, 2.1.3, tools for reading, writing, merging, and remapping SNPs, 2021-04-17T21:36:11+0000
/project/itk-anisotropicdiffusionlbr/, itk-anisotropicdiffusionlbr, 1.1.2, Smooth images while preserving edges or coherent structures., 2020-06-10T22:07:51+0000
/project/insights/, insights, 0.3.2, Quantitative algorithms, portfolio managers, data sources and contexts for Intuition, 2014-05-31T16:10:13+0000
/project/nems/, nems, 0.3.0, Neural encoding models, 2018-10-01T00:40:04+0000
/project/bigtempo/, bigtempo, 0.38.9, BigTempo is a powerful and scalable programming model, originally crafted for temporal data processment / analysis., 2014-01-09T16:08:04+0000
/project/bear-installation-tool/, bear_installation_tool, 0.0.5, Installation tool for coala-bears, 2016-08-07T21:40:36+0000
/project/coclust/, coclust, 0.2.1, coclustering algorithms for data mining, 2017-02-22T17:15:55+0000
/project/pycloner/, pycloner, 0.1.0, pycloner is a package that tries to help in the process of manually crawling a website., 2017-07-04T13:30:24+0000
/project/csvpivot/, csvpivot, 1.4, Pivot tables for CSV files in the terminal., 2018-06-22T21:01:09+0000
/project/optimization-metadata/, optimization-metadata, 0.3.2, Meta-data core functionalities for Hyperactive, 2020-08-04T09:50:11+0000
/project/cohort-analysis/, cohort-analysis, 0.1.2, A package for calculating cohort metrics from an activity stream and cohorts data table., 2021-04-15T12:32:57+0000
/project/vis-graph/, vis-graph, 0.0.2, From time series to graph thru visibility algorithm., 2019-07-25T20:20:02+0000
/project/datadotworld/, datadotworld, 1.7.0, Python library for data.world, 2019-07-06T00:50:52+0000
/project/glmtools/, glmtools, 0.1.0, GLMtools, 2020-07-17T15:59:57+0000
/project/datrie-extended/, datrie-extended, 0.7.3, Super-fast, efficiently stored Trie for Python., 2017-02-15T19:15:22+0000
/project/neuraxle-tensorflow/, neuraxle-tensorflow, 0.1.2, TensorFlow steps, savers, and utilities for Neuraxle. Neuraxle is a Machine Learning (ML) library for building neat pipelines, providing the right abstractions to both ease research, development, and deployment of your ML applications., 2020-09-07T00:45:38+0000
/project/sequential-procedure/, sequential_procedure, 1.0.b1, A library that contains classes having methods that will help in estimating the sample size required for a statistical experiment., 2017-03-09T19:32:15+0000
/project/bw2analyzer/, bw2analyzer, 0.9.4, , 2017-04-17T06:27:24+0000
/project/cpytraceafl-regex/, cpytraceafl-regex, 0.2.0, A modified version of mrab-regex with added cpytraceafl instrumentation, 2020-06-19T21:34:20+0000
/project/awesome-panel-extensions/, awesome-panel-extensions, 20210326.3, A package of awesome Panel extensions. Provided by awesome-panel.org, 2021-03-26T06:31:55+0000
/project/sideeye/, sideeye, 1.0.0a13, Library for analyzing eye-tracking-while-reading data, 2019-12-09T16:32:47+0000
/project/metanetwork/, metanetwork, 0.1.0, Structured Ensemble Learning, 2020-07-27T20:56:04+0000
/project/tableschema-spss/, tableschema-spss, 1.0.14, , 2019-11-01T12:53:19+0000
/project/hangul-korean/, hangul-korean, 1.0rc2, Word segmentation for the Korean Language, 2021-01-20T08:29:57+0000
/project/paretochart/, paretochart, 1.0, Pareto chart for python (similar to Matlab's, but much more flexible), 2013-09-05T20:14:19+0000
/project/quaerere-willamette-client/, quaerere-willamette-client, 0.1.0a2, Client for willamette RESTful API, 2019-08-08T03:55:38+0000
/project/minicps/, minicps, 1.1.3, MiniCPS: a framework for Cyber-Physical Systems real-time simulation, built on top of mininet., 2017-06-28T03:51:49+0000
/project/vhdllintbear/, VHDLLintBear, 0.10.0, 'VHDLLintBear' bear for coala (http://coala.rtfd.org/), 2017-03-16T13:07:05+0000
/project/rlintbear/, RLintBear, 0.10.0, 'RLintBear' bear for coala (http://coala.rtfd.org/), 2017-03-16T13:05:40+0000
/project/lcoptview/, lcoptview, 0.1.4, , 2017-11-29T15:45:05+0000
/project/annotationbear/, AnnotationBear, 0.10.0, 'AnnotationBear' bear for coala (http://coala.rtfd.org/), 2017-03-16T12:59:12+0000
/project/pdftabextract/, pdftabextract, 0.3.0, A set of tools for data mining (OCR-processed) PDFs, 2018-01-09T08:00:22+0000
/project/ogn-flogger/, OGN-Flogger, 0.3.2a14, Realtime logging of glider flights from Flarm data, 2018-06-15T20:12:51+0000
/project/lux-widget/, lux-widget, 0.1.5, A Custom Jupyter Widget Library, 2021-04-19T01:30:32+0000
/project/urbansim-wfrc/, urbansim-wfrc, 0.4.0, Urbansim library originally by Paul Waddell, customized by WFRC Analytics, 2020-07-09T18:45:14+0000
/project/perke/, perke, 0.3.3, A keyphrase extractor for Persian, 2021-04-11T22:53:22+0000
/project/cmakelintbear/, CMakeLintBear, 0.10.0, 'CMakeLintBear' bear for coala (http://coala.rtfd.org/), 2017-03-16T12:56:59+0000
/project/awkward/, awkward, 1.2.2, Manipulate JSON-like data with NumPy-like idioms., 2021-04-12T21:41:54+0000
/project/pymatgen/, pymatgen, 2022.0.6, Python Materials Genomics is a robust materials analysis code that defines core object representations for structures and molecules with support for many electronic structure codes. It is currently the core analysis code powering the Materials Project (https://www.materialsproject.org)., 2021-04-22T06:26:09+0000
/project/soyprice/, soyprice, 0.0.2, A python library to show the soy price in a twitter timeline., 2015-02-04T22:56:28+0000
/project/autogluon-tabular/, autogluon.tabular, 0.1.0, AutoML for Text, Image, and Tabular Data, 2021-03-01T22:06:47+0000
/project/cross/, cross, 1.0.3, Tool to cross CSV/TSV datasets, 2017-02-03T22:04:36+0000
/project/pelican-similar-posts/, pelican-similar-posts, 1.0.0, Pelican plugin to add similar posts to articles, based on a vector space model, 2020-11-20T21:38:33+0000
/project/swarmlib/, swarmlib, 0.14.1, Implementation and visualization of different swarm optimization algorithms., 2020-12-16T20:54:59+0000
/project/textblob-de/, textblob-de, 0.4.3, German language support for TextBlob., 2019-01-03T00:13:57+0000
/project/target-typo-proxy/, target-typo-proxy, 0.1.0, Typo is the intelligent data quality barrier for enterprise information systems. The Typo target proxy communicates with Singer taps, consumes data that conforms to the Singer JSON specification, and provides data quality services to data in motion., 2019-12-30T23:14:36+0000
/project/rgmining-rsd/, rgmining-rsd, 0.2.5, An implementation of RSD algorithm, 2017-09-27T14:24:36+0000
/project/deepaas/, deepaas, 1.3.0, DEEPaaS is a REST API to expose a machine learning model., 2020-04-22T15:38:05+0000
/project/absorbing-centrality/, absorbing_centrality, 0.1.0, An implementation of the absorbing random-walk centrality measure for graphs., 2015-09-18T16:11:51+0000
/project/simplecosine/, simplecosine, 1.2, Simple cosine distance, 2017-06-15T21:35:03+0000
/project/gitlas/, gitlas, 0.2.4, A minimalist git log Statistics library, 2020-09-06T10:05:04+0000
/project/edapy/, edapy, 0.3.0, A tookit for exploratoriy data analysis., 2020-07-24T16:58:15+0000
/project/clan/, clan, 0.2.3, A command line utility for working with Google Analytics., 2014-12-17T14:43:29+0000
/project/pysurfex/, pysurfex, 0.0.1a16, Python API to SURFEX, 2021-04-22T08:16:06+0000
/project/indicoio/, IndicoIo, 1.4.1, A Python Wrapper for indico. Use pre-built state of the art machine learning algorithms with a single line of code., 2020-01-28T19:50:19+0000
/project/apstools/, apstools, 1.5.0, Various Python tools for use with the Bluesky Framework at the APS, 2021-04-02T20:49:42+0000
/project/fiftyone/, fiftyone, 0.8.0.1, FiftyOne: the open-source tool for building high-quality datasets and computer vision models, 2021-04-06T21:11:44+0000
/project/mjolnir/, MJOLNIR, 1.1.18, Neutron Scattering software suite., 2021-04-13T09:16:02+0000
/project/flatbread/, flatbread, 0.0.8, Pivot tables and graphs for pandas, 2021-04-23T20:36:34+0000
/project/underverse/, underverse, 0.4.1, A zero-configuration, non-distributed, JSON-based document storage and analysis module focusing on the manipulation,                     grouping and filtering of unstructured data from various sources. MapReduce is also supported for more advanced                     analysis methods. Query syntax is similar to SQL-Alchemy's filter method., 2012-03-06T20:06:22+0000
/project/aomie/, aomie, 0.0.0, Pure Python 3 open source library to handle Iberian electricity market data published by OMIE., 2019-09-17T13:37:38+0000
/project/concurrentpandas/, ConcurrentPandas, 0.1.2, Download data using pandas with multi-threading and multi-processing., 2015-03-25T21:24:40+0000
/project/mypersonaldev/, MyPersonalDev, 0.1.2, open-source personal development software, 2011-12-21T03:53:32+0000
/project/pymrt/, pymrt, 0.0.3.4, Python Magnetic Resonace Tools, 2020-09-09T13:27:57+0000
/project/skits/, skits, 0.1.2, scikit-learn-inspired time series, 2019-11-01T20:30:16+0000
/project/networkit/, networkit, 8.1, NetworKit is a toolbox for high-performance network analysis, 2021-02-23T17:32:14+0000
/project/atquant/, atquant, 2.3.846, atquant Algorithm Trading System, 2018-09-04T07:37:18+0000
/project/mave/, mave, 0.0.42, Package for Measurement and Verification, 2016-02-23T01:52:57+0000
/project/simcrf/, simcrf, 0.1.8, simple and quick crf wrapper for crfsuite, 2018-05-18T07:52:12+0000
/project/openfisca-france-indirect-taxation/, OpenFisca-France-Indirect-Taxation, 0.4.dev0, France specific indirect taxation model for OpenFisca -- a versatile microsimulation free software, 2015-12-02T13:42:42+0000
/project/tmtoolkit/, tmtoolkit, 0.10.0, Text Mining and Topic Modeling Toolkit, 2020-08-03T13:40:46+0000
/project/ifa/, ifa, 0.2.0, A library for information flow analysis, 2015-02-05T19:55:02+0000
/project/fgivenx/, fgivenx, 2.3.0, fgivenx: Functional Posterior Plotter, 2021-02-05T15:23:18+0000
/project/kmeanstf/, kmeanstf, 0.8.1, TensorFlow-based implementation of k-means, k-means++ and tunnel k-means. GPU-enabled., 2020-01-06T00:26:17+0000
/project/golintbear/, GoLintBear, 0.10.0, 'GoLintBear' bear for coala (http://coala.rtfd.org/), 2017-03-16T13:00:38+0000
/project/masked-convolution/, masked-convolution, 0.3.1, A PyTorch wrapper for masked convolutions, 2021-02-01T22:26:05+0000
/project/perfectns/, perfectns, 2.1.3, Dynamic and standard nested sampling for spherically symmetric likelihoods and priors., 2019-08-17T09:57:07+0000
/project/uncover-ml/, uncover-ml, 0.4.0, Machine learning tools for the Geoscience Australia uncover project, 2020-07-24T11:02:46+0000
/project/pyvast-threatbus/, pyvast-threatbus, 2021.3.25, Connect the open source telemetry engine VAST with Threat Bus, the open source threat intelligence dissemination layer, 2021-03-25T09:17:09+0000
/project/anesthetic/, anesthetic, 1.3.6, anesthetic: nested sampling visualisation, 2020-07-31T06:25:00+0000
/project/covid19sweden/, covid19sweden, 0.2.2, Web Scraper for Sweden COVID19 data., 2021-01-01T16:08:47+0000
/project/hmmus/, hmmus, 0.3.1, Posterior decoding with a hidden Markov model, 2010-07-28T14:24:37+0000
/project/fornax/, fornax, 0.1.1, Approximate fuzzy subgraph matching in polynomial time, 2019-06-10T08:58:22+0000
/project/wmf-umapi-client/, wmf_umapi_client, 0.1.1-dev, Client wrapper for Wikimedia UMAPI., 2013-04-02T17:52:30+0000
/project/imslp/, imslp, 0.1.0, The clean and modern way of accessing IMSLP data and scores programmatically., 2020-08-03T07:08:50+0000
/project/py-sonicvisualiser/, py_sonicvisualiser, 0.3, manipulating sonic-visualiser environment files, 2017-06-02T12:54:18+0000
/project/ps-calcs/, ps-calcs, 2.0.0, Product Space calculations., 2018-11-12T17:23:49+0000
/project/scikit-surgeryvideoutils/, scikit-surgeryvideoutils, 0.1.0, scikit-surgeryvideoutils, 2018-12-23T08:58:56+0000
/project/qlink/, qlink, 0.1a1, Entity Resolution and Record Linkage library, 2017-07-28T22:08:39+0000
/project/sigmentation/, sigmentation, 0.1.2, Univariate Data Segmentation using Genetic Algorithm, 2020-02-11T10:07:05+0000
/project/lpbkg/, LPBkg, 0.1.3, Detecting new signals under background mismodelling., 2020-06-14T01:08:03+0000
/project/smatch/, smatch, 1.0.4, Smatch (semantic match) tool, 2020-05-31T05:02:52+0000
/project/scikit-surgerytrackervisualisation/, scikit-surgerytrackervisualisation, 0.0.4, Provides a live visualisation of tracking data from a scikit-surgerytracker source, 2020-08-10T13:42:02+0000
/project/connvitals/, connvitals, 4.3.2, Checks a machines connection to a specific host or list of hosts, 2018-08-30T16:22:18+0000
/project/agrc-usaddress/, agrc-usaddress, 0.6.1, Parse US (optimized for Utah by AGRC) addresses using conditional random fields, 2021-01-04T21:40:44+0000
/project/cwru/, cwru, 0.2, Case Western Reserve University Bearing Data, 2016-06-10T16:59:31+0000
/project/jumany/, jumany, 0.4.5, Interface for JUMAN Morphological analysis system, 2017-10-10T03:45:16+0000
/project/pyseg/, pyseg, 0.0.9, sentence seg module written in C, 2019-09-04T02:11:36+0000
/project/panel-sketch/, panel-sketch, 20210411.2, To sketch high performing, interactive visualizations running in the browser and drawing inspiration from p5js, 2021-04-11T17:31:14+0000
/project/spellcheckbear/, SpellCheckBear, 0.10.0, 'SpellCheckBear' bear for coala (http://coala.rtfd.org/), 2017-03-16T13:03:18+0000
/project/py4xs/, py4xs, 2021.2.22.0, python package for processing x-ray scattering data, 2021-02-22T21:35:35+0000
/project/losd/, losd, 0.2b0, losd is (currently) a very simple python package for querying the LOSD (linked open social data) dataset, 2019-07-02T02:06:28+0000
/project/tslintbear/, TSLintBear, 0.10.0, 'TSLintBear' bear for coala (http://coala.rtfd.org/), 2017-03-16T13:06:47+0000
/project/calculate-retention/, calculate-retention, 0.0.5, Simple package designed to calculate end-to-end user retention metrics, 2019-11-06T00:34:19+0000
/project/podcast/, podcast, 1.0.1, An easy way to see the importpodcast site., 2012-07-14T08:01:45+0000
/project/openfisca-france-fiscalite-miniere/, OpenFisca-France-Fiscalite-Miniere, 1.1.2, French mining tax system for OpenFisca, 2020-11-16T15:33:48+0000
/project/datamol/, datamol, 0.3.7, A python library to work with molecules. Built on top of RDKit., 2021-04-17T17:53:21+0000
/project/tm-navigator/, tm_navigator, 1.0, UNKNOWN, 2015-09-26T19:00:08+0000
/project/spec2nexus/, spec2nexus, 2021.1.8, Converts SPEC data files and scans into NeXus HDF5 files, 2020-11-10T21:18:24+0000
/project/invalidlinkbear/, InvalidLinkBear, 0.10.0, 'InvalidLinkBear' bear for coala (http://coala.rtfd.org/), 2017-03-16T12:59:35+0000
/project/igo-python/, igo-python, 1.0.0, Python port of Igo Japanese morphological analyzer, 2018-09-24T23:56:31+0000
/project/fastr/, fastr, 3.2.3, Workflow creation and batch execution environment., 2020-06-25T12:51:34+0000
/project/nsound/, Nsound, 0.9.4, Nsound is a C++ library and Python module for audio synthesis
    featuring dynamic digital filters. Nsound lets you easily shape
    waveforms and write to disk or plot them. Nsound aims to be as
    powerful as Csound but easy to use., 2015-08-23T19:28:52+0000
/project/ckiptngsu/, ckiptngsu, 0.1.0, , 2018-07-13T10:18:30+0000
/project/xploitv/, xploitv, 0.1.1, An automated Xploitv grabber, 2020-04-06T17:43:03+0000
/project/itemresponsecalc/, ItemResponseCalc, 0.5.0, Statistical Analysis of Questionnaire Response Data, 2020-06-09T02:28:54+0000
/project/gazelib/, gazelib, 2.1.1, Software tools to manage and analyze data from eye-trackers, 2016-06-14T11:27:46+0000
/project/hasi/, hasi, 0.2, High-throughput Applications for Skeletal Imaging (HASI) Python content, 2021-04-06T17:24:38+0000
/project/tabnetviz/, tabnetviz, 1.1.2, Table-based network visualizer, 2021-01-07T21:03:15+0000
/project/pyxdameraulevenshtein/, pyxDamerauLevenshtein, 1.7.0, pyxDamerauLevenshtein implements the Damerau-Levenshtein (DL) edit distance algorithm for Python in Cython for high performance., 2021-02-09T18:51:42+0000
/project/awkward1-cuda-kernels/, awkward1-cuda-kernels, 0.4.5, CUDA plug-in for Awkward Array, enables GPU-bound arrays and operations., 2020-11-24T21:27:38+0000
