/project/mohammedyasser/, mohammedyasser, 0.0.1, very simple calculator, 2021-01-12T13:34:31+0000
/project/reybasiccalculator/, ReyBasicCalculator, 0.0.1, A command line calculator, 2021-04-12T08:15:39+0000
/project/reg-sieves/, reg-sieves, 0.0.1, The regression approach with sieves., 2020-09-22T00:10:28+0000
/project/sesam-jacktop/, Sesam-JackTop, 0.0.1, Sesam Software Jacket and Topside Helper Tools, 2020-07-24T11:36:44+0000
/project/piimp/, piimp, 0.0.0, This is a Python package for post-processing ice irradiation data., 2020-11-20T06:18:36+0000
/project/generator-name/, Generator-Name, 0.0.4, Generacion de Id en base a nombre, 2020-12-01T20:06:43+0000
/project/binmysql/, BinMySQL, 0.0.9, Quick and intuitive MySQL Connector, 2021-04-04T15:33:32+0000
/project/vamsikrishnapapana/, vamsikrishnapapana, 0.0.1, A simple library that contains my details, 2021-03-11T14:40:12+0000
/project/morepitool/, MorEpiTool, 2.0.8, RL based Epidemic control simulation environment, 2021-03-04T15:25:55+0000
/project/tsr/, tsr, 0.0.3, TSR on command-line, 2018-07-11T08:54:29+0000
/project/lifx-control-panel/, lifx-control-panel, 1.8.0, An open source application for controlling your LIFX brand lights, 2020-08-08T21:29:41+0000
/project/simpleeconomy/, SimpleEconomy, 1.2.1, Very easy to use discord.py economy creator, 2021-04-13T13:09:47+0000
/project/vivek2dropoffnan/, vivek2dropoffnan, 0.0.1, A simple package to perform basic data cleaning in EDA, 2021-03-23T00:10:23+0000
/project/tweetdatalib6/, tweetdatalib6, 0.0.1, A very basic twitter data extractor library, 2020-09-05T21:20:11+0000
/project/naitancalculator/, naitancalculator, 0.1, A very basic calculator, 2020-12-12T12:19:32+0000
/project/flecsimo/, flecsimo, 0.1.3, A research/educational simulation model of a IIoT cellular production site., 2020-08-28T17:16:02+0000
/project/fpldata/, fpldata, 0.0.4, Getting data out of FPL API made easier, 2020-10-08T20:40:35+0000
/project/hello-wor/, hello-wor, 0.0.1, A very simple library, 2021-04-18T09:03:05+0000
/project/onedrive/, onedrive, 0.0.14, Download shared folders with Selenium in bulk., 2020-07-01T10:52:04+0000
/project/csvwrangle/, csvwrangle, 0.0.1, Wrangle CSV data with pandas from the command-line, 2020-12-24T16:04:12+0000
/project/functions-for-mash-objects/, functions-for-mash-objects, 0.0.1, Functions for parsing of maya ascii files that returns name, position and uid of all mesh objects, 2021-01-19T20:35:58+0000
/project/cappy-python/, CapPy-Python, 0.0.6, Python package for easy window capturing, 2020-09-05T21:27:01+0000
/project/apprest-interface/, apprest_interface, 1.0.7.dev0, A simple Python package to facilitate interactions with APP's API, 2017-12-15T22:15:42+0000
/project/pillepy/, pillepy, 0.0.1, Useful functions for data manipulation., 2020-12-21T09:54:48+0000
/project/manhattandistance/, manhattandistance, 1.1.1, Calculates the Manhattan Distance of two places, 2020-12-15T16:08:03+0000
/project/hassans-frame/, hassans-frame, 0.0.0, , 2021-04-25T17:47:21+0000
/project/pyautomaker/, PyAutoMaker, 0.1.4, 자동화를 위한 패키지, 2021-03-01T13:50:42+0000
/project/pymemory/, PyMemory, 0.0.7, Happy using PyMemory to read and write to computer memory., 2019-10-25T13:28:42+0000
/project/liqueur/, liqueur, 0.0.5, A lightweight python framework for Capital API, 2020-07-05T10:14:56+0000
/project/potosnail/, Potosnail, 0.2.4, improves ML workflow, 2021-03-12T13:31:11+0000
/project/topsis-ritik-101803600/, TOPSIS-Ritik-101803600, 0.0.1, TOPSIS package, 2020-11-13T18:54:52+0000
/project/mediaplanning/, mediaplanning, 0.0.5, Python package for media planning, 2020-08-30T15:10:47+0000
/project/plotmygsheet/, plotmygsheet, 0.0.1, This package will plot a graph between the two columns of your choice from google sheet., 2020-10-10T12:44:56+0000
/project/starsymbolfinder/, starsymbolfinder, 0.0.6, A package that finds a star symbol for a specified date., 2021-04-05T11:31:56+0000
/project/slprint11-pkg/, slprint11-pkg, 1.1, Simple module to display a text with a time interval between each characters., 2020-05-02T00:11:08+0000
/project/pyfpa/, pyfpa, 0.0.9, Leverage the power of Python for corporate finance and accounting functions., 2020-12-08T01:56:51+0000
/project/andrew-confidence-intervals/, andrew-confidence-intervals, 0.0.6, Package for calculation of confidence intervals., 2020-09-05T14:33:44+0000
/project/enan/, enan, 1.0.2, a package for ENrichment ANalyses, 2020-11-09T09:41:29+0000
/project/trovefm/, trovefm, 0.0.2, A Python API for TroveFM, 2018-12-15T22:19:57+0000
/project/ataner/, ataner, 0.0.1, Say hello!, 2021-01-15T17:23:14+0000
/project/simple-package/, Simple-Package, 0.0.1, A very basic calculator, 2020-10-26T21:11:35+0000
/project/manuvision/, manuvision, 0.0.1a0, A small example package, 2020-08-19T10:11:17+0000
/project/rectanglecollision/, RectangleCollision, 0.0.0.7, A basic collision module, 2020-07-14T13:48:35+0000
/project/easydataframe-lipsum/, easydataframe-lipsum, 0.0.3, A library that handles small xlsx files as a DataFrame., 2021-01-02T01:52:34+0000
/project/onhandcal/, onhandcal, 0.0.1, basic calculator, 2020-11-27T12:55:52+0000
/project/oeispy/, oeispy, 0.0.5, Simple Python Library for OEIS, 2020-06-06T07:32:12+0000
/project/yucli/, YUCLI, 1.3.0.0, A customizable command line environment for Python projects, 2021-04-15T22:30:02+0000
/project/bert-embeddings/, bert-embeddings, 0.0.9, Create positional embeddings based on TinyBERT or similar bert models, 2021-04-17T15:39:22+0000
/project/satyam/, Satyam, 0.0.1, This pacakage conatins a basic functionality of a calculator , containing functions such as addition , subraction , multiplication and division. It  will return the value calculated by the respective function., 2021-02-09T10:20:08+0000
/project/koapy/, koapy, 0.3.4, Kiwoom Open Api Python, 2021-03-28T23:47:28+0000
/project/fmoarpg/, FMOARPG, 0.0.7, Biblioteca para integrar Forge e Power BI, 2020-06-29T17:54:23+0000
/project/simplelinearregression/, simplelinearregression, 0.0.1, A very linear regression package, 2020-12-19T15:41:37+0000
/project/arsibasiccalculator/, arsibasiccalculator, 0.0.1, A very basic calculator, 2021-03-14T09:49:47+0000
/project/autoanno/, autoanno, 0.0.1.dev1, Investigation into using AutoML and Topological Data Analysis for Automated Annotation, 2021-03-22T19:26:25+0000
/project/autocp2k/, autocp2k, 0.0.1, This is a python module for automating CP2K calculations., 2020-05-25T22:03:26+0000
/project/dotsandboxes/, DotsAndBoxes, 1.1.0, 点格棋对弈软件, 2018-07-25T02:16:10+0000
/project/pdot/, pdot, 0.0.1, This is a bookmark!, 2021-02-20T00:03:11+0000
/project/gloria-housing/, gloria-housing, 0.0.1, Predicts Median housing value, 2020-11-13T13:02:37+0000
/project/timemory/, timemory, 3.1.0, Lightweight cross-language instrumentation API for C, C++, Python, Fortran, and CUDA which allows arbitrarily bundling tools together into a single performance analysis handle, 2020-07-11T01:12:43+0000
/project/wmc-datalake-functions/, wmc-datalake-functions, 1.0, Functions from WMC Datalake, 2020-11-18T12:20:30+0000
/project/cwl-airflow-parser/, cwl-airflow-parser, 1.0.20181213213631, Package extends Airflow functionality with CWL v1.0 support, 2018-12-13T21:46:28+0000
/project/pisarnwatebasiccalculator/, pisarnwatebasiccalculator, 0.0.1, A very very basic calculator, 2020-10-15T15:05:14+0000
/project/crisps/, crisps, 0.0.3.1, Eat and get fat., 2021-02-07T10:39:27+0000
/project/dominisia/, dominisia, 0.0.1, Say hello!, 2021-01-13T20:10:26+0000
/project/heaty/, Heaty, 2020.10b2, A building heat load calculator, 2020-10-23T13:04:19+0000
/project/ddns-client/, ddns-client, 0.8, ddns_client, used with coredns/etcd, 2019-06-27T03:01:22+0000
/project/lts/, lts, 0.0.2, A basic list to string converter, 2020-08-26T21:27:34+0000
/project/pycapnp/, pycapnp, 1.0.0, A cython wrapping of the C++ Cap'n Proto library, 2020-11-20T21:00:38+0000
/project/fliptrack/, fliptrack, 1.0.0, A Library for getting Flipkart Products info, 2020-10-15T15:22:33+0000
/project/mosquito-remover/, mosquito-remover, 1.0.0, This is only for entertainment purposes (I made this for fun!), 2021-02-17T08:44:16+0000
/project/a2y/, a2y, 0.8.0, A handy package for installing a2y series modules., 2020-06-30T03:03:54+0000
/project/veerbasiccalculator/, veerbasiccalculator, 0.0.1, A very basic calculator, 2020-10-20T08:16:41+0000
/project/uptt/, uPTT, 0.0.1.beta, uPTT, 2019-08-19T07:02:38+0000
/project/cryptoanalysis/, cryptoanalysis, 0.0.1, Basic analysis and visualization of cryptocurrency digital assets, 2021-04-10T15:57:37+0000
/project/pymathrix/, pymathrix, 0.0.7, Pymathrix is a python library for matrix objects creation and basic operations., 2020-10-01T15:35:25+0000
/project/formatting/, formatting, 0.0.1, A formatting function, 2021-02-06T14:20:02+0000
/project/topsis-sukriti-401803026/, TOPSIS-SUKRITI-401803026, 0.0.4, TOPSIS evaluator for given data. Enter all arguments as strings, 2020-11-13T20:42:11+0000
/project/pathtub/, pathtub, 1.1.2, Reading and editing Windows PATH., 2020-04-12T16:31:03+0000
/project/discordbmd/, discordBMD, 0.0.1, A simple bot discord creator, 2021-03-24T11:26:36+0000
/project/datapreprep/, datapreprep, 0.0.7, A Data Pre Processing Package, 2020-12-09T15:58:35+0000
/project/bhasklibrary/, bhasklibrary, 0.0.1, A very basic calculator, 2021-02-11T16:50:48+0000
/project/postgrestools/, PostgresTools, 0.0.7, Tools to copy database, 2020-12-16T17:05:44+0000
/project/n2pc-library/, N2PC-Library, 0.0.1, Calculates N2PC component of attention, 2020-12-07T22:34:20+0000
/project/skyiris/, skyiris, 0.1.5, machine leanring with iris_dataset, 2021-03-22T15:33:27+0000
/project/usd-core/, usd-core, 21.5, Pixar's Universal Scene Description library, 2021-04-12T22:37:07+0000
/project/collageradiomics-core/, collageradiomics-core, 0.1.2.1, CoLliage Implementation, 2020-07-26T21:40:48+0000
/project/pys5p/, pys5p, 1.1.1, Software package to access S5p Tropomi data products, 2020-11-06T14:48:56+0000
/project/creatingpylibrary/, creatingPyLibrary, 0.0.1, A very basic calculator, 2020-12-19T20:37:22+0000
/project/thepeeps191calc/, thepeeps191calc, 0.0.1, A very basic calculator, 2020-11-26T04:38:29+0000
/project/own-app/, own-app, 0.0.1, , 2021-01-30T14:01:59+0000
/project/potofox/, Potofox, 0.0.1, a Deep Learning library, 2021-03-10T15:54:43+0000
/project/ffmaxflow/, ffmaxflow, 0.0.6, Implementation of the  Fork Fulkerson method to find the max posible flow of a network, 2021-04-25T03:44:44+0000
/project/pybingwallpaper/, PyBingWallpaper, 1.5.6, A simple Bing.com wallpaper downloader, 2019-05-01T04:49:32+0000
/project/brainio/, brainio, 0.0.20, Loading and saving of brain imaging data., 2020-06-18T15:11:40+0000
/project/randpercent/, randpercent, 0.0.3, A library to generate booleans with a given percentage., 2021-04-02T21:51:36+0000
/project/upperdek/, upperdek, 0.0.1, A very basic program, 2020-09-09T21:02:49+0000
/project/spotlight-api/, spotlight-api, 0.0.2, Allow you to monetize your Discord Bots while adding ads to them, 2020-12-06T14:56:06+0000
/project/owopy/, owopy, 0.0.1, This module OwOifies your sentences (turns your sentences into japanese "furry" baby babblespeak :>), 2021-04-07T07:08:39+0000
/project/django-rss-xml-parser/, django-rss-xml-parser, 0.4, This parser is intended for RSS/XML that does not communicate the standard rfc5005, 2017-09-25T00:30:47+0000
/project/s-fhimiancaculator/, s.fhimiancaculator, 0.0.1, A very basic calculator, 2021-03-17T15:14:44+0000
/project/pylgorithm/, pylgorithm, 0.0.1, A Package That Contains Lots Of Commonly Used Algorithms To Make The Developer's Life Easier, 2021-02-16T17:19:10+0000
/project/tlscanary/, tlscanary, 4.0.0, TLS/SSL Test Suite for Mozilla Firefox, 2020-02-18T20:56:15+0000
/project/lc-py/, lc-py, 2.0.1, Lowercase values for Python!, 2019-12-03T02:38:30+0000
/project/line-formater/, line-formater, 1.1.0, A collection of line text formaters, 2018-09-07T09:07:17+0000
/project/sdasbasiccalculator/, SDasBasicCalculator, 1.0.1, A very basic calculator, 2021-01-19T19:13:14+0000
/project/larkinlab/, larkinlab, 0.0.16, A collection of code I have either made or found that helps streamline things. For Data Analysis., 2020-11-03T03:32:25+0000
/project/calc-by-xlabd/, calc-by-xlabd, 0.0.2, A simple calculator, 2020-09-25T05:26:52+0000
/project/examplepkgwindf98/, examplepkgwindf98, 0.1.2, A small example package, 2020-12-28T05:42:34+0000
/project/recalc/, ReCalc, 0.1.12, , 2018-03-25T00:19:28+0000
/project/liamhealytest/, liamhealytest, 0.0.1, Test library, 2021-02-13T14:52:37+0000
/project/sqlalchemy-paradox/, sqlalchemy-paradox, 0.2.0, A SQLAlchemy dialect for Borland / Corel Paradox flat-file databases., 2021-03-10T18:57:36+0000
/project/cp2trans/, cp2trans, 1.1.0, Clipboard to translate., 2020-01-02T07:04:06+0000
/project/sub-finder/, sub-finder, 0.0.1, Module to get all subsidiaries of the given company, 2021-03-30T09:20:26+0000
/project/behzodcalculator/, behzodcalculator, 0.0.1, Juda oddiy kalkulyator, 2021-04-23T19:10:49+0000
/project/hi-pypi-practice/, hi-pypi-practice, 0.0.2, A practice package for me., 2021-02-22T03:27:11+0000
/project/quotespy/, quotespy, 1.3, Python library to create quotes/lyrics and tweet graphics with PIL., 2020-08-30T22:12:16+0000
/project/example-pkg-test03/, example-pkg-test03, 0.1.1, A small example package, 2020-02-27T13:23:21+0000
/project/cxsystem2/, cxsystem2, 0.1.2.6, A cerebral cortex simulation framework, 2020-01-30T14:39:11+0000
/project/sap-example-pkg/, sap-example-pkg, 0.0.6, A small example package, 2019-07-03T13:06:17+0000
/project/zas-rep-tools-data/, zas-rep-tools-data, 0.3, This is the data-set for "zas-rep-tools" package., 2018-10-15T17:04:45+0000
/project/daquiri/, daquiri, 0.0.2, DAQuiri = DAQ + UI Generation + Reactivity + Instruments: A simple scientific DAQ framework., 2019-09-10T19:30:46+0000
/project/xint/, xint, 0.0.4, Use Python to create and explor world., 2021-04-12T08:31:15+0000
/project/secure-password-py/, secure-password-py, 0.0.0, A very easy password generator, 2021-03-14T18:30:58+0000
/project/hyralix/, Hyralix, 0.1.0, Hyralix is a basic text formatter for Python., 2020-12-26T17:59:59+0000
/project/signalpy/, SignalPy, 1.0.6, Realtime communication for Python web applications, 2020-10-20T02:15:54+0000
/project/vsutillib/, vsutillib, 1.6.4, Library module with miscellaneous convenience functions and classes, 2020-09-03T20:29:37+0000
/project/kinopoiskdata/, kinopoiskdata, 1.0, Kinopoisk films data, 2020-12-24T11:59:53+0000
/project/tonetransposer/, tonetransposer, 0.0.5, Transposes a series of tones into all 12 keys and classifies them by their shape on a piano keyboard, 2020-06-24T17:40:36+0000
/project/irori/, irori, 1.0.0, general purpose built tool, 2019-02-02T08:36:51+0000
/project/dcspy/, dcspy, 1.2.2, Software for integrating Digital Combat Simulation planes with Logitech G13/G15/G510, 2021-04-24T14:24:36+0000
/project/dprofiles/, dprofiles, 0.0.2, Discord Oauth2 Client for Quart and a easy to use API Wrapper for dprofiles.xyz, 2021-03-28T09:05:46+0000
/project/bitbotxl/, bitbotxl, 0.0.2, A Python module for the 4tronix Bit:bot XL., 2020-06-03T14:51:01+0000
/project/skidings/, skidings, 0.1.2, Simple module for new comers to networking and requests and mysql, 2021-02-03T01:06:15+0000
/project/justapracticemodule69420blazeit/, justapracticemodule69420blazeit, 1.0.0, This is a calculator, 2020-11-09T19:31:04+0000
/project/maid/, maid, 0.1.12, A package manager written in Python 3.7, 2019-01-09T10:57:22+0000
/project/topology-radiomics/, topology-radiomics, 0.0.0.dev1, Topology Radiomics by INVENT and BRIC lab, 2020-09-25T07:57:39+0000
/project/noita-save-manager/, noita-save-manager, 0.1.2, Noita Save Manager, allows for backup and restoring of save files, 2021-03-14T01:18:44+0000
/project/eelforkexcludefiles/, EelForkExcludeFiles, 0.14.8, For little HTML GUI applications, with easy Python/JS interop, 2021-04-12T20:47:18+0000
/project/dharadrop2/, dharadrop2, 0.0.1, Basic cleaning, 2021-04-11T04:42:09+0000
/project/frogpam/, FrogPAM, 0.0.1, Biblioteca para integrar Forge e Power BI, 2020-06-29T16:13:18+0000
/project/gitupload/, gitupload, 1.0.2, A Python package to upload a local repository to Github from your Local Machine without git commands, 2020-04-16T03:55:09+0000
/project/applicationcreatortoolkit/, applicationcreatortoolkit, 0.0.1, A GUI library built on top of tkinter, 2021-03-19T18:01:31+0000
/project/prospector2/, prospector2, 0.1, Prospector: python static analysis tool, 2018-07-31T12:59:38+0000
/project/offline-115/, Offline-115, 0.1.5, 115网盘添加离线下载任务命令行工具, 2020-10-03T10:47:39+0000
/project/algo-ml/, algo-ml, 0.0.1, Machine learning Package, 2020-09-20T19:06:14+0000
/project/gym-guesswho/, gym-guesswho, 0.0.5, An OpenAI Gym framework for machine learning with the game "Guess Who?", 2018-08-07T01:03:58+0000
/project/genix/, genix, 0.1.2, GUI library for Pygame, 2020-08-27T04:20:49+0000
/project/calculations/, Calculations, 1.10, To calculate equations and draw diagrams, 2020-08-02T17:47:30+0000
/project/asyncrequester/, asyncrequester, 0.1.2, Basic async requester, 2020-09-29T18:42:38+0000
/project/rsrtools/, rsrtools, 1.0.0, Tools for creating Rocksmith 2014 songlists and managing Rocksmith save files, 2020-05-16T03:44:49+0000
/project/pydiscordbot/, PyDiscordBot, 0.0.0, A very basic discord bot for begginer, 2021-04-15T07:42:54+0000
/project/filehandling/, filehandling, 0.21.0, Cross-platform file handling utilities., 2021-01-23T22:16:16+0000
/project/crystal-0-0-1/, crystal-0.0.1, 0.0.1, Calculation of mismatch of FCC crystal systems, 2021-01-13T02:22:35+0000
/project/paygo-utils/, paygo-utils, 0.0.18, This is a utilities library that contains the base files needed by every microservice, 2021-02-19T09:16:06+0000
/project/noblesse2/, noblesse2, 0.0.1, Optimiser, 2021-04-07T20:49:55+0000
/project/intersection-py/, intersection.py, 1.2.0, A simple API Wrapper for IC, 2021-04-11T19:03:50+0000
/project/makeprimetanakiin/, makeprimetanakiin, 0.0.1, A simple prime number identifier, 2021-03-13T16:49:35+0000
/project/py-nsbcli/, py-nsbcli, 0.5.20, interacting with Tendermint-NSB from python, 2019-06-28T15:13:35+0000
/project/sclacsll/, sclacsll, 0.0.1, A basic calculator which add, subtracts, multiplies and divides, 2020-08-21T13:43:58+0000
/project/secure-password/, secure-password, 2.1, A very easy password generator, 2021-03-17T14:00:15+0000
/project/bet365/, bet365, 0.0.3, ninja25538@tutanota.de, 2020-05-24T17:19:20+0000
/project/tkinterx/, tkinterx, 0.0.9, Use tkinter to create a handy GUI tool., 2020-05-30T01:34:40+0000
/project/y1z1ncalculator/, Y1z1nCalculator, 0.0.3, Simple calc, 2020-10-20T10:36:38+0000
/project/bleak/, bleak, 0.11.0, Bluetooth Low Energy platform Agnostic Klient, 2021-03-18T09:03:23+0000
/project/plotg/, plotg, 0.0.1, A very basic gsheets ploting library, 2020-10-08T19:14:33+0000
/project/oddtools/, OddTools, 1.0.0, An odd package that does odd things for odd people, 2021-04-19T10:21:48+0000
/project/mf3cf/, mf3cf, 2.1.1, Model-free 3-component full polarimetric decomposition, 2021-01-06T14:49:49+0000
/project/pyc3dserver/, pyc3dserver, 0.0.12, Python interface of C3Dserver software for reading and editing C3D motion capture files., 2020-07-25T01:31:37+0000
/project/metanetx-post/, metanetx-post, 0.5.1, Enrich the information coming from MetaNetX from additional sources., 2020-04-27T07:21:52+0000
/project/justone/, justone, 0.2.0, Duplicate files finder, 2020-10-17T06:29:02+0000
/project/riteshawesomemllibraries/, RiteshAwesomeMLlibraries, 0.0.2, ML Module Collection, 2020-09-02T13:41:18+0000
/project/topside/, topside, 0.3.0, A simulator for rocket launch operations, 2020-10-07T00:09:45+0000
/project/jigbot/, jigbot, 0.1.1, Install essential Libraries to create Chatbot, 2020-08-19T06:18:18+0000
/project/qscreencast/, QScreenCast, 0.1.34, A no-nonsense screen-caster behind a QToolButton., 2021-04-25T08:52:26+0000
/project/strupper/, strupper, 0.0.1, A very basic calculator, 2020-09-09T21:13:18+0000
/project/mensuration3d/, mensuration3d, 0.0.1, A module that can calculate surface areas and volumes of 3d geometric shapes., 2021-01-22T15:26:38+0000
/project/tgt-grease/, tgt-grease, 2.6.1, Modern distributed automation engine built with love by Target, 2019-05-07T13:20:26+0000
/project/vtam/, vtam, 0.1.21, VTAM - Validation and Taxonomic Assignation of Metabarcoding Data is a metabarcoding pipeline. The analyses start from high throughput sequencing (HTS) data of amplicons of one or several metabarcoding markers and produce an amplicon sequence variant (ASV) table of validated variants assigned to taxonomic groups., 2020-12-14T05:37:37+0000
/project/api-to-csv/, API-to-CSV, 0.0.1, This is how to get from a CSV file to an API, 2021-03-25T23:21:56+0000
/project/layerview/, layerview, 0.1.5, LayerView is a G-code visualizer and inspector., 2021-02-26T15:07:49+0000
/project/ktzgraph/, KTZgraph, 0.0.1, Say hello!, 2020-12-21T22:48:19+0000
/project/mayplotlib/, mayplotlib, 0.0.1, A very basic exam library, 2021-01-28T14:28:46+0000
/project/trolleer/, trolleer, 0.0.1, Use import trolleer to import package and pip unistall to uninstall package if you don't like it., 2020-10-06T13:20:52+0000
/project/pyq/, pyq, 5.0.0, PyQ - Python for kdb+, 2020-06-02T16:31:52+0000
/project/multidownload/, MultiDownload, 1.0.2, A libary to download media from social media like twitter.com, instagram.com, snapchat.com and more will be added with the next updates, 2020-12-01T15:28:27+0000
/project/pyeeg/, pyeeg, 0.0.2, A Library for the Emotiv Insight Five Channel EEG., 2021-03-31T15:35:08+0000
/project/depro/, depro, 0.0.11, a package for Decomposition of Profile Data, 2021-02-23T08:33:58+0000
/project/pyjquery/, PyjQuery, 3.5.1.1, The Write Less, Do More, JavaScript Library for DicksonUI, 2020-10-19T02:05:33+0000
/project/digitrecognizer/, DigitRecognizer, 1.0.0, Hand Writing Digits Recognition program is an open-source python machine learning algorithm program which program recognizes and predicts handwriting digits., 2021-03-26T20:23:30+0000
/project/pythonatinsta/, pythonatinsta, 0.0.1, A very basic instagram robot, 2021-02-03T20:13:22+0000
/project/topsis-shrey-101803112/, TOPSIS-Shrey-101803112, 0.0.1, Topsis_Assignment, 2020-11-13T14:28:22+0000
/project/productdetailfinder/, ProductDetailFinder, 1.0.1, Amazon Flipkart product detail finder, 2020-12-09T18:40:37+0000
/project/r0ping/, r0ping, 0.0.5, , 2020-10-09T16:54:39+0000
/project/magicofinputandoutputbykeshari/, MAGICOFINPUTANDOUTPUTBYKESHARI, 0.0.1, , 2020-07-22T22:50:24+0000
/project/morefunctions/, moreFunctions, 1.0.2, A compilation of additional functions for use in varying purposes in Python, 2020-07-27T06:35:16+0000
/project/calculadorainterfaces/, CalculadoraInterfaces, 0.0.1, Operaciones de 2 digitos con Interfaz, 2020-11-17T23:50:51+0000
/project/sagbprojections/, sagbprojections, 0.0.5, A module to query SAGB NBA daily fantasy projections, 2021-03-16T19:36:09+0000
/project/collides/, collides, 0.0.4, A vehicle collision detector, 2020-10-14T20:53:30+0000
/project/balinese-library/, balinese-library, 0.0.7, A very basic balinese library about information extraction in balinese language, 2021-01-14T00:04:03+0000
/project/yangsuite/, yangsuite, 2.7.10, YANG Suite core application., 2021-02-11T21:32:51+0000
/project/ionicsdk/, ionicsdk, 2.1.0.8, Ionic Machina Client SDK, 2021-02-05T18:26:24+0000
/project/sapy-script/, sapy-script, 1.0.1, Library to manipulate SAP by script, 2018-07-31T11:21:27+0000
/project/aminebasiccalculator/, aminebasiccalculator, 0.0.1, A very basic calculator, 2020-09-07T09:00:59+0000
/project/pyautoeios/, pyautoeios, 0.0.2, automate an old school classic, 2020-10-29T23:55:33+0000
/project/cdstools/, cdstools, 0.0.3, Tools designed for use with CDS data, 2020-10-11T19:23:30+0000
/project/d3dshot/, d3dshot, 0.1.5, Extremely Fast and Robust Screen Capture on Windows with the Desktop Duplication API, 2020-06-12T00:15:54+0000
/project/wmc-dl/, wmc-dl, 1.4.7, Functions from WMC Datalake, 2020-11-19T18:22:08+0000
/project/encodeurl/, EncodeURL, 1.0.1, Encode url, 2020-12-10T15:32:44+0000
/project/simplecalculator222-websoft-tech/, simpleCalculator222-WebSoft-tech, 0.0.1, A small example package, 2020-10-05T17:23:18+0000
/project/tele-bot/, tele-bot, 0.0.1, Telegram bot, 2020-11-20T17:19:26+0000
/project/nanoleafdiscovery/, NanoLeafDiscovery, 0.1.0, Discovery module for nanoleaf, 2021-01-12T18:30:10+0000
/project/python-libtiepie/, python-libtiepie, 0.9.7, Python bindings for LibTiePie, 2021-04-08T12:38:19+0000
/project/pychocolate/, pyChocolate, 0.0.2.2, debugger and logger for python, 2021-03-05T18:19:55+0000
/project/ansibeautifier/, ansibeautifier, 0.0.5, You can beautify your python command-line and GUI applications using colors, 2021-02-20T06:35:07+0000
/project/projectsetup/, ProjectSetup, 0.1.1, describe your project, 2018-01-18T21:57:14+0000
/project/edlm/, edlm, 0.1.9, , 2018-02-23T17:35:18+0000
/project/toynn/, toynn, 0.1.0, DeepLearning Model Builder, 2021-04-21T20:27:19+0000
/project/shaheer-basic-cal/, Shaheer-Basic-Cal, 0.0.1, A very basic calculator, 2020-10-26T18:05:20+0000
/project/win10note/, win10note, 0.0, A time calculator, 2020-10-16T08:15:37+0000
/project/clfsdecisionboundary/, clfsdecisionboundary, 0.0.1, Plot decision boundary for classification, 2021-03-31T05:34:59+0000
/project/unimator/, UniMator, 0.0.1, use import unimate to import, 2020-10-07T14:08:24+0000
/project/gloriahousing/, gloriahousing, 0.0.1, Predicts Median housing value, 2020-11-13T13:09:44+0000
/project/color-printer/, color-printer, 0.0.2, This is the simple way to print with colors, 2021-04-03T11:28:00+0000
/project/string-to-tense/, string-to-tense, 1.0.0, Forword Looking Sentence Identification, 2021-04-22T16:00:49+0000
/project/badtooth/, badtooth, 0.0.1, A memory hacking package for windows games., 2020-09-28T04:29:46+0000
