/project/df-websockets/, df-websockets, 0.10.9, Websocket integration for Django, 2021-04-16T08:51:00+0000
/project/fsnix/, fsnix, 0.2, Expose more advanced posix/file system APIs to Python, 2012-11-12T20:42:35+0000
/project/twine/, twine, 3.4.1, Collection of utilities for publishing packages on PyPI, 2021-03-17T00:42:30+0000
/project/fogbugz-bis/, fogbugz-bis, 1.1, Python library for interacting with the FogBugz API, 2019-04-17T13:59:37+0000
/project/kd-samba/, kd-samba, 0.1.dev0, Web interface for managing samba users, 2020-12-04T11:25:33+0000
/project/cpuid/, cpuid, 0.0.10, cpuid Pythonic API, 2021-01-26T00:42:36+0000
/project/subprocess32/, subprocess32, 3.5.4, A backport of the subprocess module from Python 3 for use on 2.x., 2019-05-20T22:14:16+0000
/project/wheelz/, wheelz, 0.1, wheelz -- complexity via Burrows-Wheeler transform., 2019-11-14T19:48:28+0000
/project/kaidoku/, kaidoku, 0.5.6, Player, solver and creater of sudoku puzzles, 2018-08-22T06:36:01+0000
/project/actorio/, actorio, 0.1.4, A simple actor framework for asyncio, 2018-12-06T17:40:54+0000
/project/ofunctions/, ofunctions, 2.0.3, Toolset with various file logging / network / checksumming / process functions, 2021-03-30T13:58:36+0000
/project/thomas/, thomas, 2.2.3, Thomas allows segmented downloads and is an alternative to Axel, 2019-02-17T14:07:06+0000
/project/hipachectl/, hipachectl, 0.3.0, Command Line Tool to Manage hipache, 2015-12-26T05:41:01+0000
/project/adoc/, adoc, 0.1.5, Python code documentation generator, 2018-08-29T18:31:43+0000
/project/cv/, cv, 1.0.0, Check version of a Python module, 2019-09-19T16:32:26+0000
/project/kivymd/, kivymd, 0.104.1, Set of widgets for Kivy inspired by Google's Material Design, 2020-04-27T20:04:26+0000
/project/setuplibcore/, setuplibcore, 0.1.15, Support library functions for extensions and entry points of setuptools / distutils., 2019-12-13T11:13:52+0000
/project/readme-renderer/, readme-renderer, 29.0, readme_renderer is a library for rendering "readme" descriptions for Warehouse, 2021-02-23T05:45:15+0000
/project/oneid-cli/, oneID-cli, 1.0.35, A command line interface for the Neustar Trusted Identity (TDI) Core, 2017-12-14T21:34:32+0000
/project/mu-sdk/, mu-sdk, 0.0.3, ss-panel mu api sdk for python, 2016-12-15T15:41:42+0000
/project/openlp/, OpenLP, 2.9.2, Open source Church presentation and lyrics projection application., 2020-12-21T18:27:11+0000
/project/borgbackup/, borgbackup, 1.1.16, Deduplicated, encrypted, authenticated and compressed backups, 2021-03-22T21:44:05+0000
/project/yakt/, yakt, 0.1.dev0, Yet another keysigning tool, 2018-02-05T05:55:50+0000
/project/ffmpy3/, ffmpy3, 0.2.3, A simple asynchronous Python wrapper for ffmpeg, 2017-01-01T03:24:32+0000
/project/x84/, x84, 2.0.17, Framework for Telnet and SSH BBS or MUD server development with example default bbs board, 2020-06-17T12:51:31+0000
/project/kivymd-extensions-akivymd/, kivymd-extensions.akivymd, 1.2.5, A set of fancy widgets for KivyMD, 2020-11-28T12:47:11+0000
/project/fpscanner/, fpscanner, 0.1.1, , 2021-04-23T02:41:35+0000
/project/maybe/, maybe, 0.4.0, See what a program does before deciding whether you really want it to happen., 2016-03-27T17:57:21+0000
/project/yaurtww/, yaurtww, 0.0.1, Yet Another Urban Terror Wget Wrapper., 2014-08-04T04:30:25+0000
/project/setupjavax/, setupjavax, 0.1.38, Support Java extensions for setuptools / distutils., 2019-12-13T13:46:37+0000
/project/cuts/, cuts, 0.37.7, Remove and/or rearrange sections from each line of a file(s)., 2015-07-26T21:23:19+0000
/project/fintech/, fintech, 6.6.2, The Python FinTech package (SEPA, EBICS & more), 2021-03-16T00:48:02+0000
/project/multicoder/, multicoder, 0.1.2, Test classical encodings., 2020-01-14T12:58:58+0000
/project/awacs/, awacs, 1.0.4, AWS Access Policy Language creation library, 2021-03-20T15:31:48+0000
/project/atividades-algoritmos/, atividades-algoritmos, 0.1, Pacote com a resolução das atividades do segundo estágio, 2019-04-12T23:56:45+0000
/project/gnupg/, gnupg, 2.3.1, A Python wrapper for GnuPG, 2017-09-06T23:42:36+0000
/project/cyhdfs/, cyhdfs, 0.1.3, Cython wrapper around libhdfs, 2012-09-19T19:24:20+0000
/project/kivymd-extensions-example-extension/, kivymd-extensions.example-extension, 0.1.1, Example extension that adds beautiful button, 2020-11-01T10:35:50+0000
/project/ruruki/, ruruki, 1.4.2, Ruruki is a lightweight in-memory graph database which is ideal if you need a temporary graph database, or just doing a proof of concept and need a fast and reliable graph database., 2017-05-20T04:38:22+0000
/project/cloudi/, cloudi, 2.0.1, Python CloudI API, 2020-11-27T06:18:14+0000
/project/chicken-turtle-project/, chicken_turtle_project, 2.3.0, Python 3 project development tools, 2016-10-08T00:20:58+0000
/project/underscorex/, UnderscoreX, 0.0.1r001a-yusut-bozlon, DecoratorClass used to parse **Kargs and handle Warning and exception thru Missing Attribute by adding static Decorator., 2012-09-18T05:00:50+0000
/project/mjail/, mjail, 0.3.0, Command line tool to create and manage FreeBSD jails, 2019-07-08T16:12:10+0000
/project/mello/, mello, 0.7.16, A Fast Command-line Interface for Trello, 2018-03-26T19:44:50+0000
/project/ses2/, ses2, 0.1.9, Library for status/control of SES2 enclosure management devices, 2013-11-20T23:14:48+0000
/project/sixfour/, sixfour, 1.3.3, base64 Image Encoder and Embedder for HTML, CSS, Markdown, LESS, SASS, 2013-11-21T13:34:00+0000
/project/wenvkernel/, wenvkernel, 0.0.1, Jupyter kernel for Python on Wine, 2020-07-20T10:43:10+0000
/project/infi-watchdog/, infi.watchdog, 0.6.3, Filesystem events monitoring, 2013-02-26T13:39:26+0000
/project/ht/, ht, 1.0.1, Heat transfer component of Chemical Engineering Design Library (ChEDL), 2021-03-30T02:52:17+0000
/project/freezer-api/, freezer-api, 10.0.0, OpenStack Backup and Restore API Service, 2021-04-14T11:04:23+0000
/project/signalpy/, SignalPy, 1.0.6, Realtime communication for Python web applications, 2020-10-20T02:15:54+0000
/project/bobtemplates-pypbr/, bobtemplates.pypbr, 0.3, bobtemplates to create python packages with pbr, 2015-03-31T13:05:09+0000
/project/flac2all/, flac2all, 5.1, Multi process, clustered, FLAC to multi codec audio converter with tagging support, 2020-01-23T11:48:41+0000
/project/freebsd-ports/, FreeBSD-ports, 0.0.9, Parse FreeBSD Ports INDEX, provide search API, 2019-07-11T21:25:43+0000
/project/redssh/, redssh, 2.3.2, An SSH automation library., 2021-03-06T12:10:54+0000
/project/human-body-prior/, human-body-prior, 0.8.5.0, Variational human pose prior for human pose synthesis and estimation., 2019-07-03T13:12:31+0000
/project/py-pf/, py-pf, 0.2.1, Pure-Python module for managing OpenBSD's Packet Filter, 2019-10-10T20:22:43+0000
/project/lorax/, lorax, 0.94.86, lorax -- speaks for the (phylogenetic) trees., 2018-08-23T20:24:44+0000
/project/openvas-tasks/, openvas_tasks, 1.1, Information and history receptor for OpenVAS tasks, 2015-06-20T15:32:26+0000
/project/dynamodb-backup/, dynamodb-backup, 1.0.0, Backup a DynamoDB table to an Avro container, 2019-11-29T22:18:06+0000
/project/refuse/, refuse, 0.0.4, Simple cross-plattform ctypes bindings for libfuse / FUSE for macOS / WinFsp, 2020-07-10T19:35:35+0000
/project/pythemis/, pythemis, 0.13.0, , 2020-07-08T15:24:07+0000
/project/ofunctions-threading/, ofunctions.threading, 0.1.0, Threading decorator to run functions as threads, 2021-03-30T14:04:27+0000
/project/viz-alchemy/, viz-alchemy, 0.0.1, Visualize database relationship for SQLAlchemy, 2020-12-07T16:02:39+0000
/project/pollinator/, pollinator, 0.0.3, Pollinator is a Python poll and generator based package for writing simple
non-blocking network services, 2016-01-17T19:48:30+0000
/project/trollo/, trollo, 0.2.1, , 2021-02-23T21:21:38+0000
/project/ffpyplayer/, ffpyplayer, 4.3.2, A cython implementation of an ffmpeg based player., 2020-10-14T23:56:01+0000
/project/game-of-thrones/, game-of-thrones, 0.1.7, Command line tool to generate words that sound like characters from Game of Thrones. Good for project names., 2014-06-24T16:54:25+0000
/project/caffeine-ng/, caffeine-ng, 3.5.1, Tray bar app to temporarily inhibit screensaver and sleep mode., 2021-01-19T08:32:29+0000
/project/egenix-mxodbc-zopeda/, egenix-mxodbc-zopeda, 2.2.3, eGenix mxODBC Zope/Plone Database Adapter for Plone and Zope, 2015-09-11T18:36:59+0000
/project/timemory/, timemory, 3.1.0, Lightweight cross-language instrumentation API for C, C++, Python, Fortran, and CUDA which allows arbitrarily bundling tools together into a single performance analysis handle, 2020-07-11T01:12:43+0000
/project/ofunctions-string-handling/, ofunctions.string-handling, 0.1.2, Simple string sanitization functions, 2021-03-30T14:04:04+0000
/project/env2/, env2, 0.0.0, os.environ on steroids, 2017-11-10T20:41:58+0000
/project/pg-chameleon-web/, pg-chameleon-web, 0.1.dev0, Web interface for pg_chameleon, 2020-05-01T12:50:00+0000
/project/fnvstring/, fnvstring, 0.9.7, Python fnv hash string implementation, 2021-04-04T10:43:25+0000
/project/qiime-tools/, qiime-tools, 1.1.2, Useful additions to the QIIME analysis pipeline including tools for data visualization and cluster-computing., 2014-09-19T15:00:56+0000
/project/cix/, cix, 0.1, cheminformatics utilities, 2020-11-15T18:47:48+0000
/project/python-slick-reporting/, python-slick-reporting, 0.1.4, A one-stop report adn analytics generation and computation with batteries included, 2020-04-25T18:38:47+0000
/project/get-geckodriver/, get-geckodriver, 0.2.1, Automatically install geckodriver, compile if required., 2020-09-13T23:20:35+0000
/project/archey4/, archey4, 4.11.0, Archey is a simple system information tool written in Python, 2021-03-21T08:21:44+0000
/project/vivarium-public-health/, vivarium-public-health, 0.10.9, Components for modelling diseases, risks, and interventions with ``vivarium``, 2021-01-26T04:34:54+0000
/project/findcmd/, findcmd, 0.1.2, A command line tool for searching commands, 2020-11-10T05:43:46+0000
/project/varbio/, varbio, 2.0.0, Bioinformatics utility library, 2017-09-27T09:29:56+0000
/project/calmjs-webpack/, calmjs.webpack, 1.2.0, Package for extending the Calmjs framework to support the usage of webpack for the generation of deployable artifacts from JavaScript source code provided by Python packages in conjunction with standard JavaScript or Node.js packages sourced from npm or other similar package repositories., 2018-08-22T02:28:47+0000
/project/pugbot-ng/, pugbot_ng, 0.0.4, Urban Terror PUG IRC bot., 2014-07-29T00:38:54+0000
/project/qclipx/, qclipx, 1.0.1, Cross platform clipboard tool, 2021-03-07T13:11:59+0000
/project/eventfabric/, eventfabric, 0.1.0, Event Fabric API client library, 2013-08-06T11:14:55+0000
/project/gi-docgen/, gi-docgen, 2021.5, Documentation tool for GObject-based libraries, 2021-04-15T15:11:51+0000
/project/auxlib/, auxlib, 0.0.43, auxiliary library to the python standard library, 2019-03-13T19:10:44+0000
/project/pixiv-ugoku/, pixiv_ugoku, 0.1.1, Simple Pixiv animated image downloader., 2017-12-20T15:47:54+0000
/project/redlibssh2/, redlibssh2, 2.0.2, Super fast SSH library - bindings for libssh2, 2021-01-05T16:01:14+0000
/project/wholly/, wholly, 1.0.1, Wholly, 2017-08-25T22:55:57+0000
/project/meson/, meson, 0.57.2, A high performance build system, 2021-04-10T10:27:25+0000
/project/spiceypy/, spiceypy, 4.0.0, A Python Wrapper for the NAIF CSPICE Toolkit, 2020-12-08T02:53:55+0000
/project/gtd-py/, gtd.py, 0.7.1, A Fast Command-line Interface for Trello, 2020-09-20T19:23:49+0000
/project/daxfi/, DAXFi, 1.1, configure different kinds of firewalls in a consistent way., 2007-05-16T18:58:40+0000
/project/redislite/, redislite, 6.0.674960, Redis built into a python package, 2021-01-26T02:57:03+0000
/project/django-ra-erp/, django-ra-erp, 1.2.0, A light-weight effective Django based framework to create diverse business applications, 2020-11-24T09:41:29+0000
/project/uv/, uv, 0.0.3.dev1, Python LibUV CFFI Bindings, 2015-11-26T18:44:58+0000
/project/zsm-lib/, zsm-lib, 0.2.1, ZFS Snapshot Manager Library, 2021-01-24T23:13:21+0000
/project/abgleich/, abgleich, 0.0.7, zfs sync tool, 2020-08-05T10:03:35+0000
/project/snakecycles/, snakecycles, 0.1, Parse snakefood output and detect import cycles., 2016-09-26T19:20:15+0000
/project/autodock-hipache/, autodock-hipache, 0.0.2, autodock hipache plugin, 2015-12-26T07:13:30+0000
/project/pyusb/, pyusb, 1.1.1, Python USB access module, 2021-01-20T06:22:11+0000
/project/pyjquery/, PyjQuery, 3.5.1.1, The Write Less, Do More, JavaScript Library for DicksonUI, 2020-10-19T02:05:33+0000
/project/pysourceinfo/, pysourceinfo, 0.1.32, Utilities for simplified gain of runtime information on source code  and binary locations., 2018-06-14T20:10:16+0000
/project/csorteddict/, csorteddict, 0.2, Key-sorted (balanced tree) dictionary store implemented in C, 2010-05-11T04:12:00+0000
/project/pam-yubico/, pam_yubico, 0.3.0.dev, Python PAM module which allows you to integrate the Yubikey into your existing user authentication infrastructure (supports online, failback and offline mode), 2010-05-13T18:13:39+0000
/project/kth-build/, kth-build, 0.0.7, Knuth node build tools, 2020-01-17T18:20:59+0000
/project/uhid-freebsd/, uhid-freebsd, 1.2.1, Get information on FreeBSD uhid devices., 2019-09-11T22:30:47+0000
/project/pyspectator-tornado/, pyspectator_tornado, 1.1.2, pyspectator_tornado is a web-monitoring tool ported onTornado with pyspectator as a main monitoring module., 2017-04-14T21:52:28+0000
/project/game24/, game24, 1.0.1, A console application to play the 24 game, 2015-03-27T08:36:11+0000
/project/mod-wsgi/, mod-wsgi, 4.7.1, Installer for Apache/mod_wsgi., 2020-02-16T23:05:48+0000
/project/pyfilesysobjects/, pyfilesysobjects, 0.1.33, Standard conformant utilities for resource paths of file systems and URIs., 2018-06-15T07:45:33+0000
/project/kernelchecker/, kernelchecker, 1.0.0, Linux kernel version scanner, 2016-05-24T22:07:55+0000
/project/acmens/, acmens, 0.1.4, A simple ACMEv2 client. Fork of acme-nosudo., 2021-04-17T01:47:31+0000
/project/pomodoro-calculator/, pomodoro-calculator, 1.0.2, A pretty command line tool to calculate the number of Pomodori available between two points in time., 2018-09-13T07:43:58+0000
/project/natto-py/, natto-py, 0.9.2, A Tasty Python Binding with MeCab(FFI-based, no SWIG or compiler necessary), 2019-12-31T13:13:26+0000
/project/solutions/, solutions, 0.0.2, Solutions to common Python interview problems., 2014-08-13T05:58:51+0000
/project/ofunctions-file-utils/, ofunctions.file-utils, 0.8.0, Various file handling of which get_files_recursive is the most advanced, 2021-04-06T10:08:52+0000
/project/hairgap/, hairgap, 1.1.7, Basic protocol to send files using the hairgap binary ( github.com/cea-sec/hairgap )., 2020-12-22T06:28:35+0000
/project/serf-membership/, serf_membership, 1.2, This is very simple script for election a leader (primary) from all members tagged with specific role., 2016-07-12T23:01:40+0000
/project/elm327-emulator/, ELM327-emulator, 2.1.0, ELM327 Emulator for testing software interfacing OBDII via ELM327 adapter, 2021-03-28T11:49:49+0000
/project/mathmakerlib/, mathmakerlib, 0.7.4, Collection of lualatex-printable mathematical objects, including geometric shapes., 2019-02-22T12:35:28+0000
/project/autodock-cron/, autodock-cron, 0.0.2, autodock cron plugin, 2015-12-26T07:27:30+0000
/project/python-kairosdb/, python-kairosdb, 0.2.1, KairosDB REST API python client and interface, 2017-11-28T15:15:14+0000
/project/pypledge/, pypledge, 0.3.1, Binding for the OpenBSD pledge(2) system call, 2018-08-31T21:23:03+0000
/project/subprocess32-ext/, subprocess32-ext, 3.2.8.2, A backport of the subprocess module from Python 3.2/3.3 for use on 2.x., 2017-05-09T14:52:23+0000
/project/amet/, amet, 0.4, A library to read complex configuration from environment variables., 2018-05-13T12:13:27+0000
/project/iterfzf/, iterfzf, 0.5.0.20.0, Pythonic interface to fzf, 2020-02-09T14:54:20+0000
/project/python-freezerclient/, python-freezerclient, 4.2.0, OpenStack Disaster Recovery API Client Library, 2021-01-18T22:02:28+0000
/project/muteria/, muteria, 0.1.113, Software Analysis and Testing Framework, 2021-04-10T02:26:04+0000
/project/grafana-alerts/, grafana_alerts, 1.0.0.dev7, Alerting Module to use with Grafana metrics., 2015-07-27T18:35:36+0000
/project/splitviewfuse/, splitviewfuse, 0.3.1, A fuse implementation for an segmented view on a given directory., 2016-10-30T15:39:28+0000
/project/nlring/, nlring, 1.0.1, NLNOG Ring task execution library, 2017-01-06T20:42:53+0000
/project/save-thread-result/, save-thread-result, 0.0.6, Simple subclass wrapper around `threading.Thread` to get the return value from a thread in python (from `threading` built-in module in Python Standard library). Exact same interface for creating an instance of this threading sublcass as `threading.Thread`!, 2021-02-08T00:27:52+0000
/project/purerpc/, purerpc, 0.6.1, Asynchronous pure Python gRPC client and server implementation supporting asyncio, uvloop, curio and trio, 2020-04-13T09:02:54+0000
/project/hark/, hark, 1.0.0.dev3, a simple virtual machine management tool, 2016-08-04T12:30:40+0000
/project/circuits/, circuits, 3.2.1, Asynchronous Component based Event Application Framework, 2020-10-30T01:44:05+0000
/project/repcloud/, repcloud, 0.1a1, PostgreSQL repacker without need, 2019-11-26T15:02:22+0000
/project/pilotmapreduce/, PilotMapReduce, 0.1.0, SAGA Pilot-Abstractions based MapReduce Implementation, 2012-11-06T06:48:43+0000
/project/thermosteam/, thermosteam, 0.24.10, BioSTEAM's Premier Thermodynamic Engine, 2021-04-08T11:14:15+0000
/project/ofunctions-logger-utils/, ofunctions.logger-utils, 2.0.1, Shorthand for logger initialization, recording worst called loglevel and handling nice console output, 2021-03-30T14:01:09+0000
/project/f1bw/, F1bw, 0.2.1, , 2018-08-13T19:47:01+0000
/project/blackpanther-pydialog/, blackPanther-pydialog, 0.9.8, PyDialog [PyQt5] is a new dialog instead kdialog or zenity, 2018-12-03T22:21:19+0000
/project/wmflib/, wmflib, 0.0.7, Generic library for common tasks in the WMF production infrastructure, 2021-02-19T11:31:03+0000
/project/toda/, toda, 0.0.1, Toda gives you the power to safely deploy files using symlinks on any operating system with Python installed., 2021-03-11T08:15:50+0000
/project/bitnfly/, bitnfly, 0.0.4, BitnFly is a mini API for working with bit flags, 2016-06-30T12:36:11+0000
/project/flexsolve/, flexsolve, 0.4.8, Flexible function solvers, 2021-03-31T01:46:42+0000
/project/datacube/, datacube, 1.8.3, An analysis environment for satellite and other earth observation data, 2020-08-18T04:09:37+0000
/project/parsetf/, parsetf, 3.0, Parse terraform template, 2020-10-29T12:44:14+0000
/project/git-remote-couch/, git-remote-couch, 0.1a2, a git-remote-helper that allows you to push source code into a CouchDB, 2010-08-11T13:11:44+0000
/project/graphillion/, Graphillion, 1.4, Fast, lightweight library for a huge number of graphs, 2020-11-04T14:31:02+0000
/project/posix-ipc/, posix-ipc, 1.0.5, POSIX IPC primitives (semaphores, shared memory and message queues) for Python, 2020-10-11T00:40:52+0000
/project/unidist/, unidist, 2010.10.15.0, unidist: Unified Distributed Computing contains: shared message queues, state, counters, locks, logging, and time series collection and graphing (RRD)., 2010-10-15T16:47:12+0000
/project/qconcurrency/, qconcurrency, 0.0a1, A collection of tools to simplify Concurrency in Qt, 2017-04-24T14:43:50+0000
/project/daemonize/, daemonize, 2.5.0, Library to enable your code run as a daemon process on Unix-like systems., 2018-12-12T19:47:37+0000
/project/cumin/, cumin, 4.0.0, Automation and orchestration framework and CLI written in Python, 2020-09-10T14:05:53+0000
/project/sequencer/, sequencer, 1.8.4, The sequencer is used to execute actions in a specified order (for example power on/off clusters), 2017-03-28T07:07:36+0000
/project/sshh/, sshh, 0.10.0, sshh is an ssh helper tool for batch registration of ssh private keys in ssh-agent, 2019-06-02T06:58:02+0000
/project/pg-ninja/, pg_ninja, 2.0.0a1, MySQL to PostgreSQL replica and migration, 2018-07-27T14:03:09+0000
/project/crestic/, crestic, 0.5.0, Configurable restic, 2020-05-24T10:43:47+0000
/project/dockernel/, dockernel, 1.0.2, Utility for creating dockerized Jupyter kernels, 2021-03-21T00:16:59+0000
/project/yices/, yices, 1.1.4, Python Bindings for the Yices SMT Solver, 2020-07-11T01:24:21+0000
/project/bgpdumpy/, bgpdumpy, 1.1.4, A libbgpdump Python CFFI wrapper for analyzing MRTv1 and MRTv2 BGP table dump files, 2019-11-13T22:28:25+0000
/project/configparser-crypt/, configparser-crypt, 0.6.2, Drop-in replacement for ConfigParser with encryption support, 2021-03-16T14:04:33+0000
/project/microwave-usbfan/, microwave-usbfan, 1.1, Implementation of the Jaycar RGB USB LED fan (GH1031) protocol, 2019-06-16T00:37:45+0000
/project/caspyr/, caspyr, 1.1.1, Cinchingly awesome scripts of Pythonic rapture, 2019-08-01T23:19:27+0000
/project/check-mount/, check-mount, 1.0.3, Nagios / Icinga plugin to check that mounts are present., 2019-12-12T15:32:16+0000
/project/myremotedump/, myremotedump, 0.1.0, Dumps a firewalled MySQL database via a ssh tunnel to the remote system, 2013-12-13T14:58:53+0000
/project/pkgdiff/, pkgdiff, 0.1, Compare FreeBSD pkg files by metadata., 2020-12-01T15:19:49+0000
/project/raisin/, raisin, 0.0.23, Simple parallel, distributed and cluster computing, 2021-04-24T10:58:04+0000
/project/hark-builder/, hark-builder, 1.0.0.dev6, tool to build hark images, 2016-07-24T06:52:11+0000
/project/fpi/, fpi, 0.1.1, Fluid-particle Interaction component of Chemical Engineering Design Library (ChEDL), 2016-04-04T02:56:58+0000
/project/inventicode/, Inventicode, 1.0.2, Create labels with QR and barcodes., 2017-02-26T22:33:24+0000
/project/pyqtenumconverter/, PyQtEnumConverter, 1.0, Converts enums from PyQt5 to PyQt6, 2021-03-15T13:55:26+0000
/project/wenv/, wenv, 0.2.1, Running Python on Wine, 2020-07-10T17:59:06+0000
/project/ocrmypdf/, ocrmypdf, 12.0.0, OCRmyPDF adds an OCR text layer to scanned PDF files, allowing them to be searched, 2021-04-23T07:40:28+0000
/project/openbsd/, openbsd, 0.1.0, OpenBSD Library, 2019-05-02T23:40:14+0000
/project/simplewebdavclient/, simplewebdavclient, 1.0.2, This is a library used to make WebDav Client Connections simple., 2020-04-30T19:43:56+0000
/project/biosteam/, biosteam, 2.27.7, The Biorefinery Simulation and Techno-Economic Analysis Modules, 2021-04-15T05:25:54+0000
/project/setupdocx/, setupdocx, 0.1.22, Support of documentation commands and extensions for setuptools / distutils., 2019-12-11T08:43:33+0000
/project/sysctl/, sysctl, 0.2, Wrapper for the sysctl* system functions, 2014-06-20T01:26:16+0000
/project/risk-distributions/, risk-distributions, 2.0.3, Components for building distributions. Compatible for use with ``vivarium``, 2020-10-08T23:22:11+0000
/project/minefield/, minefield, 0.6, High performance Python WSGI Web Server, 2014-11-02T08:09:40+0000
/project/select26/, select26, 0.1a3, Backport of the new select module with epoll and kqueue interface, 2008-04-30T19:45:05+0000
/project/ak-apkverify/, ak-apkverify, 0.1.1.1, Appknox Fork - Jar Signature / APK Signature v2 verify with pure python (support rsa dsa ecdsa)., 2019-09-23T20:30:44+0000
/project/kafkaconnectsync/, kafkaconnectsync, 0.0.4, Kafka Connect API connectors synchronization library, 2020-06-08T15:15:43+0000
/project/certifi-system-store/, certifi-system-store, 3021.3.16, A certifi hack to use system trust store on Linux/FreeBSD, 2021-03-16T11:36:33+0000
/project/dismod-mr/, dismod-mr, 1.1.1, Integrative Meta-Regression Framework for Descriptive Epidemmiology, 2019-11-06T18:13:54+0000
/project/jdminecraftlauncher/, jdMinecraftLauncher, 2.4, A Minecraft Launcher writen in Python, 2020-05-23T23:16:32+0000
/project/shtab/, shtab, 1.3.5, Automatically generate shell tab completion scripts for python CLI apps, 2021-02-22T15:41:09+0000
/project/pydnet/, PyDNET, 1.0, Distribution Network Evaluation Tool, 2017-03-02T15:42:29+0000
/project/oleeditor/, oleeditor, 1.0.0, An OLE structed storage file editor, 2021-03-06T14:43:59+0000
/project/serious/, serious, 1.0.0.dev21, Easily serialize dataclasses to and from JSON, 2019-08-22T18:56:14+0000
/project/pida/, pida, 0.6.2, An integrated development environment that reuses tools such as Vim, and all version control systems., 2010-08-04T16:42:51+0000
/project/configer/, configer, 1.3.1, Easy configuration of arguments in a python code!, 2019-06-11T09:19:27+0000
/project/crypt4gh/, crypt4gh, 1.5, GA4GH cryptographic utilities, 2021-03-07T12:40:39+0000
/project/mog/, mog, 0.6.0, A different take on the UNIX tool cat, 2017-03-15T09:25:53+0000
/project/pysendfile/, pysendfile, 2.0.1, A Python interface to sendfile(2), 2014-05-27T11:07:28+0000
/project/flipexception/, FlipException, 0.5, The best way to flip an exception out of rage, 2019-10-14T20:31:16+0000
/project/trio/, trio, 0.18.0, A friendly Python library for async concurrency and I/O, 2021-01-11T06:44:02+0000
/project/layabout/, layabout, 1.0.2, A small event handling library on top of the Slack RTM API., 2020-01-12T04:10:04+0000
/project/zugbruecke/, zugbruecke, 0.0.15, Calling routines in Windows DLLs from Python scripts running under Linux, MacOS or BSD, 2020-07-10T15:05:20+0000
/project/airspider/, AirSpider, 2.0.4, An Easy-to-use and Fast Python Spider Framework, 2020-09-02T06:16:01+0000
/project/runpon/, RunPON, 0.5, runs scripts, keeping track of the elapsed time., 2009-09-19T12:54:21+0000
/project/pyfuse3/, pyfuse3, 3.2.0, Python 3 bindings for libfuse 3 with async I/O support, 2020-12-30T20:03:06+0000
/project/cogen/, cogen, 0.2.1, Coroutines and asynchronous I/O using enhanced generators         from python 2.5, including a enhanced WSGI server., 2009-01-16T22:05:03+0000
/project/asyncio-railgun/, asyncio-railgun, 0.0.3, Library for easier asyncio concurrent tasks., 2019-06-23T20:22:51+0000
