/project/txgsm/, txgsm, 0.2.0, Utilities for talking to a GSM modem over USB via AT commands., 2015-11-09T07:06:56+0000
/project/qt5reactor-fork/, qt5reactor-fork, 0.2, Twisted Qt Integration, 2015-06-12T14:35:27+0000
/project/pycnb/, pycnb, 0.0.5, Library, CLI and Twisted protocol for `Czech National Bank daily rates, 2017-06-03T05:40:20+0000
/project/pytgram/, pytgram, 0.0.7, Library to create Telegram Bot based on Twisted, 2018-02-01T20:07:14+0000
/project/txthoonk/, txthoonk, 0.1, Python/Twisted client for Thoonk, 2012-07-04T13:27:59+0000
/project/datahaven/, datahaven, rev8784, Distributed encrypted backup utility, 2014-06-05T06:28:50+0000
/project/wallaby-plugin-elasticsearch/, wallaby-plugin-elasticsearch, 0.1.10, This package integrates the elasticsearch backend into wallaby., 2013-01-25T00:35:05+0000
/project/iwant/, iwant, 1.0.14, CLI based decentralized peer to peer file sharing, 2017-06-27T18:23:27+0000
/project/mysearch/, mysearch, 1.5, MySearch engine, 2014-09-14T14:12:34+0000
/project/txgraylog/, txGraylog, 0.3, A twisted log service that interacts with Graylog2., 2015-03-31T17:33:03+0000
/project/axiombench/, axiombench, 0, Silly benchmarks for Axiom, 2012-09-12T16:59:52+0000
/project/twittytwister/, twittytwister, 0.1.0, Twitter client for Twisted Python, 2010-07-13T01:25:33+0000
/project/maxims/, maxims, 0.0.2, A set of tools and reusbale items for Axiom, 2013-03-02T13:44:10+0000
/project/txscrypt/, txscrypt, 3.0.0, Twisted wrapper for scrypt, 2013-12-04T11:32:23+0000
/project/ldaptor/, ldaptor, 21.2.0, A Pure-Python Twisted library for LDAP, 2021-02-28T23:59:55+0000
/project/patron-it-opencanary/, patron-it-opencanary, 0.7.1, OpenCanary daemon, 2018-12-15T01:19:17+0000
/project/txu1/, txu1, 13.06.0, Twisted-based async interface for Ubuntu One Files Cloud REST API v1, 2013-06-13T21:46:40+0000
/project/afpproxy/, afpproxy, 0.1.2, proxy for the AFP (AppleShare) protocol, 2016-02-05T18:31:02+0000
/project/canari/, canari, 3.3.10, Canari Framework - Maltego rapid transform development and execution framework., 2019-02-25T21:38:57+0000
/project/phen/, phen, 0.2.1, Decentralized platform for social applications, 2015-12-31T21:25:15+0000
/project/txaio/, txaio, 21.2.1, Compatibility API between asyncio/Twisted/Trollius, 2021-02-20T14:35:11+0000
/project/source-over-ssh/, source-over-ssh, 0.3, source repository management server over ssh, 2011-06-26T19:48:34+0000
/project/marathon-acme/, marathon-acme, 0.6.1, Automated management of Let's Encrypt certificates for apps running on Mesosphere Marathon, 2018-06-27T11:31:48+0000
/project/hostmaster/, hostmaster, 0.0.1, A simple way to master hosts, 2018-04-10T06:51:39+0000
/project/alot/, alot, 0.7.0, Terminal MUA using notmuch mail, 2018-02-27T19:09:35+0000
/project/mark2/, mark2, 0.1.4.3, Minecraft server wrapper, 2013-08-17T02:18:50+0000
/project/tx-logging/, tx-logging, 1.0.0, Extends Twisted log facilities., 2014-03-19T09:31:51+0000
/project/twisted-internet-processes/, twisted.internet.processes, 1.0b1, An implementation of deferToProcess using the multiprocessing package., 2009-08-24T19:26:26+0000
/project/piped/, piped, 0.7.0, A framework and application server with pipelines., 2015-08-07T19:39:46+0000
/project/tx-tlsrelay/, tx_tlsrelay, 2.1.1, A simple relay. See readme.md, 2014-12-06T02:19:47+0000
/project/ooniprobe/, ooniprobe, 2.3.0, Network measurement tool foridentifying traffic manipulation and blocking., 2018-02-14T09:14:22+0000
/project/opencanary/, opencanary, 0.6.1, OpenCanary daemon, 2021-03-30T13:07:18+0000
/project/twunnel/, twunnel, 0.14.0, A HTTPS/SOCKS4/SOCKS5 tunnel for Twisted., 2014-07-01T07:18:19+0000
/project/helga-isup/, helga-isup, 0.2.4, Helga plugin to check down for everyone or just me, 2017-01-05T21:35:58+0000
/project/txrestserver/, txrestserver, 0.4.2, A simple REST server for twisted-python with access authentication support, 2020-10-06T21:47:37+0000
/project/txrequest/, txrequest, 0.1.0, HTTP Request object API for Twisted, 2017-09-20T19:35:49+0000
/project/trosnoth/, trosnoth, 1.15.1, Trosnoth network platform game, 2021-02-01T10:16:37+0000
/project/twistedexiftool/, TwistedExiftool, 0.1.4, Discontinued, use txExiftool (https://pypi.python.org/pypi/txExiftool), 2016-01-16T23:09:29+0000
/project/asyncsteem/, asyncsteem, 0.6.3, Asynchonous library for usage of the STEEM JSON-RPC API, 2018-10-17T22:23:57+0000
/project/txi2p-tahoe/, txi2p-tahoe, 0.3.5, I2P bindings for Twisted, 2021-03-10T19:28:18+0000
/project/txpostgres/, txpostgres, 1.7.0, Twisted wrapper for asynchronous PostgreSQL connections, 2019-11-19T09:29:09+0000
/project/libervia/, libervia, 0.7.0, Web frontend for Salut à Toi, 2019-07-24T19:00:40+0000
/project/txgoogle/, txgoogle, 0.0.1, Google Data APIs for twisted, 2017-03-06T18:03:54+0000
/project/wallaby-backend-http/, wallaby-backend-http, 0.1.2, Wallaby backend for http(s)., 2013-01-25T00:40:03+0000
/project/taschenmesser/, taschenmesser, 18.3.2, Taschenmesser, a toolbelt with plugins for SCons, 2018-03-20T15:50:30+0000
/project/libtele/, libtele, 0.3, Library for interfacing http://tele.at/., 2011-01-15T11:49:17+0000
/project/piped-contrib-cyclone/, piped.contrib.cyclone, 0.7.0, Cyclone provider for Piped., 2015-08-07T19:41:43+0000
/project/appenlight-client/, appenlight-client, 0.6.26, Client for AppEnlight reporting - WSGI applications and django monitoring (http://getappenlight.com), 2018-06-14T12:22:07+0000
/project/piped-contrib-validation/, piped.contrib.validation, 0.7.0, FormEncode-like validation processor for Piped., 2015-08-07T19:42:09+0000
/project/txrecaptcha/, txrecaptcha, 0.0.6, Twisted reCAPTCHA client, 2015-03-25T10:19:10+0000
/project/txosc/, txosc, 0.2.0, Open Sound Control Protocol for Twisted, 2010-09-14T23:54:19+0000
/project/deluge/, deluge, 2.0.3, BitTorrent Client, 2019-06-12T17:51:47+0000
/project/vtwt/, vtwt, 0.1.2, Ver's Twitter CLI, 2010-07-17T00:48:23+0000
/project/exifproxy/, exifproxy, 1.0.1, Metadata extraction reverse proxy based on twisted and exiftool, 2020-11-22T12:05:26+0000
/project/vumi-go/, vumi-go, 0.5.0, Vumi Go, 2014-08-19T14:06:31+0000
/project/minitrue/, minitrue, 20130126, Proxy designed to lie., 2013-01-26T14:37:18+0000
/project/hammer/, hammer, 0.1, Hammer is a framework for managing load-balancer configuration, 2012-06-07T17:43:09+0000
/project/swcdb/, swcdb, 0.4.19.0, The SWC-DB Python Package, 2021-03-24T12:13:45+0000
/project/dumbserver/, dumbserver, 1.0, Mock several REST services in one go!, 2016-01-21T08:26:42+0000
/project/quotient/, Quotient, 0.3.0, Divmod Quotient is a messaging platform developed as an Offering for        Divmod Mantissa., 2009-11-29T19:15:53+0000
/project/localmail/, localmail, 0.5.0, Test SMTP/IMAP server for local integration testing, 2018-07-26T09:43:08+0000
/project/piped-contrib-status-testing/, piped.contrib.status_testing, 0.7.0, Status test support for Piped., 2015-08-07T19:42:03+0000
/project/txgoogleapi/, txgoogleapi, 0.0.1, Google Data APIs for twisted, 2017-03-06T16:42:28+0000
/project/leap-mail/, leap.mail, 0.4.2, Mail Services provided by Bitmask, the LEAP Client., 2016-05-17T18:29:42+0000
/project/methanal/, Methanal, 0.9.0, A web forms library for Mantissa, 2019-12-01T13:59:27+0000
/project/afkak/, afkak, 20.10.0, Twisted Python client for Apache Kafka, 2020-10-09T00:37:47+0000
/project/helga-no-more-olga/, helga-no-more-olga, 0.1.0, A helga matcher that tells people to talk to helga instead of olga, 2015-03-04T13:17:25+0000
/project/helga-isup/, helga-isup, 0.2.4, Helga plugin to check down for everyone or just me, 2017-01-05T21:35:58+0000
/project/axiombench/, axiombench, 0, Silly benchmarks for Axiom, 2012-09-12T16:59:52+0000
/project/twittytwister/, twittytwister, 0.1.0, Twitter client for Twisted Python, 2010-07-13T01:25:33+0000
/project/ldaptor/, ldaptor, 21.2.0, A Pure-Python Twisted library for LDAP, 2021-02-28T23:59:55+0000
/project/afpproxy/, afpproxy, 0.1.2, proxy for the AFP (AppleShare) protocol, 2016-02-05T18:31:02+0000
/project/canari/, canari, 3.3.10, Canari Framework - Maltego rapid transform development and execution framework., 2019-02-25T21:38:57+0000
/project/phen/, phen, 0.2.1, Decentralized platform for social applications, 2015-12-31T21:25:15+0000
/project/txaio/, txaio, 21.2.1, Compatibility API between asyncio/Twisted/Trollius, 2021-02-20T14:35:11+0000
/project/source-over-ssh/, source-over-ssh, 0.3, source repository management server over ssh, 2011-06-26T19:48:34+0000
/project/marathon-acme/, marathon-acme, 0.6.1, Automated management of Let's Encrypt certificates for apps running on Mesosphere Marathon, 2018-06-27T11:31:48+0000
/project/hostmaster/, hostmaster, 0.0.1, A simple way to master hosts, 2018-04-10T06:51:39+0000
/project/alot/, alot, 0.7.0, Terminal MUA using notmuch mail, 2018-02-27T19:09:35+0000
/project/mark2/, mark2, 0.1.4.3, Minecraft server wrapper, 2013-08-17T02:18:50+0000
/project/tx-logging/, tx-logging, 1.0.0, Extends Twisted log facilities., 2014-03-19T09:31:51+0000
/project/twisted-internet-processes/, twisted.internet.processes, 1.0b1, An implementation of deferToProcess using the multiprocessing package., 2009-08-24T19:26:26+0000
/project/txi2p/, txi2p, 0.3.2, I2P bindings for Twisted, 2017-04-03T06:32:57+0000
/project/txanalytics/, txanalytics, 0.1.4, A Twisted based client for Google Analytics Measurement Protocol, 2017-06-14T16:01:50+0000
/project/txbom/, txbom, 0.0.2, txbom is a Python Twisted package that lets you retrieve forecasts and observations from the Australian Bureau of Meteorology (BOM)., 2013-01-04T05:37:14+0000
/project/twisted-scheduling/, twisted.scheduling, 1.0, A scheduling plugin for twisted, 2010-06-02T19:37:16+0000
/project/wallaby/, wallaby, 0.1.2, Wallaby is a powerful yet simple framework for building Qt-based, cross-platform applications in PyQt/PySide with a CouchDB/CouchBase and Elasticsearch backend., 2013-01-25T00:32:03+0000
/project/txscheduling/, TxScheduling, 1.1, A scheduling plugin for Twisted, 2011-08-25T20:50:58+0000
/project/wallaby-app-inspector/, wallaby-app-inspector, 0.1.23, IDE for wallaby., 2013-01-25T00:37:39+0000
/project/moear-spider-zhihudaily/, moear-spider-zhihudaily, 1.1.1, MoEar爬虫功能扩展插件 - 知乎日报, 2018-06-17T04:17:56+0000
/project/helga-jira/, helga-jira, 0.1.4, A helga plugin that can be used to store responses that can be returned from a question, 2017-08-31T19:12:54+0000
/project/sprained/, sprained, 0.008, An integration of the spread toolkit, (http://spread.org), with twisted., 2010-03-02T21:24:15+0000
/project/txrudp/, txrudp, 0.5.2, A Twisted extension implementing RUDP, 2017-07-26T14:14:01+0000
/project/txsockjs/, txsockjs, 1.2.2, Twisted SockJS wrapper, 2014-11-29T21:03:31+0000
/project/moear-package-mobi/, moear-package-mobi, 1.1.2.post0, MoEar打包功能扩展插件 - Mobi, 2018-06-17T02:06:14+0000
/project/ptsmpp/, ptsmpp, 0.1.0, PTSMPP - Python Twisted SMPP 3.4 client library, 2015-10-21T13:14:27+0000
/project/spamfighter/, spamfighter, 0.2.0, Web-service fighting spam and other unsolicited messages, 2009-02-27T09:02:18+0000
/project/twistedschedule/, twistedschedule, 1.0b1, A scheduling plugin for twisted, 2008-12-10T03:03:15+0000
/project/launchkey-twisted/, launchkey-twisted, 1.0.0, LaunchKey Asynchronous SDK for Twisted, 2015-08-25T18:24:05+0000
/project/amqpipe/, amqpipe, 1.2, Twisted based pipeline framework for AMQP, 2017-11-07T08:05:56+0000
/project/txkoji/, txkoji, 0.10.0, Twisted API for Koji, 2018-12-10T23:14:48+0000
/project/omnipresence/, omnipresence, 3.0alpha2, An IRC utility bot, 2015-08-18T21:11:19+0000
/project/fmspy/, fmspy, 0.1.0, Flash Media Server in Python using Twisted Framework, 2009-05-30T15:16:35+0000
/project/expel-lib/, expel.lib, 0.2, Generate and respond to xPL messages., 2011-12-07T21:37:47+0000
/project/helga-loljava/, helga-loljava, 0.1.0, A helga plugin that will respond with a silly generated Java class name when someone mentions the word 'java'., 2015-03-04T16:30:39+0000
/project/wallaby-backend-couchdb/, wallaby-backend-couchdb, 0.1.39, Asynchronous CouchDB backend - part of Wallaby. The couchDB application framework., 2013-01-26T15:19:34+0000
/project/uthreads/, uthreads, 1.0, Python Microthreading Library, 2009-03-01T21:57:43+0000
/project/phen-dns/, phen.dns, 0.1.1, Domain Name Server for Phen, 2016-01-01T21:20:30+0000
/project/txsockjs-client/, txsockjs_client, 0.1.0, SockJS client for Twisted-Python, 2015-04-30T11:38:50+0000
/project/txeasymail/, txeasymail, 20121112, Twisted client for easy email sending, 2012-11-12T19:47:51+0000
/project/gameserverbackend/, gameServerBackend, 0.0.4, A framework that interfaces games with websockets, 2020-10-16T03:42:51+0000
/project/helga-hipchat-nicks/, helga-hipchat-nicks, 0.1.1, A helga preprocessor to ensure that user nicks are set as @ mentions, 2015-03-07T16:32:30+0000
/project/txcosm/, txcosm, 0.1.0, txcosm is a Python Twisted package to communicate with the Cosm API., 2013-01-27T06:20:33+0000
/project/txexiftool/, txExiftool, 0.1.3, Exiftool protocol and stream endpoint plugin to be used with Twisted, 2016-01-16T22:47:58+0000
/project/vault-redirector/, vault-redirector, 0.2.0, Python/Twisted application to redirect Hashicorp Vault client requests to the active node in a HA cluster, 2016-06-15T15:04:42+0000
/project/jersey/, jersey, 0.1.5, Jersey Core Libraries, 2010-11-11T21:31:24+0000
/project/twisted-ipython/, twisted-ipython, 2.0.0, An IPython extension for running twisted code, 2019-06-20T21:11:28+0000
/project/txgeonames/, txgeonames, 20121106, Twisted client for the GeoNames API, 2012-11-06T13:41:49+0000
/project/bitdust/, bitdust, 0.0.2, BitDust is a decentralized on-line storage network for safe, independent and private communications., 2019-05-11T17:54:37+0000
/project/pyviewx-client/, pyviewx.client, 0.5.1, A package for communicating with eye trackers via the iViewX server software from SensoMotoric Instruments., 2013-07-01T19:12:41+0000
/project/authkerb/, authkerb, 0.1, Kerberos authentication for Twisted, 2014-08-17T07:16:46+0000
/project/spreadsheetui/, spreadsheetui, 1.1.0, Multiclient bittorrent webui, 2020-06-07T12:54:55+0000
/project/txhl7/, txHL7, 0.5.0,  Async Twisted server implementation of Health Level 7's (HL7) Minimal Lower-Layer Protocol (MLLP)., 2020-09-08T23:24:52+0000
/project/helga-facts/, helga-facts, 0.2.2, A helga plugin that can be used to store responses that can be returned from a question, 2015-07-23T19:11:30+0000
/project/txoauth2/, txoauth2, 1.1.1, A module that allows implementing OAuth2 with twisted, 2018-10-26T12:20:07+0000
/project/txamqp3/, txAMQP3, 0.9.1, Python3 library for communicating with AMQP peers and brokers using Twisted, 2020-10-20T22:17:26+0000
/project/ade/, ade, 1.3.3, Asynchronous Differential Evolution, with efficient multiprocessing., 2020-03-20T17:47:55+0000
/project/redis-proxy/, redis_proxy, 0.0.2, a redis proxy that will seperate read and write, 2013-09-11T14:29:39+0000
/project/txxbee/, txXBee, 0.0.4, XBee Protocol for Twisted, 2012-02-23T22:32:58+0000
/project/treq/, treq, 21.1.0, High-level Twisted HTTP Client API, 2021-01-15T07:44:41+0000
/project/octothorpe/, octothorpe, 0.5, Asterisk Manager Interface library for the Twisted engine, 2014-07-20T03:02:06+0000
/project/merlyn/, merlyn, 0.0.9, A server backend for interactive online exercises., 2014-01-19T19:36:21+0000
/project/piped-contrib-amqp/, piped.contrib.amqp, 0.7.0, AMQP support for Piped., 2015-08-07T19:41:37+0000
/project/sockjs-cyclone/, sockjs-cyclone, 1.0.2, SockJS python server for the Cyclone Web Server, 2013-11-24T11:37:10+0000
/project/fmn/, fmn, 2.1.1, Library for fedmsg Notifications, 2018-04-05T15:43:57+0000
/project/sat-pubsub/, sat-pubsub, 0.3.0, XMPP Publish-Subscribe Service Component, build for the need of the « Salut à Toi » project, 2019-08-16T10:43:55+0000
/project/asynqueue/, AsynQueue, 0.9.8, Asynchronous task queueing with Twisted: threaded, multicore, and remote., 2019-03-05T02:44:56+0000
/project/helga-spongebob/, helga-spongebob, 0.1, HeLgA PlUgIn tO Do mOcKiNg sPoNgEbOb tExT, 2018-12-19T06:19:50+0000
/project/txpx/, TxPx, 0.1, Robust process management and communication for Twisted, 2015-03-29T20:20:53+0000
/project/ilmwetter/, ilmwetter, 0.2, Scrapy spider for the weather in Ilmenau, 2015-05-01T09:27:35+0000
/project/wallaby-base/, wallaby-base, 0.1.45, Core package for wallaby., 2013-02-01T12:12:31+0000
/project/wallaby-app-crm/, wallaby-app-crm, 0.1.36, CRM based on wallaby., 2013-01-25T00:38:41+0000
/project/scrivener/, scrivener, 0.2, Twisted Scribe Client/Server, 2012-09-07T17:05:14+0000
/project/txdbus/, txdbus, 1.1.2, A native Python implementation of the DBus protocol for Twisted applications., 2020-10-14T16:50:03+0000
/project/minidns/, minidns, 0.3, Simple DNS Server with REST API, for localhost only, 2013-09-11T17:40:51+0000
/project/mamba-framework/, mamba-framework, 0.3.5, Mamba is a high-level RAD Web Applications framework based on Twisted Web that uses Storm ORM as database access layer, 2013-05-06T22:01:05+0000
/project/txdiscourse/, txDiscourse, 0.1.2, Discourse API wrapper for Twisted, 2015-01-29T15:42:32+0000
/project/partysig/, partysig, 0.0.1, Create and verify distributed multi-party signatures, 2016-12-25T05:00:25+0000
/project/ccatterina-pymodbus/, ccatterina.pymodbus, 1.5.2.1, A fully featured modbus protocol stack in python, 2018-06-21T08:39:00+0000
/project/sqlbridge/, sqlbridge, 0.1.68, sql bridge for Autobahn|Python., 2014-12-18T17:05:07+0000
/project/pymodbus/, pymodbus, 2.5.1, A fully featured modbus protocol stack in python, 2021-04-01T06:19:31+0000
/project/authenticity/, authenticity, 0.1.1, OpenID Server running on mod_python and using a LDAP directory, 2011-03-19T04:21:08+0000
/project/txkazoo/, txkazoo, 0.0.5, Twisted binding for Kazoo, 2014-06-10T07:27:51+0000
/project/twistedwebsocket/, TwistedWebsocket, 0.0.7, Websocket server implementation based on Twisted with SSL support., 2014-03-07T03:00:40+0000
/project/txhttp/, txHTTP, 0.1.2, Twisted + klein based HTTP app server framework, 2018-04-10T09:26:23+0000
/project/carml/, carml, 20.0.0, A command-line tool to query and control a running Tor. Based on txtorcon + Twisted., 2020-04-15T17:06:09+0000
/project/piped-contrib-zookeeper/, piped.contrib.zookeeper, 0.7.1, Apache ZooKeeper support for Piped., 2017-07-13T20:44:43+0000
/project/shadowsocks-gtk/, shadowsocks-gtk, 0.1.1, ShadowSocks Gtk Client, 2014-10-05T15:41:39+0000
/project/pychat/, PyChat, 1.5.0, Asynchronous Chat Client, 2015-01-07T15:49:54+0000
/project/vmw-vco/, vmw.vco, 0.3.1, Python bindings for the VMware Orchestrator, 2010-10-25T10:47:09+0000
/project/txasgiresource/, txasgiresource, 2.2.1, ASGI implemented as a Twisted resource, 2020-05-07T15:56:57+0000
/project/helga-poems/, helga-poems, 0.2.0, A helga command to generate either haiku or tanka poems, 2016-10-26T20:46:35+0000
/project/autobahn/, autobahn, 21.3.1, WebSocket client & server library, WAMP real-time framework, 2021-03-02T15:12:15+0000
/project/xslproxy/, xslproxy, 1.0.1, Xsl transforming reverse proxy based on twisted, 2020-11-23T14:07:54+0000
/project/sasync/, sAsync, 0.9.3, SQLAlchemy done Asynchronously: Twisted-friendly access to an SQL database., 2018-04-21T00:57:03+0000
/project/eagleeye/, eagleeye, 0.2.0, EagleEye is a library for metrics reporting, using Twisted., 2013-05-28T10:54:16+0000
/project/ncolony/, ncolony, 18.6.0, A process starter/monitor, 2018-06-24T00:34:33+0000
/project/twoost/, twoost, 0.3.3.1, Twoost is a collection of tools and helpers for the Twisted framework., 2016-01-26T22:12:34+0000
/project/lalita/, lalita, 0.1.3, Yet another IRC bot., 2015-09-26T00:44:08+0000
/project/anydex/, anydex, 0.1.0, The Universal Decentralized Exchange, 2019-06-17T14:37:11+0000
/project/swftp/, swftp, 1.0.7, SwFTP is an FTP and SFTP interface for Openstack Object
Storage (swift), 2013-07-03T15:23:38+0000
/project/actr6-jni/, actr6_jni, 1.4.1, A high level library wrapper for the ACT-R JNI using Twisted., 2014-03-31T20:41:55+0000
/project/decmoc/, decmoc, 20130206, Declarative mocking, 2013-02-06T15:30:48+0000
/project/txmsgpackrpc/, txmsgpackrpc, 1.2, txmsgpackrpc is a Twisted library to support msgpack-rpc, 2016-12-18T13:39:10+0000
/project/treeoflife/, treeoflife, 0.0.4, A Tree of your Life (end-user application), 2014-03-22T06:04:56+0000
/project/silverberg/, silverberg, 0.1.12, Twisted CQL Cassandra Client, 2015-07-15T23:51:32+0000
/project/qt-reactor/, qt-reactor, 0.6, Twisted Qt Integration for Qt4 and Qt5 using qtpy, 2018-10-29T21:41:02+0000
/project/txdpce/, txdpce, 0.1.2, A Twisted class for parallel execution of functions performing the same task, returning the result from the one that finishes first., 2011-07-12T12:27:31+0000
/project/vertex/, Vertex, 0.3.1, Divmod Vertex is the first implementation of the Q2Q protocol, which is a peer-to-peer communication protocol for establishing stream-based communication between named endpoints., 2015-03-05T04:30:47+0000
/project/txkeystone/, txKeystone, 0.1.3, A Twisted Agent implementation which authenticates to Keystone and uses the Keystone auth credentials to authenticate against requested urls., 2013-10-31T00:55:41+0000
/project/txonedrive/, txOneDrive, 15.10.0, Obsolete twisted-based python async interface for old MS OneDrive API, 2015-10-25T05:48:37+0000
/project/helga-hipster/, helga-hipster, 0.1.2, Helga plugin to get hipster music recommendations, 2014-10-09T16:23:13+0000
/project/yell/, yell, 0.3.2, User notification library with pluggable backends. Compatible with popular frameworks such as Django, Flask, Celery., 2013-02-26T15:21:28+0000
/project/helga-xkcd/, helga-xkcd, 0.1.2, A helga plugin to fetch xkcd comics, 2017-05-01T02:00:38+0000
/project/txserviceregistry/, txServiceRegistry, 0.2.0, A Twisted Python client for Rackspace Service Registry., 2013-03-28T21:03:11+0000
/project/kotori/, kotori, 0.26.6, Kotori is a data acquisition, processing and graphing toolkit for humans, 2021-02-17T14:53:25+0000
/project/orchstr8/, orchstr8, 0.0.5, Services orchestration and testing library for torba and electrumx based projects., 2018-10-09T04:23:32+0000
/project/dfutils/, dfutils, 0.0.2, Utilities to work with Twisted Deferreds., 2013-08-29T17:57:19+0000
/project/vncdotool/, vncdotool, 1.0.0, Command line VNC client, 2020-04-10T23:44:33+0000
/project/txsocksx/, txsocksx, 1.15.0.2, Twisted client endpoints for SOCKS{4,4a,5}, 2015-08-03T17:20:51+0000
/project/helga-stfu/, helga-stfu, 0.1.0, A helga plugin that can be used to store responses that can be returned from a question, 2015-03-04T18:59:07+0000
/project/epsilon/, epsilon, 0.8.0, A set of utility modules used by Divmod projects, 2020-08-05T12:10:38+0000
/project/txredis/, txredis, 2.4, Python/Twisted client for Redis key-value store, 2016-02-05T00:32:28+0000
/project/txdlo/, txdlo, 0.1.8, A Twisted class for observing a set of deferreds., 2013-12-31T02:43:14+0000
/project/vcsserver/, vcsserver, 0.3.1, Library for easy and fast creation of an ssh demon for popular VCSs (Mercurial and Git), 2014-02-11T10:54:23+0000
/project/twisted-theseus/, twisted-theseus, 0.14.1.3, a Deferred-aware profiler for Twisted, 2015-10-29T19:50:47+0000
/project/wsjsonrpc/, wsjsonrpc, 0.0.2, JSON-RPC 2.0 over websockets, 2021-03-25T02:18:25+0000
/project/fmn-sse/, fmn-sse, 0.2.1, Real time feed for fedmsg, 2017-01-12T18:47:43+0000
/project/smpp-twisted3/, smpp.twisted3, 0.6, SMPP 3.4 client built on Twisted / Python3, 2020-10-21T09:16:59+0000
/project/helga-icanhazascii/, helga-icanhazascii, 0.1.0, A helga match plugin that will show ASCII art for certain keywords., 2015-03-04T14:01:54+0000
/project/txconnpool/, txconnpool, 0.1.1, A generalized connection pooling library for Twisted, 2010-02-22T20:33:10+0000
/project/redirbot/, redirbot, 0.0.5, IRCBot, telling people they should contact you on different nickname, 2013-07-23T09:34:07+0000
/project/pendrell/, pendrell, 0.3.7, HTTP 1.1 user agent for the programmable web, 2010-12-26T07:32:29+0000
/project/wallaby-frontend-qt/, wallaby-frontend-qt, 0.2.45, Integration of Qt into wallaby., 2013-02-01T12:11:51+0000
/project/twisted-hl7/, twisted-hl7, 0.2.2, Async Twisted server implementation of Health Level 7 MLLP, 2014-11-06T13:56:04+0000
/project/lala/, lala, 0.4, IRC bot based on the twisted framework, 2014-09-27T17:20:49+0000
/project/txriak/, txriak, 0.3.2, txriak is a Twisted module that communicates with the
                     HTTP interface of Basho Technologies Riak data store., 2011-03-23T13:49:10+0000
/project/txgithub/, txgithub, 15.0.0, GitHub API client implemented using Twisted., 2015-01-13T00:35:42+0000
/project/txampext/, txampext, 0.0.11, Extensions to Twisted's AMP implementation, 2013-12-20T15:38:16+0000
/project/tendril-framework/, tendril-framework, 0.1.0, An open-ended framework for handling information, to aid development, management, and production cycles, 2017-03-19T20:05:22+0000
/project/pycri-spotify/, pycri-spotify, 0.1, Spotify plugin for pycri, 2011-03-25T11:24:45+0000
/project/bfabio-pymodbus/, bfabio.pymodbus, 1.3.1, A fully featured modbus protocol stack in python, 2017-11-20T15:19:12+0000
/project/pyamf2/, PyAMF2, 0.6.1.5, AMF support for Python, 2014-09-13T21:20:28+0000
/project/sine/, Sine, 0.3.0, Divmod Sine is a standards-based voice-over-IP application server,        built as an offering for the Mantissa application server platform., 2009-11-29T19:14:08+0000
/project/txmx/, txmx, 0.0.1, MailExchange in Twisted, 2018-07-29T19:20:26+0000
/project/stenographer/, stenographer, 0.1.3, An HTTP interaction recorder for Twisted Web, 2015-08-20T20:01:29+0000
/project/helga-ignore/, helga-ignore, 0.1.0, A helga plugin to ignore messages from specific user nicks, 2015-07-08T20:23:27+0000
/project/txpool/, txpool, 0.9, A persistent process pool for Twisted, 2015-01-28T01:21:49+0000
