/project/burclar/, burclar, 1.1.0, Basit bir burç modülü., 2021-04-07T21:30:16+0000
/project/cwltool/, cwltool, 3.0.20210319143721, Common workflow language reference implementation, 2021-03-19T14:51:00+0000
/project/pychipbuilder/, pychipbuilder, 1.0.1, ChipBuilder Python package for creating, designing, and interfacing with zGlue ZIPs., 2020-06-26T05:27:21+0000
/project/elib/, elib, 2018.11.22.1, , 2018-11-22T10:34:31+0000
/project/vmani/, vmani, 0.0.1, Our package will give u a basic calculator function such as add, sub, mul, div for the two number., 2021-02-09T11:04:02+0000
/project/mlprogram1/, mlprogram1, 0.0.1, A Machine Learning Program, 2021-01-01T15:30:44+0000
/project/dogsandcats/, dogsandcats, 0.0.4, Dataset package for dogs and cats classification problem, 2020-10-21T07:55:50+0000
/project/stream-tweets/, stream-tweets, 1.0.1, stream tweets to a queue, 2018-07-27T00:58:40+0000
/project/dearpygui/, dearpygui, 0.6.403, DearPyGui: A simple Python GUI Toolkit, 2021-04-22T03:46:01+0000
/project/rajcalculator/, rajcalculator, 0.0.1, A very basic calculator, 2020-07-24T20:02:02+0000
/project/riteshyadavcalculator/, RiteshYadavCalculator, 0.0.1, A very basic calculator, 2020-09-02T09:19:11+0000
/project/pysafe/, pysafe, 0.2.2, Python password manger, 2020-03-18T21:46:33+0000
/project/mehalbasiccalculator/, mehalbasiccalculator, 0.0.1, A very basic calculator, 2021-02-09T17:31:43+0000
/project/fibooks/, fibooks, 1.0.4, Python library for financial statement analysis. The full documentation can be found at: https://github.com/TimoKats/fibooks, 2021-04-24T16:04:40+0000
/project/colored/, colored, 1.4.2, Simple library for color and formatting to terminal, 2019-12-09T09:45:53+0000
/project/pycellsewew/, pycellsewew, 1.2.8, A simple and flexible Python3 library for Cell, 2020-11-07T16:10:41+0000
/project/top-sis-cal/, TOP-SIS-CAL, 0.0.1, Calculation of TOPSIS, 2020-11-13T20:25:53+0000
/project/prerak-calculator/, Prerak-Calculator, 0.0.1, Our package will give you a basic calculator function like addition, subtraction, multiplication and division., 2021-02-09T12:24:12+0000
/project/psychxr/, psychxr, 0.2.2, Python extension library for interacting with eXtended Reality displays (HMDs), intended for research in neuroscience and psychology., 2019-10-16T20:36:38+0000
/project/manufaitest/, ManufaiTest, 0.1.1, Union de proyectos anteriores, 2020-12-30T01:08:54+0000
/project/uzbekstemmer/, UzbekStemmer, 0.0.1, Uzbek Stemmer, 2021-04-19T13:33:49+0000
/project/shadowcut/, shadowCut, 1.0.6, Deep Learning Library to speed up the coding process, 2021-04-17T05:52:30+0000
/project/metric-py/, metric-py, 0.0.6, Metric python3 module, 2020-05-13T02:09:40+0000
/project/golumn/, golumn, 0.21.3, Graphical CSV viewer. `column` with a "g", 2018-08-03T18:23:11+0000
/project/magicprintbykeshari/, MagicPrintByKeshari, 0.0.1, , 2020-07-23T19:45:15+0000
/project/sdp18/, SDP18, 0.1.0, This package schedules surgeries using metaheurisitcs. It is a project done for in NUS for Systems Design Project (SDP):Metaheuristic Surgery Scheduling for Operating Theatre Scheduling, 2021-02-01T06:19:22+0000
/project/wsl-tray/, wsl-tray, 0.2, wsl-tray is a lightweight Windows tray application for easily managing WSL 2 VMs., 2020-07-22T14:57:18+0000
/project/dakshbasicpackage/, dakshbasicpackage, 0.0.1, Basic Print statement, 2020-11-18T11:22:05+0000
/project/django-caching/, django_caching, 1.1.0, A easy using django cache manager., 2017-06-27T04:36:05+0000
/project/mkvbatchmultiplex/, mkvbatchmultiplex, 2.0.1, A mkv media batch multiplex., 2020-09-03T21:03:32+0000
/project/kelpsong/, kelpsong, 0.1.0, An algorithm library for robotics and AI, 2020-10-22T22:13:53+0000
/project/topsis-shreya-101803595/, TOPSIS-Shreya-101803595, 0.0.1, This Python Package is used to implement the TOPSIS Algorithm, 2020-11-14T06:15:35+0000
/project/solsticepy/, solsticepy, 0.3.10, Scripts and wrappers for Solstice ray-tracing software, 2020-10-13T07:32:44+0000
/project/nntoybox/, nntoybox, 1.0.5, DeepLearning Model Builder, 2021-04-21T17:21:30+0000
/project/cabocha-python/, cabocha-python, 0.69.1, Python wrapper for CaboCha: Japanese Dependency Structure Analyzer, 2019-09-20T18:56:47+0000
/project/secretlisting/, secretListing, 0.0.1, Makes operations on lists easy., 2021-03-08T17:12:33+0000
/project/a2y-atsui/, a2y-atsui, 0.9.0, A module that implements the UI part of ats module., 2020-11-22T03:30:27+0000
/project/shaderpy/, shaderpy, 0.0.4, A simple shader package for Pyglet., 2021-02-27T17:42:37+0000
/project/simplepackage4/, SimplePackage4, 0.0.2, A very basic calculator, 2020-10-26T22:06:41+0000
/project/csvgen/, csvgen, 1.0.0, A command line CSV data output generator for testing, 2018-03-31T20:13:39+0000
/project/wav-win-sound/, wav-win-sound, 1.0.7, Play WAV Sounds (Windows ONLY!), 2021-02-14T13:25:37+0000
/project/fazil/, fazil, 0.0.1, A simple library developed by Fazil., 2020-09-22T13:55:25+0000
/project/olsapy/, olsapy, 2.0.1, a package for orthogonal linear separation analysis (OLSA), 2020-12-05T13:48:22+0000
/project/iexplorer-api/, iexplorer-api, 0.0.1, Internet Explorer API written on C++ Builder 6, 2021-01-09T05:16:08+0000
/project/brainreg/, brainreg, 0.2.4, Automated 3D brain registration, 2021-03-11T12:21:10+0000
/project/emiz/, emiz, 2018.9.16.4, Set of tools for the DCS mission builder, 2018-09-16T19:45:46+0000
/project/awsom/, AWSOM, 0.14, Desktop automation tools for managing common tasks such as renaming media files and making backups, as well as interacting with Adobe Premiere Pro using the `Pymiere` library (Windows only)., 2020-11-16T13:13:46+0000
/project/justatestpasswordgenerator2/, justatestpasswordgenerator2, 1.0.0, A random password generator, 2020-11-10T14:48:16+0000
/project/ssound/, ssound, 1.0, Plays sounds, 2020-11-19T11:57:46+0000
/project/excelerator/, EXCELerator, 0.8, Library for reading tabular data from excel in a very forgiving manner., 2019-11-20T18:50:10+0000
/project/wmseo/, wmseo, 1.0.2, SEO Functions from WMC, 2020-11-18T20:56:39+0000
/project/loltui/, loltui, 0.1.0, LoL assistant with a TUI-interface, 2021-02-09T12:49:00+0000
/project/pyms-nist-search/, pyms-nist-search, 0.4.14, PyMassSpec extension for searching mass spectra using NIST's Mass Spectrum Search Engine, 2020-04-29T06:48:36+0000
/project/mlutilities/, MLUtilities, 1.0.0, A collection of tools for machine learning preprocessing, 2021-03-29T04:27:50+0000
/project/gramophonetools/, GramophoneTools, 0.7.0, Tools for Gramophone systems by Femtonics Ltd., 2020-02-19T07:04:08+0000
/project/rotate-matrix/, rotate-matrix, 0.0.7, Rotate any matrix of any type, either clockwise or anti-clockwise instantly., 2020-11-23T17:26:02+0000
/project/distop/, DisTop, 1.0.2, Very easy to use https://distop.xyz Stats updater, 2020-12-14T08:52:39+0000
/project/moziris/, moziris, 0.8.5, Automation tool for visual testing, 2020-01-09T18:02:00+0000
/project/algebramathgenerator/, algebraMathGenerator, 0.0.6.8, An easy way to generate algebraic equations and even solve them, 2021-04-24T23:15:40+0000
/project/cnc-centroid-skinning/, cnc-centroid-skinning, 0.0.2, wrapper for the CncSkinning API (C#), 2020-08-02T10:03:33+0000
/project/boolcalc/, boolcalc, 0.0.8, basic boolean calculator, 2020-12-07T10:04:30+0000
/project/notebooker/, notebooker, 0.2.1, Tool for parametrizing, executing, and displaying Jupyter Notebooks as reports., 2021-02-11T16:56:23+0000
/project/kedarbasiccalculator/, kedarbasiccalculator, 0.0.1, A very basic calculator, 2021-01-25T06:20:53+0000
/project/jjc-card-game/, jjc-card-game, 0.0.3, A very simple card game, 2019-10-27T02:27:09+0000
/project/chaithramc99-hamming-code-v1/, chaithramc99-hamming-code-v1, 0.0.1, Hamming code generator and validator, 2021-01-17T08:44:00+0000
/project/console-engine/, console-engine, 0.0.7, Create Console Games (Windows ONLY!), 2021-02-17T02:02:51+0000
/project/funity/, funity, 0.0.11, A Unity3d installation finder and a command line helper., 2020-11-16T08:06:09+0000
/project/watchdog/, watchdog, 2.0.3, Filesystem events monitoring, 2021-04-22T17:57:30+0000
/project/queue-tweets/, queue-tweets, 1.0.1, stream tweets to a queue, 2018-07-27T00:52:19+0000
/project/abxy/, abxy, 2.3.3, Abxy is a third party library for the package named inkster., 2020-07-13T05:54:58+0000
/project/madstestpackage/, madstestpackage, 0.0.2, A very basic calculator, 2020-12-02T11:54:02+0000
/project/varlock-throw/, varlock-throw, 0.1.6, funtion to return scambled list of word when a list of word is inputed, 2020-12-09T06:55:10+0000
/project/python-git/, python-git, 2018.2.1, Automate boring git tasks, 2019-01-08T18:39:34+0000
/project/stringfun/, stringFun, 0.0.2, It is a simple Strings related library,that simplifies some of the Strings operations and saves coding time specially while working on bigger projects., 2020-09-13T17:21:33+0000
/project/starz/, starz, 0.2.7, Sized Tape ARchiveZ, 2021-02-21T10:55:10+0000
/project/slys/, slys, 0.0.1, Python sys simulator, 2020-11-19T10:49:22+0000
/project/mbitutils/, mbitutils, 0.0.4, A Python module for the 4tronix Bit:bot XL and stubs for the BBC micro:bit., 2020-05-06T10:07:19+0000
/project/onnx-plaidml/, onnx-plaidml, 0.6.3, PlaidML ONNX backend implementation., 2019-07-11T18:46:18+0000
/project/bilinator/, bilinator, 0.0.2, Creates bil files from fits files via tiff files., 2020-07-21T13:16:30+0000
/project/ormucoq2comparator/, ormucoq2comparator, 1.0, A basic comparator, 2020-09-03T00:41:34+0000
/project/autoneuro-master-new/, Autoneuro-master-new, 0.0.1, basic, 2020-07-26T11:37:49+0000
/project/spesdebris/, spesdebris, 0.0.3, Python-based desktop automationand cross-device communication suite, 2018-12-08T22:48:05+0000
/project/yiban/, yiban, 0.7.0.1, Yiban Api, 2020-04-25T02:34:14+0000
/project/physical2fa/, Physical2FA, 1.1.0, Encryption using 2 Factor Authentication through an external drive., 2020-05-23T18:54:36+0000
/project/speedtestookla/, SpeedtestOOkla, 0.0.1, Okla Speed test automation, 2021-02-19T05:47:55+0000
/project/kvdatastore/, KVDatastore, 1.0.1, File based key-value datastore, 2021-01-01T11:53:39+0000
/project/topsis-shrey-101803346/, TOPSIS-Shrey-101803346, 1.0.0, A very basic file of topsis, 2020-11-13T15:55:07+0000
/project/libmcphase/, libMcPhase, 0.1.2, A mean-field Monte Carlo simulation program for magnetic phase diagrams and excitations., 2020-04-24T15:34:10+0000
/project/xixur999calculator/, xixur999calculator, 0.0.1, A very basic calculator, 2021-03-02T01:12:38+0000
/project/nhl-api-wrapper/, NHL-API-Wrapper, 0.7, A wrapper for the NHL API, 2021-01-27T22:02:56+0000
/project/yoctopuce/, yoctopuce, 1.10.44175, Yoctopuce python API, 2021-03-12T10:21:54+0000
/project/connected-components-3d/, connected-components-3d, 3.2.0, Connected components on 2D and 3D images. Supports multiple labels., 2021-04-02T10:53:15+0000
/project/small-win-tools/, small-win-tools, 1.0.2, A small example package, 2021-01-25T04:00:30+0000
/project/notifly/, notifly, 1.3.1, Notification on the fly !, 2021-02-21T08:48:13+0000
/project/a2y-touchui/, a2y-touchui, 0.8.0, A module that implements the UI part of touch module., 2020-06-29T08:38:53+0000
/project/neosensory-python/, neosensory-python, 0.0.1, A package to help developers interact with Neosensory products, 2020-08-10T23:11:31+0000
/project/vnpy/, vnpy, 1.9.2, A framework for developing Quantitative Trading programmes, 2018-12-29T02:21:27+0000
/project/split-df-ml/, split-df-ml, 0.0.1, splits dataset into train and test data, 2020-10-14T13:55:23+0000
/project/notion-toaster/, notion-toaster, 0.0.5, A small example package, 2021-03-03T14:39:42+0000
/project/guicrate/, GuiCrate, 1.0.5, A basic tool for creating GUI apps, 2021-03-27T15:05:56+0000
/project/updatehdr/, updatehdr, 1.0.4, This is a tool for updating hdr file for envi., 2018-11-07T11:34:43+0000
/project/ahkunwrapped/, ahkunwrapped, 2.0.2, Lightweight execution and bidirectional communication for native AutoHotkey code and scripts; full language support., 2021-03-20T09:29:16+0000
/project/sattar-package/, sattar-package, 0.0.12, A very basic libray, 2020-12-24T11:42:09+0000
/project/pypdb2/, pyPDB2, 0.0.2, Dialog Boxes, 2020-07-13T06:19:01+0000
/project/py-fbx/, py-fbx, 0.1.1, A simple-to-use Python wrapper for FBX, now with included libraries for even less setup (Windows 32 bit Only :( ), 2020-05-28T13:25:22+0000
/project/selinstapy/, selinstapy, 0.0.1, A instagram bot using selenium, 2021-01-09T20:24:58+0000
/project/a2y-cppyy/, a2y-cppyy, 0.8.0, A dummy wrapper of cppyy., 2020-08-05T05:46:35+0000
/project/kimimaro/, kimimaro, 2.1.0, Skeletonize densely labeled image volumes., 2021-04-23T18:58:20+0000
/project/mno-maxflow/, mno-maxflow, 0.0.1, Implementación del método Fork Fulkerson para hallar el flujo máximo de una red, 2021-03-18T18:29:02+0000
/project/pywayman/, pywayman, 0.0.3, Move Windows lock-screen photos, 2019-06-15T21:24:02+0000
/project/flowcell/, flowcell, 0.0.5, Acquisition software for wireless flow-through spectrophotometer, 2020-02-26T19:55:31+0000
/project/medusatest/, MedusaTest, 0.0.1, A very test, 2021-03-14T14:57:20+0000
/project/pc-info/, PC-Info, 1.0.2, PC-Info is a library used for getting all kinds of information about the computer you are using this module on., 2021-04-23T15:48:21+0000
/project/cyberaide-bookmanager/, cyberaide-bookmanager, 0.2.35, Creating Books from content in different git and other cloud services., 2020-07-29T14:02:46+0000
/project/simple-package3/, Simple-Package3, 0.0.2, A very basic calculator, 2020-10-26T21:57:29+0000
/project/mecab/, mecab, 0.996.3, MeCab binding for many OSs (Windows, macOS, and Linux), 2021-04-24T11:39:41+0000
/project/scs-analysis/, scs-analysis, 1.0.10, Information management and analysis utilities for South Coast Science data consumers., 2021-03-23T14:38:46+0000
/project/py-dataset/, py-dataset, 0.1.9, A command line tool for working with JSON documents on local disc, 2020-06-29T23:57:50+0000
/project/beta-beam/, beta-beam, 0.0.4, My last hope to get a degree..., 2021-01-28T18:02:06+0000
/project/debugging/, debugging, 0.5.5, Grab debug and error information with ease., 2020-05-21T16:33:51+0000
/project/calibre-search/, calibre-search, 0.3.7, Search local Calibre XML export, lookup results online., 2019-09-05T13:05:51+0000
/project/f2depine/, F2Depine, 0.0.6, Para resolver ejercicios de F2, 2020-10-10T20:03:55+0000
/project/ownpackage/, OwnPackage, 0.0.1, This is a library which calculates the rank by given data., 2020-11-13T19:16:50+0000
/project/aescipher/, aescipher, 2.4.1, Use AES to encrypt everything with ease!, 2020-04-18T03:46:49+0000
/project/math2-0/, Math2.0, 0.0.1, maths library with some intermediate function, 2020-08-10T12:14:31+0000
/project/drew/, drew, 0.0.11, drew, 2020-11-18T07:30:51+0000
/project/trialrandomsearch1/, trialrandomsearch1, 0.0.1, just a trial of making library, 2021-04-23T11:01:42+0000
/project/modelauto/, ModelAuto, 0.5, Speed up your model making process. This will help you in selecting best features, best Models (SVM,SVR Random Fotest e.t.c and also in Data Preprocessing, 2020-12-13T12:36:35+0000
/project/pyguard42/, pyguard42, 0.0.6, auto-starter for python,javascript and cpp codes, 2021-03-04T01:00:27+0000
/project/elib-logging/, elib-logging, 2018.6.17.1, , 2018-06-17T14:36:49+0000
/project/ap9boy-isa/, ap9boy-isa, 0.0.1, A very cool person, 2020-10-28T09:24:04+0000
/project/fseai/, fseai, 0.0.2, Full Stack Engineering AI course package, 2020-10-28T08:14:12+0000
/project/servertools/, servertools, 1.1.2, administration tools for specific servers, 2019-01-16T17:30:03+0000
/project/yk-calculator/, YK-Calculator, 0.0.1, Our package will give you a basic calculator function such as addition,subtraction, multiplication and division. It will provide you a basic undersanding of how a calculator works., 2021-02-09T11:10:56+0000
/project/suext/, suext, 0.0.3, Utility for showing any file extension and MIME type info. Support show files information in a directory as list or table., 2020-04-01T07:41:01+0000
/project/librarymayaasciikkn/, librarymayaasciikkn, 0.0.1, Functions for parsing of maya ascii files that returns name, position and uid of all mesh objects, 2021-01-19T23:19:42+0000
/project/winsystem/, winsystem, 1.0.8, Control Windows volume,use Windows TTS,make link on Windows，调用tts，创建快捷方式，控制音量, 2020-08-27T04:04:10+0000
/project/martinsimplecalculator/, martinsimplecalculator, 0.0.3, a basic calculator, 2020-10-16T20:32:47+0000
/project/pyrandmeme/, pyrandmeme, 0.0.6, Random memes for discord.py, 2020-12-27T15:56:33+0000
/project/pysharedoscom/, pysharedoscom, 1.5, Pyshare Library, 2021-02-11T17:04:34+0000
/project/tgshg/, tgshg, 1.0.1, A test small example package, 2019-03-19T03:54:48+0000
/project/helloworld20211234/, Helloworld20211234, 0.0.1, says hello world. Learn how to make your own Python package by visiting my blog, https://ryan-chou.medium.com/, 2021-04-18T01:20:39+0000
/project/toastify/, toastify, 1.1.5, Simple and Lighweight Windows 10 Toast Notifications., 2021-04-14T10:25:18+0000
/project/flex-motion/, flex-motion, 0.0.1, Python bindings around National Instruments's Flex Motion, 2020-02-10T00:18:23+0000
/project/subpub/, subpub, 0.9.0, Minimalistic, thread-safe, publish-subscribe API for Python, 2020-11-29T09:53:22+0000
/project/watermelon-feature-selection/, watermelon-feature-selection, 0.0.3, A python package for watermelon feature selection method, 2020-09-07T16:18:48+0000
/project/gervis/, Gervis, 0.0.1, This is a python based voice virtual assistant that performs multiple tasks based on voice commands., 2021-03-06T21:37:44+0000
/project/theverybasiccalculator/, theverybasiccalculator, 0.0.1, A very basic calculator, 2021-02-04T21:05:17+0000
/project/legodev/, LEGODEV, 0.0.3, Libraries to assist competitors with common tasks or sequence of tasks, 2021-04-16T19:24:10+0000
/project/pyblish-photoshop/, pyblish-photoshop, 0.1.0, Pyblish integration for Adobe Photoshop, 2020-12-29T14:05:20+0000
/project/amiautomation/, AmiAutomation, 0.0.6, Package to extract samples into pandas dataframes, 2020-12-14T23:56:21+0000
/project/valycalculate123/, valycalculate123, 0.0.1, A very basic calculator, 2020-11-22T12:06:21+0000
/project/zkbattleship/, ZKBattleship, 1.0.0, Battleship with cryptographic protections and a zero-knowledge framework., 2021-03-05T01:19:21+0000
/project/mybasiccalculator222/, mybasiccalculator222, 0.0.1, A very basic calculator, 2020-04-18T17:21:18+0000
/project/log-everywhere/, log-everywhere, 0.0.1, Logging package to enable writing all program information with corresponding datetime to multiple, DIFFERENT files safely when running multiple threads (multi-threading)., 2021-01-14T08:20:05+0000
/project/pmec/, pmec, 0.0.4, fetching data from pmec, 2021-03-16T18:04:48+0000
/project/kalikl/, kalikl, 0.0.3, A very basic calculator, 2021-01-03T20:36:55+0000
/project/cwlab/, cwlab, 0.4.1, A platform-agnostic, cloud-ready framework for simplified deployment of the Common Workflow Language using a graphical web interface, 2021-04-07T22:07:33+0000
/project/jscatter/, jscatter, 1.3.0.8, Combines dataArrays with attributes for fitting, plottingand analysis including models for Xray and neutron scattering, 2021-03-25T16:18:49+0000
/project/autoneuro/, Autoneuro, 0.0.1, basic, 2020-07-26T11:51:04+0000
/project/formelsammlung/, formelsammlung, 5.0.0, Collection of different functions, 2021-02-06T21:57:16+0000
/project/snirocr/, snirocr, 0.1.6, automatic ocr, 2021-03-17T17:05:02+0000
/project/aneeshcalculator/, aneeshcalculator, 0.0.2, A very basic calculator, 2020-11-09T14:24:26+0000
/project/winrt/, winrt, 1.0.21033.1, Access Windows Runtime APIs from Python, 2021-02-03T00:18:30+0000
/project/sispo/, sispo, 0.2.0, Space Imaging Simulator for Proximity Operations, 2021-03-09T21:51:01+0000
/project/autoneuro-master/, Autoneuro-master, 0.0.2, basic, 2020-07-26T09:55:47+0000
/project/ibm-db/, ibm-db, 3.0.4, Python DBI driver for DB2 (LUW, zOS, i5) and IDS, 2021-04-09T18:06:25+0000
/project/captcha-harvester/, captcha-harvester, 2.1.1, Solve captchas yourself without having to pay for services like 2captcha for use in automated projects., 2020-08-27T03:30:17+0000
/project/foremon/, foremon, 1.3.0, Automatically restart applications when file changes are detected., 2021-02-22T02:43:40+0000
/project/basic-func/, basic-func, 0.0.1, A bunch of basic functions needed for all Python programs, 2020-06-19T15:35:44+0000
/project/get-gifnimage/, get-gifNimage, 0.1.5, Downloading image from URL, displaying from the drive, 2021-04-25T00:11:47+0000
/project/datashow/, DataShow, 1.3.1, a tool for displaying CAN-Frames, 2021-04-17T07:58:40+0000
/project/a2y-cv/, a2y-cv, 0.8.2, A module that supplies some Image Processing, Computer Vision tools., 2020-12-14T09:00:09+0000
/project/topsis-raunak-101816012/, TOPSIS-Raunak-101816012, 0.0.1, A very basic calculator, 2020-11-12T19:32:54+0000
/project/lnv180620lib/, LNV180620lib, 0.0.1, A small example package, 2020-06-18T12:54:09+0000
/project/marymodule/, Marymodule, 0.0.1, A very basic package, 2020-09-18T10:43:57+0000
/project/cloudmesh-common/, cloudmesh-common, 4.3.65, A set of useful APIs for cloudmesh, 2021-04-07T12:33:23+0000
/project/elearning/, eLearning, 0.0.5, eLearning is an API dedicated to managing the backend infrastructure of an e-learning system., 2019-12-11T02:46:09+0000
/project/basiccalc/, BasicCalc, 0.0.1, A very basic calculator, 2020-09-12T17:20:52+0000
/project/topsis-ayush-101803635/, Topsis-Ayush-101803635, 0.0.3, myTopsisPackage, 2020-11-13T19:31:27+0000
/project/torchsdkclienttest/, torchsdkclienttest, 0.0.8, Torch sdk python client for pipleline, 2021-04-09T17:25:37+0000
/project/quick-mail/, quick-mail, 1.0.4, A simple commandline application for sending mails quickly, 2021-03-25T22:03:15+0000
/project/topsis-jaskaran-101803660/, topsis-jaskaran-101803660, 1.0.0, A topsis package., 2020-11-13T17:55:34+0000
/project/revolutionselling/, RevolutionSelling, 0.1, a pyrogram bot cloner, 2021-03-17T21:10:36+0000
/project/badar-calc/, badar-calc, 0.0.5, Very basic calculator, 2021-02-16T19:09:52+0000
/project/knives/, knives, 0.0.3, A commonly used python tools library for myself, 2020-09-29T13:35:35+0000
/project/easybotfn/, easybotfn, 0.0.1, A free lobbybot coded in python., 2021-01-30T07:35:50+0000
/project/pyrecruiter/, pyrecruiter, 0.0.9, This is a Light weight Open source Python Package made specially for Job Seekers and Recruiters in the field of Data science and Machine Learning (Currently), In order to use the Power of Machine Learning to help Shortlist the Right Candidates for a specific Job., 2020-11-23T12:40:53+0000
/project/vdevapi/, vdevapi, 0.0.3, An API, that can do a lots of cool things., 2021-01-12T13:10:51+0000
/project/mrinal-basic-calculator/, Mrinal-Basic-Calculator, 0.0.1, A very elementary calculator, 2020-08-22T03:16:22+0000
/project/c-gpu/, C-GPU, 0.0.1, Mini virtual GPU made with the curses module!, 2021-02-01T20:24:20+0000
/project/anonfiles/, anonfiles, 0.0.5, Capable of zipping, splitting, uploading files and folders to AnonFiles, BayFiles, ForumFiles., 2020-06-22T16:44:10+0000
/project/shaizae-fp/, shaizae-fp, 0.0.2, a grate machine learning tool for beginners and dummies :), 2021-01-25T19:18:29+0000
/project/norman-ai/, norman-ai, 0.0.4, A package for automation of the novel object recognition test., 2021-04-12T08:28:17+0000
/project/strictdf/, strictdf, 0.1.0, A very basic dataframe check, 2020-09-15T07:36:28+0000
/project/polytest/, polytest, 0.0.4, Wrapper for Polymatica API, 2020-12-03T07:26:56+0000
/project/mecab-python-windows/, mecab-python-windows, 0.996.3, Python wrapper for CaboCha: Japanese Dependency Structure Analyzer, 2019-03-03T17:13:42+0000
/project/dspc-bot-ctrl/, dspc-bot-ctrl, 1.0.2, Controller for bot to control your PC through telegram messages, 2020-03-20T02:53:29+0000
/project/pywamg/, PyWaMG, 1.1.3, PyWaMG - WhatsApp Automator Bot, 2021-03-17T16:19:36+0000
/project/pcpartscraper/, pcpartscraper, 1.1.0, A powerful pcpartpicker.com WebScraper that extracts Data from Part URL's and search Queries., 2020-10-06T04:55:56+0000
/project/text-fabric/, text-fabric, 8.4.14, Processor and browser for Text Fabric Data, 2021-04-20T06:00:35+0000
/project/ghseetvisualizer/, ghseetvisualizer, 0.1.0, A Visualizing program which can visualize you data from google sheets, 2020-10-11T19:49:13+0000
/project/surveyjsunofficial/, surveyJsUnofficial, 0.0.1, A basic library to access surveyJs api., 2020-12-11T07:05:48+0000
/project/angel-tag/, angel-tag, 0.0.9, An Ancient Greek Morphology Tagger, 2021-02-04T20:41:41+0000
/project/import-ready/, import-ready, 0.12.0, A simple importable Python package, 2019-07-13T15:02:44+0000
/project/standard-naming/, standard-naming, 0.1, Achieving semantic consistency of name-identity, 2020-10-16T04:58:01+0000
/project/tesingforfree/, tesingforfree, 0.0.1, A very basic calculator, 2020-12-02T15:33:53+0000
/project/featureview/, featureview, 1.0.4.1, A tool for feature visualization, 2020-08-26T08:28:01+0000
/project/mkbasiccalc/, mkbasiccalc, 0.0.1, A basic calculator, 2021-01-09T05:14:35+0000
/project/piyush/, piyush, 0.0.1, hi piyush, 2020-04-15T21:32:46+0000
/project/swordiedb/, swordiedb, 1.0.2, A database API for SwordieMS-based maplestory sources., 2021-01-20T21:35:01+0000
/project/arithomate/, arithomate, 0.0.1, This module helps to do Arithemetic Operations easily., 2021-02-05T06:38:30+0000
/project/noblessev2/, noblessev2, 0.0.2, A very basic calculator, 2021-04-07T20:41:06+0000
/project/corpfipy/, CorpFiPy, 0.0.1, A short description of the library, 2020-12-04T04:28:41+0000
/project/deepreg/, deepreg, 0.1.2, DeepReg is a freely available, community-supported open-source toolkit for research and education in medical image registration using deep learning., 2021-02-01T08:46:39+0000
