/project/zn/, zn, 0.0.1, Zinc, 2019-01-31T00:43:06+0000
/project/transmute/, transmute, 5.0, Automatically update Python Eggs on application startup., 2014-03-07T13:12:48+0000
/project/malice/, malice, 0.0.3, My awesome little infrastructure configuration environment, 2019-06-24T18:10:44+0000
/project/yagmail/, yagmail, 0.14.247, Yet Another GMAIL client, 2021-03-31T13:01:45+0000
/project/django-fab/, django-fab, 1.0.4, Common methods to help create fabric deplopment scripts for django, 2009-10-13T04:34:19+0000
/project/mr-parker/, mr.parker, 1.0, Ensures that the PyPI bus factor for a package is above a certain threshold., 2009-10-31T14:43:22+0000
/project/pexe37/, pexe37, 0.9.6.5, Python to Exe, 2019-12-17T04:49:09+0000
/project/graphiteencoder/, GraphiteEncoder, 0.1.4, , 2018-09-28T02:33:54+0000
/project/autopub/, autopub, 0.2.0, Automatic package release upon pull request merge, 2021-02-15T14:47:37+0000
/project/venv-pack/, venv-pack, 0.2.0, Package virtual environments for redistribution, 2018-08-23T16:02:51+0000
/project/codedeploy-monitor/, codedeploy_monitor, 0.1, Creates and monitors AWS CodeDeploy deployments., 2015-12-16T10:07:07+0000
/project/genesis/, genesis, 0.0.0, AI based Genetic algorithm for data migration, 2018-05-23T23:11:16+0000
/project/flask-fs/, flask-fs, 0.6.1, Simple and easy file storages for Flask, 2018-04-19T12:39:10+0000
/project/aboutcode/, AboutCode, 3.0.0.dev3, Document the provenance (origin and license) of third-party software using small text files. Collect inventories, generate attribution documentation., 2016-06-21T10:57:34+0000
/project/jumpssh/, jumpssh, 1.6.5, Python library for remote ssh calls through a gateway., 2020-11-06T17:52:50+0000
/project/ministryofpackages/, MinistryOfPackages, 0.9.5, A minimal PyPI implementation meant for use behind a firewall., 2011-09-19T17:08:29+0000
/project/inboard/, inboard, 0.9.1, Docker images and utilities to power your Python APIs and help you ship faster., 2021-04-19T23:47:34+0000
/project/buildout-couchdb/, buildout_couchdb, 0.1, ZC buildout recipe for Apache CouchDB server, 2009-11-09T22:19:19+0000
/project/rudix/, rudix, 2017.3.18, Rudix Package Manager, 2017-03-19T01:46:15+0000
/project/solv/, solv, 0.7.17, A free package dependency solver using a satisfiability algorithm., 2021-01-30T04:33:15+0000
/project/sdataflow/, sdataflow, 0.3, A simple language to describe dataflow between entries, implemented in Python., 2015-04-27T16:57:03+0000
/project/bakercm/, bakercm, 0.4.4, Baker is a decentralized configuration management based on files, 2018-11-12T21:49:18+0000
/project/appsync-resolver-uploader/, appsync-resolver-uploader, 1.0.0, Creates or updates an AWS AppSync resolver, 2021-04-23T16:53:09+0000
/project/yourtool/, yourtool, 0.0.1, Uses WiFi to tell you where you are, 2016-10-08T16:56:10+0000
/project/flowtool-releasing/, flowtool-releasing, 0.7.23, Releasing made easy for pythonic git users., 2016-04-24T15:39:37+0000
/project/package/, package, 0.1.1, package is a package to package your package, 2011-04-24T05:58:52+0000
/project/prequ/, prequ, 1.4.7, Prequ -- Python requirement handling, 2019-07-29T19:14:48+0000
/project/doorpi/, DoorPi, 2.5.1, provide intercomstation to the doorstation by VoIP, 2016-08-01T15:58:19+0000
/project/docker-registry-purger/, docker-registry-purger, 0.1.1, A simple docker registry cleaner, 2018-08-31T08:58:57+0000
/project/mysqlbinlog2blinker/, mysqlbinlog2blinker, 0.1, This project listen on mysql binlog (as a slave) and send the binlog event to blinker signal. It can remember last binlog position and work as a MySQL slave., 2016-04-04T07:48:21+0000
/project/natural-money/, natural_money, 0.0.4, Find money / currencies talk, 2016-08-20T18:33:28+0000
/project/setuplib/, setuplib, 0.1.14, Support library functions for extensions and entry points of setuptools / distutils., 2019-12-13T09:54:07+0000
/project/pycloudhub/, pycloudhub, 0.1.10, A CloudHub API wrapper written in python, 2016-07-28T07:49:09+0000
/project/transmute-core/, transmute-core, 1.13.3, a utility library to help provide api route generation form function signature for web frameworks., 2019-12-19T21:19:59+0000
/project/git-export-hardlink/, git_export_hardlink, 0.1.0, Git export command that reuses already existing exports and hardlinks files from them., 2013-02-14T08:16:11+0000
/project/platform-migrator/, platform-migrator, 1.1.0, Migrate software from one system to another, 2018-05-12T21:44:52+0000
/project/udata-geoplatform/, udata-geoplatform, 2.0.0, Connects uData with Geoplatform (geo.data.gouv.fr), 2020-03-11T17:08:24+0000
/project/xstatic/, XStatic, 1.0.2, XStatic base package with minimal support code, 2018-09-18T17:49:48+0000
/project/draxoft-pkginfo/, draxoft.pkginfo, 0.1, Simple utility and library for extracting metadata from Python setup files., 2012-03-15T08:27:47+0000
/project/pyinstaller/, pyinstaller, 4.3, PyInstaller bundles a Python application and all its dependencies into a single package., 2021-04-17T04:46:48+0000
/project/setuptools-parcels/, setuptools-parcels, 0.0.8, an alternative interface to package_data, 2017-04-20T16:45:17+0000
/project/buildutils/, buildutils, 0.3, Distutils extensions for developing Python libraries and applications., 2007-09-19T17:50:17+0000
/project/tok/, tok, 0.1.14, Fast and customizable tokenizer, 2019-07-09T18:48:26+0000
/project/cx-freeze-395/, cx-Freeze-395, 6.0b1, create standalone executables from Python scripts, 2019-04-02T18:41:00+0000
/project/supvisors/, supvisors, 0.5, A Control System for Distributed Applications, 2021-03-02T00:23:58+0000
/project/autoupgrade-ng/, autoupgrade-ng, 0.3.0, Automatic upgrade of PyPI packages, 2017-02-17T12:13:31+0000
/project/creep/, creep, 0.3.5, Incremental FTP/SSH deployment tool, 2020-01-18T09:36:07+0000
/project/flask-restplus-oauth-redirect/, flask-restplus-oauth-redirect, 0.13.0, Fully featured framework for fast, easy and documented API development with Flask, 2019-03-29T12:47:53+0000
/project/flowtool-githooks-demo/, flowtool-githooks-demo, 0.7.24, Trivial demo tasks for git users., 2016-05-02T21:30:23+0000
/project/flowtool-stages/, flowtool-stages, 0.7.11, Manage different environments., 2016-04-24T15:47:08+0000
/project/carbonstat/, carbonstat, 1.0, Metric collection agent for Carbon, 2017-08-22T08:07:04+0000
/project/riker/, riker, 0.2.4, Deploy any application to AWS, 2015-05-01T04:09:05+0000
/project/tpunicorn/, tpunicorn, 0.5.5, TPU management, 2021-01-29T02:56:00+0000
/project/robotice/, robotice, 0.0.1, Opensource monitoring, reasoning and acting framework., 2015-02-26T21:44:25+0000
/project/reliz/, reliz, 0.1.0.dev0, Manage releases versionning accross multiple products, 2017-12-08T16:19:39+0000
/project/udata-gouvfr/, udata-gouvfr, 2.5.5, uData customizations for Data.gouv.fr, 2021-04-02T14:16:14+0000
/project/wheel-inspect/, wheel-inspect, 1.7.0, Extract information from wheels, 2020-11-07T22:33:36+0000
/project/pypi-parker/, pypi-parker, 0.1.2, , 2017-10-09T04:03:50+0000
/project/setl/, setl, 0.10.0, Packaging tool for PEP 518 projects with Setuptools backend., 2020-03-11T17:16:25+0000
/project/trackdeps/, trackdeps, 1.0.2, , 2016-02-28T16:15:38+0000
/project/invocations/, invocations, 2.0.0, Common/best-practice Invoke tasks and collections, 2021-01-24T23:47:08+0000
/project/fabric-tb/, fabric-tb, 0.0.1, Based on Fabric, use ansible-like config files., 2016-01-15T10:13:06+0000
/project/peeper/, Peeper, 0.1, Peep inside a Python sdist tarball/zip and find its dirty requirements., 2014-10-20T10:34:42+0000
/project/taskforce/, taskforce, 0.6.0, Taskforce starts and restarts daemon processes.  It will detect executable and/or module changes and automatically restart the affected processes., 2020-08-13T19:13:49+0000
/project/os-sys-php/, os-sys-php, 2019.10.13, a big lib with many usefull tools and it are not only os and sys tools..., 2019-10-14T04:22:05+0000
/project/pylightnix/, pylightnix, 0.2.1, A Nix-style immutable data management library in Python, 2020-08-01T15:29:19+0000
/project/bureaucrat/, bureaucrat, 0.3.6, Procfile and Deployfile process manager for Python virtual environments, 2015-10-22T01:52:59+0000
/project/wheelfile/, wheelfile, 0.0.3, API for inspecting and creating .whl files, 2021-03-28T01:42:34+0000
/project/sysdm/, sysdm, 0.8.58, Scripts as a service. Builds on systemd., 2021-03-05T15:40:20+0000
/project/paci/, paci, 1.10.3, Your friendly, lightweight and flexible package manager., 2021-01-22T11:06:22+0000
/project/wagtail-sendinblue/, wagtail-sendinblue, 0.1.0.dev0, SendInBlue integration for Wagtail, 2017-11-12T22:41:30+0000
/project/loco/, loco, 0.1.32, Share localhost through SSH., 2019-02-09T23:05:44+0000
/project/yay-digitalsparky/, yay-digitalsparky, 0.0.1, Simple Python interface to Arch Linux package manager (yay), 2020-08-21T18:13:08+0000
/project/pudb/, pudb, 2020.1, A full-screen, console-based Python debugger, 2020-12-21T04:20:59+0000
/project/django-password/, django-password, 3.0, A Django application to store communal passwords., 2012-05-11T15:19:38+0000
/project/bombardier-cli/, bombardier_cli, 1.10-783, Open Source Configuration management and package delivery: central server components, 2011-03-07T23:11:39+0000
/project/pyqt-distutils/, pyqt-distutils, 0.7.3, A set of distutils extension for building Qt ui files, 2017-06-18T11:18:50+0000
/project/gn2gn-client/, gn2gn-client, 0.0.4.dev0, Outil d'import de donnes entre instances GeoNature (ct client), 2020-12-31T00:54:39+0000
/project/impstall/, impstall, 0.3.0, This module can be used to import python packages and install them if not already installed., 2017-07-28T01:24:47+0000
/project/netaddr2/, netaddr2, 0.7.19, A network address manipulation library for Python, 2020-05-22T10:27:13+0000
/project/launchbox/, launchbox, 0.1.1, Packaging and dependency resolution for chef-solo cookbooks, 2013-01-03T05:32:15+0000
/project/tbcli/, tbcli, 0.0.10, Based on Fabric, use ansible-like config files., 2016-02-17T07:01:21+0000
/project/access-points/, access_points, 0.4.66, Scan your WiFi and get access point information and signal quality., 2019-09-08T22:32:03+0000
/project/with-cloud-blob/, with-cloud-blob, 0.4.4, , 2020-07-08T09:28:33+0000
/project/django-eztables/, django-eztables, 0.3.2, jQuery Datatables integration for Django, 2013-06-07T00:39:14+0000
/project/awslambda/, awslambda, 1.0.6, A tool for deploying Python projects to AWS Lambda., 2016-12-04T02:41:55+0000
/project/solar/, solar, 0.2.1, Deployment tool, 2016-02-18T15:25:01+0000
/project/pexpect-py3-patch/, pexpect-py3-patch, 4.6.0, Fork for python 3 support issue #506., 2018-10-17T00:14:18+0000
/project/isconf/, isconf, 4.2.8.253, Infrastructure configuration management tool, 2015-02-25T04:38:18+0000
/project/aliyun-img-utils/, aliyun-img-utils, 1.1.0, Package that provides utilities for handling images in Aliyun Cloud., 2021-04-07T15:44:53+0000
/project/dot-access/, dot_access, 0.0.1, Makes nested python objects easy to go through, 2017-09-22T21:09:59+0000
/project/justdb/, justdb, 0.0.14, Just a thread/process-safe, file-based, fast, database., 2017-06-21T20:12:37+0000
/project/pipis/, pipis, 2.0.0.post2, Wraps pip and venv to install scripts, 2019-06-19T11:23:26+0000
/project/dstack-factory/, dstack-factory, 1.0.7, CLI that accompanies dstack-factory for building and publishing docker images for python packages., 2017-02-17T12:22:55+0000
/project/genesis/, genesis, 0.0.0, AI based Genetic algorithm for data migration, 2018-05-23T23:11:16+0000
/project/flask-fs/, flask-fs, 0.6.1, Simple and easy file storages for Flask, 2018-04-19T12:39:10+0000
/project/aboutcode/, AboutCode, 3.0.0.dev3, Document the provenance (origin and license) of third-party software using small text files. Collect inventories, generate attribution documentation., 2016-06-21T10:57:34+0000
/project/jumpssh/, jumpssh, 1.6.5, Python library for remote ssh calls through a gateway., 2020-11-06T17:52:50+0000
/project/ministryofpackages/, MinistryOfPackages, 0.9.5, A minimal PyPI implementation meant for use behind a firewall., 2011-09-19T17:08:29+0000
/project/inboard/, inboard, 0.9.1, Docker images and utilities to power your Python APIs and help you ship faster., 2021-04-19T23:47:34+0000
/project/buildout-couchdb/, buildout_couchdb, 0.1, ZC buildout recipe for Apache CouchDB server, 2009-11-09T22:19:19+0000
/project/rudix/, rudix, 2017.3.18, Rudix Package Manager, 2017-03-19T01:46:15+0000
/project/solv/, solv, 0.7.17, A free package dependency solver using a satisfiability algorithm., 2021-01-30T04:33:15+0000
/project/sdataflow/, sdataflow, 0.3, A simple language to describe dataflow between entries, implemented in Python., 2015-04-27T16:57:03+0000
/project/bakercm/, bakercm, 0.4.4, Baker is a decentralized configuration management based on files, 2018-11-12T21:49:18+0000
/project/appsync-resolver-uploader/, appsync-resolver-uploader, 1.0.0, Creates or updates an AWS AppSync resolver, 2021-04-23T16:53:09+0000
/project/yourtool/, yourtool, 0.0.1, Uses WiFi to tell you where you are, 2016-10-08T16:56:10+0000
/project/flowtool-releasing/, flowtool-releasing, 0.7.23, Releasing made easy for pythonic git users., 2016-04-24T15:39:37+0000
/project/package/, package, 0.1.1, package is a package to package your package, 2011-04-24T05:58:52+0000
/project/prequ/, prequ, 1.4.7, Prequ -- Python requirement handling, 2019-07-29T19:14:48+0000
/project/doorpi/, DoorPi, 2.5.1, provide intercomstation to the doorstation by VoIP, 2016-08-01T15:58:19+0000
/project/docker-registry-purger/, docker-registry-purger, 0.1.1, A simple docker registry cleaner, 2018-08-31T08:58:57+0000
/project/mysqlbinlog2blinker/, mysqlbinlog2blinker, 0.1, This project listen on mysql binlog (as a slave) and send the binlog event to blinker signal. It can remember last binlog position and work as a MySQL slave., 2016-04-04T07:48:21+0000
/project/natural-money/, natural_money, 0.0.4, Find money / currencies talk, 2016-08-20T18:33:28+0000
/project/setuplib/, setuplib, 0.1.14, Support library functions for extensions and entry points of setuptools / distutils., 2019-12-13T09:54:07+0000
/project/pycloudhub/, pycloudhub, 0.1.10, A CloudHub API wrapper written in python, 2016-07-28T07:49:09+0000
/project/transmute-core/, transmute-core, 1.13.3, a utility library to help provide api route generation form function signature for web frameworks., 2019-12-19T21:19:59+0000
/project/git-export-hardlink/, git_export_hardlink, 0.1.0, Git export command that reuses already existing exports and hardlinks files from them., 2013-02-14T08:16:11+0000
/project/platform-migrator/, platform-migrator, 1.1.0, Migrate software from one system to another, 2018-05-12T21:44:52+0000
/project/udata-geoplatform/, udata-geoplatform, 2.0.0, Connects uData with Geoplatform (geo.data.gouv.fr), 2020-03-11T17:08:24+0000
/project/xstatic/, XStatic, 1.0.2, XStatic base package with minimal support code, 2018-09-18T17:49:48+0000
/project/draxoft-pkginfo/, draxoft.pkginfo, 0.1, Simple utility and library for extracting metadata from Python setup files., 2012-03-15T08:27:47+0000
/project/pyinstaller/, pyinstaller, 4.3, PyInstaller bundles a Python application and all its dependencies into a single package., 2021-04-17T04:46:48+0000
/project/setuptools-parcels/, setuptools-parcels, 0.0.8, an alternative interface to package_data, 2017-04-20T16:45:17+0000
/project/buildutils/, buildutils, 0.3, Distutils extensions for developing Python libraries and applications., 2007-09-19T17:50:17+0000
/project/fabric/, fabric, 2.6.0, High level SSH command execution, 2021-01-19T01:10:03+0000
/project/pexpect-py3-fork/, pexpect-py3-fork, 4.6.0, Fork for python 3 support issue #506., 2018-10-17T00:08:02+0000
/project/pip-accel/, pip-accel, 0.43, Accelerator for pip, the Python package manager, 2016-03-14T12:52:31+0000
/project/pip2pkgbuild/, pip2pkgbuild, 0.2.6, Generate PKGBUILD file for a Python module from PyPi, 2019-04-13T07:56:19+0000
/project/serviceinstaller/, serviceinstaller, 0.1.3, A flexible service installer, currently compatible with Linux Systemd., 2020-06-19T12:07:42+0000
/project/make-lambda-package/, make-lambda-package, 1.1.0, Bundle up deployment packages for AWS Lambda., 2019-11-04T23:40:36+0000
/project/fabtools-python/, fabtools-python, 0.19.7, Fabtools version compatible with both Python2 and Python3, 2017-03-27T17:47:37+0000
/project/awxkit/, awxkit, 19.0.0, The official command line interface for Ansible AWX, 2021-04-07T21:46:01+0000
/project/nuitka/, Nuitka, 0.6.14.4, Python compiler with full language support and CPython compatibility, 2021-04-18T14:21:23+0000
/project/vcver/, vcver, 0.2.11, provide package versions with version control data., 2020-04-08T04:20:43+0000
/project/grocker/, grocker, 6.9.1, Docker image builder, 2021-04-20T10:05:17+0000
/project/uranium/, uranium, 2.1.2, a build system for python, 2020-04-12T03:36:30+0000
/project/monocat/, monocat, 0.5.0, monocat is a command line utility for managing GitHub releases, 2020-10-13T22:55:19+0000
/project/bleeding-rez/, bleeding-rez, 2.40.5, A cross-platform packaging system that can build and install multiple version of packages, and dynamically configure resolved environments at runtime., 2020-11-06T09:40:19+0000
/project/sysdm/, sysdm, 0.8.58, Scripts as a service. Builds on systemd., 2021-03-05T15:40:20+0000
/project/loco/, loco, 0.1.32, Share localhost through SSH., 2019-02-09T23:05:44+0000
/project/yay-digitalsparky/, yay-digitalsparky, 0.0.1, Simple Python interface to Arch Linux package manager (yay), 2020-08-21T18:13:08+0000
/project/pudb/, pudb, 2020.1, A full-screen, console-based Python debugger, 2020-12-21T04:20:59+0000
/project/django-password/, django-password, 3.0, A Django application to store communal passwords., 2012-05-11T15:19:38+0000
/project/bombardier-cli/, bombardier_cli, 1.10-783, Open Source Configuration management and package delivery: central server components, 2011-03-07T23:11:39+0000
/project/pyqt-distutils/, pyqt-distutils, 0.7.3, A set of distutils extension for building Qt ui files, 2017-06-18T11:18:50+0000
/project/gn2gn-client/, gn2gn-client, 0.0.4.dev0, Outil d'import de donnes entre instances GeoNature (ct client), 2020-12-31T00:54:39+0000
/project/gdm/, GDM, 0.8.2, A language-agnostic, 2016-02-24T14:56:41+0000
/project/adhoc/, AdHoc, 0.3.2, Standalone Package Generator, 2013-08-24T09:06:43+0000
/project/setuptestx/, setuptestx, 0.1.46, Support test automation for setuptools / distutils., 2019-12-13T13:34:05+0000
/project/get-mirror/, get-mirror, 1.0, UNKNOWN, 2013-06-17T07:52:41+0000
/project/applause-tool/, applause-tool, 0.5.0, This package allows integration with Applause Inc. services., 2016-10-14T13:32:24+0000
/project/lambda-deploy/, lambda-deploy, 0.1.2, Easily deploy code to AWS Lambda, 2016-08-11T16:19:54+0000
/project/tfnz/, tfnz, 1.3.4, SDK for 20ft.nz, 2018-08-13T02:33:32+0000
/project/snapcraft/, snapcraft, 3.8, Publish your app for Linux users for desktop, cloud, and IoT., 2019-09-11T15:14:19+0000
/project/python-quilt/, python-quilt, 1.0, A quilt patch system implementation in Python, 2017-07-01T11:52:05+0000
/project/flowtool-base/, flowtool-base, 0.7.61, Start managing your workflow!, 2016-05-03T18:30:36+0000
/project/localshop/, localshop, 0.9.3, A private pypi server including auto-mirroring of pypi., 2015-05-15T13:53:19+0000
/project/fuel-plugin-builder/, fuel-plugin-builder, 4.2.0, Helps to create and build fuel plugins, 2017-02-02T14:05:55+0000
/project/projy/, Projy, 0.4.1, Projy is a template-based skeleton generator., 2013-10-21T13:32:54+0000
/project/fab-classic/, fab-classic, 1.18.1, fab-classic is a simple, Pythonic tool for remote execution and deployment., 2020-07-28T10:07:23+0000
/project/riker/, riker, 0.2.4, Deploy any application to AWS, 2015-05-01T04:09:05+0000
/project/tpunicorn/, tpunicorn, 0.5.5, TPU management, 2021-01-29T02:56:00+0000
/project/robotice/, robotice, 0.0.1, Opensource monitoring, reasoning and acting framework., 2015-02-26T21:44:25+0000
/project/reliz/, reliz, 0.1.0.dev0, Manage releases versionning accross multiple products, 2017-12-08T16:19:39+0000
/project/udata-gouvfr/, udata-gouvfr, 2.5.5, uData customizations for Data.gouv.fr, 2021-04-02T14:16:14+0000
/project/wheel-inspect/, wheel-inspect, 1.7.0, Extract information from wheels, 2020-11-07T22:33:36+0000
/project/pypi-parker/, pypi-parker, 0.1.2, , 2017-10-09T04:03:50+0000
/project/setl/, setl, 0.10.0, Packaging tool for PEP 518 projects with Setuptools backend., 2020-03-11T17:16:25+0000
/project/trackdeps/, trackdeps, 1.0.2, , 2016-02-28T16:15:38+0000
/project/invocations/, invocations, 2.0.0, Common/best-practice Invoke tasks and collections, 2021-01-24T23:47:08+0000
/project/possible/, possible, 0.0.0, Possible is configuration management tool, 2019-05-26T09:26:07+0000
/project/pip-save/, pip-save, 0.2.0, A wrapper around pip to add `npm --save` style functionality to pip, 2016-09-20T19:38:08+0000
/project/gentle/, Gentle, 0.1, Gentle is a help you quickly submit code to the test environment tools., 2013-12-04T15:12:20+0000
/project/appypi/, appypi, 0.2.0, appypi: sandboxing apps from Pypi packages, 2012-12-16T17:22:04+0000
/project/warthog/, warthog, 2.0.1, Simple client for A10 load balancers, 2017-07-20T21:19:28+0000
/project/rundeckrun/, rundeckrun, 0.2.1, Rundeck API Python client, 2015-10-12T20:51:39+0000
/project/moscow-yandex-transport/, moscow-yandex-transport, 0.2.0, YANDEX transport API client library, 2019-08-31T17:39:09+0000
/project/cizsle/, cizsle, 0.0a7, Cisco ZTP Server LE, 2019-05-09T02:14:31+0000
/project/calmjs-dev/, calmjs.dev, 2.3.0, Package for aiding the development of JavaScript code to be provided as part of Python packages through integration with Node.js development tools into a Python environment via the Calmjs framework., 2019-05-28T06:03:36+0000
/project/cada/, cada, 1.0.0, Search and consult CADA advices, 2019-07-19T13:52:44+0000
/project/pypercard/, pypercard, 0.0.1a4, A HyperCard inspired GUI framework for beginner developers., 2019-09-21T15:50:04+0000
/project/nexus-client/, nexus_client, 0.1.1, Python client for Nexus., 2014-12-26T19:55:59+0000
/project/rt-factory/, rt-factory, 0.2.4, Pythonic wrapper for the artifactory API, 2017-10-26T15:22:17+0000
/project/pglite/, pglite, 1.0.13, PostgreSQLite, 2020-09-01T08:16:49+0000
/project/flowtool-all/, flowtool-all, 0.7.22, Start managing everything!, 2016-04-24T16:22:01+0000
/project/cp-buildout-postgres/, cp.buildout_postgres, 0.1-r2723, zc.buildout recipes for setting up a Postgres Environment., 2010-04-03T18:54:28+0000
/project/calmjs-rjs/, calmjs.rjs, 2.0.1, Package for the integration of RequireJS into a Python environment via the Calmjs framework, to provide a reproducible workflow for the generation of deployable artifacts from JavaScript source code provided by Python packages in conjunction with standard JavaScript or Node.js packages sourced from npm or other similar package repositories., 2018-05-03T03:06:49+0000
/project/zombieagent/, ZombieAgent, 0.0.1a, ., 2012-01-05T23:37:08+0000
/project/jasypt4py/, jasypt4py, 0.0.3, Cipher functions that produce Jasypt/Bouncycastle compatible password encryption., 2017-12-28T06:37:06+0000
/project/cozy-management/, cozy-management, 0.0.25, Module to help self hosted cozy management, 2017-01-31T12:31:42+0000
/project/circup/, circup, 0.9.4, A tool to manage/update libraries on CircuitPython devices., 2021-03-25T17:20:19+0000
/project/aiohttp-transmute/, aiohttp-transmute, 2.0.0, a toolset to generate routes from functions for aiohttp., 2019-02-24T22:39:38+0000
/project/calmjs-sassy/, calmjs.sassy, 1.0.2, Package for extending the Calmjs framework to support the usage of sass in a manner that crosses Python package boundaries by exposing an import system that mimics the package namespaces available within a given Python environment., 2020-04-23T10:14:52+0000
/project/autoupgrade3/, autoupgrade3, 0.2.1, Python 3 friendly automatic upgrade of python modules and packages, 2016-06-25T08:18:48+0000
/project/fabric-logging/, fabric-logging, 0.1.0, Adds option to redirect all stdout/stderr through standard Python logging. Very much a work in progress, 2012-09-19T00:28:18+0000
/project/setup-qt/, setup_qt, 1.0.0, Compile Qt resource files, UI files and translations in setup.py, 2017-03-23T17:03:48+0000
/project/signify/, signify, 0.3.0, Module to generate and verify PE signatures, 2020-08-16T10:32:38+0000
/project/pyalpm/, pyalpm, 0.9.2, libalpm bindings for Python 3, 2020-10-13T20:14:26+0000
/project/seed/, seed, 0.11.3, A utility for easily creating and releasing Python packages, 2017-02-22T16:22:12+0000
/project/yadtbroadcast-client/, yadtbroadcast-client, 1.2.1, YADT - an Augmented Deployment Tool - The Broadcast Client Part, 2014-02-11T15:22:18+0000
/project/zn/, zn, 0.0.1, Zinc, 2019-01-31T00:43:06+0000
/project/houston/, houston, 0.3.0, Application deployment on CoreOS clusters using fleetd and Consul, 2015-08-10T19:49:36+0000
/project/paths/, paths, 0.0.1a1, Python utility module for dealing with local paths, 2013-12-07T14:12:58+0000
/project/pup/, pup, 1.0.0a9, Pluggable Micro Packager, 2021-02-06T22:08:06+0000
/project/gitvier/, gitvier, 0.1.1, A component manager based where your components live in Git., 2017-05-13T20:57:31+0000
/project/transmute/, transmute, 5.0, Automatically update Python Eggs on application startup., 2014-03-07T13:12:48+0000
/project/malice/, malice, 0.0.3, My awesome little infrastructure configuration environment, 2019-06-24T18:10:44+0000
/project/yagmail/, yagmail, 0.14.247, Yet Another GMAIL client, 2021-03-31T13:01:45+0000
/project/django-fab/, django-fab, 1.0.4, Common methods to help create fabric deplopment scripts for django, 2009-10-13T04:34:19+0000
/project/mr-parker/, mr.parker, 1.0, Ensures that the PyPI bus factor for a package is above a certain threshold., 2009-10-31T14:43:22+0000
/project/pexe37/, pexe37, 0.9.6.5, Python to Exe, 2019-12-17T04:49:09+0000
