/project/monet-calendar-location/, monet.calendar.location, 0.4.1, Add Italian features to monet.calendar.event, 2012-01-04T09:48:44+0000
/project/redturtle-sqlcontents/, redturtle.sqlcontents, 0.9.1, RedTurtle - SQL Contents, 2013-07-29T10:10:19+0000
/project/redturtle-portlets-inspector/, redturtle.portlets.inspector, 1.0.0, Redturtle Portlets Inspector, 2013-11-26T13:29:48+0000
/project/iw-rejectanonymous/, iw.rejectanonymous, 1.2.5, Disallow access to a Plone site and its children if user is anonymous, 2019-10-18T07:57:47+0000
/project/collective-singing/, collective.singing, 0.7.6, A Zope 3 library for sending notifications and newsletters, 2019-10-22T13:56:00+0000
/project/collective-contentrules-mailtorole/, collective.contentrules.mailtorole, 1.7, Send e-mail to users having a role on the object, 2013-08-12T09:32:02+0000
/project/products-reflecto/, Products.Reflecto, 3.0.6, Access the filesystem from Plone, 2014-06-05T21:11:00+0000
/project/products-ploneglossary/, Products.PloneGlossary, 1.7.3, Highlight Plone content terms, mouseover shows the term definition as tooltip., 2017-04-11T15:54:03+0000
/project/collective-brasil-vocab/, collective.brasil.vocab, 0.8, A Zope 3 vocabulary implementation of brasil.vocab, 2011-12-21T01:04:47+0000
/project/products-plonearticle/, Products.PloneArticle, 4.2.0, A Plone document including images, attachments and links, with a free choice of layout., 2012-02-08T15:15:26+0000
/project/collective-tablepage/, collective.tablepage, 0.10.6, A Plone page with an editable table as main content, 2015-07-31T13:47:06+0000
/project/zopehealthwatcher/, ZopeHealthWatcher, 0.9.0, ZopeHealthWatcher allows you to monitor and debug the threads of a Zope application., 2016-01-03T12:33:20+0000
/project/rt-atmigrator/, rt.atmigrator, 0.1.0, A tool that allows to migrate objects from a content-type to another, 2013-03-12T14:32:10+0000
/project/quintagroup-z3cform-captcha/, quintagroup.z3cform.captcha, 1.0.3, Captcha field for z3cform based on quintagroup.captcha.core package, 2013-07-19T12:21:06+0000
/project/zest-commentcleanup/, zest.commentcleanup, 1.6, Quickly remove lots of spam comments from your Plone Site, 2013-05-13T12:56:11+0000
/project/products-extrememanagement/, Products.eXtremeManagement, 2.1, Project administration which supports the eXtreme Programming methodology., 2016-08-01T06:50:10+0000
/project/collective-powertoken-core/, collective.powertoken.core, 0.3.0, A mechanism for bypass Plone security, performing operations normally unauthorized, if a secret token is know (core package), 2012-02-15T14:46:27+0000
/project/pas-plugins-memberpropertytogroup/, pas.plugins.memberpropertytogroup, 1.1, Plone PAS plugin to create virtual groups based on member properties., 2018-03-05T14:44:11+0000
/project/products-addremovewidget/, Products.AddRemoveWidget, 1.5.2, AddRemoveWidget + ComboBoxWidget for Plone, 2017-01-31T11:13:22+0000
/project/products-signupsheet/, Products.SignupSheet, 0.6.1, A signup sheet implementation for Plone, 2012-01-09T15:09:05+0000
/project/collective-dancefloor/, collective.dancefloor, 1.0.3, S&D extension to allow local newsletters, 2015-12-02T16:22:29+0000
/project/collective-cdn-multiplehostnames/, collective.cdn.multiplehostnames, 0.6, Multiple Hostnames CDN support for Plone, 2012-08-01T19:26:20+0000
/project/auslfe-formonline-content/, auslfe.formonline.content, 0.8.1, The Form Online content type for Plone, 2012-10-03T14:03:10+0000
/project/auslfe-formonline-tokenaccess/, auslfe.formonline.tokenaccess, 0.3.1, Plone add-on that enable anonymous use (with secret token) of auslfe.formonline features, 2012-02-15T16:35:32+0000
/project/quintagroup-plonecomments/, quintagroup.plonecomments, 4.1.9, Plone Comments, 2013-01-16T11:00:38+0000
/project/collective-cdn-core/, collective.cdn.core, 0.6, CDN support for Plone, 2012-08-01T18:02:37+0000
/project/redturtle-video/, redturtle.video, 1.1.1, Video content types for Plone; use collective.flowplayer but also pluggable with external services. - Forward compatibility shim version, for easily migrate to wildcard.media, 2015-08-17T09:01:44+0000
/project/redturtle-portlet-collection/, redturtle.portlet.collection, 1.0.0, A simple collection portlet for Plone, where you manually choose your skins template id, 2017-09-13T15:28:46+0000
/project/collective-cutandpaste/, collective.cutandpaste, 1.1, for copy and paste items for plone with an csv file, 2011-12-14T14:03:54+0000
/project/zest-social/, zest.social, 1.3, Zest Social Bookmarking, 2012-09-12T16:07:54+0000
/project/quintagroup-seoptimizer/, quintagroup.seoptimizer, 4.3, Quintagroup Search Engine Optimization Tool, 2013-09-18T11:34:05+0000
/project/collective-sendaspdf/, collective.sendaspdf, 3.0, An open source product for Plone to download or email a page seen by the user as a PDF file., 2015-06-24T17:28:45+0000
/project/collective-contextualcontactinfo/, collective.contextualcontactinfo, 0.1.0, Add the information about the context in contact-info message of your Plone Site, 2012-06-15T09:09:16+0000
/project/products-maps/, Products.Maps, 3.3, A simple, easy to use Plone integration with Google Maps, 2013-04-05T15:39:46+0000
/project/collective-portlet-colorcollection/, collective.portlet.colorcollection, 0.3.0, Replace some code of the Plone collection portlet to add links color, 2013-02-13T16:49:14+0000
/project/redturtle-custommenu-factories/, redturtle.custommenu.factories, 0.3.1, Customize the Plone "add portal content" menu, 2015-02-24T11:30:18+0000
/project/collective-contacts/, collective.contacts, 1.5.2, Address book product for Plone, 2012-06-12T18:02:37+0000
/project/collective-sortmyfolder/, collective.sortmyfolder, 1.0.7, Reveal some not-so-hidden Plone feature for sorting your folders, 2014-04-08T07:39:06+0000
/project/collective-csv2atvocabularymanager/, collective.csv2atvocabularymanager, 0.1.1, Plone utility for importing your ATVocabularyManager vocabularies from CSV sources (with LinguaPlone support), 2012-11-13T09:05:35+0000
/project/slc-linguatools/, slc.linguatools, 1.4.4, A set of tools that simplify handling multilingual content in Plone based on LinguaPlone, 2013-12-06T14:43:01+0000
/project/collective-easyslider/, collective.easyslider, 1.4.1, The product will allow you to apply an easyslider to any page with the ability to create each slide using a WYSIWYG editor. It also provides a slider view for Folders and Collections., 2014-01-14T02:53:43+0000
/project/collective-emaillogin/, collective.emaillogin, 1.3, Allow logins with email address rather than login name., 2012-09-24T16:13:04+0000
/project/mr-inquisition/, mr.inquisition, 0.2, A package to help with exploring a Plone site., 2015-08-04T10:47:25+0000
/project/collective-unresettableuser/, collective.unresettableuser, 0.2.0, Additional option for Plone users, that make the reset password operation not available, 2012-02-03T08:31:18+0000
/project/cciaa-portlet-calendar/, cciaa.portlet.calendar, 1.3.0, Alternative calendar portlet for Plone that perform some additional search, 2013-11-20T15:37:46+0000
/project/collective-portlet-discussion/, collective.portlet.discussion, 1.2.6, A simple Plone portlet to show a list of comments, 2019-05-13T12:39:30+0000
/project/rer-giunta/, rer.giunta, 1.1.3, An Archetype for alderman informations, 2015-12-03T12:30:58+0000
/project/adi-bookmark/, adi.bookmark, 0.2, Store bookmarks to a Plone-site or -folder., 2017-04-27T12:59:44+0000
/project/products-atvocabularymanager/, Products.ATVocabularyManager, 1.6.7, Vocabulary library Plone. Central, Pluggable, TTW, with IMS VDEX Support, 2015-07-30T11:29:20+0000
/project/quintagroup-dropdownmenu/, quintagroup.dropdownmenu, 1.3.4, Multilevel portal dropdown menu for Plone sites., 2015-06-09T12:43:51+0000
/project/mr-inquisition/, mr.inquisition, 0.2, A package to help with exploring a Plone site., 2015-08-04T10:47:25+0000
/project/collective-unresettableuser/, collective.unresettableuser, 0.2.0, Additional option for Plone users, that make the reset password operation not available, 2012-02-03T08:31:18+0000
/project/cciaa-portlet-calendar/, cciaa.portlet.calendar, 1.3.0, Alternative calendar portlet for Plone that perform some additional search, 2013-11-20T15:37:46+0000
/project/collective-portlet-discussion/, collective.portlet.discussion, 1.2.6, A simple Plone portlet to show a list of comments, 2019-05-13T12:39:30+0000
/project/rer-giunta/, rer.giunta, 1.1.3, An Archetype for alderman informations, 2015-12-03T12:30:58+0000
/project/adi-bookmark/, adi.bookmark, 0.2, Store bookmarks to a Plone-site or -folder., 2017-04-27T12:59:44+0000
/project/pas-plugins-aselect/, pas.plugins.aselect, 1.5, PAS Plugin for authentication with A-Select, 2012-10-14T01:44:00+0000
/project/collective-itvalidators/, collective.itvalidators, 1.0.0, A set of Archetypes validators for Plone, some for Italian specific needs, others useful for all, 2012-11-12T13:51:19+0000
/project/collective-relateditems/, collective.relateditems, 0.1.0, Backporting Plone 4 related items viewlet into Plone 3, 2011-12-29T22:14:21+0000
/project/collective-sortmyfolder/, collective.sortmyfolder, 1.0.7, Reveal some not-so-hidden Plone feature for sorting your folders, 2014-04-08T07:39:06+0000
/project/collective-ptg-flickr/, collective.ptg.flickr, 0.1.1, Add on collective.plonetruegallery to aggregate from flickr, 2012-11-07T15:19:42+0000
/project/collective-csv2atvocabularymanager/, collective.csv2atvocabularymanager, 0.1.1, Plone utility for importing your ATVocabularyManager vocabularies from CSV sources (with LinguaPlone support), 2012-11-13T09:05:35+0000
/project/slc-linguatools/, slc.linguatools, 1.4.4, A set of tools that simplify handling multilingual content in Plone based on LinguaPlone, 2013-12-06T14:43:01+0000
/project/collective-easyslider/, collective.easyslider, 1.4.1, The product will allow you to apply an easyslider to any page with the ability to create each slide using a WYSIWYG editor. It also provides a slider view for Folders and Collections., 2014-01-14T02:53:43+0000
