/project/bob-paper-btas-c2016/, bob.paper.btas_c2016, 1.0.3, Package for BTAS Speaker Anti-spoofing Competition, 2016-09-07T19:51:52+0000
/project/xfacereclib-extension-csu/, xfacereclib.extension.CSU, 2.0.0, Wrapper classes to use the PythonFaceEvaluation classes from the CSU Face Recognition Resources, 2014-12-11T17:15:15+0000
/project/bob-db-hci-tagging/, bob.db.hci-tagging, 1.1.6, Mahnob HCI-Tagging Database Access API for Bob, 2020-10-02T12:30:14+0000
/project/bob-ip-flandmark/, bob.ip.flandmark, 2.1.12, Flandmark keypoint localization library, 2020-10-01T20:44:57+0000
/project/bob-buildout/, bob.buildout, 2.3.0, A collection of zc.buildout recipes for Bob packages, 2021-04-13T12:07:05+0000
/project/bob-bio-vein/, bob.bio.vein, 2.0.0, Vein Recognition Library, 2021-04-13T18:24:21+0000
/project/bob-measure/, bob.measure, 4.2.3, Evaluation metrics for Bob, 2021-04-13T13:08:01+0000
/project/bob-chapter-frice/, bob.chapter.FRICE, 1.0.3, Running the experiments as described in the boock chapter "Face Recognition in Challenging Environments: An Experimental and Reproducible Research Survey", 2016-02-19T22:34:15+0000
/project/bob-paper-tifs2018-dsu/, bob.paper.tifs2018-dsu, 1.0.2, Tools to reproduce the paper "Heterogeneous Face Recognition Using Domain Specific Units", 2019-01-14T14:17:17+0000
/project/bob-learn-pytorch/, bob.learn.pytorch, 0.2.0, Bob bindings for PyTorch, 2021-04-13T19:14:06+0000
/project/bob-db-drive/, bob.db.drive, 1.0.1, DRIVE Database Access API for Bob, 2020-02-18T01:58:24+0000
/project/bob-db-drishtigs1/, bob.db.drishtigs1, 1.0.1, Drishti-GS1 Database Access API for Bob, 2020-02-18T03:03:24+0000
/project/facereclib/, facereclib, 2.1.2, Compare a variety of face recognition algorithms by running them on many image databases with default protocols., 2016-03-29T16:12:27+0000
/project/bob-db-mobio/, bob.db.mobio, 2.2.6, MOBIO Database Access API for Bob, 2020-10-02T14:54:39+0000
/project/bob-bio-csu/, bob.bio.csu, 2.0.4, Wrapper classes to use the PythonFaceEvaluation classes from the CSU Face Recognition Resources, 2016-09-22T15:51:37+0000
/project/bob-paper-taslp-2017/, bob.paper.taslp-2017, 1.0.12, Presentation Attack Detection Using Long Term Spectral Statistics for Trustworthy Speaker Verification, 2017-11-28T14:29:57+0000
/project/bob-db-casme2/, bob.db.casme2, 2.1.12, CASME2  Database Access API for Bob, 2020-10-02T11:13:46+0000
/project/bob-paper-isba2018-pad-dnn/, bob.paper.isba2018-pad-dnn, 1.0.2, "On the Use of Convolutional Neural Networks for Speech Presentation Attack Detection" published in ISBA 2018, 2018-10-08T11:51:10+0000
/project/bob-ip-facedetect/, bob.ip.facedetect, 4.0.0, Face detection using boosted LBP features, 2021-04-13T16:29:18+0000
/project/bob-learn-linear/, bob.learn.linear, 2.1.9, Linear Machine and Trainers for Bob, 2021-04-13T15:06:18+0000
/project/bob-thesis-tiago/, bob.thesis.tiago, 1.0.1, Tools to reproduce the experiments of the Ph.D. thesis from Tiago de Freitas Pereira, 2019-01-14T13:54:55+0000
/project/bob-db-youtube/, bob.db.youtube, 2.1.10, Youtube Faces Database Access API for Bob, 2020-10-02T18:44:39+0000
/project/bob-blitz/, bob.blitz, 2.0.23, Bindings for Blitz++ (a C++ array template library), 2021-04-13T12:25:49+0000
/project/bob-db-casiasurf/, bob.db.casiasurf, 1.0.3, Bob Database interface for the CASIA-SURF database, 2020-10-02T19:17:49+0000
/project/bob-db-siw/, bob.db.siw, 0.0.2, SIW Database Access in Bob, 2020-10-05T16:01:22+0000
/project/bob-ip-caffe-extractor/, bob.ip.caffe-extractor, 2.0.3, Feature extractor using caffe CNNs, 2019-10-30T08:26:32+0000
/project/bob-pad-vein/, bob.pad.vein, 1.0.5, Implements tools for spoofing or presentation attack detection in vein biometrics, 2020-10-02T22:06:49+0000
/project/xbob-buildout/, xbob.buildout, 1.0.4, zc.buildout recipes to perform a variety of tasks required by Bob satellite packages, 2015-09-24T10:12:09+0000
/project/bob-db-mnist/, bob.db.mnist, 2.2.7, MNIST Database Access API for Bob, 2021-04-13T16:02:19+0000
/project/bob-ip-gabor/, bob.ip.gabor, 2.0.18, Gabor wavelet analysis tools for Bob, 2021-04-13T14:45:36+0000
/project/bob-io-base/, bob.io.base, 3.0.10, Basic IO for Bob, 2021-04-13T12:47:27+0000
/project/bob-bio-face-ongoing/, bob.bio.face-ongoing, 1.0.7, Tools for running face recognition experiments, 2020-10-03T17:26:35+0000
/project/bob-db-wine/, bob.db.wine, 2.0.15, Wine Database for bob, 2020-10-01T19:27:04+0000
/project/bob-io-audio/, bob.io.audio, 2.0.14, Audio I/O support for Bob, 2021-04-13T13:49:02+0000
/project/bob-db-gbu/, bob.db.gbu, 2.1.10, Database Access API of the Good, the Bad and the Ugly (GBU) image database for Bob, 2020-10-02T11:54:08+0000
/project/bob-paper-scia2015/, bob.paper.SCIA2015, 2.0.4, Source code for regenerating the results of the paper "Gender Classification by LUT based boosting of Overlapping Block Patterns", 2016-05-27T16:23:01+0000
/project/bob-db-replaymobile/, bob.db.replaymobile, 1.1.9, Replay-Mobile Database Access API for Bob, 2020-10-02T15:58:47+0000
/project/bob-db-refuge/, bob.db.refuge, 1.0.1, REFUGE Database Access API for Bob, 2020-02-18T02:52:44+0000
/project/bob-ip-facelandmarks/, bob.ip.facelandmarks, 1.0.10, Bob wrapper for Menpo's face keypoint detector, 2020-10-02T09:01:59+0000
/project/bob-db-verification-utils/, bob.db.verification.utils, 2.0.8, Utilities for bob.db verification databases, 2016-07-14T11:50:50+0000
/project/bob-math/, bob.math, 3.1.8, Mathematical functions of Bob, 2021-04-13T12:57:46+0000
/project/bob-learn-misc/, bob.learn.misc, 2.0.1, Bindings for miscelaneous machines and trainers of Bob, 2015-01-24T11:31:25+0000
/project/bob-bio-spear/, bob.bio.spear, 3.2.6, Tools for running speaker recognition experiments, 2020-10-02T20:30:58+0000
/project/bob-paper-jstsp-2017/, bob.paper.jstsp_2017, 1.0.0, Impact of score fusion on voice biometrics and presentation attack detection in cross-database evaluations, 2017-04-03T15:44:58+0000
/project/bob-ip-pytorch-extractor/, bob.ip.pytorch-extractor, 0.0.2, Extract features from images using (C)NN built with pyTorch, 2018-05-25T10:34:09+0000
/project/bob-db-chasedb1/, bob.db.chasedb1, 1.0.1, CHASE_DB1 Database Access API for Bob, 2020-02-18T02:15:04+0000
/project/bob-hobpad2-chapter19/, bob.hobpad2.chapter19, 1.0.1, Software package to reproduce Evaluation Methodologies for Biometric Presentation Attack Detection chapter of Handbook of Biometric Anti-Spoofing: Presentation Attack Detection 2nd Edition, 2018-10-08T09:33:06+0000
/project/bob-io-image/, bob.io.image, 2.5.0, Image I/O support for Bob, 2021-04-13T13:19:29+0000
/project/antispoofing-utils/, antispoofing.utils, 2.0.7, Utility package for anti-spoofing countermeasures, 2015-11-26T19:27:44+0000
/project/bob-bio-htface/, bob.bio.htface, 1.0.6, Tools for running heterogeneous face recognition experiments, 2020-10-03T18:36:23+0000
/project/bob-ip-base/, bob.ip.base, 2.2.7, Basic Image Processing Utilities for Bob, 2021-04-13T14:25:09+0000
/project/bob-db-avspoof/, bob.db.avspoof, 2.3.5, Audio AVspoof Attack Database Access API for Bob, 2020-10-02T10:20:36+0000
/project/bob-db-replay/, bob.db.replay, 3.0.9, Replay Attack Database Access API for Bob, 2020-10-02T15:47:38+0000
/project/bob-core/, bob.core, 2.2.7, Core utilities required on all Bob modules, 2021-04-13T12:35:57+0000
/project/bob-ip-skincolorfilter/, bob.ip.skincolorfilter, 0.0.9, Skin color filter in the rg colorspace, 2020-10-02T08:52:27+0000
/project/bob-db-verification-filelist/, bob.db.verification.filelist, 2.0.3, Verification File List Database Access API for Bob, 2015-11-26T15:43:28+0000
/project/bob-db-nist-sre12/, bob.db.nist-sre12, 3.0.9, Speaker verification protocol on the NIST SRE 2012, 2020-10-02T15:27:45+0000
/project/xfacereclib-paper-iet2015/, xfacereclib.paper.IET2015, 1.0.1, Source code to reproduce the paper "Impact of Eye Detection Error on Face Recognition Performance", 2015-04-28T16:10:11+0000
/project/bob-db-base/, bob.db.base, 3.1.0, Basic Database Frontend API for Bob, 2021-04-13T13:27:23+0000
/project/bob-paper-isba2018-entropy/, bob.paper.isba2018-entropy, 1.0.3, Calculating the entropy of fingervein patterns, 2017-10-31T08:10:12+0000
/project/bob-ip-optflow-liu/, bob.ip.optflow.liu, 2.0.18, Ce Liu's Optical Flow Framework for Bob, 2020-10-01T20:36:01+0000
/project/xfacereclib-paper-befit2012/, xfacereclib.paper.BeFIT2012, 1.0.0, Running the face recognition experiments as given in paper: "An Open Source Framework for Standardized Comparisons of Face Recognition Algorithms"., 2013-07-05T11:20:43+0000
/project/bob-db-cbsr-nir-vis-2/, bob.db.cbsr-nir-vis-2, 2.0.7, CASIA NIR-VIS 2.0 Face Database protocol, 2020-10-02T23:05:40+0000
/project/bob-paper-biosig2017-3dmaskprestudy/, bob.paper.biosig2017-3dmaskprestudy, 1.0.0, Package for BioSIG-2017 paper on Extended-Range imaging for 3D-Mask PAD., 2017-10-23T15:34:01+0000
/project/bob-db-verapalm/, bob.db.verapalm, 2.0.0, VERA Palmvein Database Access API for Bob, 2016-03-04T12:54:08+0000
/project/bob-db-asvspoof/, bob.db.asvspoof, 1.2.5, ASVspoof Database Access API for Bob, 2020-10-02T09:44:10+0000
/project/bob-db-livdet2013/, bob.db.livdet2013, 2.1.5, LivDet 2013 Fingerprint database access for Bob, 2020-10-02T14:30:20+0000
/project/bob-palmvein/, bob.palmvein, 2.0.0a1, Palmvein recognition based on Bob and the facereclib, 2015-05-21T07:26:29+0000
/project/bob-db-putvein/, bob.db.putvein, 1.3.6, PUT Vein Database Access API for Bob, 2020-10-02T15:40:17+0000
/project/bob-learn-libsvm/, bob.learn.libsvm, 2.1.6, Python bindings to LIBSVM for Bob, 2021-04-13T15:15:53+0000
/project/bob-db-maskattack/, bob.db.maskattack, 0.0.5, Bob Database interface for the 3DMAD database, 2020-10-02T19:02:59+0000
/project/bob-db-iostar/, bob.db.iostar, 1.0.1, IOSTAR Database Access API for Bob, 2020-02-18T02:24:53+0000
/project/bob-ip-tensorflow-extractor/, bob.ip.tensorflow-extractor, 0.0.7, Feature extractor using tensorflow CNNs, 2020-10-03T15:30:34+0000
/project/bob-bio-video/, bob.bio.video, 4.0.0, Run biometric recognition algorithms on videos, 2021-04-13T18:11:09+0000
/project/bob-ip-draw/, bob.ip.draw, 2.0.15, Line and Box drawing utilities of Bob, 2020-10-01T17:27:29+0000
/project/bob-db-brsu/, bob.db.brsu, 0.0.1, Bob's interface for the BRSU Multispectral Face/Skin Database, 2019-12-04T16:01:37+0000
/project/bob-learn-mlp/, bob.learn.mlp, 2.2.6, Multi-layer Perceptron and Trainers for Bob, 2018-03-29T23:26:17+0000
/project/bob-db-asvspoof2017/, bob.db.asvspoof2017, 1.1.5, ASVspoof2017 Database Access API for Bob, 2020-10-02T09:51:19+0000
/project/bob-db-uvad/, bob.db.uvad, 0.0.6, UVAD Database Access in Bob, 2020-10-02T22:38:18+0000
/project/bob-db-ijba/, bob.db.ijba, 2.1.6, IJB-A Database Access API for Bob, 2020-10-02T12:46:38+0000
/project/bob-db-verafinger/, bob.db.verafinger, 2.0.6, VERA Fingervein Database Access API for Bob, 2020-10-02T16:26:49+0000
/project/xbob-db-casme2/, xbob.db.casme2, 1.0.0, CASME2  Database Access API for Bob, 2015-05-12T16:07:49+0000
/project/bob-ip-qualitymeasure/, bob.ip.qualitymeasure, 1.1.7, Image-quality feature-extractors for PAD applications, 2021-04-13T16:49:38+0000
/project/bob-ip-optflow-hornschunck/, bob.ip.optflow.hornschunck, 2.0.19, Optical Flow framework based on Horn & Schunck, 2020-10-01T20:17:25+0000
/project/bob-db-frgc/, bob.db.frgc, 2.1.9, Database Access API of the Face Recognition Grand Challenge (FRGC) ver2.0 image database for Bob, 2020-10-02T11:41:38+0000
/project/bob-db-oulunpu/, bob.db.oulunpu, 0.1.2, OULU-NPU Database Access in Bob, 2020-10-02T22:24:17+0000
/project/bob-bio-base/, bob.bio.base, 5.0.0, Tools for running biometric recognition experiments, 2021-04-13T17:20:43+0000
/project/bob-db-kboc16/, bob.db.kboc16, 2.1.5, KBOC16 Database Access API for Bob, 2020-10-02T14:14:18+0000
/project/bob-paper-interspeech-2016/, bob.paper.interspeech_2016, 1.0.12, Cross-database evaluation of audio-based spoofing detection systems, 2018-10-22T13:21:58+0000
/project/bob-db-casia-fasd/, bob.db.casia-fasd, 2.0.10, CASIA Face Anti-Spoofing Database Access API for Bob, 2020-10-02T11:06:07+0000
/project/bob-db-rimoner3/, bob.db.rimoner3, 1.0.1, RIM-ONE r3 Database API for Bob, 2020-02-18T02:36:54+0000
/project/bob-pad-base/, bob.pad.base, 3.0.0, A framework for executing the chain of presentation attack detection (PAD) experiments, 2021-04-13T18:35:26+0000
/project/bob-db-iris/, bob.db.iris, 2.1.8, Bob access API for Fisher's Iris Flower Dataset, 2021-04-13T15:38:39+0000
/project/bob-io-video/, bob.io.video, 3.0.4, Video I/O support for Bob, 2021-04-13T13:38:40+0000
/project/bob-bio-caffe-face/, bob.bio.caffe-face, 1.1.3, Face Feature extraction using caffe pre-trained models, 2019-10-30T08:33:42+0000
/project/bob-ip-binseg/, bob.ip.binseg, 1.2.0, Binary Segmentation Benchmark Package for Bob, 2021-04-13T19:35:43+0000
/project/bob-rppg-base/, bob.rppg.base, 2.0.6, Baseline Algorithms for Remote Photoplethysmography (rPPG), 2020-10-02T21:08:40+0000
/project/xfacereclib-paper-iet2014/, xfacereclib.paper.IET2014, 1.0.0, Running the experiments as given in paper:, 2013-12-02T12:01:48+0000
/project/bob-pad-voice/, bob.pad.voice, 1.0.10, Package extends bob.pad.base for attack detection in speech, 2020-10-02T21:58:18+0000
/project/bob-db-bio-filelist/, bob.db.bio_filelist, 2.1.1, Verification File List Database Access API for Bob, 2016-10-06T05:44:56+0000
/project/bob-ip-mtcnn/, bob.ip.mtcnn, 1.0.3, Face detection and landmark extraction using MTCNN pretrained model, 2019-10-29T12:30:50+0000
/project/bob-ip-annotator/, bob.ip.annotator, 1.0.1, A TkInter-based keypoint annotation tool for images, 2019-02-05T11:08:38+0000
/project/bob-example-cmake/, bob.example.cmake, 1.0.1, Example project using Bob C++ interface, 2016-06-06T05:51:20+0000
/project/bob-db-avspoof-btas2016/, bob.db.avspoof_btas2016, 1.0.1, Audio AVspoof Attack Database Access API for BTAS 2016 Speaker Anti-spoofing Competition, 2016-03-24T15:52:52+0000
/project/bob-paper-icb2015/, bob.paper.ICB2015, 2.0.0a0, Running the experiments as given in paper: "On the Vulnerability of Palm Vein Recognition to Spoofing Attacks"., 2015-05-03T18:35:17+0000
/project/bob-ip-color/, bob.ip.color, 2.0.17, Color Conversion Utilities of Bob, 2021-04-13T14:34:15+0000
/project/bob-paper-biosig2016-replaymobile/, bob.paper.biosig2016_replaymobile, 1.0.4, Package for BioSIG-2016 paper on Replay-Mobile database., 2016-09-20T14:51:31+0000
/project/bob-io-matlab/, bob.io.matlab, 2.0.17, Handling of Matlab(R) files via bob.io.base, 2020-10-01T16:12:33+0000
/project/bob-db-drionsdb/, bob.db.drionsdb, 1.0.1, DRIONS-DB Database Access API for Bob, 2020-02-18T02:43:05+0000
/project/bob-db-arface/, bob.db.arface, 2.1.10, AR Face  Database Access API for Bob, 2020-10-02T09:26:09+0000
/project/bob-learn-activation/, bob.learn.activation, 2.0.17, Bindings for Activation functors, 2021-04-13T14:55:27+0000
/project/bob-bio-pericrosseye-competition/, bob.bio.pericrosseye_competition, 1.0.2, This package contains the scripts to reproduce the experiments of the 2nd Cross-Spectrum Iris/Periocular Recognition competition, 2017-04-10T20:58:50+0000
/project/bob-paper-interspeech-2016/, bob.paper.interspeech_2016, 1.0.12, Cross-database evaluation of audio-based spoofing detection systems, 2018-10-22T13:21:58+0000
/project/bob-db-fv3d/, bob.db.fv3d, 1.1.6, 3D Fingervein Database Access API for Bob, 2020-10-02T16:42:30+0000
/project/bob-db-xm2vts/, bob.db.xm2vts, 2.1.10, XM2VTS Database Access API for Bob, 2020-10-02T18:36:59+0000
/project/bob-db-msu-mfsd-mod/, bob.db.msu-mfsd-mod, 2.2.9, MSU Mobile Face Spoofing Database Access API for Bob, with modified protocol, 2020-10-02T15:02:43+0000
/project/bob-db-voxforge/, bob.db.voxforge, 2.3.6, Speaker verification protocol on a subset of the VoxForge database, 2020-10-02T20:59:57+0000
/project/bob-db-scface/, bob.db.scface, 2.1.11, SCface Database Access API for Bob, 2020-10-02T16:06:08+0000
/project/bob-pipelines/, bob.pipelines, 1.0.0, Tools to build robust and extensible pipelines, 2021-04-13T17:00:47+0000
/project/bob-extension/, bob.extension, 6.0.0, Building of Python/C++ extensions for Bob, 2021-04-13T12:14:16+0000
/project/bob-ip-mtcnn/, bob.ip.mtcnn, 1.0.3, Face detection and landmark extraction using MTCNN pretrained model, 2019-10-29T12:30:50+0000
/project/bob-ip-annotator/, bob.ip.annotator, 1.0.1, A TkInter-based keypoint annotation tool for images, 2019-02-05T11:08:38+0000
/project/bob-example-cmake/, bob.example.cmake, 1.0.1, Example project using Bob C++ interface, 2016-06-06T05:51:20+0000
/project/bob-db-avspoof-btas2016/, bob.db.avspoof_btas2016, 1.0.1, Audio AVspoof Attack Database Access API for BTAS 2016 Speaker Anti-spoofing Competition, 2016-03-24T15:52:52+0000
/project/bob-paper-icb2015/, bob.paper.ICB2015, 2.0.0a0, Running the experiments as given in paper: "On the Vulnerability of Palm Vein Recognition to Spoofing Attacks"., 2015-05-03T18:35:17+0000
/project/bob-ip-color/, bob.ip.color, 2.0.17, Color Conversion Utilities of Bob, 2021-04-13T14:34:15+0000
/project/bob-paper-biosig2016-replaymobile/, bob.paper.biosig2016_replaymobile, 1.0.4, Package for BioSIG-2016 paper on Replay-Mobile database., 2016-09-20T14:51:31+0000
/project/bob-io-matlab/, bob.io.matlab, 2.0.17, Handling of Matlab(R) files via bob.io.base, 2020-10-01T16:12:33+0000
/project/bob-db-drionsdb/, bob.db.drionsdb, 1.0.1, DRIONS-DB Database Access API for Bob, 2020-02-18T02:43:05+0000
/project/bob-ip-dlib/, bob.ip.dlib, 1.0.9, Bob interface for dlib functions, 2020-10-02T09:18:57+0000
/project/bob-example-faceverify/, bob.example.faceverify, 2.1.2, Example for using Bob to create three distinct face verification systems, 2015-11-26T19:32:06+0000
/project/bob-db-biosecurid-face/, bob.db.biosecurid.face, 2.1.14, BiosecurID (face) Database Access API for Bob, 2020-10-02T10:58:26+0000
/project/bob-db-fargo/, bob.db.fargo, 1.0.5, Bob Database interface for the FARGO database, 2020-10-02T19:31:37+0000
/project/bob-hobpad2-chapter20/, bob.hobpad2.chapter20, 1.0.2, Software package to reproduce Evaluation Methodologies for Biometric Presentation Attack Detection chapter of Handbook of Biometric Anti-Spoofing: Presentation Attack Detection 2nd Edition, 2018-12-11T11:15:28+0000
/project/bob-pad-face/, bob.pad.face, 3.0.0, Implements tools for spoofing or presentation attack detection in face biometrics, 2021-04-13T18:47:59+0000
/project/bob-db-hrf/, bob.db.hrf, 1.0.1, HRF Database Access API for Bob, 2020-02-18T02:30:54+0000
/project/bob-sp/, bob.sp, 2.0.17, Core signal processing utilities for Bob, 2021-04-13T13:59:55+0000
/project/bob-db-swan/, bob.db.swan, 0.0.4, SWAN Database Access API for Bob, 2020-10-02T22:48:08+0000
/project/bob-learn-boosting/, bob.learn.boosting, 2.0.19, Boosting framework for Bob, 2020-10-01T18:54:47+0000
/project/bob-db-caspeal/, bob.db.caspeal, 2.1.11, CAS-PEAL Database Access API for Bob, 2020-10-02T11:21:06+0000
/project/bob-db-fv3d/, bob.db.fv3d, 1.1.6, 3D Fingervein Database Access API for Bob, 2020-10-02T16:42:30+0000
/project/bob-db-ijbc/, bob.db.ijbc, 1.0.4, IJB-C Database Access API for Bob, 2020-10-02T14:02:11+0000
/project/bob-fusion-base/, bob.fusion.base, 0.0.6, Score fusion in biometric and pad experiments, 2021-04-13T18:58:19+0000
/project/bob-db-banca/, bob.db.banca, 2.1.11, BANCA Database Access API for Bob, 2020-10-02T10:34:07+0000
/project/bob-paper-btas-j2016/, bob.paper.btas_j2016, 1.0.3, Package for BTAS 2016 paper on ASV-PAD systems, 2017-08-28T14:38:24+0000
/project/bob-db-xm2vts/, bob.db.xm2vts, 2.1.10, XM2VTS Database Access API for Bob, 2020-10-02T18:36:59+0000
/project/bob-db-msu-mfsd-mod/, bob.db.msu-mfsd-mod, 2.2.9, MSU Mobile Face Spoofing Database Access API for Bob, with modified protocol, 2020-10-02T15:02:43+0000
/project/bob-db-voxforge/, bob.db.voxforge, 2.3.6, Speaker verification protocol on a subset of the VoxForge database, 2020-10-02T20:59:57+0000
/project/bob-db-scface/, bob.db.scface, 2.1.11, SCface Database Access API for Bob, 2020-10-02T16:06:08+0000
/project/bob-pipelines/, bob.pipelines, 1.0.0, Tools to build robust and extensible pipelines, 2021-04-13T17:00:47+0000
/project/bob-extension/, bob.extension, 6.0.0, Building of Python/C++ extensions for Bob, 2021-04-13T12:14:16+0000
/project/bob-hobpad2-veins/, bob.hobpad2.veins, 1.0.2, Software package to reproduce experiments of Chapter 18, "An Introduction to Vein Presentation Attacks and Detection" of the "Handbook of Biometric Anti-Spoofing: Presentation Attack Detection 2nd Edition" book, 2018-10-18T09:21:08+0000
/project/bob-db-batl/, bob.db.batl, 1.0.0, Implements a low-level database interface for the BATL database, which is designed for spoofing or presentation attack detection experiments in face biometrics., 2020-02-27T14:19:41+0000
/project/bob-db-atvskeystroke/, bob.db.atvskeystroke, 2.1.11, ATVS-Keystroke Database Access API for Bob, 2020-10-02T10:03:27+0000
/project/bob-db-cohface/, bob.db.cohface, 1.1.6, COHFACE Database Access API for Bob, 2020-10-02T11:29:09+0000
/project/bob-paper-btas-c2016/, bob.paper.btas_c2016, 1.0.3, Package for BTAS Speaker Anti-spoofing Competition, 2016-09-07T19:51:52+0000
/project/xfacereclib-extension-csu/, xfacereclib.extension.CSU, 2.0.0, Wrapper classes to use the PythonFaceEvaluation classes from the CSU Face Recognition Resources, 2014-12-11T17:15:15+0000
/project/bob-db-hci-tagging/, bob.db.hci-tagging, 1.1.6, Mahnob HCI-Tagging Database Access API for Bob, 2020-10-02T12:30:14+0000
/project/bob-ip-flandmark/, bob.ip.flandmark, 2.1.12, Flandmark keypoint localization library, 2020-10-01T20:44:57+0000
/project/bob-buildout/, bob.buildout, 2.3.0, A collection of zc.buildout recipes for Bob packages, 2021-04-13T12:07:05+0000
/project/bob-bio-vein/, bob.bio.vein, 2.0.0, Vein Recognition Library, 2021-04-13T18:24:21+0000
/project/bob-measure/, bob.measure, 4.2.3, Evaluation metrics for Bob, 2021-04-13T13:08:01+0000
/project/bob-chapter-frice/, bob.chapter.FRICE, 1.0.3, Running the experiments as described in the boock chapter "Face Recognition in Challenging Environments: An Experimental and Reproducible Research Survey", 2016-02-19T22:34:15+0000
/project/bob-paper-tifs2018-dsu/, bob.paper.tifs2018-dsu, 1.0.2, Tools to reproduce the paper "Heterogeneous Face Recognition Using Domain Specific Units", 2019-01-14T14:17:17+0000
/project/bob-learn-pytorch/, bob.learn.pytorch, 0.2.0, Bob bindings for PyTorch, 2021-04-13T19:14:06+0000
/project/bob-db-drive/, bob.db.drive, 1.0.1, DRIVE Database Access API for Bob, 2020-02-18T01:58:24+0000
/project/bob-db-drishtigs1/, bob.db.drishtigs1, 1.0.1, Drishti-GS1 Database Access API for Bob, 2020-02-18T03:03:24+0000
/project/bob-learn-linear/, bob.learn.linear, 2.1.9, Linear Machine and Trainers for Bob, 2021-04-13T15:06:18+0000
/project/bob-blitz/, bob.blitz, 2.0.23, Bindings for Blitz++ (a C++ array template library), 2021-04-13T12:25:49+0000
/project/bob-db-casiasurf/, bob.db.casiasurf, 1.0.3, Bob Database interface for the CASIA-SURF database, 2020-10-02T19:17:49+0000
/project/facereclib/, facereclib, 2.1.2, Compare a variety of face recognition algorithms by running them on many image databases with default protocols., 2016-03-29T16:12:27+0000
/project/bob-db-mobio/, bob.db.mobio, 2.2.6, MOBIO Database Access API for Bob, 2020-10-02T14:54:39+0000
/project/bob-db-siw/, bob.db.siw, 0.0.2, SIW Database Access in Bob, 2020-10-05T16:01:22+0000
/project/bob-ip-caffe-extractor/, bob.ip.caffe-extractor, 2.0.3, Feature extractor using caffe CNNs, 2019-10-30T08:26:32+0000
/project/bob-pad-vein/, bob.pad.vein, 1.0.5, Implements tools for spoofing or presentation attack detection in vein biometrics, 2020-10-02T22:06:49+0000
/project/bob-bio-csu/, bob.bio.csu, 2.0.4, Wrapper classes to use the PythonFaceEvaluation classes from the CSU Face Recognition Resources, 2016-09-22T15:51:37+0000
/project/bob-paper-taslp-2017/, bob.paper.taslp-2017, 1.0.12, Presentation Attack Detection Using Long Term Spectral Statistics for Trustworthy Speaker Verification, 2017-11-28T14:29:57+0000
/project/bob-db-casme2/, bob.db.casme2, 2.1.12, CASME2  Database Access API for Bob, 2020-10-02T11:13:46+0000
/project/xbob-buildout/, xbob.buildout, 1.0.4, zc.buildout recipes to perform a variety of tasks required by Bob satellite packages, 2015-09-24T10:12:09+0000
/project/bob-paper-isba2018-pad-dnn/, bob.paper.isba2018-pad-dnn, 1.0.2, "On the Use of Convolutional Neural Networks for Speech Presentation Attack Detection" published in ISBA 2018, 2018-10-08T11:51:10+0000
/project/bob-ip-facedetect/, bob.ip.facedetect, 4.0.0, Face detection using boosted LBP features, 2021-04-13T16:29:18+0000
/project/bob-db-mnist/, bob.db.mnist, 2.2.7, MNIST Database Access API for Bob, 2021-04-13T16:02:19+0000
/project/bob-ip-gabor/, bob.ip.gabor, 2.0.18, Gabor wavelet analysis tools for Bob, 2021-04-13T14:45:36+0000
/project/bob-io-base/, bob.io.base, 3.0.10, Basic IO for Bob, 2021-04-13T12:47:27+0000
/project/bob-thesis-tiago/, bob.thesis.tiago, 1.0.1, Tools to reproduce the experiments of the Ph.D. thesis from Tiago de Freitas Pereira, 2019-01-14T13:54:55+0000
/project/bob-db-youtube/, bob.db.youtube, 2.1.10, Youtube Faces Database Access API for Bob, 2020-10-02T18:44:39+0000
/project/bob-ip-skincolorfilter/, bob.ip.skincolorfilter, 0.0.9, Skin color filter in the rg colorspace, 2020-10-02T08:52:27+0000
/project/bob-db-wine/, bob.db.wine, 2.0.15, Wine Database for bob, 2020-10-01T19:27:04+0000
/project/bob-io-audio/, bob.io.audio, 2.0.14, Audio I/O support for Bob, 2021-04-13T13:49:02+0000
/project/bob-db-verification-filelist/, bob.db.verification.filelist, 2.0.3, Verification File List Database Access API for Bob, 2015-11-26T15:43:28+0000
/project/bob-db-nist-sre12/, bob.db.nist-sre12, 3.0.9, Speaker verification protocol on the NIST SRE 2012, 2020-10-02T15:27:45+0000
