/project/django-cast/, django-cast, 0.1.35, Just another blogging / podcasting package, 2020-10-26T05:35:17+0000
/project/sunflower/, Sunflower, 1.1.0, model transcription factor binding to DNA, 2010-06-08T00:21:08+0000
/project/p5core/, p5core, 0.7.0, Programmer en Python comme un Pro Par la Pratique, 2020-12-11T11:42:32+0000
/project/dosie/, Dosie, 0.0.3, A search engine that makes knowledge a resource, and creates liberation with information sharing, 2019-03-11T13:22:59+0000
/project/mit-18-06-linalg-notes/, mit-18.06-linalg-notes, 2020.9.21.0, MIT 18.06 线性代数笔记, 2020-09-21T04:15:56+0000
/project/iscc-samples/, iscc-samples, 0.4.0, A collection of media files as sample data for ISCC testing., 2021-03-14T15:50:37+0000
/project/pubkeeper-protocol-v1/, pubkeeper.protocol.v1, 1.1.1, Brew, Fill, Consume, 2018-06-12T21:23:30+0000
/project/data-france/, data-france, 0.11.3, Paquet agrégeant des données administratives publiques pour en rendre l'utilisation facile., 2021-03-24T17:49:15+0000
/project/pypkgs-elina/, pypkgs-elina, 0.1.0, "Python package that eases the pain of concatenating Pandas categoricals!", 2021-02-27T06:27:24+0000
/project/python-monetdb/, python-monetdb, 11.19.3.2, Native MonetDB client Python API, 2015-01-07T15:27:09+0000
/project/myt/, myt, 0.5.4, Time, zones, 2021-04-15T12:41:25+0000
/project/hexdoor/, hexdoor, 0.1.0, A colorful terminal hex viewer, 2019-02-14T07:13:03+0000
/project/hybrid-vocal-classifier/, hybrid-vocal-classifier, 0.3.0, a Python machine learning library for animal vocalizations and bioacoustics, 2021-04-10T19:34:50+0000
/project/bgcore/, bgcore, 0.5.0, Biomedical Genomics Python core libraries, 2014-07-29T08:36:06+0000
/project/ringmaster-show/, ringmaster.show, 0.4.2, The world is a circus and you are the ringmaster!, 2021-04-08T09:56:52+0000
/project/simspec/, simspec, 1.11.0, User interface for SimSpec. SIMplified SPECtrum reduction package for astronomy., 2019-04-04T15:50:53+0000
/project/helmholtz/, Helmholtz, 0.2.0, A framework for creating neuroscience databases, 2012-02-03T13:36:34+0000
/project/uniquid/, uniquid, 0.5.6, UniquID command line administration tool., 2020-02-21T13:17:45+0000
/project/ddv-logging/, ddv-logging, 0.2.1, Python logging formatters, filters, and convenience methods, 2020-10-18T17:02:11+0000
/project/rssd/, rssd, 2021.2.22, Rohde & Schwarz SCPI Driver, 2021-02-22T18:36:27+0000
/project/prql/, prql, 0.1.12, An interpreted relational query language that compiles to SQL, 2020-11-17T16:14:01+0000
/project/apap/, apap, 0.0.0b3, Declarative and handy RESTful client factory, 2019-08-17T12:25:30+0000
/project/qctrl-commons/, qctrl-commons, 7.0.1, Q-CTRL Python Commons, 2021-04-22T06:58:55+0000
/project/vital/, vital, 0.2.16, , 2021-04-02T22:18:08+0000
/project/webnms/, WebNMS, 1b1, A package providing provisions for connecting with a WebNMS IoT platform, 2018-12-13T14:41:30+0000
/project/unimatrix-ext-model/, unimatrix.ext.model, 0.3.1, Unimatrix Domain Models, 2020-12-21T02:13:39+0000
/project/portfolioscience/, portfolioscience, 1.0.11, PortfolioScience RiskAPI Enterprise Client, 2020-11-18T17:47:43+0000
/project/magen-statistics-service/, magen-statistics-service, 1.1a1, Statistics MicroService Package, 2017-10-20T07:05:18+0000
/project/jpl-mcl-site-knowledge/, jpl.mcl.site.knowledge, 0.0.8, Knowledge representation for the MCL site, 2018-09-05T19:06:38+0000
/project/azureml-designer-core/, azureml-designer-core, 0.0.61, , 2021-04-13T08:29:39+0000
/project/azureml-automl-runtime/, azureml-automl-runtime, 1.27.0.post1, AutoML client runtime library, 2021-04-21T15:26:10+0000
/project/ruamel-music/, ruamel.music, 0.4.0, handling of music files: conversion, playing, 2020-09-17T13:06:46+0000
/project/wailord/, wailord, 0.0.2, Wailord is a python library to interact with ORCA, 2020-12-27T16:43:49+0000
/project/medaimodels/, medaimodels, 0.1.0, A libarary for creating med-ai models, 2020-08-10T14:00:30+0000
/project/pytorch-doc-zh/, pytorch-doc-zh, 2020.9.28.0, <center>PyTorch 中文教程</center>, 2020-09-28T06:10:33+0000
/project/poplar-oeaddlne/, poplar-oeaddlne, 1.1.0, Example Extender customization that adds an OE Order line when a line with a particular item is entered., 2019-12-19T16:02:09+0000
/project/pinecone-client/, pinecone-client, 0.8.39, Pinecone client and SDK, 2021-04-08T15:55:53+0000
/project/immunio/, immunio, 2.3.3, Immunio agent library, 2019-11-13T16:07:00+0000
/project/pybee/, pybee, 0.3.2, Provides some useful functions to write maintainer scripts or deployment scripts, 2019-05-31T15:33:09+0000
/project/ucb-cs294-112-notes-zh/, ucb-cs294-112-notes-zh, 2020.9.21.0, UCB CS294-112 深度强化学习中文笔记, 2020-09-21T04:51:44+0000
/project/jarvicsdk/, JarvicSDK, 0.0.0, JarvicSDK description., 2020-05-13T15:21:33+0000
/project/dsai-wiki/, dsai-wiki, 2020.11.1.1, ApacheCN 数据科学和人工智能知识库, 2020-11-01T12:37:05+0000
/project/purplship-sf-express/, purplship.sf-express, 2021.3, Purplship - SF-Express Shipping Extension, 2021-04-18T05:01:41+0000
/project/atmosphere-python-client/, atmosphere-python-client, 1.0, Atmosphere REST API client written in python, 2015-10-15T16:40:55+0000
/project/kort/, kort, 0.1, Kort is a simple python URL-Shortener API, 2017-06-30T23:26:17+0000
/project/azureml-designer-classic-modules/, azureml-designer-classic-modules, 0.0.153, , 2021-04-13T08:32:05+0000
/project/simple-icons/, simple-icons, 0.1.0, A small python wrapper for the https://github.com/simple-icons/simple-icons/ project, 2021-01-10T22:17:32+0000
/project/pyinvoicer/, pyinvoicer, 0.0.3, Commandline tool to generate HTML-based and PDF invoices., 2021-03-18T21:49:58+0000
/project/pyvimond/, pyvimond, 0.3.1, Tiny client library for various Vimond APIs, 2021-01-13T11:01:25+0000
/project/pytket-qsharp/, pytket-qsharp, 0.10.0, Extension for pytket, providing simulators from Microsoft QDK, 2021-04-01T11:04:48+0000
/project/purplship-dhl-universal/, purplship.dhl-universal, 2021.3, Purplship - DHL Universal Tracking Extension, 2021-04-18T05:01:24+0000
/project/symtool/, symtool, 0.0.5, A tool for interacting with your SYM-1 microcomputer, 2021-02-08T00:37:17+0000
/project/hdbcli/, hdbcli, 2.8.16, SAP HANA Python Client, 2021-04-20T15:08:27+0000
/project/pubkeeper-brew-zmq/, pubkeeper.brew.zmq, 1.0.0, Brew, Consume, ZMQ!, 2017-11-15T17:11:06+0000
/project/fastfm2/, fastfm2, 0.5.2, A Library for Factorization Machines, 2021-03-03T23:13:55+0000
/project/endjoy/, endjoy, 1.0.0, Ctrl-Z for the filesystem, 2019-06-11T04:08:28+0000
/project/js-module-introduce-myself/, js-module-introduce-myself, 2020.9.21.0, JavaScript module introduce myself, 2020-09-21T04:12:57+0000
/project/mcdiscovery/, mcdiscovery, 0.1.1, A library for discovering Minecraft LAN servers on a network, 2020-11-28T00:26:53+0000
/project/pypix/, pypix, 0.1.6, Python library for generating pix codes with CRC16 validation, 2020-11-29T18:38:32+0000
/project/reader-rbv/, reader-rbv, 0.6.0, SDK / Client python untuk Ruang Baca Virtual Universitas Terbuka., 2021-04-06T16:35:28+0000
/project/satori-rtm-cli/, satori-rtm-cli, 1.5.3, Satori RTM CLI, 2017-12-28T14:04:09+0000
/project/wrector-library/, wrector-library, 0.1.0, , 2020-11-17T20:40:23+0000
/project/intel-scikit-learn/, intel-scikit-learn, 0.19.2, scikit-learn optimized with Intel(R) Data Analytics Acceleration Library, 2018-09-25T15:30:51+0000
/project/bwc-cli/, bwc-cli, 2.1.0, Brocade Workflow Composer CLI, 2016-12-06T05:37:05+0000
/project/satori-raspberry/, satori-raspberry, 0.0.4, Raspberry Pi framework to work with Satori, 2017-09-08T14:51:40+0000
/project/isortd/, isortd, 0.1.4, isort daemon. Http api to isort, 2021-02-03T18:42:29+0000
/project/calculadora-do-cidadao/, calculadora-do-cidadao, 0.5.2, Tool for Brazilian Reais monetary adjustment/correction, 2021-01-27T15:02:38+0000
/project/postcodes/, Postcodes, 0.1, A simple library for getting access to UK Postcode data,including latitide and longitude and administrative information. You can also search for other postcodes withina distance of a point or other postcode., 2012-11-17T17:46:48+0000
/project/ds100-textbook-zh/, ds100-textbook-zh, 2020.9.21.0, UCB DS100 数据科学的原理与技巧, 2020-09-21T03:51:52+0000
/project/django-codenerix-vending/, django-codenerix-vending, 1.0.1, Codenerix Vending is a module that enables CODENERIX to work a Point Of Sales system focused for business faced to final client (services, supermarkets & shops, examples: retaurants, petrol stations, clothes shops, grocery store, hardware store and others)., 2018-05-26T13:39:47+0000
/project/roamnerd-private-cli/, roamnerd-private-cli, 0.1.1, A private CLI for roamNERd developers / power users. Runs all NER locally using spacy, 2020-09-28T16:07:51+0000
/project/bq-tools-dirupload/, bq-tools-dirupload, 0.8.1, Upload/Download files to bisque/ViQi in parallel, 2021-04-22T21:57:35+0000
/project/teradataml/, teradataml, 17.0.0.3, Teradata Vantage Python package for Advanced Analytics, 2021-04-21T05:20:50+0000
/project/seaborn-request-client/, seaborn-request-client, 0.0.4, Request Client creates and maintains connections using the request library, but make each url endpoint a remoteprocedure call with the response content returned.  These function calls can made from a "connection" which hasa hierarchy of objects that mirrors the hierarchy of the API., 2018-03-15T05:11:18+0000
/project/prequel/, prequel, 0.1.8, An interpreted relational query language that compiles to SQL, 2020-10-28T20:04:30+0000
/project/gramexenterprise/, gramexenterprise, 1.65.0, Gramex: Visual Analytics Platform (Enterprise version), 2020-11-01T09:52:21+0000
/project/purplship-royalmail/, purplship.royalmail, 2021.3, Purplship - Royal Mail Shipping Extension, 2021-04-18T05:01:30+0000
/project/cfactory/, cfactory, 0.1.0, C/C++, et al., metaprogramming tool implemented in python, 2021-03-31T08:25:22+0000
/project/calc4b-zh/, calc4b-zh, 2020.9.21.0, MIT 18.03 面向初学者的微积分, 2020-09-21T03:47:23+0000
/project/rspy/, rspy, 0.0.3, Fundamental Formulas for Radar and Angle Management, 2019-04-19T13:02:30+0000
/project/nikw/, nikw, 0.0.0, Nikw, a game solver., 2020-12-07T22:28:10+0000
/project/aiosqlembic/, aiosqlembic, 0.3.10, Migrations powered by aiosql, 2021-02-10T10:46:28+0000
/project/boardgame2/, boardgame2, 0.0.5, 2-player zero-sum board game extension for OpenAI Gym., 2019-04-01T14:57:54+0000
/project/rticonnextdds-connector/, rticonnextdds-connector, 1.0.0, RTI Connector for Python, 2019-12-09T19:43:17+0000
/project/exotic/, exotic, 0.41.1, EXOTIC: EXOplanet Transit Interpretation Code, 2021-04-23T20:52:22+0000
/project/athentoimaging/, athentoimaging, 0.1, Image cleaning and OCR improvement package in Python using OpenCV., 2015-04-21T15:01:19+0000
/project/apollo-fpga/, apollo-fpga, 0.0.3, host tools for Apollo FPGA debug controllers, 2021-03-02T18:10:30+0000
/project/powa-web/, powa-web, 4.1.1, A User Interface for the PoWA project, 2021-02-11T14:08:36+0000
/project/alfalfa-client/, alfalfa-client, 0.1.0.dev7, A standalone client for the NREL Alfalfa application, 2021-02-17T19:32:16+0000
/project/yubikey-manager/, yubikey-manager, 4.0.2, Tool for managing your YubiKey configuration., 2021-04-12T08:06:56+0000
/project/chartio/, chartio, 6.0.1, Setup wizard and connection client for connecting MySQL/PostgreSQL databases to Chartio, 2015-05-22T00:39:22+0000
/project/ccmodel/, ccmodel, 0.1.0, Python libclang-powered C/C++ code modeling, 2021-03-31T08:15:00+0000
/project/django-aries-community/, django-aries-community, 0.1.3, A simple Django package to build web-based Indy/Aries agent applications., 2020-03-18T14:31:50+0000
/project/library-wrector/, library-wrector, 0.10.0, , 2021-03-03T22:09:30+0000
/project/neuron-nightly/, NEURON-nightly, 8.0a533, Empirically-based simulator for modeling neurons and networks of neurons, 2021-04-25T00:07:48+0000
/project/onednn-devel-cpu-vcomp/, onednn-devel-cpu-vcomp, 2021.2.0, Intel® oneAPI Deep Neural Network Library, 2021-03-26T20:21:23+0000
/project/geeksforgeeks-zh/, geeksforgeeks-zh, 2020.9.21.0, GeeksForGeeks 中文系列教程, 2020-09-21T03:54:31+0000
/project/tuubacrypt/, tuubacrypt, 0.4.0, TuubaCrypt - the least useful encryption and decryption algorithm., 2020-03-14T23:03:00+0000
/project/applauncher/, applauncher, 2.0.0, Python application launcher, 2021-04-21T21:56:10+0000
/project/dse-graph/, dse-graph, 1.9.0, DataStax Enterprise extension for graph, 2019-10-28T13:34:03+0000
/project/nonebot-plugin-r6s/, nonebot-plugin-r6s, 0.2.1, A R6s plugin for Nonebot2, 2021-04-22T07:27:54+0000
/project/pyqt4-doc-zh/, pyqt4-doc-zh, 2020.9.21.0, PyQt4 中文文档, 2020-09-21T04:38:48+0000
/project/tutor-license/, tutor-license, 11.0.0, Tutor license management plugin, 2020-11-26T15:18:10+0000
/project/egenix-mxodbc/, egenix-mxodbc, 3.3.6, eGenix mxODBC - Python ODBC Database Interface, 2016-11-16T16:42:59+0000
/project/odoo-backup-db-cli/, odoo-backup-db-cli, 1.0.0, Tool to create full backup of odoo database, 2021-01-25T00:12:39+0000
/project/azureml-designer-dataio-modules/, azureml-designer-dataio-modules, 0.0.57, , 2021-04-13T08:20:44+0000
/project/pylcp/, pylcp, 1.0.0, A package for calculating laser cooling physics, 2020-11-10T17:14:57+0000
/project/daal-static/, daal-static, 2021.2.2, Intel® oneAPI Data Analytics Library, 2021-04-05T18:52:45+0000
/project/pylesswrap/, pylesswrap, 0.1.4, A Python wrapper around LESS.js, destined to help compiling LESS files from Django., 2015-04-24T08:51:03+0000
/project/preql-lang/, preql-lang, 0.2.1, An interpreted relational query language that compiles to SQL, 2021-03-12T19:46:04+0000
/project/cassandra-driver-dse/, cassandra-driver-dse, 1.1.0, DataStax Enterprise extensions for cassandra-driver, 2016-11-02T00:39:42+0000
/project/qencode/, qencode, 1.0.3, Client library for main features and functionality of Qencode for Python v2.x., 2021-04-09T23:03:45+0000
/project/msvc-runtime/, msvc-runtime, 14.28.29910, Install the Microsoft™ Visual C++™ runtime DLLs to the sys.prefix and Scripts directories, 2021-03-05T22:28:19+0000
/project/pipeline-cli/, pipeline-cli, 1.0.15, Command-line interface to Sepior pipeline server., 2017-04-19T16:28:35+0000
/project/readcqt/, readcqt, 1.1.3, Converts specification from .xlsx files into a dataframe., 2020-11-08T09:32:33+0000
/project/broadworks-ocip/, broadworks-ocip, 1.4.0, API interface to the OCI-P provisioning interface of a Broadworks softswitch, 2021-01-20T23:43:29+0000
/project/rbn/, rbn, 0.1.0, A Python library for consuming data from the Reverse Beacon Network in real time, 2021-01-25T15:18:54+0000
/project/asyncpixel/, asyncpixel, 1.0.8, Asyncpixel, 2021-04-03T03:01:43+0000
/project/ownercredit/, ownercredit, 5.0.0, Ownercredit implements some concepts for a wealth-backed currency system, 2015-05-23T13:14:00+0000
/project/servicemapper/, servicemapper, 0.0.13, Data Steward Service-Mapper framework, 2020-06-24T19:07:09+0000
/project/azureml-dataprep-native/, azureml-dataprep-native, 33.0.0, Python Package for AzureML DataPrep specific native extensions., 2021-03-31T22:15:02+0000
/project/satori-rtm-sdk/, satori-rtm-sdk, 1.5.0, Python SDK for Satori RTM, 2017-09-21T09:12:38+0000
/project/pubkeeper-brew-local/, pubkeeper.brew.local, 2.0.0, Brew, Consume, Local, 2018-06-19T13:46:34+0000
/project/musamusa-atext/, musamusa-atext, 0.0.4, MusaMusa::AnnotatedText, 2021-04-10T20:37:55+0000
/project/brian/, brian, 1.4.4, A clock-driven simulator for spiking neural networks, 2017-12-08T10:14:08+0000
/project/ses2/, ses2, 0.1.9, Library for status/control of SES2 enclosure management devices, 2013-11-20T23:14:48+0000
/project/the-way-to-wealth-freedom-notes/, the-way-to-wealth-freedom-notes, 2020.9.21.0, 通往财富自由之路精细笔记, 2020-09-21T04:47:04+0000
/project/sym-sdk/, sym-sdk, 0.0.19, Sym's Python SDK, 2021-04-20T22:59:03+0000
/project/bookertrans/, BookerTrans, 2021.4.9.2, HTML Translator with Google Api for iBooker/ApacheCN, 2021-04-10T03:51:36+0000
/project/inspyre-toolbox/, inspyre-toolbox, 1.0a2, A toolbox containing some useful tools for Inspyre Softworks packages. Generally useful to some programmers too., 2020-12-16T18:16:20+0000
/project/bencode-py/, bencode.py, 4.0.0, Simple bencode parser (for Python 2, Python 3 and PyPy), 2020-06-12T04:34:03+0000
/project/django-codenerix-invoicing/, django-codenerix-invoicing, 2.0.5, Codenerix Invoicing is a module that enables CODENERIX to manage bills., 2018-07-08T05:13:09+0000
/project/example-pkg-test03/, example-pkg-test03, 0.1.1, A small example package, 2020-02-27T13:23:21+0000
/project/skripsi/, skripsi, 0.1.1, Alat bantu skripsi berbasis python, 2021-03-22T13:58:59+0000
/project/becquerel/, becquerel, 0.3.0, Tools for radiation spectral analysis., 2021-02-19T22:07:57+0000
/project/qctrl/, qctrl, 10.0.1, Q-CTRL Python, 2021-04-22T07:46:56+0000
/project/py-devtools-builtin/, py-devtools-builtin, 1.0.0, Add devtools.debug() to python builtins, 2021-01-04T20:46:32+0000
/project/tapipy/, tapipy, 0.3.18, Python lib for interacting with an instance of the Tapis API Framework, 2021-04-22T21:00:34+0000
/project/sap-example-pkg/, sap-example-pkg, 0.0.6, A small example package, 2019-07-03T13:06:17+0000
/project/shuup/, shuup, 2.6.5, E-Commerce Platform, 2021-04-22T15:58:28+0000
/project/arcesium-python/, arcesium-python, 0.0.1, Arcesium Python Client redirector, 2021-03-01T22:44:02+0000
/project/anyrunapi/, anyrunapi, 0.1.0, Library and CLI tool for Any Run (any.run) malware sandbox api., 2021-04-24T13:58:45+0000
/project/htpio/, htpio, 1.1.0.4, Remote GPIO access library, 2019-06-05T06:41:35+0000
/project/hyralix/, Hyralix, 0.1.0, Hyralix is a basic text formatter for Python., 2020-12-26T17:59:59+0000
/project/favicons/, favicons, 0.0.9, Favicon generator for Python 3 with strongly typed sync & async APIs, CLI, & HTML generation., 2020-10-05T06:44:28+0000
/project/pyaprsfi/, pyaprsfi, 1.0.0, An aprs.fi API client for Python, 2021-03-18T14:10:32+0000
/project/flask-s3/, Flask-S3, 0.3.3, Seamlessly serve the static files of your Flask app from Amazon S3, 2017-02-23T20:44:58+0000
/project/azureml-accel-models/, azureml-accel-models, 1.27.0, Azure Machine Learning Hardware Accelerated models, 2021-04-19T15:48:08+0000
/project/errorship/, errorship, 0.0.7b0, Send exceptions to datadog., 2020-04-13T13:57:07+0000
/project/bq-airflow-dag-generator/, bq-airflow-dag-generator, 0.2.0, Generate Airflow DAG from DOT language to execute BigQuery efficiently mainly for AlphaSQL, 2021-04-02T11:47:10+0000
/project/feu-utils/, feu-utils, 0.1.3, A set of common utilities used by Inmarsat FieldEdge Ultralite, 2021-04-06T01:47:04+0000
/project/pywanda/, pywanda, 0.4.1, Python bindings for the Wanda API, 2019-12-19T14:54:57+0000
/project/pubkeeper-communication-websocket/, pubkeeper.communication.websocket, 0.2.5, Brew, Fill, Consume, 2017-10-31T22:01:35+0000
/project/shadowsocks-async/, shadowsocks-async, 0.1.0, shadowsocks built with asyncio., 2021-03-19T08:39:57+0000
/project/librelingo-utils/, librelingo-utils, 1.0.0, Utilities to be used in LibreLingo-related-packages, 2021-03-23T08:46:34+0000
/project/opendssdirect-py/, OpenDSSDirect.py, 0.6.1, Python direct-mode interface to OpenDSS, 2021-03-11T01:53:34+0000
/project/gym-guesswho/, gym-guesswho, 0.0.5, An OpenAI Gym framework for machine learning with the game "Guess Who?", 2018-08-07T01:03:58+0000
/project/verval/, verval, 0.1.0, Client python verval* sdm.data.kemdikbud, 2020-12-26T03:37:07+0000
/project/pycachu/, pycachu, 0.1.1, A basic Python package to store files in a LRU cache., 2015-06-03T20:43:32+0000
/project/4suite-xml/, 4Suite-XML, 1.0.2, An open-source platform for XML processing, 2006-12-26T18:39:57+0000
/project/flink-doc-zh/, flink-doc-zh, 2021.4.11.0, Flink 中文文档, 2021-04-11T13:42:32+0000
/project/cobe-act/, cobe-act, 1.7.0, A collection of common tools for cobe.io., 2017-06-03T10:12:45+0000
/project/turkanime-cli/, turkanime-cli, 6.0.3, Türkanime video oynatıcı ve indirici, 2021-03-03T16:10:44+0000
/project/latex-admin/, latex-admin, 0.1.0, A CLI tool for managing LaTeX projects(inspired by django-admin), 2020-11-17T19:34:05+0000
/project/constellate/, constellate, 0.5.0, Constellate, a bunch of utilities aggregated over time., 2021-03-05T13:16:09+0000
/project/django-storages-dospaces/, django-storages-dospaces, 0.1.1, Small wrapper over django-storages S3Boto3Storage with sane defaults for DigitalOcean Spaces usage., 2020-12-06T03:00:55+0000
/project/guiblox/, guiblox, 2019.5.22, GUI Widgets in Frames, 2019-05-22T20:11:19+0000
/project/yhttp-pony/, yhttp-pony, 1.1.3, A very micro http framework., 2020-01-28T21:29:35+0000
/project/narration/, narration, 0.2.2, Narration, 2021-02-07T14:31:14+0000
/project/idp-engine/, idp-engine, 0.8.0, IDP-Z3 is a collection of software components implementing the Knowledge Base paradigm using the FO(.) language and a Z3 SMT solver., 2021-03-25T17:12:42+0000
/project/robot-spline/, robot-spline, 1.0.0, Robot spline path library, 2016-05-21T16:23:25+0000
/project/lcthw-zh/, lcthw-zh, 2020.9.21.0, 笨办法学C 中文版, 2020-09-21T04:14:26+0000
/project/ubase/, ubase, 0.2.1, μBase is oversimpistic key-value database wrapper on top of aiosqlite, 2021-04-23T18:04:24+0000
/project/calcifer/, calcifer, 0.3.0, A Python based policy framework., 2017-05-01T21:40:00+0000
/project/ciscodnacapphosting/, ciscodnacapphosting, 0.1.1, Cisco DNA Center App Hosting SDK, 2021-04-10T15:07:59+0000
/project/django-codenerix-email/, django-codenerix-email, 1.0.16, Codenerix Email is a module that enables CODENERIX to set send emails in a general manner., 2020-07-13T06:53:20+0000
/project/roxyai-inspect/, roxyai-inspect, 1.8.0, Roxy AI Inspect-Server package, 2021-04-12T03:36:20+0000
/project/bosdyn-choreography-client/, bosdyn-choreography-client, 2.3.4, Boston Dynamics API client code and interfaces for choreography, 2021-04-14T12:02:51+0000
/project/onednn-cpu-dpcpp-gpu-dpcpp/, onednn-cpu-dpcpp-gpu-dpcpp, 2021.2.0, Intel® oneAPI Deep Neural Network Library, 2021-03-26T20:16:57+0000
/project/ezrel/, ezrel, 1.0.0a4, The easy release., 2021-04-17T21:41:10+0000
/project/qutest/, qutest, 6.9.3, QUTest Python scripting support, 2021-01-28T21:18:00+0000
/project/functionwords/, functionwords, 0.4.2, Curated Chinese and English function words., 2021-04-19T00:41:01+0000
/project/jambel/, jambel, 0.1.1, Interface to jambit's project traffic lights., 2015-06-10T06:51:17+0000
/project/wildq/, wildq, 1.1.10, Command-line TOML/JSON/INI/YAML/XML processor using jq c bindings., 2021-04-15T06:49:30+0000
/project/orange3-timeseries-zh/, Orange3-Timeseries-zh, 0.3.4, Orange3 add-on for exploring time series and sequential data., 2020-03-24T21:05:16+0000
/project/aws-session-recorder/, aws-session-recorder, 0.2.2, AWS session that records discovered resources to a database, 2021-02-08T01:14:49+0000
/project/onionshare-cli/, onionshare-cli, 2.3.1, OnionShare lets you securely and anonymously send and receive files. It works by starting a web server, making it accessible as a Tor onion service, and generating an unguessable web address so others can download files from you, or upload files to you. It does _not_ require setting up a separate server or using a third party file-sharing service., 2021-02-22T22:14:26+0000
/project/prts/, prts, 1.0.0.3, , 2021-02-17T08:40:25+0000
/project/squirroclient/, SquirroClient, 3.2.9, Python client for the Squirro API, 2021-04-20T14:12:47+0000
/project/netlogger/, netlogger, 4.3.1, NetLogger Toolkit, 2012-05-12T16:03:17+0000
/project/pyton/, pyTON, 0.1.4, Python API for libtonlibjson (Telegram Open Network Light Client), 2020-01-21T10:03:13+0000
/project/xarray-ms/, xarray-ms, 0.1.9, xarray Datasets from CASA Tables., 2019-06-21T13:06:13+0000
/project/oaas-sdk/, oaas-sdk, 1.1.3, OaaS Client SDK, 2019-10-24T22:24:24+0000
/project/ayx-python-sdk/, ayx-python-sdk, 0.1b2, The Python plugin SDK for Alteryx Designer., 2021-03-02T01:10:05+0000
/project/starseqr/, starseqr, 0.6.7, RNA-Fusion Calling with STAR, 2018-04-06T18:37:26+0000
/project/katsuya/, katsuya, 0.190829.2118, A small example package, 2019-08-29T12:18:53+0000
/project/netlint/, netlint, 0.1.2, Performs static analysis on network device configuration files., 2021-04-17T14:12:07+0000
/project/teradatasqlalchemy/, teradatasqlalchemy, 17.0.0.1, Teradata SQL Driver Dialect for SQLAlchemy, 2021-04-06T11:56:36+0000
/project/arcgis/, arcgis, 1.8.5.post3, ArcGIS API for Python, 2021-04-12T03:28:09+0000
/project/web-hacking-101-zh/, web-hacking-101-zh, 2020.9.21.0, Web Hacking 101 中文版, 2020-09-21T04:53:01+0000
/project/egenix-mxodbc-zopeda/, egenix-mxodbc-zopeda, 2.2.3, eGenix mxODBC Zope/Plone Database Adapter for Plone and Zope, 2015-09-11T18:36:59+0000
/project/lynxkite-python-api/, lynxkite-python-api, 999, Python API for LynxKite [obsolete], 2020-06-23T11:27:49+0000
/project/purplship-dhl-express/, purplship.dhl-express, 2021.3, Purplship - DHL Express Shipping Extension, 2021-04-18T05:01:18+0000
/project/neutrino-engine/, neutrino-engine, 5.0.4, Deep neural network optimizer to make them faster, smaller, and energy-efficient from cloud to edge computing., 2021-04-23T14:56:47+0000
/project/acted-projects/, acted.projects, 0.6, UNKNOWN, 2012-05-20T19:42:22+0000
/project/aws-lambda-powertools/, aws-lambda-powertools, 1.14.0, Python utilities for AWS Lambda functions including but not limited to tracing, logging and custom metric, 2021-04-09T09:58:17+0000
/project/xgboost-doc-zh/, xgboost-doc-zh, 2020.9.21.0, <center>XGBoost 中文文档</center>, 2020-09-21T04:53:36+0000
/project/shakti/, shakti, 0.0.1, ..., 2020-04-12T02:43:36+0000
/project/takeonme/, takeonme, 0.4.0, Enumerate resources vulnerable to takeover, 2021-01-26T21:05:06+0000
/project/sourcery-cli/, sourcery-cli, 0.9.0, Magically refactor Python, 2021-04-12T20:21:50+0000
