/project/aqlbasic/, aqlbasic, 0.0.2, A simple package to connect to mysql easily, 2021-02-25T17:49:36+0000
/project/missioncontrol-client/, missioncontrol-client, 0.0.3, python client for the missioncontrol api, 2019-03-11T23:52:51+0000
/project/pyleo/, pyleo, 0.0.13, Unofficial Lingualeo API python library, 2019-04-06T04:28:56+0000
/project/furious-fastas/, furious-fastas, 0.1.5, Module to update the fastas., 2019-07-30T16:22:35+0000
/project/hsaquery/, hsaquery, 0.2.0, Python tools for querying the ESA Hubble Science Archive, 2018-08-31T13:04:47+0000
/project/django-zendesk/, django-zendesk, 0.0.1, Django application for handling HTTP target callbacks from Zendesk., 2013-07-09T18:43:33+0000
/project/mymodel/, mymodel, 0.0.1, Valve, 2021-04-19T22:46:53+0000
/project/nlpcorepy/, nlpcorepy, 0.0.1, PyPi package created by Schibsted's Product & Application Security team., 2021-02-16T08:36:47+0000
/project/advapi/, advapi, 0.0.1, microsoft, 2021-04-19T21:59:05+0000
/project/hffe/, hffe, 0.0.13, Implements high-frequency financial econometrics tools., 2019-03-04T18:50:38+0000
/project/vaurien/, vaurien, 1.9, TCP Chaos Proxy, 2014-06-21T10:13:45+0000
/project/aitree/, aitree, 0.0.1rc0, Mapping urban trees from street-level imagery, 2019-08-13T05:38:08+0000
/project/mydoubles/, mydoubles, 1.5.3, Test doubles for Python., 2021-01-18T05:12:25+0000
/project/somerandomsktest/, somerandomsktest, 0.0.1, , 2021-04-19T11:08:28+0000
/project/curiouslearner/, curiouslearner, 0.0.1, Meet Sanyam Khurana (CuriousLearner), 2018-08-31T13:17:32+0000
/project/fobi-phonenumber/, fobi-phonenumber, 0.1.0, UNKNOWN, 2016-02-10T17:17:49+0000
/project/async-email/, async-email, 0.1.0, , 2020-10-13T18:51:49+0000
/project/manatee/, manatee, 0.0.0, GNU Social server based on async Python 3, 2017-04-08T03:21:47+0000
/project/byref/, byref, 0.0.1, apple, 2021-04-19T22:07:52+0000
/project/mytestonlyhello/, myTestOnlyHello, 0.0.1, A basic hello package, 2021-04-23T08:52:28+0000
/project/nnc/, nnc, 0.0.1, Neural Network Control, 2020-09-07T10:18:31+0000
/project/ruly/, ruly, 0.0.4, Simple, extensible rule engine in Python, 2020-10-10T00:36:13+0000
/project/improve/, improve, 0.0.0a0, Python utils, 2019-01-22T23:26:40+0000
/project/decorate/, decorate, 1.0.1, Decorate HTML docs by adding them classes by theme, 2016-07-12T06:00:44+0000
/project/case-insensitive-dict/, case_insensitive_dict, 0.1.3, Case Insensitive Dict for python., 2016-02-24T22:22:43+0000
/project/conn/, conn, 0.0.1, cisco, 2021-04-19T22:33:51+0000
/project/astrohut/, astrohut, 0.1.2, Barnes-Hut NBody simulation library., 2018-07-13T18:50:45+0000
/project/pygtails/, pygtails, 0.1.6, A simple wrapper around pygame, 2018-02-26T23:41:27+0000
/project/coolered/, coolered, 0.1.0, A better dslackw/colored, 2017-12-18T06:46:17+0000
/project/python-netlify/, python-netlify, 0.0.1, Python client for Netlify, 2018-11-18T09:04:58+0000
/project/graystruct/, graystruct, 0.1.1, Integration between structlog and graylog GELF, provided by graypy, 2015-03-01T12:49:21+0000
/project/pyentrypoint/, pyentrypoint, 0.7.4, pyentrypoint manages entrypoints in Docker containers., 2020-06-14T17:50:59+0000
/project/zencelium/, zencelium, 2020.0.1, Zencelium: Personal Zentropi Instance Server, 2020-03-06T14:06:29+0000
/project/peleffy/, peleffy, 1.3.0, PELE Force Field Yielder, 2021-04-20T17:38:56+0000
/project/stormglass/, stormglass, 0.1.4, Python wrapper for the Storm Glass Global weather API, 2020-03-28T19:51:50+0000
/project/lindworm/, lindworm, 0.0.7, core tools covering folder content, markdown, GUI, 2020-10-16T12:16:59+0000
/project/bush/, bush, 0.0.1, Toys to play around with machine learning, 2019-10-25T03:47:42+0000
/project/rta/, rta, 0.0.1, Retention Time Alignment for LC-IM-MS., 2018-04-16T09:51:10+0000
/project/streamsx-sttgateway/, streamsx.sttgateway, 1.0.1, Speech To Text gateway integration for IBM Streams, 2020-12-07T08:21:05+0000
/project/pysoilmap/, pysoilmap, 0.1.0, Tools for performing Digital Soil Mapping (DSM) with python., 2021-04-15T14:43:32+0000
/project/uncertainpythonsdp/, UncertainPythonSDP, 1.1.3, A uncertain Python package, 2021-03-08T14:23:58+0000
/project/beepy/, beepy, 1.0.7, Play notification sounds., 2019-08-02T18:11:40+0000
/project/subpar/, subpar, 0.0.1, google, 2021-04-19T21:15:09+0000
/project/orange3-bioinformatics/, Orange3-Bioinformatics, 4.3.1, Orange Bioinformatics add-on for Orange data mining software package., 2021-03-01T08:15:42+0000
/project/hirez-py/, hirez.py, 0.0.0.dev0, A mirror package for pyrez. Please install that instead., 2019-06-06T00:06:53+0000
/project/p10n-path-templates/, p10n-path-templates, 0.0.1, PyPi package created by Schibsted's Product & Application Security team., 2021-02-16T08:36:57+0000
/project/tensorlab/, tensorlab, 0.0.0, Low-level TensorFlow APIs made easy., 2018-04-05T10:11:03+0000
/project/pycric-predict/, pycric-predict, 0.0.1, simple test cricket player score prediction via your cricket knowledge, 2021-02-20T16:38:10+0000
/project/wind/, wind, 0.0.0.dev0, Wind Project, 2018-09-27T15:07:02+0000
/project/django-opstasks/, django-opstasks, 0.2.10, opstasks, 2020-10-13T09:16:35+0000
/project/moria/, moria, 0.0.0, Just a placeholder for my intended app, 2018-06-12T07:07:28+0000
/project/mete0r-xoauth2relay/, mete0r.xoauth2relay, 0.1.0, SMTP XOAUTH2 Relay, 2018-10-26T11:05:55+0000
/project/p2tool/, p2tool, 0.0.1, Frootii, 2018-05-11T13:49:28+0000
/project/makecite/, makecite, 0.5, Autogenerate bibtex citations for common Python packages, 2019-11-08T18:40:10+0000
/project/clouds/, clouds, 0.1.a.dev, UNKNOWN, 2013-08-16T08:44:23+0000
/project/dlogr/, dlogr, 0.0.3, UNKNOWN, 2016-12-14T19:21:11+0000
/project/flaskull/, flaskull, 0.0.1, A set of useful class, functions, mixins and snippets to works with Flask., 2020-10-13T18:01:41+0000
/project/nucoscr/, nucosCR, 0.2.8, nucosCR - convenient python crypto-tools, 2020-12-21T18:45:46+0000
/project/gtts-simple/, gTTS_Simple, 1.2, La synthèse vocale simplifiée, 2017-05-03T12:09:35+0000
/project/lettherebe/, lettherebe, 0.0.2, LetThereBe Python library and command-line scripts, 2017-03-29T14:25:48+0000
/project/domoticzpy/, Domoticzpy, 0.1.8, Interact with Domoticz JSON API, 2018-12-24T15:34:15+0000
/project/remove-cookies-notice/, remove-cookies-notice, 0.0.2, Tool to remove cookies notice in html pages, 2020-08-27T14:23:03+0000
/project/sshim/, sshim, 1.3.2, Scriptable SSH server for testing SSH clients., 2018-05-14T09:46:24+0000
/project/bytbil-auth-lib/, bytbil-auth-lib, 0.0.1, PyPi package created by Schibsted's Product & Application Security team., 2021-02-16T08:33:44+0000
/project/pylops-gpu/, pylops-gpu, 0.0.0,  An extension to PyLops for linear operators on GPUs., 2020-01-12T14:33:43+0000
/project/industry-classifier-library/, industry_classifier_library, 0.0.1, PyPi package created by Schibsted's Product & Application Security team., 2021-04-15T10:52:26+0000
/project/apeworx/, apeworx, 0.0.0a0, , 2021-01-02T22:26:57+0000
/project/skasip-pbc/, skasip-pbc, 1.3.0, SIP Processing Block Controller library., 2019-01-10T12:29:30+0000
/project/wise-cli/, wise-cli, 0.0.1, Django deployment CLI, 2020-04-12T20:27:24+0000
/project/telegram-game/, telegram-game, 0.0.3, Asyncio telegram bot framework for games, 2016-07-12T01:44:16+0000
/project/augmentext/, Augmentext, 0.1.2, Text augmentation package for machine learning and NLP, with a focus on medical applications, 2021-01-11T12:43:40+0000
/project/angou-okex/, angou-okex, 1, Lightweight and suckless OKEX REST API client library, 2018-09-14T16:50:18+0000
/project/refactorlib/, refactorlib, 0.14.0, A library to help automate refactoring, 2016-10-26T20:48:25+0000
/project/regutil/, regutil, 0.0.1, microsoft, 2021-04-19T22:02:32+0000
/project/brtools/, brtools, 0.0.1, Does something and then we make money, 2015-11-18T20:20:30+0000
/project/association/, association, 0.0.1, google, 2021-04-19T21:10:48+0000
/project/bytbil-db-api/, bytbil-db-api, 0.0.1, PyPi package created by Schibsted's Product & Application Security team., 2021-02-16T08:33:54+0000
/project/scuts/, scuts, 2019.1.9.1, Python Standard Shortcuts, 2019-01-09T13:16:10+0000
/project/wmf-user-metrics/, wmf_user_metrics, 0.1.1, Data Analysis for Wikipedia User data., 2013-02-05T17:29:14+0000
/project/pymonerowallet/, pymonerowallet, 0.1, Python library to query a Monero wallet, 2016-10-24T09:02:45+0000
/project/laueagle/, laueagle, 0.0.3, , 2018-03-12T13:38:12+0000
/project/areplay/, areplay, 0.6, Apache Log live replicator, 2016-03-19T05:45:02+0000
/project/padmin/, padmin, 0.0.1, Project administration tool, 2019-12-17T07:00:05+0000
/project/basestats/, basestats, 0.0.1, PyPi package created by Schibsted's Product & Application Security team., 2021-04-15T10:52:16+0000
/project/communication/, communication, 0.0.1, google, 2021-04-19T21:11:18+0000
/project/bio2bel-hippie/, bio2bel-hippie, 0.0.1, Bio2BEL HIPPIE., 2018-09-26T18:11:26+0000
/project/pysequen/, pysequen, 0.1, Python library for concurrent processing of tasks with dependencies requiring sequencing, 2016-09-06T02:19:37+0000
/project/bytbil-ad-bump-api-client/, bytbil-ad-bump-api-client, 0.0.1, PyPi package created by Schibsted's Product & Application Security team., 2021-02-16T08:33:40+0000
/project/pytranslate/, pytranslate, 0.1.4, Google Translate wrapper for Python., 2011-03-24T04:16:40+0000
/project/ingresse/, Ingresse, 0.1, Ingresse Python SDK for great usage, 2016-06-30T19:32:15+0000
/project/you/, you, 0.5.0.dev1, My next dumb thing., 2017-12-22T21:37:05+0000
/project/hallu/, hallu, 0.0.1, hallucinating a zine publishing tool and static site generator, 2019-04-18T16:09:32+0000
/project/consign/, consign, 0.2.0, Python storage for humans., 2021-04-22T11:01:11+0000
/project/iteritems/, iteritems, 0.0.1, dropbox, 2021-04-19T22:21:39+0000
/project/xconstruct/, xconstruct, 0.0.1, google, 2021-04-19T21:16:58+0000
/project/recsys-related-items/, recsys-related-items, 0.0.1, PyPi package created by Schibsted's Product & Application Security team., 2021-02-16T08:37:25+0000
/project/ponio/, ponio, 0.1, Python Objects for Numerical IntegratOr, 2019-12-17T08:53:18+0000
/project/codet-ari/, codet-ari, 0.0.1, Library for accessing the Asterisk REST Interface, 2016-11-21T14:55:02+0000
/project/mete0r-monkeypatchbuildout/, mete0r.monkeypatchbuildout, 0.0.2, monkeypatch buildout for some reason, 2017-03-04T15:17:36+0000
/project/desfiddle/, DESfiddle, 1.0.0, A python package that offers high flexibility for implementing and experimenting with non-classical DES., 2021-04-23T15:37:59+0000
/project/ecom-utils/, ecom-utils, 0.1.0, Core de módulos para PyPI, 2021-02-18T14:40:19+0000
/project/babel-lingua-chameleon/, babel-lingua-chameleon, 0.1.0, Babel extractor for Chameleon templates, 2018-09-08T05:34:25+0000
/project/starfruitai/, starfruitai, 0.0.3, Starfruit AI - Deep Learning Deployments Made Simple, 2021-03-26T06:00:44+0000
/project/airsea/, airsea, 0.0.1, AirSea Libray for Python, 2014-07-21T15:31:22+0000
/project/vfs/, vfs, 0.0.1, google, 2021-04-19T21:16:25+0000
/project/bluewhale3-bluewhale/, BlueWhale3-BlueWhale, 0.0.43, 蓝鲸大数据平台，提供教学数据与案例, 2021-04-08T08:59:05+0000
/project/cachext/, cachext, 1.0.0, cache extension for sea/flask, 2020-02-20T05:57:33+0000
/project/uce/, uce, 0.0.1, µce, 2020-11-21T23:07:05+0000
/project/bytbil-base-api-client/, bytbil-base-api-client, 0.0.1, PyPi package created by Schibsted's Product & Application Security team., 2021-02-16T08:33:46+0000
/project/artisan/, Artisan, 0.0.0, Coming soon, 2017-06-18T17:03:32+0000
/project/mvrt/, mvrt, 0.0.1, Nothing, 2019-09-07T18:44:26+0000
/project/pytest-mock-api/, pytest-mock-api, 0.1.0, A mock API server with configurable routes and responses available as a fixture., 2019-02-13T04:26:24+0000
/project/domina/, domina, 0.1.0a3, Game AI script framework for MMORTS screeps.com, 2020-12-06T20:17:40+0000
/project/ae-i18n/, ae-i18n, 0.1.20, ae_i18n portion of python application environment namespace package, 2021-01-23T22:49:07+0000
/project/pggui/, pggui, 0.0.2, A lib to make GUI made with PyGame, 2021-01-04T12:49:57+0000
/project/zaifapi/, zaifapi, 1.6.3, Zaif Api Library, 2018-08-02T06:47:52+0000
/project/de-core/, de-core, 0.0.20, de_core portion of python development environment namespace package, 2021-04-07T23:25:27+0000
/project/django-appwatch/, django-appwatch, 0.0.1, Watch Django INSTALLED_APPS and copy files, 2018-05-19T21:22:39+0000
/project/libra-py-001-07/, libra_py_001_07, 0.0.1, Split Linearized Bregman Iteration, 2018-07-21T06:05:25+0000
/project/t4g/, t4g, 0.0.1.dev3, Tag Generator, 2021-03-18T10:36:55+0000
/project/jupyter-contrib-nbextensions/, jupyter-contrib-nbextensions, 0.5.1, A collection of Jupyter nbextensions., 2019-01-02T12:28:49+0000
/project/ztranslator/, ztranslator, 0.0.9, Powerful command line translator., 2020-08-02T04:34:38+0000
/project/billopsql/, billopsql, 0.0.0, internal use, 2021-02-10T19:18:14+0000
/project/fiscal-printer-adapter/, fiscal-printer-adapter, 0.0.3, A standarized fiscal printer interface, 2018-12-28T00:41:14+0000
/project/pymediaannotator/, pyMediaAnnotator, 0.1.9.post2, A pyGTK and vlc based application to hand-annotate audio and video files for classification tasks, 2019-01-29T05:40:56+0000
/project/configparserplus/, configparserplus, 0.0.6, configparser module with lasers (for now with Jinja2 support), 2020-05-28T16:48:55+0000
/project/splashpy/, splashpy, 0.3.1, Foundation Package for Splash Py Clients, 2020-11-30T12:04:55+0000
/project/rustybits/, rustybits, 0.0.2, , 2020-01-19T21:35:16+0000
/project/openbudget/, OpenBudget, 0.0.2, Simple budget management planner, 2019-03-10T20:09:31+0000
/project/qg-core/, qg.core, 0.1.6, qg.core, 2015-07-28T03:28:40+0000
/project/moon-manager/, moon-manager, 0.9.1, , 2020-04-30T16:37:58+0000
/project/gmeterpy/, gmeterpy, 0.0.2, Processing gravity measurements with Python, 2019-05-14T09:19:39+0000
/project/sphinx-django-theme/, sphinx-django-theme, 0.0.1.dev0, sphinx theme for django projects, 2020-07-23T17:51:26+0000
/project/f-cli/, f-cli, 0.0.0, Cloud Engineer toolkit, 2019-12-01T03:17:12+0000
/project/django-backoffice/, django-backoffice, 0.0.1.dev0, django backoffice admin theme, 2021-01-30T17:58:48+0000
/project/user-modeling-monitoring/, user-modeling-monitoring, 0.0.1, PyPi package created by Schibsted's Product & Application Security team., 2021-02-16T08:39:07+0000
/project/f-lib/, f-lib, 0.1.0, A library of useful functions and classes for python projects., 2020-02-01T23:52:10+0000
/project/iceberg/, iceberg, 0.4, The ICEBERG workflow middleware, 2021-04-15T19:21:59+0000
/project/pylibcontainer/, pylibcontainer, 0.0.6, An OCI runtime specification implementation library, 2018-05-24T16:45:05+0000
/project/lid/, Lid, 1.0.4, tiny project, 2017-05-09T03:44:54+0000
/project/armodel/, armodel, 0.1.0, the python arxml parser, 2021-04-04T02:43:34+0000
/project/preprocessors/, preprocessors, 0.0.1, microsoft, 2021-04-19T22:02:10+0000
/project/scopereaders/, ScopeReaders, 0.0.0, , 2020-08-15T19:52:25+0000
/project/tipfy-ext-auth-google/, tipfy.ext.auth.google, 0.1, Google authentication extension for tipfy using OpenId/Oauth, 2010-07-11T00:09:37+0000
/project/statisfactory/, statisfactory, 0.0.1, , 2019-07-17T19:58:45+0000
/project/pinpayments/, pinpayments, 0.1.1, A Python interface to the Pin Payments API., 2016-05-01T10:20:40+0000
/project/obj/, obj, 0.0.1, apple, 2021-04-19T22:09:59+0000
/project/gmsdk/, gmsdk, 0.2.2, Python SDK for communicating Delhivery's - Warehouse Management System APIs for Order / Product / Supplier, 2015-04-07T07:10:31+0000
/project/nocss/, nocss, 0.0.1, , 2019-10-04T23:33:12+0000
/project/duckarray/, duckarray, 0.0.1, google, 2021-04-19T21:11:37+0000
/project/pyintralinks/, pyintralinks, 0.1.1, A python client for intralinks api., 2017-06-18T03:20:07+0000
/project/atomhelloworld780/, AtomHelloWorld780, 0.0.1, A basic helloworld package., 2021-04-08T14:26:47+0000
/project/bio2bel-adeptus/, bio2bel-adeptus, 0.0.1, Bio2BEL ADEPTUS., 2018-11-20T09:33:05+0000
/project/hiphp/, hiphp, 0.1.0, A package for controlling a php-based website., 2021-04-18T20:24:10+0000
/project/tensorflow-cpu-2-0-preview/, tensorflow-cpu-2.0-preview, 0.0.0, , 2019-05-18T00:01:48+0000
/project/whaaaaat/, whaaaaat, 0.5.2, Collection of common interactive command line user interfaces, based on Inquirer.js, 2017-04-01T03:56:57+0000
/project/baxa/, baxa, 0.0.2, Models and examples built with JAX, 2021-02-01T02:35:11+0000
/project/pjeuler-chicotobi/, pjeuler-chicotobi, 0.8.0, Tools in Python for Project Euler, 2020-11-08T21:02:53+0000
/project/peakrdl/, peakrdl, 0.1.0, Command-line tool for control/status register automation, 2020-04-15T03:57:29+0000
/project/pymola/, pymola, 0.1.9, A python/modelica based simulation environment., 2017-05-30T22:30:28+0000
/project/libstorages/, libstorages, 0.0.2, Cloud Store API, 2012-12-31T13:00:05+0000
/project/saphyr/, saphyr, 0.0.3, An experiemental fullstack framework, 2018-08-17T13:04:57+0000
/project/tdu/, tdu, 0.0.1, Thruster design utility., 2016-08-23T23:15:03+0000
/project/bytbil-blocket-api-client/, bytbil-blocket-api-client, 0.0.1, PyPi package created by Schibsted's Product & Application Security team., 2021-02-16T08:33:47+0000
/project/sweetmorse/, sweetmorse, 1.1.0, Morse code tools from read to write, analog to digital, 2017-09-07T02:32:07+0000
/project/domainadaptation/, domainadaptation, 0.0.1, Domain Adaptation Tools for Python, 2018-09-23T01:50:39+0000
/project/procfile/, procfile, 0.1.0, Procfile parser, 2015-11-20T17:50:40+0000
/project/ae-droid/, ae-droid, 0.1.2, ae_droid portion of python application environment namespace package, 2021-03-23T19:09:15+0000
/project/billoes/, billoes, 0.0.0, internal use, 2021-02-10T19:18:07+0000
/project/cryptodo/, cryptodo, 3.0, TEXT ENCRYPTION AND DECRYPTION, 2021-03-07T07:48:46+0000
/project/invenio-utils/, invenio-utils, 0.2.0, Various utility functions and datatypes for Invenio., 2015-10-05T09:02:42+0000
/project/linq3/, linq3, 0.0.1, , 2018-10-27T01:37:34+0000
/project/cryptomodel-athanikos/, cryptomodel-athanikos, 2.6.7, Model for CryptoStore and CoinMarketCap Collections for Mongo db, 2021-03-05T19:49:59+0000
/project/stackdriver/, stackdriver, 0.1.1, A Python client for the Stackdriver service, 2016-08-02T03:21:26+0000
/project/psapi/, psapi, 0.0.1, microsoft, 2021-04-19T22:02:13+0000
/project/trimport/, trimport, 0.0.6, Directory structure function import, 2019-09-17T17:16:00+0000
/project/hgwebinit/, hgwebinit, 0.1.0, Mercurial hgweb init support., 2013-01-27T05:44:57+0000
/project/fictive-aws/, fictive-aws, 0.0.1, , 2021-02-10T18:24:50+0000
/project/invoicer/, invoicer, 0.1.0, Invoicer , 2018-09-08T19:26:32+0000
/project/tvt-test-vector-transformer/, tvt-test-vector-transformer, 0.0.1, Translate digital test vectors for automated test equipment for semiconductors, 2013-04-14T09:49:36+0000
/project/polist/, polist, 0.0.2, polist, partially ordered list, 2014-05-09T18:21:01+0000
/project/mk/, mk, 1.0.5, mk, 2021-04-15T17:24:35+0000
/project/liquipy/, liquipy, 0.1.4, a Python wrapper for Liquibase (see http://www.liquibase.org/), 2014-01-07T23:30:44+0000
/project/mlenv/, mlenv, 0.1.dev0, A machine learning framework., 2019-08-26T01:06:46+0000
/project/mldb/, mldb, 0.0.1, ML DataBase, 2021-03-18T18:00:34+0000
/project/black-hole-solver/, black-hole-solver, 0.2.3, lib, 2020-06-23T20:05:08+0000
/project/speechtotext/, speechtotext, 0.0.3, Text to Speech for python, 2016-07-12T03:56:08+0000
/project/maggtomic/, maggtomic, 0.1.6, Metadata aggregation using the Datomic information model, 2021-01-26T15:53:50+0000
/project/tam/, tam, 0.1.2, Tile Assembly Model modules, 2016-03-18T05:49:31+0000
/project/led/, led, 0.0.2, Docker utility for Lets Encrypt, 2019-05-09T02:18:16+0000
/project/qconfig/, qconfig, 0.0.1, Open source config management in python, 2021-03-20T16:15:40+0000
/project/prototypes/, prototypes, 0.0.1, dropbox, 2021-04-19T22:23:56+0000
/project/droneposelib/, droneposelib, 0.0.0a3, A Python package for Visual-Inertial Odometry, 2021-04-23T18:11:01+0000
/project/appx/, appx, 0.0.0.0.dev20200918, , 2020-09-18T06:21:27+0000
/project/daspy/, DASpy, 0.0.1, , 2020-11-05T12:07:37+0000
/project/restiro/, restiro, 0.19.1, RESTful API documentation generator, 2019-07-24T06:45:14+0000
/project/selectinload/, selectinload, 0.0.1, Valve, 2021-04-19T22:46:58+0000
/project/django-csp-observer/, django-csp-observer, 1.0.2, A Django app that evaluates CSP reports to identify malicious activity., 2020-08-27T14:56:14+0000
/project/unionfind/, unionfind, 0.0.12, `unionfind` is a package for unionfind., 2020-12-18T14:43:24+0000
/project/fuzzers/, fuzzers, 0.0.1, google, 2021-04-19T21:12:00+0000
/project/pysosirius/, pysosirius, 0.1.0, Unofficial Sirius XM API, 2018-04-08T20:22:04+0000
/project/btsbots-wallet/, btsbots-wallet, 0.2.3, web wallet for BitShares, 2016-10-02T07:40:10+0000
/project/ate-cd-upload-lambdas/, ate-cd-upload-lambdas, 0.0.1, PyPi package created by Schibsted's Product & Application Security team., 2021-02-16T08:32:49+0000
/project/alterego/, alterego, 0.0.0, alterego library., 2017-09-28T22:22:46+0000
/project/mwa/, mwa, 0.0.1, mwa, 2018-05-11T13:52:35+0000
/project/coercion/, coercion, 1.0.0, Coercing data into a normalized form, 2015-11-02T18:54:07+0000
/project/python-outfit/, python-outfit, 0.0.8, , 2021-04-15T13:05:25+0000
/project/pymodulon/, pymodulon, 0.0.2, Python package for analyzing and visualizing iModulons, 2020-09-14T23:26:10+0000
/project/pynamodb-plus/, pynamodb-plus, 0.0.4, Python 3 library with some utilities to use with PynamoDB, 2020-05-11T13:18:03+0000
/project/django-pyodbc-gis/, django-pyodbc-gis, 0.0.7, GIS support for SQL Server, on top of django-pyodbc-azure, 2014-01-17T03:19:21+0000
/project/bayrell-runtime-web/, bayrell-runtime-web, 0.0.1, Bayrell Runtime Web, 2018-09-12T10:02:12+0000
/project/skasip-config-db/, skasip-config-db, 1.3.0, SIP Execution Control Configuration Database library., 2019-03-28T14:12:58+0000
/project/ansatz/, ansatz, 0.0.1, A physics Python library, 2019-10-17T20:06:11+0000
/project/sctr/, sctr, 0.0.1, Supervisord Controller., 2021-04-02T22:33:06+0000
/project/pdfannot/, pdfannot, 2019.6.5.1, PDF Annotation Utils, 2019-06-05T13:04:44+0000
/project/nonexistant/, nonexistant, 0.0.1, google, 2021-04-19T21:13:17+0000
/project/django-addle/, django-addle, 0.0.1, A Django app for managing ads and internal promotions., 2016-11-22T03:28:31+0000
/project/hpd-20/, hpd-20, 0.0.2, HPD-20 simple patch editor and librarian, 2017-01-05T13:04:25+0000
/project/geoclaw-landspill/, geoclaw-landspill, 1.0.dev3, A hydrocarbon overland flow simulator for pipeline rupture events., 2021-01-19T09:19:07+0000
/project/printerpackage/, Printerpackage, 0.0.9, print words, 2021-03-01T03:20:30+0000
/project/nbimport/, nbimport, 0.0.0, An IPython magic command to import and run external notebooks using public URLs., 2019-08-13T10:09:24+0000
/project/hangman-sk/, hangman_sk, 0.1.0, Init python project, 2017-12-16T09:49:33+0000
/project/billodynamodb/, billodynamodb, 0.0.0, internal use, 2021-02-10T19:18:04+0000
/project/mloscli/, mloscli, 0.0.1, mlOScli Package, 2020-08-07T05:52:50+0000
/project/yftest-2/, yftest-2, 0.0.0, , 2019-05-17T23:01:03+0000
/project/comment/, comment, 0.0.1, airbnb, 2021-04-19T22:48:41+0000
/project/dislocation/, dislocation, 0.0.0, Library for dealing with dislocations., 2019-08-02T10:23:57+0000
/project/arrowhead/, arrowhead, 1.0a1, micro-framework for flowchart-like computing, 2014-05-11T23:38:32+0000
/project/py-tiny-orm/, py-tiny-orm, 0.0.5, Trivial ORM for mapping dataclasses to SQLite, 2021-01-10T16:59:33+0000
/project/timage/, Timage, 0.0.2, Hide text into image, 2021-03-01T16:07:23+0000
/project/az/, az, 0.1.0.dev1, AZ - simple command line tools, 2018-09-25T06:30:25+0000
/project/lshc/, LSHC, 1.0, Hierarchical Agglomerative Clustering based on Locality Sensitive Hashing, 2020-05-01T00:23:04+0000
/project/easyqueue-core/, easyqueue-core, 0.0.1, Easy queue basic model, 2020-10-05T21:33:59+0000
/project/alita/, alita, 0.2.3, A simple Python async framework for building web applications., 2019-06-12T08:53:39+0000
/project/attntvpy/, attntvpy, 0.1.0, We like programming, 2018-01-26T19:47:35+0000
/project/pansurg/, pansurg, 0.2, Basic pip module for accessing coronavirus resources, 2020-05-05T10:44:35+0000
/project/edk/, edk, 0.0.1, microsoft, 2021-04-19T22:00:13+0000
/project/spt-data-pipeline-utils/, spt-data-pipeline-utils, 0.0.1, PyPi package created by Schibsted's Product & Application Security team., 2021-02-16T08:38:39+0000
/project/awsssolib/, awsssolib, 0.4.0, A template to create python libraries, 2021-01-28T10:48:17+0000
/project/apidou/, apidou, 0.2.2, Module to communicate with APIdou, the connected plush, 2016-12-05T16:13:45+0000
/project/md2tex/, md2tex, 0.0.17, `md2tex` is a package which convert markdown to TeX., 2018-10-02T01:30:47+0000
/project/blox1module/, blox1module, 0.0.4, Package for infoblox bloxone users, 2021-01-18T03:47:49+0000
/project/django-pudb3/, django-pudb3, 0.2.0, Django middleware to view exceptions in PuDB., 2020-10-23T21:41:00+0000
/project/biokit/, biokit, 0.4.6, Access to Biological Web Services from Python, 2020-04-01T12:43:41+0000
/project/magma/, magma, 0.3.9, MAGnet MAnifest Management - Readout and create lists of magnets in yaml format., 2008-06-16T09:25:30+0000
/project/moduconfig/, moduconfig, 0.0.1, A declarative and powerful configuration APIfor application configuration and documentation, 2020-01-18T23:13:21+0000
/project/pymysharesdk/, pyMyShareSDK, 0.0.3, Python SDK for MyShare API, 2021-02-04T00:55:52+0000
/project/vip/, vip, 0.1.4, vip is a simple library that makes your python aware of existing virtualenv underneath., 2012-12-10T02:14:21+0000
/project/ae-valid/, ae-valid, 0.1.1, ae_valid portion of python application environment namespace package, 2020-08-27T17:01:58+0000
