/project/doconce/, DocOnce, 1.5.9, Markup language similar to Markdown targeting scientific reports, software documentation, books, blog posts, and slides. DocOnce can generate LaTeX, Sphinx, HTML, IPython notebooks, Markdown, MediaWiki, and other formats, 2021-04-19T11:42:16+0000
/project/apachecn-c-cpp-zh/, apachecn-c-cpp-zh, 2021.4.5.0, ApacheCN C/C++ 译文集, 2021-04-05T06:15:12+0000
/project/think-py-2e-zh/, think-py-2e-zh, 2020.9.21.0, Think Python, 2020-09-21T04:48:01+0000
/project/shamecom/, shamecom, 2020.11.3.0, 校招污点公司记录, 2020-11-03T14:17:23+0000
/project/codekitlang/, CodeKitLang, 0.4, CodeKit Language Compiler, Python implementation, 2015-03-08T18:14:13+0000
/project/html5builder/, html5builder, 0.1.0, Simple HTML5 document builder., 2020-04-18T16:57:16+0000
/project/weboob-qt/, weboob-qt, 2.0, Weboob, Web Outside Of Browsers, 2020-03-27T19:11:00+0000
/project/chj/, CHJ, 3.7, Package for CSS/HTML/Javascript support., 2020-04-28T11:01:00+0000
/project/htmldate/, htmldate, 0.8.1, Fast and robust extraction of original and updated publication dates from web pages., 2021-03-09T17:08:59+0000
/project/klon/, klon, 1.0.1, Utilities for building ElementTrees, 2021-01-08T11:49:58+0000
/project/hands-on-ml-2e-zh/, hands-on-ml-2e-zh, 2020.12.31.0, Sklearn 与 TensorFlow 机器学习实用指南第二版, 2020-12-31T11:30:06+0000
/project/socialmediamining-zh/, SocialMediaMining-zh, 2020.10.16.0, <center>社交媒体挖掘 - 翻译版</center>, 2020-10-16T09:15:59+0000
/project/inline-html/, inline-html, 1.0.0, HTML stylesheet inliner, replaces resources with data-uri, 2018-07-16T12:17:45+0000
/project/html2phpbbcode/, html2phpbbcode, 0.1.4, HTML to phpBB-compatible BBCode converter, 2018-09-18T15:52:25+0000
/project/spring-boot-doc-zh/, spring-boot-doc-zh, 2020.9.21.0, Spring Boot 1.5.2 中文文档, 2020-09-21T04:43:25+0000
/project/kajiki/, Kajiki, 0.8.2, Fast XML-based template engine with Genshi syntax and Jinja blocks, 2019-11-26T10:58:10+0000
/project/textoutpc/, textoutpc, 0.2.1, textout() equivalent from Planète Casio, 2018-11-01T22:47:54+0000
/project/nfsyndication/, NFSyndication, 0.2.25, News Feed Syndication - A package that read and fetch RSS feeds from the publications., 2021-04-20T20:57:05+0000
/project/joho/, joho, 0.19.3, HTML and SVG module to create lecture materials for 情報処理及び実習 TAC101  at University of Yamanashi (山梨大学)., 2019-02-13T10:14:38+0000
/project/mdtex2html/, mdtex2html, 1.2.0, library to convert Markdown with included LaTeX-Formulas to HTML with MathML, 2021-04-19T20:00:39+0000
/project/patternfork-nosql/, patternfork-nosql, 3.6, Web mining module for Python., 2020-08-25T20:36:32+0000
/project/tuhinga/, tuhinga, 0.1.1, Minimalistic markup language that translates to XML/HTML, 2015-05-28T21:04:07+0000
/project/pyratemp/, pyratemp, 0.3.2, Small, simple and powerful template-engine for Python., 2013-09-18T08:00:35+0000
/project/tutormagic/, tutormagic, 0.3.1, Magic to display pythontutor.com from a code cell in the IPython notebook., 2021-03-04T23:13:45+0000
/project/apachecn-cv-zh/, apachecn-cv-zh, 2021.2.18.0, ApacheCN 计算机视觉译文集, 2021-02-18T14:48:45+0000
/project/storm-doc-zh/, storm-doc-zh, 2020.9.21.0, Storm 1.1.0 中文文档, 2020-09-21T04:45:44+0000
/project/omero-figure/, omero-figure, 4.4.0, OMERO figure creation app, 2021-02-25T14:18:45+0000
/project/woob/, woob, 3.0, Woob, Web Outside Of Browsers, 2021-04-11T12:52:02+0000
/project/cocktail/, cocktail, 1.8.3, A tasty mix of python web development utilities., 2016-03-17T11:55:11+0000
/project/impatient-js-zh/, impatient-js-zh, 2020.9.21.0, 写给不耐烦程序员的 JavaScript, 2020-09-21T04:09:34+0000
/project/plumage/, plumage, 2.4.0, Clean and tidy theme for Pelican., 2020-12-06T17:42:32+0000
/project/livehtml/, livehtml, 0.0.1, Simple development server for writing an html pages, 2012-06-27T20:35:09+0000
/project/bdt-sitemap/, bdt_sitemap, 0.9, Sitemap.xml generator for a local copy of a website, 2014-08-13T21:36:28+0000
/project/frogstarb/, FrogstarB, 0.1.0, Simple tool to post to Blogger.com from the command line., 2011-01-06T14:12:27+0000
/project/pyorg/, pyorg, 0.1.8, The org-mode parser fro python, 2017-01-22T14:35:45+0000
/project/osrframework-server/, osrframework-server, 0.18.0a4, OSRFramework Server - A HTTP server writen in Python to interact with OSRFramework., 2017-12-03T18:32:46+0000
/project/quik/, quik, 0.2.2, A fast and lightweight Python template engine, 2013-09-06T13:57:44+0000
/project/cardify/, cardify, 0.1.0, Cardify - A set of GPLv3+ libraries to deal with carding information., 2016-03-19T17:11:39+0000
/project/llthw-zh/, llthw-zh, 2020.9.21.0, 笨办法学 Linux 中文版, 2020-09-21T04:15:06+0000
/project/django-markdownx/, django-markdownx, 3.0.1, A comprehensive Markdown editor built for Django., 2019-12-28T09:03:17+0000
/project/omero-webtagging-autotag/, omero-webtagging-autotag, 3.1.0, OMERO webtagging autotag app, 2020-01-18T08:44:38+0000
/project/cssutils/, cssutils, 2.2.0, A CSS Cascading Style Sheets library for Python, 2021-03-11T01:12:04+0000
/project/elementtreefactory/, ElementTreeFactory, 1.0, A Genshi-inspired framework for easy use of ElementTree, 2011-11-27T19:51:42+0000
/project/pypi-simple/, pypi-simple, 0.8.0, PyPI Simple Repository API client library, 2020-12-13T19:47:19+0000
/project/html/, html, 1.16, simple, elegant HTML, XHTML and XML generation, 2011-06-29T09:29:32+0000
/project/markdown-figure-caption/, markdown-figure-caption, 0.0.1, Add <figcaption> elements to your images, 2019-01-27T16:45:52+0000
/project/chemdataextractor-ide/, ChemDataExtractor-IDE, 1.3.2, A toolkit for extracting chemical information from the scientific literature., 2019-11-28T14:09:56+0000
/project/omero-gallery/, omero-gallery, 3.4.0, A Python plugin for OMERO.web, 2021-03-26T10:24:28+0000
/project/penelope/, penelope, 3.1.3.0, Penelope is a multi-tool for creating, editing and converting dictionaries, especially for eReader devices, 2016-09-23T09:27:17+0000
/project/selectq/, selectq, 0.0.6, Non cryptic XML/HTML parsing, 2020-12-15T02:56:21+0000
/project/tns/, tns, 1.0.0, Top News Selectors (tns): Top news parsing from select websites, 2018-02-04T02:03:41+0000
/project/characterentities/, characterentities, 0.1.2, HTML Entities for Python, 2018-09-29T17:20:10+0000
/project/pdfkit-async/, pdfkit-async, 0.7.2, Wkhtmltopdf python wrapper to convert html to pdf using the webkit rendering engine and qt, 2020-05-09T21:02:10+0000
/project/cachebust/, cachebust, 1.1.0, Provide a server-side means to ensure that clients always fetch assets when they are updated, 2015-12-22T19:15:21+0000
/project/xhtml2pdf/, xhtml2pdf, 0.2.5, PDF generator using HTML and CSS, 2020-10-08T18:57:39+0000
/project/jquery-drop-widget/, jquery-drop-widget, 2010.10.14.0, Jquery based HTML Widget generation (compatible/made for dropSTAR webserver, but done generically., 2010-10-14T18:24:50+0000
/project/htexpr/, htexpr, 0.1.0, htexpr compiles an html string into a Python expression, 2020-06-21T19:24:38+0000
/project/harser/, harser, 0.1, Easy way for HTML parsing and building XPath., 2016-11-30T18:57:35+0000
/project/sicp-py-zh/, sicp-py-zh, 2020.9.21.0, UCB CS61a SICP Python 描述, 2020-09-21T04:42:24+0000
/project/sphinx-wxoptimize/, sphinx_wxoptimize, 1.2, Convert sphinx-generated htmlhelp files into versions optimized for reading using the wxHtmlHelp browser, 2009-11-19T04:41:59+0000
/project/pandas-cookbook-code-notes/, pandas-cookbook-code-notes, 2020.9.21.0, Pandas Cookbook 带注释源码, 2020-09-21T04:35:55+0000
/project/html-writer/, html-writer, 1.1.1, A simple HTML writer, 2018-10-24T07:50:02+0000
/project/bark-ssg/, bark-ssg, 1.3.4, Single file static site generator., 2015-09-04T21:33:08+0000
/project/confluence-junction/, confluence-junction, 0.1.1, Publish to and manage Confluence spaces with markdown files tracked in Git., 2021-03-05T23:51:29+0000
/project/getme/, getme, 0.0.1, An HTML extractor by a simple template, 2013-03-28T23:48:32+0000
/project/piglet-templates/, piglet-templates, 1.2.0, Fast, robust HTML templating engine, 2021-04-25T16:43:01+0000
/project/mezzanine-wymeditor/, mezzanine-wymeditor, 0.3, WYMeditor RichText widget for Mezzanine, 2014-08-05T21:21:11+0000
/project/guru99-zh/, guru99-zh, 2020.9.21.0, Guru99 中文系列教程, 2020-09-21T04:00:19+0000
/project/airflow-doc-zh/, airflow-doc-zh, 2020.9.21.0, Airflow 中文文档, 2020-09-21T02:36:45+0000
/project/degrotesque/, degrotesque, 1.2, A tiny web type setter, 2020-05-30T20:48:16+0000
/project/voldemort/, voldemort, 0.8.1, Voldemort is a simple static site generator                     using Jinja2 and Markdown templates., 2014-02-06T07:23:47+0000
/project/djungle-modernizer/, djungle-modernizer, 0.0.0, Modernizr and HTML5 Shiv as Django app, 2012-03-14T20:50:48+0000
/project/markdown-figcap/, markdown-figcap, 0.1.1, Extension for Python-Markdown to handle <figure> and <figcaption>., 2019-03-09T04:24:32+0000
/project/jobscraper/, jobscraper, 0.2, Grab all the matching jobs from job portals, 2016-01-14T07:15:23+0000
/project/django-genshi/, django-genshi, 1.1.3, Django integration for Genshi, 2009-04-18T22:50:46+0000
/project/geoformalchemy/, GeoFormAlchemy, 0.4, GeoFormAlchemy - a extension for FormAlchemy that adds support for spatial databases, 2011-12-02T21:25:59+0000
/project/ark/, ark, 3.0.1, A static website generator., 2016-09-06T09:17:28+0000
/project/markupsafe/, MarkupSafe, 1.1.1, Safely add untrusted strings to HTML/XML markup., 2019-02-24T01:04:50+0000
/project/mdxflavours/, mdxflavours, 1.0, Markdown extensions for basic syntax flavoring., 2012-01-10T13:52:00+0000
/project/apifier/, apifier, 2.1.0, A web parser for tabular and/or paginated data, 2017-04-12T10:21:29+0000
/project/shutdown-if-idle/, shutdown_if_idle, 0.0.1, Shutdown machine if considered idle, 2014-03-25T17:25:40+0000
/project/html5prescan/, html5prescan, 0.2.0, Prescan a byte string and return WHATWG and Python encoding names., 2020-08-23T14:58:40+0000
/project/python-creole/, python-creole, 1.4.9, python-creole is an open-source (GPL) markup converter in pure Python for: creole2html, html2creole, html2ReSt, html2textile, 2020-11-04T07:50:10+0000
/project/pyoes/, pyoes, 0.12.2, Algemene onroerenderfgoed stijl (gebaseerd op de Vlaamse huisstijl) voor pyramid, 2021-04-07T07:58:08+0000
/project/wheezy-template/, wheezy.template, 3.1.0, A lightweight template library, 2021-04-17T07:07:39+0000
/project/pyjoyment/, Pyjoyment, 0.0.1, An asynchronous, event driver web framework for the Python programming language., 2016-03-27T12:12:49+0000
/project/mdx-customspanclass/, mdx_customspanclass, 1.1.1, Markdown extension which allows inserting span elements with custom class, 2015-08-19T03:59:24+0000
/project/mkdocs-brudi/, mkdocs-brudi, 0.5.0, A brudi theme for MkDocs based on mkdocs-brudi, 2019-11-12T19:13:59+0000
/project/htmlement/, htmlement, 1.0.0, Pure-Python HTML parser with ElementTree support., 2017-12-02T12:38:30+0000
/project/markdown-no-lazy-blockquote-extension/, Markdown-No-Lazy-BlockQuote-Extension, 0.2, Disable lazy blockquotes for Markdown., 2015-11-26T10:18:46+0000
/project/lightgbm-doc-zh/, lightgbm-doc-zh, 2020.9.21.0, LightGBM 中文文档, 2020-09-21T04:14:51+0000
/project/create-redirect/, create-redirect, 0.1.3, Python script for creating HTML redirects., 2020-12-22T17:05:07+0000
/project/online-judge-tools/, online-judge-tools, 11.3.0, CLI tool to solve problems of competitive programming, 2021-04-23T01:24:15+0000
/project/think-comp-2e-zh/, think-comp-2e-zh, 2020.9.21.0, 复杂性思维 中文第二版, 2020-09-21T04:47:24+0000
/project/omero-fpbioimage/, omero-fpbioimage, 0.4.0, A Python plugin for OMERO.web, 2020-01-13T14:11:51+0000
/project/products-xmlwidgets/, Products.XMLWidgets, 0.13.1, XMLWidgets is a Zope 2 product used to create through the web viewers and editors of ParsedXML content., 2008-09-30T11:04:54+0000
/project/restinpeace/, ReSTinPeace, 0.5.2, A tool to make handling ReStructured Text easier., 2010-09-17T00:48:31+0000
/project/z3c-pt/, z3c.pt, 3.3.0, Fast ZPT engine., 2020-03-31T14:18:59+0000
/project/jinja2-hamlpy/, jinja2-hamlpy, 0.1, HamlPy extension for Jinja2, 2012-08-04T17:06:14+0000
/project/pattern/, Pattern, 3.6, Web mining module for Python., 2018-08-18T17:48:04+0000
/project/django-htmlmin/, django-htmlmin, 0.11.0, HTML minifier for Python frameworks (not only Django, despite the name)., 2019-03-18T01:25:14+0000
/project/govuk-frontend-jinja/, govuk-frontend-jinja, 1.2.1, GOV.UK Frontend Jinja Macros, 2021-03-05T12:42:50+0000
/project/djungle-analytics/, djungle-analytics, 0.0.4, Django template tags for Google Analytics, 2012-06-28T17:18:21+0000
/project/html5lib-typogrify/, html5lib-typogrify, 0.2, Corrects common typographical mistakes., 2020-02-19T09:01:08+0000
/project/pyces/, Pyces, 0.0, XML processing library combining Xerces-C++ with the ElementTree API, 2012-12-06T06:09:03+0000
/project/cmf-pt/, cmf.pt, 1.0, Bridge to use Chameleon with Zope 2 and CMF., 2010-05-12T12:26:54+0000
/project/django-inlinecss-redux/, django-inlinecss-redux, 0.1.4, A Django app useful for inlining CSS (primarily for e-mails), 2020-06-12T15:35:44+0000
/project/renfe-cli/, renfe-cli, 2.1.0, Get faster RENFE Spanish Trains timetables in your terminal, 2020-04-17T23:20:56+0000
/project/mdx-embedly/, mdx_embedly, 0.4.0, Python Markdown extension for embeded url using Embedly, 2017-09-04T05:28:01+0000
/project/gensim-doc-zh/, gensim-doc-zh, 2020.9.21.0, Gensim 中文文档, 2020-09-21T03:55:14+0000
/project/mdx-cite/, mdx_cite, 1.0, Python-Markdown extension to support the <cite> tag., 2012-04-21T21:14:22+0000
/project/cython-doc-zh/, cython-doc-zh, 2020.9.21.0, Cython 3.0 中文文档, 2020-09-21T03:47:44+0000
/project/pdfshift/, pdfshift, 1.0.4, Convert HTML documents to PDF using the PDFShift.io API., 2018-07-03T14:59:06+0000
/project/pymd/, pymd, 0.5.5, wrapper for python markdown but having a full HTML for the output (and nice things), 2013-12-09T16:59:20+0000
/project/witica/, witica, 1.2, Automates publishing content to the Web, 2017-08-12T16:22:15+0000
/project/haufe-stripml/, haufe.stripml, 1.2.2, Python extension for removing markup from strings., 2012-11-08T09:22:50+0000
/project/demodocus/, demodocus, 1.0.0.1, demodocus is Python CLI program to quickly check synchronization maps, 2015-12-12T12:08:55+0000
/project/htool/, htool, 1.0.1, Create and manipulate HTML as objects., 2020-10-10T08:49:20+0000
/project/nlpeasy/, nlpeasy, 0.7.0, Easy Peasy Language Squeezy, 2019-11-24T00:25:59+0000
/project/sklearn-doc-zh/, sklearn-doc-zh, 2020.9.28.0, <center>scikit-learn (sklearn) 官方文档中文版</center>, 2020-09-28T06:07:40+0000
/project/flexable/, flexable, 0.3dev, Template engine with simple data structure, 2007-07-18T10:23:58+0000
/project/pyda-2e-zh/, pyda-2e-zh, 2021.1.2.0, 利用 Python 进行数据分析 · 第 2 版, 2021-01-01T16:10:20+0000
/project/kirlent-sphinx/, kirlent-sphinx, 0.3.0, Sphinx extension for slides and extended tables., 2019-03-28T11:05:10+0000
/project/rainlotus/, RAINLotus, 1.1.2, ✨A new powerful markup language ～ 一门新型的强大的标记语言💪🎄, 2020-04-29T03:34:39+0000
/project/openkongqi/, openkongqi, 0.2.6, Outdoor air quality data, 2021-03-18T08:01:05+0000
/project/ibis/, ibis, 3.2.0, A template engine for people who enjoy the simpler things in life., 2021-03-27T18:22:35+0000
/project/salal/, salal, 0.20.0b0, A system for building websites from templates and content, 2021-04-22T16:56:00+0000
/project/vulcanize/, vulcanize, 0.2, Vulcanizes HTML files that use Polymer, 2014-12-12T17:41:56+0000
/project/wheezy-html/, wheezy.html, 3.0.1, A lightweight html rendering library, 2020-12-02T15:14:43+0000
/project/flourish/, flourish, 0.9.6, Static website generator, 2021-04-22T04:54:18+0000
/project/html2bbcode/, html2bbcode, 2.3.3, HTML to BBCode converter, 2017-01-14T23:03:37+0000
/project/mdhtmlgen/, mdhtmlgen, 0.8, Markdown based html generator, 2021-03-28T15:42:38+0000
/project/simplehttpfetch/, SimpleHttpFetch, 4.0.0, Python module that will, in a single line, fetch an http/https url and return a string or dictionary (JSON), 2016-03-31T23:06:40+0000
/project/plantuml-markdown/, plantuml-markdown, 3.4.2, A PlantUML plugin for Markdown, 2020-12-19T17:39:03+0000
/project/jtmpl/, jtmpl, 0.1.0.4, commandline app for quickly running jsontemplate, 2012-06-29T19:09:41+0000
/project/w2j/, w2j, 0.4, A tool for migrating from WizNote to Joplin., 2021-03-02T11:18:34+0000
/project/piccup/, piccup, 0.1.1, Render HTML from Python using plain data structures, inspired by Clojure's Hiccup, 2019-09-16T20:47:02+0000
/project/pyramid-haml/, pyramid_haml, 0.1.2, Use HAML templates in your pyramid project., 2011-12-07T14:19:21+0000
/project/opengrapher-useragent/, opengrapher-useragent, 0.2.1, Utility for parsing the OpenGraph tags - with customizable User-Agent headers, 2020-07-18T14:11:58+0000
/project/htmlfilter/, htmlfilter, 0.2, White list HTML filter, 2010-05-03T11:55:20+0000
/project/exoskeleton/, exoskeleton, 1.2.5, A library to create a bot / spider / crawler., 2021-04-18T07:45:06+0000
/project/django-reversion-compare/, django-reversion-compare, 0.14.0, history compare for django-reversion, 2021-02-24T14:46:30+0000
/project/materialdjango/, MaterialDjango, 0.2.5, A Django library bringing paper-ui and iron polymer elements to django, 2017-12-19T21:42:12+0000
/project/omero-parade/, omero-parade, 0.2.1, A Python plugin for OMERO.web, 2020-02-27T11:47:35+0000
/project/jbt-zh/, jbt-zh, 2020.9.21.0, JavaBeginnersTutorial 中文系列教程, 2020-09-21T04:11:09+0000
/project/email-scraper/, email-scraper, 0.4, Simple utility to extract email addresses from HTML, including obfuscated email addresses, 2021-03-24T18:12:42+0000
/project/genshi/, Genshi, 0.7.5, A toolkit for generation of output for the web, 2020-11-18T12:16:51+0000
/project/markdown2/, markdown2, 2.4.0, A fast and complete Python implementation of Markdown, 2021-01-22T20:51:09+0000
/project/markyp-fontawesome/, markyp-fontawesome, 0.1910.0, Font Awesome icons for markyp-html webpages., 2019-10-21T20:17:10+0000
/project/fastpt/, FastPt, 0.1dev, Really fast well-formed xml templates, 2010-07-01T14:07:59+0000
/project/mdx-semanticwikilinks/, mdx_semanticwikilinks, 1.1.1, Python-Markdown extension to add support for semantic (wiki)links (RDFa).., 2012-08-15T14:20:18+0000
/project/tablefactory/, TableFactory, 0.1.4, Easily create HTML, spreadsheet, or PDF tables from common Python data sources, 2011-07-18T15:30:48+0000
/project/feed2exec/, feed2exec, 0.17.1, The programmable feed reader, 2021-02-04T22:17:19+0000
/project/lib-rharris/, lib_rharris, 0.1.14, Python Internet Programming Library, 2005-12-15T14:47:57+0000
/project/xpathi/, xpathi, 1.0.0, Library for generating XPath expressions as string using magic methods 🧙✨, 2020-09-05T21:28:55+0000
/project/jinja2-highlight/, jinja2-highlight, 0.6.1, Jinja2 extension to highlight source code using Pygments, 2014-09-13T17:56:37+0000
/project/html5tagger/, html5tagger, 1.1.0, Pythonic HTML5 generation without templating, 2020-03-19T13:51:16+0000
/project/selenium-update/, selenium-update, 0.0.0, Automate Selenium webdriver dependency set up, 2020-08-09T10:21:26+0000
/project/rdfa2rdf/, rdfa2rdf, 0.1, WSGI proxy for transforming RDFa to RDF via RDFa2RDFXML.xsl., 2007-09-26T00:08:25+0000
/project/mrkup/, mrkup, 0.1, Compose HTML (and some XML) using Python, 2020-12-08T13:49:27+0000
/project/html5charref/, html5charref, 0.1.0, Python library for escaping/unescaping HTML5 Named Character References., 2014-09-28T21:01:10+0000
/project/kemmering/, kemmering, 1.0.3, Super simple XMLish tags, 2017-08-08T20:53:50+0000
/project/django-mustache/, django-mustache, 1.1.2, Mustache template engine for Django 1.8 and newer, with support for Django context processors., 2020-01-15T01:02:58+0000
/project/mdx-environment/, mdx_environment, 0.2.0, Python Markdown plugin to insert content and show hide sections based on environment variables, 2016-05-26T03:22:26+0000
/project/ya-ma/, ya-ma, 0.3.8, YANDEX transport API client library, 2019-10-13T13:56:06+0000
/project/nemo-templates/, Nemo-Templates, 0.9.2, Lightweight Templating Language, 2012-04-07T18:17:32+0000
/project/opengraph/, opengraph, 0.5, A module to parse the Open Graph Protocol, 2012-05-25T21:25:51+0000
/project/py2pip/, py2pip, 1.0.2, Master package for Py2PIP, 2020-02-12T16:02:55+0000
/project/os-sys/, os-sys, 2.1.4, a big lib with many usefull tools and it are not only os and sys tools..., 2019-12-10T20:06:28+0000
/project/mdx-textalign/, mdx_textalign, 1.0, Python-Markdown extension to support centering and right-aligning text., 2013-10-14T08:37:55+0000
/project/stanford-cs183-notes/, stanford-cs183-notes, 2020.9.21.0, 斯坦福 CS183 & YC 创业课系列中文笔记, 2020-09-21T04:44:04+0000
/project/loslassa/, Loslassa, 0.3.10, Just another toy static website generator, 2014-11-22T17:14:22+0000
/project/htmler/, htmler, 0.1.3, A simple HTML generation library, 2019-08-04T12:35:48+0000
/project/pytidylib/, pytidylib, 0.3.2, Python wrapper for HTML Tidy (tidylib) on Python 2 and 3, 2016-11-16T01:52:59+0000
/project/mkdocs-kpn/, mkdocs-kpn, 0.24.6, A KPN-styles theme for MkDocs, 2020-12-14T14:20:21+0000
/project/jinja2/, Jinja2, 2.11.3, A very fast and expressive template engine., 2021-01-31T16:33:07+0000
/project/bundled-pdfkit/, bundled-pdfkit, 0.6.1, Wkhtmltopdf python wrapper to convert html to pdf using the webkit rendering engine and qt, 2019-11-18T08:09:16+0000
/project/decorate/, decorate, 1.0.1, Decorate HTML docs by adding them classes by theme, 2016-07-12T06:00:44+0000
/project/lqcuq-zh/, lqcuq-zh, 2020.10.26.0, <center>使用 Qiskit 学习量子计算 - 翻译版</center>, 2020-10-26T11:14:13+0000
/project/rows/, rows, 0.4.1, A common, beautiful interface to tabular data, no matter the format, 2019-02-14T21:12:03+0000
/project/jinja2-precompiler/, jinja2-precompiler, 0.2, Pre-compile Jinja2 templates to Python byte code, 2014-01-06T11:07:22+0000
/project/html2textile/, html2textile, 0.2, A WORKING converter for html -> textile, most of syntax and features is supported, 2011-09-13T21:05:40+0000
/project/tags/, tags, 0.0.3, A toolkit to create HTML code with python, 2009-11-03T13:00:39+0000
/project/imgkit/, imgkit, 1.2.2, Wkhtmltopdf python wrapper to convert html to image using the webkit rendering engine and qt, 2021-04-10T13:49:38+0000
/project/htmlcompare/, HTMLCompare, 0.3.1, library to compare HTML while ignoring non-functional differences, 2020-12-07T16:26:00+0000
/project/bmx/, bmx, 0.0.3, Basic Markup eXpressions, 2021-02-08T20:56:39+0000
/project/tonnikala/, tonnikala, 0.16, Python templating engine - the one ton solution, 2014-11-02T12:43:24+0000
/project/python-pptx-templater/, python-pptx-templater, 1.1.15, Create customizable PowerPoint Presentation (.pptx) using a predefined layout template, 2019-10-27T18:48:32+0000
/project/matplotboard/, matplotboard, 1.1.6, Generate simple HTML dashboards using matplotlib, 2020-03-10T15:35:01+0000
/project/sneakylang/, sneakylang, 0.3.0, Extensible framework for easy creation of extensible WikiLanguages, 2009-03-10T18:35:29+0000
/project/opengraph-py3/, opengraph_py3, 0.71, A module to parse the Open Graph Protocol. Ported to Python3.6 using 2to3-3.6, 2018-02-27T11:52:58+0000
/project/b-py/, b.py, 0.11.0, Post to Blogger or WordPress in markup language seamlessly, 2016-02-26T06:05:05+0000
/project/django-janitor/, django-janitor, 0.5.1, django-janitor allows you to use bleach to clean HTML stored in a Model's field., 2017-10-30T23:40:03+0000
/project/lighty-template/, lighty-template, 0.3.4, Simple template engine for python, 2012-06-15T07:10:34+0000
/project/python-programming-net-zh/, python-programming-net-zh, 2020.9.21.0, PythonProgramming.net 系列教程, 2020-09-21T04:39:23+0000
/project/dido/, dido, 0.0.1.0, dido is an API server and Web application for the aeneas forced aligner, 2017-03-09T14:41:19+0000
/project/mkdocs-pachyderm/, mkdocs-pachyderm, 1.2.10, Pachyderm Documentation theme, 2020-07-20T21:38:21+0000
/project/markdown-no-lazy-code-extension/, Markdown-No-Lazy-Code-Extension, 0.1, Disable lazy code blocks for Markdown., 2015-11-26T11:46:53+0000
/project/jinja2loader/, Jinja2Loader, 0.1.0, This module prodives a decorator for using jinja2 templates with cherry py in an easy way!, 2017-03-21T05:57:18+0000
/project/deadcheck/, deadcheck, 0.0.3.3.1, Deadlink Check Utility using Python Modules, 2015-03-10T07:11:56+0000
/project/ipy-table/, ipy_table, 1.15.1, Creates richly formatted tables in a Jypyter Notebook, 2017-08-25T23:41:39+0000
/project/xmlwitch/, xmlwitch, 0.3, xmlwitch offers Pythonic XML generation through context generators, 2016-08-25T20:29:21+0000
/project/async-markdown/, async-markdown, 3.3.4, Asynchronous version of the Markdown package., 2021-04-09T21:29:07+0000
/project/handroll/, handroll, 3.1, A website generator for software artisans, 2016-12-26T15:41:00+0000
/project/markdown-djangostaticimage/, markdown-djangostaticimage, 0.1, Markdown extension: Add static tag to image source, 2017-10-24T07:32:11+0000
/project/pinyin-markdown/, pinyin_markdown, 0.8.2, Type Chinese pinyin with tone numbers in Markdown. Get accented pinyin., 2017-02-09T23:30:19+0000
/project/druid/, Druid, 0.2.1, Doing Magic things with Tumulus, 2014-08-11T13:11:21+0000
/project/mdx-outline/, mdx_outline, 1.3.0, Python-Markdown extension to wrap the document logical sections (as implied by h1-h6 headings), 2017-05-31T23:37:22+0000
/project/fasttext-doc-zh/, fasttext-doc-zh, 2020.9.21.0, FastText 中文文档, 2020-09-21T03:52:29+0000
/project/bamanro-django-markdownx/, bamanro-django-markdownx, 2.0.29, A comprehensive Markdown editor built for Django., 2019-06-25T13:44:37+0000
/project/beautifulsoup4/, beautifulsoup4, 4.9.3, Screen-scraping library, 2020-10-03T15:37:19+0000
