/project/fsnix/, fsnix, 0.2, Expose more advanced posix/file system APIs to Python, 2012-11-12T20:42:35+0000
/project/fixturefilehandler/, fixturefilehandler, 1.4.0, This project helps you to vacate specific file path or deploy resource file into specific file path when unit testing., 2020-08-17T06:19:26+0000
/project/hachoir/, hachoir, 3.1.2, Package of Hachoir parsers used to open binary files, 2021-02-15T11:03:12+0000
/project/in-place/, in-place, 0.5.0, In-place file processing, 2021-02-20T20:46:33+0000
/project/speedcopy/, speedcopy, 2.1.0, Replacement or alternative for python copyfile()utilizing server side copy on network shares for fastercopying., 2020-06-09T15:12:02+0000
/project/aioflock/, aioflock, 0.0.1, File lock support for asyncio., 2015-08-28T16:06:17+0000
/project/pyznap/, pyznap, 1.6.0, ZFS snapshot tool written in Python, 2020-09-22T18:06:26+0000
/project/py-splice/, py-splice, 1.0.2, A Python interface to splice(2), 2018-11-30T18:39:41+0000
/project/pydirstat/, pydirstat, 0.9.15, Show statistics informations for a directory in HTML, SVG, or Flash., 2006-11-02T22:45:52+0000
/project/perplex/, perplex, 0.0.1, Perpetual Plex in the Cloud, 2018-12-23T05:33:08+0000
/project/dewi-commands/, dewi-commands, 2.1.1, A toolchain and framework for everyday tasks, 2020-07-03T21:26:57+0000
/project/pymmbtool/, pymmbtool, 1.0.0, Command line tools to manage BBC Microcomputer DFS disk images and MMB disk bundles, 2020-05-13T08:05:00+0000
/project/bitdust/, bitdust, 0.0.2, BitDust is a decentralized on-line storage network for safe, independent and private communications., 2019-05-11T17:54:37+0000
/project/jaffle/, jaffle, 0.2.4, Python app and process orchestration tool for development environment, 2018-06-17T06:02:59+0000
/project/mutagen-helper/, mutagen-helper, 2.0.0, Mutagen Helper allow you to define Mutagen synchronisation sessions inside a configuration file on directories you want to synchronise. Created sessions are marked with a session name and a project name that makes them easier to manage., 2021-04-19T12:34:27+0000
/project/ipfshttpclient/, ipfshttpclient, 0.7.0, Python IPFS HTTP CLIENT library, 2021-03-15T10:33:37+0000
/project/airfs/, airfs, 1.5.0, A Python library for cloud and remote file Systems, 2020-11-24T20:05:49+0000
/project/timefops/, timefops, 0.3, A cross-platform module for file operations based on time., 2020-12-01T04:29:21+0000
/project/compactpath/, compactpath, 0.5.0, a python package to compact filepaths to a desired length, 2008-06-19T16:43:51+0000
/project/rs-pyinotify/, rs-pyinotify, 0.9.9, Linux filesystem events monitoring, 2017-10-24T22:15:54+0000
/project/dewi-utils/, dewi-utils, 2.5.0, A toolchain and framework for everyday tasks, 2021-02-21T17:55:42+0000
/project/fich/, fich, 0.5, Suppression sécurisée et hashage., 2019-03-08T19:25:30+0000
/project/fusepyng/, fusepyng, 1.0.7, Simple ctypes bindings for FUSE, 2018-10-24T01:05:40+0000
/project/fs1/, fs1, 0.6.0, Filesystem abstraction layer, 2017-01-11T17:32:51+0000
/project/pi/, pi, 0.1.2, Simpler python package installation, 2014-05-05T14:43:11+0000
/project/libcgroup/, libcgroup, 0.2.4, A library that handles Linux cgroups internally using the libcgroup shared library., 2019-03-29T18:24:36+0000
/project/aioipfs/, aioipfs, 0.5.5, Asynchronous IPFS client library, 2021-03-11T02:52:16+0000
/project/googledriveaccess/, googleDriveAccess, 0.1.6, update spreadsheet with OAuth2 and recursive upload to Google Drive ( supports OAuth2, Calendar, Gmail, geocoding, spreadsheet, etc ) and import-export Google Apps Script source code, 2014-08-07T17:04:21+0000
/project/capidup-cli/, capidup-cli, 1.0.0, Quickly find duplicate files in directories (CLI utility), 2016-07-17T17:40:48+0000
/project/xrosfs/, xrosfs, 0.1.1, Mount a Running Docker Container File Sytem via FUSE, 2018-02-11T07:32:16+0000
/project/artifactory/, artifactory, 0.1.17, A Python to Artifactory interface, 2016-03-12T17:36:32+0000
/project/pyfsevents/, pyfsevents, 0.1, Low level interface to FSEvents primitives, 2009-08-24T20:12:27+0000
/project/fuse-adfs/, fuse_adfs, 0.20, A FUSE filesystem for ADFS disc images, 2008-07-13T15:50:15+0000
/project/filework/, filework, 1.1.2, A simple wrapper class for easy reading from/iterating through, writing, and appending to files., 2017-09-14T14:02:56+0000
/project/qrc-pathlib/, qrc-pathlib, 1.0.2, Extension for pathlib that implements Path and PurePath for Qt Resources System., 2016-04-29T20:54:26+0000
/project/infi-watchdog/, infi.watchdog, 0.6.3, Filesystem events monitoring, 2013-02-26T13:39:26+0000
/project/libnfs/, libnfs, 1.0.post4, NFS client for Python., 2016-11-06T22:55:10+0000
/project/ptree/, ptree, 0.3, Work with PairTree file system convention, 2020-08-27T14:11:21+0000
/project/nomoney-shop/, nomoney.shop, 0.1.0, Plattform to exchange goods and services and calculate possible deals direct and indirect, 2020-04-08T19:36:25+0000
/project/pytagfs/, pytagfs, 0.0.2, A FUSE filesystem which manages files via tags instead of containing them in folders., 2021-04-15T09:31:04+0000
/project/pynfsclient/, pyNfsClient, 0.1.5, Pure python NFS client, 2019-06-04T06:52:02+0000
/project/notion-export-enhancer/, notion-export-enhancer, 0.0.5, Export and _enhance_, takes Notion's export and makes it just a bit more usable., 2021-02-15T23:21:35+0000
/project/refuse/, refuse, 0.0.4, Simple cross-plattform ctypes bindings for libfuse / FUSE for macOS / WinFsp, 2020-07-10T19:35:35+0000
/project/rc-cli/, rc-cli, 0.4.1, RoseCloud CLI, 2019-03-28T19:29:00+0000
/project/remcmp/, remcmp, 2.1.0.post2, Extensible program to compare local and remote directories., 2019-10-02T20:54:09+0000
/project/kubefuse/, kubefuse, 0.7.3, A FUSE file system for Kubernetes, 2016-08-24T09:43:37+0000
/project/zfstui/, zfstui, 0.1.1, terminal user interface for the ZFS filesystem, 2018-11-03T11:42:51+0000
/project/pollinotify/, pollinotify, 1.2, inotify wrapper providing polling with timeout for specified filesystem events, 2017-12-25T05:09:30+0000
/project/getdents/, getdents, 0.3, Python binding to linux syscall getdents64., 2019-07-28T11:26:14+0000
/project/wsl-path-converter/, wsl-path-converter, 0.3.1, Convert between Linux and Windows path in WSL, 2019-08-05T13:04:54+0000
/project/fs-s3fs-ng/, fs-s3fs-ng, 1.1.2b4, Amazon S3 filesystem for PyFilesystem2, with streaming and non-strict by default, 2019-11-17T15:14:39+0000
/project/batchpath/, batchpath, 0.2, Developer utility to generate and verify pathnames, 2015-02-03T18:18:53+0000
/project/cdblib/, cdblib, 0.5, Read and write cdb ("constant database") files, 2009-06-19T23:25:31+0000
/project/pyfsftpserver/, pyfsftpserver, 0.2.0, A simple ftp server for serving PyFilesystem2 filesystems., 2020-12-05T01:51:08+0000
/project/ipfs-api-mount/, ipfs-api-mount, 0.4.1, Mount IPFS directory as local FS., 2021-03-16T07:50:21+0000
/project/winpath/, winpath, 202002.2, Retrieves common Windows folders as Unicode strings, 2020-02-02T23:51:31+0000
/project/brunnhilde/, brunnhilde, 1.9.1, A Siegfried-based digital archives reporting tool for directories and disk images, 2020-08-02T02:54:17+0000
/project/count-files/, count-files, 1.5.0, A command-line interface (CLI) utility that helps you count all the files or search for files with a certain file extension (or without it) in the specified directory., 2019-08-09T19:13:51+0000
/project/matanui/, matanui, 0.1.0, MataNui Replicating Grid Data Server, 2011-02-03T01:35:15+0000
/project/pathvalidate/, pathvalidate, 2.4.1, pathvalidate is a Python library to sanitize/validate a string such as filenames/file-paths/etc., 2021-04-03T16:46:41+0000
/project/django-hadoop-storage/, django-hadoop-storage, 0.1.3, Module for use hadoop file system (hdfs) as django storage, 2020-04-24T16:44:38+0000
/project/temptree/, temptree, 0.2.1, Generates temporary files and directories from a tree, 2019-09-23T09:06:12+0000
/project/fuse-python/, fuse-python, 1.0.3, Bindings for FUSE, 2021-02-19T07:30:46+0000
/project/pyisis/, pyIsis, 0.2.3, Python wrapper for Avid Isis Client Management Console, 2018-08-14T12:40:43+0000
/project/zzzfs/, zzzfs, 0.1.2, Dataset management à la ZFS, 2017-05-07T16:16:36+0000
/project/pytest-resource-path/, pytest-resource-path, 1.2.1, Provides path for uniform access to test resources in isolated directory, 2020-08-18T15:33:09+0000
/project/watcher/, watcher, 0.2.1, FileSystemWatcher clone for CPython, 2011-02-25T20:19:43+0000
/project/python-fsutil/, python-fsutil, 0.4.0, file-system utilities for lazy devs., 2020-12-23T13:25:25+0000
/project/pyfs/, pyfs, 0.0.8, a pythonic file system wrapper for humans, 2016-02-26T14:41:07+0000
/project/radula/, radula, 0.8.7, RadosGW client for Ceph S3 storage, 2019-04-05T19:58:03+0000
/project/s3cache/, s3cache, 0.1.1, Local cache of S3 buckets, 2016-09-12T16:12:25+0000
/project/zpoolparty/, zpoolparty, 0.1.2, Execute ZFS dataset commands transparently across pools/hosts, 2017-03-20T14:09:10+0000
/project/fs-miniofs/, fs-miniofs, 1.1.2, MinIO S3 filesystem for PyFilesystem2, 2020-03-19T22:55:26+0000
/project/ptpy/, ptpy, 0.3.2, A pure Python implementation of Picture Transfer Protocol., 2017-12-19T10:21:34+0000
/project/image-rename/, image-rename, 0.2.0, Rename the picture by looking through the human eye and typing. (you don't need to open the file by yourself), 2020-10-11T16:50:34+0000
/project/haruspex/, haruspex, 0.3.1, filesystem haruspicy, 2020-11-25T00:39:22+0000
/project/filetype/, filetype, 1.0.7, Infer file type and MIME type of any file/buffer. No external dependencies., 2020-04-28T18:33:46+0000
/project/pathtools/, pathtools, 0.1.2, File system general utilities, 2011-08-25T09:39:30+0000
/project/filename-sanitizer/, filename-sanitizer, 0.1.0, A Python 2.7/3.2+ package to sanitize filenames in a (hopefully) cross-platform, cross-filesystem manner., 2018-11-18T16:06:07+0000
/project/gdrivefs/, gdrivefs, 0.14.13, A complete FUSE adapter for Google Drive., 2020-03-30T22:45:42+0000
/project/find-ff/, find-ff, 600, A tool for finding files in the filesystem, 2021-04-09T11:50:38+0000
/project/pyfatfs/, pyfatfs, 0.2.0, FAT12/16/32 implementation with VFAT support, 2021-04-07T17:07:31+0000
/project/zsm-lib/, zsm-lib, 0.2.1, ZFS Snapshot Manager Library, 2021-01-24T23:13:21+0000
/project/abgleich/, abgleich, 0.0.7, zfs sync tool, 2020-08-05T10:03:35+0000
/project/ticktock/, ticktock, 0.1.2, adds least-recently-used cache management and automatic data timeout to Python's Shelf class., 2014-03-18T11:07:16+0000
/project/droblo/, droblo, 0.0.9, A multi-hosts, PostgreSQL backed, filesystem duplication detection system., 2019-01-20T09:56:21+0000
/project/btrfs-sxbackup/, btrfs-sxbackup, 0.6.11, Incremental btrfs snapshot backups with push/pull support via SSH, 2017-03-23T10:09:38+0000
/project/lazydog/, lazydog, 0.1.1, User-level filesystem event observer, 2018-05-03T15:31:21+0000
/project/littlefs-python/, littlefs-python, 0.2.0, A python wrapper for littlefs, 2020-04-13T19:23:10+0000
/project/linkat/, linkat, 1.1, Python support for the POSIX/Linux functions linkat and symlinkat., 2014-10-23T22:52:41+0000
/project/fscacher/, fscacher, 0.1.4, Caching results of operations on heavy file trees, 2021-02-22T19:39:44+0000
/project/fs-youtube/, fs.youtube, 0.3.1, Youtube Filesystem for PyFilsystem2, 2019-10-15T11:42:15+0000
/project/pyfakefs/, pyfakefs, 4.4.0, pyfakefs implements a fake file system that mocks the Python file system modules., 2021-02-24T20:32:54+0000
/project/3xsd/, 3xsd, 0.0.26, 3xsd is a native epoll server serving TCP/UDP connections, a high performance static web server, a failover dns server, a http-based distributed file server, a load-balance proxy-cache server, and a warp-drive server. Written in python, take the full power of multi-cores., 2016-10-29T06:32:20+0000
/project/pydf/, pydf, 12, colourised df(1)-clone, 2015-04-03T15:29:48+0000
/project/pyreduce/, pyreduce, 1.0.1, Reduce Python programs, 2018-12-05T06:43:01+0000
/project/ssd-checker/, ssd-checker, 1.0.3, Solid-state drive (ssd) checker, 2021-02-15T19:28:29+0000
/project/svfs/, SVFS, 2.0.0, Multi-purpose virtual file system inside single file, 2012-07-19T08:25:32+0000
/project/dupfilefind/, dupfilefind, 1.6.9, find files with identical contents, or print out a list of all files and their md5 sums and sizes, 2010-04-22T05:23:07+0000
/project/fs-sshfs/, fs.sshfs, 1.0.0, Pyfilesystem2 over SSH using paramiko, 2021-01-29T00:34:08+0000
/project/mendeley-watchdog/, mendeley-watchdog, 0.0.2, Continuously monitor a file and mirror the content after modification, 2021-03-05T00:03:09+0000
/project/py-usvfs/, py-usvfs, 0.2.0, Python bindings for the userspace virtual filesystem (usvfs) library, 2019-07-09T15:57:01+0000
/project/pyzfs/, pyzfs, 0.2.3, Wrapper for libzfs_core, 2016-03-24T15:20:30+0000
/project/count-money/, count-money, 0.7.1, A tkinter based GUI application that helps you count money., 2019-08-12T01:20:28+0000
/project/iatorrent/, iaTorrent, 0.1.4, This module can be used to snatch torrents for each collection object from a given Internet archive collection., 2013-02-06T03:38:05+0000
/project/aiofile-linux/, aiofile-linux, 0.1.0, Linux aio ABI wrapper, 2019-01-30T07:57:49+0000
/project/galacteek/, galacteek, 0.5.0, Browser for the distributed web, 2021-03-16T17:55:02+0000
/project/fs-omero-pyfs/, fs-omero-pyfs, 0.0.5, OMERO PyFilesystem2 filesystem, 2020-01-04T21:05:28+0000
/project/dewi-realtime-sync/, dewi-realtime-sync, 2.0.0, DEWI realtime sync framework: synchronize a directory to another or to a server, 2019-01-22T13:49:56+0000
/project/cmpdisktree/, cmpdisktree, 0.1.2, Compare Directories as macOS Disk Structures, 2019-12-03T07:29:31+0000
/project/yorm/, YORM, 1.6.2, Automatic object-YAML mapping for Python., 2019-03-23T23:16:50+0000
/project/containerutil/, containerutil, 0.2.0, Tools for inspecting contents of docker container filesystem., 2018-01-18T12:17:32+0000
/project/ficl/, ficl, 0.0.1-alpha, Empty large batches of files in one command, 2020-05-17T20:58:31+0000
/project/splitviewfuse/, splitviewfuse, 0.3.1, A fuse implementation for an segmented view on a given directory., 2016-10-30T15:39:28+0000
/project/save-thread-result/, save-thread-result, 0.0.6, Simple subclass wrapper around `threading.Thread` to get the return value from a thread in python (from `threading` built-in module in Python Standard library). Exact same interface for creating an instance of this threading sublcass as `threading.Thread`!, 2021-02-08T00:27:52+0000
/project/deplicate/, deplicate, 1.2.3, Advanced Duplicate File Finder for Python. Nothing is impossible to solve., 2017-09-12T02:34:07+0000
/project/fslib/, fslib, 0.3.4, Wrapper around low-level FS-related calls, with support for advanced FS stacking, 2020-07-15T21:01:14+0000
/project/dewi/, dewi, 2.1.0, DEWI - A toolchain and framework for everyday tasks, 2020-07-03T21:32:30+0000
/project/imagemounter/, imagemounter, 3.1.0, Command line utility and Python package to ease the (un)mounting of forensic disk images., 2017-08-06T09:44:33+0000
/project/symbolic-file-system/, Symbolic-File-System, 2.0.0, Lightweight file manager for backing up and organizing your data, 2018-12-31T08:27:43+0000
/project/txboxdotnet/, txboxdotnet, 15.5.0, Twisted-based async interface for Box (box.net) API v2.0, 2015-05-02T10:11:34+0000
/project/py7file/, py7file, 0.7.4, Convenient File Handling Library, 2011-11-19T23:25:20+0000
/project/sanpai/, sanpai, 0.1, sanpai is a tool for inspecting and diffing SANs on x509 certificates, 2016-10-18T04:05:42+0000
/project/emojifs/, emojifs, 0.2.0, A FUSE filesystem to manipulate custom emojis on your various Slacks and Discords, 2020-09-29T22:03:22+0000
/project/fstpy/, fstpy, 0.1.0, Bridging FTP and cloud storage, 2021-01-19T15:02:14+0000
/project/crypto-drive-manager/, crypto-drive-manager, 3.0, Unlock all your encrypted drives with one pass phrase., 2018-01-17T23:20:53+0000
/project/standardnotes-fs/, standardnotes-fs, 0.0.2, Mount your Standard Notes as a filesystem., 2018-05-29T21:29:27+0000
/project/filemarx/, filemarx, 0.1.0, Validate a directory structure using JSON schemas, 2015-03-01T15:28:17+0000
/project/acdcli/, acdcli, 0.3.2, a command line interface and FUSE filesystem for Amazon Cloud Drive, 2016-08-24T14:45:16+0000
/project/iterpath/, iterpath, 0.2.0, Iterate through a file tree, 2021-02-19T15:19:59+0000
/project/finder-tags-butler/, finder-tags-butler, 0.1.dev2, Synchronize Mac OS Finder tags between several machines, 2020-12-17T15:55:15+0000
/project/macresources/, macresources, 1.2, Library for working with legacy Macintosh resource forks, 2020-06-23T05:52:35+0000
/project/bytesplitter/, ByteSplitter, 1.0.4, A tiny Python utility for splitting any binary files into parts and combining them back, 2019-02-25T17:56:57+0000
/project/fs-smbfs/, fs.smbfs, 1.0.1, Pyfilesystem2 over SMB using pysmb, 2021-04-12T14:39:50+0000
/project/unitypackage-extractor/, unitypackage-extractor, 1.0.0, Extractor for .unitypackage files, 2020-05-17T05:32:42+0000
/project/ssd/, ssd, 1.0.0, Solid-State Drive Checker, 2017-07-22T21:43:52+0000
/project/pyimapi/, pyIMAPI, 0.4.0b2, Create CD, DVD, DVD Dual Layer, and BluRay ISO images under Windows directly from Python, 2018-06-25T06:47:36+0000
/project/dutree/, dutree, 1.6, Disk usage summary, showing large dirs/files, 2019-08-27T09:05:09+0000
/project/volumeutil/, volumeutil, 1.1.0, A small utility for mount/unmount volume in Windows., 2012-04-13T14:33:40+0000
/project/snapbtr/, snapbtr, 0.1, Simple btrfs snapshots management, 2017-09-10T18:51:31+0000
/project/tinyhdfs/, tinyhdfs, 1.1.4, Tiny client for HDFS, base on WebHDFS, 2016-10-09T04:15:23+0000
/project/dephell-archive/, dephell-archive, 0.1.7, pathlib for archives, 2020-05-30T14:55:54+0000
/project/pyftpdlib/, pyftpdlib, 1.5.6, Very fast asynchronous FTP server library, 2020-02-16T15:43:49+0000
/project/pyreadpartitions/, pyreadpartitions, 1.1.1, Read MBR and GPT partitions directly in python., 2020-12-18T16:16:45+0000
/project/stackby/, stackby, 0.4, Instant coding answers via the command line, 2018-06-10T19:24:18+0000
/project/basefs/, basefs, 0.7, Basically Available, Soft state, Eventually consistent File System, 2016-04-22T08:20:48+0000
/project/baculafs/, BaculaFS, 0.1.7, Bacula Filesystem in USErspace, 2010-12-30T21:40:01+0000
/project/pathlib/, pathlib, 1.0.1, Object-oriented filesystem paths, 2014-09-03T15:41:44+0000
/project/win32-setfiletime/, win32-setfiletime, 1.0.0, A small Python utility to set file creation/modified/accessed time on Windows, 2020-07-17T02:07:47+0000
/project/dlow/, dlow, 0.3.4, A library for downloading an S3 folder recursively and unzipping its contents. Extensible to other sources and post-processes., 2018-03-20T08:24:14+0000
/project/trueaction-mongofile/, trueaction.mongofile, 0.2.3, A way to read, write, and append file-like objects to MongoDB, 2012-07-02T04:43:47+0000
/project/fs-dlna/, fs.dlna, 0.2.7, Youtube Filesystem for PyFilsystem2, 2019-10-07T22:00:30+0000
/project/filepath/, filepath, 0.1, Object-oriented filesystem path representation., 2010-06-24T01:31:45+0000
/project/everlib/, everlib, 0.0.1, Everlasting media library backed by cloud storage, 2020-02-03T02:15:23+0000
/project/thumbtack/, thumbtack, 0.3.3, Service to manage disk image mounts., 2021-03-03T20:51:19+0000
/project/kryptal/, kryptal, 0.1.18, Manage encrypted file systems, for example to encrypt your cloud storage., 2020-10-11T11:03:08+0000
/project/pyproxyfs/, PyProxyFS, 0.8, Simple filesystem abstraction, 2011-11-15T22:20:36+0000
/project/flask-filer/, flask-filer, 0.1.1, A Flask extension that integrates PyFilesystem2, 2019-04-23T04:32:07+0000
/project/chunkfile/, chunkfile, 1.0.0b2, A file-like interface backed by multiple smaller files., 2017-05-27T22:43:45+0000
/project/zfec/, zfec, 1.5.5, An efficient, portable erasure coding tool, 2020-11-12T14:03:44+0000
/project/taggo/, taggo, 0.18.0, Tag organizer that creates symlinks from filename-tags, 2019-12-07T21:44:08+0000
/project/pyfuse3/, pyfuse3, 3.2.0, Python 3 bindings for libfuse 3 with async I/O support, 2020-12-30T20:03:06+0000
/project/fs-proxy/, fs.proxy, 0.1.4, Miscellaneous proxy filesystems for Pyfilesystem2, 2017-09-18T14:39:13+0000
/project/py-versioning/, py_versioning, 1.0.0, Set of tools helping in versioning projects, 2015-01-25T19:07:33+0000
/project/btrfs/, btrfs, 11, Python module to inspect btrfs filesystems, 2019-03-06T22:56:41+0000
/project/pyartifactory/, pyartifactory, 1.8.3, Typed interactions with the Jfrog Artifactory REST API, 2021-04-12T19:06:47+0000
/project/freeway/, freeway, 0.0.12, Freeway is a module for managing file system structures with recursive pattern rules., 2020-10-30T22:32:23+0000
/project/testtube/, testtube, 1.1.0, testtube is a Python based continuous test runner.

testtube's stir command can, based on a tube.py configuration file, monitor
a directory for file changes and execute a pre-configured set of tests when
changes occur., 2016-06-13T20:38:01+0000
/project/fileperms/, fileperms, 1.0.4, fileperms is small library for describing file permissions, 2016-10-06T16:04:56+0000
/project/xzip/, xzip, 0.10, E[x]ploded zip file system in FUSE, 2012-05-02T21:05:15+0000
/project/hashfs/, hashfs, 0.7.2, A content-addressable file management system., 2019-10-25T03:43:50+0000
/project/timegaps/, timegaps, 0.1.1, Accept or reject items based on age categorization., 2014-05-19T15:38:11+0000
/project/huefs/, huefs, 0.0.1a2, Philips Hue as a FUSE filesystem, 2018-03-22T07:35:19+0000
/project/pyvenvwrapper/, pyvenvwrapper, 1.0.0, pyvenvwrapper is a small and lightweight set of Bash script functions, that enhance the use of venv module for management of virtual environments., 2018-09-16T13:07:03+0000
/project/bagit/, bagit, 1.8.1, Create and validate BagIt packages, 2021-02-08T18:53:20+0000
/project/udiskie/, udiskie, 2.3.3, Removable disk automounter for udisks, 2021-03-05T14:13:46+0000
/project/txonedrive/, txOneDrive, 15.10.0, Obsolete twisted-based python async interface for old MS OneDrive API, 2015-10-25T05:48:37+0000
/project/chainerio/, chainerio, 0.1.2, Chainer IO library, 2020-04-20T08:26:06+0000
/project/petropy/, petropy, 0.1.6, A package to calculate petrophysical properties for formation evaluation., 2018-02-15T16:16:27+0000
/project/safecopy/, safecopy, 1.2.5, Simple secure file copy. Alternative to rsync., 2021-01-02T11:21:44+0000
/project/ignorelib/, ignorelib, 0.3.0, Use the syntax and semantics of gitignore with custom ignore file names and locations, 2020-10-27T15:29:28+0000
/project/aiowebhdfs/, aiowebhdfs, 0.0.2, A modern and asynchronous web client for WebHDFS, 2020-03-31T02:12:45+0000
/project/zfs-tools-zbackup/, zfs-tools-zbackup, 0.5.1, ZFS synchronization and snapshotting tools, 2018-12-13T22:39:20+0000
/project/deplicate-cli/, deplicate-cli, 0.1.1, Command Line Interface for deplicate., 2017-07-12T16:04:18+0000
/project/bagit-profile/, bagit-profile, 1.3.1,  This module can be used to validate BagitProfiles., 2020-03-24T13:09:29+0000
/project/fs-basespace/, fs-basespace, 0.2.0, Illumina Basespace filesystem for PyFilesystem2, 2020-03-29T22:03:31+0000
/project/binario/, binario, 0.0.4, Package that lets an application read/write primitive data types from an underlying input/output stream as binary data., 2014-08-21T18:02:28+0000
/project/hubd/, hubd, 0.1, Real-time JSON MVC Framework, 2012-02-17T07:05:45+0000
/project/pyisis-readonly/, pyIsis_ReadOnly, 0.2.2, Python wrapper for Avid Isis Client Management Console, 2016-02-10T20:52:31+0000
/project/fs-smb-int/, fs-smb-int, 2.4.11, fs-smb_int, 2019-10-16T11:29:46+0000
/project/spymaster/, spymaster, 0.3, A pure python MFT parser, 2019-04-30T12:22:30+0000
/project/rinstall/, rinstall, 0.2.3, A configurable installer CLI for installing R from source (sudo and non-sudo)., 2019-04-12T22:20:29+0000
/project/fs-sparse/, fs-sparse, 0.1, A wrapper for sparse file detection, 2018-03-02T17:26:21+0000
/project/superblock/, superblock, 0.2.1, A script written in Python 2 to analyze the superblock of an ext2/ext3 formatted file., 2013-01-30T18:55:55+0000
/project/fs-archive/, fs.archive, 0.6.2, Enhanced archive filesystems for Pyfilesystem2, 2019-02-22T12:41:04+0000
/project/ibooks/, ibooks, 0.3, iBooks Author cover and metadata extraction, 2013-07-29T21:46:55+0000
/project/ftputil/, ftputil, 5.0.1, High-level FTP client library (virtual file system and more), 2021-03-18T16:16:41+0000
/project/cloudrepoanalytics/, CloudRepoAnalytics, 2.0.0, Flask and Annie-based server to keep track of CloudRepo artifact download counts, 2020-06-01T01:30:00+0000
/project/fuzzify/, fuzzify, 0.0.1, rSync fuzzy file pool creation, 2014-09-22T19:52:12+0000
/project/vsqs/, vsqs, 0.3, A very simple message queuing system inspired on Amazon's SQS., 2014-11-30T05:33:06+0000
/project/thumbtack-client/, thumbtack-client, 0.3.0, Connect to a Thumbtack Server., 2020-12-04T14:27:59+0000
/project/javanicus/, Javanicus, 0.1, A WebHDFS FUSE driver, 2013-05-10T23:09:19+0000
/project/fsscan/, fsscan, 0.0.4, Directory scanner, 2018-07-24T19:27:54+0000
/project/zfs-tools/, zfs-tools, 0.5.1, ZFS synchronization and snapshotting tools, 2020-01-04T00:10:51+0000
/project/nekumo/, nekumo, 0.1.2, Package description, 2017-03-05T05:12:48+0000
/project/pymmbgui/, pymmbgui, 0.1.3, GUI tool to manage BBC Microcomputer DFS disk images and MMB disk bundles, 2020-05-11T17:10:57+0000
/project/rsfile/, RSFile, 2.2, RSFile advanced I/O file streams, 2019-01-20T09:50:01+0000
/project/bigos/, bigos, 0.0.3, Do stuff on file change, 2014-04-30T18:02:07+0000
/project/pycosio/, pycosio, 1.3.3, Python Cloud Object Storage I/O, 2019-07-03T13:32:09+0000
/project/extractor/, Extractor, 0.5, bindings for GNU libextractor, the metadata extractor, 2006-06-01T22:15:33+0000
/project/remarkable-fs/, remarkable-fs, 0.1.2, A FUSE filesystem driver for the reMarkable tablet, 2018-03-04T17:28:29+0000
