/project/arista/, arista, 0.9.3, An easy multimedia transcoder for GNOME, 2009-06-28T20:14:47+0000
/project/sublime-music/, sublime-music, 0.11.11, A native GTK *sonic client., 2021-02-11T18:13:07+0000
/project/ecsu-mid-project/, ECSU_Mid_Project, 1.1, Extracts HTML data with python regex and convert the data to a csv file, 2018-10-09T18:05:36+0000
/project/file-converter/, File_Converter, 0.1, Make me them backups, 2018-10-04T15:28:11+0000
/project/plib-gui/, plib.gui, 0.10.3, A simple Python GUI framework., 2019-09-23T06:30:59+0000
/project/tryton/, tryton, 5.8.7, Tryton desktop client, 2021-04-16T17:01:24+0000
/project/btc-price-notifier/, btc-price-notifier, 0.0.1a5, Bitcoin price notifier, 2018-03-08T23:35:48+0000
/project/gampc/, gampc, 0.3.0, Graphical Asynchronous Music Player Client, 2021-03-21T18:03:31+0000
/project/daily-notes/, daily-notes, 0.1.1, This program is targeted to who will make some notes everyday., 2008-10-06T05:56:20+0000
/project/pole/, pole, 1.2.0, A micro framework for PyGtk, PDF, XML, Utilities and Brazilan NFe., 2019-05-16T19:19:31+0000
/project/xpl/, xpl, 0.8.6.2, XPS spectrum analysis, 2019-09-23T12:11:31+0000
/project/vocball/, vocball, 1.1.0, Play vocabulary football in class, 2019-12-27T12:25:01+0000
/project/dr14-t-meter/, DR14-T.meter, 1.0.16, Compute the DR14 of a given audio file according to the procedure described by the Pleasurize Music Foundation, 2015-01-04T17:51:07+0000
/project/sotlogger/, sotlogger, 1.0, SOT Library, Maintain event logs in casandra database using python connection script., 2014-10-15T08:17:06+0000
/project/browse-ocrd-physical-import/, browse-ocrd-physical-import, 0.2.1, Plugin for browse-ocrd to scan book pages with an android phone camera, 2020-08-07T21:46:40+0000
/project/couch/, couch, 1.0.1, Graphical UI for shuffling names in a game of Four on the Couch, 2019-08-12T14:59:54+0000
/project/bennu/, bennu, 0.4.1a10, muchu's utility module, 2016-09-07T23:51:37+0000
/project/rafcon/, rafcon, 0.14.6, Develop your robotic tasks with hierarchical state machines using an intuitive graphical user interface, 2020-08-04T11:02:27+0000
/project/pymodbus/, pymodbus, 2.5.1, A fully featured modbus protocol stack in python, 2021-04-01T06:19:31+0000
/project/storytext/, StoryText, 3.12, An unconvential GUI-testing tool for UIs written with PyGTK, Tkinter, wxPython, Swing, SWT or Eclipse RCP, 2015-03-13T12:27:11+0000
/project/tl-buildout-gtk/, tl.buildout_gtk, 0.2.2, A zc.buildout recipe for installing pygtk, pyobject and pycairo., 2011-01-02T19:42:47+0000
/project/xinput-gui/, xinput-gui, 0.3.1, A simple GUI for Xorg's Xinput tool., 2019-07-20T05:03:14+0000
/project/ledgertools/, ledgertools, 0.3, Ledger accounting system utilities, 2013-07-07T00:24:23+0000
/project/wx-icons-tango/, wx-icons-tango, 0.1.1, description goes here, 2020-04-16T19:20:17+0000
/project/signalpy/, SignalPy, 1.0.6, Realtime communication for Python web applications, 2020-10-20T02:15:54+0000
/project/khansoul/, khansoul, 2.1.0, Simple terminal emulator, 2021-01-25T06:54:10+0000
/project/jpydict/, jpydict, 1.0.0, Japanese-English dictionary, interface for JMdict, 2017-01-01T15:28:07+0000
/project/your-notes/, your-notes, 0.1, a), 2019-07-06T18:23:09+0000
/project/wx-icons-humanity/, wx-icons-humanity, 0.1.3, Humanity and Humanity Dark icon themes for wxPython 🐍, 2020-08-03T11:18:42+0000
/project/editobj3/, Editobj3, 0.1, An automatic dialog box generator for Python objects, supporting multiple graphical backends: Qt, GTK and HTML (single-user or with multiple users)., 2017-09-10T19:38:39+0000
/project/ivolution/, Ivolution, 1.0, Timelapse creation using Face Recognition, 2012-08-03T07:17:20+0000
/project/printrun/, Printrun, 2.0.0rc7, Host software for 3D printers, 2020-09-06T12:00:22+0000
/project/caffeine-ng/, caffeine-ng, 3.5.1, Tray bar app to temporarily inhibit screensaver and sleep mode., 2021-01-19T08:32:29+0000
/project/osd-neo2/, OSD-neo2, 0.15, On screen display for learning the keyboard layout Neo2, 2020-06-05T14:32:38+0000
/project/wx-icons-suru/, wx-icons-suru, 0.1.2, Suru icon theme for wxPython 🐍, 2020-08-03T16:50:01+0000
/project/sense-emu/, sense-emu, 1.1, The Raspberry Pi Sense HAT Emulator library, 2018-07-09T12:52:52+0000
/project/notementum/, notementum, 0.1.0, A native Markdown notebook app., 2019-08-25T07:10:25+0000
/project/bullseye/, bullseye, 0.1.1, laser beam profiler, 2012-03-05T00:15:40+0000
/project/vsucs4900c/, vsucs4900c, 0.1, Demo for building a Python project, 2020-04-10T08:24:48+0000
/project/sudokuaspuzzle/, sudokuaspuzzle, 0.1.28, Customizable Sudoku, 2019-11-04T09:33:55+0000
/project/streamtuner2/, streamtuner2, 2.2.0, Streamtuner2 is an internet radio browser, 2017-01-01T21:48:37+0000
/project/gagar/, gagar, 0.1.4, Standalone graphical agar.io Python client using GTK and agarnet, 2016-03-21T01:46:48+0000
/project/oppa/, oppa, 0.5.0, Presentation and lecture support tool, 2014-07-21T23:51:36+0000
/project/ccatterina-pymodbus/, ccatterina.pymodbus, 1.5.2.1, A fully featured modbus protocol stack in python, 2018-06-21T08:39:00+0000
/project/pyedit/, PyEdit, 1.8.0, A Python Editor using GTK, 2021-02-21T01:39:47+0000
/project/pyschelling/, pyschelling, 0.1.0, An agent-based implementation of Schelling's segregation model, 2013-06-24T23:45:40+0000
/project/ecsuconvert-1/, ECSUConvert_1, 0.5, Demo for building a Python project, 2018-10-02T16:19:47+0000
/project/petapass/, Petapass, 0.2.1, better passwords using hashes, 2011-03-27T21:56:03+0000
/project/pygmount/, pygmount, 0.9.3, Software for graphical mount network shares., 2014-04-03T12:26:59+0000
/project/shadowsocks-gtk/, shadowsocks-gtk, 0.1.1, ShadowSocks Gtk Client, 2014-10-05T15:41:39+0000
/project/pritunl-client/, pritunl_client, 0.10.1, Pritunl openvpn client, 2014-07-24T22:48:48+0000
/project/simplegtd/, simplegtd, 0.0.22, Manage your to-do list using the Getting Things Done system., 2020-06-29T13:27:40+0000
/project/basico/, basico, 0.3, SAP Notes Manager for SAP Consultants, 2019-04-07T11:42:47+0000
/project/yt-dlg/, yt-dlg, 1.2.2, Youtube Downloader GUI, 2021-04-22T05:13:44+0000
/project/steno/, Steno, 0.1b3, An application that helps people learning a foreign language to train listening skills., 2015-01-28T14:21:56+0000
/project/scalpel/, scalpel, 0.8.2, Scalpel Audio Editor, 2010-12-11T00:29:26+0000
/project/gnuhealth-client/, gnuhealth-client, 3.8.1, The GNU Health GTK client, 2021-02-15T21:13:09+0000
/project/klemmbrett/, klemmbrett, 0.3.3, Versatile clipboard manager, 2020-06-08T20:13:51+0000
/project/nwd/, nwd, 2.1.0, Notify When Done (NWD). A tool for posting a desktop notification, E-mail, or other alert when a process finishes., 2020-07-28T17:44:49+0000
/project/mailflagger/, mailflagger, 0.1.0, A program which flags emails, typically after an incoming payment, 2020-06-08T18:43:47+0000
/project/pysugarscape/, pysugarscape, 0.1.0, A simple agent-based implementation of Epstein & Axtell's sugarscape model., 2013-07-09T08:52:51+0000
/project/wx-icons-adwaita/, wx-icons-adwaita, 0.1.2, Adwaita icon theme for wxPython 🐍, 2020-08-03T08:14:29+0000
/project/cinnamon-udev-locker/, cinnamon-udev-locker, 0.1.0, Lock Cinnamon desktop session on device removal (i.e YubiKey), 2017-04-04T11:13:21+0000
/project/gcaff/, gcaff, 0.4, graphical OpenPGP signing assistant, 2017-11-24T12:05:16+0000
/project/ecsuproject-2/, ECSUProject_2, 0.1, Demo for building a Python project, 2018-10-03T05:36:14+0000
/project/genxword/, genxword, 2.1.0, A crossword generator, 2020-05-11T07:45:37+0000
/project/drumst/, drumst, 1.0.0, School Management For Drum Teachers, 2019-02-13T13:04:09+0000
/project/oathguardian/, oathguardian, 0.1.0, TOTP generator for Gnome, 2018-04-02T15:26:33+0000
/project/ordenley/, ordenley, 0.2.1dev, Manager desktop app oriented to lawyers office, 2013-03-26T12:38:38+0000
/project/sftpman-gtk/, sftpman-gtk, 1.0.3, A GTK frontend for SftpMan, which helps you mount SFTP file systems., 2019-04-12T07:32:30+0000
/project/coverart/, coverart, 0.7.5, Cover art downloader., 2019-10-30T05:20:15+0000
/project/save-thread-result/, save-thread-result, 0.0.6, Simple subclass wrapper around `threading.Thread` to get the return value from a thread in python (from `threading` built-in module in Python Standard library). Exact same interface for creating an instance of this threading sublcass as `threading.Thread`!, 2021-02-08T00:27:52+0000
/project/tl-gcrop/, tl.gcrop, 0.1, Visually crop an image under various constraints., 2010-02-14T16:58:32+0000
/project/pycross/, PyCross, 0.3.3, Singleplayer/Multiplayer Tic-Tac-Toe game, 2014-11-17T13:09:24+0000
/project/safeeyes/, safeeyes, 2.1.3, Protect your eyes from eye strain using this continuous breaks reminder., 2021-04-20T01:35:43+0000
/project/sutekh/, Sutekh, 1.1.0, VtES Card Collection Manager, 2021-01-17T17:15:47+0000
/project/htmltocsv/, HTMLtoCSV, 0.1, Program for taking table in html and outputting in csv file., 2018-10-04T15:50:27+0000
/project/toga-gtk/, toga-gtk, 0.2.15, A GTK+ backend for the Toga widget toolkit., 2017-08-14T18:30:45+0000
/project/tenma-serial/, tenma-serial, 1.0.0, Serial control of tenma device, 2020-07-03T11:02:17+0000
/project/cricket-score-indicator/, cricket-score-indicator, 5.0, An indicator to show live cricket(domestic/international) scores, 2018-03-03T10:13:40+0000
/project/epip/, Epip, 1.0.4, Pipe style programming in Python, 2018-07-14T05:51:51+0000
/project/neso/, neso, 4.0.0, Standalone Client/Server for the Tryton Application Platform, 2016-05-02T13:39:17+0000
/project/pypso/, pyPSO, 0.9.3, Implementation of Particle Swarm Optimalizator in python.       Toolkit with bunch of usefull tools., 2007-10-08T14:55:41+0000
/project/jcchess/, jcchess, 0.0.1, A Chess GUI, 2017-09-16T06:47:07+0000
/project/pdfchain/, pdfchain, 0.5.0.0.alpha.5, A graphical user interface for the PDF Toolkit, 2020-06-05T07:03:20+0000
/project/overwatch/, overwatch, 2.0.0, Overwatch: Python Logging Browser., 2014-12-08T17:23:35+0000
/project/ecsuproject-1/, ECSUProject_1, 0.1, Demo for building a Python project, 2018-10-02T13:05:14+0000
/project/midterm-2018/, Midterm_2018, 0.2, Webscraper to develope unitest skills, 2018-10-09T15:26:58+0000
/project/photocollage/, photocollage, 1.4.4, Graphical tool to make photo collage posters, 2017-10-30T08:28:20+0000
/project/etk-docking/, etk.docking, 0.2, PyGTK Docking Widgets, 2011-09-29T04:51:01+0000
/project/ipa-zounds/, ipa-zounds, 3.1, IPA Zounds sound change applier, 2013-05-19T21:07:30+0000
/project/burneronfire/, BurnerOnFire, 0.1, BurnerOnFire is multi-threaded program that can write same content (iso files for now) to multiple CD/DVD burners simultaneously., 2009-10-03T07:52:39+0000
/project/zx/, zx, 0.7.0, ZX Spectrum Emulator for Researchers and Developers, 2020-05-25T18:12:58+0000
/project/crawlermaster/, crawlermaster, 0.1.2a6, muchu's utility module, 2016-10-27T19:55:15+0000
/project/tardis/, tardis, 0.1, A minimal CalDAV client, 2019-10-27T12:39:21+0000
/project/advene/, advene, 3.5, Annotate DVds, Exchange on the NEt, 2017-11-17T22:20:56+0000
/project/ezgpg/, ezgpg, 0.2.5, Simplified GPG UI, 2016-12-27T20:18:16+0000
/project/pywebview-unofficial-osx-patched/, pywebview-unofficial-osx-patched, 0.8.4, A cross-platform lightweight native wrapper around a web view component, 2016-02-08T09:15:30+0000
/project/clip2zeus/, Clip2Zeus, 0.9d, Monitor your clipboard for URLs and automatically shorten them using 2Zeus, 2010-01-18T17:58:43+0000
/project/pida/, pida, 0.6.2, An integrated development environment that reuses tools such as Vim, and all version control systems., 2010-08-04T16:42:51+0000
/project/sharescanner/, Sharescanner, 0.1.0, A GTK tool for scanning network shares and downloading files from them, 2012-01-02T22:06:50+0000
/project/sticky-notes/, sticky-notes, 2.3, Stick your notes to your desktop (inspired from stickies for Mac), 2016-10-07T16:17:40+0000
/project/ethmenu/, ethmenu, 2.0.4, Simple menu, 2020-10-23T15:19:11+0000
/project/wxpython/, wxPython, 4.1.1, Cross platform GUI toolkit for Python, "Phoenix" version, 2020-11-25T21:48:11+0000
/project/boot/, boot, 0.30, VHDL simulator and synthesis tool, 2012-08-26T13:18:02+0000
/project/runpon/, RunPON, 0.5, runs scripts, keeping track of the elapsed time., 2009-09-19T12:54:21+0000
/project/tkpick/, tkpick, 1.0.0, Get pixel color using the cursor, 2021-01-23T10:08:08+0000
/project/gaphor/, gaphor, 2.3.2, Gaphor is the simple modeling tool written in Python., 2021-03-30T00:34:47+0000
/project/disaiah-project-1/, Disaiah_Project_1, 0.1, Demo for building a Python project, 2018-10-02T16:37:03+0000
/project/protonvpn-linux-gui-calexandru2018/, protonvpn-linux-gui-calexandru2018, 2.0.7, Unofficial Linux GUI client for ProtonVPN, 2020-04-23T18:49:14+0000
/project/mplayer-py/, mplayer.py, 0.7.2.post1, Lightweight and dynamic MPlayer wrapper with a Pythonic API, 2019-07-28T11:13:37+0000
/project/txlearnbot/, txlearnbot, 0.02, UNKNOWN, 2011-11-29T10:45:27+0000
/project/plib3-gui/, plib3.gui, 0.10.5, A simple Python 3 GUI framework., 2019-09-23T06:28:44+0000
/project/lcdchargen/, lcdchargen, 0.1, Generate custom character for HD44780U LCD screen, 2020-04-16T20:17:19+0000
/project/paperwork/, paperwork, 2.0.2, Using scanner and OCR to grep dead trees the easy way, 2021-01-01T15:25:12+0000
/project/udiskie/, udiskie, 2.3.3, Removable disk automounter for udisks, 2021-03-05T14:13:46+0000
/project/ramstk/, RAMSTK, 0.14.0, The RAMS ToolKit (RAMSTK) is a suite of tools for performing and documenting reliability, availability, maintainability, and safety (RAMS) analyses, 2021-02-04T05:28:24+0000
/project/jack-select/, jack-select, 1.5.1, A systray app to set the JACK configuration from QjackCtl presets via DBus., 2021-01-15T07:59:28+0000
/project/minidlnaindicator/, minidlnaindicator, 0.5.5, MiniDLNA Indicator, 2017-09-08T16:05:54+0000
/project/windownow/, windownow, 0.9.6, Switch desktop's windows by typing their titles, name, etc., 2013-01-14T12:04:23+0000
/project/gallery-uploader/, Gallery-Uploader, 2.3, Upload pictures and videos to Gallery installations, 2010-11-17T09:04:24+0000
/project/labpype/, LabPype, 0.7.8, A Framework for Creating Pipeline Software, 2018-07-15T21:35:12+0000
/project/wxwize/, wxWize, 1.2.0, wxPython object builder, 2021-03-15T21:54:32+0000
/project/sdictviewer/, sdictviewer, 0.6.2, SDict Viewer is a viewer for dictionaries in Sdictionary format.
                    Download dictionaries at http://sdict.com, 2008-04-24T02:32:24+0000
/project/gdm2setup/, gdm2setup, 0.3.7, GDM2 Setup utility and libraries, 2010-03-02T02:34:31+0000
/project/wammu/, wammu, 0.44, Wammu Mobile Phone Manager, 2018-01-05T14:40:34+0000
/project/gui2py/, gui2py, 0.9.6.1, gui2py framework, 2016-09-05T21:43:00+0000
/project/abeluna/, abeluna, 1.1.0, A simple GUI to-do/task manager with CalDAV support., 2021-03-06T03:27:55+0000
/project/monkeysign/, monkeysign, 2.2.4, OpenPGP key exchange for humans, 2018-06-18T17:27:52+0000
/project/wizpym/, wizpym, 0.2.0, A tool to write Wizard-like apps, 2010-11-22T11:17:33+0000
/project/pass-pls/, pass-pls, 1.0.4, A GTK-based implementation of ssh-askpass, 2020-09-30T10:13:50+0000
/project/twitscreen/, twitscreen, 0.1, A simple screenshot utility that can crop images and upload them to Twitpic, 2009-07-01T07:05:33+0000
/project/bibreview/, BibReview, 0.2.4, BibReview is a software for managing bibliographic database. It includes avanced functions for literature reviews., 2016-01-19T09:26:31+0000
/project/final-project/, Final_Project, 1.0, Extracting home information from zillow.com, 2018-12-02T23:51:18+0000
/project/bfabio-pymodbus/, bfabio.pymodbus, 1.3.1, A fully featured modbus protocol stack in python, 2017-11-20T15:19:12+0000
/project/backupmysystemusb2usb/, backupmysystemusb2usb, 1.0.4, Backup a usb key to another usb key with the same space disk, 2020-02-09T13:12:16+0000
/project/netzob/, Netzob, 1.0.2, Protocol Reverse Engineering, Modeling and Fuzzing, 2017-04-30T22:43:29+0000
/project/football-score-indicator/, football_score_indicator, 4.5.9.5, An indicator to show live football scores in panel, 2016-04-19T20:20:36+0000
/project/vsucs4900/, vsucs4900, 0.1, Demo for building a Python project, 2020-04-10T07:54:55+0000
/project/pyanimenc/, pyanimenc, 0.1a1, Audio/Video Transcoding Frontend, 2014-08-26T16:10:28+0000
/project/gtkeggdeps/, gtkeggdeps, 0.0.7, Interactive egg dependency browser, 2009-07-09T17:37:19+0000
/project/mop/, mop, 0.1.1, MPEG ID3 tagger using Python, eyeD3, and GTK+, 2020-04-07T15:13:31+0000
/project/sipie/, Sipie, 0.1196144357, Library and Player for Sirius Online Streaming, 2008-03-10T16:17:29+0000
/project/pieberry-library-assistant/, pieberry-library-assistant, 1.7-7, A program to download pdf documents from public websites, and catalogue them in BibTeX format, 2010-08-20T22:12:49+0000
/project/lindworm/, lindworm, 0.0.7, core tools covering folder content, markdown, GUI, 2020-10-16T12:16:59+0000
/project/gridsync/, gridsync, 0.4.3, Synchronize local directories with Tahoe-LAFS storage grids., 2020-07-25T00:41:46+0000
/project/arronax/, arronax, 0.7.1, Create and modify application, file and URI starters., 2019-05-21T18:00:45+0000
/project/pyrana/, Pyrana, 2.0.0, a minimalistic mp3 player, 2011-07-10T02:31:51+0000
/project/foonitidigital/, foonitidigital, 1, Testing the app, 2014-10-13T08:12:58+0000
/project/pdock/, pdock, 0.1.1, an experimental PyGTK docking implementation, 2008-06-29T09:39:09+0000
/project/desktop-security-assistant/, desktop-security-assistant, 0.0.8, Desktop Security Assistant, 2015-01-18T12:34:48+0000
/project/brss/, brss, 0.8.14, Offline DBus RSS reader, 2011-07-31T08:38:59+0000
/project/gouyong/, GouYong, 0.5.3, A translation software on  linux, 2018-12-27T07:54:09+0000
/project/gum-audio/, gum-audio, 0.8.3.2, Gum Audio Editor, 2017-11-02T00:15:23+0000
/project/pywebview/, pywebview, 3.4, Build GUI for your Python program with JavaScript, HTML, and CSS., 2020-12-04T22:30:50+0000
/project/vsucsprime2/, vsucsprime2, 0.2, Demo for building a Python project, 2020-04-10T07:53:28+0000
/project/vsucs4900b/, vsucs4900b, 0.1, Demo for building a Python project, 2020-04-10T07:58:02+0000
/project/pympress/, pympress, 1.6.0, A simple and powerful dual-screen PDF reader designed for presentations, 2021-04-16T12:16:11+0000
/project/ad1459/, ad1459, 1.19.0, An IRC Client, 2020-02-26T23:16:49+0000
/project/erika/, erika, 0.1.1, A GTK podcast manager, 2018-03-11T14:22:21+0000
/project/eafsotlogger/, eafsotlogger, 1.1, SOT Library, Maintain log in casandra database using python script., 2014-10-14T10:20:14+0000
/project/gaphas/, gaphas, 3.1.4, Gaphas is a GTK+ based diagramming widget, 2021-04-04T09:30:14+0000
/project/qrtray/, qrtray, 1.0.1, Shows the current clipboard content as a QR code, 2016-03-03T20:33:21+0000
/project/youtube-dl-helper/, youtube-dl-helper, 0.0.13, A tool to automate YouTube downloads via drag and drop, 2020-10-26T02:11:40+0000
/project/slugathon/, slugathon, 0.1-20120727040741-5027075, Fantasy battle board game, 2012-07-27T04:07:47+0000
/project/discover-overlay/, discover-overlay, 0.3.3, Voice chat overlay, 2020-10-23T12:14:34+0000
/project/pycolorsel/, pycolorsel, 1.0, Graphical Python color selector, 2014-08-26T01:37:54+0000
/project/py2048-game/, py2048-game, 1.0.1, PyGTK implementation of the popular 2048 game, 2016-12-06T20:50:43+0000
/project/python-rdesktop-gui/, python-rdesktop-gui, 0.5, A sample gui for rdesktop, 2019-08-27T18:07:35+0000
/project/palabra/, palabra, 0.1.7, A free crossword editor, 2011-06-03T17:59:30+0000
/project/python-gtkmvc-dlr/, python-gtkmvc-dlr, 1.99.2, Model-View-Controller and Observer patterns for developing pygtk-based applications -- mainly written by Roberto Cavada and for minor changes forked by the Institute of Robotics and Mechatronics of the German Aerospace Center (DLR-RM). In order to release a full installation chain for other tools DLR-RM put it on pypi even so the previous versions were only hosted on sourceforge.net., 2017-04-27T12:58:05+0000
/project/protonvpn-gui/, protonvpn-gui, 2.1.1, Linux GUI client for ProtonVPN, 2020-07-07T14:26:22+0000
/project/gxps/, gxps, 0.8.11, XPS analysis, 2020-09-10T12:44:01+0000
/project/pypi-classifiers/, pypi-classifiers, 0.2, Use a GUI to select PyPI-classifiers and include them in asetup.py, 2015-12-07T07:50:21+0000
/project/midterm/, Midterm, 0.1, Programming Languages Mid-Term, 2018-10-09T21:51:40+0000
/project/gkraken/, gkraken, 0.12.2, GUI to control cooling and lighting of NZXT Kraken X (X42, X52, X62 or X72) pumps, 2019-09-26T15:46:36+0000
/project/bat-man/, Bat-man, 0.3.1, A YouTube batch downloader and converter., 2014-02-05T18:12:06+0000
/project/laileoulacuisse/, laileoulacuisse, 0.1.0, Restaurants' menu watcher tray app, 2015-03-07T03:01:12+0000
/project/spacepass/, spacepass, 0.4, A spacemacs inspired menu for pass password store, 2019-05-29T10:32:59+0000
/project/kernelcheck/, kernelcheck, 1.1.4, Build the latest kernel, 2008-06-30T14:35:03+0000
/project/popupdict/, popupdict, 0.3.3, Linux 下的划词翻译工具，支持有道智云等多种翻译服务, 2019-03-01T06:48:10+0000
/project/gplayer/, gplayer, 0.1.3, Lightweight Music Player with cover- and lyrics-display, 2013-07-26T13:32:23+0000
/project/typetrainer/, typetrainer, 0.5.2, Typing tutor trainer, 2011-03-06T02:11:52+0000
/project/kazam/, kazam, 1.5.5, A screencasting program created with design in mind., 2019-08-27T07:04:29+0000
/project/camelot/, Camelot, 13.04.13-gpl-pyqt, A python GUI framework on top of Sqlalchemy and Qt, inspired by the Django admin interface. Start building desktop applications at warp speed, simply by adding some additional information to you model definition., 2013-04-11T21:58:49+0000
/project/snaked/, snaked, 0.4.7, Very light and minimalist editor inspired by Scribes, 2011-02-16T05:01:34+0000
/project/pyusecase/, PyUseCase, 3.5.1, The previous name for the StoryText project, 2011-05-05T12:11:12+0000
/project/pymplayer/, PyMPlayer, 0.6.0, Lightweight and dynamic MPlayer wrapper with a Pythonic API, 2011-03-03T08:50:36+0000
/project/zenityshell/, ZenityShell, 0.0.1-r001a-ekcebo-ivaritt, Zenity Module with more option embedded for fast integration, 2012-09-18T04:57:36+0000
/project/pianofish/, pianofish, 1.0.1, pianofish process management tool, 2018-01-12T23:57:33+0000
/project/rpi-backlight/, rpi-backlight, 2.2.0, A Python module for controlling power and brightness of the official Raspberry Pi 7" touch display., 2020-05-17T15:38:39+0000
/project/fontypython/, fontypython, 0.4.3, Fonty Python - view and manage all kinds of fonts on Gnu/Linux, 2009-10-05T13:28:36+0000
/project/cocoricofm/, cocoricofm, 1.4, A little radio player, 2019-08-18T10:11:13+0000
/project/deluge/, deluge, 2.0.3, BitTorrent Client, 2019-06-12T17:51:47+0000
/project/geode-gem/, Geode-GEM, 0.11.2, Geode-GEM is an interface to manage emulators and games, 2021-03-15T20:13:42+0000
/project/samuel/, samuel, 0.1.9, A Draughts Program, 2019-02-10T22:13:40+0000
/project/photorepl/, photoREPL, 0.0.3, Experimental CLI/GUI hybrid raw photo editor, 2015-08-16T06:08:23+0000
/project/dicksonui/, DicksonUI, 2.4.5, Lightweight And Full Featured Browser Based UI / GUI (Graphical User Interface Library), 2020-10-16T13:10:48+0000
/project/chessproblem-ui/, chessproblem.ui, 1.2.0, The user interface to edit chessproblems for tex files using the chess-problem-diagrams latex style., 2017-02-10T15:20:54+0000
/project/kayleevc/, KayleeVC, 0.1.1, Somewhat fancy voice command recognition software, 2016-05-01T02:07:16+0000
/project/xdot/, xdot, 1.2, Interactive viewer for Graphviz dot files, 2020-11-21T11:56:29+0000
/project/eclipseprofileselector/, eclipseprofileselector, 0.2.2, Manage separate Eclipse profiles and workspaces with a nice graphical user interface., 2015-10-13T03:57:22+0000
/project/kwplayer/, kwplayer, 3.5.2, Music player for linux users, 2015-03-14T09:44:31+0000
/project/formiko/, formiko, 1.4.3, Formiko is reStructuredText and MarkDown editor and live previewer., 2019-12-10T05:40:25+0000
/project/metarace/, metarace, 1.11.3, Cycle race abstractions, 2021-01-29T04:53:59+0000
/project/gtkchartlib/, gtkchartlib, 0.1.2, Collection of GTK+ chart widgets, 2011-06-25T05:48:16+0000
/project/xharvest/, xharvest, 0.8.0, Unofficial Harvest desktop for Linux, 2021-03-24T17:36:10+0000
/project/gameclock/, gameclock, 5.1, The Gameclock, 2016-09-04T23:58:10+0000
/project/palabra/, palabra, 0.1.7, A free crossword editor, 2011-06-03T17:59:30+0000
/project/pycam/, pycam, 0.6.4, Open Source CAM - Toolpath Generation for 3-Axis CNC machining, 2019-07-28T14:51:08+0000
/project/grun/, grun, 0.14, The simplest GUI builder (tk/gtk), for RAD scripts, 2009-10-05T20:46:02+0000
/project/englishcards/, englishcards, 0.1a1, Flash cards app for learning English, 2020-06-19T10:14:56+0000
/project/pygameoflife/, pygameoflife, 0.1.1, An agent-based implementation of Conway's Game of Life, 2013-06-23T15:07:59+0000
/project/editra/, Editra, 0.7.20, Developer's Text Editor, 2013-01-05T22:05:54+0000
/project/mmm-gui/, mmm-gui, 0.1.1, minimalistic media manager - gui, 2018-09-16T17:48:07+0000
/project/goocalendar/, GooCalendar, 0.7.2, A calendar widget for GTK using PyGoocanvas, 2021-03-28T10:03:40+0000
/project/papageorge/, papageorge, 0.1.1, Simple client for the Free Internet Chess Server, 2015-09-07T08:29:02+0000
/project/protonvpn-gtk/, protonvpn-gtk, 0.2, Unofficial GTK 3 client for ProtonVPN., 2020-01-05T12:04:34+0000
/project/dynaui/, DynaUI, 1.1.5, A framework to increase the scalability and flexibility of wxPython, 2021-03-26T07:22:06+0000
/project/plib2/, plib2, 0.7.3, A namespace package for a number of useful sub-packages and modules., 2012-08-15T04:57:05+0000
/project/tl-geodrawing/, tl.geodrawing, 0.1, A geographic pygtk drawing area.

The drawing surface provides a geographic coordinate system and displays map
images in the background., 2010-04-13T15:26:51+0000
