/project/bat-man/, Bat-man, 0.3.1, A YouTube batch downloader and converter., 2014-02-05T18:12:06+0000
/project/laileoulacuisse/, laileoulacuisse, 0.1.0, Restaurants' menu watcher tray app, 2015-03-07T03:01:12+0000
/project/spacepass/, spacepass, 0.4, A spacemacs inspired menu for pass password store, 2019-05-29T10:32:59+0000
/project/kernelcheck/, kernelcheck, 1.1.4, Build the latest kernel, 2008-06-30T14:35:03+0000
/project/kayleevc/, KayleeVC, 0.1.1, Somewhat fancy voice command recognition software, 2016-05-01T02:07:16+0000
/project/xdot/, xdot, 1.2, Interactive viewer for Graphviz dot files, 2020-11-21T11:56:29+0000
/project/eclipseprofileselector/, eclipseprofileselector, 0.2.2, Manage separate Eclipse profiles and workspaces with a nice graphical user interface., 2015-10-13T03:57:22+0000
/project/kwplayer/, kwplayer, 3.5.2, Music player for linux users, 2015-03-14T09:44:31+0000
/project/spacemenu/, spacemenu, 0.4, A spacemacs menu inspired gtk module, 2019-05-29T10:32:28+0000
/project/rocket-depot/, rocket-depot, 1.0.0, An rdesktop/xfreerdp frontend., 2016-03-16T01:43:23+0000
/project/exiflow/, exiflow, 0.4.5.17, A set of tools including a little GUI to provide a complete digital photo workflow for Unixes, using EXIF headers as the central information repository., 2015-05-05T13:23:36+0000
/project/rafcon-task-planner-plugin/, rafcon-task-planner-plugin, 1.5.2, The RAFCON Task Planner Plugin (RTPP) is a plugin to interface arbitrary pddl planner and automate the state machine generation process., 2020-02-28T09:52:54+0000
/project/plib/, plib, 0.8.9, A namespace package for a number of useful sub-packages and modules., 2013-06-04T21:05:14+0000
/project/formiko/, formiko, 1.4.3, Formiko is reStructuredText and MarkDown editor and live previewer., 2019-12-10T05:40:25+0000
/project/ecsu-midterm-proj/, ECSU_Midterm_Proj, 0.2, Extracts HTML data with python regex and convert the data to a csv file, 2018-10-09T19:29:25+0000
/project/metarace/, metarace, 1.11.3, Cycle race abstractions, 2021-01-29T04:53:59+0000
/project/gtkchartlib/, gtkchartlib, 0.1.2, Collection of GTK+ chart widgets, 2011-06-25T05:48:16+0000
/project/wx-icons-hicolor/, wx-icons-hicolor, 0.2.0, Hicolor icon theme for wxPython., 2020-11-27T21:34:59+0000
/project/presenter/, Presenter, 0.2dev, The presentation tool designed for control freaks., 2009-08-08T01:21:37+0000
/project/videomass/, videomass, 3.4.2, Videomass is a cross-platform GUI for FFmpeg and youtube-dl, 2021-04-24T17:53:54+0000
/project/revelation-indicator/, revelation-indicator, 0.1.5, Indicator for the revelation password manager on Unity desktop., 2012-06-11T14:20:23+0000
/project/xharvest/, xharvest, 0.8.0, Unofficial Harvest desktop for Linux, 2021-03-24T17:36:10+0000
/project/gameclock/, gameclock, 5.1, The Gameclock, 2016-09-04T23:58:10+0000
/project/poproofread/, PoProofRead, 0.2.0, PoProofRead, a po and podiff file proofreader, 2019-12-05T21:53:45+0000
/project/bcloud/, bcloud, 3.8.2, Baidu Pan client for Linux Desktop users, 2015-12-25T17:51:43+0000
/project/kazam/, kazam, 1.5.5, A screencasting program created with design in mind., 2019-08-27T07:04:29+0000
/project/camelot/, Camelot, 13.04.13-gpl-pyqt, A python GUI framework on top of Sqlalchemy and Qt, inspired by the Django admin interface. Start building desktop applications at warp speed, simply by adding some additional information to you model definition., 2013-04-11T21:58:49+0000
/project/snaked/, snaked, 0.4.7, Very light and minimalist editor inspired by Scribes, 2011-02-16T05:01:34+0000
/project/pyusecase/, PyUseCase, 3.5.1, The previous name for the StoryText project, 2011-05-05T12:11:12+0000
/project/pymplayer/, PyMPlayer, 0.6.0, Lightweight and dynamic MPlayer wrapper with a Pythonic API, 2011-03-03T08:50:36+0000
/project/zenityshell/, ZenityShell, 0.0.1-r001a-ekcebo-ivaritt, Zenity Module with more option embedded for fast integration, 2012-09-18T04:57:36+0000
/project/pianofish/, pianofish, 1.0.1, pianofish process management tool, 2018-01-12T23:57:33+0000
/project/rpi-backlight/, rpi-backlight, 2.2.0, A Python module for controlling power and brightness of the official Raspberry Pi 7" touch display., 2020-05-17T15:38:39+0000
/project/fontypython/, fontypython, 0.4.3, Fonty Python - view and manage all kinds of fonts on Gnu/Linux, 2009-10-05T13:28:36+0000
/project/cocoricofm/, cocoricofm, 1.4, A little radio player, 2019-08-18T10:11:13+0000
/project/deluge/, deluge, 2.0.3, BitTorrent Client, 2019-06-12T17:51:47+0000
/project/geode-gem/, Geode-GEM, 0.11.2, Geode-GEM is an interface to manage emulators and games, 2021-03-15T20:13:42+0000
/project/samuel/, samuel, 0.1.9, A Draughts Program, 2019-02-10T22:13:40+0000
/project/photorepl/, photoREPL, 0.0.3, Experimental CLI/GUI hybrid raw photo editor, 2015-08-16T06:08:23+0000
/project/dicksonui/, DicksonUI, 2.4.5, Lightweight And Full Featured Browser Based UI / GUI (Graphical User Interface Library), 2020-10-16T13:10:48+0000
/project/chessproblem-ui/, chessproblem.ui, 1.2.0, The user interface to edit chessproblems for tex files using the chess-problem-diagrams latex style., 2017-02-10T15:20:54+0000
/project/pygtkimageview/, PyGtkImageView, 1.0.0, Python binding for GtkImageView, 2007-09-30T02:57:41+0000
/project/shareplayer-mplayer-py/, sharePlayer-mplayer.py, 0.7.0, Lightweight and dynamic MPlayer wrapper with a Pythonic API, 2016-10-18T01:37:53+0000
/project/diarrhouea/, diarrhouea, 9999.0.0, Simple terminal emulator, 2019-12-04T12:30:52+0000
/project/tl-geodrawing/, tl.geodrawing, 0.1, A geographic pygtk drawing area.

The drawing surface provides a geographic coordinate system and displays map
images in the background., 2010-04-13T15:26:51+0000
/project/sayminimal/, sayminimal, 3.0.0, A minimalist write-only Twitter/Mastodon client., 2018-08-22T23:18:58+0000
/project/dns-firewall/, dns-firewall, 0.0.4, Local DNS Firewall, 2014-12-23T12:14:36+0000
/project/pycameo/, pycameo, 0.1.2a1, cameo scrapy project, 2016-05-28T06:09:16+0000
/project/replication-monitor/, replication-monitor, 0.1.9, Replication Monitor - a GTK+ tool for AvanceDB, CouchDB, PouchDB and Cloudant, 2017-03-02T13:51:07+0000
/project/pamic/, pamic, 0.2.2, Funking up Pulseaudio microphone use, 2021-02-22T21:34:09+0000
/project/texttest/, TextTest, 4.0.7, A tool for text-based Approval Testing, 2021-02-22T14:04:46+0000
/project/helm/, helm, 0.4, Helm is a system monitor released under GNU GPLv3., 2011-04-25T15:56:57+0000
/project/crossfiledialog/, crossfiledialog, 0.1.0, A Python wrapper for opening files and folders with the native file dialog., 2020-06-21T13:01:21+0000
/project/popupdict/, popupdict, 0.3.3, Linux 下的划词翻译工具，支持有道智云等多种翻译服务, 2019-03-01T06:48:10+0000
/project/gplayer/, gplayer, 0.1.3, Lightweight Music Player with cover- and lyrics-display, 2013-07-26T13:32:23+0000
/project/pyasteroids/, pyasteroids, 0.5.2, Python asteroids game demonstrating pyagents library, 2013-05-02T12:36:33+0000
/project/cadbiom-gui/, cadbiom-gui, 0.3, GUI of Cadbiom software v0.3, 2020-02-08T18:13:36+0000
/project/typetrainer/, typetrainer, 0.5.2, Typing tutor trainer, 2011-03-06T02:11:52+0000
/project/gcalendar/, gcalendar, 0.4.1, Read Google Calendar events from your terminal., 2020-12-14T13:11:34+0000
/project/gtimelog/, gtimelog, 0.11.3, A Gtk+ time tracking application, 2019-04-23T18:23:39+0000
/project/pycam/, pycam, 0.6.4, Open Source CAM - Toolpath Generation for 3-Axis CNC machining, 2019-07-28T14:51:08+0000
/project/pythonturtle/, PythonTurtle, 0.3.2, An educational environment for learning Python, suitable for beginners, 2020-09-24T23:39:40+0000
/project/symbol-please/, symbol-please, 1.2.0, Symbol Please is a visual log parsing helper for Project 1999, 2019-11-20T23:14:11+0000
/project/camelot/, Camelot, 13.04.13-gpl-pyqt, A python GUI framework on top of Sqlalchemy and Qt, inspired by the Django admin interface. Start building desktop applications at warp speed, simply by adding some additional information to you model definition., 2013-04-11T21:58:49+0000
/project/snaked/, snaked, 0.4.7, Very light and minimalist editor inspired by Scribes, 2011-02-16T05:01:34+0000
/project/pyusecase/, PyUseCase, 3.5.1, The previous name for the StoryText project, 2011-05-05T12:11:12+0000
/project/pymplayer/, PyMPlayer, 0.6.0, Lightweight and dynamic MPlayer wrapper with a Pythonic API, 2011-03-03T08:50:36+0000
/project/zenityshell/, ZenityShell, 0.0.1-r001a-ekcebo-ivaritt, Zenity Module with more option embedded for fast integration, 2012-09-18T04:57:36+0000
/project/deluge/, deluge, 2.0.3, BitTorrent Client, 2019-06-12T17:51:47+0000
/project/geode-gem/, Geode-GEM, 0.11.2, Geode-GEM is an interface to manage emulators and games, 2021-03-15T20:13:42+0000
/project/samuel/, samuel, 0.1.9, A Draughts Program, 2019-02-10T22:13:40+0000
/project/photorepl/, photoREPL, 0.0.3, Experimental CLI/GUI hybrid raw photo editor, 2015-08-16T06:08:23+0000
/project/dicksonui/, DicksonUI, 2.4.5, Lightweight And Full Featured Browser Based UI / GUI (Graphical User Interface Library), 2020-10-16T13:10:48+0000
/project/chessproblem-ui/, chessproblem.ui, 1.2.0, The user interface to edit chessproblems for tex files using the chess-problem-diagrams latex style., 2017-02-10T15:20:54+0000
/project/kayleevc/, KayleeVC, 0.1.1, Somewhat fancy voice command recognition software, 2016-05-01T02:07:16+0000
/project/py2048-game/, py2048-game, 1.0.1, PyGTK implementation of the popular 2048 game, 2016-12-06T20:50:43+0000
/project/python-rdesktop-gui/, python-rdesktop-gui, 0.5, A sample gui for rdesktop, 2019-08-27T18:07:35+0000
/project/palabra/, palabra, 0.1.7, A free crossword editor, 2011-06-03T17:59:30+0000
/project/python-gtkmvc-dlr/, python-gtkmvc-dlr, 1.99.2, Model-View-Controller and Observer patterns for developing pygtk-based applications -- mainly written by Roberto Cavada and for minor changes forked by the Institute of Robotics and Mechatronics of the German Aerospace Center (DLR-RM). In order to release a full installation chain for other tools DLR-RM put it on pypi even so the previous versions were only hosted on sourceforge.net., 2017-04-27T12:58:05+0000
/project/protonvpn-gui/, protonvpn-gui, 2.1.1, Linux GUI client for ProtonVPN, 2020-07-07T14:26:22+0000
/project/gxps/, gxps, 0.8.11, XPS analysis, 2020-09-10T12:44:01+0000
/project/pypi-classifiers/, pypi-classifiers, 0.2, Use a GUI to select PyPI-classifiers and include them in asetup.py, 2015-12-07T07:50:21+0000
/project/midterm/, Midterm, 0.1, Programming Languages Mid-Term, 2018-10-09T21:51:40+0000
/project/browse-ocrd/, browse-ocrd, 0.4.2, An extensible viewer for OCR-D workspaces, 2020-11-12T16:58:55+0000
/project/swan/, swan, 0.7.1, Easy continuous wavelet analysis, 2020-09-11T04:32:42+0000
/project/gshogi/, gshogi, 0.5.1, A Shogi Program (Japanese Chess), 2017-09-18T17:53:34+0000
/project/pyxrd/, PyXRD, 0.8.4, PyXRD is a python implementation of the matrix algorithm developed for the X-ray diffraction analysis of disordered lamellar structures, 2020-03-07T08:59:00+0000
/project/pywebsms/, pyWebSMS, 1.1, pyWebSMS is an graphical sms sender which supports many programmable providers., 2005-04-18T16:46:20+0000
