/project/django-analytical/, django-analytical, 3.0.0, Analytics service integration for Django projects, 2020-12-06T22:24:14+0000
/project/crispy-forms-gds/, crispy-forms-gds, 0.2.2, Django application to add 'django-crispy-forms' layout objects for the GOV.UK Design System., 2021-01-07T21:44:01+0000
/project/escapejson/, escapejson, 1.0, Escape JSON strings for safe execution as literal javascript and inclusion in HTML <script> environments, 2020-03-31T14:18:30+0000
/project/drf-partial-response/, drf-partial-response, 0.1.5, Implements Google's partial response in Django RestFramework (Fork from Zapier's package and upgrade version), 2020-03-23T04:55:38+0000
/project/stimulus-django/, stimulus-django, 0.0.1, Integrate Hotwire Stimulus in your Django app., 2020-12-26T22:42:38+0000
/project/django-rest-polymorphic/, django-rest-polymorphic, 0.1.9, Polymorphic serializers for Django REST Framework., 2020-04-02T12:25:10+0000
/project/django-autoslug/, django-autoslug, 1.9.8, An automated slug field for Django., 2020-07-22T08:27:57+0000
/project/pirates/, pirates, 0.5.0, Django app for users, teamds and groups., 2021-02-09T09:54:21+0000
/project/huscy-project-archivenotes/, huscy.project-archivenotes, 0.1.0a0, , 2020-03-18T11:36:01+0000
/project/django-echoices/, django-echoices, 2.8.0, Choices for Django model fields as enumeration, 2020-07-21T18:31:34+0000
/project/finitelycomputable-helloworld-django/, finitelycomputable-helloworld-django, 21.4, A hello_world implementation in Django, 2021-04-11T15:10:07+0000
/project/wagtail-metadata-mixin/, wagtail-metadata-mixin, 0.1.0, OpenGraph, Twitter Card and Schema.org snippet tags for Wagtail CMS pages, 2021-01-26T08:34:53+0000
/project/graphene-django/, graphene-django, 2.15.0, Graphene Django integration, 2020-12-31T06:55:57+0000
/project/drf-nested-routers/, drf-nested-routers, 0.93.3, Nested resources for the Django Rest Framework, 2021-03-12T19:43:08+0000
/project/django-datastore/, django-datastore, 0.1.3.5, Generic data store for Django Rest framework, 2020-09-08T09:11:19+0000
/project/django-async-downloads/, django-async-downloads, 0.2.1, Asynchronous downloads scaffolding for Django projects, 2021-04-07T13:19:30+0000
/project/django-itelegram/, django-itelegram, 1.2.6, Developing Telegram bots on Django with extra built-in features, 2020-12-16T22:20:50+0000
/project/dsm/, dsm, 0.5.3, Damn simple finite state machine, 2020-03-17T22:54:57+0000
/project/django-entity-event/, django-entity-event, 2.2.1, Newsfeed-style event tracking and subscription management for django-entity., 2021-03-16T16:44:32+0000
/project/hooked-on-django/, hooked-on-django, 0.1.1, Simple django application to trigger hooked methods., 2021-03-04T11:27:16+0000
/project/django-polls-miravic/, django-polls-miravic, 0.1, A Django app to conduct Web-based polls., 2020-05-25T19:48:05+0000
/project/django-admin-blame/, django-admin-blame, 0.3.0, Tools for logging changes made from Django admin, 2021-04-09T10:15:45+0000
/project/gdaps/, gdaps, 0.4.18, "Generic Django Apps Plugin System", 2021-01-09T22:58:06+0000
/project/django-unmigrate/, django-unmigrate, 0.3.0, Smart reversion of Django migrations based on Git diff, 2021-03-06T17:31:12+0000
/project/martor/, martor, 1.6.2, Django Markdown Editor, 2021-04-07T14:35:26+0000
/project/django-postgres-tweaks/, django-postgres-tweaks, 0.1.3, Special PostgreSQL lookups and functions for Django apps, 2020-02-13T12:32:42+0000
/project/django-guid/, django-guid, 3.2.0, Middleware that enables single request-response cycle tracing by injecting a unique ID into project logs, 2020-12-03T21:11:01+0000
/project/django-impersonate-permissions/, django-impersonate-permissions, 0.4, Django app that tracks user permssions when using django-impersonate., 2020-07-19T13:22:51+0000
/project/django-stubs-ext/, django-stubs-ext, 0.2.0, Monkey-patching and extensions for django-stubs, 2021-04-14T10:12:19+0000
/project/nitrate-tcms/, nitrate-tcms, 4.11, A full-featured Test Case Management System, 2021-03-07T03:07:57+0000
/project/django-baton/, django-baton, 2.1.5, A cool, modern and responsive django admin application, 2021-04-02T15:24:10+0000
/project/aleksis-app-dashboardfeeds/, aleksis-app-dashboardfeeds, 2.0a2, AlekSIS (School Information System) — App Dashboard Feeds (Include feeds from external resources as widgets on dashboard), 2020-05-11T13:18:52+0000
/project/django-two-factor-auth/, django-two-factor-auth, 1.13.1, Complete Two-Factor Authentication for Django, 2021-04-01T18:28:30+0000
/project/django-url-permissions/, django-url-permissions, 0.2.1, A Django app to give role permissions on urls directly., 2020-01-06T07:45:23+0000
/project/djangocms-style/, djangocms-style, 3.0.0, Adds style plugin to django CMS, 2020-09-02T13:57:40+0000
/project/espressodb/, espressodb, 1.2.1, Science database interface using Django as the content manager., 2020-07-27T11:02:59+0000
/project/django-manager-utils/, django-manager-utils, 2.0.1, Model manager utilities for Django, 2020-12-29T09:14:18+0000
/project/event-routing-backends/, event-routing-backends, 0.1.0, Various backends for receiving edX LMS events., 2020-10-01T20:19:45+0000
/project/django-admin-wizard/, django-admin-wizard, 0.2.0, Wizard implementation for Django admin, 2021-04-09T10:14:31+0000
/project/django-nonrelated-inlines/, django-nonrelated-inlines, 0.1.1, Django admin inlines for unrelated models, 2020-07-25T08:07:34+0000
/project/pyuploadcare/, pyuploadcare, 2.7.0, Python library for Uploadcare.com, 2020-05-03T13:55:44+0000
/project/django-versatileimagefield-private/, django-versatileimagefield-private, 2.0, A drop-in replacement for django's ImageField that provides a flexible, intuitive and easily-extensible interface for creating new images from the one assigned to the field., 2021-04-23T16:54:45+0000
/project/django-admin-lightweight-date-hierarchy/, django-admin-lightweight-date-hierarchy, 0.4.0, Using django admin date hierarchy queries free!, 2020-10-20T11:57:58+0000
/project/django-recaptcha/, django-recaptcha, 2.0.6, Django recaptcha form field/widget app., 2020-01-19T21:21:42+0000
/project/django-image-cropping/, django-image-cropping, 1.5.0, A reusable app for cropping images easily and non-destructively in Django, 2020-09-22T11:28:43+0000
/project/dbca-utils/, dbca-utils, 1.1.1, Utilities for Django/Python apps, 2020-02-06T00:31:17+0000
/project/django-rest-firebase-auth/, django-rest-firebase-auth, 0.2.0, Firebase authentication for Django REST framework, 2020-05-27T00:42:37+0000
/project/jwtauthapi/, jwtauthapi, 0.1, A Django app to conduct session based authentication., 2020-05-22T08:46:51+0000
/project/django-sftp/, django-sftp, 0.2.2, Django SFTP, 2020-10-07T17:57:13+0000
/project/aldjemy/, aldjemy, 1.0.0, SQLAlchemy to Django integration library, 2020-11-05T18:10:44+0000
/project/django-dfapp/, django-dfapp, 1.1, A Django app that manages dependent fields, 2020-06-17T18:20:10+0000
/project/dj-stripe/, dj-stripe, 2.4.3, Django + Stripe made easy, 2021-02-08T09:00:54+0000
/project/dj-chartjs/, dj-chartjs, 1.0.7, Library to render chart using chartjs, 2021-02-27T02:47:16+0000
/project/django-statsd/, django-statsd, 2.5.2, django-statsd is a Django app that submits query and view durations to Etsy's statsd., 2020-05-03T19:18:27+0000
/project/django-clone/, django-clone, 2.5.3, Create a clone of a django model instance., 2021-04-25T03:34:00+0000
/project/huscy-users/, huscy.users, 0.1.0a1, , 2020-07-27T08:33:53+0000
/project/django-teryt-tree/, django-teryt-tree, 0.17.0, Django-teryt-tree is a Django app that implements TERYT database as tree by django-mptt., 2020-11-04T01:31:31+0000
/project/waffle-window/, waffle-window, 0.1.0.dev0, Django app for managing user groups and django-waffle flags., 2020-01-16T23:11:53+0000
/project/django-evolution/, django-evolution, 2.1.2, A database schema evolution tool for the Django web framework., 2021-01-20T01:41:36+0000
/project/django-emaillog-backend/, django-emaillog-backend, 0.1.1, Django email backend that writes messages to logger instead of sending them by SMTP., 2020-05-03T17:00:53+0000
/project/pytest-django/, pytest-django, 4.2.0, A Django plugin for pytest., 2021-04-10T17:46:59+0000
/project/wagtail-react-streamfield/, wagtail-react-streamfield, 1.3.6, The brand new Wagtail StreamField!, 2020-06-24T13:41:22+0000
/project/django-hashid-field/, django-hashid-field, 3.2.1, A Hashids obfuscated Django Model Field, 2021-04-14T17:04:47+0000
/project/django-pluggableappsettings/, django-pluggableappsettings, 2.0.3, A convenience class for providing default values for a django app setting., 2020-02-14T15:08:57+0000
/project/djt-og/, djt-og, 0.9.6, Panel for Django-debug-toolbar that displays OpenGraph metadata found in your HTML page., 2020-11-24T15:33:03+0000
/project/django-polymorphic-foreignkey/, django-polymorphic-foreignkey, 2.0.0, A polymorphic ForeignKey field that acts like a generic ForeignKey, 2021-04-01T21:11:35+0000
/project/django-sockpuppet/, django-sockpuppet, 0.6.0, Helping you use websockets in an effective way in views, 2021-04-19T11:14:10+0000
/project/django-ecsmanage/, django-ecsmanage, 2.0.1, Run any Django management command on an AWS Elastic Container Service (ECS) cluster., 2020-11-24T19:13:24+0000
/project/django-mercadopago/, django-mercadopago, 6.0.1, MercadoPago integration for django, 2020-11-19T11:09:34+0000
/project/django-template-toolkit/, django-template-toolkit, 0.1.3, A collection of useful templates & tags for the Django web framework, 2020-08-06T15:31:23+0000
/project/pinax-wiki/, pinax-wiki, 2.0.0, a wiki app for Django sites, 2020-07-19T18:20:50+0000
/project/django-opstasks/, django-opstasks, 0.2.10, opstasks, 2020-10-13T09:16:35+0000
/project/muses-lpdp/, muses-lpdp, 0.3.1589114859, Muses from La Passion des Poèmes., 2020-05-10T12:51:04+0000
/project/django-private-chat2/, django-private-chat2, 0.1.4, Chat app for Django, powered by Django Channels, Websockets & Asyncio, 2021-04-01T20:53:12+0000
/project/finitelycomputable-idtrust-django/, finitelycomputable-idtrust-django, 21.4, A Django microsite to explore identifying game-theory strategies, 2021-04-11T15:10:10+0000
/project/django-haystack/, django-haystack, 3.0, Pluggable search for Django., 2020-09-14T23:11:13+0000
/project/django-check-constraint/, django-check-constraint, 1.0.18, Extends django check constraint to support annotations., 2020-02-27T18:57:12+0000
/project/django-oauth-toolkit/, django-oauth-toolkit, 1.5.0, OAuth2 Provider for Django, 2021-03-22T13:34:28+0000
/project/wagtailtrans/, wagtailtrans, 2.2.1, A Wagtail add-on for supporting multilingual sites, 2020-09-16T09:00:52+0000
/project/vprad/, vprad, 0.1.0, Very Pythonic Rapid Application Development, 2020-02-14T17:08:07+0000
/project/snotra-rss/, snotra-rss, 0.2.5.6, Wagtail app - with rss aggregator and tweeter aggregator feature, 2021-01-09T10:02:51+0000
/project/django-ra/, django-ra, 0.1.1, A light-weight effective Django based framework to create diverse business applications, 2020-01-12T15:16:30+0000
/project/django-elastic-appsearch/, django-elastic-appsearch, 1.1.3, Integrate your Django Project with Elastic App Search with ease., 2021-04-12T04:53:45+0000
/project/django-deprecate-fields/, django-deprecate-fields, 0.1.1, This package allows deprecating model fields and allows removing them in a backwards compatible manner., 2021-01-08T18:15:29+0000
/project/paper-uploads/, paper-uploads, 0.4.5, Asynchronous file upload for Django, 2020-10-26T08:06:35+0000
/project/django-distributions/, django-distributions, 0.1.5, A Django app to distribute apps., 2019-12-25T10:40:19+0000
/project/djangocms-attributes-field/, djangocms-attributes-field, 2.0.0, Adds attributes to Django models., 2020-09-02T13:28:29+0000
/project/django-simpleinliner/, django-simpleinliner, 0.3.4, A simple Django app for inlining static files in templates., 2020-04-09T09:53:22+0000
/project/django-polymorphic-tree/, django-polymorphic-tree, 2.0, A polymorphic mptt structure to display content in a tree., 2021-04-01T12:12:05+0000
/project/django-kn-defaults/, django-kn-defaults, 0.3.0, A collection of logging and helpers for KN., 2020-10-12T06:16:54+0000
/project/django-hmin/, django-hmin, 0.5.4, Html minification middleware with (but not only) django support and good, 2020-11-15T01:15:19+0000
/project/django-rest-authemail/, django-rest-authemail, 2.0.6, A RESTful API for user signup and authentication using email addresses, 2020-12-30T11:59:10+0000
/project/django-user-email-extension/, django-user-email-extension, 2.2.1, User model extender for django, 2020-10-16T10:41:40+0000
/project/django-listing/, django-listing, 0.0.8, Library for creating HTML listing / table / data grid, 2020-07-15T07:33:05+0000
/project/django-markdownx/, django-markdownx, 3.0.1, A comprehensive Markdown editor built for Django., 2019-12-28T09:03:17+0000
/project/django-debug-toolbar/, django-debug-toolbar, 3.2.1, A configurable set of panels that display various debug information about the current request/response., 2021-04-14T15:31:01+0000
/project/snowland-djangohelper/, snowland-djangohelper, 0.1.1, django helper, toolkit for django., 2021-01-13T14:04:29+0000
/project/djangosaml2idp/, djangosaml2idp, 0.7.2, SAML 2.0 Identity Provider for Django, 2020-04-14T21:24:41+0000
/project/django-gisserver/, django-gisserver, 1.1.2, Django speaking WFS 2.0 (exposing GeoDjango model fields), 2020-12-22T12:15:07+0000
/project/django-mama-cas/, django-mama-cas, 2.5.0, A Django Central Authentication Service (CAS) single sign-on server, 2021-04-03T20:11:01+0000
/project/django-app-settings/, django-app-settings, 0.7.1, Application settings helper for Django apps., 2020-05-28T09:40:48+0000
/project/pucas/, pucas, 0.7.0, Django app to login with CAS and populate user accounts with LDAP., 2020-08-31T18:19:53+0000
/project/django-entangled/, django-entangled, 0.4, Edit JSON field using Django Model Form, 2020-12-03T08:11:59+0000
/project/django-split-input/, django-split-input, 0.2.2.post1, A widget to have a django text input split into multiple HTML inputs., 2021-02-08T16:59:30+0000
/project/django-backoffice/, django-backoffice, 0.0.1.dev0, django backoffice admin theme, 2021-01-30T17:58:48+0000
/project/django-paste/, django-paste, 1.1.3, Pluggable, configurable, pastebin HTTP REST API, 2020-11-13T19:40:41+0000
/project/django-tempus-dominus/, django-tempus-dominus, 5.1.2.13, A Django widget for the Tempus Dominus Bootstrap 4 DateTime picker., 2020-01-18T14:49:06+0000
/project/django-geoadmin/, django-geoadmin, 0.0.2, Django Geo Admin, 2020-07-08T21:18:18+0000
/project/dj-tasks/, dj-tasks, 1.1.0, A django app to run a collection of tasks in a management command., 2020-12-29T17:33:23+0000
/project/django-fido/, django-fido, 0.31, Django application for FIDO protocol, 2021-04-12T11:54:06+0000
/project/django-channels-handlers/, django-channels-handlers, 0.2.2, Django Channels, without the Pain, 2020-09-26T04:53:14+0000
/project/django-yubin/, django-yubin, 1.6.0, A reusable Django app for composing and queueing emails Adds django-mailer2 + django-mailviews + others, 2020-01-27T11:13:24+0000
/project/django-waffle/, django-waffle, 2.1.0, A feature flipper for Django., 2021-01-22T09:36:17+0000
/project/django-taggit-machinetags/, django-taggit-machinetags, 0.8.1, Machine tagging built upon django-taggit, 2020-10-12T12:14:57+0000
/project/django-rest-framework-jwt-oauth2/, django-rest-framework-jwt-oauth2, 0.0.4, A generic api for oauth2, 2020-01-06T11:38:26+0000
/project/acdh-django-archeutils/, acdh-django-archeutils, 0.0.1, Utility module to serialize a django-model into ARCHE-RDF., 2020-01-13T13:14:20+0000
/project/django-command-log/, django-command-log, 0.4.1, Django management command auditing app, 2021-01-09T18:01:37+0000
/project/sifter-wagtail/, sifter-wagtail, 3.0a1, A Django content management system for sifter., 2020-11-09T19:52:19+0000
/project/django-tarantool/, django-tarantool, 0.0.20, Tarantool database backend for Django, 2021-01-16T22:30:30+0000
/project/django-terra-utils/, django-terra-utils, 0.3.11, Common utils for terra apps., 2020-08-25T10:17:55+0000
/project/unicef-vision/, unicef-vision, 0.6, , 2020-10-14T16:20:28+0000
/project/pinax-forums/, pinax-forums, 2.0.0, an extensible forum app for Django and Pinax, 2020-07-19T21:18:44+0000
/project/filefield-cache/, filefield-cache, 0.0.5, Cache Files in Form for files retaining, 2020-01-21T13:00:29+0000
/project/django-fsm-log/, django-fsm-log, 2.0.1, Logging for django-fsm, 2020-03-26T13:05:19+0000
/project/django-contrib-comments/, django-contrib-comments, 2.1.0, The code formerly known as django.contrib.comments., 2021-03-03T20:16:28+0000
/project/django-track-history/, django-track-history, 0.2.0, Easy model change tracking for Django, 2020-05-24T10:29:35+0000
/project/django-cassiopeia/, django-cassiopeia, 2.1.0, Django Integration of the Riot Games Developer API Wrapper 'cassiopeia', 2020-09-30T16:31:09+0000
/project/django-global-config/, django-global-config, 0.1, A Django app for dynamic global config, 2020-04-06T16:12:14+0000
/project/django-jazzmin/, django-jazzmin, 2.4.6, Drop-in theme for django admin, that utilises AdminLTE 3 & Bootstrap 4 to make yo' admin look jazzy, 2021-04-16T08:41:05+0000
/project/django-makeallmessages/, django-makeallmessages, 0.2.1, Django Makeallmessages is a tool designed to ease the message making in your Django project., 2020-10-25T22:28:13+0000
/project/django-salesman/, django-salesman, 1.0.0, Headless e-commerce framework for Django., 2021-03-29T11:13:49+0000
/project/django-audit-events/, django-audit-events, 0.2.4, Log audit events in Django, 2021-04-12T13:17:33+0000
/project/django-csp-observer/, django-csp-observer, 1.0.2, A Django app that evaluates CSP reports to identify malicious activity., 2020-08-27T14:56:14+0000
/project/django-ai-kit-auth/, django-ai-kit-auth, 1.0.0, A Django package for account and authentication managment, 2021-04-12T16:49:28+0000
/project/wagtail-cache/, wagtail-cache, 1.0.2, A simple page cache for Wagtail based on the Django cache middleware., 2021-02-26T21:33:25+0000
/project/wagtailblock-register/, wagtailblock-register, 1.7, Register wagtailblocks with a simple decorator, 2020-09-03T11:26:07+0000
/project/django-http-referrer-policy/, django-http-referrer-policy, 1.1.1, django-http-referrer-policy provides a middleware class implementing the Referrer-Policy header for Django-powered sites., 2020-11-02T09:34:57+0000
/project/django-regions/, django-regions, 0.0.1, 中国省市区数据模型., 2020-08-04T02:01:18+0000
/project/django-camunda/, django-camunda, 0.10.0, Interact with Camunda from Django, 2021-01-26T16:17:09+0000
/project/django-todolist/, django-todolist, 0.2, , 2021-04-15T13:29:29+0000
/project/django-adminactions-ptbr/, django-adminactions-ptbr, 1.9.0, Collections of useful actions to use with django.contrib.admin.ModelAdmin, 2021-03-16T22:13:38+0000
/project/huscy-recruitment/, huscy.recruitment, 0.6.0a20, , 2021-03-11T19:51:12+0000
/project/drfaddons/, drfaddons, 0.1.4, A collection package for Django REST Framework, 2020-08-11T02:49:55+0000
/project/django-generic-plus/, django-generic-plus, 2.3.0, Django model field that combines the functionality of GenericForeignKey and FileField, 2020-07-16T18:12:04+0000
/project/django-tracking-analyzer/, django-tracking-analyzer, 1.1.1, User actions tracking and analytics for Django sites., 2020-07-02T17:30:41+0000
/project/manny/, manny, 0.1.4, Django scaffold like in Ruby on Rails, 2020-12-08T18:05:38+0000
/project/django-tiny-erp/, django-tiny-erp, 0.3.0, Enterprise Resource Planning (ERP) for tiny companies, 2020-10-16T19:50:03+0000
/project/django-crum/, django-crum, 0.7.9, Django middleware to capture current request and user., 2020-11-10T17:15:33+0000
/project/django-admin-view/, django-admin-view, 0.0.2, , 2020-01-08T11:15:58+0000
/project/django-mirage-field/, django-mirage-field, 1.1.8, A Django model field that encrypt your data when save to and decrypt when get from database. It keeps data always encrypted in database., 2021-04-15T09:38:28+0000
/project/django-registration-redux/, django-registration-redux, 2.9, An extensible user-registration application for Django, 2021-01-05T02:08:34+0000
/project/wagtail-seo/, wagtail-seo, 0.0.3, Search engine and social media optimization for Wagtail., 2021-01-19T17:07:03+0000
/project/menu-header-wagtail/, menu-header-wagtail, 1.0.1, Full navigation header, menus, sub menus, internal and external links and documents, simple integrated design., 2020-08-27T20:43:27+0000
/project/dgeq/, dgeq, 0.4.1, Provide a query string API for construction of complex django QuerySet - https://dgeq.readthedocs.io/, 2021-01-24T23:36:09+0000
/project/django-timescaledb/, django-timescaledb, 0.2.8, A Django database backend for integration with TimescaleDB, 2021-04-20T20:58:22+0000
/project/zgw-consumers/, zgw-consumers, 0.15.2, Reusable code for consumers of ZGW APIs, 2021-01-26T11:57:31+0000
/project/django-structlog/, django-structlog, 2.1.0, Structured Logging for Django, 2020-11-27T03:51:46+0000
/project/django-valerie/, django-valerie, 0.2.0, A Django app that provides a singleton model so you can store your settings in the database., 2020-10-20T10:51:55+0000
/project/lucterios-documents/, lucterios-documents, 2.5.2.21032517, documents managment module for Lucterios framework., 2021-03-30T09:27:48+0000
/project/ajax-validation/, ajax-validation, 0.1, A package used to return django form validation errors without refreshing the page, 2020-12-28T14:13:50+0000
/project/djangocms-modules/, djangocms-modules, 1.0.0, Adds copy/paste capabilities to groups of plugins, 2020-09-02T13:58:54+0000
/project/django-celery-beat-yywing2/, django-celery-beat-yywing2, 2.0.0, Database-backed Periodic Tasks., 2020-07-08T15:08:40+0000
/project/netbox-reorder/, netbox-reorder, 1.0.1, NetBox Plugin to order interfaces more intuitively, 2020-07-02T18:13:39+0000
/project/skooby-drf-chart-of-account/, skooby-drf-chart-of-account, 1.0.0, A Django app to manage chart of accounts layers., 2020-10-17T09:51:27+0000
/project/django-xls2po/, django-xls2po, 0.7.8, Convert django-po2xls generated .xls files to .po files, 2021-03-16T01:21:24+0000
/project/django-simpleui-captcha/, django-simpleui-captcha, 0.1.2, simpleui_captcha is a django admin captcha packages, 2021-04-21T07:36:00+0000
/project/kde-account-oauth-client/, kde-account-oauth-client, 0.9.4, Django app for using KDE Account as OAuth2 authentication service., 2020-08-12T13:59:48+0000
/project/django-mail-auth/, django-mail-auth, 2.1.2, Django authentication via login URLs, no passwords required, 2020-11-12T13:47:44+0000
/project/django-cryptography/, django-cryptography, 1.0, Easily encrypt data in Django, 2020-02-10T06:18:46+0000
/project/django-magnificent-messages/, django-magnificent-messages, 0.3.1, All-in-one Django message app!, 2020-01-27T14:54:51+0000
/project/djangocms-page-meta/, djangocms-page-meta, 1.0.1, OpenGraph, Twitter Card and Schema.org snippet tags for django CMS 3 pages, 2020-12-21T09:04:42+0000
/project/django-phonenumber-field/, django-phonenumber-field, 5.1.0, An international phone number field for django models., 2021-04-15T07:40:55+0000
/project/lucterios-standard/, lucterios-standard, 2.5.0.21032317, Standard application for Lucterios., 2021-03-30T09:28:16+0000
/project/django-treebeard/, django-treebeard, 4.5.1, Efficient tree implementations for Django, 2021-02-23T06:32:36+0000
/project/django-finder/, django-finder, 0.0.1, A Django app to find car make/model/year from photo., 2020-06-30T17:47:18+0000
/project/proxyid/, proxyid, 0.1.0, Proxyid hides your Django model primary key, 2021-03-27T01:27:00+0000
/project/django-monaco-editor/, django-monaco-editor, 1.0.9, A extra widget for django, 2020-07-16T10:16:39+0000
/project/django-bitcoin-field/, django-bitcoin-field, 0.3, A Bit Library implementation on a Django Model Field, 2020-11-18T13:47:25+0000
/project/django-bulk-update-or-create/, django-bulk-update-or-create, 0.2.0, bulk_update_or_create for Django model managers, 2020-08-09T22:30:13+0000
/project/django-stubs/, django-stubs, 1.8.0, Mypy stubs for Django, 2021-04-12T10:22:39+0000
/project/django-http-method/, django-http-method, 1.2.0, Provide a workaround to use different method from GET or POST inside HTML forms, 2021-04-12T10:38:33+0000
/project/django-override-storage/, django-override-storage, 0.3.1, Django test helpers to manage file storage side effects., 2021-04-08T02:58:05+0000
/project/django-model-controller/, django-model-controller, 0.4.2, A model tracking field, 2021-01-27T11:44:05+0000
/project/aldryn-snake/, aldryn-snake, 2.0.0, Adds header and tail scripts from addons., 2020-09-03T09:11:56+0000
/project/django-login-history/, django-login-history, 0.1.1, A django app to store logins history of each user, 2020-06-08T20:03:52+0000
/project/django-pipeline/, django-pipeline, 2.0.6, Pipeline is an asset packaging library for Django., 2021-01-19T20:52:55+0000
/project/django-admin-notice/, django-admin-notice, 1.1.4, Show a floating notice banner above the Django admin interface, 2021-04-09T22:39:25+0000
/project/django-fluent-contents/, django-fluent-contents, 2.0.7, A widget engine to display various content on Django pages, 2020-01-05T12:17:38+0000
/project/django-render-block/, django-render-block, 0.8.1, Render a particular block from a template to a string., 2020-10-15T19:21:25+0000
/project/django-postgres-metrics/, django-postgres-metrics, 0.10.1, A Django app that exposes a bunch of PostgreSQL database metrics., 2021-04-06T20:18:14+0000
/project/django-session-timeout/, django-session-timeout, 0.1.0, Middleware to expire sessions after specific amount of time, 2020-03-08T19:21:49+0000
/project/zappa/, zappa, 0.52.0, Server-less Python Web Services for AWS Lambda and API Gateway, 2020-10-07T16:06:39+0000
