/project/zappa-dateutil/, zappa-dateutil, 0.51.0, Server-less Python Web Services for AWS Lambda and API Gateway, 2020-07-09T21:51:00+0000
/project/wagtail-localize-git/, wagtail-localize-git, 0.9.2, Wagtail Localize integration for Git-based translation services, 2021-02-03T09:39:15+0000
/project/django-like-systems/, django-like-systems, 0.0.1, An easy way to add feedback'like/dislike' to any of your models., 2020-07-19T15:55:36+0000
/project/django-constance/, django-constance, 2.8.0, Django live settings with pluggable backends, including Redis., 2020-11-20T13:09:51+0000
/project/django-filer/, django-filer, 2.0.2, A file management application for django that makes handling of files and images a breeze., 2020-09-10T19:05:51+0000
/project/sorl-thumbnail/, sorl-thumbnail, 12.7.0, Thumbnails for Django, 2020-11-23T18:34:27+0000
/project/django-impression/, django-impression, 0.5.0, CMS for email; admin UI, API, and permissions for email templates., 2019-12-29T02:30:52+0000
/project/pinax-likes/, pinax-likes, 4.0.0, a liking app for Django, 2020-07-17T23:33:47+0000
/project/django-gitlab-webhooks/, django-gitlab-webhooks, 1.0.0, Gitlab webhooks for Django., 2020-07-19T12:39:34+0000
/project/wagtail-headlessing/, wagtail-headlessing, 0.2, A Django app that exteds wagtail., 2020-11-05T10:28:38+0000
/project/djt-og/, djt-og, 0.9.6, Panel for Django-debug-toolbar that displays OpenGraph metadata found in your HTML page., 2020-11-24T15:33:03+0000
/project/django-polymorphic-foreignkey/, django-polymorphic-foreignkey, 2.0.0, A polymorphic ForeignKey field that acts like a generic ForeignKey, 2021-04-01T21:11:35+0000
/project/django-sockpuppet/, django-sockpuppet, 0.6.0, Helping you use websockets in an effective way in views, 2021-04-19T11:14:10+0000
/project/django-ecsmanage/, django-ecsmanage, 2.0.1, Run any Django management command on an AWS Elastic Container Service (ECS) cluster., 2020-11-24T19:13:24+0000
/project/django-mercadopago/, django-mercadopago, 6.0.1, MercadoPago integration for django, 2020-11-19T11:09:34+0000
/project/django-template-toolkit/, django-template-toolkit, 0.1.3, A collection of useful templates & tags for the Django web framework, 2020-08-06T15:31:23+0000
/project/pinax-wiki/, pinax-wiki, 2.0.0, a wiki app for Django sites, 2020-07-19T18:20:50+0000
/project/django-opstasks/, django-opstasks, 0.2.10, opstasks, 2020-10-13T09:16:35+0000
/project/pinax-announcements/, pinax-announcements, 4.0.0, a Django announcements app, 2020-07-17T23:11:52+0000
/project/muses-lpdp/, muses-lpdp, 0.3.1589114859, Muses from La Passion des Poèmes., 2020-05-10T12:51:04+0000
/project/django-private-chat2/, django-private-chat2, 0.1.4, Chat app for Django, powered by Django Channels, Websockets & Asyncio, 2021-04-01T20:53:12+0000
/project/finitelycomputable-idtrust-django/, finitelycomputable-idtrust-django, 21.4, A Django microsite to explore identifying game-theory strategies, 2021-04-11T15:10:10+0000
/project/django-haystack/, django-haystack, 3.0, Pluggable search for Django., 2020-09-14T23:11:13+0000
/project/django-check-constraint/, django-check-constraint, 1.0.18, Extends django check constraint to support annotations., 2020-02-27T18:57:12+0000
/project/drf-encrypt-content/, drf-encrypt-content, 0.1, The package helps you encrypt your serialized data., 2020-07-04T14:17:31+0000
/project/consent-log/, consent-log, 0.1, Keeps a record of consents. Required by EU law, 2020-06-17T10:34:12+0000
/project/django-ulid/, django-ulid, 0.0.4, Universally Unique Lexicographically Sortable Identifier (ULID) support in Django, 2020-06-17T23:25:59+0000
/project/djangorestframework-datatables/, djangorestframework-datatables, 0.6.0, Seamless integration between Django REST framework and Datatables (https://datatables.net), 2021-02-09T17:12:24+0000
/project/restdoctor/, restdoctor, 0.0.26, BestDoctor's batteries for REST services., 2021-04-12T21:20:50+0000
/project/django-controlcenter/, django-controlcenter, 0.3.0, Set of widgets to build dashboards for your Django-project., 2020-03-19T00:10:49+0000
/project/django-vimage/, django-vimage, 1.1.0,  Image validation (for the Django Admin) as a breeze. Validations on: Size, Dimensions, Format and Aspect Ratio., 2020-09-14T09:29:44+0000
/project/django-hierarkey/, django-hierarkey, 1.0.4, Hierarchical key-value store for django, 2020-07-21T14:57:42+0000
/project/jnt-django-admin-tools/, jnt-django-admin-tools, 0.9.34, A collection of tools for the django administration interface, 2021-04-10T14:35:53+0000
/project/django-mssql-backend/, django-mssql-backend, 2.8.1, Django backend for Microsoft SQL Server, 2020-04-22T19:31:40+0000
/project/django-sqltemplate/, django-sqltemplate, 0.5.2.post2, Database querying tool for Django, based on SQL templates, 2019-12-21T22:46:01+0000
/project/django-allauth-2fa-foxtail/, django-allauth-2fa-foxtail, 0.9, Adds two factor authentication to django-allauth, 2021-03-16T11:02:00+0000
/project/django-extra-field-validation/, django-extra-field-validation, 1.1.1, Extra django field validation., 2021-03-21T17:51:18+0000
/project/graphene-django-tools/, graphene-django-tools, 0.21.0, Tools for use [`graphene-django`](https://github.com/graphql-python/graphene-django), 2020-03-12T03:16:53+0000
/project/cf-django-oauth-toolkit/, cf-django-oauth-toolkit, 1.3.3, OAuth2 Provider for Django, 2021-01-04T05:08:05+0000
/project/django-tag-parser/, django-tag-parser, 3.2, Micro-library to easily write custom Django template tags, 2019-12-18T07:47:11+0000
/project/django-geoadmin/, django-geoadmin, 0.0.2, Django Geo Admin, 2020-07-08T21:18:18+0000
/project/dj-tasks/, dj-tasks, 1.1.0, A django app to run a collection of tasks in a management command., 2020-12-29T17:33:23+0000
/project/django-fido/, django-fido, 0.31, Django application for FIDO protocol, 2021-04-12T11:54:06+0000
/project/django-channels-handlers/, django-channels-handlers, 0.2.2, Django Channels, without the Pain, 2020-09-26T04:53:14+0000
/project/django-yubin/, django-yubin, 1.6.0, A reusable Django app for composing and queueing emails Adds django-mailer2 + django-mailviews + others, 2020-01-27T11:13:24+0000
/project/django-waffle/, django-waffle, 2.1.0, A feature flipper for Django., 2021-01-22T09:36:17+0000
/project/django-taggit-machinetags/, django-taggit-machinetags, 0.8.1, Machine tagging built upon django-taggit, 2020-10-12T12:14:57+0000
/project/django-rest-framework-jwt-oauth2/, django-rest-framework-jwt-oauth2, 0.0.4, A generic api for oauth2, 2020-01-06T11:38:26+0000
/project/acdh-django-archeutils/, acdh-django-archeutils, 0.0.1, Utility module to serialize a django-model into ARCHE-RDF., 2020-01-13T13:14:20+0000
/project/django-command-log/, django-command-log, 0.4.1, Django management command auditing app, 2021-01-09T18:01:37+0000
/project/sifter-wagtail/, sifter-wagtail, 3.0a1, A Django content management system for sifter., 2020-11-09T19:52:19+0000
/project/django-tarantool/, django-tarantool, 0.0.20, Tarantool database backend for Django, 2021-01-16T22:30:30+0000
/project/django-terra-utils/, django-terra-utils, 0.3.11, Common utils for terra apps., 2020-08-25T10:17:55+0000
/project/unicef-vision/, unicef-vision, 0.6, , 2020-10-14T16:20:28+0000
/project/pinax-forums/, pinax-forums, 2.0.0, an extensible forum app for Django and Pinax, 2020-07-19T21:18:44+0000
/project/filefield-cache/, filefield-cache, 0.0.5, Cache Files in Form for files retaining, 2020-01-21T13:00:29+0000
/project/django-fsm-log/, django-fsm-log, 2.0.1, Logging for django-fsm, 2020-03-26T13:05:19+0000
/project/django-contrib-comments/, django-contrib-comments, 2.1.0, The code formerly known as django.contrib.comments., 2021-03-03T20:16:28+0000
/project/django-track-history/, django-track-history, 0.2.0, Easy model change tracking for Django, 2020-05-24T10:29:35+0000
/project/django-cassiopeia/, django-cassiopeia, 2.1.0, Django Integration of the Riot Games Developer API Wrapper 'cassiopeia', 2020-09-30T16:31:09+0000
/project/django-global-config/, django-global-config, 0.1, A Django app for dynamic global config, 2020-04-06T16:12:14+0000
/project/django-jazzmin/, django-jazzmin, 2.4.6, Drop-in theme for django admin, that utilises AdminLTE 3 & Bootstrap 4 to make yo' admin look jazzy, 2021-04-16T08:41:05+0000
/project/django-makeallmessages/, django-makeallmessages, 0.2.1, Django Makeallmessages is a tool designed to ease the message making in your Django project., 2020-10-25T22:28:13+0000
/project/django-salesman/, django-salesman, 1.0.0, Headless e-commerce framework for Django., 2021-03-29T11:13:49+0000
/project/django-audit-events/, django-audit-events, 0.2.4, Log audit events in Django, 2021-04-12T13:17:33+0000
/project/django-csp-observer/, django-csp-observer, 1.0.2, A Django app that evaluates CSP reports to identify malicious activity., 2020-08-27T14:56:14+0000
/project/django-ai-kit-auth/, django-ai-kit-auth, 1.0.0, A Django package for account and authentication managment, 2021-04-12T16:49:28+0000
/project/wagtail-cache/, wagtail-cache, 1.0.2, A simple page cache for Wagtail based on the Django cache middleware., 2021-02-26T21:33:25+0000
/project/wagtailblock-register/, wagtailblock-register, 1.7, Register wagtailblocks with a simple decorator, 2020-09-03T11:26:07+0000
/project/django-http-referrer-policy/, django-http-referrer-policy, 1.1.1, django-http-referrer-policy provides a middleware class implementing the Referrer-Policy header for Django-powered sites., 2020-11-02T09:34:57+0000
/project/django-regions/, django-regions, 0.0.1, 中国省市区数据模型., 2020-08-04T02:01:18+0000
/project/django-camunda/, django-camunda, 0.10.0, Interact with Camunda from Django, 2021-01-26T16:17:09+0000
/project/django-todolist/, django-todolist, 0.2, , 2021-04-15T13:29:29+0000
/project/django-adminactions-ptbr/, django-adminactions-ptbr, 1.9.0, Collections of useful actions to use with django.contrib.admin.ModelAdmin, 2021-03-16T22:13:38+0000
/project/huscy-recruitment/, huscy.recruitment, 0.6.0a20, , 2021-03-11T19:51:12+0000
/project/drfaddons/, drfaddons, 0.1.4, A collection package for Django REST Framework, 2020-08-11T02:49:55+0000
/project/django-generic-plus/, django-generic-plus, 2.3.0, Django model field that combines the functionality of GenericForeignKey and FileField, 2020-07-16T18:12:04+0000
/project/django-tracking-analyzer/, django-tracking-analyzer, 1.1.1, User actions tracking and analytics for Django sites., 2020-07-02T17:30:41+0000
/project/manny/, manny, 0.1.4, Django scaffold like in Ruby on Rails, 2020-12-08T18:05:38+0000
/project/django-tiny-erp/, django-tiny-erp, 0.3.0, Enterprise Resource Planning (ERP) for tiny companies, 2020-10-16T19:50:03+0000
/project/django-registration-redux/, django-registration-redux, 2.9, An extensible user-registration application for Django, 2021-01-05T02:08:34+0000
/project/wagtail-seo/, wagtail-seo, 0.0.3, Search engine and social media optimization for Wagtail., 2021-01-19T17:07:03+0000
/project/menu-header-wagtail/, menu-header-wagtail, 1.0.1, Full navigation header, menus, sub menus, internal and external links and documents, simple integrated design., 2020-08-27T20:43:27+0000
/project/dgeq/, dgeq, 0.4.1, Provide a query string API for construction of complex django QuerySet - https://dgeq.readthedocs.io/, 2021-01-24T23:36:09+0000
/project/django-timescaledb/, django-timescaledb, 0.2.8, A Django database backend for integration with TimescaleDB, 2021-04-20T20:58:22+0000
/project/zgw-consumers/, zgw-consumers, 0.15.2, Reusable code for consumers of ZGW APIs, 2021-01-26T11:57:31+0000
/project/django-structlog/, django-structlog, 2.1.0, Structured Logging for Django, 2020-11-27T03:51:46+0000
/project/django-valerie/, django-valerie, 0.2.0, A Django app that provides a singleton model so you can store your settings in the database., 2020-10-20T10:51:55+0000
/project/lucterios-documents/, lucterios-documents, 2.5.2.21032517, documents managment module for Lucterios framework., 2021-03-30T09:27:48+0000
/project/ajax-validation/, ajax-validation, 0.1, A package used to return django form validation errors without refreshing the page, 2020-12-28T14:13:50+0000
/project/djangocms-modules/, djangocms-modules, 1.0.0, Adds copy/paste capabilities to groups of plugins, 2020-09-02T13:58:54+0000
/project/django-celery-beat-yywing2/, django-celery-beat-yywing2, 2.0.0, Database-backed Periodic Tasks., 2020-07-08T15:08:40+0000
/project/netbox-reorder/, netbox-reorder, 1.0.1, NetBox Plugin to order interfaces more intuitively, 2020-07-02T18:13:39+0000
/project/django-finder/, django-finder, 0.0.1, A Django app to find car make/model/year from photo., 2020-06-30T17:47:18+0000
/project/proxyid/, proxyid, 0.1.0, Proxyid hides your Django model primary key, 2021-03-27T01:27:00+0000
/project/django-monaco-editor/, django-monaco-editor, 1.0.9, A extra widget for django, 2020-07-16T10:16:39+0000
/project/django-bitcoin-field/, django-bitcoin-field, 0.3, A Bit Library implementation on a Django Model Field, 2020-11-18T13:47:25+0000
/project/django-bulk-update-or-create/, django-bulk-update-or-create, 0.2.0, bulk_update_or_create for Django model managers, 2020-08-09T22:30:13+0000
/project/django-stubs/, django-stubs, 1.8.0, Mypy stubs for Django, 2021-04-12T10:22:39+0000
/project/django-http-method/, django-http-method, 1.2.0, Provide a workaround to use different method from GET or POST inside HTML forms, 2021-04-12T10:38:33+0000
/project/django-override-storage/, django-override-storage, 0.3.1, Django test helpers to manage file storage side effects., 2021-04-08T02:58:05+0000
/project/django-model-controller/, django-model-controller, 0.4.2, A model tracking field, 2021-01-27T11:44:05+0000
/project/django-crum/, django-crum, 0.7.9, Django middleware to capture current request and user., 2020-11-10T17:15:33+0000
/project/django-admin-view/, django-admin-view, 0.0.2, , 2020-01-08T11:15:58+0000
/project/django-mirage-field/, django-mirage-field, 1.1.8, A Django model field that encrypt your data when save to and decrypt when get from database. It keeps data always encrypted in database., 2021-04-15T09:38:28+0000
/project/aldryn-snake/, aldryn-snake, 2.0.0, Adds header and tail scripts from addons., 2020-09-03T09:11:56+0000
/project/django-login-history/, django-login-history, 0.1.1, A django app to store logins history of each user, 2020-06-08T20:03:52+0000
/project/django-pipeline/, django-pipeline, 2.0.6, Pipeline is an asset packaging library for Django., 2021-01-19T20:52:55+0000
/project/django-admin-notice/, django-admin-notice, 1.1.4, Show a floating notice banner above the Django admin interface, 2021-04-09T22:39:25+0000
/project/django-fluent-contents/, django-fluent-contents, 2.0.7, A widget engine to display various content on Django pages, 2020-01-05T12:17:38+0000
/project/django-render-block/, django-render-block, 0.8.1, Render a particular block from a template to a string., 2020-10-15T19:21:25+0000
/project/django-postgres-metrics/, django-postgres-metrics, 0.10.1, A Django app that exposes a bunch of PostgreSQL database metrics., 2021-04-06T20:18:14+0000
/project/django-session-timeout/, django-session-timeout, 0.1.0, Middleware to expire sessions after specific amount of time, 2020-03-08T19:21:49+0000
/project/zappa/, zappa, 0.52.0, Server-less Python Web Services for AWS Lambda and API Gateway, 2020-10-07T16:06:39+0000
/project/django-tinymce4-lite/, django-tinymce4-lite, 1.8.0, A Django application that provides a fully functional TinyMCE 4 editor widget for models and forms., 2020-04-11T09:51:44+0000
/project/lc-django-elasticsearch-dsl/, lc-django-elasticsearch-dsl, 7.1.3, Wrapper around elasticsearch-dsl-py for django models, 2020-05-11T09:06:12+0000
/project/django-boost/, django-boost, 1.7.2, Django Extension library, 2020-12-13T01:09:05+0000
/project/django-media-fixtures/, django-media-fixtures, 1.0.0, Simple project to copy media files (intended for fixtures loads), pretty much as Django staticfiles does, 2020-05-19T14:58:16+0000
/project/django-rest-framework-datatables-filter/, django-rest-framework-datatables-filter, 0.0.2, Seamless integration between Django REST framework and Datatables (https://datatables.net), 2020-12-07T22:50:10+0000
/project/mapitio-edc/, mapitio-edc, 0.1.19, Retrospective HIV Cohort for Diabetes Research, 2020-05-14T02:48:17+0000
/project/django-money/, django-money, 1.3.1, Adds support for using money and currency fields in django models and forms. Uses py-moneyed as the money implementation., 2021-02-04T09:34:39+0000
/project/django-trench/, django-trench, 0.2.3, REST Multi-factor authentication package for Django, 2019-12-17T10:39:08+0000
/project/django-authsimple/, django-authsimple, 1.0.2, A Django app to implement basic authentication in django project., 2021-04-21T14:23:31+0000
/project/django-cas-agn/, django-cas-agn, 4.1.2, Django CAS 1.0/2.0/3.0 client authentication library, support Django 2.0, 2.1, 2.2, 3.0 and Python 3.5+, 2020-09-10T16:27:37+0000
/project/django-notifications2/, django-notifications2, 0.1.11, Django notification app., 2020-09-08T20:12:08+0000
/project/django-frontpage/, django-frontpage, 1.0.3, Show a page before your users authenticate into the admin site, 2021-03-28T19:07:30+0000
/project/django-vestlus/, django-vestlus, 0.1.4, A Django app for chat conversations, 2020-07-23T00:57:59+0000
/project/dj-static-revision/, dj-static-revision, 0.4, Revision info for Django static file, 2020-11-27T09:53:20+0000
/project/djapi/, djapi, 0.2, The library of simple helpers to build API with Django., 2020-08-04T14:21:35+0000
/project/django-modeltranslation-rosetta/, django-modeltranslation-rosetta, 0.0.6, , 2021-02-17T18:20:01+0000
/project/django-currentuser/, django-currentuser, 0.5.3, Conveniently store reference to request user on thread/db level., 2021-04-23T19:44:31+0000
/project/django-crawfish/, django-crawfish, 0.0.8, pending..., 2020-12-20T23:47:15+0000
/project/django-probes/, django-probes, 1.6.0, Make Django wait until database is ready. Probes for Docker and Kubernetes., 2020-12-24T15:42:36+0000
/project/irekua-rest-api/, irekua-rest-api, 0.1.3, REST API for Irekua access, 2020-04-27T04:47:55+0000
/project/djecrety/, djecrety, 1.0.14, Djecrety package provides a command to generate a new secret key for your project and save it to settings.py file., 2021-04-08T18:20:11+0000
/project/sveetch-djangoapp-sample/, sveetch-djangoapp-sample, 0.1.0, A project sample created from cookiecutter-sveetch-djangoapp, 2020-10-19T00:40:38+0000
/project/django-bldtool/, django-bldtool, 0.0.1, , 2020-04-16T17:03:29+0000
/project/django-simple-bulma/, django-simple-bulma, 2.2.0, Django application to add the Bulma CSS framework and its extensions, 2021-04-12T18:53:11+0000
/project/django-ph-geography/, django-ph-geography, 1.0.0, Philippine Geography models for Django, 2020-10-14T18:18:04+0000
/project/drf-yasg-json-api/, drf-yasg-json-api, 0.8.1, Automated generation of real Swagger/OpenAPI 2.0 schemas for JSON API Django Rest Framework endpoints., 2021-02-26T17:29:49+0000
/project/django-nacl-fields/, django-nacl-fields, 4.0.0, This is a collection of Django Model Field classes that are encrypted using PyNaCl., 2020-12-18T15:30:31+0000
/project/huscy-project-storage/, huscy.project-storage, 0.1.0a0, , 2020-04-14T10:23:37+0000
/project/az-iranian-bank-gateways/, az-iranian-bank-gateways, 1.6.8, Iraninan Bank Gateways for django, 2021-03-23T19:48:06+0000
/project/heroicons/, heroicons, 1.0.2, Use heroicons in your Django and Jinja templates., 2021-04-22T18:21:11+0000
/project/django-rclone-storage/, django-rclone-storage, 0.1.1, A simple wrapper for Rclone as a Django storage, 2021-01-21T12:06:32+0000
/project/django-vue-rollup/, django-vue-rollup, 0.1.2, A django-compressor filter to compile .vue files using rollup, 2020-11-26T14:02:57+0000
/project/django-sequences/, django-sequences, 2.6, Generate gapless sequences of integer values., 2021-02-06T17:58:24+0000
/project/django-xicon/, django-xicon, 0.16.0, Django reusable application to handle modern bunch of site icons, 2021-04-16T02:35:59+0000
/project/django-clearcache/, django-clearcache, 1.2.1, Allows you to clear Django cache via admin UI or manage.py command, 2021-04-15T11:55:55+0000
/project/django-quickbooks/, django-quickbooks, 0.6.4.2, A Django app to integrate with quickbooks., 2020-03-09T11:38:01+0000
/project/django-hydra/, django-hydra, 0.9.9, Gives superpowers to Django Framework, 2020-11-25T22:50:05+0000
/project/pinax-testimonials/, pinax-testimonials, 3.0.0, a testimonials app, 2020-07-17T23:45:53+0000
/project/huscy-subjects/, huscy.subjects, 1.0.2, Managing subjects in a human research context., 2021-02-15T07:34:04+0000
/project/django-queryable-properties/, django-queryable-properties, 1.6.1, Write Django model properties that can be used in database queries., 2021-04-19T17:13:57+0000
/project/django-import/, django-import, 0.0.4, Import to django models, 2020-05-28T07:58:34+0000
/project/django-auth-adfs/, django-auth-adfs, 1.6.1, A Django authentication backend for Microsoft ADFS and AzureAD, 2021-03-25T11:37:01+0000
/project/django-query-params/, django-query-params, 0.5.0, A Django app providing template tags for query string management, 2021-01-21T22:04:20+0000
/project/geonode-avatar/, geonode-avatar, 5.0.7, A fork of django-avatar, for GeoNode, 2020-08-04T15:50:17+0000
/project/django-infopush/, django-infopush, 1.8, Django reusable app, what allows to send web push., 2020-12-24T15:09:43+0000
/project/django-athm/, django-athm, 0.4.2, Django + ATH Móvil, 2020-11-01T16:33:13+0000
/project/django-anymail/, django-anymail, 8.2, Django email integration for Amazon SES, Mailgun, Mailjet, Postmark, SendGrid, SendinBlue, SparkPost and other transactional ESPs, 2021-01-27T22:46:58+0000
/project/drf-imgproxy/, drf-imgproxy, 1.1.0, Serialize Django's ImageField into imgproxy URLs for your Django REST Framework APIs to generate thumbnails., 2021-04-23T12:27:59+0000
/project/django-tinymce4-widget/, django-tinymce4-widget, 6.1.2, A Django application that provides a TinyMCE 4 editor widget without any static files, 2021-04-06T18:17:53+0000
/project/django-template-editor/, django-template-editor, 0.1.1, A Django app to edit and render template., 2020-02-07T19:58:36+0000
/project/pinax-referrals/, pinax-referrals, 4.0.1, a referrals app for Django, 2020-07-27T19:35:28+0000
/project/pinax-invitations/, pinax-invitations, 7.0.0, a user to user join invitations app, 2020-07-17T23:31:40+0000
/project/django-admin-shuffle/, django-admin-shuffle, 0.1.7, Simply shuffles objects on admin changelist view, 2020-09-04T06:25:21+0000
/project/perimeter/, perimeter, 0.14, Site-wide perimeter access control for Django projects., 2020-07-15T10:09:45+0000
/project/django-flash-rest/, django-flash-rest, 0.8.4, Tiny, lightweight, blazing fast REST library for django, 2020-06-15T15:40:29+0000
/project/wagtail-shell/, wagtail-shell, 0.1.0, JavaScript powered frontend for Wagtail, 2021-01-02T19:29:44+0000
/project/aleksis-app-untis/, aleksis-app-untis, 2.0a2, AlekSIS (School Information System) — App for Untis import, 2020-05-11T13:23:12+0000
/project/uzsoato-registry/, uzsoato-registry, 0.1.3, SOATO Registry of Uzbekistan, 2021-04-21T13:45:41+0000
/project/django-fields-history/, django-fields-history, 0.1.1, Store model fields history, 2020-03-26T16:42:32+0000
/project/django-onfido/, django-onfido, 1.0, Django app for integration with Onfido., 2021-03-29T11:54:09+0000
/project/django-fsm-admin2/, django-fsm-admin2, 0.1.2, django-fsm transition integration to django admin., 2021-04-23T11:34:15+0000
/project/arrange-videochat/, arrange-videochat, 0.1.1, A Django app to arrange a meeting for a video chat, 2020-08-01T14:49:50+0000
/project/django-npm-mjs/, django-npm-mjs, 2.0.9, ('A Django package to use npm.js dependencies and transpile ES2015+',), 2020-10-14T13:42:32+0000
/project/django-magic-link/, django-magic-link, 0.4.1, Django app for managing tokenised 'magic link' logins., 2020-08-07T14:04:06+0000
/project/django-controlled-vocabulary/, django-controlled-vocabulary, 0.11, Link your data to authority lists or your own controlled lists, 2020-10-14T16:43:32+0000
/project/django-b2/, django-b2, 0.7.0, django backblaze b2 storage using b2sdk, 2020-12-29T16:40:18+0000
/project/django-maintenance-mode/, django-maintenance-mode, 0.16.0, django-maintenance-mode shows a 503 error page when maintenance-mode is on., 2021-03-23T10:44:46+0000
/project/pwned-passwords-django/, pwned-passwords-django, 1.4.1, A Pwned Passwords implementation for Django sites., 2020-09-21T08:27:41+0000
/project/dj-logger/, dj-logger, 0.1, A Django app to log all exceptions, errors and user activity., 2021-03-07T14:23:34+0000
/project/django-lrucache-backend/, django-lrucache-backend, 4.0.0, A smarter local memory cache backend for Django, 2020-04-05T11:36:23+0000
/project/django-adminlte3-amigne/, django-adminlte3-amigne, 0.1.99, AdminLTE template packaged for Django, 2021-03-09T22:06:38+0000
/project/django-vega-admin/, django-vega-admin, 0.0.19, Simple and fast automated CRUD for any Django model, 2020-06-26T11:29:57+0000
/project/wagtail-resume/, wagtail-resume, 1.1.0, A Wagtail project made to simplify creation of resumes for developers., 2021-01-28T12:16:26+0000
/project/django-html-components/, django-HTML-components, 0.3, Adds several commonly used components for Django, such as a styled header and footer., 2020-01-25T08:36:18+0000
/project/django-commonstuff/, django-commonstuff, 0.9, Reusable app, what collects django-related code, used in most of my projects., 2020-12-24T14:55:52+0000
/project/django-user-visit/, django-user-visit, 0.4.1, Django app used to track user visits., 2020-08-19T17:02:07+0000
/project/drf-generators/, drf-generators, 0.5.0, Generate DRF Serializers, Views, and urls for your API application., 2020-02-05T17:59:18+0000
/project/viapy/, viapy, 0.2.0, Python module for interacting with VIAF data & APIs, 2020-03-26T16:04:07+0000
