/project/py3-bp/, py3-bp, 0.0.4, Ultimate template for new Python 3 projects, 2019-09-20T05:05:48+0000
/project/django-slick-reporting/, django-slick-reporting, 0.5.8, A one-stop report and analytics generation and computation with batteries included, 2021-04-08T05:22:23+0000
/project/platformids/, platformids, 0.1.39, Enumeration of operating systems and their releases., 2019-12-18T14:04:11+0000
/project/aiengine/, aiengine, 1.6.1, AIEngine is a next generation interactive/programmable Python/Ruby/Java/Lua packet inspection engine, 2016-10-04T21:03:46+0000
/project/machine-learning-py/, machine-learning-py, 3.5.8, mlpy - Machine Learning Py - High-Performance Python Package for Predictive Modeling, 2018-05-17T09:06:30+0000
/project/ifconfigpy/, ifconfigpy, 0.0.1.devr11, ifconfigpy is a python library to manipulate interfaces like ifconfig, 2014-06-24T22:46:47+0000
/project/djt-nvu/, djt-nvu, 0.9.2, Panel for Django-debug-toolbar that checks againt a HTML validator, 2020-11-22T17:13:55+0000
/project/pymt/, PyMT, 0.5.1, A framework for making accelerated multitouch UI, 2010-09-06T21:04:31+0000
/project/spriterx/, spriterx, 0.1.1, Python 3.6+ web scraping micro-framework based on asyncio coroutine pool., 2019-09-21T07:31:22+0000
/project/nmdc/, nmdc, 0.2.1, Command line toolbox of NMDC (https://microbiomedata.org/), 2021-01-29T21:03:14+0000
/project/someip/, someip, 0.1.2, , 2020-07-31T15:59:44+0000
/project/homeassistant-pyozw/, homeassistant-pyozw, 0.1.10, python_openzwave is a python wrapper for the openzwave c++ library., 2020-03-24T10:10:14+0000
/project/pygibson/, pygibson, 0.2.1, Python client for gibson cache server, 2015-08-02T20:38:17+0000
/project/fmmap/, fmmap, 2.0.0, A fast reimplementation of mmap, 2020-06-03T18:22:51+0000
/project/drupan/, drupan, 3.0.2, Drupan is a flexible static site generator helping you     to create blogs, single page applications or traditional websites., 2018-08-03T13:20:54+0000
/project/piratebaybua/, PirateBayBUA, 0.0.1r004-apha-chyctu, PirateBay Json, Python Query analysis, implemented with Better User Agent and Aparatus in << Software Pirating Analysis >> know in detection of malware, virus and Evil intention., 2013-09-04T20:58:08+0000
/project/mikla/, mikla, 0.2.1, A command line tool to edit text files encrypted with GnuPG whilst preventing the plaintext from being written to the hard drive., 2015-12-07T00:23:41+0000
/project/pyinstallercustom/, PyInstallerCustom, 3.5, PyInstaller bundles a Python application and all its dependencies into a single package., 2021-04-20T18:01:05+0000
/project/schedule-jobs/, schedule-jobs, 0.0.4, A Schedule Jobs Library, 2018-07-28T10:45:11+0000
/project/mod-wsgi-standalone/, mod-wsgi-standalone, 4.7.1, Installer for Apache/mod_wsgi., 2020-02-16T23:05:51+0000
/project/esbackup/, esbackup, 0.2, Simple backup tool, 2011-11-02T05:51:55+0000
/project/supercli/, supercli, 0.0a5, Toolkit to quickly create readable, user-friendly CLI interfaces with automatic shell-autocompletion, 2017-03-05T12:06:36+0000
/project/fdict/, fdict, 0.8.1, Easy out-of-core computing of recursive dict, 2017-08-08T19:01:56+0000
/project/composites/, composites, 0.3.5, Methods to calculate composite material properties, 2021-04-23T15:06:43+0000
/project/baruwa/, baruwa, 2.0.9, Ajax enabled MailScanner web frontend, 2015-08-29T09:50:59+0000
/project/anyks-sc/, anyks-sc, 1.2.4, Smart language model, 2020-09-20T11:32:24+0000
/project/py-rtprio/, py-rtprio, 1.3.1, rtprio(2) interface for altering process priority, 2016-12-03T05:59:14+0000
/project/mathmaker/, mathmaker, 0.7.4, Mathmaker creates automatically elementary maths exercises and their (detailed) answers., 2018-10-20T09:19:02+0000
/project/baboon/, baboon, 0.1.4, Detect merge conflict in realtime., 2013-02-12T18:13:35+0000
/project/aead/, aead, 0.2, An authenticated encryption implementation., 2014-12-29T09:24:40+0000
/project/geneflow/, geneflow, 2.2.1, A light-weight platform-agnostic workflow engine for scientific computing., 2021-02-19T20:32:24+0000
/project/alignak/, alignak, 2.1.5, Alignak is a monitoring framework compatible with Nagios configuration and plugins, 2019-04-29T05:09:03+0000
/project/routerchecker/, routerchecker, 1.1.0, Router firmware update scanner, 2016-05-24T13:09:13+0000
/project/psutil/, psutil, 5.8.0, Cross-platform lib for process and system monitoring in Python., 2020-12-19T01:19:27+0000
/project/gocept-sftpcopy/, gocept.sftpcopy, 2.0, Upload/download files via SFTP to a maildir structure, 2020-06-18T11:56:29+0000
/project/py-make/, py-make, 0.1.1, Makefile execution powered by pure Python, 2019-01-21T00:18:55+0000
/project/checkpkgaudit/, checkpkgaudit, 0.7.2, Check FreeBSD pkg audit Nagios|Icinga|shinken|etc plugin., 2017-06-05T19:38:45+0000
/project/tqdm/, tqdm, 4.60.0, Fast, Extensible Progress Meter, 2021-04-06T01:23:21+0000
/project/iosshy/, IOSSHy, 1.6, Desktop tool to quickly setup SSH tunnels and automatically execute commands that make use of them, 2011-03-02T08:57:22+0000
/project/qsdsan/, qsdsan, 0.2.3, Quantitative Sustainable Design for sanitation and resource recovery systems, 2021-04-24T21:13:37+0000
/project/nubium-faust/, nubium-faust, 1.0.1, Python Stream processing., 2021-04-20T22:05:16+0000
/project/wllvm/, wllvm, 1.3.1, Whole Program LLVM, 2021-04-10T16:39:41+0000
/project/eddie-tool/, EDDIE-Tool, 1.0.0, The EDDIE Tool is a system and network monitoring, security, and performance analysis agent developed entirely in threaded Python. Its key features are portability, extendibility, and powerful configuration., 2009-09-28T14:19:16+0000
/project/prwlock/, prwlock, 0.4.1, Native process-shared rwlock support for Python, 2020-05-28T13:37:06+0000
/project/oonibackend/, oonibackend, 1.3.7, Open Observatory of Network Interference Backend, 2019-12-06T08:33:16+0000
/project/easytextract/, easytextract, 1.1.5, Easy to use text extractor, from PDF, DOC, DOCX and other document types, using the awesome Textract, including if necessary using OCR (via Tesseract)., 2017-11-12T23:21:14+0000
/project/sisqo/, sisqo, 2.1.1, A better library for automating network gear with Cisco-style command line interfaces, 2017-08-25T20:36:37+0000
/project/csg-dicoms-anonymizer/, csg-dicoms-anonymizer, 1.4.2, Robust and easy to use generic dicoms anonymizer with demographics csv spreadsheet anonymization by hashed ids, 2018-02-17T14:44:12+0000
/project/patois/, patois, 0.1.0, Python VM compatibility library, 2014-01-08T12:51:11+0000
/project/thermosolver/, thermosolver, 0.0.1, Under development, 2016-12-17T14:28:21+0000
/project/edison/, edison, 0.0.2, Absurdity as a Service, 2014-02-04T06:19:01+0000
/project/jdtranslationhelper/, jdTranslationHelper, 2.1, A simple API for translating your programs, 2019-11-21T18:04:28+0000
/project/jdreplace/, jdReplace, 2.2, With jdReplace you can replace a text in all files of a directory, 2019-12-04T14:10:12+0000
/project/ofunctions-csv/, ofunctions.csv, 0.2.0, CSV file reader with header management, fieldnames, delimiters and comment skipping, 2021-03-30T13:59:41+0000
/project/ssh-python/, ssh-python, 0.9.0, libssh C library bindings for Python., 2020-12-18T09:52:13+0000
/project/cmdqueue/, cmdQueue, 0.0.5, A command line queue., 2017-08-29T22:08:16+0000
/project/dyndnsc/, dyndnsc, 0.6.1, dynamic dns (dyndns) update client with support for multiple protocols, 2021-04-02T05:55:24+0000
/project/yapytf/, yapytf, 0.5.7, Yet Another Python Terraform Wrapper, 2020-05-27T19:10:37+0000
/project/apkverify/, apkverify, 0.1.1.0, Jar Signature / APK Signature v2 verify with pure python (support rsa dsa ecdsa)., 2018-11-30T18:55:42+0000
/project/pydstool/, PyDSTool, 0.91.0, Python dynamical systems simulation and modeling, 2020-01-31T20:46:21+0000
/project/git-fame/, git-fame, 1.14.1, Pretty-print `git` repository collaborators sorted by contributions, 2021-03-01T22:16:22+0000
/project/bewegung/, bewegung, 0.0.4, a versatile video renderer, 2020-12-14T20:01:32+0000
/project/hookee/, hookee, 2.0.6, Command line webhooks, on demand., 2021-03-08T18:38:14+0000
/project/sap-py-jwt/, sap-py-jwt, 1.5.0, SAP CP Security Client Library for JWT offline validation, 2019-07-09T21:40:18+0000
/project/djt-og/, djt-og, 0.9.6, Panel for Django-debug-toolbar that displays OpenGraph metadata found in your HTML page., 2020-11-24T15:33:03+0000
/project/freezer/, freezer, 10.0.0, The OpenStack Backup Restore and Disaster Recovery as a Service Platform, 2021-04-14T11:03:37+0000
/project/oneid-connect/, oneID-connect, 0.21.1, Neustar TDI is an identity & authentication framework for the Internet of Things (IoT) devices, servers, and end-users., 2017-10-17T20:28:53+0000
/project/confset/, confset, 0.1.0, A simple script to change or update package configurations, 2020-05-08T21:30:10+0000
/project/django-ra/, django-ra, 0.1.1, A light-weight effective Django based framework to create diverse business applications, 2020-01-12T15:16:30+0000
/project/psutil-extra/, psutil-extra, 0.2.0, Some helper functions to go along with the ones in psutil, 2020-08-03T20:17:49+0000
/project/lpschedule-generator/, lpschedule-generator, 0.10.2, LibrePlanet schedule generator, 2020-07-11T07:30:09+0000
/project/ipaddresstools/, ipaddresstools, 1.2.11, This is a library used to manipulate and verify ipv4 address's. ucast and mcast, 2021-01-29T17:46:40+0000
/project/django-kn-defaults/, django-kn-defaults, 0.3.0, A collection of logging and helpers for KN., 2020-10-12T06:16:54+0000
/project/pypsutil/, pypsutil, 0.1.0, A partial reimplementation of psutil in pure Python using ctypes., 2020-09-01T02:12:23+0000
/project/procblock/, procblock, 2010.10.15.0, problock is a logic and data tag processor and hardended execution environment., 2010-10-15T16:46:39+0000
/project/filegardener/, filegardener, 1.6.9, filegardener file utilities dedup, only file copy detection, empty dir detection, 2017-04-02T00:12:35+0000
/project/bw2qsd/, bw2qsd, 0.0.10, Bridging Brightway2 and QSD packages for LCA, 2021-04-20T17:31:01+0000
/project/passweb/, passweb, 0.0.1, Secure Password (Web) Manager, 2013-09-01T12:12:54+0000
/project/python-dbusmock/, python-dbusmock, 0.23.0, Mock D-Bus objects, 2021-03-24T18:39:18+0000
/project/jdtextedit/, jdTextEdit, 8.3, A powerful texteditor with a lot of features, 2021-02-28T19:37:01+0000
/project/trio-asyncio/, trio-asyncio, 0.12.0, A re-implementation of the asyncio mainloop on top of Trio, 2021-01-08T00:57:52+0000
/project/ffmpy/, ffmpy, 0.3.0, A simple Python wrapper for ffmpeg, 2021-01-13T11:55:47+0000
/project/setproctitle/, setproctitle, 1.2.2, A Python module to customize the process title, 2021-01-23T03:52:02+0000
/project/zsm/, zsm, 0.2.1, ZFS Snapshot Manager, 2021-01-24T23:21:06+0000
/project/fluids/, fluids, 1.0.5, Fluid dynamics component of Chemical Engineering Design Library (ChEDL), 2021-04-22T02:13:17+0000
/project/pythonids/, pythonids, 0.1.40, The 'pythonids' package provides the identification and enumeration of Python syntax and implementation., 2019-12-19T05:50:36+0000
/project/command-runner/, command-runner, 0.6.3, Platform agnostic command and shell execution tool, also allows UAC/sudo privilege elevation, 2021-03-15T15:28:07+0000
/project/cpuid-py/, cpuid-py, 0.0.1, cpuid Pythonic API, 2017-10-18T13:46:39+0000
/project/repomirror/, repomirror, 1.0.4, Clone/mirror multiple Linux distro/BSD flavor/etc. repositories to a local server, 2020-07-07T17:33:39+0000
/project/ofunctions-mailer/, ofunctions.mailer, 0.3.5, Mail sending function that handles encryption, authentication, bulk and split mail sending, 2021-02-11T01:10:18+0000
/project/scriptharness/, scriptharness, 0.2.0, A generic logging, configuration, and workflow framework for scripts., 2015-06-21T07:20:09+0000
/project/moin/, moin, 1.9.11, MoinMoin 1.9.11 is an easy to use, full-featured and extensible wiki software package, 2020-11-08T17:42:48+0000
/project/dyndnsc-growl/, dyndnsc-growl, 0.1, plugin for dyndnsc providing growl desktop notifications, 2018-01-14T19:42:18+0000
/project/python-powerdns/, python-powerdns, 0.2.1, PowerDNS web api python client and interface, 2018-06-19T13:22:37+0000
/project/sasspython/, SassPython, 0.2.1, binding for libsass, 2012-08-08T08:02:26+0000
/project/qtile/, qtile, 0.17.0, A pure-Python tiling window manager., 2021-02-13T18:46:35+0000
/project/ofunctions-checksums/, ofunctions.checksums, 0.2.1, SHA256 Checksumming functions, checksum manifest file creation and verification, 2021-02-11T01:10:12+0000
/project/ssh2-python/, ssh2-python, 0.26.0, Super fast SSH library - bindings for libssh2, 2021-01-02T21:30:02+0000
/project/troposphere/, troposphere, 2.7.1, AWS CloudFormation creation library, 2021-04-16T18:26:32+0000
/project/botskeleton/, botskeleton, 3.3.6, A skeleton for content bots., 2019-07-03T04:55:42+0000
/project/yatfs/, yatfs, 0.4.0, FUSE-based torrent-backed filesystem, 2018-02-01T09:39:13+0000
/project/pymailq/, pymailq, 0.9.0, Postfix queue control python tool, 2017-09-07T11:29:36+0000
/project/hb/, hb, 1.4.2, A simple command-line utility for calculating checksums., 2018-11-03T05:06:35+0000
/project/rhdndat/, rhdndat, 1.6.6, A www.romhacking.net dat creator and update checker., 2019-06-17T01:13:38+0000
/project/dyndnsc-macosnotify/, dyndnsc-macosnotify, 0.1, plugin for dyndnsc providing macos desktop notifications, 2018-01-14T19:39:05+0000
/project/watchdog/, watchdog, 2.0.3, Filesystem events monitoring, 2021-04-22T17:57:30+0000
/project/inary/, inary, 1.4.2-1, Inary (Special Package Manager), 2020-11-01T17:55:55+0000
/project/updoc/, updoc, 1.9.7, Upload HTML documentations and share bookmarks, 2018-02-04T14:11:41+0000
/project/inparallel/, inparallel, 1.0.3, A novel take on process-based parallelism in Python (CPython 2.7 or 3.4+), 2017-01-06T15:12:15+0000
/project/homer/, homer, 0.2.7, Configuration manager for network devices, 2021-04-20T13:32:41+0000
/project/namedtupledefs2/, namedtupledefs2, 0.1.21, Extended 'namedtuple' by default values., 2019-12-13T12:31:13+0000
/project/ofunctions-bisection/, ofunctions.bisection, 0.2.1, Bisection function that allows callable to be tested with any list of arguments, 2021-02-11T01:10:11+0000
/project/readme/, readme, 0.7.1, readme is a library for rendering "readme" descriptions for Warehouse, 2016-01-05T09:24:35+0000
/project/aifashion-sdk/, aifashion-sdk, 1.2.0, AIFashion® Python SDK, 2019-07-18T07:39:51+0000
/project/bitprim/, bitprim, 1.1.94, Bitcoin development platform, 2018-08-08T13:17:36+0000
/project/autodock-logger/, autodock-logger, 0.0.2, autodock logger plugin, 2015-12-26T04:46:00+0000
/project/minecraft-launcher-lib/, minecraft-launcher-lib, 2.1, A library for creating a custom Minecraft launcher, 2020-07-13T20:23:32+0000
/project/ofunctions-misc/, ofunctions.misc, 1.0.0, Collection of various functions, 2021-02-11T01:10:19+0000
/project/wikilink/, wikilink, 0.3.0.post1, A multiprocessing web-scraping application to scrape wiki pages and find minimum number of links between two given wiki pages., 2019-03-30T14:24:35+0000
/project/kvpio-python/, kvpio-python, 0.2.0, Official kvp.io python bindings and client, 2016-06-06T14:56:33+0000
/project/dato-predictive-service-client/, dato-predictive-service-client, 1.0.0, Dato Predictive Service Client makes it easy to make REST API calls to Dato Predictive Services, 2015-05-19T00:12:17+0000
/project/libzt/, libzt, 1.3.4b1, ZeroTier, 2021-03-18T01:15:49+0000
/project/yapydata/, yapydata, 0.1.40, The 'yapydata provides miscellaneous low-level *Python* data access APIs., 2019-12-13T09:48:02+0000
/project/pyonedesk/, pyonedesk, 0.0.30, PyOneDesk, 2019-08-01T14:38:31+0000
/project/flutils/, flutils, 0.7, A collection of commonly used utility functions for Python projects., 2020-07-23T17:06:11+0000
/project/sequencetools/, sequencetools, 0.0.7, sequencetools -- A package for FASTX stats generation and manipulation, 2020-02-07T20:25:50+0000
/project/cdist/, cdist, 6.9.6, A Usable Configuration Management System, 2021-04-20T05:36:01+0000
/project/pysha3/, pysha3, 1.0.2, SHA-3 (Keccak) for Python 2.7 - 3.5, 2017-02-05T16:42:07+0000
/project/wiredtiger/, wiredtiger, 10.0.0, high performance, scalable, production quality, NoSQL, Open Source extensible platform for data management, 2021-04-12T04:11:41+0000
/project/rainbow-logging-handler/, rainbow_logging_handler, 2.2.2, Ultimate Python colorized logger with user-custom color, 2014-08-06T23:43:19+0000
/project/pydica-watchdog/, pydica-watchdog, 0.6.2, Native and Virtual Filesystem Events Monitoring, 2013-07-25T12:52:41+0000
/project/jdaptdirreinstall/, jdAptDirReinstall, 1.0, Reinstall all packages that have files in a directory, 2019-11-13T16:33:56+0000
/project/meinheld/, meinheld, 1.0.2, High performance asynchronous Python WSGI Web Server, 2020-05-17T13:09:14+0000
/project/suext/, suext, 0.0.3, Utility for showing any file extension and MIME type info. Support show files information in a directory as list or table., 2020-04-01T07:41:01+0000
/project/libspg/, libspg, 0.2, Python library for interacting with Brazil NPAC SPG, 2015-06-15T01:36:51+0000
/project/openvas-lib/, openvas-lib, 1.1.8, OpenVAS Manager for OpenVAS 6 to 8 and XML report parser, 2019-06-27T08:57:31+0000
/project/wpyscan/, wpyscan, 1.0.1, Wordpress pentest tool, 2018-12-02T15:56:28+0000
/project/pthat/, pthat, 1.0.1, A package containing the API for the PTHat by CNC Design Limited, 2020-12-01T01:35:06+0000
/project/autodock/, autodock, 0.0.2, Daemon for Docker Automation, 2015-12-26T04:28:17+0000
/project/twine-verify-upload/, twine-verify-upload, 0.0.3, Adds "verify-upload" command to twine., 2020-08-15T23:11:48+0000
/project/pfweb/, pfweb, 0.1.0.dev4, Simple web interface for the OpenBSD Packet Filter, 2016-12-10T23:22:02+0000
/project/smersh-cli/, smersh-cli, 0.1.dev1, A SMERSH command-line client, 2021-03-08T13:02:17+0000
/project/simple-monitor-alert/, simple-monitor-alert, 0.2.4, A simple monitor with alerts for Unix/Linux under the KISS philosophy. Keep It Simple, Stupid!, 2016-06-07T14:31:21+0000
/project/mod-wsgi-httpd/, mod-wsgi-httpd, 2.4.46.1, Installer for Apache httpd server., 2020-10-31T09:33:55+0000
/project/log-everywhere/, log-everywhere, 0.0.1, Logging package to enable writing all program information with corresponding datetime to multiple, DIFFERENT files safely when running multiple threads (multi-threading)., 2021-01-14T08:20:05+0000
/project/dongbei-lang/, dongbei-lang, 0.0.6, Programming language based on Dongbei dialect, 2020-02-29T23:00:39+0000
/project/redexpect/, redexpect, 2.0.3.post3, An SSH automation library using expect., 2019-11-23T16:57:58+0000
/project/npm-accel/, npm-accel, 2.0.1, Accelerator for npm, the Node.js package manager, 2020-09-17T12:35:34+0000
/project/serviceping/, serviceping, 20.3.174593, A command line utility that provides a ping like interface for checking tcp/ssl ports and services, 2020-03-13T15:24:26+0000
/project/calmjs-sassy/, calmjs.sassy, 1.0.2, Package for extending the Calmjs framework to support the usage of sass in a manner that crosses Python package boundaries by exposing an import system that mimics the package namespaces available within a given Python environment., 2020-04-23T10:14:52+0000
/project/name-of-thrones/, name-of-thrones, 0.2.7, Command line tool to generate words that sound like characters from Game of Thrones. Good for naming projects, servers and stray cats., 2016-03-04T21:28:55+0000
/project/coho/, coho, 0.4, SMILES parser, 2019-01-19T03:34:02+0000
/project/argopt/, argopt, 0.7.0, doc to argparse driven by docopt, 2021-03-01T16:51:30+0000
/project/ooniprobe/, ooniprobe, 2.3.0, Network measurement tool foridentifying traffic manipulation and blocking., 2018-02-14T09:14:22+0000
/project/autotorrent/, autotorrent, 1.7.1, AutoTorrent allows easy cross-seeding, 2019-12-30T20:59:14+0000
/project/za-id-number/, za-id-number, 0.0.3, Library South African ID number validation and easy data extraction., 2021-01-20T17:25:10+0000
/project/py-rbac/, py-rbac, 20.12.3, Python implementation of the NIST model for role based access control (RBAC)., 2020-12-21T02:31:07+0000
/project/darfortie/, darfortie, 1.0.2, A utility that extends and simplifies using dar (Disk ARchive) for doing routine incremental backups., 2020-02-01T05:11:55+0000
/project/fbsd-gpio/, fbsd_gpio, 0.5.0, cffi-based Python bindings for FreeBSD GPIO, 2016-04-02T22:34:36+0000
/project/qutebrowser/, qutebrowser, 2.2.0, A keyboard-driven, vim-like browser based on PyQt5., 2021-04-13T10:07:16+0000
/project/llfuse/, llfuse, 1.4.1, Python bindings for the low-level FUSE API, 2021-01-31T20:50:00+0000
/project/kivymd-extensions-sweetalert/, kivymd-extensions.sweetalert, 0.1.5, Beautiful, responsive, customizable and accessible popup replacement, 2020-11-23T08:34:34+0000
/project/conff/, conff, 0.5.0, Simple config parser with evaluator library., 2018-06-05T05:37:18+0000
/project/polyarchiv/, polyarchiv, 0.14.3, Multiple-source backup tool: backup files|MySQL|LDAP|PostgresSQL to git|rsync|tar archives, 2017-04-23T12:16:47+0000
/project/mkbak-iterfzf/, mkbak-iterfzf, 0.7.0.25.1, Pythonic interface to fzf, 2021-02-09T20:43:21+0000
/project/kivymd-extensions/, kivymd-extensions, 1.0.0, Additional packages for KivyMD library, 2020-11-01T08:53:17+0000
/project/bakercm/, bakercm, 0.4.4, Baker is a decentralized configuration management based on files, 2018-11-12T21:49:18+0000
/project/alom-exporter/, alom-exporter, 0.0.6, Prometheus exporter for Sun ALOM statistics, 2020-10-03T22:37:43+0000
/project/stack-watcher/, stack-watcher, 0.3.4, Be the first to answer questions on Stack Exchange web sites with this library
and command line tool to notify you as soon as relevant questions are posted., 2014-12-23T19:21:23+0000
/project/rvo/, rvo, 23.0.6, Managing text data from the commandline, 2017-02-25T09:13:15+0000
/project/papa/, papa, 1.0.6, Simple socket and process kernel, 2016-01-20T22:53:19+0000
/project/zvbi/, Zvbi, 0.1.1, Interface to the Zapping VBI decoder library, 2020-05-30T07:28:03+0000
/project/lightweight/, lightweight, 1.0.0.dev52, Code over configuration static site generator., 2020-06-29T15:06:45+0000
/project/clearsilver/, clearsilver, 0.10.1, High performance HTML Template System, 2005-10-20T20:04:39+0000
/project/txrecaptcha/, txrecaptcha, 0.0.6, Twisted reCAPTCHA client, 2015-03-25T10:19:10+0000
/project/passme/, passme, 1.2.0, Password management with command line, 2020-09-16T16:38:45+0000
/project/gpxconverter/, gpxconverter, 0.9.4, gpx to csv converter. it supports waypoint elements except extensions. Values in extensions will be ignored., 2018-01-19T06:34:42+0000
/project/scrap2rst/, scrap2rst, 0.3.0, Converting scrapbox syntax into reStructuredText, 2019-09-26T00:21:34+0000
/project/xntool/, xntool, 0.8.2, funny tools, 2017-02-15T02:06:09+0000
/project/sysv-ipc/, sysv-ipc, 1.1.0, System V IPC primitives (semaphores, shared memory and message queues) for Python, 2021-01-17T19:07:39+0000
/project/setuplib/, setuplib, 0.1.14, Support library functions for extensions and entry points of setuptools / distutils., 2019-12-13T09:54:07+0000
/project/xattr-compat/, xattr-compat, 1.0.0, Multi-platform extended attributes support, 2021-03-03T21:20:29+0000
/project/bsdploy/, bsdploy, 2.3.0, A tool to remotely provision, configure and maintain FreeBSD jails, 2017-11-13T10:09:00+0000
/project/pyssh-ctypes/, pyssh-ctypes, 0.3, Python bindings for libssh on top of ctypes, 2014-01-20T20:26:45+0000
/project/bucky/, bucky, 2.3.0, StatsD and CollectD adapter for Graphite, 2015-02-19T18:41:22+0000
/project/natto-py-fork/, natto-py-fork, 0.9.0, A Tasty Python Binding with MeCab(FFI-based, no SWIG or compiler necessary), 2019-03-07T15:10:19+0000
/project/autopalette/, autopalette, 0.1.0-2, Terminal palettes and themes, without tears., 2018-06-05T09:28:53+0000
/project/py-capsicum-cffi/, py-capsicum-cffi, 3, Python interface to Capsicum, 2020-04-06T03:06:43+0000
/project/dicksonui/, DicksonUI, 2.4.5, Lightweight And Full Featured Browser Based UI / GUI (Graphical User Interface Library), 2020-10-16T13:10:48+0000
/project/getopt2/, getopt2, 0.0.3, Pythonic Unix C-style parser for command line options in few LOC, 2019-05-03T19:54:30+0000
/project/pyinstaller/, pyinstaller, 4.3, PyInstaller bundles a Python application and all its dependencies into a single package., 2021-04-17T04:46:48+0000
/project/yywtestpackage/, yywtestpackage, 0.1.4, yywtestpackage just test package, 2020-09-22T16:23:42+0000
/project/libyate/, libyate, 1.0, Python library for developing Yate external applications, 2015-06-15T01:38:02+0000
/project/service-identity/, service_identity, 18.1.0, Service identity verification for pyOpenSSL & cryptography., 2018-12-05T12:50:40+0000
/project/pyngrok/, pyngrok, 5.0.5, A Python wrapper for ngrok., 2021-03-26T01:04:59+0000
/project/poorwsgi/, PoorWSGI, 2.3.4, Poor WSGI connector for Python, 2021-03-12T09:15:09+0000
/project/calmjs/, calmjs, 3.4.1, A Python framework for building toolchains and utilities for working with the Node.js ecosystem from within a Python environment., 2019-05-23T06:39:53+0000
/project/octadist/, octadist, 3.0.0, OctaDist: A tool for calculating distortion parameters in molecule., 2021-03-08T22:52:18+0000
/project/bbarchivist/, bbarchivist, 4.0.0, BlackBerry OS tools, in Pythons, 2019-09-02T14:02:06+0000
/project/pretty-bad-protocol/, pretty-bad-protocol, 3.1.1, A Python wrapper for GnuPG, 2018-08-01T21:07:12+0000
/project/select-backport/, select_backport, 0.2, Backport of the new select module with epoll and kqueue interface, 2010-11-28T00:39:53+0000
/project/uncrumpled-kivy/, uncrumpled_kivy, 1.9.2.dev0, A software library for rapid development of hardware-accelerated multitouch applications., 2017-04-15T08:41:16+0000
/project/package-index/, package-index, 1.0.0rc0, Dataclasses API for PyPI and other warehouses., 2019-09-19T16:28:12+0000
/project/watchdog-lite/, watchdog-lite, 0.0.1, Filesystem events monitoring, 2017-02-10T18:50:17+0000
