/project/jinjamodificado/, jinjamodificado, 2.10, Jinja Modificado engine written in pure python., 2018-03-30T06:50:53+0000
/project/chameleon-genshi/, chameleon.genshi, 1.0b4, Genshi template engine based on Chameleon, 2009-03-05T17:47:29+0000
/project/doctor-leipzig/, doctor-leipzig, 2.0, Interlinear (Leipzig Rules) glossing for Markdown, 2020-12-25T20:29:02+0000
/project/mit-18-06-linalg-notes/, mit-18.06-linalg-notes, 2020.9.21.0, MIT 18.06 线性代数笔记, 2020-09-21T04:15:56+0000
/project/htmlbuilder/, htmlBuilder, 1.0.0, A beautiful html builder library., 2021-03-02T06:13:45+0000
/project/jinja-atoms/, jinja-atoms, 0.1, Atomic inclusion blocks extension for Jinja2 template engine, 2013-04-09T11:16:54+0000
/project/yatom/, yatom, 0.0.4, Beautiful HTML/XHTML/XML using YAML, 2019-03-29T23:37:54+0000
/project/fugue-generator/, Fugue-generator, 0.9a1, , 2020-04-24T16:41:07+0000
/project/geoformalchemy2/, GeoFormAlchemy2, 2.0dev3, GeoFormAlchemy - a extension for FormAlchemy that adds support for spatial databases, 2015-01-13T17:02:02+0000
/project/trender/, trender, 1.0.8, Template Render Engine written in pure Python, 2017-01-11T15:57:38+0000
/project/creoleparser/, Creoleparser, 0.7.5, Parser for the Creole common wiki markup language, 2019-06-10T21:29:24+0000
/project/linkie/, linkie, 1.4.1, Linkie looks through files for broken links using Python 3., 2020-06-08T00:21:53+0000
/project/md-mermaid/, md-mermaid, 0.1.1, Python-Markdown extension to add support for mermaid graph inside markdown file., 2020-09-03T15:51:24+0000
/project/typographeur/, typographeur, 0.5.0, Faire respecter les règles typographiques françaises en HTML., 2020-06-26T19:40:42+0000
/project/trafilatura/, trafilatura, 0.8.2, Web scraping library and command-line tool for text discovery and retrieval. Downloads web pages, scrapes main text and comments while preserving some structure, and converts to TXT, CSV, JSON and XML, 2021-04-21T15:35:14+0000
/project/markout-html/, markout-html, 0.1.7, A small Python package to extract content from web pages., 2020-03-19T16:44:45+0000
/project/whiff/, whiff, 1.1, WHIFF: WSGI HTTP Integrated Filesystem Frames, 2013-07-09T21:19:15+0000
/project/ford/, FORD, 6.0.0, FORD, standing for FORtran Documenter, is an automatic documentation generator for modern Fortran programs., 2018-06-30T12:39:23+0000
/project/tdi/, tdi, 0.9.9.9, Template Data Interface (TDI), 2015-12-31T18:09:53+0000
/project/justext/, jusText, 2.2.0, Heuristic based boilerplate removal tool, 2016-03-06T18:01:09+0000
/project/mdmail/, mdmail, 0.1.3, Send email written in Markdown, 2017-11-20T12:47:33+0000
/project/ll-nightshade/, ll-nightshade, 0.14.1, Serve the output of Oracle functions/procedures with CherryPy, 2009-03-09T17:35:13+0000
/project/mau/, mau, 1.3.0, A lightweight markup language, 2021-03-11T10:59:40+0000
/project/markyp-bootstrap4/, markyp-bootstrap4, 0.1910.0, Bootstrap4 components built with markyp-html, 2019-10-14T17:59:56+0000
/project/pydocx/, PyDocX, 0.9.10, docx (OOXML) to html converter, 2016-07-29T20:31:35+0000
/project/mkdocs-traefiklabs/, mkdocs-traefiklabs, 100.0.9, A Traefik Labs branded Material Design theme for MkDocs, 2021-02-02T13:28:44+0000
/project/jinja-kit/, jinja_kit, 0.0.16, Collection of utilities and extenstion for jinja2, 2015-12-20T13:14:05+0000
/project/pytorch-doc-zh/, pytorch-doc-zh, 2020.9.28.0, <center>PyTorch 中文教程</center>, 2020-09-28T06:10:33+0000
/project/pithy/, pithy, 0.0.13, Pithy is a collection of utility libraries for Python 3., 2020-05-06T16:09:48+0000
/project/mylit/, mylit, 0.1.2, Literate programming for Python, 2012-03-14T15:37:18+0000
/project/html5lib/, html5lib, 1.1, HTML parser based on the WHATWG HTML specification, 2020-06-22T23:32:36+0000
/project/pyhtmlparser/, pyHTMLParser, 2.1.0, A simple html parser that constructs DOM tree., 2017-01-20T18:54:08+0000
/project/ucb-cs294-112-notes-zh/, ucb-cs294-112-notes-zh, 2020.9.21.0, UCB CS294-112 深度强化学习中文笔记, 2020-09-21T04:51:44+0000
/project/dsai-wiki/, dsai-wiki, 2020.11.1.1, ApacheCN 数据科学和人工智能知识库, 2020-11-01T12:37:05+0000
/project/bettertablesextension/, BetterTablesExtension, 0.0.2, Python-Markdown extension to add additional table options, 2015-03-16T20:35:18+0000
/project/parslepy/, parslepy, 0.3.0, Parsley extraction library using lxml, 2015-03-05T23:19:08+0000
/project/pycloner/, pycloner, 0.1.0, pycloner is a package that tries to help in the process of manually crawling a website., 2017-07-04T13:30:24+0000
/project/xaml/, xaml, 0.6.5, XML Abstract Markup Language, 2019-05-23T22:05:43+0000
/project/python-hcalendar/, python-hcalendar, 0.2.4, python-hcalendar is a basic hCalendar parser, 2019-01-26T17:30:12+0000
/project/jnj/, JNJ, 3.7, Package providing a Jinja2-based template framework., 2020-04-28T11:01:09+0000
/project/templar/, templar, 2.1.2, A static templating engine written in Python, 2016-10-08T03:51:33+0000
/project/parsel/, parsel, 1.6.0, Parsel is a library to extract data from HTML and XML using XPath and CSS selectors, 2020-05-07T20:46:55+0000
/project/fiole/, fiole, 0.4.1, The handy Python web framework., 2014-07-03T07:31:40+0000
/project/rdfutils/, rdfutils, 0.1, Thin wrapper functions to work with an RDF store based on the Redland C library & Python bindings (python-librdf), 2013-04-22T07:56:19+0000
/project/js-module-introduce-myself/, js-module-introduce-myself, 2020.9.21.0, JavaScript module introduce myself, 2020-09-21T04:12:57+0000
/project/wsgiview/, wsgiview, 0.2.1, Use TurboGears template plug-ins anywhere WSGI runs, 2007-01-02T00:03:47+0000
/project/jinja/, Jinja, 1.2, A small but fast and easy to use stand-alone template engine written in pure python., 2007-11-17T21:37:34+0000
/project/emmett-haml/, emmett-haml, 1.0.0, HAML syntax for Emmett templates, 2020-10-18T15:27:01+0000
/project/ocxsect/, ocxsect, 0.1.5, A python markdown extension that allows you to add semantic HTML5 sectioning elements into the generated html., 2019-08-15T15:01:13+0000
/project/tumulus/, Tumulus, 0.2.1, Python HTML Generator for Recyclable Web Elements, 2014-08-11T00:03:28+0000
/project/ds100-textbook-zh/, ds100-textbook-zh, 2020.9.21.0, UCB DS100 数据科学的原理与技巧, 2020-09-21T03:51:52+0000
/project/deepify/, deepify, 0.3.2, Deepify - A set of GPLv3+ libraries to deal with Deepweb connections., 2016-03-17T07:30:45+0000
/project/markdown-jinja/, markdown-jinja, 0.1.0, Python Markdown extension which adds Jinja2 support, 2018-02-05T22:45:32+0000
/project/python-markdown-cloudinary/, python-markdown-cloudinary, 1.0.0, Markdown extension to display and manipulate images on Cloudinary., 2015-08-13T10:12:22+0000
/project/markdown-notebook/, markdown-notebook, 1.0, Python markdown extension to render Jupyter output notation, 2019-02-08T10:27:59+0000
/project/calc4b-zh/, calc4b-zh, 2020.9.21.0, MIT 18.03 面向初学者的微积分, 2020-09-21T03:47:23+0000
/project/tosixinch/, tosixinch, 0.5.0, Browser to e-reader in a few minutes, 2020-08-23T15:10:11+0000
/project/django-inlinecss/, django-inlinecss, 0.3.0, A Django app useful for inlining CSS (primarily for e-mails), 2019-10-24T17:30:55+0000
/project/rst2html5slides/, rst2html5slides, 1.2.2, rst2html5slides generates a slideshow from a reStructuredText file., 2018-11-17T03:39:20+0000
/project/example-aless80/, example-aless80, 1.5.4, Markup language similar to Markdown targeting scientific reports, software documentation, books, blog posts, and slides. DocOnce can generate LaTeX, Sphinx, HTML, IPython notebooks, Markdown, MediaWiki, and other formats, 2021-03-02T08:39:48+0000
/project/statico/, statico, 0.2.1, Static site generator, 2015-09-06T18:05:54+0000
/project/atropine/, atropine, 0.2, HTML Scraper Thing, 2005-11-29T01:29:21+0000
/project/htmllist/, HtmlList, 2.2.2, Extract information from HTML pages that have some kind of a repetitive pattern, 2010-10-16T11:07:38+0000
/project/geeksforgeeks-zh/, geeksforgeeks-zh, 2020.9.21.0, GeeksForGeeks 中文系列教程, 2020-09-21T03:54:31+0000
/project/mdx-gh-links/, mdx_gh_links, 0.2, An extension to Python-Markdown which adds support for shorthand links to GitHub users, repositories, issues and commits., 2018-03-09T17:17:17+0000
/project/khl-team/, khl_team, 1.0, Interface for obtaining data about KHL teams, 2017-02-12T01:10:26+0000
/project/pyqt4-doc-zh/, pyqt4-doc-zh, 2020.9.21.0, PyQt4 中文文档, 2020-09-21T04:38:48+0000
/project/markdown-changelog/, markdown-changelog, 0.0.4, Python-Markdown extension for easy changelog tagging, 2020-09-11T12:25:54+0000
/project/weppy-haml/, weppy-Haml, 0.4, Haml syntax for weppy templates, 2017-07-17T12:52:11+0000
/project/wq-app/, wq.app, 1.2.0, Offline-capable HTML5 web and hybrid apps for citizen science field data collection., 2020-01-22T07:12:47+0000
/project/surely/, surely, 0.1, Pythonic XML Shorthand, 2006-02-26T09:25:16+0000
/project/lightnovel-crawler/, lightnovel-crawler, 2.25.1, An app to download novels from online sources and generate e-books., 2021-04-25T01:53:14+0000
/project/depdf/, depdf, 0.2.2, PDF table & paragraph extractor, 2020-06-12T12:12:38+0000
/project/pydantic-distiller/, pydantic-distiller, 0.1.0b8, HTML/JSON documents parser into Pydantic models, 2020-10-09T14:00:44+0000
/project/tibia-py/, tibia.py, 4.1.1, API that parses website content into python data., 2021-04-19T20:21:02+0000
/project/the-way-to-wealth-freedom-notes/, the-way-to-wealth-freedom-notes, 2020.9.21.0, 通往财富自由之路精细笔记, 2020-09-21T04:47:04+0000
/project/bookertrans/, BookerTrans, 2021.4.9.2, HTML Translator with Google Api for iBooker/ApacheCN, 2021-04-10T03:51:36+0000
/project/md-mermaid-ort/, md-mermaid-ort, 0.1.5, Fork of original md_mermaid by Olivier Ruelle, including some fixes with PR awaiting on the upstream, 2020-10-30T08:09:03+0000
/project/opengrapher/, opengrapher, 0.4, Utility for parsing the OpenGraph tags, 2020-11-13T11:59:45+0000
/project/parsedom/, parsedom, 1.0.0, A fast DOM parser, 2014-03-24T12:55:17+0000
/project/kiroku/, kiroku, 0.8.0, Static blog generator, 2014-01-02T09:23:16+0000
/project/djungle-pegjs/, djungle-pegjs, 0.0.2, PEG.js as Django app., 2012-07-13T20:54:03+0000
/project/pynfact/, pynfact, 1.3.2, Blog-oriented static website generator using Markdown or reStructuredText., 2020-08-05T10:32:27+0000
/project/markdown-mdantic/, markdown-mdantic, 1.3.1, Python-Markdown extension for rendering pydantic BaseModel as table, 2020-08-12T01:48:07+0000
/project/benker/, Benker, 0.5.2, Easily convert your CALS, HTML, Formex4, Office Open XML (docx) tables from one format to another., 2019-11-25T16:39:45+0000
/project/markdown/, Markdown, 3.3.4, Python implementation of Markdown., 2021-02-24T19:57:49+0000
/project/pwt-jinja2js/, pwt.jinja2js, 0.8.1, pwt.jinja2js is an extension to the Jinja2 template engine that compiles
valid Jinja2 templates containing macros to JavaScript. The JavaScript output
can be included via script tags or can be added to the applications JavaScript., 2013-02-28T14:50:07+0000
/project/rtfde/, RTFDE, 0.0.2, A library for extracting HTML content from RTF encapsulated HTML as commonly found in the exchange MSG email format., 2020-12-28T15:15:35+0000
/project/formalchemy/, FormAlchemy, 1.5.6, FormAlchemy greatly speeds development with SQLAlchemy mapped classes (models) in a HTML forms environment., 2020-11-12T10:56:58+0000
/project/mkdocs-material/, mkdocs-material, 7.1.3, A Material Design theme for MkDocs, 2021-04-24T11:10:28+0000
/project/pydhtmlparser/, pyDHTMLParser, 2.2.3, Python HTML/XML parser for easy web scraping., 2020-04-12T21:10:45+0000
/project/flink-doc-zh/, flink-doc-zh, 2021.4.11.0, Flink 中文文档, 2021-04-11T13:42:32+0000
/project/weasyprint/, weasyprint, 52.5, The Awesome Document Factory, 2021-04-17T15:22:49+0000
/project/genshi-forms/, genshi-forms, 1.0, Form generator and validator for Genshi, 2009-05-17T01:16:43+0000
/project/html-tree-diff/, html-tree-diff, 0.1.2, Structure-aware diff for html and xml documents, 2011-02-16T20:37:58+0000
/project/hamill/, hamill, 0.2.4, A lightweight markup language, 2021-03-15T15:06:14+0000
/project/django-rest-framework-mongoengine-hack/, django-rest-framework-mongoengine-hack, 1.0.0, Hack for django-rest-framework-mongoengine to support newer mongoengine and drf, 2015-11-13T10:02:42+0000
/project/dayone-export/, dayone_export, 1.0.0, Export Day One journal using Jinja2 templates, 2018-05-09T03:01:02+0000
/project/js-tinymce/, js.tinymce, 4.5.4, Fanstatic packaging of TinyMCE, 2017-03-07T08:42:57+0000
/project/markdown-include/, markdown-include, 0.6.0, This is an extension to Python-Markdown which provides an "include" function, similar to that found in LaTeX (and also the C pre-processor and Fortran). I originally wrote it for my FORD Fortran auto-documentation generator., 2020-08-20T23:10:25+0000
/project/hatom2atom/, hatom2atom, 0.6, WSGI proxy for transforming hAtom to Atom via hAtom2Atom.xsl., 2008-12-19T03:43:16+0000
/project/os-sys-linux/, os-sys-linux, 0.0.0.dev0, a big lib with many usefull tools and it are not only os and sys tools..., 2020-01-04T10:12:51+0000
/project/lcthw-zh/, lcthw-zh, 2020.9.21.0, 笨办法学C 中文版, 2020-09-21T04:14:26+0000
/project/mdx-custom-span-class/, mdx-custom-span-class, 1.1.3, Markdown extension which allows inserting span elements with custom class, 2019-09-10T12:34:56+0000
/project/pyramid-pystache/, pyramid_pystache, 0.2, Mustache template bindings using Pystache for the Pyramid web framework, 2015-05-24T00:16:24+0000
/project/mackerel/, mackerel, 0.2, Minimal static site generator built with type annotations, 2017-07-11T22:23:54+0000
/project/pisa/, pisa, 3.0.33, PDF generator using HTML and CSS, 2010-06-16T14:09:56+0000
/project/chameleon-html/, chameleon.html, 0.9.3, Dynamic HTML template compiler with XSS language support., 2009-02-13T18:05:01+0000
/project/docupy/, docupy, 0.3.2, A markdown library., 2020-04-10T11:41:43+0000
/project/web-hacking-101-zh/, web-hacking-101-zh, 2020.9.21.0, Web Hacking 101 中文版, 2020-09-21T04:53:01+0000
/project/html5print/, html5print, 0.1.2, HTML5, CSS, Javascript Pretty Print, 2016-09-01T02:20:19+0000
/project/scrapely/, scrapely, 0.14.1, A pure-python HTML screen-scraping library, 2019-11-28T11:03:32+0000
/project/markdown-headdown/, markdown-headdown, 0.1.3, A Python-Markdown extension to downgrade headings, 2018-11-10T01:58:02+0000
/project/metadata-parser/, metadata-parser, 0.10.5, A module to parse metadata out of urls and html documents, 2021-03-26T16:08:00+0000
/project/xgboost-doc-zh/, xgboost-doc-zh, 2020.9.21.0, <center>XGBoost 中文文档</center>, 2020-09-21T04:53:36+0000
/project/logya/, logya, 4.7.2, Logya: easy to use and flexible static Web site generator., 2020-11-18T20:30:09+0000
/project/django-rest-framework-mongoengine/, django-rest-framework-mongoengine, 3.4.1, MongoEngine support for Django Rest Framework., 2020-01-02T13:56:12+0000
/project/dexy-filter-examples/, dexy_filter_examples, 0.0.4, Filter example templates., 2014-01-10T03:47:19+0000
/project/chemdataextractor/, ChemDataExtractor, 1.3.0, A toolkit for extracting chemical information from the scientific literature., 2017-02-03T00:12:04+0000
/project/djungle-hyphenator/, djungle-hyphenator, 0.0.5, Hyphenator.js as Django app., 2013-03-30T16:03:13+0000
/project/wq-db/, wq.db, 1.2.1, Django design patterns and REST API for citizen science field data collection., 2020-09-02T05:10:10+0000
/project/farbox-misaka/, farbox-misaka, 0.0.2, A FarBox flavored Markdown parser (by Misaka Markdown parser)., 2021-02-01T01:49:47+0000
/project/spritify/, spritify, 0.4.2, The spritify is a tool for transform directory of images in the stylesheet and image file., 2015-03-31T03:39:12+0000
/project/elasticsearch-doc-zh/, elasticsearch-doc-zh, 2020.9.21.0, Elasticsearch 5.4 中文文档, 2020-09-21T03:26:44+0000
/project/textminer/, textminer, 1.3.1, Extracts content from html using rules., 2017-12-26T08:01:49+0000
/project/pymdown-typehint/, pymdown-typehint, 0.2.0, A Python-Markdown extension for styling variable types in-line, 2020-05-11T18:10:06+0000
/project/pytidyhtml5/, pytidyhtml5, 2021.1.11, HTML clean-up and repair: Statically linked Python interface for tidy-html5., 2021-01-11T23:12:40+0000
/project/ruby2shoes/, ruby2shoes, 1.09, low-resource writer's software for screenplays and fiction, 2007-10-14T18:02:16+0000
/project/pdfmate/, pdfmate, 0.4.9, Pyppeteer-based async python wrapper to convert html to pdf, 2020-12-06T12:56:36+0000
/project/pdfkit/, pdfkit, 0.6.1, Wkhtmltopdf python wrapper to convert html to pdf using the webkit rendering engine and qt, 2017-01-09T15:44:16+0000
/project/xml2data/, xml2data, 0.1.0, a library for converting xml into native data, 2013-03-02T15:57:22+0000
/project/pithytools/, pithytools, 0.0.1, Pithytools is a collection of command line utilities., 2020-05-06T16:10:08+0000
/project/markdown-bokeh/, markdown-bokeh, 0.1.1, This is an extension to Python-Markdown which provides the ability to include plots from bokeh., 2018-01-05T20:15:20+0000
/project/apachecn-ds-zh/, apachecn-ds-zh, 2020.10.30.0, ApacheCN 数据科学和机器学习译文集, 2020-10-30T05:19:34+0000
/project/mdx-semanticdata/, mdx_semanticdata, 1.1, Python-Markdown extension to add support for semantic data (RDFa)., 2012-11-05T00:35:39+0000
/project/uiuc-cs241-notes-zh/, uiuc-cs241-notes-zh, 2020.9.21.0, UIUC CS241 系统编程中文讲义, 2020-09-21T04:52:29+0000
/project/xmlbuilder/, xmlbuilder, 1.0, pythonic way to create xml/(x)html files. Updated version with fixes, unicode support and cleaned API., 2011-12-14T00:50:43+0000
/project/richxerox/, richxerox, 1.0.1, copy/paste for Mac OS X for rich text (HTML/RTF) rather than plain text, 2017-11-16T23:13:35+0000
/project/choubun/, choubun, 1.3.0, A library for generating HTML from Python using context managers, 2020-06-23T20:18:44+0000
/project/dragoncreole/, DragonCreole, 0.2.5.1, Optimized parser for creole-like markup language, 2017-05-26T21:17:48+0000
/project/textpipe-pattern/, textpipe-pattern, 3.6.1, Web mining module for Python., 2019-03-27T12:16:53+0000
/project/lmpythw-zh/, lmpythw-zh, 2020.9.21.0, 笨办法学 Python · 续 中文版, 2020-09-21T04:15:24+0000
/project/samdown/, samdown, 0.2.0, A markdown library, 2017-03-12T21:33:45+0000
/project/pluralize/, pluralize, 0.1.6, i18n + pluralization library with multi-plural form support and thread safe for web, 2020-09-11T06:23:58+0000
/project/stuphos/, stuphos, 1.0.15, Containerization middleware., 2020-11-05T13:18:05+0000
/project/htmlcssinclude/, HtmlCssInclude, 0.1.2, HtmlCssInclude convert css to inline style for mobile, 2011-03-30T07:53:07+0000
/project/sumy/, sumy, 0.8.1, Module for automatic summarization of text documents and HTML pages., 2019-05-19T14:38:29+0000
/project/manga-py-providers/, manga-py.providers, 2.0a1, , 2019-11-24T11:59:46+0000
/project/antimarkdown/, antimarkdown, 1.0.2, HTML to Markdown converter., 2018-06-01T19:59:18+0000
/project/django-richtexteditor/, django-richtexteditor, 0.0.1.dev3, Django Rich Text Editor with many flavors, 2020-07-22T16:25:32+0000
/project/beampy-slideshow/, beampy-slideshow, 0.5.5.post1, A python tool to create simple HTML5 presentation slideshow, 2019-07-08T07:16:09+0000
/project/djungle-less/, djungle-less, 0.0.3, LESS for Django, 2012-07-13T21:19:37+0000
/project/omero-forms/, omero-forms, 1.1.0, OMERO forms app for enhanced metadata input and provenance, 2020-05-07T06:46:59+0000
/project/htmlmin/, htmlmin, 0.1.12, An HTML Minifier, 2017-12-29T16:41:36+0000
/project/css-parser/, css-parser, 1.0.6, A CSS Cascading Style Sheets library for Python, 2020-10-28T03:31:19+0000
/project/mkdocs-swan/, mkdocs-swan, 0.1.0, SWAN theme for MkDocs, 2020-08-01T15:50:56+0000
/project/mdx-bleach/, mdx_bleach, 0.1.4, Python-Markdown extension to sanitize the output of untrusted Markdown documents., 2018-05-21T02:59:09+0000
/project/online-resume/, online-resume, 2020.9.21.0, Online Resume, 2020-09-21T04:34:08+0000
/project/mdx-footnotes2/, mdx-footnotes2, 0.3.0, The official Python markdown "footnotes" extension, with additional options., 2021-04-09T07:55:12+0000
/project/sitekicker/, sitekicker, 1.0.6, Another static site generator, 2020-05-03T07:17:28+0000
/project/pymdown-toc-ext/, pymdown-toc-ext, 1.3.1, An extension for Python-Markdown which extends the built-in toc extension with additional capabilities to customize the generated table of contents., 2021-03-17T18:37:36+0000
/project/holly/, holly, 0.3.0, A blog-engine plugin for Ivy., 2020-12-30T21:08:16+0000
/project/dominate/, dominate, 2.6.0, Dominate is a Python library for creating and manipulating HTML documents using an elegant DOM API., 2020-10-21T07:01:43+0000
/project/html5witch/, html5witch, 0.2.1, html5witch offers Pythonic HTML5 generation based on xmlwitch, 2011-01-12T18:41:48+0000
/project/embeddify/, embeddify, 0.3.1, converts URLs to embed codes, 2017-08-28T10:55:49+0000
/project/citylink-utils/, citylink-utils, 0.8, Simple utility package to handle CityLink dispatches for commercial customers, 2014-07-11T20:49:13+0000
/project/mdx-smartypants/, mdx_smartypants, 1.5.1, Python-Markdown extension using smartypants to emit typographically nicer ("curly") quotes, proper ("em" and "en") dashes, etc., 2013-11-18T13:57:09+0000
/project/xlsconv/, xlsconv, 1.2.0, Tool to convert ODK-style XLSForms into Django models and HTML templates for use with wq (https://wq.io/), 2020-09-02T07:36:37+0000
/project/python-creole-atlassian/, python-creole-atlassian, 1.4.92, python-creole is an open-source (GPL) markup converter in pure Python for: creole2html, html2creole, html2ReSt, html2textile, 2020-11-20T15:03:15+0000
/project/renoir-haml/, renoir-haml, 1.0.0, HAML syntax for Renoir templates, 2020-03-15T22:31:38+0000
/project/apachecn-cs-zh/, apachecn-cs-zh, 2021.1.7.0, ApacheCN 计算机科学译文集, 2021-01-07T15:47:23+0000
/project/manga-py-utils/, manga-py.utils, 2.0, , 2020-05-02T23:00:37+0000
/project/htmlpyever/, htmlpyever, 0.1.0.post3, Python bindings to html5ever, 2017-03-04T01:17:39+0000
/project/xpath-py/, xpath-py, 0.1.2, Python library for generating XPath expressions, 2017-09-09T22:16:01+0000
/project/piglet-templates/, piglet-templates, 1.1.0, Fast, robust HTML templating engine, 2020-12-08T15:15:58+0000
/project/cachebust/, cachebust, 1.1.0, Provide a server-side means to ensure that clients always fetch assets when they are updated, 2015-12-22T19:15:21+0000
/project/xhtml2pdf/, xhtml2pdf, 0.2.5, PDF generator using HTML and CSS, 2020-10-08T18:57:39+0000
/project/mezzanine-wymeditor/, mezzanine-wymeditor, 0.3, WYMeditor RichText widget for Mezzanine, 2014-08-05T21:21:11+0000
/project/guru99-zh/, guru99-zh, 2020.9.21.0, Guru99 中文系列教程, 2020-09-21T04:00:19+0000
/project/airflow-doc-zh/, airflow-doc-zh, 2020.9.21.0, Airflow 中文文档, 2020-09-21T02:36:45+0000
/project/voldemort/, voldemort, 0.8.1, Voldemort is a simple static site generator                     using Jinja2 and Markdown templates., 2014-02-06T07:23:47+0000
/project/djungle-modernizer/, djungle-modernizer, 0.0.0, Modernizr and HTML5 Shiv as Django app, 2012-03-14T20:50:48+0000
/project/markdown-figcap/, markdown-figcap, 0.1.1, Extension for Python-Markdown to handle <figure> and <figcaption>., 2019-03-09T04:24:32+0000
/project/jobscraper/, jobscraper, 0.2, Grab all the matching jobs from job portals, 2016-01-14T07:15:23+0000
/project/django-genshi/, django-genshi, 1.1.3, Django integration for Genshi, 2009-04-18T22:50:46+0000
/project/geoformalchemy/, GeoFormAlchemy, 0.4, GeoFormAlchemy - a extension for FormAlchemy that adds support for spatial databases, 2011-12-02T21:25:59+0000
/project/ark/, ark, 3.0.1, A static website generator., 2016-09-06T09:17:28+0000
/project/markupsafe/, MarkupSafe, 1.1.1, Safely add untrusted strings to HTML/XML markup., 2019-02-24T01:04:50+0000
/project/mdxflavours/, mdxflavours, 1.0, Markdown extensions for basic syntax flavoring., 2012-01-10T13:52:00+0000
/project/apifier/, apifier, 2.1.0, A web parser for tabular and/or paginated data, 2017-04-12T10:21:29+0000
/project/shutdown-if-idle/, shutdown_if_idle, 0.0.1, Shutdown machine if considered idle, 2014-03-25T17:25:40+0000
/project/html5prescan/, html5prescan, 0.2.0, Prescan a byte string and return WHATWG and Python encoding names., 2020-08-23T14:58:40+0000
/project/jinja2-maps/, jinja2_maps, 0.2.0, Maps filters for Jinja2, 2016-03-23T15:17:55+0000
/project/html3/, html3, 1.18, simple, elegant HTML, XHTML and XML generation for python3 (based on html), 2020-03-30T15:25:10+0000
/project/markdown-customblocks/, markdown-customblocks, 1.1.1, Python Markdown extension to add custom parametrizable and nestable blocks, 2020-08-09T07:43:29+0000
/project/ivy/, ivy, 5.1.0, A static website generator for people who enjoy the simpler things in life., 2021-01-20T14:32:04+0000
/project/apachedex/, APacheDEX, 1.8, Compute APDEX from Apache-style logs., 2021-01-21T05:51:01+0000
/project/komar/, KoMar, 0.5, KoMar is simple wiki-markup heavily based on Creole, 2011-05-30T21:20:45+0000
/project/djungle-favicons/, djungle-favicons, 0.0.0, Favicon auto-generation for Django, 2012-03-14T21:00:46+0000
/project/halweb/, HalWeb, 0.6.0, Halicea Web Framework(HalWeb) is an Appengine MVC web framework for real easy, understandable and rapid development, 2012-01-06T03:12:06+0000
/project/html-auto/, HTML-Auto, 0.0.4, Just another HTML tag generator (for Python), 2020-01-15T16:18:22+0000
/project/pytest-reporter-html1/, pytest-reporter-html1, 0.8.1, A basic HTML report template for Pytest, 2020-11-02T19:32:55+0000
/project/python-utilities-jsm/, python-utilities-jsm, 1.0.2, Myriad python utilities., 2021-04-14T03:11:04+0000
/project/mf2util/, mf2util, 0.5.1, Python Microformats2 utilities, a companion to mf2py, 2018-11-05T05:29:08+0000
