/project/flake8-local-import/, flake8-local-import, 1.0.5, Python 3 check local import for flake8, 2020-08-16T14:36:39+0000
/project/wps-light/, wps-light, 0.15.2, The strictest and most opinionated python linter ever (lighter fork)., 2021-03-13T13:43:53+0000
/project/flake2lint/, flake2lint, 0.4.0, Tool and pre-commit hook to augment Flake8 noqa comments with PyLint comments., 2021-03-03T23:36:14+0000
/project/allennlp-server/, allennlp-server, 1.0.0, Simple demo server for AllenNLP models and training config builder., 2021-04-06T17:55:23+0000
/project/flake8-csv/, flake8-csv, 0.2.0, CSV reporting formatter plugin for Flake8, 2018-06-09T21:33:08+0000
/project/qtemplate/, qtemplate, 0.0.1, Flexible and extensible templating CLI, 2020-12-26T19:16:17+0000
/project/flake8-future-import/, flake8-future-import, 0.4.6, __future__ import checker, plugin for flake8, 2019-08-04T13:09:14+0000
/project/flake8-import-order-grok/, flake8-import-order-grok, 0.3.3, Grok Learning's flake8-import-order plugin., 2019-12-06T05:16:06+0000
/project/restd/, restd, 0.0.5, Flexible and extensible REST, 2020-05-11T01:35:42+0000
/project/flake8-sfs/, flake8-sfs, 0.0.3, Python String Formatting Style (SFS) plugin for flake8, 2020-01-22T11:36:22+0000
/project/flake8-multiline-conditionals-comprehensions/, flake8-multiline-conditionals-comprehensions, 1.1, A flake8 plugin to make sure complex conditional expressions and comprehension expressions are split over several lines., 2020-06-24T06:10:28+0000
/project/isortd/, isortd, 0.1.4, isort daemon. Http api to isort, 2021-02-03T18:42:29+0000
/project/flake8-annotations-coverage/, flake8-annotations-coverage, 0.0.5, A flake8 extension that checks for type annotations coverage, 2021-01-14T14:15:34+0000
/project/dh2flake8/, dh2flake8, 3.8.4, the modular source code checker: pep8 pyflakes and co, 2020-07-14T09:57:36+0000
/project/flake8-dashboard/, flake8-dashboard, 0.1.4, Generate different reports of flake8 violations, 2020-09-04T22:51:08+0000
/project/flake8-codeclimate/, flake8-codeclimate, 0.3.0, Code Climate reporting formatter plugin for Flake8, 2019-01-15T21:44:43+0000
/project/flake8/, flake8, 3.9.1, the modular source code checker: pep8 pyflakes and co, 2021-04-16T03:54:10+0000
/project/flake8-patch/, flake8-patch, 0.1.0, A flake8 plugin checking for mocking issues., 2020-10-03T02:11:53+0000
/project/flake9/, flake9, 3.8.3.post2, the modular source code checker: pep8 pyflakes and co, 2020-06-19T08:19:09+0000
/project/flake9-isort/, flake9-isort, 4.0.2, flake8 plugin that integrates isort ., 2020-10-24T16:45:40+0000
/project/flake8-no-u-prefixed-strings/, flake8-no-u-prefixed-strings, 0.2, Detects and warns about invalid escape sequences., 2018-09-28T06:44:54+0000
/project/flake8-import-order-jwodder/, flake8-import-order-jwodder, 0.1.0, Yet another import order style, 2020-03-16T14:45:16+0000
/project/flake8-helper/, flake8-helper, 0.1.1, A helper library for Flake8 plugins., 2021-02-11T16:25:58+0000
/project/qzig/, qzig, 0.0.4, A ZigBee convertor for Seluxit IoT platform, 2017-11-09T09:18:41+0000
/project/flake8-datetimez/, flake8-datetimez, 20.10.0, A plugin for flake8 to ban the usage of unsafe naive datetime class., 2020-10-20T05:36:11+0000
/project/flake8-formatter-junit-xml/, flake8-formatter-junit-xml, 0.0.6, JUnit XML Formatter for flake8, 2018-04-11T05:44:26+0000
/project/flakeheaven/, flakeheaven, 0.10.0a0, Flake8 wrapper to make it nice and configurable, 2021-02-13T04:19:10+0000
/project/flake8-prevent-fails/, flake8-prevent-fails, 0.0.2, , 2018-07-09T07:43:13+0000
/project/flake8-pyi/, flake8-pyi, 20.10.0, A plugin for flake8 to enable linting .pyi files., 2020-10-18T06:18:03+0000
/project/flake8-black/, flake8-black, 0.2.1, flake8 plugin to call black as a code style validator, 2020-07-25T16:07:56+0000
/project/flake8-functions/, flake8-functions, 0.0.6, A flake8 extension that checks functions, 2021-04-23T09:26:09+0000
/project/flake8-continuation/, flake8-continuation, 1.0.5, Flake8 Line Continuation Plugin, 2020-03-17T18:09:51+0000
/project/qlmetrics/, qlmetrics, 0.0.1, Metrics tracker, 2019-10-13T03:27:11+0000
/project/flake8-quotes/, flake8-quotes, 3.2.0, Flake8 lint for quotes., 2020-05-12T23:46:28+0000
/project/flake8-json/, flake8-json, 21.1.0, JSON Formatting Reporter plugin for Flake8, 2021-01-18T22:23:08+0000
/project/flake8-multiline-containers/, flake8-multiline-containers, 0.0.18, Ensure a consistent format for multiline containers., 2021-03-25T21:42:17+0000
/project/flake8-meiqia/, flake8-meiqia, 0.2.0, Python style guideline in Meiqia, 2017-12-04T10:23:10+0000
/project/flake8-annotations-complexity/, flake8-annotations-complexity, 0.0.6, A flake8 extension that checks for type annotations complexity, 2021-01-11T16:12:06+0000
/project/flake8-import-single/, flake8-import-single, 0.1.5, Flake8 plugin that requires single line imports, 2018-08-04T13:29:46+0000
/project/flake8-expression-complexity/, flake8-expression-complexity, 0.0.9, A flake8 extension that checks expressions complexity, 2021-01-14T14:36:01+0000
/project/flake8-slots/, flake8-slots, 0.1.4, A Flake8 plugin to require __slots__ to be defined for subclasses of immutable types., 2021-03-18T10:38:09+0000
/project/flake8-confusables/, flake8-confusables, 0.1.0, A flake8 plugin to check for ambiguous identifiers, 2017-11-22T17:57:09+0000
/project/flake8-bandit/, flake8-bandit, 2.1.2, Automated security testing with bandit and flake8., 2019-10-08T03:58:31+0000
/project/flake8-implicit-str-concat/, flake8-implicit-str-concat, 0.2.0, Flake8 plugin to encourage correct string literal concatenation., 2020-11-25T20:56:56+0000
/project/flake8-no-fstring/, flake8-no-fstring, 1.0.3, A flake8 plugin to ban f-strings, 2020-03-20T10:11:45+0000
/project/flake8-typing-import-style/, flake8-typing-import-style, 0.5.0, A flake8 plugin to ensure typing module import convention, 2021-01-11T07:59:59+0000
/project/flake8-filename/, flake8-filename, 1.0.0, A flake8 linter plug-in for validating that certain Python files comply with a user defined pattern., 2018-05-30T16:08:54+0000
/project/pandas-vet/, pandas-vet, 0.2.2, A flake8 plugin to lint pandas in an opinionated way, 2020-02-01T05:12:09+0000
/project/flake8-todo/, flake8-todo, 0.7, TODO notes checker, plugin for flake8, 2016-11-15T16:11:37+0000
/project/flake8-assertive/, flake8-assertive, 1.3.0, Flake8 unittest assert method checker, 2020-10-12T17:23:00+0000
/project/flake8-ownership/, flake8-ownership, 2.0.1, A flake8 checker for assuring that author, copyright, and license are specified in source files., 2019-07-15T15:42:45+0000
/project/flake8-todo-ticket/, flake8-todo-ticket, 0.1.0, Enforce ownership and ticketing of TODO notes., 2019-06-20T09:24:57+0000
/project/flake8-builtins/, flake8-builtins, 1.5.3, Check for python builtins being used as variables or parameters., 2020-05-14T10:45:01+0000
/project/flake8-simplicity/, flake8-simplicity, 0.0.1, Take your Python syntax back to the 90s!, 2020-07-04T02:49:50+0000
/project/flake8-ycm/, flake8-ycm, 0.1.0, A Flake8 plugin that enforces YouCompleteMe and ycmd coding style, 2018-05-30T00:38:13+0000
/project/flake8-numpy-random/, flake8-numpy-random, 0.1.0, Plugin for Flake8 that forbids usage of numpy.random(), 2021-04-11T20:16:07+0000
/project/flake8-dunder-all/, flake8-dunder-all, 0.1.7, A Flake8 plugin and pre-commit hook which checks to ensure modules have defined '__all__'., 2021-03-18T10:18:57+0000
/project/flake8-colors/, flake8-colors, 0.1.9, Error highlight plugin for Flake8., 2020-11-16T09:38:39+0000
/project/flake8-class-attributes-order/, flake8-class-attributes-order, 0.1.2, A flake8 extension that checks classes attributes order, 2021-01-14T15:04:23+0000
/project/flake8-truveris/, flake8_truveris, 0.3.4, Flake8 extension for checking Python code against Truveris's code style guide, 2016-11-08T22:55:23+0000
/project/flakehell/, flakehell, 0.9.0, Flake8 wrapper to make it nice and configurable, 2021-01-11T18:40:29+0000
/project/flake8-sorted-keys/, flake8-sorted-keys, 0.2.0, check keys are sorted in dict literals, 2017-09-27T11:53:16+0000
/project/flake8-import-order-spoqa/, flake8-import-order-spoqa, 1.5.0, Spoqa's import order style for flake8-import-order, 2018-08-30T21:13:41+0000
/project/flake8-bugbear/, flake8-bugbear, 21.4.3, A plugin for flake8 finding likely bugs and design problems in your program. Contains warnings that don't belong in pyflakes and pycodestyle., 2021-04-01T21:21:59+0000
/project/flake8-rst-docparams/, flake8-rst-docparams, 1.0.6, Check for reStructuredText function parameter documentation, 2021-01-11T10:59:30+0000
/project/grenml/, grenml, 0.1.6, Library for creating, parsing, and storing GRENML, 2020-10-20T21:11:21+0000
/project/flake8-import-order-ruler501/, flake8-import-order-ruler501, 0.18.1.2, ruler501's flake8-import-order plugin., 2019-09-23T04:16:15+0000
/project/flake8-spellcheck/, flake8-spellcheck, 0.24.0, Spellcheck variables, comments and docstrings, 2021-03-04T13:24:10+0000
/project/flake8-fancy-header/, flake8-fancy-header, 0.3.0, check file has a fancy header at the top, 2020-03-11T14:59:52+0000
/project/flake8-strftime/, flake8-strftime, 0.3.1, A flake8 plugin which checks for use of platform specific strftime codes., 2021-03-18T10:46:46+0000
/project/hytera-homebrew-bridge/, hytera-homebrew-bridge, 2021.1, Connect Hytera IPSC repeater to MMDVM system such as HBlink, DMRGateway, 2021-01-01T10:37:40+0000
/project/snowday/, snowday, 0.1.5, Tools for turning Snowflake into a Snow Day. ❄️, 2020-10-03T13:48:46+0000
/project/flake8-comprehensions/, flake8-comprehensions, 3.4.0, A flake8 plugin to help you write better list/set/dict comprehensions., 2021-03-18T11:33:43+0000
/project/flake8-tuple-unpack-limit/, flake8-tuple-unpack-limit, 0.0.1, A flake8 extension that checks for tuple unpack length, 2020-04-30T16:06:11+0000
/project/gwm-skywalking/, gwm-skywalking, 0.1.1, Python Agent for Apache SkyWalking Add FastApi RocketMQ Plugins, 2020-12-07T08:28:11+0000
/project/flake8-no-unnecessary-fstrings/, flake8-no-unnecessary-fstrings, 1.0.1, A flake8 plugin to ban f-strings, 2020-09-13T08:49:46+0000
/project/flake8-no-implicit-concat/, flake8-no-implicit-concat, 0.1.4, Flake8 plugin that forbids implicit string literal concatenations, 2020-08-18T20:21:30+0000
/project/flake8-alphabetize/, flake8-alphabetize, 0.0.14, A Python style checker for alphabetizing import and __all__., 2021-04-20T20:12:01+0000
/project/flake8-aaa/, flake8-aaa, 0.11.2, A Flake8 plugin that checks Python tests follow the Arrange-Act-Assert pattern, 2021-04-22T20:54:43+0000
/project/flake8-super/, flake8-super, 0.1.2, Python 3 super() check for flake8, 2020-08-10T15:26:34+0000
/project/flake8-network-timeout/, flake8-network-timeout, 0.2.0, our extension to flake8, 2017-07-02T12:38:42+0000
/project/flake8-github-actions/, flake8-github-actions, 0.1.1, GitHub Actions integration for flake8., 2021-02-25T21:04:31+0000
/project/flake8-tidy-imports/, flake8-tidy-imports, 4.2.1, A flake8 plugin that helps you write tidier imports., 2020-12-19T10:48:01+0000
/project/flake8-logging-format/, flake8-logging-format, 0.6.0, Flake8 extension to validate (lack of) logging format strings, 2019-01-10T17:24:16+0000
/project/flake8-bitbucket/, flake8-bitbucket, 0.1.10, A flake8 plugin for bitbucket insights., 2020-06-26T05:24:19+0000
/project/flake8-debugger/, flake8-debugger, 4.0.0, ipdb/pdb statement checker plugin for flake8, 2020-11-29T14:34:57+0000
/project/flake8-commas/, flake8-commas, 2.0.0, Flake8 lint for trailing commas., 2018-03-19T16:49:29+0000
/project/flake8-os-walk/, flake8-os-walk, 0.4.0, Flake8 plugin which usage of os.walk()., 2020-03-14T18:16:28+0000
/project/flake8-super-call/, flake8-super-call, 1.0.0, flake8 super call checker, 2018-04-13T20:17:35+0000
/project/flake8-executable/, flake8-executable, 2.1.1, A Flake8 plugin for checking executable permissions and shebangs., 2020-12-15T00:47:12+0000
/project/flake8-fixme/, flake8-fixme, 1.1.1, Check for FIXME, TODO and other temporary developer notes. Plugin for flake8., 2019-05-06T19:06:44+0000
/project/django-nonrelated-inlines/, django-nonrelated-inlines, 0.1.1, Django admin inlines for unrelated models, 2020-07-25T08:07:34+0000
/project/qcluster/, QCluster, 0.0.5, An SDK to enable quick clustering of microservices., 2021-01-09T13:59:12+0000
/project/pybooklib/, pybooklib, 1.2, Create, upload, and use Python project templates., 2021-01-19T14:03:45+0000
/project/wemake-python-styleguide/, wemake-python-styleguide, 0.15.2, The strictest and most opinionated python linter ever, 2021-02-27T12:21:12+0000
/project/flake8-expandtab/, flake8-expandtab, 0.3, flake8 for tab junkies, 2018-02-23T18:15:06+0000
/project/flake8-todos/, flake8-todos, 0.1.5, None, 2020-11-16T09:56:00+0000
/project/flake8-type-annotations/, flake8-type-annotations, 0.1.0, Flake8 plugin to enforce consistent type annotation styles, 2018-09-29T09:26:41+0000
/project/flake8-disrespectful-code/, flake8-disrespectful-code, 0.0.1, My example Flake8 extension, 2017-10-05T03:38:42+0000
/project/flake8-linenumber/, flake8-linenumber, 0.1.8, flake8 plugin to limit line number in a module, 2020-02-12T10:05:06+0000
/project/ezflakehell/, ezflakehell, 0.9.2, Flake8 wrapper to make it nice and configurable, 2021-04-20T09:36:10+0000
/project/responsysrest/, responsysrest, 0.1.12, Python client library for the Responsys Interact REST API, 2019-05-01T19:33:19+0000
/project/flake8-import-restrictions/, flake8-import-restrictions, 1.1.1, A flake8 plugin used to disallow certain forms of imports., 2020-08-13T08:43:00+0000
/project/flake8-import-order/, flake8-import-order, 0.18.1, Flake8 and pylama plugin that checks the ordering of import statements., 2019-03-04T08:39:11+0000
/project/flake8-no-pep420/, flake8-no-pep420, 1.0.1, A flake8 plugin to ban PEP-420 implicit namespace packages., 2020-12-22T16:35:03+0000
/project/qconfig/, qconfig, 0.0.1, Open source config management in python, 2021-03-20T16:15:40+0000
/project/flake8-import-graph/, flake8-import-graph, 0.1.3, A flake8 lint to enforce that some modules can't be imported from other modules., 2018-09-14T14:37:28+0000
/project/flake8-pytest-style/, flake8-pytest-style, 1.4.1, A flake8 plugin checking common style issues or inconsistencies with pytest-based tests., 2021-04-01T20:25:30+0000
/project/flake8-imports/, flake8-imports, 0.1.1, isort extension flake8, 2017-04-30T17:43:44+0000
/project/flake8-sphinx-links/, flake8-sphinx-links, 0.2.1, A Flake8 plugin to check docstrings for double backticked strings which should be links to the Python documentation., 2021-03-18T10:45:48+0000
/project/flake8-import-order-fuzeman/, flake8-import-order-fuzeman, 1.7.0, @fuzeman's import order style for flake8-import-order, 2018-01-07T23:38:34+0000
/project/datagif/, datagif, 0.1.1, Make animated gifs out of multiple data plots., 2021-04-22T06:53:26+0000
/project/flake8-cognitive-complexity/, flake8-cognitive-complexity, 0.1.0, An extension for flake8 that validates cognitive functions complexity, 2020-08-01T05:49:18+0000
/project/flake8-encodings/, flake8-encodings, 0.3.4, A Flake8 plugin to identify incorrect use of encodings., 2021-03-30T12:44:12+0000
/project/studosi/, studosi, 0.0.0.dev2, The official Studoši Python toolkit, 2021-04-03T17:58:29+0000
/project/apache-skywalking/, apache-skywalking, 0.6.0, Python Agent for Apache SkyWalking, 2021-03-31T14:04:05+0000
/project/flake8-keyword-arguments/, flake8-keyword-arguments, 0.1.0, A flake8 extension that is looking for function calls and forces to use keyword arguments if there are more than X arguments, 2020-04-08T22:19:58+0000
/project/wikilink/, wikilink, 0.3.0.post1, A multiprocessing web-scraping application to scrape wiki pages and find minimum number of links between two given wiki pages., 2019-03-30T14:24:35+0000
/project/flake8-string-format/, flake8-string-format, 0.3.0, string format checker, plugin for flake8, 2020-02-16T15:27:49+0000
/project/flake8-maya-flags/, flake8-maya-flags, 1.1.0, Flake8 plugin to warn when using short names flags with Maya commands, 2021-01-12T15:29:28+0000
/project/flake8-broken-line/, flake8-broken-line, 0.3.0, Flake8 plugin to forbid backslashes for line breaks, 2020-10-29T09:08:09+0000
/project/flake8-django-on-delete-comment/, flake8-django-on-delete-comment, 0.0.2, A flake8 extension to validate django models ForeignKey fields on on_delete CASCADE comment, 2021-01-14T14:37:43+0000
/project/flake8-pytest-mark/, flake8-pytest-mark, 1.1.0, A flake8 plugin that helps check the presence of a PyTest mark, 2018-12-05T18:44:56+0000
/project/flake8-mypy/, flake8-mypy, 17.8.0, A plugin for flake8 integrating mypy., 2017-08-31T23:16:58+0000
/project/flake8-prettycount/, flake8-prettycount, 0.1.1, Wrapper around flake8 providing a formatted count at the end., 2020-11-26T11:19:24+0000
/project/flake8-isort/, flake8-isort, 4.0.0, flake8 plugin that integrates isort ., 2020-08-11T08:04:21+0000
/project/flake8-file-encoding/, flake8-file-encoding, 0.1.0, A Flake8 plugin to check for files opened without an explicit encoding, 2019-06-16T13:40:53+0000
/project/flake8-import-style/, flake8-import-style, 0.5.0, A flake8 plugin to ensure explicit module imports, 2020-01-13T15:57:15+0000
/project/flake8-lineleak/, flake8-lineleak, 1.0.2, Lineleak is a flake8 plugin that counts the lines containing live code in a script, and 'yells' if a set limit is exceeded. It is meant to help enforce short scripts and modular python programming., 2019-06-14T11:43:57+0000
/project/flake8-author/, flake8-author, 1.2.0, Flake8 __author__ checker, 2020-10-12T17:53:23+0000
/project/flake8-markdown/, flake8-markdown, 0.2.0, Lints Python code blocks in Markdown files using flake8, 2019-06-15T03:30:34+0000
/project/flake8-phabricator-formatter/, flake8-phabricator-formatter, 0.1.1, flake8 formatter for Phabricator's Harbormaster, 2018-10-30T11:32:21+0000
/project/estimium/, estimium, 0.2.0, A collection of ML tools written with professor's chalk, 2020-07-15T23:01:50+0000
/project/flake8-printf-formatting/, flake8-printf-formatting, 1.1.2, flake8 plugin which forbids printf-style string formatting, 2021-02-01T02:14:58+0000
/project/dottree/, dottree, 0.1.3, , 2020-03-02T11:31:43+0000
/project/coax/, coax, 0.1.6, Plug-n-play reinforcement learning with OpenAI Gym and JAX, 2021-02-05T06:02:05+0000
/project/flake8-if-checker/, flake8-if-checker, 0.3.0, Flake8's IF statement complexity linter plugin, 2020-11-09T20:33:18+0000
/project/flake8-mypy-fork/, flake8-mypy-fork, 20.5.1, A plugin for flake8 integrating mypy (fork)., 2020-05-14T09:05:53+0000
/project/flake8-mypy-fork/, flake8-mypy-fork, 20.5.1, A plugin for flake8 integrating mypy (fork)., 2020-05-14T09:05:53+0000
/project/flake8-django-migrations/, flake8-django-migrations, 0.1.1, Flake8 plugin to lint for backwards incompatible database migrations, 2021-04-06T18:50:13+0000
/project/flake8-rewriter/, flake8-rewriter, 1.2.0, Flake8 plugin that rewrites error codes., 2019-02-10T03:05:35+0000
/project/flake8-config-4catalyzer/, flake8-config-4catalyzer, 0.2.1, , 2017-07-26T19:57:23+0000
/project/flake8-vyper/, flake8-vyper, 0.1.10, Plugin for flake8 to support Vyper, 2019-03-22T16:50:00+0000
/project/pep8-naming/, pep8-naming, 0.11.1, Check PEP-8 naming conventions, plugin for flake8, 2020-06-16T23:48:52+0000
/project/flake8-strict/, flake8_strict, 0.2.1, Flake8 plugin that checks Python code against a set of opinionated style rules, 2018-05-30T14:10:05+0000
/project/censys/, censys, 1.1.1, An easy-to-use and lightweight API wrapper for the Censys Search Engine (censys.io)., 2021-02-23T19:08:41+0000
/project/flake8-django/, flake8-django, 1.1.1, Plugin to catch bad style specific to Django Projects, 2020-05-25T16:15:06+0000
/project/good-smell/, good-smell, 0.18, A linter/refactoring tool to make your code smell better!, 2021-03-27T09:14:50+0000
/project/flake8-annotations/, flake8-annotations, 2.6.2, Flake8 Type Annotation Checks, 2021-04-01T13:38:59+0000
/project/flake8-oist-steps/, flake8-oist-steps, 0.3, Check usage STEPS subcellular simulator, 2019-12-02T09:47:27+0000
/project/udar/, udar, 0.1.8, Detailed part-of-speech tagger for (accented) Russian., 2021-04-22T22:55:04+0000
/project/flake8-datetime-utcnow-plugin/, flake8-datetime-utcnow-plugin, 0.1.1, Plugin to check that utcnow() is not used in favour of now(UTC), 2020-09-15T22:19:19+0000
/project/flake8-nb/, flake8-nb, 0.2.7, Flake8 based checking for jupyter notebooks, 2021-04-16T22:41:11+0000
/project/flake8-django-on-delete-comment/, flake8-django-on-delete-comment, 0.0.2, A flake8 extension to validate django models ForeignKey fields on on_delete CASCADE comment, 2021-01-14T14:37:43+0000
/project/flake8-tabs/, flake8-tabs, 2.3.2, Tab (or Spaces) indentation style checker for flake, 2021-04-22T22:41:14+0000
/project/flake8-requirements/, flake8-requirements, 1.4.0, Package requirements checker, plugin for flake8, 2021-03-27T19:25:00+0000
/project/flake8-literal/, flake8-literal, 1.1.1, Flake8 string literal validation, 2020-06-18T02:22:29+0000
/project/flake8-classmethod-staticmethod/, flake8-classmethod-staticmethod, 1.0, flake8 plugin that checks rules regarding the staticmethod and classmethod decorators., 2020-07-17T19:56:01+0000
/project/censys-maltego/, censys-maltego, 2.0.0b1, This package provides an interface into Censys from Maltego., 2021-04-22T14:13:21+0000
/project/flake8-report/, flake8-report, 0.1.0a1, JSON Formatting Reporter plugin for Flake8, 2020-12-18T17:43:00+0000
/project/flake8-raise/, flake8-raise, 0.0.5, A flake8 plugin that finds that finds improvements for raise statements., 2020-01-26T13:53:13+0000
/project/flake8-functions-names/, flake8-functions-names, 0.0.5, An extension for flake8 that validates functions names, decomposition and conformity with annotations., 2021-03-22T14:05:52+0000
/project/flake8-print-clean/, flake8-print-clean, 3.1.4, print statement checker plugin for flake8, 2020-10-06T02:28:51+0000
/project/flake8-super-mario/, flake8-super-mario, 0.0.2, A flake8 plugin with super_mario specific validations, 2019-12-16T13:06:18+0000
/project/flake8-ensure-ascii/, flake8-ensure-ascii, 1.0.0, Flake8 Ensure ASCII encoding plugin., 2021-02-27T12:10:16+0000
/project/flake8-fine-pytest/, flake8-fine-pytest, 1.0.2, A flake8 extension that checks test extra style, 2021-01-14T14:34:59+0000
/project/flake8-simplify/, flake8-simplify, 0.14.0, flake8 plugin which checks for code that can be simpified, 2021-02-20T10:58:47+0000
/project/flake8-scrapy/, flake8-scrapy, 0.0.1, , 2018-10-10T02:15:34+0000
/project/flake8-pep3101/, flake8-pep3101, 1.3.0, Checks for old string formatting., 2019-12-14T23:32:14+0000
/project/flake8-exceptions/, flake8-exceptions, 0.0.1a0, A flake8 plugin to identify commonly unhandled exceptions., 2019-05-21T20:03:25+0000
/project/flake8-rst-docstrings/, flake8-rst-docstrings, 0.2.1, Python docstring reStructuredText (RST) validator, 2021-04-23T17:30:56+0000
/project/flake8-html/, flake8-html, 0.4.1, Generate HTML reports of flake8 violations, 2020-05-14T22:19:52+0000
/project/flake8-typing-collections/, flake8-typing-collections, 1.0.1, A flake8 plugin that checks the use of type alternatives from the typing module over actual run time types, especially from the collections module., 2020-08-23T12:02:51+0000
/project/flake8-pytestrail/, flake8-pytestrail, 0.2.1, Flake8 plugin to check for missing or wrong TestRail test identifiers, 2020-11-28T16:27:32+0000
/project/flake8-print/, flake8-print, 4.0.0, print statement checker plugin for flake8, 2020-11-29T14:56:00+0000
/project/flake8-array-spacing/, flake8-array-spacing, 0.2.0, flake8 plugin to make exceptions for array-like variables, 2020-09-17T12:44:08+0000
/project/deplatformer-webapp/, deplatformer-webapp, 0.1.8, Flask webapp for the deplatformer platform, 2020-11-11T11:28:39+0000
/project/flake8-eradicate/, flake8-eradicate, 1.0.0, Flake8 plugin to find commented out code, 2020-10-12T08:26:38+0000
/project/flake8-block-comment/, flake8-block-comment, 0.0.3, Block comment checker, 2020-01-17T14:44:59+0000
/project/flake8-polyfill/, flake8-polyfill, 1.0.2, Polyfill package for Flake8 plugins, 2017-12-30T13:46:54+0000
/project/flake8-absolute-import/, flake8-absolute-import, 1.0, flake8 plugin to require absolute imports, 2019-09-09T14:48:03+0000
/project/flexi-settings/, flexi-settings, 1.0.1.dev270739073, Manages embedded variables and blending settings, 2021-03-15T16:23:37+0000
/project/flake8-no-types/, flake8-no-types, 1.1.1, A flake8 plugin to ban type hints., 2020-12-19T10:48:31+0000
/project/flake8-tabs/, flake8-tabs, 2.3.2, Tab (or Spaces) indentation style checker for flake, 2021-04-22T22:41:14+0000
/project/flake8-requirements/, flake8-requirements, 1.4.0, Package requirements checker, plugin for flake8, 2021-03-27T19:25:00+0000
/project/flake8-literal/, flake8-literal, 1.1.1, Flake8 string literal validation, 2020-06-18T02:22:29+0000
/project/flake8-classmethod-staticmethod/, flake8-classmethod-staticmethod, 1.0, flake8 plugin that checks rules regarding the staticmethod and classmethod decorators., 2020-07-17T19:56:01+0000
/project/flake8-idom-hooks/, flake8-idom-hooks, 0.4.1, Flake8 plugin to enforce the rules of hooks for IDOM, 2021-04-22T03:33:55+0000
/project/flake8-sql/, flake8-SQL, 0.4.1, Flake8 plugin that checks SQL code against opinionated style rules, 2020-06-27T20:18:47+0000
/project/flake8-checkstyle/, flake8-checkstyle, 0.1.2, Output Checkstyle XML reports of flake8 violations., 2018-05-07T09:15:45+0000
