/project/qat-devices/, qat-devices, 0.1.1, Module qat-devices [715fd9c] - Compiled by Atos, 2021-04-23T20:55:52+0000
/project/archspec/, archspec, 0.1.2, A library to query system architecture, 2020-11-12T14:08:52+0000
/project/entro-py/, entro-py, 0.6.0, , 2019-09-19T07:38:24+0000
/project/tableauhyperapi/, tableauhyperapi, 0.0.12514, Hyper API for Python, 2021-04-07T15:05:23+0000
/project/backplane/, backplane, 0.9.0, a dead-simple backplane for Dockerized applications, 2020-12-22T12:19:26+0000
/project/qbuild/, qbuild, 0.3.7, A build system for Quera technology challenges, 2020-12-28T15:59:28+0000
/project/rubik-box/, rubik-box, 0.0.2, Rubik's cube solver, 2016-07-01T10:23:32+0000
/project/isystem-connect/, isystem.connect, 9.21.9.0, isystem.connect for Python, 2021-04-19T06:19:49+0000
/project/pytis/, pytis, 8.2.8, pytis-toolkit, 2020-06-15T17:12:55+0000
/project/upguard/, upguard, 0.0.21, UpGuard SDK for Python, 2021-03-17T01:41:23+0000
/project/mtsmultitool/, mtsmultitool, 0.2.0, Library and command line tool for working with Multitech products., 2021-02-26T19:42:03+0000
/project/tltools/, TLTools, 2.0.5, Tools for acquiring and processing Ultrasonic NDT data, 2017-04-25T15:23:11+0000
/project/quant-learning/, quant-learning, 2020.10.26.1, QuantLearning, 2020-10-26T08:19:31+0000
/project/maze-rl/, maze-rl, 0.1.3, MazeRL is a development framework for building applied reinforcement learning systems, addressing real-world decision problems. It supports the complete development life cycle of RL applications, ranging from simulation engineering up to agent development, training and deployment., 2021-04-01T21:59:01+0000
/project/pypylon/, pypylon, 1.7.2, The python wrapper for the Basler pylon Camera Software Suite., 2021-03-03T12:57:18+0000
/project/alguns/, alguns, 0.1.3, A crypto library for encrypting text data., 2021-01-08T17:51:39+0000
/project/teca/, teca, 4.0.0, The Toolkit for Extreme Climate Analysis, 2021-01-27T15:44:57+0000
/project/tfpred/, tfpred, 0.1.0, , 2019-11-24T11:41:07+0000
/project/cabfile/, cabfile, 1.0.0, Cabinet file reader for python, 2016-02-01T19:21:25+0000
/project/geojson-modelica-translator/, geojson-modelica-translator, 0.2.2, Package for converting GeoJSON to Modelica models for Urban Scale Analyses., 2021-03-23T23:00:33+0000
/project/dmdj/, dmdj, 0.4.2, Django model generator for JSON metadata, 2016-09-01T20:23:12+0000
/project/torrentdoer/, torrentdoer, 0.3.0, Do your torrenting from DigitalOcean., 2020-11-25T19:19:44+0000
/project/ask-lang/, ask-lang, 1.2.0, Ask is a modern open-source transpiled programming language, designed for building backend services and APIs. Ask reduces the amount of needed boilerplate code for setting up things like database connections and authentication to virtually zero lines., 2021-03-13T06:34:55+0000
/project/amieci/, amieci, 0.0.8, The python API for amie, 2019-03-14T19:02:33+0000
/project/teladduser/, teladduser, 0.1.0, This is a CLI with the aim to add new users from a spreadsheet at a Telegram supergroup., 2020-10-26T20:54:22+0000
/project/silph-models/, silph.models, 0.19.3, Database models for TSR, 2020-09-11T17:51:42+0000
/project/bosdyn-api/, bosdyn-api, 2.3.4, Boston Dynamics API definition of protobuf messages, 2021-04-14T12:02:17+0000
/project/django-termsandconditions/, django-termsandconditions, 2.0.8, Django app that enables users to accept terms and conditions of a site., 2021-01-27T16:44:14+0000
/project/the-conf/, the-conf, 0.0.19, Config build from multiple sources, 2021-04-21T07:53:44+0000
/project/imperva-sdk/, imperva-sdk, 0.2.0, SDK for Imperva SecureSphere Open API, 2019-09-09T20:54:30+0000
/project/simis/, Simis, 0.1.9, A package for communicating with the Ashes wind turbine simulation software in order to run custom simulation code., 2020-09-23T12:48:50+0000
/project/shoobx-mocks3/, shoobx.mocks3, 1.5.0, Shoobx Mock S3 Implementation, 2020-12-01T23:23:29+0000
/project/dagather/, dagather, 0.1.0, directed acyclic gather, 2021-01-19T22:39:10+0000
/project/nonebot-plugin-translator/, nonebot-plugin-translator, 2.0.0a8.post0, Multi language tanslator worked with nonebot2, 2021-01-03T16:35:52+0000
/project/musamusa-romannumbers/, musamusa-romannumbers, 0.0.1, Roman Numbers (XVI <-> 16), 2021-03-27T11:49:03+0000
/project/fruit-cli/, fruit-cli, 0.8.1, Command-line application plus API client for FRμIT cluster management, 2019-06-24T12:03:05+0000
/project/carehare/, carehare, 0.0.10, asyncio RabbitMQ client, 2021-03-04T19:02:08+0000
/project/personal-rfoster-helloworld/, personal.rfoster.helloworld, 5.0.0, Helloworld App to Test Alpine Images, 2021-03-31T15:02:44+0000
/project/qview/, qview, 6.9.3, QView visualization and monitoring, 2021-01-16T16:21:58+0000
/project/django-guid/, django-guid, 3.2.0, Middleware that enables single request-response cycle tracing by injecting a unique ID into project logs, 2020-12-03T21:11:01+0000
/project/cpppo/, cpppo, 4.4.2, Cpppo is a Communication Protocol Python Parser and Originator, 2021-01-21T16:45:19+0000
/project/probable-happiness/, probable-happiness, 0.0.4, A library for music apis, 2019-07-25T14:09:59+0000
/project/livezip/, livezip, 0.1.0, Memory-bound streamable implementation of ZIP64. Aimed at streaming zips full of multimedia assets (videos, images, etc)., 2019-11-28T18:10:48+0000
/project/pyawsutils/, pyawsutils, 0.10.0.17, A collection of utilities for interacting with Amazon Web Services, 2021-02-05T11:53:19+0000
/project/eskodesk/, eskodesk, 0.1.0, Python client for the Eskodesk API, 2020-12-01T01:18:40+0000
/project/hostp2pd/, hostp2pd, 0.1.7, Wi-Fi Direct Session Manager, implementing a host AP daemon in Wi-Fi Direct mode, including P2P WPS enrollment, 2021-02-06T10:52:18+0000
/project/ci-ynh/, ci-ynh, 0.1.0a1, CI for YunoHost to test YunoHost packages ;), 2021-01-08T17:19:21+0000
/project/cpbd/, cpbd, 1.0.7, Calculate the sharpness of an image with the CPBD metric, 2018-02-19T23:00:17+0000
/project/databrickslabs-jupyterlab/, databrickslabs-jupyterlab, 2.2.0, Remote JupyterLab kernel for Databricks, 2021-04-21T11:36:50+0000
/project/pycouchdb/, pycouchdb, 1.14.1, Modern pure python CouchDB Client., 2020-02-20T08:50:17+0000
/project/purplship-usps/, purplship.usps, 2021.3, Purplship - USPS Shipping Extension, 2021-04-18T05:01:25+0000
/project/dnac/, dnac, 1.3.1.7, A wrapper for using Cisco DNA Center's REST API, 2020-04-16T19:34:59+0000
/project/pyinstrument-patch/, pyinstrument-patch, 0.0.2, Patch for fix pyinstrument root_frame exception, 2020-07-04T03:37:52+0000
/project/opentimelineio/, OpenTimelineIO, 0.13.0, Editorial interchange format and API, 2020-08-24T18:21:56+0000
/project/django-wools/, django-wools, 0.1.4, Django tools from WITH, 2020-06-04T11:59:28+0000
/project/mkl-dpcpp/, mkl-dpcpp, 2021.2.0, Intel® oneAPI Math Kernel Library, 2021-03-26T20:33:06+0000
/project/mpymodcore-watering/, mpymodcore-watering, 0.0.9, mpymodcore, 2020-12-12T05:32:22+0000
/project/arus/, arus, 1.1.22, Activity Recognition with Ubiquitous Sensing, 2021-02-04T00:09:46+0000
/project/njinn-worker/, njinn-worker, 0.12.4, Njinn Worker, 2021-04-21T11:42:48+0000
/project/flask-s3-gzip/, Flask-S3-gzip, 0.1.8, Seamlessly serve the static files of your Flask app from Amazon S3 (forked from original flask-s3), 2014-11-16T07:45:11+0000
/project/idp-solver/, idp-solver, 0.7.3, IDP-Z3 is a collection of software components implementing the Knowledge Base paradigm using the IDP language and a Z3 SMT solver., 2021-03-04T09:53:40+0000
/project/impi-rt/, impi-rt, 2021.2.0, Intel® MPI Library, 2021-03-26T20:17:14+0000
/project/bergen/, bergen, 0.3.103, A python client for the Arnheim Framework, 2021-04-23T14:16:11+0000
/project/opencl-rt/, opencl-rt, 2021.2.0, Intel® oneAPI OpenCL* Runtime, 2021-03-26T20:25:26+0000
/project/philsol/, philsol, 0.25, A fully vectorial finite difference waveguide mode solver. Based on the algorithm of Zhu and Brown, 2021-04-16T18:18:32+0000
/project/schematics-patched/, schematics-patched, 1.1.2, A aptched version of schematics 1.1.1 that can pickle with multiprocessing, 2018-04-04T17:43:18+0000
/project/seaborn-calling-function/, seaborn-calling-function, 0.0.2, SeabornCallingFunction reads metadata regarding functions applied to its member functions.", 2017-12-27T16:37:29+0000
/project/dbd-py/, dbd-py, 0.2.8, Cool Discord Bot Designer module for python by Edited Cocktail, 2021-03-20T10:19:38+0000
/project/onednn-devel-cpu-dpcpp-gpu-dpcpp/, onednn-devel-cpu-dpcpp-gpu-dpcpp, 2021.2.0, Intel® oneAPI Deep Neural Network Library, 2021-03-26T20:20:57+0000
/project/abnex/, abnex, 1.0.0, Abnormal expressions (abnex) is an alternative to regular expressions (regex)., 2021-03-06T12:29:52+0000
/project/monty-carlo/, Monty-Carlo, 0.1.2.dev, Monty Carlo is a modular Monte Carlo engine, suitable for statistical systems., 2011-10-02T19:39:19+0000
/project/alx/, alx, 0.4.5, Swiss army knife for Shell, Cloud and DevOps., 2015-05-08T01:56:08+0000
/project/memprocfs/, memprocfs, 3.9.0, MemProcFS for Python, 2021-03-21T15:02:38+0000
/project/luh3417/, luh3417, 0.1.6, A WordPress backup/restore/workflow tool, 2020-12-02T15:42:43+0000
/project/qmenta-lint/, qmenta-lint, 0.9.8, Run qlint to perform linting (flake8) on QMENTA components., 2020-05-19T13:44:01+0000
/project/pytket-cirq/, pytket-cirq, 0.9.0, Extension for pytket, providing translation to and from the Cirq framework, 2021-04-01T11:04:41+0000
/project/commvault-client/, commvault-client, 2.3.0, Python wrapper for Commvault api, 2020-10-08T18:55:24+0000
/project/mythic-payloadtype-container/, mythic-payloadtype-container, 0.0.38, Functionality for Mythic Payload Type Containers, 2021-03-17T01:06:41+0000
/project/stanford-cs183-notes/, stanford-cs183-notes, 2020.9.21.0, 斯坦福 CS183 & YC 创业课系列中文笔记, 2020-09-21T04:44:04+0000
/project/purplship-canpar/, purplship.canpar, 2021.3, Purplship - Canpar Shipping Extension, 2021-04-18T05:01:28+0000
/project/ri-python/, ri-python, 0.9.9, Resolved Instruments Python library, 2021-04-24T21:48:30+0000
/project/opensmile/, opensmile, 2.0.0, Python wrapper for common openSMILE feature sets, 2021-02-12T11:05:11+0000
/project/django-codenerix-transports/, django-codenerix-transports, 1.0.4, Codenerix Transports is a module that enables CODENERIX to manage transports and let clients to request transport of packages with kwnown companies., 2018-05-08T09:46:58+0000
/project/ee-extra/, ee-extra, 0.0.1, Miscellaneous functions for working with the Earth Engine Python API., 2021-04-02T15:17:46+0000
/project/osmpy/, osmpy, 0.2.0, Powerfull wrapper around OSM Overpass Turbo to query regions of any size and shape, 2020-11-24T16:51:02+0000
/project/seniverse-py/, seniverse-py, 0.1.1, 心知天气第三方SDK / seniverse third party sdk for python3, 2021-04-12T04:46:58+0000
/project/flask-azure-oauth/, flask-azure-oauth, 0.5.0, Python Flask extension for using Azure Active Directory with OAuth to protect applications, 2020-09-14T14:37:49+0000
/project/magen-datastore/, magen-datastore, 1.0a1, Ingestion MicroService Package, 2017-08-31T03:36:25+0000
/project/brainfoodr/, brainfoodr, 0.1.3, structure for r projects, 2019-06-05T21:18:50+0000
/project/qat-variational/, qat-variational, 1.2.3, Module qat-variational [9f5dd6b] - Compiled by Atos, 2021-04-23T20:56:48+0000
/project/python-sdk-auth/, python-sdk-auth, 0.3.0, Library for Hologram Authentication methods, 2019-10-25T18:17:21+0000
/project/moana/, moana, 0.1.1, Moana: A robust and scalable cell type classification framework for single-cell RNA-Seq data., 2018-10-31T00:06:27+0000
/project/lqcuq-zh/, lqcuq-zh, 2020.10.26.0, <center>使用 Qiskit 学习量子计算 - 翻译版</center>, 2020-10-26T11:14:13+0000
/project/dbdpy/, dbdpy, 1.2.9, Discord Bot Designer For Discord module for python writen by Edited cocktail, official server: https://discord.gg/t9wHKGtD7p, 2021-02-10T10:33:39+0000
/project/mkl-include/, mkl-include, 2021.2.0, Intel® oneAPI Math Kernel Library, 2021-03-26T20:23:39+0000
/project/sdss-basecam/, sdss-basecam, 0.4.2, A base library for camera wrapping and actor., 2021-02-16T20:36:15+0000
/project/pyentrypoint/, pyentrypoint, 0.7.4, pyentrypoint manages entrypoints in Docker containers., 2020-06-14T17:50:59+0000
/project/stories-pytest/, stories-pytest, 0.1.0, Pytest reporter for stories executed during the test., 2020-12-04T18:56:34+0000
/project/intel-scipy/, intel-scipy, 1.1.0, SciPy optimized with Intel(R) MKL library, 2018-09-25T15:29:45+0000
/project/magen-hwa-service/, magen-hwa-service, 1.1a1, Magen Hello-World WebApp MicroService Package, 2017-11-08T19:16:50+0000
/project/sphinx-diagrams/, sphinx-diagrams, 0.2.2, Rendering Diagrams in Sphinx, 2020-12-12T05:48:06+0000
/project/pypssl/, pypssl, 2.2, Python API for PSSL., 2021-04-15T22:35:20+0000
/project/allya-nestedconfigparser/, allya.nestedconfigparser, 0.1.0, A simple extension to configparser that allows nested fallback configurations, 2016-08-17T22:46:31+0000
/project/ak-apkid/, ak-apkid, 2.1.0.post1, Android Package Identifier, 2020-04-28T21:39:12+0000
/project/freeflyer-runtime-api/, freeflyer-runtime-api, 3.0.0, Python interface to the FreeFlyer® Runtime API, 2019-10-17T06:33:02+0000
/project/indico-fonts/, indico-fonts, 1.1, Indico - Binary fonts, 2017-03-10T13:03:50+0000
/project/simdak/, simdak, 1.1.0, Importer-exporter data Simdak Kemdikbud, 2020-12-26T02:51:40+0000
/project/rapidpro-python/, rapidpro-python, 2.8.2, Python client library for the RapidPro API, 2021-04-09T19:20:24+0000
/project/html-table-parser-python3/, html-table-parser-python3, 0.2.0, A small and simple HTML table parser not requiring any external dependency., 2021-04-13T13:32:02+0000
/project/cryolo/, cryolo, 1.7.6, Picking procedure for cryo em single particle analysis, 2020-11-02T13:17:39+0000
/project/gosdk/, gosdk, 0.8.18, gosdk, 2019-04-01T15:18:13+0000
/project/laueagle/, laueagle, 0.0.3, , 2018-03-12T13:38:12+0000
/project/apachecn-cv-zh/, apachecn-cv-zh, 2021.2.18.0, ApacheCN 计算机视觉译文集, 2021-02-18T14:48:45+0000
/project/yaml-1-3/, yaml-1.3, 0.1.0, next YAML parser, 2017-07-05T07:34:14+0000
/project/storm-doc-zh/, storm-doc-zh, 2020.9.21.0, Storm 1.1.0 中文文档, 2020-09-21T04:45:44+0000
/project/dsr/, dsr, 1.0.4, Automatically gegerate repr to show data structures espelly trees, 2020-08-22T16:09:51+0000
/project/qmenta-anon/, qmenta-anon, 0.7, The qmenta-anon library is used by the qmenta-client library to anonymize files before transferring them to the QMENTA platform., 2019-11-28T16:24:35+0000
/project/met-api/, met-api, 0.1.1, "Metropolitain Museum of Art API client.", 2020-11-01T20:45:03+0000
/project/qtrf/, qtrf, 1.8.3, Widgets for RF inputs written in Qt for Python (PySide2)., 2020-04-10T20:58:45+0000
/project/bmc/, bmc, 0.0.3, Python wrapper for Minio Admin, 2021-04-16T20:18:29+0000
/project/peltak/, peltak, 0.27.5, A command line tool to help manage a project, 2021-03-29T20:27:23+0000
/project/llthw-zh/, llthw-zh, 2020.9.21.0, 笨办法学 Linux 中文版, 2020-09-21T04:15:06+0000
/project/azureml-automl-core/, azureml-automl-core, 1.27.0, AutoML client common library, 2021-04-19T15:48:10+0000
/project/space-translation-util/, space-translation-util, 0.0.9, Space Translation Utility, 2019-03-14T12:19:23+0000
/project/sealights-python-agent/, sealights-python-agent, 0.2.234, Python Agent, 2020-05-06T07:16:12+0000
/project/fast-microservice/, fast-microservice, 0.1.0rc4, Small Microservice based on FastAPI, 2020-12-28T21:52:59+0000
/project/bopku/, bopku, 0.1.0, Alat bantu administrasi BOP (Bantuan Operasional) Paud., 2020-12-29T08:00:00+0000
/project/hypercube/, hypercube, 0.3.4, Actually an n-orthotope., 2019-05-29T07:40:29+0000
/project/oftools-compile/, oftools-compile, 1.1.3.dev3, A general purpose build tool used in the Openframe environment, 2020-07-28T20:50:16+0000
/project/flask-request-id-header/, flask-request-id-header, 0.1.1, Python Flask middleware to ensure all requests have a request ID header, 2019-03-02T16:43:58+0000
/project/ft4222/, ft4222, 1.2.1, Python wrapper around libFT4222., 2020-09-20T08:43:14+0000
/project/cryptoauthlib/, cryptoauthlib, 20210121, Python Wrapper Library for Microchip Security Products, 2021-01-21T16:29:45+0000
/project/filegardener/, filegardener, 1.6.9, filegardener file utilities dedup, only file copy detection, empty dir detection, 2017-04-02T00:12:35+0000
/project/seaborn-timestamp/, seaborn-timestamp, 1.1.0, Seaborn Timestamp has timing functions and a timing profile which collects and reports on timing data of code execution, 2018-04-01T03:35:55+0000
/project/cthulhu-cult-database/, cthulhu-cult.database, 0.1, SQL Alchemy entities for Cthulhu Cult project, 2020-01-06T01:59:09+0000
/project/bilidriveex/, BiliDriveEx, 2020.3.9.3, ☁️ 哔哩哔哩云 Ex，支持任意文件的全速上传与下载, 2020-03-10T10:03:16+0000
/project/mvinstall/, mvinstall, 0.3.0, mvinstall - install data and packages from S3., 2019-05-25T20:43:46+0000
/project/tentakel/, tentakel, 3.1.1, distributed command execution, 2021-02-26T16:07:02+0000
/project/csdbe/, csdbe, 2.3.0, This is a CSDBE(Coctail script discord bot editor) writen by Winter_coctail, 2021-01-20T07:25:23+0000
/project/scrud-django/, scrud-django, 0.5.0, A Django REST Framework app for Semantic CRUD., 2021-04-01T14:05:08+0000
/project/fasttext-doc-zh/, fasttext-doc-zh, 2020.9.21.0, FastText 中文文档, 2020-09-21T03:52:29+0000
/project/rodder/, rodder, 0.1.9.1, A distro-independant package manager for Linux, 2021-04-23T11:36:58+0000
/project/typefit/, typefit, 0.3.0, Fits JSON values into Python type-anotated objects, 2020-04-30T13:15:35+0000
/project/flake8-flask/, flake8-flask, 0.9.3, Static analysis checks for Flask, by r2c. Available in our free program analysis tool, Bento. (ht, 2020-04-15T19:14:35+0000
/project/mnemoize/, mnemoize, 0.1.1, Use mnemonic code instead of bytes or passwords., 2020-08-04T22:53:50+0000
/project/anycore-dbg-supplement/, anycore-dbg-supplement, 0.3.1, A bundle of auxiliary scripts for the Anycore project, 2020-12-20T15:15:12+0000
/project/azureml-pipeline/, azureml-pipeline, 1.27.0, , 2021-04-19T15:48:49+0000
/project/logx/, logx, 0.1.1579232358, best practice python logging with zero config, 2020-01-17T03:39:18+0000
/project/magic-comic-reader/, magic-comic-reader, 1.8, Scrapes webcomics to make them easier to read., 2018-06-04T04:26:16+0000
/project/markdown-iconfonts/, markdown-iconfonts, 3.0.0, Easily display icon fonts in markdown., 2018-12-15T15:17:32+0000
/project/pyadaaah/, pyadaaah, 0.90, Python extension adding automatic, dynamic, runtime type and range checking support, 2021-02-18T23:56:51+0000
/project/pyk8sver/, pyk8sver, 1.0, Get k8s version from github, 2019-01-14T18:11:45+0000
/project/magen-logger/, magen-logger, 1.0a1, Magen Logging Package, 2017-08-31T02:47:29+0000
/project/qat-comm/, qat-comm, 1.2.1, Module qat-comm [3edbcc6] - Compiled by Atos, 2021-04-23T20:54:59+0000
/project/panoramik-analytic-models/, panoramik-analytic-models, 0.3.6, Panoramik ClickHouse analytic models, 2019-09-23T13:35:35+0000
/project/montblanc/, montblanc, 0.6.4, GPU-accelerated RIME implementations., 2021-02-03T08:20:02+0000
/project/pydebuggerupgrade/, pydebuggerupgrade, 3.4.6.46, CLI and library utility for upgrading firmware on Microchip PKOB nano (nEDBG) debugger, 2020-10-30T15:38:53+0000
/project/ibooker-plain-dealer/, ibooker-plain-dealer, 2020.11.3.0, iBooker 布客老实人报, 2020-11-03T02:59:18+0000
/project/etch-a-tv/, etch-a-tv, 0.1.1, Draw images over the radio, 2021-01-18T06:33:54+0000
/project/aa-spark-run-utils/, aa-spark-run-utils, 1.4.0, , 2020-10-16T10:00:20+0000
/project/emencia-yuic/, emencia-yuic, 2.4.8, Nope, 2021-02-13T02:36:30+0000
/project/fastiqa/, fastiqa, 0.6.1, fastiqa makes deep learning for image quality assessment faster and easier, 2020-02-21T19:55:22+0000
/project/tvm-valuetypes/, tvm-valuetypes, 0.0.3, Collection of utils for handling Telegram Open Network Virtual Machine value types, 2019-12-27T19:20:14+0000
/project/ibm-quantum-widgets/, ibm-quantum-widgets, 1.0.3, IBM Quantum widgets for Jupyter, 2021-02-11T17:04:06+0000
/project/rss-parser/, rss-parser, 0.2.3, Typed pythonic RSS parser, 2021-04-15T15:30:34+0000
/project/contrib-colormaps/, contrib-colormaps, 0.0.1, Contributed colormaps, 2019-11-22T22:19:20+0000
/project/zeorawdata/, ZeoRawData, 2.0, Zeo Raw Data Library, 2014-09-20T08:03:24+0000
/project/modelicapy/, modelicapy, 0.3.2, A Python library containing a variety of scripts and functions for interaction with Modelica and TRANSFORM, 2018-12-19T18:10:56+0000
/project/azureml-dataprep/, azureml-dataprep, 2.15.0, Azure ML Data Preparation SDK, 2021-04-22T07:42:06+0000
/project/fa-common/, fa-common, 0.13.2, CSIRO Geoanalytics FastAPI Common Framework. Standardises Data access, authentication, task execution and provides a number of utilities and helper classes., 2021-01-20T08:32:47+0000
/project/matplotlib-doc-zh/, matplotlib-doc-zh, 2020.9.21.0, Matplotlib 用户指南, 2020-09-21T04:15:38+0000
/project/dev-shell/, dev-shell, 0.2.2, Devloper shell for easy startup..., 2021-04-13T06:35:54+0000
/project/azureml-contrib-services/, azureml-contrib-services, 1.27.0, , 2021-04-19T15:48:36+0000
/project/iloveruby-zh/, iloveruby-zh, 2020.9.21.0, 我爱 Ruby, 2020-09-21T04:09:18+0000
/project/webheroes-utils/, webheroes-utils, 0.0.4, Set of python utils made specifically for Web Heroes Inc., 2015-06-22T23:45:55+0000
/project/bento-cli/, bento-cli, 0.12.0, Free program analysis focused on bugs that matter to you., 2020-05-08T22:15:32+0000
/project/egenix-pyopenssl/, egenix-pyopenssl, 0.13.16, eGenix pyOpenSSL Distribution for Python, 2016-11-11T10:00:02+0000
/project/django-mail-panel/, django-mail-panel, 3.2.3, A panel for django-debug-toolbar that allows for viewing of recently sent email., 2021-04-05T17:00:27+0000
/project/theconcierge/, theconcierge, 0.0.2, The Concierge allows you to create a simple project for the development of a ready-to-use Telegram Bot., 2021-03-26T15:17:00+0000
/project/sepp/, sepp, 0.0.0, Science Exploitation and Preservation Platform, 2019-06-03T22:07:44+0000
/project/py-agender/, py-agender, 0.0.9, Simple opencv & tensorflow based solution to estimate Faces, Age and Gender on pictures, 2019-08-26T13:59:23+0000
/project/musamusa-fal/, musamusa-fal, 0.0.3, Use this package to store a filename and a line number., 2021-03-04T16:01:01+0000
/project/idonethis/, idonethis, 1.0.0, A simple Python CLI for interacting with idonethis, 2015-06-05T04:40:54+0000
/project/piauthorizer/, piauthorizer, 0.5.0, A package to create a uniform authorization and autorest standard for FastAPI, 2021-04-15T08:36:36+0000
/project/py-hi/, py-hi, 0.1.2, hi is a tiny cli program that send benchmark request to almost everything based on asyncio, 2021-01-23T08:00:44+0000
/project/python-tldap/, python-tldap, 1.0.6, High level python LDAP Library, 2021-04-07T23:10:21+0000
/project/huntflow-py/, huntflow-py, 0.1.1, Huntflow API library for Python, 2020-05-02T22:57:48+0000
/project/douze/, douze, 0.1.4, A DigitalOcean API client to help with 12-factors apps, 2020-07-17T09:05:32+0000
/project/deepsparse/, deepsparse, 0.2.0, Neural network inference engine that delivers GPU-class performance for sparsified models on CPUs, 2021-03-31T22:24:49+0000
/project/norgatedata/, norgatedata, 1.0.58, Python interface to financial data provided by Norgate Data, 2021-04-21T04:14:24+0000
/project/distro-names/, distro-names, 0.0.8, Search for the names and versions of popular OS distributions, 2021-03-25T00:33:24+0000
/project/canopy-toolkit/, canopy-toolkit, 1.0.14, Nifty utilities to access Canopy resources via python., 2020-01-03T12:59:56+0000
/project/numba-doc-zh/, numba-doc-zh, 2020.9.21.0, Numba 0.44 中文文档, 2020-09-21T04:32:29+0000
/project/devsnets/, devsnets, 1.9.6, Devsnets, 2021-03-24T12:22:10+0000
/project/drop2beets/, drop2beets, 1.0.0, Import singles to Beets as soon as they are dropped in a folder, 2020-11-30T20:59:12+0000
/project/seaborn-meta/, seaborn-meta, 1.0.0, SeabornMeta allows for simple changingof names between conventions, as wellas auto-generating init files, 2018-04-01T02:37:26+0000
/project/hoshy/, hoshy, 1.210328.0, Cryptographic hash, abstract algebra and operators (previously known as 'hoshy') - see package hosh for a faster, native (compiled) hash/ops approach , 2021-03-28T13:01:38+0000
/project/impatient-js-zh/, impatient-js-zh, 2020.9.21.0, 写给不耐烦程序员的 JavaScript, 2020-09-21T04:09:34+0000
/project/dis-patch/, dis.patch, 0.2.5, A discord.py utility library., 2021-01-21T22:05:40+0000
/project/bento-headless/, bento-headless, 0.11.2, Git-aware utility for automated program analysis, 2020-05-04T17:55:51+0000
/project/serialxfer/, serialXfer, 0.3, Ancient serial file transfer protocols in Python, 2013-03-27T14:12:08+0000
/project/wmdlib/, wmdlib, 0.1dev-r17, A library to interface with the Windows Media Devices API, 2007-09-10T23:13:30+0000
/project/jembe/, jembe, 0.3.0, Jembe Web Framework, 2021-04-08T19:48:31+0000
/project/satori-sdk-python/, satori-sdk-python, 1.0.3, Satori SDK, 2017-04-21T14:23:12+0000
/project/db-sheet/, db-sheet, 0.1.4, db_sheet: Using Google Spreadsheets as Database., 2019-01-03T23:00:36+0000
/project/icecore/, icecore, 0.2.0.0, icecore C++ library python bindings, 2018-03-02T01:29:39+0000
/project/neuron-morphology/, neuron-morphology, 1.0.0, Tools for working with single-neuron morphological reconstructions, 2020-07-02T21:49:06+0000
/project/inqbus-rainflow/, inqbus.rainflow, 1.5, Cython optimized rainflow algorithm, 2017-08-21T13:51:42+0000
/project/pyogmaneo/, pyogmaneo, 1.0.3, Python bindings for the OgmaNeo2 library, 2020-06-16T23:50:24+0000
/project/ipp-include/, ipp-include, 2021.2.0, Intel® Integrated Performance Primitives, 2021-03-26T20:21:17+0000
/project/pacu/, pacu, 0.1.15, , 2021-04-21T22:17:39+0000
